start_hhmmss,end_hhmmss,text
00:35:58,00:36:00,being chased by stuff.
00:36:00,00:36:02,And James has been to the zoo today.
00:36:02,00:36:04,[LAUGHTER]
00:36:04,00:36:07,And I went on to runnersworld.com.
00:36:07,00:36:10,"And apparently, this is a problem that lots of runners"
00:36:10,00:36:14,"have that are farting a lot while they're running, right?"
00:36:14,00:36:17,And they say that the reason is all that--
00:36:17,00:36:18,People have told me.
00:36:18,00:36:21,"People have told me that, too, sorry."
00:36:21,00:36:26,I felt as I was agreeing with that that it was too enthusiastic.
00:36:26,00:36:29,"So anyway, apparently, what it is, is it's all the heavy breathing."
00:36:29,00:36:33,"So you're taking in a lot of gas, and it has to go somewhere."
00:36:33,00:36:34,And that's what happens.
00:36:34,00:36:36,"Really, yeah, apparently."
00:36:36,00:36:38,And you need to poo as well.
00:36:38,00:36:42,Run as diarrhea is a serious problem on running forums.
00:36:42,00:36:42,Hey.
00:36:42,00:36:43,Hey.
00:36:43,00:36:47,[LAUGHTER]
00:36:47,00:36:51,Is anyone else feeling like they're at a help group?
00:36:51,00:36:51,Sorry.
00:36:51,00:36:52,"Sorry, I forgot everyone was here."
00:36:55,00:36:56,"OK, I do have a question."
00:36:56,00:36:59,"And I'm not a physicist, but I do have this question."
00:36:59,00:37:02,"If you're running, and you break wind--"
00:37:02,00:37:02,Yeah.
00:37:02,00:37:05,"-- let's say you're running at 12 miles an hour,"
00:37:05,00:37:10,and you break wind at 4 miles an hour out the other way.
00:37:10,00:37:13,I presume that the wind that you break is still traveling
00:37:13,00:37:16,at 8 miles an hour in your wake.
00:37:16,00:37:19,"OK, I've got a lot to tell you about relativity."
00:37:19,00:37:20,That's correct.
00:37:20,00:37:21,We'll do it after the show.
00:37:21,00:37:22,OK.
00:37:22,00:37:24,I think that works.
00:37:24,00:37:24,Yeah.
00:37:24,00:37:26,[LAUGHTER]
00:37:26,00:37:30,One of the good farting animal is the pupfish.
00:37:30,00:37:32,"So I think this isn't the book as well, but it eats algae."
00:37:32,00:37:35,But it has-- the algae has such high levels of gas in it
00:37:35,00:37:39,"that the pupfish's stomach inflates, fully inflates,"
00:37:39,00:37:41,and it floats to the top of the water.
00:37:41,00:37:42,"And that's a really, really bad place for it to be,"
00:37:42,00:37:44,because it exposes it to lots of predators.
00:37:44,00:37:47,"So the moment the pupfish has a meal of algae,"
00:37:47,00:37:49,it has to fart to save its own life.
00:37:49,00:37:50,Wow.
00:37:50,00:37:50,And so--
00:37:50,00:37:51,Wow.
00:37:51,00:37:54,The pup's straight up to the top and is desperately trying to expel
00:37:54,00:37:56,wind constantly to sink back down again.
00:37:56,00:37:58,It's extremely stressful.
00:37:58,00:37:59,That's amazing.
00:37:59,00:38:00,It's a raise to the bottom for them.
00:38:00,00:38:04,[LAUGHTER]
00:38:04,00:38:05,"Now, maybe some stuff on zebras."
00:38:05,00:38:06,Yeah.
00:38:06,00:38:08,Here's an amazing thing about zebras.
00:38:08,00:38:09,"When they're being chased by a lion,"
00:38:09,00:38:11,"not only do they do what you said,"
00:38:11,00:38:14,but they only run about half the top speed
00:38:14,00:38:16,when they're being chased by a lion.
00:38:16,00:38:16,What?
00:38:16,00:38:20,"So basically, what happens is, if you're going at your top speed"
00:38:20,00:38:22,"and you're running, it's really easy for the lion"
00:38:22,00:38:25,or whatever to tell where you're going to be in two strides time.
00:38:25,00:38:28,"So what they do is they go at half of their speed,"
00:38:28,00:38:29,"and then when the lion gets anywhere near them,"
00:38:29,00:38:32,they just go in a different direction.
00:38:32,00:38:33,And then they go really fast.
00:38:33,00:38:36,"And then they'll slow down to half their speed again,"
00:38:36,00:38:37,and then wait till the lion gets to them
00:38:37,00:38:39,and then speed off really quickly again.
00:38:39,00:38:39,"Oh, wow."
00:38:39,00:38:40,"That's smart, isn't it?"
00:38:40,00:38:41,"That's very, very good."
00:38:41,00:38:42,Very clever.
00:38:42,00:38:47,Did you read about this ridiculous story in 2001
00:38:47,00:38:49,where some farmers brought in the UK
00:38:49,00:38:53,"bought a Shetland Pony, a really small pony."
00:38:53,00:38:56,And then they were surprised when they woke up one morning
00:38:56,00:38:57,and they went out into the field.
00:38:57,00:38:58,"And there was their Shetland Pony in there,"
00:38:58,00:39:01,"but also a tiny, tiny zebra."
00:39:01,00:39:04,And it was because they hadn't realized
00:39:04,00:39:05,"they'd bought a pregnant Shetland Pony,"
00:39:05,00:39:06,and they bought it from a wildlife sanctuary
00:39:06,00:39:08,where it was sharing a field with a zebra.
00:39:08,00:39:09,What?
00:39:09,00:39:10,Wow.
00:39:10,00:39:12,What?
00:39:12,00:39:15,"The woman didn't say, we had thought that she was getting faster,"
00:39:15,00:39:18,but it really was a bit of a shock when we got up one morning
00:39:18,00:39:20,and we saw that full zebra was there.
00:39:20,00:39:24,We realized then what had happened.
00:39:24,00:39:27,"That's-- I have a related factor that, which is that--"
00:39:27,00:39:28,I think it's in Georgia.
00:39:28,00:39:31,"There are dogs who are supposed to be guarding sheep,"
00:39:31,00:39:33,and they keep on having sex with the wolves.
00:39:33,00:39:37,They're meant to be defending the sheep from.
00:39:37,00:39:40,"Well, I guess it would put the wolves off"
00:39:40,00:39:41,what they were supposed to be doing.
00:39:41,00:39:42,That is true.
00:39:42,00:39:47,"It was a action method, but they keep testing the dogs"
00:39:47,00:39:49,"as well, and finding out, oh, you're half wolf,"
00:39:49,00:39:53,because your parents were a wolf and a dog.
00:39:53,00:39:54,This is amazing.
00:39:54,00:39:57,"But in the line of duty, James Bond does it all the time."
00:39:57,00:39:58,He does.
00:39:58,00:39:59,[LAUGHTER]
00:39:59,00:40:06,"OK, that is it."
00:40:06,00:40:07,That is all of our facts.
00:40:07,00:40:08,Thank you so much for listening.
00:40:08,00:40:11,[APPLAUSE]
00:40:11,00:40:14,If you would like to get in contact with any of us
00:40:14,00:40:17,"about the things that we have said over the course of this podcast,"
00:40:17,00:40:19,we can be found on our Twitter accounts.
00:40:19,00:40:22,I'm on @SriberlandAndy.
00:40:22,00:40:23,@AndyHondaM.
00:40:23,00:40:23,James.
00:40:23,00:40:24,That's James Harkin.
00:40:24,00:40:25,And Chazinski.
00:40:25,00:40:27,You can email podcast@QI.com.
00:40:27,00:40:28,Yep.
00:40:28,00:40:29,"Or you can go to our group account, which"
00:40:29,00:40:31,"is @NoSuchThink, or go to our Facebook page."
00:40:31,00:40:33,"NoSuchThink is a fish, or a website."
00:40:33,00:40:35,NoSuchThink is a fish.com.
00:40:35,00:40:36,"We have all of our previous episodes up there,"
00:40:36,00:40:39,"all of our future tour dates, and the link to our books."
00:40:39,00:40:41,So please do go there.
00:40:41,00:40:42,"Thank you so much, guys."
00:40:42,00:40:44,We'll be back again next week.
00:40:44,00:40:45,Goodbye.
00:40:45,00:40:48,[MUSIC PLAYING]
00:40:49,00:40:52,[APPLAUSE]
00:40:52,00:41:02,[BLANK_AUDIO]
