start_hhmmss,end_hhmmss,text
00:00:00,00:00:06,"Hey everyone! Welcome to episode 30 of No Such Things A Fish. We recorded a live podcast last night,"
00:00:06,00:00:11,our first live podcast and we've decided to put it out tonight for some reason and basically
00:00:11,00:00:18,unedited so it's pretty long but yeah hope you enjoy it. We really enjoyed it so much in fact
00:00:18,00:00:23,that we are going to do another live podcast tickets are going to go on sale for that on Monday.
00:00:23,00:00:29,Tickets will be available at www.chortle.co.uk or at www.nosuchthingsafish.com. It's going to be in
00:00:29,00:00:58,Canon London so keep an eye out for that and hope you enjoy this one.
00:00:58,00:01:03,"Welcome to another episode of No Such Things A Fish, a weekly podcast coming to you this week"
00:01:03,00:01:08,from the Aces & 8 bar in Tuppnell Park. This is our first ever live recording. My name is
00:01:08,00:01:13,"Dan Schroiber. Please welcome to the stage the three regular elves Andy Murray, Anna Chazinski and"
00:01:13,00:01:24,James Horkin. Once again we have gathered around with our four favorite facts from the last seven
00:01:24,00:01:28,"days and in no particular order here we go. Fact number one and beginning with you,"
00:01:28,00:01:35,James. Okay my fact this week is that the first BBC radio presenter with a northern accent
00:01:35,00:01:39,was given the job to make it more difficult for the Nazis to impersonate news readers.
00:01:39,00:01:47,So why were the Nazis impersonating newsreaders? They thought that if they could pretend to be newsreaders
00:01:47,00:01:51,over the radio then people would believe anything they said and they'd be able to say oh we've
00:01:51,00:01:55,got such a strong army and people would just believe it. So they let raid the BBC? It was just
00:01:55,00:02:00,propaganda really. They would pretend to be BBC newsreaders. And so people wore horror and people
00:02:00,00:02:11,like that. But yeah. It's also why we've got James on the podcast. James a Nazi. No this was a guy
00:02:11,00:02:19,called Wilfrid Pickles. He was the first northern newsreader from 1941. He was from Yorkshire
00:02:19,00:02:24,and a lot of people didn't believe the news when he read it out because he had a northern accent.
00:02:24,00:02:29,Apparently. What did they think? They thought that's a Nazi trying to do a British accent.
00:02:29,00:02:37,No I don't know what they thought really. They just thought this guy's uneducated he
00:02:37,00:02:40,can't possibly know what the news is. That's what they I read this thing about in the early days
00:02:40,00:02:46,of news reporting particularly on radio that they never it was all male presenters and they said
00:02:46,00:02:50,that they wouldn't allow female presenters on because they didn't want them to have to go through
00:02:50,00:02:55,reading bad news like upsetting news stories. Yeah. They just thought they're not going to like that. That
00:02:55,00:03:00,would be too emotional. And it's true. It's a BBC thing where they announced that they said we're
00:03:00,00:03:05,not going to allow wind to do that. They'll be too upset when they hear this bad news. No. It's
00:03:05,00:03:11,terrible. They did have one in 1933 the first female newsreader. She was called Mrs. Giles Borrett.
00:03:11,00:03:15,I don't know what her real first name was. It doesn't seem to come up any more.
00:03:15,00:03:19,"Have you seen a picture of that? Mrs. Giles Borrett. Yeah, as he named after her husband. We were asked"
00:03:19,00:03:24,holes to women back in the day. We still are but like I mean doubly so. That's terrible.
00:03:24,00:03:28,There were complaints she was there for two months and the BBC took her off the air for technical
00:03:28,00:03:38,reasons. She's technically a gender is wrong. Did you know that all newsreaders were originally
00:03:38,00:03:43,anonymous? No. So they didn't give their names on air. It was just the voice of the BBC news.
00:03:43,00:03:47,And so we have the Nazis to thank the named newsreaders because during the war people said that they
00:03:47,00:03:52,should be able to listen and kind of authenticate who they were listening to. So the first one was
00:03:52,00:03:57,Frank Phillips and he said in July 1940 battle of Britain time this is Frank Phillips from the BBC
00:03:57,00:04:02,so that again you couldn't be impersonated. So today we might have Hugh Edwards just being a man
00:04:02,00:04:09,on a screen. Wow. That's kind of used to me. Yeah. Isn't that weird though that none of them
00:04:09,00:04:14,identified themselves? Do you guys know about the very first ever BBC news report on the radio?
00:04:14,00:04:19,No. Okay. It's great. It basically was on the 14th of November and I forgot to look up the date.
00:04:19,00:04:23,But it's on the 14th of November so we're coming up to the anniversary. Very exciting.
00:04:23,00:04:32,And basically he read out the news. It was a guy called Arthur Burrows and he read it out
00:04:32,00:04:38,but he read it twice once quickly and then once slowly and then asked the listeners which to do
00:04:38,00:04:43,proper. Just for future recordings to know which way they go. And the wish did they go with?
00:04:43,00:04:49,I think it's not been recorded. I don't know the answer. So we didn't know if now we have quick
00:04:49,00:04:54,news or slow news. I have no idea. I have no idea. Also it was really weird because when they started
00:04:54,00:04:59,doing the news they did it post 7pm and Lord Reath joined. So Lord Reath if you don't know his name
00:04:59,00:05:05,he's the guy who in the BBC they have a big kind of saying which is to entertain and form and
00:05:05,00:05:09,educate. That's the Lord Reath philosophy for BBC that everyone's tried to stick to. He joined
00:05:09,00:05:15,the week after the very first broadcast of a radio announcement telling the news on the BBC.
00:05:15,00:05:20,And he had this thing where he said we don't want anyone to be doing news bulletins before 6pm
00:05:20,00:05:25,because the newspapers will be hurt as a result of it. And so no one was allowed to do anything
00:05:25,00:05:31,in terms of announcing any news to the point that when they showed horse racing on the
00:05:31,00:05:38,news they couldn't have commentators commentating on the horse race so you listen to hooves
00:05:38,00:05:45,and people cheering at like 4pm and then at 7pm they go and blitzer one. They would wait till the
00:05:45,00:05:49,7 o'clock news. Was there a pause in between the end of the hoose? I think so. And blitzer one.
00:05:49,00:05:55,So you were speaking of radio though. Do you know what they did in 1955 when ITV started? I think
00:05:55,00:06:03,it was 1955 wasn't it? And what the BBC did to try and jeopardize ITV's chances? No.
00:06:03,00:06:07,It wasn't actually on TV because radio was the more popular medium at that time. They killed off
00:06:07,00:06:15,Grace Archer in the Archer's gas. 20 million people tuned in. The population of Britain was 40
00:06:15,00:06:20,million at the time. Half the country tuned in to listen to Grace get killed off from the Archer.
00:06:20,00:06:28,The Archer's fans really hate you don't they don't they? We make I so outside anyone who
00:06:28,00:06:33,listens to this podcast might know that we also the four of us work for QI and one of the QI
00:06:33,00:06:38,things is a radio show called Museum of Curiosity. And Museum of Curiosity is played at 630 every
00:06:38,00:06:43,evening on a Monday and Archer's follows immediately and we get the shit ripped out of us by the Archer's
00:06:43,00:06:48,fans they hate us and they just they don't even they just they say how much they hate us and then
00:06:48,00:06:56,they do hashtag the archers and so everyone they catch the last five minutes of Museum of Curiosity
00:06:56,00:07:00,and we're usually talking about pubic lies or something like that and this it doesn't come up on
00:07:00,00:07:03,the Archer's apparently. No it doesn't there was a great there was a fantastic one this week though
00:07:03,00:07:07,there was someone who actually tweeted what is this garbage I absolutely hate it hashtag the
00:07:07,00:07:11,Archer's someone wrote back going I know this program sucks they should cancel it the Archer's is
00:07:11,00:07:20,terrible lovely confusion I have a fact about Lord wreath John wreath as he was then when he applied
00:07:20,00:07:24,for the post of general manager of the British broadcasting company he did not know what broadcasting
00:07:24,00:07:31,was and he wrote in his diary that when he was called to an interview he quote still hadn't the
00:07:31,00:07:36,remotest idea as to what broadcasting was I hadn't trouble to find out and they gave him the job
00:07:38,00:07:45,and when so do you know where remote controls were for what was the main attraction of them
00:07:45,00:07:49,how they were marketed remote controls what for TV yeah is that I'm calling them you don't have to
00:07:49,00:07:54,get up and walk over to the thing presumably it is that but their main strategy in the marketing
00:07:54,00:07:59,was it was after ITV came about and Adverts came about and remote controls were just volume controls
00:07:59,00:08:02,and they looked like one of those rotary phones so they were like a a dial which you just dialed
00:08:02,00:08:08,up or down and it was they can meet the Adverts so Adverts came onto TV and immediately they marked
00:08:08,00:08:13,something that could make them shut there was one really early there was one really early remote
00:08:13,00:08:18,control that was done by light the problem with it was that when the sun shot on it it would turn
00:08:18,00:08:26,the channel over there's a great I was talking about this in the office a few days ago and I can't
00:08:26,00:08:31,verify this fact and I really want to really go anyone knows this show I'm known as the dubious one
00:08:31,00:08:37,on the show not just on the show just in life the way I do any research for this show is to put in the
00:08:37,00:08:42,fact and then put plus Yeti that's my kind of research of this show that's how bad I am at it but
00:08:42,00:08:47,I read a fact in a book years ago when I first moved to England and it was a fact that when they
00:08:47,00:08:51,doing when they did live TV dramas they would have a thing where obviously it was black and white
00:08:51,00:08:56,everything had to be done live as they were going along and the actors if they forgot their lines
00:08:56,00:09:00,as they were doing this play live they would mind speaking and then the other actor would mind
00:09:00,00:09:06,speaking back at them so that while the production we're quickly trying to find cards that could show
00:09:06,00:09:09,them what the next line was the people at home were going what the hell's wrong with the TV are
00:09:09,00:09:13,sounds gone again and get up and hit it and then by the time they remember the line they'd be like
00:09:13,00:09:17,we should go to the shops and then they're back into the play but I can't prove this as a fact so
00:09:17,00:09:23,if anyone listening or anyone in this room tonight knows it please let me know yeah don't wait
00:09:23,00:09:30,up for the post accents oh go on what no what was yours well I've got to max and go on yeah talk
00:09:30,00:09:35,about you know for an accent syndrome oh yeah what's that what's that the real thing so it's not
00:09:35,00:09:40,just mad people making it up you know when someone wakes up and you make that terrible
00:09:40,00:09:45,self-hyros accent yeah I would but yeah it's a real thing so it happens if you have a particularly
00:09:45,00:09:49,bad migraine you can get for an accent syndrome but it's not where you wake up with a specific
00:09:49,00:09:53,for an accent it's just where you wake up with an accent that sounds kind of like for an accent
00:09:53,00:09:57,so there's like an interview with this woman Julie Matthias who just had a migraine and now speaks in
00:09:57,00:10:04,this bizarre kind of Scandinavian Indian South African hybrid and I think it's really horrible
00:10:04,00:10:10,for her is it it must be tough right also cat breasts syndrome do you know that one it's where you
00:10:10,00:10:16,believe that one of your loved ones has actually been has died and been replaced by a robot or
00:10:16,00:10:24,something like that once the real yeah yeah yeah what like we all had it like that time when my dad
00:10:24,00:10:29,died and was replaced by a robot yeah but that actually happened yeah but for people with a
00:10:29,00:10:35,syndrome yeah yeah but if you google this and look for examples of it happening there's like one
00:10:35,00:10:40,pretty much one or two examples on the BBC news and the most famous person to have it done it was
00:10:40,00:10:46,called Alan Davis really yeah and I always wanted to run that on cue I but thought no not really
00:10:46,00:10:52,it's just in case it's actually him yeah all right come if you're mocking me on cue I do you
00:10:52,00:10:58,want to hear something cool about the Queen's accent yeah so they've done a study on her but without
00:10:58,00:11:04,and okay they've they've listened to the Queen's speech from three from different decades so they
00:11:04,00:11:08,listened to loads from the 1950s and then they listened to loads from the 1980s and they found
00:11:08,00:11:13,that she no longer speaks the Queen's English so they measured loads of her sounds surely by
00:11:13,00:11:18,definition what she says is a good thing that's true but they it was a study at Macquarie University
00:11:18,00:11:23,on Australia and they said that her accent has drifted a bit so she sounds a bit like some younger
00:11:23,00:11:28,and I'm using their words she sounds Jamaican now she sounds Jamaican they said she has
00:11:28,00:11:33,Cockney influences now apparently yeah I mean you can't tell apparently most of the changes it
00:11:33,00:11:41,was 12 or 13 vowel sounds she says you get me yeah why can't we tell if she has it
00:11:41,00:11:50,where machines can hear it apparently computers can hear machines yes my dad my dad but they
00:11:50,00:11:54,they they were so happy to study her because and these are the words she hasn't lived and lived
00:11:54,00:12:01,in different communities that might alter her accent yeah no kidding so you reckon she got
00:12:01,00:12:06,it off TV or something I don't know maybe yeah she is a fact she's a huge fan of I think
00:12:06,00:12:10,the other things of the archers yeah it's a miracle museum is still going you should say
00:12:10,00:12:16,your tweets to me the terrible and she didn't do a speech in 1969 there was no Queen's speech
00:12:16,00:12:23,on TV and the reason was she had already done one interview that year in the summer for a documentary
00:12:23,00:12:28,and it changed her accent so much she couldn't bear does she just said that's enough you get one
00:12:28,00:12:34,dose a queen a year and that was it for 1969 so she didn't know that's great and we used to speak
00:12:34,00:12:38,rotec English didn't we which is how the American speak English show the way American speak is the
00:12:38,00:12:44,way that is proper English is the English that we were speaking in the 17th century yeah we didn't
00:12:44,00:12:48,pronounce our arse and that's wrong and that's because spelling hasn't kept up with the way we speak
00:12:48,00:12:52,what do you mean don't pronounce her like oh god I'm not going to be able to think of any
00:12:52,00:12:57,examples now so you know if we said I've just got the word Somerset written down here so if we say
00:12:57,00:13:01,Somerset they'd say Somerset or that she just sounds like a Somerset
00:13:01,00:13:10,to sound like 40 say Somerset Dan you've got a Somerset yeah exactly like cover and garden
00:13:10,00:13:17,cover what there's no or in cover but he's he's got it wrong this is the biggest content should say
00:13:17,00:13:22,I have a messed up accent I know I have a messed up accent the main tweet outside of archers hatred
00:13:22,00:13:27,towards me that I get is people listening to our show saying why are you saying
00:13:27,00:13:32,cover and garden like I get so much what about the what about the child who listens to the podcast oh
00:13:32,00:13:37,there's a child who listens to our podcast they're three four years old yeah three four years old the
00:13:37,00:13:43,godmother wrote into us to say that James every time uh you're you talk my my my my little goddaughter
00:13:43,00:13:48,she smiles and she's how happy how nice yeah and then when Dan comes on she frowns and looks
00:13:48,00:13:57,disappointed in Southwest really splitting accent well okay let's go back to the point in hand
00:13:57,00:14:01,yeah I want to speak about Wilfred Pickles so this was the guy with a northern accent who read the
00:14:01,00:14:07,news uh he also was the host of the first British quiz show to give away prizes it was called
00:14:07,00:14:14,Hava Go and the jackpot was three pounds wow let's see what was more than I suppose but still
00:14:14,00:14:24,yeah it's not who wants to be a million who wants to own three pounds but they got an audience of
00:14:24,00:14:33,26 million yeah if you think about what uh break off got what 13 million this was uh up to 1967 he
00:14:33,00:14:37,did it yeah a lot more people used to watch yeah but they didn't make up they didn't have beg off back
00:14:37,00:14:42,then so you know what was what was the what was the fact that you told me in the office the other day
00:14:42,00:14:48,about um like a tire and stuff when they when they were recording uh in radio early radio about
00:14:48,00:14:56,what they have to wear I do remember yes in the 30s the British news readers had to wear
00:14:56,00:15:00,dennesuit even though you couldn't see them when they were reading the news on the radio I really
00:15:00,00:15:03,like that you can tell though you can tell with the voice when they're sitting up properly it won't
00:15:03,00:15:10,be slouching like that is that why was that they're just yeah I think it gives you a better you know
00:15:10,00:15:14,posture a better accent just you know they're just being being annoying about it sure yeah
00:15:14,00:15:18,for anyone listening we're all wearing dinner jackets now
00:15:18,00:15:24,um some animals have accents don't they but not all what I'm trying to just think which
00:15:24,00:15:29,which animal's doing which don't so so people tend to think that like hardly animal
00:15:29,00:15:33,hardly any animals have accents like animals it's in their dreams the way the way they speak but
00:15:33,00:15:38,then farmers in the north of England reported that I think it was that I think this might have been
00:15:38,00:15:42,where I just read Somerset it was a Somerset farmer who said that his cows had a different accent to
00:15:42,00:15:48,the farmers in surrounding counties oh they do they move in accents that want to that want
00:15:48,00:15:55,an ignoble price didn't it yeah cows move in regional access yeah a very appeared review scientific
00:15:55,00:15:59,paper that um and yeah and babies as well babies have regional access they move in different
00:15:59,00:16:05,uh no babies go French and German babies have different ways of saying
00:16:07,00:16:14,neither of them sound like that German ones go and I'm paraphrasing and French babies go
00:16:14,00:16:19,okay there is a difference a machines can hear it my dad if he was
00:16:19,00:16:26,we should we should wrap up on our first facts we got anything else anyone want to add anything
00:16:26,00:16:31,uh apparently the announcers on the BBC if they would cough during a broadcast they would be
00:16:31,00:16:36,inundated with cough cough lozenges and wallen underwear because everyone was scared that they had a
00:16:36,00:16:42,call so guys whenever you want to start throwing oh that's really good okay um oh yeah yeah go
00:16:42,00:16:46,for just go to the case we don't come back onto the subject of radio for loads of podcasts um when
00:16:46,00:16:53,woman's up again in 1946 it was hosted by a man early early items on the show included
00:16:53,00:16:59,cooking with whale meat I married a lion tamer and how to hang your husband's suit
00:17:01,00:17:11,true great and fact okay um time for fact number two uh and that is my fact and my fact this week
00:17:11,00:17:16,is that in china if you want to empty a building of people a building full of people if you want
00:17:16,00:17:28,to empty it you play this song don't get up and leave it here there's it doesn't work apparently
00:17:28,00:17:39,so this is a song does anyone know what that is no one okay you can even guess the artist
00:17:40,00:17:47,yes five points yeah now i've this is a weird thing no one in this country in the uk seems to know
00:17:47,00:17:54,who kene g is kene g is one of the biggest artists in the world and in my heart uh he's sold 75
00:17:54,00:18:01,million albums uh worldwide he uh played at the inauguration of bill clinton he worked on the body
00:18:01,00:18:05,guard soundtrack if you watch the Grammys in the 90s and variably at some point Michael Bolton would
00:18:05,00:18:11,rock on stage next to kene g and they would own it uh and the interesting thing is that since the year
00:18:11,00:18:16,2000 in 1989 this song came out and it got really big it's called going home by kene g
00:18:16,00:18:21,and for some reason it got adopted and no one really knows why in china as the going home song
00:18:21,00:18:27,so at the end of the day i think because it's called going home yeah why did they choose it
00:18:29,00:18:38,why didn't they choose melody and be wake me up before you go go what so they basically it's a tune
00:18:38,00:18:43,that just gets played everywhere at schools at the end of school they play it to kids to go home
00:18:43,00:18:49,if you're on a train that's entering the final stop of its destination the terminal uh they play that
00:18:49,00:18:53,song everywhere in china in a marketplace they'll play it on loop for an hour and a half to tell
00:18:53,00:18:58,you to get out and kene g people are really getting the hint if you have to play it for an hour and a
00:18:58,00:19:03,half at the end of a party presumably you play that when you want every well when because as a result
00:19:03,00:19:07,this song he doesn't get any royalties from it but he plays a lot of gigs in china now he had to
00:19:07,00:19:11,make sure that he put that song at the end otherwise people still playing during the gig but this
00:19:11,00:19:16,is this is an insane thing if he did get royalties though he will be richer than bill gays if they
00:19:16,00:19:20,play it for an hour and a half at every day at the closing of a month not only that when tv used to
00:19:20,00:19:26,end at say like 12 a.m. or 11 p.m. whenever it is in china up until six a.m. when it came back on it
00:19:26,00:19:32,would be on loop that was the song that played kene g is massive in china i i i have i read a few
00:19:32,00:19:39,accounts from chinese people saying i'm pretty sick of this song that i liked it the first time i
00:19:39,00:19:45,heard it and now i really don't so i think so i had an heard of kene g oh no i had heard of him i
00:19:45,00:19:48,didn't know what he was but i think that's us being musically illiterate i think everyone else in
00:19:48,00:19:50,"and Britain, I think you're touring British people"
00:19:50,00:19:52,with our brush by saying no one's heard of Kenny G.
00:19:52,00:19:54,"- No, no, no one in this room except one person, right?"
00:19:54,00:19:56,"- Oh, no, no, no, no, no, no, no, no, no, no, no, no, no, no, no, no, no, no, no, no, no, no."
00:19:56,00:19:58,"- Okay, so well done. - So the only thing, so I was like,"
00:19:58,00:19:59,"I'd haven't heard of this guy,"
00:19:59,00:20:00,"I don't really listen to music,"
00:20:00,00:20:02,it was made in the last 40 years.
00:20:02,00:20:05,"So I just decided, I'll look up something about music."
00:20:05,00:20:07,I know he's kind of jazz.
00:20:07,00:20:09,Let's look up a circular breathing.
00:20:09,00:20:13,The longest musical note ever held lasted 45 minutes
00:20:13,00:20:16,"and 47 seconds, and the record was set by Kenny G."
00:20:16,00:20:20,- Yeah. - This guy is phenomenal about him.
00:20:20,00:20:22,"- Yeah. - Well, I like playing golf"
00:20:22,00:20:25,and I looked up who's the best musician who plays golf
00:20:25,00:20:27,and it's Kenny G. (laughing)
00:20:27,00:20:30,- He's everywhere. - He's off plus 0.8.
00:20:30,00:20:32,"- And many years ago, Kenny G woke up one morning"
00:20:32,00:20:36,"when his uncle said, ""I have a business."
00:20:36,00:20:38,My friend is running and I think you might be interested.
00:20:38,00:20:40,You should buy some stocks into it.
00:20:40,00:20:42,"They make coffee and he went, ""I'll buy some stocks."""
00:20:42,00:20:46,And he now has made almost as much money off the back
00:20:46,00:20:48,of the fact that he put stocks into Starbucks
00:20:48,00:20:51,"before it launched, as much as he's made"
00:20:51,00:20:52,from his 75 million albums.
00:20:52,00:20:54,- So should we boycott him now?
00:20:54,00:20:57,(laughing)
00:20:57,00:20:58,- I have been doing an unconscious boycott
00:20:58,00:21:01,"of him all my life, but I don't know who he was."
00:21:01,00:21:03,(laughing)
00:21:03,00:21:05,"- No, I didn't know who Kenny G was either"
00:21:05,00:21:09,"and I Googled Kenny G is and the first to our,"
00:21:09,00:21:11,Kenny G is my imaginary friend.
00:21:11,00:21:13,(laughing)
00:21:13,00:21:16,And Kenny G is Katie Perry's uncle
00:21:16,00:21:18,and I looked it up and he isn't.
00:21:18,00:21:19,(laughing)
00:21:19,00:21:22,I have no idea what that's about at all.
00:21:22,00:21:23,And then I spent the rest of the afternoon
00:21:23,00:21:25,Googling Katie Perry's uncle
00:21:25,00:21:27,who is even less interesting than Kenny G.
