start_hhmmss,end_hhmmss,text
00:21:27,00:21:29,(laughing)
00:21:29,00:21:30,- What's he do?
00:21:30,00:21:31,Who is he?
00:21:31,00:21:32,- He's a director of movies.
00:21:32,00:21:33,He's dead now.
00:21:33,00:21:34,"- Oh, okay."
00:21:34,00:21:37,"- Oh, a bit of a downer."
00:21:37,00:21:39,- You didn't even know him.
00:21:39,00:21:40,"- And in fairness, guys, he was a robot."
00:21:40,00:21:43,(laughing)
00:21:43,00:21:46,"- Circular breathing, there was a thing in Greece"
00:21:46,00:21:49,called the Disfigurement of Athens
00:21:49,00:21:51,and it's written about by some Greek crisis
00:21:51,00:21:54,and apparently that was a weird facial disfigurement
00:21:54,00:21:56,you would get if you did too much circular breathing.
00:21:56,00:21:58,"- I really, what's that like?"
00:21:58,00:21:58,- I don't know.
00:21:58,00:22:00,- I don't really know how you do it.
00:22:00,00:22:02,"- No, how you do circular breathing?"
00:22:02,00:22:03,"- No, I read about how to do it the other day"
00:22:03,00:22:06,"and I still, I can't do it."
00:22:06,00:22:08,- You save a little bit of air in your mouth
00:22:08,00:22:10,and then you breathe through your nose.
00:22:10,00:22:12,"- Does it help people beat box, is that it's beat box?"
00:22:12,00:22:14,- And it's to help you sustain notes.
00:22:14,00:22:15,"- Yeah, yeah."
00:22:15,00:22:16,"- So jazz, he's jazz, right?"
00:22:16,00:22:17,That's what he does.
00:22:17,00:22:19,"Otherwise, I've been reading mother rums."
00:22:19,00:22:20,"- Yeah, yeah, yeah, yeah, yeah."
00:22:20,00:22:22,- Let's say he's jazz anyway.
00:22:22,00:22:23,- I see he plays his saxophone.
00:22:23,00:22:24,"Does he go, let's be round for president?"
00:22:24,00:22:25,Did you know that?
00:22:25,00:22:26,- What?
00:22:26,00:22:27,- Of America.
00:22:27,00:22:28,- Of America.
00:22:28,00:22:31,"In 1964, he ran a joke campaign for president."
00:22:31,00:22:32,"He promised to rename the White House,"
00:22:32,00:22:34,"the Blues House, and a point."
00:22:34,00:22:35,(laughing)
00:22:35,00:22:37,- And he was going to appoint Duke Ellington
00:22:37,00:22:39,as his secretary of state and Miles Davis
00:22:39,00:22:40,as head of the CIA.
00:22:40,00:22:41,- Which would have been--
00:22:41,00:22:42,- Miles Davis.
00:22:42,00:22:43,- Who are you from?
00:22:43,00:22:43,(laughing)
00:22:43,00:22:48,"- He also, does he, Lesby, couldn't hit since 1949,"
00:22:48,00:22:51,he was unable to hit the B-flat above high sea on his trumpet
00:22:51,00:22:54,"'cause he had a very, very minor bicycling accident."
00:22:54,00:22:57,"But he got $1,000, which I think was quite a lot in 1949."
00:22:57,00:22:58,- Sure.
00:22:58,00:23:01,- And compensation for it because it's damaged his art.
00:23:01,00:23:02,I could never hit that high B-flat.
00:23:02,00:23:04,- Yeah.
00:23:04,00:23:06,"Wait, a minor cycling accident."
00:23:06,00:23:07,"- Just a twisted ankle, yeah."
00:23:07,00:23:09,- He stopped him from being able to hit a high--
00:23:09,00:23:10,- Weird.
00:23:10,00:23:12,"- Yeah, maybe it was winded or something."
00:23:12,00:23:15,- You can sue for damaging your art.
00:23:15,00:23:16,- You'll want your art.
00:23:16,00:23:17,"- Down, I don't think he's got a case."
00:23:17,00:23:20,(laughing)
00:23:20,00:23:24,- Just checking.
00:23:24,00:23:27,- Another influential jazz person.
00:23:27,00:23:30,Most influential guitarist of all time.
00:23:30,00:23:31,- Jimmy Hendrix.
00:23:31,00:23:33,- I was gonna go with Django Reinhart.
00:23:33,00:23:35,Maybe it wasn't like jazz guitar.
00:23:35,00:23:37,"- Was missing the two main guitar playing fingers,"
00:23:37,00:23:38,"- Yeah, yeah, yeah."
00:23:38,00:23:40,- So it only ever did solos on two fingers.
00:23:40,00:23:42,- Didn't he die because he refused to go to a doctor?
00:23:42,00:23:44,"- Yes, I think he did."
00:23:44,00:23:45,"- Yeah, he had a minor medical condition."
00:23:45,00:23:48,He didn't go to a doctor and then it got bad and then he died.
00:23:48,00:23:50,Does anyone know what Knitt will remember what he had?
00:23:50,00:23:51,"- I don't remember, no."
00:23:51,00:23:54,"- Just speaking of Django, this is a very weird link,"
00:23:54,00:23:56,but it's something I was when I was looking into
00:23:56,00:23:57,all the stuff about Michael Bolt.
00:23:57,00:23:59,"I'm sorry, Kenny G being massive in China."
00:23:59,00:24:01,It is curious when you find out about people
00:24:01,00:24:04,"who are big in other countries,"
00:24:04,00:24:07,who aren't sort of as like Norman Wisdom being massive
00:24:07,00:24:09,in Albania.
00:24:09,00:24:11,Norman Wisdom is huge still to this day in Albania.
00:24:11,00:24:13,"When he died, it was almost a national holiday"
00:24:13,00:24:14,"and they just, and they have."
00:24:14,00:24:15,- That's the holiday.
00:24:15,00:24:16,(laughing)
00:24:16,00:24:19,"- So, that's the day of my life, thank you again."
00:24:19,00:24:23,"- Good boy, finally, that hated Wisdom is removed."
00:24:23,00:24:25,(laughing)
00:24:25,00:24:28,"- When Kenny G dies, a lot of Chinese society"
00:24:28,00:24:31,will celebrate not having to listen to this song anymore.
00:24:31,00:24:32,"- That's true, that's true."
00:24:32,00:24:33,"Oh, come on."
00:24:34,00:24:36,- There's a lot of Kenny G lovely in the room.
00:24:36,00:24:39,"- Yeah, it's a lot of people more famous in other countries."
00:24:39,00:24:41,"- Yeah, yeah, so I was reading about people who are more famous."
00:24:41,00:24:44,"The list of Americans, or just a people foreign people"
00:24:44,00:24:46,to China being big there.
00:24:46,00:24:47,"It's quite, it's quite interesting."
00:24:47,00:24:50,"The most famous person in China is Kobe Bryant,"
00:24:50,00:24:52,"who's a basketball player, which I did not expect."
00:24:52,00:24:54,- The most famous person in all of China.
00:24:54,00:24:57,"- Well, my theory is that it's actually Mr. Bean,"
00:24:57,00:24:59,"which, and then, in at number three,"
00:24:59,00:25:00,Mao Zedong.
00:25:00,00:25:03,(laughing)
00:25:03,00:25:09,"- Yeah, it's a phrase that done."
00:25:09,00:25:10,"- Oh, it's the most famous foreigner."
00:25:10,00:25:11,- Okay.
00:25:11,00:25:12,"- Yeah, yeah, yeah."
00:25:12,00:25:13,- It's not fun.
00:25:13,00:25:18,- So these people are getting bigger and bigger.
00:25:18,00:25:21,"And as a result, there's a really interesting thing going on"
00:25:21,00:25:22,"with the movie world at the moment,"
00:25:22,00:25:24,which is that the Chinese movie world
00:25:24,00:25:25,has now overtaken Bollywood.
00:25:25,00:25:27,It's taken over everything except America.
00:25:27,00:25:29,They're the second largest movie makers in the world.
00:25:29,00:25:32,"And so as a result of these people's names getting quite big,"
00:25:32,00:25:35,they're getting put into movies now and being sold to China.
00:25:35,00:25:37,"And as a result, so the top film in China last year"
00:25:37,00:25:40,"was Transformers, above anything in the world, right?"
00:25:40,00:25:41,They absolutely loved it.
00:25:41,00:25:43,The latest Transformers movie that came out.
00:25:43,00:25:45,But they do this really interesting thing
00:25:45,00:25:48,where they have to edit out certain bits of the movie
00:25:48,00:25:50,as it exists because it turns out there's a lot
00:25:50,00:25:52,of anti-Chinese government stuff in movies
00:25:52,00:25:53,that we don't realize.
00:25:53,00:25:56,"So when movies go out, suddenly there's a missing five minutes"
00:25:56,00:25:58,where a character has been taken out
00:25:58,00:26:00,and it suddenly just doesn't make sense.
00:26:00,00:26:03,"Cloud Atlas, they took out 43 minutes of the movie"
00:26:03,00:26:04,when they took to China.
00:26:04,00:26:07,That you can argue that it could miss 43 minutes.
00:26:07,00:26:07,Couldn't do that.
00:26:07,00:26:08,I haven't seen it.
00:26:08,00:26:10,I haven't seen it.
00:26:10,00:26:12,"When the sound of music came out in South Korea,"
00:26:12,00:26:13,"it was really, really popular."
00:26:13,00:26:16,And like Cinemas were playing it four or five times a day.
00:26:16,00:26:18,And one cinema owner wanted to work out a way
00:26:18,00:26:20,that he could play it more times a day
00:26:20,00:26:22,to get more customers in.
00:26:22,00:26:23,So he edited out all the songs.
00:26:23,00:26:25,[LAUGHTER]
00:26:25,00:26:26,Amazing.
00:26:26,00:26:28,"That's like, if anyone heard an episode"
00:26:28,00:26:30,"that we did, I think it was last week of the week before,"
00:26:30,00:26:34,"Chuck Norris, when he plays his movies to his kids,"
00:26:34,00:26:36,doesn't like the idea of his kids seeing the fight scenes
00:26:36,00:26:37,and the Chuck Norris movies.
00:26:37,00:26:40,So he personally edits out all the fight scenes
00:26:40,00:26:42,from his movies and his kids just watch it.
00:26:42,00:26:45,And I cannot think of a worse experience than watching
00:26:45,00:26:45,a fight with--
00:26:45,00:26:47,Sound of music without any songs.
00:26:47,00:26:48,Yeah.
00:26:48,00:26:49,"It's just called ""of."""
00:26:49,00:26:50,I can.
00:26:50,00:26:52,[LAUGHTER]
00:26:52,00:26:58,People must have loved Cinemas so confused.
00:26:58,00:27:01,What was with the title of it?
00:27:01,00:27:04,"Just to qualify, when I said Django, the reason I said that"
00:27:04,00:27:07,"is Django Unchained, the Quentin Tarantino movie,"
00:27:07,00:27:10,went into China and was pulled minutes from all of the cinemas
00:27:10,00:27:11,"when it started, because I had a nude scene."
00:27:11,00:27:14,And they don't allow nudity in movies now.
00:27:14,00:27:16,That's not anti-China propaganda to be fair to Django.
00:27:16,00:27:18,"Yeah, yeah, yeah."
00:27:18,00:27:21,"No, it's just they have strict law still with Serious."
00:27:21,00:27:24,The other thing is that China is the biggest
00:27:24,00:27:25,"as in the amount of money they take,"
00:27:25,00:27:28,"not the number of movies they make, I think."
00:27:28,00:27:30,"Yeah, because it's the side of the world, yeah."
00:27:30,00:27:32,Which is not the only way.
00:27:32,00:27:33,"Yeah, they do this thing as well now."
00:27:33,00:27:36,"So you know, when we watch a James Bond movie, how they take out--"
00:27:36,00:27:39,"you just see Richard Branson suddenly, and it's obviously"
00:27:39,00:27:41,"a virgin ad, or it's just product placement the whole way"
00:27:41,00:27:42,through.
00:27:42,00:27:45,They re-shoot scenes with Chinese product placement.
00:27:45,00:27:46,So which movie was it here?
00:27:46,00:27:51,"It was ""During World Wars"" Z. Oh, great movie."
00:27:51,00:27:51,Great film.
00:27:51,00:27:53,Great movie.
00:27:53,00:27:54,It is a great film.
00:27:54,00:27:55,"What's it, World Wars?"
00:27:55,00:27:58,You like Pacific Rim as your greatest ever.
00:27:58,00:27:58,I love the Pacific Rim.
00:27:58,00:28:00,Come on.
00:28:00,00:28:01,Thank you.
00:28:01,00:28:02,"Oh, my goodness."
00:28:02,00:28:03,"Yeah, it goes forever."
00:28:03,00:28:04,All right.
00:28:04,00:28:07,"I saw an edited version of ""Wobble Z,"""
00:28:07,00:28:09,"because I was on a plane watching it,"
00:28:09,00:28:11,"because that's when you should watch ""Wobble Z."""
00:28:11,00:28:15,And they edited out the bit with the enormous plane zombie
00:28:15,00:28:18,"scene, which ends with the plane crashing."
00:28:18,00:28:18,Really?
00:28:18,00:28:20,"Yeah, weird, right?"
00:28:20,00:28:21,We censors.
00:28:21,00:28:24,Let us watch the scene.
00:28:24,00:28:25,That's fair.
00:28:25,00:28:26,We should move on.
00:28:26,00:28:27,We don't quite want to start.
00:28:27,00:28:28,"Oh, I just want to say one more thing."
00:28:28,00:28:32,"So this, Kenny G's real name is."
00:28:32,00:28:33,Kenneth Gorelic.
00:28:33,00:28:35,Kenneth Gorelic.
00:28:35,00:28:37,And I thought I'd check and see if I had anything on him
00:28:37,00:28:39,in my files on my computer.
00:28:39,00:28:40,And I didn't have anything on him.
00:28:40,00:28:43,But I did have something on another Kenneth Gorelic.
00:28:43,00:28:44,And this is--
00:28:44,00:28:46,That is weird.
00:28:46,00:28:47,Go into the basement.
00:28:47,00:28:49,"Kenneth J. Gorelic, this is."
00:28:49,00:28:52,"He's a medic, and he wrote a paper called"
00:28:52,00:28:55,"""A four letter word in the medical literature."""
00:28:55,00:28:56,And he went through all medical literature looking
00:28:56,00:28:59,"for instances of the word ""fuck."""
00:28:59,00:29:00,OK?
00:29:00,00:29:04,He found 17 instances since the 1960s.
00:29:04,00:29:06,"Four were about a fungus called ""fuck."""
00:29:06,00:29:09,Two were sexual.
00:29:09,00:29:11,And six were the author.
00:29:11,00:29:13,OK?
00:29:13,00:29:14,What do you mean?
00:29:14,00:29:15,As in the name of the author?
00:29:15,00:29:15,"Oh, right, sorry."
00:29:15,00:29:18,"So here, the most prolific single contributor"
00:29:18,00:29:22,"was Dr. E. Fuck, whose four German language publications"
00:29:22,00:29:27,on the Malik acid metabolism of saccharolytices constitute
00:29:27,00:29:29,a major contribution to the field.
00:29:29,00:29:32,This may be about to change with the emergence
00:29:32,00:29:37,of Dr. L. Fuck as a co-author of a publication in 1999.
00:29:37,00:29:39,So look out for those new fucks.
00:29:39,00:29:45,"OK, let's move on to fact number three,"
00:29:45,00:29:47,and that is Chazinski.
00:29:47,00:29:49,"Uh, yeah, it is."
00:29:49,00:29:55,My fact is that the two leading paleontologists
00:29:55,00:29:58,in the 19th century used to destroy their fossil sites
00:29:58,00:30:01,after excavating them so that their rival
00:30:01,00:30:03,wasn't able to find anything on them.
00:30:03,00:30:04,That's insane.
00:30:04,00:30:06,"And so, and these really were the two"
00:30:06,00:30:08,"by far and away, the leading paleontologist."
00:30:08,00:30:11,"So they were Edward Drinker, Cope, and Othnial, Charles, Marsh."
00:30:11,00:30:12,Othnial.
00:30:12,00:30:12,Othnial?
00:30:12,00:30:14,"Yep, that's right, that's his name."
00:30:14,00:30:15,Got a problem with that?
00:30:15,00:30:16,No.
00:30:16,00:30:18,"No, ma'am."
00:30:18,00:30:20,It's just a brilliant name.
00:30:20,00:30:20,"It's good, yeah."
00:30:20,00:30:22,"So before they came along, there were nine species"
00:30:22,00:30:24,of dinosaur had been discovered and named.
00:30:24,00:30:27,"And between the two of them, by the time they both died,"
00:30:27,00:30:29,"they'd named 136 species between them,"
00:30:29,00:30:31,"including all the ones you've heard of,"
00:30:31,00:30:33,"all the big ones, stegosaurus, diplodocus, triceratops,"
00:30:33,00:30:34,all those guys.
00:30:34,00:30:36,And they kind of liked each other at first.
00:30:36,00:30:39,"So they met in 1867, and they named species"
00:30:39,00:30:39,after one another.
00:30:39,00:30:43,So a giant serpent from New Jersey
00:30:43,00:30:47,was called Mossosaurus Copianus after Cope and vice versa.
00:30:47,00:30:49,"Yeah, but I'm not sure that was because he liked him,"
00:30:49,00:30:52,because it's actually his copianus.
00:30:52,00:30:53,"Copianus, isn't it?"
00:30:53,00:30:54,That's what it is.
00:30:54,00:30:56,"Yeah, so I think that might have been an insult."
00:30:56,00:30:57,No.
00:30:57,00:30:58,For only you've been there to tell him.
00:30:58,00:31:00,He thought he were best friends.
00:31:00,00:31:02,I think this is why he was so upset.
00:31:02,00:31:04,"And Dick had a Soros, what is that?"
00:31:04,00:31:07,[LAUGHTER]
00:31:07,00:31:10,"So, relationship went sour when Cope showed off"
00:31:10,00:31:12,"this fossil of an elasmosaurus, and a big, like,"
00:31:12,00:31:13,showing a new fossil.
00:31:13,00:31:15,Classic faux pas.
00:31:15,00:31:17,Yeah.
00:31:17,00:31:19,Not at the end yet.
00:31:19,00:31:21,Did that put the head on the wrong end of it?
00:31:21,00:31:24,"And Marsh said, I think you put the head on the tail."
00:31:24,00:31:26,"And Cope was like, no, haven't, you're wrong."
00:31:26,00:31:29,"And they called in the museum curator, the academy curator,"
00:31:29,00:31:31,"who said, yeah, you put the head on the wrong end."
00:31:31,00:31:33,"And he was so humiliated by that, that Marsh wrote,"
00:31:33,00:31:36,"that after that, he's been my bitter enemy."
00:31:36,00:31:37,And it was so extreme.
00:31:37,00:31:40,They spent 25 years stealing each other's fossils.
00:31:40,00:31:43,They both employed teams of sort of spies to go
00:31:43,00:31:44,and jeopardize each other's sight.
00:31:44,00:31:47,So they'd steal and break each other's fossils.
00:31:47,00:31:48,"One of them, Marsh, got into government"
00:31:48,00:31:52,so that he could withdraw funding from the other guy.
00:31:52,00:31:54,"It comes in exchange of letters, where one would say,"
00:31:54,00:31:56,some of my fossils are damaged and have disappeared.
00:31:56,00:31:57,I know you're responsible.
00:31:57,00:31:59,"And the other one would write back going,"
00:31:59,00:32:00,it's outrageous that you'd accuse me of that.
00:32:00,00:32:02,"But since you mentioned it, some of my fossils"
00:32:02,00:32:06,"were gone and I thought, at least just 25 years of this."
00:32:06,00:32:06,Wow.
00:32:06,00:32:07,It was called the Bone Wars.
00:32:07,00:32:08,The Bone Wars.
00:32:08,00:32:11,How would they destroy each other's sort of--
00:32:11,00:32:14,"Well, Dynamite was how Marsh did it."
00:32:14,00:32:14,Dynamite.
00:32:14,00:32:15,Yeah.
00:32:15,00:32:18,"So they would find their bit and then go,"
00:32:18,00:32:19,there may be lots more here.
00:32:19,00:32:20,But I'm just going to--
00:32:20,00:32:21,"Yeah, just in case there is."
00:32:21,00:32:23,"Or I think if they couldn't carry stuff back,"
00:32:23,00:32:25,or if they'd found the thing they needed to find.
00:32:25,00:32:28,"They couldn't carry stuff back, yeah."
00:32:28,00:32:32,"Well, that's all I can say about that."
00:32:32,00:32:33,"Well, maybe they thought they would"
00:32:33,00:32:37,propel it back with the dynamite.
00:32:37,00:32:39,"I read that, on one occasion, there"
00:32:39,00:32:40,"are two teams of researchers, even"
00:32:40,00:32:43,had a stone throwing battle against each other.
00:32:43,00:32:44,They stayed from--
00:32:44,00:32:45,Yeah.
00:32:45,00:32:46,They hated each other.
00:32:46,00:32:48,They were throwing fossils at each other.
00:32:48,00:32:48,Yeah?
00:32:48,00:32:50,"No, I think they're still just--"
00:32:50,00:32:51,Yeah.
00:32:51,00:32:53,And it was quite-- even though they were obviously
00:32:53,00:32:55,"really successful, A, what were we missing that we could have?"
00:32:55,00:32:57,"And B, it was quite damaging to their--"
00:32:57,00:32:58,"like, how good they were at their work,"
00:32:58,00:33:00,because they constantly rushed to have stuff published
00:33:00,00:33:01,before the other person.
00:33:01,00:33:04,And this is when the Brondosaurus cock up came about.
00:33:04,00:33:08,"So Marsh, off Neil Marsh, named the Apatosaurus."
00:33:08,00:33:10,"And then he thought he'd found a different dinosaur,"
00:33:10,00:33:11,and he named it the Brondosaurus.
00:33:11,00:33:13,"And that was really catchy name, because it means thunder"
00:33:13,00:33:15,horse or something.
00:33:15,00:33:17,And it turned out that it wasn't a Brondosaurus.
00:33:17,00:33:19,It was just another Apatosaurus.
00:33:19,00:33:22,"And that was just because he'd sped it through,"
00:33:22,00:33:23,because he must publish more papers than--
00:33:23,00:33:25,"and he won the Bone Wars in the end,"
00:33:25,00:33:29,"because he named 18 new species, and Copen named 56."
00:33:29,00:33:31,"I don't think there were that many winners in this, really,"
00:33:31,00:33:35,"there, there."
00:33:35,00:33:38,[LAUGHTER]
00:33:38,00:33:41,"Well, are you my teacher?"
00:33:41,00:33:45,"When bones fight each other, nobody wins."
00:33:45,00:33:48,I've read that they died--
00:33:48,00:33:50,I guess they did.
00:33:50,00:33:51,That was us.
00:33:51,00:33:53,"Yeah, they've gone--"
00:33:53,00:33:54,I've got a great fact about that.
00:33:54,00:33:55,How about you're a fact next week?
00:33:55,00:33:58,Ah!
00:33:58,00:34:04,"So yeah, so after Copen, Marsh, when he got into government,"
00:34:04,00:34:08,"he divided his-- yeah, as you say, he made himself hugely"
00:34:08,00:34:10,powerful just so he could fight the other guy.
00:34:10,00:34:14,But then he tried to take Copen's fossils away from him.
00:34:14,00:34:17,"And that was his crucial misstep, because he said,"
00:34:17,00:34:18,"these were found with government money,"
00:34:18,00:34:21,"and dug up with government money, therefore, the government"
00:34:21,00:34:23,"owns them, and we're going to take your collection away from you."
00:34:23,00:34:25,But Copen proved that he paid for all of his own.
00:34:25,00:34:27,"Yeah, the receipts, kept the receipts, right?"
00:34:27,00:34:29,"Yeah, and he destroyed Marsh's reputation"
00:34:29,00:34:31,by showing that Marsh had behaved so unethically.
00:34:31,00:34:34,"So then Marsh lost his job in government, lost all his income,"
00:34:34,00:34:35,lost everything.
00:34:35,00:34:38,"Cope died 56 years old, penniless,"
00:34:38,00:34:42,"Marsh died two years after that, and he had $186 left."
00:34:42,00:34:43,"You see, Anna, no winners."
00:34:43,00:34:47,[LAUGHTER]
00:34:47,00:34:48,I've learned my lessons.
00:34:48,00:34:49,The dinosaurs are all--
00:34:49,00:34:52,"they named 142 dinosaurs, but only 30--"
00:34:52,00:34:53,That is true.
00:34:53,00:34:54,--are actual-- they're still dinosaurs.
00:34:54,00:34:56,They got overexcited.
00:34:56,00:34:57,A lot of them were mistakes.
00:34:57,00:35:02,They made 110 fake dinosaurs and rushed to beat the other guy.
00:35:02,00:35:02,They're not fake.
00:35:02,00:35:05,We just weren't as good a classifying species then.
00:35:05,00:35:07,Cool dinosaur thing.
00:35:07,00:35:10,The most complete or one of the most complete fossils we have
00:35:10,00:35:14,"of a T-Rex was wrapped around, and with its teeth embedded"
00:35:14,00:35:17,in the most complete fossil we have of a triceratops.
00:35:17,00:35:17,Wow.
00:35:17,00:35:19,It's really cool.
00:35:19,00:35:20,"So annoyingly, it went straight to Bonham's,"
00:35:20,00:35:24,and they're trying to sell it for something like $10 million or something.
00:35:24,00:35:26,So they haven't got scientists into verifying it.
00:35:26,00:35:27,But recently--
00:35:27,00:35:28,"Yeah, it was last year, but it didn't go."
00:35:28,00:35:32,"And they were saying about how T-Rexes would have eaten them,"
00:35:32,00:35:34,and they would have taken their head off
00:35:34,00:35:35,like a tin opener kind of thing.
00:35:35,00:35:36,Is that all?
00:35:36,00:35:38,Because his teeth were embedded in its neck.
00:35:38,00:35:41,"The teeth have come out of the T-Rex, and were in this sort of net."
00:35:41,00:35:42,So that was the theory that they would just
00:35:42,00:35:44,"cut around the neck, and they'd take the head off and eat the inside."
00:35:44,00:35:46,"So then it was doing this, and there was an earthquake,"
00:35:46,00:35:49,"they think, and which caused Santa fall on top of them,"
00:35:49,00:35:51,and they sort of sunk into the sinking sand.
00:35:51,00:35:52,And they were forever--
00:35:52,00:35:55,"Right, for 60 million years, they've been embraced."
00:35:55,00:35:57,"I see if it wasn't exciting enough with dinosaurs fighting,"
00:35:57,00:35:59,then there was an earthquake.
00:35:59,00:36:00,"Ah, that's amazing."
00:36:00,00:36:01,That's incredible.
00:36:01,00:36:05,You don't get that kind of entertainment anymore.
00:36:05,00:36:09,I read the very first dinosaur bone that was ever found was--
00:36:09,00:36:11,"at the time, it not thought to be a dinosaur bone."
00:36:11,00:36:14,It was in retrospective kind of looking at the drawings
00:36:14,00:36:16,of the thing that was described.
00:36:16,00:36:17,And it was a guy called Robert Plott.
00:36:17,00:36:18,"Oh, yeah."
00:36:18,00:36:22,"And Robert Plott, he thought what he'd found"
00:36:22,00:36:25,"was not a dinosaur, but a giant, which is incredible."
00:36:25,00:36:27,"He thought he was looking at this bone,"
00:36:27,00:36:29,"and he was like, this must be a giant man."
00:36:29,00:36:31,And so he told everyone that that's what he thought it was.
00:36:31,00:36:33,"Yeah, it was actually--"
00:36:33,00:36:36,it was a top of the thigh bone.
00:36:36,00:36:39,"Because of the shape of the top of the thigh bone of a dinosaur,"
00:36:39,00:36:40,it's quite hard to imagine that.
00:36:40,00:36:44,"But because of its shape, they called it scrotum humanum,"
00:36:44,00:36:46,because it looked like a giant scrotum.
00:36:46,00:36:48,And the thing is that they--
00:36:48,00:36:50,Giant balls.
00:36:50,00:36:51,Is that what he thought it was?
00:36:51,00:36:52,That wasn't him.
00:36:52,00:36:53,That was Richard Brooks who thought that.
00:36:53,00:36:55,But he came a little bit later.
00:36:55,00:36:58,He thought it was a giant elephant or something like that.
00:36:58,00:37:01,But then they came along called it scrotum humanum.
00:37:01,00:37:03,And then they realized it was a megalosaurus bone.
00:37:03,00:37:06,"But according to the rules of nomenclature,"
00:37:06,00:37:08,they should keep the first thing that it was called.
00:37:08,00:37:12,So the megalosaurus should really be called scrotum humanum.
00:37:12,00:37:13,That's so good.
00:37:13,00:37:16,"So the thing I really liked about this guy, though, Robert Plott."
00:37:16,00:37:18,He was quite an influential character back in the day
00:37:18,00:37:21,when it came to science and classifying things
00:37:21,00:37:22,and pushing forward ideas.
00:37:22,00:37:24,He also wrote about-- and I'd not
00:37:24,00:37:27,heard about this until today when I was looking into him--
00:37:27,00:37:31,he wrote about the first ever noted double sunset.
00:37:31,00:37:31,What?
00:37:31,00:37:32,Yeah.
00:37:32,00:37:33,Have you heard about this?
00:37:33,00:37:36,"OK, so he noticed it in leak, which I've not heard of either."
00:37:36,00:37:37,I don't know what that is.
