start_hhmmss,end_hhmmss,text
00:37:37,00:37:38,"No, it's famous for it."
00:37:38,00:37:40,"I think if you're from anywhere near leak,"
00:37:40,00:37:41,they're known for the double sunset.
00:37:41,00:37:42,They're known for the double sunset.
00:37:42,00:37:42,"Yeah, it's amazing."
00:37:42,00:37:43,What is it then?
00:37:43,00:37:44,"No, no, it's a real thing."
00:37:44,00:37:45,It's a real thing.
00:37:45,00:37:47,It's just where the contours of the earth
00:37:47,00:37:49,"aligns such that when the sun sets on a certain day of the year,"
00:37:49,00:37:53,"I think it's on the solstice, it looks like it's set over one hill."
00:37:53,00:37:56,And then because of the distance a certain hill behind it
00:37:56,00:37:59,is it rises up again and sets again.
00:37:59,00:38:00,It's just look at it on YouTube.
00:38:00,00:38:01,It's a real phenomenon.
00:38:01,00:38:02,It's a double sunset.
00:38:02,00:38:03,It's not magic.
00:38:03,00:38:06,"It's just the angle of the sun, compared to the mountains."
00:38:06,00:38:07,And it's in England.
00:38:07,00:38:07,It's a double sunset.
00:38:07,00:38:08,It's really-- it's really cool.
00:38:08,00:38:09,"Yeah, it's amazing."
00:38:09,00:38:11,Another thing just on rivalries that I really like
00:38:11,00:38:15,is that there's so much academic warfare that goes on.
00:38:15,00:38:17,It's not just with the dinosaur hunters.
00:38:17,00:38:19,You look through any bit of history up until now.
00:38:19,00:38:21,"I tweeted once saying, where does outer space begin?"
00:38:21,00:38:24,And that sparked a huge debate on Twitter for ages.
00:38:24,00:38:27,Where no one knew where outer space technically began.
00:38:27,00:38:28,So I love collecting these little things.
00:38:28,00:38:31,And I found this thing that the first mobile phone call ever
00:38:31,00:38:33,placed was in April the 3rd--
00:38:33,00:38:35,"on April the 3rd, 1973."
00:38:35,00:38:37,I was a guy called Martin Cooper.
00:38:37,00:38:38,He invented it.
00:38:38,00:38:41,And he basically worked for Motorola.
00:38:41,00:38:43,And his very first phone call--
00:38:43,00:38:45,"when he was like, we've made the mobile phone."
00:38:45,00:38:46,Let's do this.
00:38:46,00:38:48,His very first phone call was to the rivals at AT&T
00:38:48,00:38:50,to say that they got their first.
00:38:50,00:38:51,How cool is that?
00:38:51,00:38:52,He called them.
00:38:52,00:38:53,We got their suckers.
00:38:53,00:38:54,Bye!
00:38:54,00:38:55,I got it.
00:38:55,00:38:59,"That was the very first mobile phone call ever made, 1973."
00:38:59,00:39:00,"We need to move on, by the way."
00:39:00,00:39:03,"Oh, so we just quickly talked about the bastard Edison was."
00:39:03,00:39:03,Go for it.
00:39:03,00:39:04,Yeah.
00:39:04,00:39:05,What?
00:39:05,00:39:06,It's about bloody time.
00:39:06,00:39:07,I think it is.
00:39:07,00:39:10,So obviously Edison is credited with a great deal.
00:39:10,00:39:12,He was propaganda Maestro.
00:39:12,00:39:14,And he came up with DC Current.
00:39:14,00:39:16,"Well, Tesla was coming up with AC Current,"
00:39:16,00:39:19,"which is what is used most mostly around the world now,"
00:39:19,00:39:21,"because it's much more useful, it travels longer distances,"
00:39:21,00:39:22,et cetera.
00:39:22,00:39:25,But Edison waged such a strong campaign against Tesla
00:39:25,00:39:27,and against AC Current.
00:39:27,00:39:29,"To the extent that, he wrote to the Society"
00:39:29,00:39:32,"for the Prevention of Cruelty to Animals in the US,"
00:39:32,00:39:36,"and asked them to send him a bunch of dogs, cats, sheep, horses,"
00:39:36,00:39:39,and elephants to electrocute using AC Current
00:39:39,00:39:41,to prove that it was dangerous.
00:39:41,00:39:42,And the Prevention of Cruelty to Animals.
00:39:42,00:39:45,"So I said, yeah, of course, here you have some animals."
00:39:45,00:39:50,Feel free to electrocute them at your convenience.
00:39:50,00:39:51,"I'm not really doing the job, are they?"
00:39:51,00:39:54,"We did that in public, something was going on there."
00:39:54,00:39:56,"Yeah, and the electrocute to tops of the elephant."
00:39:56,00:39:59,"The electrocute topsi, which is the most traumatic thing."
00:39:59,00:40:04,"Topsi was a circus elephant, who basically she killed one guy"
00:40:04,00:40:05,who poked her in the face or something.
00:40:05,00:40:09,And so she was supposed to be hanged as elephants tended
00:40:09,00:40:10,to be when they were executed.
00:40:10,00:40:11,Hanged.
00:40:11,00:40:13,They used to hang elephants.
00:40:13,00:40:14,What?
00:40:14,00:40:15,That's the way to do it.
00:40:15,00:40:16,It's not the best way to do it.
00:40:16,00:40:19,I mean.
00:40:19,00:40:21,This is a source of a lot of content in the QI office.
00:40:21,00:40:24,"You're the Kenji song, that's right."
00:40:24,00:40:27,"On the normal circumstances, we would have caught that big animal."
00:40:27,00:40:29,But we--
00:40:29,00:40:31,It's live.
00:40:31,00:40:35,I've just made it to hanging elephants.
00:40:35,00:40:40,"OK, time to move on to our final facts."
00:40:40,00:40:42,Andy Murray.
00:40:42,00:40:45,My fact is that Mozilla Firefox translates
00:40:45,00:40:48,its computer systems into hundreds of different languages.
00:40:48,00:40:50,But lots of the metaphors don't translate.
00:40:50,00:40:54,"So things like cookies or files or mouse, things like that."
00:40:54,00:40:56,"So in Senegal, in the Fula language,"
00:40:56,00:40:58,"a computer crash is known as a hooky, which"
00:40:58,00:41:03,means a cow falling over but not dying.
00:41:03,00:41:04,Isn't that good?
00:41:04,00:41:06,And they have all of these things.
00:41:06,00:41:09,They're translating them using local idioms and local
00:41:09,00:41:09,languages.
00:41:09,00:41:13,"So a timeout is a Hanama, which means your fish has gone away."
00:41:13,00:41:19,And I don't really get this one.
00:41:19,00:41:23,"But aspect ratio is translated as Jean Dondero,"
00:41:23,00:41:27,which is a rebuke from elders when a fishing net is wrongly woven.
00:41:27,00:41:28,You don't get that?
00:41:28,00:41:29,I don't know.
00:41:29,00:41:30,Do you know what aspect ratio is?
00:41:30,00:41:33,Not really.
00:41:33,00:41:34,I'm thinking about it now.
00:41:34,00:41:35,I do get it.
00:41:35,00:41:36,I think that's quite good.
00:41:36,00:41:38,"It's kind of like a fishing net, isn't it?"
00:41:38,00:41:39,When it's wrongly woven.
00:41:39,00:41:39,I'm laughing.
00:41:39,00:41:41,I'd still don't know what it is.
00:41:41,00:41:42,Never mind.
00:41:42,00:41:43,I do like it when--
00:41:43,00:41:47,"Yeah, so when interesting linguistic metaphors, I guess."
00:41:47,00:41:49,And I think we might have been more fun with them
00:41:49,00:41:50,in the olden days.
00:41:50,00:41:54,"So in the 1800s, they referred to ducks or any birds"
00:41:54,00:41:57,with feet quite close to their buns as ass feet.
00:41:57,00:42:01,"And if you read natural science journals and stuff,"
00:42:01,00:42:04,"they'll say the ass foot duck present here,"
00:42:04,00:42:05,"or the ass foot present here, was--"
00:42:05,00:42:08,Wasn't the Grieb formally known as an ass foot?
00:42:08,00:42:09,"It would have been, yeah, yeah, Grieb."
00:42:09,00:42:11,Which one is known as a windfucker?
00:42:11,00:42:14,"That's a kestrel, or a kite."
00:42:14,00:42:16,Because they stay hovering against the wind.
00:42:16,00:42:17,Yeah.
00:42:17,00:42:19,[LAUGHTER]
00:42:19,00:42:23,"So ""computer"" words in Hawaiian, the word for ""computer"""
00:42:23,00:42:26,"literally means ""electric brain."""
00:42:26,00:42:27,"That's ""lala-ulah."""
00:42:27,00:42:30,"Yeah, and in Iceland, the computer is known as a ""tulah,"""
00:42:30,00:42:33,"which means ""number prophetess."""
00:42:33,00:42:34,"Oh, that's good, isn't it?"
00:42:34,00:42:35,That's really nice.
00:42:35,00:42:37,I like-- it's a female as well.
00:42:37,00:42:38,"Yeah, yeah."
00:42:38,00:42:40,And they-- they're older--
00:42:40,00:42:42,Standard.
00:42:42,00:42:46,"They're old words for a page that was, oh, I can't pronounce that,"
00:42:46,00:42:50,"""frifluothur,"" which means ""feeth of the peace."""
00:42:50,00:42:52,Wow.
00:42:52,00:42:53,"That's good, though, isn't it?"
00:42:53,00:42:55,That's incredible.
00:42:55,00:42:57,"Yeah, so speaking of women and computers,"
00:42:57,00:42:59,"first person to write ""computer code"" was a woman, right?"
00:42:59,00:43:01,"Who I think we've talked to, yeah?"
00:43:01,00:43:03,She's here tonight.
00:43:03,00:43:07,"Welcome to the stage, the 150-year-old from ""Come Up."""
00:43:07,00:43:10,"Ada Lovelace, or Lovelace, I never know how to say that."
00:43:10,00:43:11,Byron's daughter.
00:43:11,00:43:11,Byron's daughter.
00:43:11,00:43:12,Byron's only legitimate daughter.
00:43:12,00:43:14,Although she was never allowed to see him
00:43:14,00:43:17,"because her understandably, her mum hated him so much."
00:43:17,00:43:19,Yeah.
00:43:19,00:43:24,"Yeah, so she wrote the world's first ""computer code"" in 1842,"
00:43:24,00:43:25,"and it was because she worked with Charles Papish,"
00:43:25,00:43:28,"didn't she, who made the analytical engine?"
00:43:28,00:43:29,Is that what it was called?
00:43:29,00:43:30,Yeah.
00:43:30,00:43:31,"And it wasn't called a computer,"
00:43:31,00:43:33,because originally computers were people who did sums.
00:43:33,00:43:34,Yes.
00:43:34,00:43:36,"You would say, ""I'll just go and turn on the computer."""
00:43:36,00:43:38,"No, you wouldn't say that."
00:43:38,00:43:41,[LAUGHTER]
00:43:41,00:43:44,That's too wrong in too many ways.
00:43:44,00:43:46,"My mum always-- you know, in parents,"
00:43:46,00:43:47,I've like really lame jokes.
00:43:47,00:43:48,They do your whole life.
00:43:48,00:43:50,"Whenever you say to her, ""Can you turn on the lights, please?"""
00:43:50,00:43:51,"She starts flirting with the lights, well."
00:43:51,00:43:55,[LAUGHTER]
00:43:55,00:43:57,I wonder if everyone here has shown.
00:43:57,00:43:58,"That's not a lame joke, actually."
00:43:58,00:43:59,[LAUGHTER]
00:43:59,00:44:00,That's pretty good.
00:44:00,00:44:01,She'll be thrilled.
00:44:01,00:44:03,[LAUGHTER]
00:44:03,00:44:06,The first search engine was called Archie.
00:44:06,00:44:07,"Oh, that's it."
00:44:07,00:44:08,"Oh, yeah."
00:44:08,00:44:11,And so it was set up by this guy called Alan M. Taj.
00:44:11,00:44:12,"It was in the '80s, in 1983."
00:44:12,00:44:15,"And he was Barbadian, or Bayesian, whatever,"
00:44:15,00:44:16,whichever we're going to call it.
00:44:16,00:44:18,"And yeah, so he set up this search engine."
00:44:18,00:44:19,He did computer science.
00:44:19,00:44:20,And it was called Archie.
00:44:20,00:44:24,And because I think comic book fans overlap quite a lot
00:44:24,00:44:27,with computer geek people sometimes.
00:44:27,00:44:29,"And so everyone assumed it was named after Archie,"
00:44:29,00:44:30,the comic book guy.
00:44:30,00:44:32,And so eventually he did an interview where he came out.
00:44:32,00:44:34,"And he said, it's not named after Archie."
00:44:34,00:44:35,It's named after Archive.
00:44:35,00:44:36,And I took the V out.
00:44:36,00:44:41,"Archie, the comics are the most insipid thing I've ever read."
00:44:41,00:44:44,"He was not invited back to Comic Con the next year, wasn't he?"
00:44:44,00:44:47,"Anyway, he hasn't owned a computer since 1983."
00:44:47,00:44:49,Probably I haven't let him have one.
00:44:49,00:44:50,So rude about them.
00:44:50,00:44:53,[LAUGHTER]
00:44:53,00:44:55,"The word bug, supposedly, was coined in 1946"
00:44:55,00:44:58,when a lady called Grace Hopper found a moth
00:44:58,00:45:00,trapped in a relay at Harvard University.
00:45:00,00:45:01,And she freed them off.
00:45:01,00:45:03,And then she taped it into a book.
00:45:03,00:45:05,"But still, the computer then worked again."
00:45:05,00:45:08,And that's where people thought we got the word bug from.
00:45:08,00:45:09,But it's not true.
00:45:09,00:45:11,It's been in use since at least the 1870s.
00:45:11,00:45:12,"However, she is amazing."
00:45:12,00:45:14,"She is not only a great computer scientist,"
00:45:14,00:45:17,she was also a US Navy rear admiral.
00:45:17,00:45:18,Wow.
00:45:18,00:45:18,She's badass.
00:45:18,00:45:21,There are photos of this little lady in an enormous rack
00:45:21,00:45:22,of medals on her chest.
00:45:22,00:45:25,And she's got the proper naval admiral hat.
00:45:25,00:45:25,Amazing.
00:45:25,00:45:26,"Yeah, very cool."
00:45:26,00:45:28,In the what year?
00:45:28,00:45:32,She died in about 1980 or 1990.
00:45:32,00:45:34,"So in the mid '40s, '50s, '60s was when"
00:45:34,00:45:36,she was in her admiral and computer heyday.
00:45:36,00:45:37,Right.
00:45:37,00:45:37,"Yeah, look her up."
00:45:37,00:45:38,Grace Hopper.
00:45:38,00:45:38,Very cool.
00:45:38,00:45:39,Brilliant.
00:45:39,00:45:41,I was looking at language because of the language part
00:45:41,00:45:44,of the fact.
00:45:44,00:45:45,"I was looking at the language of Vanuatu,"
00:45:45,00:45:47,which is called Bislama.
00:45:47,00:45:49,And this was brought to the islands by sailors.
00:45:49,00:45:53,"So they're a bit, you know, a bit racy, the words."
00:45:53,00:45:56,And a lot of their words have the word shit in them.
00:45:56,00:45:57,Their word for shit is sit.
00:45:57,00:46:00,So sit-belong fire is ash.
00:46:00,00:46:03,"So it's the ship, which is left over after a fire's burned,"
00:46:03,00:46:04,which is quite good.
00:46:04,00:46:07,"Sit water, obviously, is diarrhea."
00:46:07,00:46:10,And sit-belong spider is--
00:46:10,00:46:11,Spider shit.
00:46:11,00:46:12,A spider web.
00:46:12,00:46:14,"Oh, I fell into that one."
00:46:14,00:46:15,Yeah.
00:46:15,00:46:18,That's an innocent one.
00:46:18,00:46:21,"And then I spent all afternoon looking at Vanuatu, basically--"
00:46:21,00:46:23,What have you found?
00:46:23,00:46:26,I found that they have pseudo-hermaphroditic pigs
00:46:26,00:46:27,on the island.
00:46:27,00:46:29,And these are the pigs that they've--
00:46:29,00:46:32,bred and bred and bred to have less and less testosterone.
00:46:32,00:46:35,So the penises have got smaller and smaller and smaller.
00:46:35,00:46:37,And now you can't even tell they have penises.
00:46:37,00:46:39,And they're pseudo-hermaphrodites.
00:46:39,00:46:41,And they're so precious on the island
00:46:41,00:46:43,that they're used as currency.
00:46:43,00:46:47,"So they use pseudo-hermaphroditic pigs as currency, which"
00:46:47,00:46:51,is the best sentence I've ever heard.
00:46:51,00:46:52,Do they carry around in wallet?
00:46:52,00:46:54,"No, it's just like owning it."
00:46:54,00:46:55,And then you would--
00:46:55,00:46:56,if you wanted to buy a house in your tent.
00:46:56,00:46:58,You would like a house in your house.
00:46:58,00:47:00,I think they use tusks as currency as well.
00:47:00,00:47:03,So it takes seven years for a tusk to grow in a full circle.
00:47:03,00:47:05,At which point it is valuable after the pig--
00:47:05,00:47:07,"it's removed from the pig, obviously, or taken."
00:47:07,00:47:10,"But if you get a double tusker, that's 14 years worth"
00:47:10,00:47:11,of accumulated money.
00:47:11,00:47:15,So that's how they calculate what's worth more.
00:47:15,00:47:16,I was looking at language as well.
00:47:16,00:47:19,And so fun words that exist in other languages
00:47:19,00:47:20,that we didn't have words for in English.
00:47:20,00:47:22,I think we should.
00:47:22,00:47:26,So I think my favorites are-- which one?
00:47:26,00:47:29,"""Jayus"" or ""Jayus"" in Indonesian is a joke so unfunny"
00:47:29,00:47:32,"that you have to laugh at it, which is weird with that, yeah."
00:47:32,00:47:33,That's my next edit and brush out title.
00:47:33,00:47:37,If anyone wants to come along.
00:47:37,00:47:41,"""Mangata"" in Sweden literally means ""Moon Street."""
00:47:41,00:47:43,"So it's guessable, actually."
00:47:43,00:47:45,But it's the-- do you know what it is?
00:47:45,00:47:47,No.
00:47:47,00:47:49,"It's the-- so when the moon's reflecting over a lake,"
00:47:49,00:47:51,it's the reflection of the moon.
00:47:51,00:47:53,It looks like a road.
00:47:53,00:47:55,"And then ""Sobre Mesa"" in Spanish"
00:47:55,00:47:57,is the time spent in conversation after a meal.
00:47:57,00:47:59,And it literally means over the table.
00:47:59,00:48:02,But I really like that because that turns it into an activity
00:48:02,00:48:06,"that's then justified in spending six hours doing, right?"
00:48:06,00:48:07,"Yeah, yeah, yeah."
00:48:07,00:48:09,"""Sobre Mesa""-- post-burning or washing up, basically."
00:48:09,00:48:11,[LAUGHTER]
00:48:11,00:48:12,No.
00:48:12,00:48:14,The word-- this is a great-- it's a Swiss word.
00:48:14,00:48:19,"And it's ""Altos on Tinta Lassena Versicharung."""
00:48:19,00:48:20,And it's the Swiss word for a pension.
00:48:20,00:48:22,"And they just say ""ahv."""
00:48:22,00:48:25,But what it means is old age and survivors insurance.
00:48:25,00:48:26,[LAUGHTER]
00:48:26,00:48:28,How cool is that?
00:48:28,00:48:29,"OK, just one more thing about Senegal,"
00:48:29,00:48:30,because that was--
00:48:30,00:48:31,"Yeah, the original fact."
00:48:31,00:48:32,The original fact.
00:48:32,00:48:34,All the way back was about Senegal.
00:48:34,00:48:36,"The main language in Senegal is ""Woloff."""
00:48:36,00:48:40,"And the ""Woloff"" language doesn't really have words"
00:48:40,00:48:40,for colors.
00:48:40,00:48:42,"It does have them, but they don't use them."
00:48:42,00:48:44,So they don't have the word for blue and orange
00:48:44,00:48:45,and red.
00:48:45,00:48:46,They use the French.
00:48:46,00:48:49,But they do have lots of words for shades of gray.
00:48:49,00:48:51,Loads and loads and loads.
00:48:51,00:48:51,"No, really."
00:48:51,00:48:52,How many?
00:48:52,00:48:55,[LAUGHTER]
00:48:55,00:48:56,We don't know.
00:48:56,00:48:57,I don't know.
00:48:57,00:48:58,The reason they have so many shades of gray
00:48:58,00:49:00,is because of their cast system.
00:49:00,00:49:04,Because the shade of your skin matters so much to them
00:49:04,00:49:06,that the different shades between black and white
00:49:06,00:49:08,"are really, really important to you."
00:49:08,00:49:09,And that's why they have so many shades of gray.
00:49:09,00:49:12,And the good thing about it is if you're a person
00:49:12,00:49:16,"who does a lot of art with pencils, especially in Africa,"
00:49:16,00:49:18,they use all these different shades of gray
00:49:18,00:49:20,when you're deciding how much you shade things in.
00:49:20,00:49:22,So they are actually useful as well as--
00:49:22,00:49:23,as well as a bit racist.
00:49:23,00:49:24,Yeah.
00:49:24,00:49:25,[LAUGHTER]
00:49:25,00:49:27,"I'm so excited that you've mentioned ""Wall-Off"""
00:49:27,00:49:29,"because when I was reading about jazz,"
00:49:29,00:49:32,"it's in the ""Wall-Off"" language that they think the word ""hip"""
00:49:32,00:49:33,comes from.
00:49:33,00:49:35,"And it's a word in the ""Wall-Off"" language"
00:49:35,00:49:36,"called ""Hepicat."""
00:49:36,00:49:40,And obviously so it's like a black culture thing jazz.
00:49:40,00:49:41,"And so they think ""hip"" comes from ""Hepicat."""
00:49:41,00:49:43,And then a bunch of other etymologists
00:49:43,00:49:44,think that that's rubbish.
00:49:44,00:49:46,And that's just sort of post-talk rationalization.
00:49:46,00:49:48,And they say there's no actual evidence
00:49:48,00:49:49,"that it comes from ""Hepicat."""
00:49:49,00:49:51,"And so apparently, among etymologists,"
00:49:51,00:49:55,"instead of saying ""to cry wolf,"" you say, ""to cry wall-off."""
00:49:55,00:49:57,And this is etymologist banter.
00:49:57,00:49:58,[LAUGHTER]
00:49:58,00:50:00,To cry wall-off.
00:50:00,00:50:03,"Start using it, guys."
00:50:03,00:50:05,OK.
00:50:05,00:50:05,That's it.
00:50:05,00:50:07,That's all our facts.
00:50:07,00:50:09,"Thanks so much, everyone, for listening to this show."
00:50:09,00:50:11,We'll be back again next week with another episode.
00:50:11,00:50:13,But if you want to get in contact with us
00:50:13,00:50:15,"if you're listening to this right now,"
00:50:15,00:50:16,you can get us on our Twitter accounts.
00:50:16,00:50:19,We have a main account which is @QIPodcast on Twitter.
00:50:19,00:50:20,But you can get us individually.
00:50:20,00:50:22,I'm on @Sriberland.
00:50:22,00:50:23,Andy.
00:50:23,00:50:25,Andrew Hunter M. James.
00:50:25,00:50:26,Eggshaped.
00:50:26,00:50:27,Jazzinski.
00:50:27,00:50:31,Can email podcast@QI.com.
00:50:31,00:50:34,"And yeah, we're going to be back again next week."
00:50:34,00:50:35,This was our first live show.
00:50:35,00:50:36,"We may do it again, I don't know."
00:50:36,00:50:39,Thanks everyone in the room for putting up with it.
00:50:39,00:50:40,Thanks so much for coming.
00:50:40,00:50:41,We hope you enjoyed it.
00:50:41,00:50:44,And we'll be back again next week with another episode
00:50:44,00:50:45,"of ""No Such Thing as a Fish."""
00:50:45,00:50:46,Thank you so much.
00:50:46,00:50:47,Good night.
00:50:47,00:50:50,[APPLAUSE]
00:50:50,00:50:53,[MUSIC PLAYING]
00:50:53,00:50:56,[MUSIC PLAYING]
00:50:56,00:50:59,[MUSIC PLAYING]
00:50:59,00:51:02,[MUSIC PLAYING]
00:51:02,00:51:12,[BLANK_AUDIO]
