start_hhmmss,end_hhmmss,text
00:30:01,00:30:03,He caught it in the way that baseball players do
00:30:03,00:30:05,with his mitt directly above his face.
00:30:05,00:30:07,The ball hit his mitt.
00:30:07,00:30:08,The mitt hit his face.
00:30:08,00:30:12,And he fractured his jaw and lost five teeth.
00:30:12,00:30:14,"And apparently, he dropped the ball."
00:30:14,00:30:16,Oh!
00:30:16,00:30:18,"And someone alongside him just went, ""Stop hitting yourself!"""
00:30:18,00:30:20,"""Stop hitting yourself!"""
00:30:20,00:30:24,"OK, that's it for this episode."
00:30:24,00:30:24,That's all our facts.
00:30:24,00:30:26,Thanks so much for listening.
00:30:26,00:30:27,If you want to get in contact with any of us
00:30:27,00:30:29,about the things that we've said during the course
00:30:29,00:30:32,"of this episode, you can get us on our Twitter handles."
00:30:32,00:30:34,"James, you're on Alex."
00:30:34,00:30:36,"Alex, Alex, go under school."
00:30:36,00:30:38,I'm on @Triberland.
00:30:38,00:30:39,And Chazinski.
00:30:39,00:30:42,You can email podcast@keywire.com.
00:30:42,00:30:43,Still not on since I've been away.
00:30:43,00:30:44,Still hasn't happened.
00:30:44,00:30:45,OK.
00:30:45,00:30:48,"And you can head over to nosuchthingasaffish.com,"
00:30:48,00:30:50,which houses all of our previous episodes.
00:30:50,00:30:53,"And we're going to be back again next week with another episode,"
00:30:53,00:30:54,for more facts.
00:30:54,00:30:55,So stay tuned.
00:30:55,00:30:55,And we'll see you then.
00:30:55,00:30:56,Good luck.
00:30:56,00:30:59,[MUSIC PLAYING]
00:30:59,00:31:01,(SINGING) We get together.
00:31:01,00:31:04,Sure we can do.
00:31:04,00:31:07,We'll hold on to you.
00:31:07,00:31:09,We'll hold on to you.
00:31:09,00:31:12,[MUSIC PLAYING]
00:31:12,00:31:22,[BLANK_AUDIO]
