start_hhmmss,end_hhmmss,text
00:37:35,00:37:39,"And then there was a bit of a silence, and Gilbert wrote back going, ""I can't believe"
00:37:39,00:37:42,"you don't care about this whole carpet thing."""
00:37:42,00:37:44,And then that led to them no longer being...
00:37:44,00:37:46,It feels like there might have been underlying issues.
00:37:46,00:37:48,"Well, underlying issues more like..."
00:37:48,00:37:55,"That fucking hell, that was a sarcastic show, wasn't it?"
00:37:55,00:37:57,That was a tired audience.
00:37:57,00:37:58,"I won't do it again, all right."
00:37:58,00:38:05,"Well, hey, just while we're on Detectives and Mysteries with Cheese Theft, I discovered,"
00:38:05,00:38:08,"and I found this when I was trying to look for great detective books, that there's a"
00:38:08,00:38:13,"whole series of cheese shop mysteries that have been read, and they're modern day books"
00:38:13,00:38:18,"written by someone called Avery Ames, and basically the premises, someone opens up a"
00:38:18,00:38:23,"cheese shop, and a lot of murders happen, and the cheese shop owner, I believe, is the"
00:38:23,00:38:29,"person who's solving them, and every single title of the book has a pun in its name."
00:38:29,00:38:34,So let me see who can get there first on the following title.
00:38:34,00:38:39,"So I'll give you the name of, let's say, the actual quote, the phrase, and you've got"
00:38:39,00:38:41,to convert it into cheese.
00:38:41,00:38:43,So to be or not to be.
00:38:43,00:38:44,To bring on to be.
00:38:44,00:38:45,To bring on to be.
00:38:45,00:38:46,Yep.
00:38:46,00:38:47,Give us a harder one.
00:38:47,00:38:48,"Okay, that was an easy one."
00:38:48,00:38:49,"Okay, slightly hard one."
00:38:49,00:38:51,Lost and Found.
00:38:51,00:38:52,This is a hard one.
00:38:52,00:38:54,"Mix up the word found a bit, and you can get there."
00:38:54,00:38:55,Lost and Founded.
00:38:55,00:38:56,Absolutely correct.
00:38:56,00:38:57,"Come on, nice."
00:38:57,00:38:58,Yes.
00:38:58,00:38:59,For better or worse.
00:38:59,00:39:00,For better or worse?
00:39:00,00:39:01,For better or worse?
00:39:01,00:39:02,For better or worse?
00:39:02,00:39:03,"For better or worse, absolutely."
00:39:03,00:39:05,"I would suggest a rewrite with, for better or worse."
00:39:05,00:39:06,"Sorry, James."
00:39:06,00:39:08,You've got to think like this also.
00:39:08,00:39:09,Two more.
00:39:09,00:39:11,As good as dead.
00:39:11,00:39:12,As good as dead.
00:39:12,00:39:13,"Yes, absolutely."
00:39:13,00:39:14,And last one.
00:39:14,00:39:15,Let's see if the audience can get it.
00:39:15,00:39:16,"The long kiss, goodbye."
00:39:16,00:39:17,"The long cheese, goodbye."
00:39:17,00:39:18,"The long kiss, goodbye."
00:39:18,00:39:19,"The long kiss, goodbye."
00:39:19,00:39:20,"Ah, fuck off."
00:39:20,00:39:21,"Alright, mate."
00:39:21,00:39:22,We're nearly done.
00:39:22,00:39:23,(LAUGHTER)
00:39:23,00:39:46,"I'm sorry, I chumbled a gun, I know that was your turn, I know we've been doing all"
00:39:46,00:39:47,the talking.
00:39:47,00:39:50,"It's a joke, the long quiche, goodbye."
00:39:50,00:39:52,I don't even get it right.
00:39:52,00:39:56,"I've got to fuck off for my life, I don't even get it right."
00:39:56,00:39:57,(LAUGHTER)
00:39:57,00:39:58,Wow.
00:39:58,00:40:04,"Well, it's what you get when you come to Newcastle."
00:40:04,00:40:06,"Okay, that is it."
00:40:06,00:40:07,That is all of our facts.
00:40:07,00:40:09,Thank you so much for listening.
00:40:09,00:40:12,If you would like to get in contact with any of us about the things that we've said over
00:40:12,00:40:15,"the course of this podcast, we can all be found on our Twitter accounts."
00:40:15,00:40:16,I'm on our Shriverland.
00:40:16,00:40:17,Anna?
00:40:17,00:40:18,No.
00:40:18,00:40:19,What?
00:40:19,00:40:20,I don't get my line.
00:40:20,00:40:21,You were there.
00:40:21,00:40:22,Andy?
00:40:22,00:40:23,At Anna Tajinski.
00:40:23,00:40:24,(LAUGHTER)
00:40:24,00:40:25,No!
00:40:25,00:40:26,(LAUGHTER)
00:40:26,00:40:31,"Really excited, can't wait to be joining Lotta Saka."
00:40:31,00:40:33,At Andrew Hunter M. James.
00:40:33,00:40:34,At James Harkin.
00:40:34,00:40:35,And Anna.
00:40:35,00:40:36,You can email podcast@qi.com.
00:40:36,00:40:37,(APPLAUSE)
00:40:37,00:40:51,It's a good email address.
00:40:51,00:40:53,We'll be back again next week with another episode.
00:40:53,00:40:54,We'll see you all then.
00:40:54,00:40:55,Goodbye!
00:40:55,00:40:56,(APPLAUSE)
00:40:56,00:40:58,(MUSIC)
00:40:59,00:41:00,(APPLAUSE)
00:41:00,00:41:01,(MUSIC)
00:41:01,00:41:02,(APPLAUSE)
00:41:03,00:41:04,(MUSIC)
00:41:04,00:41:07,(audience cheering)
