start_hhmmss,end_hhmmss,text
00:32:18,00:32:20,What about that Facebook thing the other day?
00:32:20,00:32:21,"Oh, that's strange."
00:32:21,00:32:22,"See, when you log on to Facebook,"
00:32:22,00:32:23,you don't see everything.
00:32:23,00:32:25,You see a selection that Facebook chooses to show you.
00:32:25,00:32:26,And they started skewing it.
00:32:26,00:32:28,"So you'd see, like, sort of pessimistic updates"
00:32:28,00:32:30,from your email friends.
00:32:30,00:32:31,And then they'd watch you see if you then
00:32:31,00:32:34,posted a more sad update if they could affect your mood
00:32:34,00:32:35,by what they showed you.
00:32:35,00:32:36,Wow.
00:32:36,00:32:38,"It's a fairly uncontroversial finding, I think,"
00:32:38,00:32:41,that if you see a load of miserable status
00:32:41,00:32:42,as you'll feel a bit glum.
00:32:42,00:32:44,"I'll tell you, hate all your friends, which I do."
00:32:44,00:32:46,So you've got the shine Friday.
00:32:46,00:32:47,"Yeah, I was delighted."
00:32:47,00:32:49,I post a lot of cheery statuses.
00:32:49,00:32:50,Great to see Neville lost his job.
00:32:50,00:32:52,It's Neville.
00:32:52,00:32:55,"So it is controversial though,"
00:32:55,00:32:58,because they're experimenting on people
00:32:58,00:32:59,who haven't given their permission.
00:32:59,00:33:00,That's a big no-go.
00:33:00,00:33:00,I'm not saying it's not.
00:33:00,00:33:01,I'm not saying it's not.
00:33:01,00:33:03,"Yeah, but presumably the snake's on a road isn't."
00:33:03,00:33:05,"Well, the rubber snake can't give him"
00:33:05,00:33:06,full consent for two reasons.
00:33:06,00:33:09,"For many, many."
00:33:09,00:33:11,I'm sort of the driver.
00:33:11,00:33:12,I don't know who you are.
00:33:12,00:33:16,"OK, we should wrap up."
00:33:16,00:33:18,Has anyone got any last minifacts on the trend?
00:33:18,00:33:19,"Yeah, go for it."
00:33:19,00:33:20,"We're especially from our first fact book,"
00:33:20,00:33:23,"""1-2-7-Q-I-Facts,"" which is that Schimpfloss"
00:33:23,00:33:25,"is a German 24-hour hotline,"
00:33:25,00:33:27,which allows customers to release
00:33:27,00:33:29,pen to progression by swearing at the telephone operators.
00:33:29,00:33:31,Have you seen things dressed?
00:33:31,00:33:31,Give them a call.
00:33:31,00:33:32,That's what they're doing.
00:33:32,00:33:33,Do you have the number by any chance?
00:33:33,00:33:34,"I don't, but hopefully we can put it on our website."
00:33:34,00:33:35,"Yeah, we can send it."
00:33:35,00:33:36,We'll put it on our website.
00:33:36,00:33:42,"1-800-AAAGH! OK, that's it. That's all of our facts."
00:33:42,00:33:43,"Thanks, everyone, for listening to this episode."
00:33:43,00:33:45,And no such thing as a fish.
00:33:45,00:33:47,And if you want to talk to any of us about the things
00:33:47,00:33:49,"that we said on this episode,"
00:33:49,00:33:51,you can reach us all on our Twitter handles.
00:33:51,00:33:53,I'm on @SriberlandJames.
00:33:53,00:33:54,@egshapedan.
00:33:54,00:33:56,@miller_an.
00:33:56,00:33:58,Andy @undruhunterm.
00:33:58,00:33:59,We'll be back again next week.
00:33:59,00:34:00,And we'll see you then.
00:34:00,00:34:01,Goodbye.
00:34:03,00:34:07,"Hi, everybody. We recorded that podcast actually a couple of days ago."
00:34:07,00:34:11,"And since then, Andy and Dan have gone to the Edinburgh Festival."
00:34:11,00:34:13,"So if you find yourself in the Edinburgh area,"
00:34:13,00:34:15,you might want to go and watch their shows.
00:34:15,00:34:16,They have two each.
00:34:16,00:34:19,Andy is doing two improv shows.
00:34:19,00:34:20,One is called ostentatious.
00:34:20,00:34:22,And the other is called Folly Adder.
00:34:22,00:34:25,And Dan is doing his first one-hour comedy show
00:34:25,00:34:27,called Cockblocked From Outer Space.
00:34:27,00:34:30,"And he will also be producing Museum of Curiosity,"
00:34:30,00:34:32,which is the QI radio show.
00:34:32,00:34:35,And they'll be doing a live show in Edinburgh as well.
00:34:35,00:34:39,"So if you're a fan of their voices, why not go along?"
00:34:39,00:34:45,The laws are on their way.
00:34:45,00:34:52,"And this time, there's no escape."
