start_hhmmss,end_hhmmss,text
00:00:00,00:00:02,- We run it on QI a few years ago. - Yeah.
00:00:02,00:00:05,"- Which was, there's no such thing as a fish. - You did a nice, such thing as a fish."
00:00:05,00:00:09,"No, seriously, it's in the Oxford Dictionary of Underwater Life."
00:00:09,00:00:12,"It says it right there, first paragraph, no such thing as a fish."
00:00:12,00:00:24,"Hello and welcome to another episode of No Such Thing as a Fish, a weekly podcast"
00:00:24,00:00:27,coming to you from the QI offices in Covent Garden.
00:00:27,00:00:33,"My name is Dan Schreiber, I am sitting at a table with Ann Miller, James Harkin, and Andy Murray."
00:00:33,00:00:38,"And once again, we've gathered around with our favorite facts from the last seven days,"
00:00:38,00:00:40,"and in no particular order, here they are."
00:00:40,00:00:45,"Okay, fact number one, and that's you, James."
00:00:45,00:00:52,"Okay, my fact is that the most painful place to be stung by a bee is your nostril."
00:00:52,00:00:54,- Is it? - It is.
00:00:54,00:00:55,So a bee inside your nose.
00:00:55,00:00:59,"Yeah, just the inside of your nostril apparently, it's the worst place to be stung."
00:00:59,00:01:04,"- How do you know this? - Well, I know this because there was a Cornell University student"
00:01:04,00:01:09,"called Michael Smith, who decided to let bees sting him on all different parts of his body"
00:01:09,00:01:11,and find out which was the most painful.
00:01:11,00:01:15,"- When he say, ""Oh, do you mean actually all?"" - Well, the main ones."
00:01:15,00:01:16,- The main ones. - The main ones.
00:01:16,00:01:19,- The skin. - The main ones are my hands and my feet.
00:01:19,00:01:23,"Yeah, I want to put nostril on my head shoulder's knees and toes, obviously."
00:01:23,00:01:28,"I'd say inside your mouth's fully pretty bad. - Yes. - Or your ears, like things that are touching your ears."
00:01:28,00:01:31,- Did he do it on his penis? That's what we're all dancing around.
00:01:31,00:01:35,"- I know. - Well, you might be dancing around your penis."
00:01:35,00:01:38,"- I would be of a bee, it's stung it."
00:01:38,00:01:39,"- He did, yes."
00:01:39,00:01:45,"He did it on the number of different parts of his body, and he gave them marks out of ten"
00:01:45,00:01:49,"for how painful they were, and the nostril was 9.0."
00:01:49,00:01:56,"The upper lip was 8.7, and the penis was the third worst place to be stung, and it was 7.3 out of ten."
00:01:56,00:02:02,"- Wow. - He had one bee, which he would hold beside his body in order to make it sting him."
00:02:02,00:02:06,- And a poor bee. Just put back in the box afterwards.
00:02:06,00:02:08,"- Oh, thank god that's over, then half an hour later."
00:02:08,00:02:10,"- Oh, here we go."
00:02:10,00:02:13,- Is it true that bees don't die after stinging you?
00:02:13,00:02:14,- Mammals have tougher skin.
00:02:14,00:02:18,"So if they sting a mammal, there's a higher chance of the sting being left behind"
00:02:18,00:02:20,"and then the bee, not surviving."
00:02:20,00:02:23,"However, if they sting other insects, which is what they normally sting, then they're fine."
00:02:23,00:02:24,They can sting them repeatedly.
00:02:24,00:02:28,- Do you know what a bee does if it can't sting you if you're too small to be stung?
00:02:28,00:02:30,"- If you're too small to be stung, you're going to be arrested and arrested."
00:02:30,00:02:32,"- They're not a human, like an insect."
00:02:32,00:02:33,"- Oh, like an insect. - Come on in between your nose."
00:02:33,00:02:35,"- Yes, yeah. I know, what does it do?"
00:02:35,00:02:36,- They bite. - They bite.
00:02:36,00:02:40,"- And their bites have a chemical in their basically paralyzes their prey, so they can turn them out of their hives."
00:02:40,00:02:43,And they might be able to be used in human medicine for anesthetics.
00:02:43,00:02:52,"Actually, the theme tune to our podcast ""Wosps"" by Ampere Yes, the song is all about how bees survive a wasp attack"
00:02:52,00:02:57,"when they come into their nest, which is that they heat it up by vibrating inside."
00:02:57,00:03:02,"And they can sustain within their own body a certain amount of heat, which is higher than a wasp heat."
00:03:02,00:03:05,So they literally cook the wasp inside the hive.
00:03:05,00:03:06,- That's awesome.
00:03:06,00:03:10,"- We also should mention the least painful places, just in case you have a supervillain say."
00:03:10,00:03:13,"- It's all about bees-beasting, YouTube."
00:03:13,00:03:15,"- Well, all of your shoe would be, yeah."
00:03:15,00:03:17,- It would be amazing. - I'll look at that.
00:03:17,00:03:23,"- But on the body, the skull tip of the middle toe, apparently, and upper arm, they're all very low rated 2.3."
00:03:23,00:03:28,"- I read about this horrible thing in New Zealand, where they're selling the venom face masks."
00:03:28,00:03:34,"So the idea is that it works like a natural bullshocks in it, so they need about 20 hives to harvest one gram of this venom."
00:03:34,00:03:37,"And they claim a mixture of skin and feel firmer, it makes it, you know, like you've had a facelift."
00:03:37,00:03:41,"- But there are told you say there's no benefits, and actually it can cause you quite severe medical problems."
00:03:41,00:03:44,- Bees can fly higher than Mount Everest.
00:03:44,00:03:48,"We did a thing about landing a helicopter on Mount Everest, which is incredibly difficult and dangerous,"
00:03:48,00:03:52,"because the air is so thin up there that even with the speed of helicopters, the rotor blades go at,"
00:03:52,00:03:53,it's almost impossible to do.
00:03:53,00:03:56,"- But someone has done it, and has done it, yeah."
00:03:56,00:03:58,"- But it wasn't a bee, just to clarify."
00:03:58,00:04:05,"- Well, Edmund Hilary, he was a beekeeper, and he actually was his beekeeping job that funded his trip to get to Mount Everest, yeah."
00:04:05,00:04:09,"- Yeah, he put it on his passport when they asked what his job was, he said he was a beekeeper."
00:04:09,00:04:10,"- Oh, that's awesome."
00:04:10,00:04:12,"- Yeah, other famous beekeepers, Sherlock Holmes."
00:04:12,00:04:14,"- Yes, he retired to become a beekeeper."
00:04:14,00:04:15,- He retired as a beekeeper.
00:04:15,00:04:18,"- Yeah, Aristotle as well, was a beekeeper."
00:04:18,00:04:24,"And he made this really odd claim that they survived for seven years, when in fact they survived for seven weeks."
00:04:24,00:04:28,"So either he thought, ""Well, they're still here,"" and just didn't recognize that he had new born bees."
00:04:28,00:04:29,"- Oh, he was a dog."
00:04:29,00:04:30,"- Oh my god, yeah."
00:04:30,00:04:31,"- Wow, Aristotle."
00:04:31,00:04:32,- We just blend this thing wider.
00:04:32,00:04:34,- Yeah.
00:04:34,00:04:39,"- I saw everything in the news, in the news a few weeks ago, that Norfolk police are warning people to be aware of bee rustlers."
00:04:39,00:04:42,They've been turning up in the night and stealing hives full of thousands of bees.
00:04:42,00:04:43,- Oh really?
00:04:43,00:04:44,"- So that's quite a high risk, fair."
00:04:44,00:04:45,"- Yeah, wow."
00:04:45,00:04:49,"- Germany has fantastic bee laws, and roughly broken down their this."
00:04:49,00:04:56,"If bees break away from a hive, they are only still your bees if you're in pursuit."
00:04:56,00:04:58,"So as long as you're in pursuit, they are your bees."
00:04:58,00:05:00,So there is nowhere off limits to you.
00:05:00,00:05:04,"If you have to run into the houses of parliament there, you can because you're just here to your bees."
00:05:04,00:05:04,- Yeah.
00:05:04,00:05:06,- You're exactly like this from this law.
00:05:06,00:05:07,- Yeah.
00:05:07,00:05:12,"- If they then land in the hive of someone else's farm, and it's an empty hive,"
00:05:12,00:05:16,"then you can break that hive down, collect your bees and bring it back and just replace the hive."
00:05:16,00:05:22,"If it lands in a hive that's full of bees, then the other owner is just acquired some new bees."
00:05:22,00:05:25,"Now the best law of the whole thing is that if you're in pursuit of your bees,"
00:05:25,00:05:28,"there's a law that states that if you see someone else in pursuit of their bees,"
00:05:28,00:05:33,"and your two bee colonies collide and turn into one swarm,"
00:05:33,00:05:35,you are now the co-owner of these bees.
00:05:35,00:05:37,"- You're in business with the hive, they're in business."
00:05:37,00:05:39,"- Yeah, if he drops out of pursuit, then it's your business."
00:05:39,00:05:41,- You're in buzziness more like.
00:05:41,00:05:47,Can I quickly tell you about bee bids?
00:05:47,00:05:47,Please do.
00:05:47,00:05:48,"- Ooh, yeah."
00:05:48,00:05:52,- This is an article by beekeeper on beeinformed.org.
00:05:52,00:05:53,"Nice, but the article reads,"
00:05:53,00:05:58,"""Having about 10,000 bees on your face is one of the best ways to demonstrate how calm and fun"
00:05:58,00:06:00,"bees can be."""
00:06:00,00:06:03,"And so the idea is that, so step one, prepare the bees,"
00:06:03,00:06:08,"step two, prepare the person, step three, add bees, step four, remove bees."
00:06:08,00:06:11,Because of the more detail on how you do all of these things.
00:06:11,00:06:13,"So basically you attach them to your chin,"
00:06:13,00:06:16,and you have to put Vaseline on your eyes and you have to put Coffin in your ears.
00:06:16,00:06:17,- How do you attach them to your chin?
00:06:17,00:06:21,Is it like on each hair and your chin or something?
00:06:21,00:06:25,- You put a queen bee just below your chin and the bees swarm to her.
00:06:25,00:06:26,- How do you get her?
00:06:26,00:06:29,"- You spray the bees with sugar syrup,"
00:06:29,00:06:32,"and then the assistant will tie the queen around your head so the queen is under your chin,"
00:06:32,00:06:37,"and then you just hold a tray on your belly and the assistant dumps all the bees into the tray,"
00:06:37,00:06:38,and they just gather to the queen.
00:06:38,00:06:39,- Okay.
00:06:39,00:06:41,- And you've got a massive beard made of bees.
00:06:41,00:06:45,"However, he does point out he's never done this without being stung at least once or twice."
00:06:45,00:06:49,"- I want to know what would happen if you were in Germany and you were chasing your bees,"
00:06:49,00:06:51,and they all gathered on some guy's face.
00:06:51,00:06:52,- You get on him.
00:06:53,00:06:56,"There is a myth about bees, according to the internet."
00:06:56,00:07:01,This is a common misconception amongst some people that bees hate bad language
00:07:01,00:07:04,and will sting those who swear in their presence.
00:07:04,00:07:08,"- I heard that if you kill, I think it works for bees, Andrew, whilst if you kill them,"
00:07:08,00:07:10,"you need to get out of there quick because if you kill them,"
00:07:10,00:07:13,they release a chemical to warn their hive mates that there's danger.
00:07:13,00:07:15,- They can do that even if they're still alive.
00:07:15,00:07:21,- There was something in the news this week that they found that gorillas communicate by BL.
00:07:21,00:07:23,"- I mean, you mean gorilla gorillas, not gorilla warriors."
00:07:23,00:07:25,- Philogastro just raised an arm.
00:07:25,00:07:32,"- Well, yes, Arifat used to just fart whenever he wanted to because that was his kind of thing."
00:07:32,00:07:33,It was his intimidation.
00:07:33,00:07:34,- To clear the room.
00:07:34,00:07:36,- It was just his thing.
00:07:36,00:07:40,"He got so much joy and we have the room to ourselves, please."
00:07:40,00:07:41,He does make a presence.
00:07:41,00:07:47,"I was reading that urban bees, they've completely evolved."
00:07:47,00:07:50,So there was a study done in Toronto that showed that three out of eight
00:07:50,00:07:56,alfalfa leaf cutter bees have nests that are made up of shredded plastic bags.
00:07:56,00:07:59,"Apparently, they use us as sort of salt licks, like us humans."
00:07:59,00:08:02,- Lots of insects drink animals tears together.
00:08:02,00:08:07,- We did on QI a few years ago that there was a company developing bee bomb detectors
00:08:07,00:08:11,and trained bees to stick out their tongue at the smell of explosives and things like that.
00:08:11,00:08:12,- Wow.
00:08:12,00:08:16,- You know how you use smoke to pacify bees?
00:08:16,00:08:17,Do you know how that works?
00:08:17,00:08:19,- No.
00:08:19,00:08:22,It doesn't make them drowsy as you might think in the normal way.
00:08:22,00:08:25,They think they're in trouble and so they eat up all of the honey
00:08:25,00:08:28,"and because they eat up so much, they're so full."
00:08:28,00:08:31,They can't really do anything and they're just waddling around
00:08:31,00:08:32,and they're not attacking people.
00:08:32,00:08:34,I think that's how the smoke stuff works.
00:08:34,00:08:35,- That's great.
00:08:35,00:08:35,"- That's great, isn't it?"
00:08:35,00:08:37,- I really hope it will be by getting them addicted to the smoke
00:08:37,00:08:40,and so that they just want another cigarette.
00:08:40,00:08:45,"- Well, there is a study where they tried to get some bees addicted to narcotics"
00:08:45,00:08:46,to see how it affected the bees.
00:08:46,00:08:47,"- Well, it could possibly go wrong."
00:08:47,00:08:49,"- Yeah, so they got some bees hooked to cocaine."
00:08:49,00:08:50,"And according to the results,"
00:08:50,00:08:52,"the cocaine-turned-good bees,"
00:08:52,00:08:54,"productive members of the hive,"
00:08:54,00:08:56,into untrustworthy bees.
00:08:56,00:09:00,- Grace will hand it up a morph as well.
00:09:00,00:09:00,"- No, I think..."
00:09:00,00:09:02,"- He has an untrustworthy bee behaviour, Dan."
00:09:02,00:09:05,"- I think, if I remember this study correctly,"
00:09:05,00:09:08,bees will do a little dance to say how much honey they have.
00:09:08,00:09:09,"Yeah, call the waggle dance."
00:09:09,00:09:11,And the ones who had taken cocaine would do that.
00:09:11,00:09:14,We've got lots of honey dance when actually they should have done that.
00:09:14,00:09:15,We didn't really find much honey.
00:09:15,00:09:17,We mostly found cocaine dance.
00:09:17,00:09:17,- That's amazing.
00:09:17,00:09:19,- We found more than anyone else has ever found.
00:09:19,00:09:20,You've got to come. You've got to come and look.
00:09:20,00:09:22,- What about drunk bees? Do you know about them?
00:09:22,00:09:22,- No.
00:09:22,00:09:24,- So you're sitting in a corner and getting a bit sad?
00:09:24,00:09:25,"- Yeah, it is a bit like that."
00:09:25,00:09:28,They have more flying accidents than sober ones.
00:09:28,00:09:33,And they can sometimes forget how to get back to the hive and die as a result.
00:09:33,00:09:35,"And if they do make it back to the hive,"
00:09:35,00:09:39,then they can be rounded on by other bees who punish them by chewing off their legs.
00:09:39,00:09:41,- So they're legless.
00:09:45,00:09:49,"- Okay, let's move on to fact B, fact number two."
00:09:49,00:09:50,Just a call back there.
00:09:50,00:09:53,"Yeah, okay, this is my fact."
00:09:53,00:09:57,And this fact is that Walt Disney used to eat breakfast like all of us.
00:09:57,00:10:01,But his favorite breakfast was fresh doughnuts dunked in scotch.
00:10:01,00:10:03,- That's why the national dish of Scotland.
00:10:03,00:10:08,"- He's one of those people who, when you look into him,"
00:10:08,00:10:11,just comes up with so many extraordinary little facts about him
00:10:11,00:10:13,that you would never have known.
00:10:13,00:10:19,"And I'm surprised that we do know, I'm surprised that we do know that he dunked his doughnuts in scotch."
00:10:19,00:10:23,I'm surprised that we know that he used to keep his testicles on ice.
00:10:23,00:10:27,"- Wait, wait, wait, wait, wait, wait, wait, wait, wait, wait, wait, wait, he dunked his scotch."
00:10:27,00:10:28,- That was on ice.
00:10:28,00:10:29,- He was his testicles.
00:10:29,00:10:34,He used to put his balls on ice because he had a low sperm count and he thought that would help.
00:10:34,00:10:35,"- He's in the electronics room, is that it?"
00:10:35,00:10:36,"- Yeah, exactly."
00:10:36,00:10:38,"- Yeah, the rest of him isn't frozen."
00:10:38,00:10:39,It's just his testicles.
00:10:39,00:10:40,- It's just his balls.
00:10:40,00:10:41,- When we regenerate him.
00:10:42,00:10:43,- Isn't he an almost pair of balls?
00:10:43,00:10:49,- There's a guy called Josh Schumacher in America and he's painted a thing called Snowballs.
00:10:49,00:10:53,And these are pants that come with a special integrated pocket
00:10:53,00:10:57,that cools the man's nether regions in an effort to boost his sperm count.
00:10:57,00:10:57,- Ah.
00:10:57,00:10:59,- And the awkward Christmas is sorted.
00:10:59,00:11:00,- Yeah.
00:11:00,00:11:02,For the man who has everything.
00:11:02,00:11:03,- Colder testicles.
00:11:03,00:11:06,"- Um, a scariest way I went around a few years ago."
00:11:06,00:11:08,That Iron Blue lowered your sperm count.
00:11:08,00:11:09,- Really?
00:11:09,00:11:11,- You basically would stuff the Scottish reproduction rates.
00:11:11,00:11:12,I think it turned out not to be true.
00:11:12,00:11:17,"- Um, Chinese Unix would keep their testicles in a jar"
00:11:17,00:11:21,in the hope that they would arrive complete in the next world after they died.
00:11:21,00:11:21,- Oh my god.
00:11:21,00:11:25,"- I just moved house and I, you know, I'm getting rid of a lot of my old stuff."
00:11:25,00:11:29,"I can imagine finding your testicles in a drawer or something and thinking,"
00:11:29,00:11:30,"""I will hang on to these."""
00:11:30,00:11:31,"- Yeah, everyone's got one of those drawers at home."
00:11:31,00:11:32,Haven't they?
00:11:32,00:11:35,"It just starts and ends like old batteries, jars of testicles."
00:11:35,00:11:37,- What happens to foreskins?
00:11:37,00:11:37,- What do you mean?
00:11:37,00:11:38,- On circumcision.
00:11:38,00:11:41,Some of them can be used in cosmetics.
00:11:41,00:11:42,- Yeah.
00:11:42,00:11:44,- And they're not really supposed to be face masks.
00:11:44,00:11:47,"- I know, they're used as artificial eyelashers."
00:11:47,00:11:50,"They're just, no, they're not actually."
00:11:50,00:11:51,- Oh my god.
00:11:51,00:11:54,"- No, there was a bit of a, a bit of a thing a couple of years ago"
00:11:54,00:11:57,"that some hospitals have been taking the,"
00:11:57,00:12:01,removed fastkins from children and they've been using them
00:12:01,00:12:04,to make cosmetics without the patient's consent.
00:12:04,00:12:06,- I did work experience in the hospital when I was younger
00:12:06,00:12:08,and I was in an operating theater and they had a sign on the world
00:12:08,00:12:10,about different kinds of bins.
00:12:10,00:12:12,"And after I made it, I was, I think it was the orange bin"
00:12:12,00:12:13,was for human body parts.
00:12:13,00:12:14,- Oh.
00:12:14,00:12:16,"- I never saw one, but I love the wary of one."
00:12:16,00:12:19,"- That's like recycling gum, mad, isn't it?"
00:12:19,00:12:21,"It's like, you're going to put it in your green bin"
00:12:21,00:12:22,or your brown bin or your orange bin.
00:12:22,00:12:23,- I didn't pay for it.
00:12:23,00:12:24,- Walt Disney.
00:12:24,00:12:26,What do we have about him?
00:12:26,00:12:30,- Something I didn't know about Walt was that he was the voice of Mickey.
00:12:30,00:12:31,- There are lots of Mickey Mouse's and one of the actors
00:12:31,00:12:34,"played Mickey Mouse, married lady who played Minnie Mouse."
00:12:34,00:12:35,Which is very nice.
00:12:35,00:12:36,"- Oh, that's good."
00:12:36,00:12:37,- That is good.
00:12:37,00:12:38,- And cows in Mickey Mouse.
00:12:38,00:12:41,There was a complaint that the otters were too big
00:12:41,00:12:42,when it first came out.
00:12:42,00:12:42,"- Oh, really?"
00:12:42,00:12:44,- And they said pictures in the future
00:12:44,00:12:46,will have small or invisible otters.
00:12:46,00:12:50,"Quite unlike the gargantuan organ whose antics have laked,"
00:12:50,00:12:52,her shocked some and convulsed others.
00:12:52,00:12:54,- I get a lot of those letters too.
00:12:54,00:12:57,- I found that yesterday.
00:12:57,00:12:58,"This is not really related,"
00:12:58,00:13:00,but from the Mickey and Minnie thing.
00:13:00,00:13:02,Do you know Fergie from the Black Eyed Peas?
00:13:02,00:13:02,- Yeah.
00:13:02,00:13:04,- Was someone in peanuts?
00:13:04,00:13:05,- What?
00:13:05,00:13:07,- I forgot the name of the character in peanuts.
00:13:07,00:13:09,The one with blonde curly hair.
00:13:09,00:13:11,Her voice was done in the 80s by Fergie.
00:13:11,00:13:13,It was the first thing she ever did when she was like nine years old.
00:13:13,00:13:15,"- Okay, I've just googled it."
00:13:15,00:13:16,She played Sally.
00:13:16,00:13:17,- That's right.
00:13:17,00:13:18,- That's a really good fact.
00:13:18,00:13:18,- Yeah.
00:13:18,00:13:22,- Just one other related fact to people behind the characters.
00:13:22,00:13:24,Ariel and Bell.
00:13:24,00:13:27,So Ariel from the lore mermaid and Bell from Beauty and the Beast.
00:13:27,00:13:29,They were both based on a real-life model.
00:13:29,00:13:31,Whose name was Cherie Stoner.
00:13:31,00:13:33,And they used all of her mannerisms.
00:13:33,00:13:37,"So there's very famously, Ariel does this thing where she kind of blows her hair"
00:13:37,00:13:39,in frustration and her hair bows.
00:13:39,00:13:42,That was just Cherie just improvising in the moment.
00:13:42,00:13:44,- Cherie also had the tail of the fish.
00:13:44,00:13:45,- She did it.
00:13:45,00:13:46,"So I mean, it was very convenient."
00:13:46,00:13:49,But she wasn't just a model because then she became a part of the family.
00:13:49,00:13:53,And she was the writer and producer for the Animaniacs
00:13:53,00:13:54,"and Casper, the friendly ghost."
00:13:54,00:13:54,- Oh really?
00:13:54,00:13:56,"- Yeah, she was like a proper..."
00:13:56,00:13:57,- That's pretty good.
00:13:57,00:14:00,That reminds me of a fact about the Statue of Liberty.
00:14:00,00:14:01,It was designed by Bertoldy.
00:14:02,00:14:07,I think he based the body of the Statue of Liberty on his mistress
00:14:07,00:14:08,and the face on his mother.
00:14:08,00:14:10,"- Oh, that's not a five-bed."
00:14:10,00:14:11,"- Which is a little bit pro-idean, isn't it?"
00:14:11,00:14:14,"- But that's like Justin's mother will be very statuesque, if so."
00:14:14,00:14:16,- Maybe she's wore a big tiara all the time.
00:14:16,00:14:17,- Maybe.
00:14:17,00:14:20,"Justin Pollard, one of the other QILs."
00:14:20,00:14:24,"In his book, Seeker Britain, he talks about how the roles"
00:14:24,00:14:26,"Royce, the Statue, the spirit of ecstasy,"
00:14:26,00:14:29,is based on the mistress of Mr. Royce.
00:14:29,00:14:31,"Was it, yeah, well, one of them."
00:14:31,00:14:33,"It was their mistress, who died in a boating accident."
00:14:33,00:14:36,And it was his tribute to her to people alive forever.
00:14:36,00:14:38,"Yeah, so that's his mistress on the front of the car."
00:14:38,00:14:40,Let's talk about breakfast.
00:14:40,00:14:43,"There was a study done saying that if you eat cake for breakfast,"
00:14:43,00:14:45,it's really good if you're on a diet.
00:14:45,00:14:48,And they got a load of overweight people.
00:14:48,00:14:50,And they gave them cake for breakfast.
00:14:50,00:14:52,That was the only difference in any of their lifestyle.
00:14:52,00:14:54,And they all lost weight.
00:14:54,00:14:57,"And the idea is that if you eat the sugary stuff in the morning,"
00:14:57,00:14:59,you're less likely to snack on it during the day.
00:14:59,00:15:01,Wow.
00:15:01,00:15:03,So a bowl of special K and a bowl of frosties
00:15:03,00:15:05,have only a one calorie difference.
00:15:05,00:15:07,And it's the special K that are more calorific.
00:15:07,00:15:08,Whoa.
00:15:08,00:15:09,So you're better off eating frosties.
00:15:09,00:15:10,"Well, really."
00:15:10,00:15:14,"The iron that you get added to cereals,"
00:15:14,00:15:15,"if you have a good enough magnet,"
00:15:15,00:15:18,you can get the iron filings out of the cereal.
00:15:18,00:15:19,There's a way of doing that.
00:15:19,00:15:21,There's videos on YouTube of how to do it.
00:15:21,00:15:22,"Oh, that's awesome."
00:15:22,00:15:22,Yeah.
00:15:22,00:15:23,Disney World.
00:15:23,00:15:24,Yes.
00:15:24,00:15:28,Is the second largest purchaser of explosives in the US?
00:15:28,00:15:30,They're just for their fireworks or are they taken to terrorism?
00:15:30,00:15:31,"No, it's fireworks."
00:15:31,00:15:33,But after the military is number one.
00:15:33,00:15:34,All that planning is something really big.
00:15:34,00:15:37,"Actually, that reminds me of the fact"
00:15:37,00:15:40,that I almost used for the podcast this week.
00:15:40,00:15:42,I read it on a website called Collector's Weekly.com.
00:15:42,00:15:44,"And they said that before they had fireworks,"
00:15:44,00:15:47,"what they would do is they would get two anvils,"
00:15:47,00:15:48,"turn one of them upside down,"
00:15:48,00:15:50,"put it on top of the other one,"
00:15:50,00:15:52,"put explosives in between them,"
00:15:52,00:15:56,set fire to the explosives so that the anvil would fly into the sky.
00:15:56,00:15:57,What could possibly go wrong?
00:15:57,00:15:59,"I know, and it caused all sorts of problems,"
00:15:59,00:16:01,people getting injured and what have you.
00:16:01,00:16:02,But hang on.
00:16:02,00:16:04,It's the cartoon trope of someone being killed
00:16:04,00:16:05,by a massive anvil falling on them.
00:16:05,00:16:07,Something that was a real risk.
00:16:07,00:16:07,Yeah.
00:16:07,00:16:09,The weather's going to be heavy anvils today
00:16:09,00:16:10,with scattered hammers.
00:16:10,00:16:11,[LAUGHS]
00:16:11,00:16:17,"OK, it is time now to move on to fact number three."
00:16:17,00:16:19,"And that is you, Anne."
00:16:19,00:16:22,"Yes, my fact is that the French used to call Arsonic"
00:16:22,00:16:25,"""poudre de sucession"" or ""inheritance powder"""
00:16:25,00:16:27,because it was used in so many murders.
