start_hhmmss,end_hhmmss,text
00:20:52,00:20:56,the iceberg where there's a hole on the inside. It's like a triathlon kind of thing you know you
00:20:56,00:21:01,do the swimming bit and then you do the climbing bit. When do you do the cycling bit? There's a
00:21:01,00:21:07,bike at the top of the iceberg. But this is where the story genuinely turns a bit Brian blessedy
00:21:07,00:21:11,for me because I just think this is impossible. So she climbs up 130 feet. But here's the thing
00:21:11,00:21:16,right this is solid ice wall right so how do you climb ice wall and she thinks to herself hang on
00:21:16,00:21:20,there's little animals that burrow themselves into the ice wall which are creating natural
00:21:20,00:21:25,handholds for me to do and apparently there's enough of these that she could scale 130. So it's
00:21:25,00:21:31,a little fish exactly the size of her finger which makes a little hole where it lives. The fish finger
00:21:31,00:21:37,yeah well the finger fish yeah yeah yeah and they make holes in the ice bag and she can use them to
00:21:37,00:21:42,grip onto and pull herself up. So she climbs up yeah I know it's blessed this is suddenly all the way up
00:21:42,00:21:48,all the way 130 feet. The fish living 100 feet up on the iceberg. 130. How did they get up there?
00:21:48,00:21:53,Who no I guess if the previous fish have gone up there. Icebergs flip over all the time.
00:21:53,00:21:57,Yeah don't know do we think what has there been cracks in the iceberg? Oh there's some cracks in
00:21:57,00:22:03,her story. And they all climb out this way 130 feet up and then they're back on the boat and
00:22:03,00:22:09,then they slip down the iceberg. And so they're sitting on the boat not long afterwards I think
00:22:09,00:22:13,they're having some drinks and some food and then suddenly they just hear screaming from other people
00:22:13,00:22:19,on the boat and there's huge cracking noises and basically there's been such a melting point on
00:22:19,00:22:24,the iceberg that it cracks in on itself and they go well if we were in there we'd be dead we'd be
00:22:24,00:22:31,squished in a second so then they go back again no they don't. But what a story. Yeah it is quite
00:22:31,00:22:37,quite an odd thing to choose to do with your life. You must have to have a very unusual
00:22:37,00:22:41,personality not to panic in all of these circumstances like she did one other dive
00:22:42,00:22:47,which she described and it was into a really really small cave so she's a cave diver
00:22:47,00:22:52,basically so underwater cave diver and she was taking a scientist down there with her who obviously
00:22:52,00:22:59,had been trained properly how to dive but the scientist got wedged in this tiny cave and panicked.
00:22:59,00:23:05,Luckily a tiny fish came and nibbled her out. And it was a really nice story because earlier
00:23:05,00:23:11,in the dive she had found that fish and it had a thorn in its fin yes and she pulled the thorn out
00:23:11,00:23:16,and then the fish came back to help her. Yeah okay it's not a Bronte novel it's this is a real life.
00:23:16,00:23:20,So she's wedged? She's wedged and they have a guideline which is the only way you can find your
00:23:20,00:23:25,way back to the entrance of the cave because you know it's full of other channels and tunnels and
00:23:25,00:23:29,stuff so you'll never find your way back otherwise. The guideline's broken which is the only thing to
00:23:29,00:23:33,lead them back to the entrance somehow and I'm not quite sure how Jill does this while she's
00:23:33,00:23:39,trying to fix the guideline she loses her partner who was previously wedged in a rock.
00:23:39,00:23:43,Yeah seems careless a bit of an oversight so she spends 73 minutes desperately looking
00:23:43,00:23:47,for her partner while trapped in this cave no idea if she's gonna escape. That's extraordinary.
00:23:47,00:23:53,And also thinking oh god I've killed this scientist how awkward. But imagine the moment and maybe it's
00:23:53,00:23:57,all worth it for this when finally she realized she has not only found her way to the entrance
00:23:57,00:24:02,but she sees a little glimpse of light but there is wasting at the entrance the scientists who
00:24:02,00:24:06,apparently her mask is just full of tears because the scientists assume that Jill's dead and she's
00:24:06,00:24:12,probably gonna die too waiting at the entrance for her and that's amazing. She was all right and she
00:24:12,00:24:16,said the weirdest thoughts go through your head like when she thought she was gonna die you think
00:24:16,00:24:20,things like oh my god I have to get home then my husband doesn't know how to do the taxes.
00:24:20,00:24:30,Wow that's an amazing story and also it's given me a new respect for the word guideline. Yeah
00:24:30,00:24:34,you know we're so used to hearing about the conceptual guidelines the theoretical ones.
00:24:34,00:24:38,Government guidelines suggest. Yeah exactly and actually guidelines can save your life.
00:24:38,00:24:43,I was reading about what Heinearth studies in the other areas of life because loads of loads of
00:24:43,00:24:50,cave diving particularly and have you guys heard of the Hallow Cline? No. So she studies animals
00:24:50,00:24:56,which are often found beneath the Hallow Cline and the Hallow Cline is a boundary between fresh
00:24:56,00:25:00,water which is higher up and salt water which is lower down and she says the boundary layer is as
00:25:00,00:25:07,thin as a sheet of paper but you can also see it when you're in the cave when you dive. So as you
00:25:07,00:25:13,go through it everything goes blurry for a second because you've broken the barrier between the two
00:25:13,00:25:17,kinds of water. Like going through a mirror which takes you to a parallel universe. It's exactly
00:25:17,00:25:21,like that it's exactly like that and then as soon as you get down to the salt water everything snaps
00:25:21,00:25:25,back into perfect clarity of focus and you look up and you can see the Hallow Cline above you.
00:25:25,00:25:31,But you meet the salt water version of yourself on the other side upside down. Yes yes yes and
00:25:31,00:25:41,then you have to climb using fishy ice hulls downwards. Early cave divers. The first UK cave
00:25:41,00:25:47,diver was in 1935 and potentially this is the first world cave dive. Quite late. That's what I
00:25:47,00:25:51,thought right? I read in a few places this was the world's first cave diving and then a few others
00:25:51,00:25:57,first UK. It happened at Wookie Hall and it was a lady called Penelope Powell and she did it with
00:25:57,00:26:01,a guy called Graham Balkam. I think that yeah I think it is in the UK because you find lots of
00:26:01,00:26:04,accounts of other people trying similar things around the world and usually you just attach a
00:26:04,00:26:08,hose to yourself and go deep in but definitely in Britain and it's thought of as the birth of
00:26:08,00:26:15,cave diving. Yeah it's like a proper sport basically. Yeah so Balkam actually tried going into a
00:26:15,00:26:21,different cave first and he made his own massively long snorkel out of a hose pipe and a woman's
00:26:21,00:26:29,bike frame and he almost died because that didn't work very well. So they upgraded their gear in
00:26:29,00:26:34,fact when he went down with Penelope Mossy Powell as she was called but it was... Sorry sorry let's
00:26:34,00:26:41,just go back to that a second. Penelope Powell her nickname was Mossy. Mossy? And is she a singer?
00:26:41,00:26:47,Her nickname was the thirties. Mossy Powell wow. Do we know why she had the nickname? She had just
00:26:47,00:26:54,hair on the southern side of her body. I'm not sure but I know that you would have gone along
00:26:54,00:26:59,very well with me. Anyway they then at that point would have a hard hat and that would be attached
00:26:59,00:27:03,to this hose called the Divers Umbilical which is a basically a combined breathing hose and phone
00:27:03,00:27:08,so that you could communicate with the surface. So they went into a hole and they went you know
00:27:08,00:27:14,many many chambers in a long way 170 foot they went in and the air pumps have to be manually
00:27:14,00:27:19,operated at the surface so they were actually broadcasting on local radio. I don't know why
00:27:19,00:27:26,they didn't make this national. Only local. We'll be right back with Wet Let Wet. You can tune in in
00:27:26,00:27:33,the Cheddar Gorge area it was an exciting time. Anyway so they were broadcast but their air would
00:27:33,00:27:37,only last about 50 seconds so they'd be saying it was Mosley Graham who did the talking to the
00:27:37,00:27:42,surface and then about every 50 seconds he'd have to say actually could I get some more air please
00:27:42,00:27:46,and then the people at the surface would have to pump air in. Just one more thing on the Wookie
00:27:46,00:27:52,Hole expedition you can actually see a painting that was done 84 years after the actual event
00:27:52,00:27:57,occurred and it was done by a guy who's called Philip Gray and he's an artist and he went down
00:27:57,00:28:04,into the place where she went so he dove down with his with his painting equipment and a light
00:28:04,00:28:10,and he did the painting down there it's the first of its kind. You have to explain how. So I'm guessing
00:28:10,00:28:15,this is because it was a bit odd. I'm excited to hear your guesses. Do you know the actual answer?
00:28:15,00:28:22,He went 19 feet down so either he went down and there's a cave system where he could pop up into
00:28:22,00:28:27,a dry bit and he could illuminate it so he had everything let's say in a plastic bag as a block
00:28:27,00:28:31,and then he painted the painting there put it put the painting in the bag and then came back up
00:28:31,00:28:35,which I'm guessing must be the way. He definitely painted it there he didn't go down take a photo
00:28:35,00:28:40,and then painted it. No he painted it down there. If you were to use water paints right but you use
00:28:40,00:28:45,salt water and you're in the you're above the hallow client you're above the hallow client might it
00:28:45,00:28:52,still work. Yeah yeah so I think it's gonna be pretty blurry painting. Is it possible the painting
00:28:52,00:28:57,is just absolute dog shit? It looks pretty cool actually. I think it looks good. I'm sorry I'm sorry.
00:28:57,00:29:04,I was looking at the world's deepest dive in scuba this is and it was by Ahmed Gabba in the Red Sea
00:29:04,00:29:15,in 2014 and he went 1090 feet down the dive took 13 hours and 15 minutes. What? The thing is 13 hours
00:29:15,00:29:20,50 minutes how much of that do you think he was going down? Oh not very much because you have to
00:29:20,00:29:25,slowly come back up because otherwise you'd get the decompression stuff. So he was going back up
00:29:25,00:29:32,for 10 hours of it. He went down for 15 minutes and then had to come back up for 13 hours and 35
00:29:32,00:29:36,minutes. It's like when you're driving along the motorway and it's incredibly clear the way
00:29:36,00:29:42,you're going and you can see the other side of the motorway. I'm only going down to the
00:29:42,00:29:47,station I've got to come back through that. And obviously if he went quicker then he'd get the
00:29:47,00:29:53,bends. He'd die. Do you know another thing that you can get from diving which isn't the bends and
00:29:53,00:29:59,isn't as dangerous as the bends but is nitrogen narcosis which sounds actually quite fun. It's
00:29:59,00:30:04,basically getting drunk and it's also known as the martini effect. Divers compare it to drinking
00:30:04,00:30:10,one martini for every 10 meters that you descend after 30 meters. It doesn't really seem to cause
00:30:10,00:30:16,much harm except to your judgement which can be a problem. Sorry so let's just work this out. So
00:30:16,00:30:25,after 30 meters every 10 meters it's one martini. This guy went 332 meters. It's basically like he
00:30:25,00:30:35,had 30 martinis. He was absolutely hammered. My limit is two. I think genuinely one of them
00:30:35,00:30:45,gets me pretty too. How do you like your martinis Mr. Bub? Oh yeah. This is fine. Where's the fucking
00:30:45,00:30:54,olive? Bubba looks at the empty jar of olives. It came with 33 olives. Wow. That's incredible.
00:30:54,00:31:00,It is. So there is a way to get around it if you don't want to be completely pissed 300 meters
00:31:00,00:31:04,"underwater. Oh you drink a small glass of milk before you go down, don't you? That just helps."
00:31:04,00:31:12,Big roast dinner and then pop down. No you use helium instead of nitrogen. So normally diving
00:31:12,00:31:19,"equipment, the gas that you have is oxygen and nitrogen combination and the the ratio depends"
00:31:19,00:31:24,on kind of what kind of dive you're doing but weirdly you can replace nitrogen with helium
00:31:24,00:31:28,and apparently we can kind of breathe that okay as well. They don't quite know why this doesn't
00:31:28,00:31:33,give you the narcosis but helium is less fat soluble and it seems like there's more soluble
00:31:33,00:31:37,the gas the more drunk you'll get and so I guess it's pretty bad though if you're in trouble it's
00:31:37,00:31:45,like oh boy oh boy oh boy could someone help me I'm really stuck I'm getting stuck dancing
00:31:45,00:31:57,in this ice pack. Okay it is time for fact number three and that is my fact. My fact this week is
00:31:57,00:32:04,that every cup of mint tea you drink contains the essence of a hundred insects. This is part of
00:32:04,00:32:09,a study which was done by Trier University in Germany a guy called Henrik Krehenwinkel he's
00:32:09,00:32:15,an ecological geneticist and basically what he was looking into is how can we monitor invasive
00:32:15,00:32:21,pests how can we see if a insect is going endangered around the world one thought that came
00:32:21,00:32:27,about is this new development which has been around for a bit now EDNA. We mentioned it years ago in
00:32:27,00:32:32,our book of the year 2019 where we talked about a New Zealand scientist called Neil Gamble going to
00:32:32,00:32:37,Loch Ness and trying to look for the dandruff of the Loch Ness monster. It's basically the idea is
00:32:37,00:32:41,that you take a little scoop of something whether it's like water I guess tea in this case and then
00:32:41,00:32:45,you look very very closely at all the molecules in it and you can find remnants of the DNA can't you
00:32:45,00:32:50,of other stuff that once passed through the scene. And the E stands for environmental so it's things
00:32:50,00:32:55,that have been in the area like you might have breathed on it and given some of your DNA to it
00:32:55,00:33:00,or yeah exactly so one of the things that they thought they would test out is could you tell from
00:33:00,00:33:06,taking a sample of tea from an area could you look through it with the EDNA method and work
00:33:06,00:33:12,out how many different species have been landing on the plants peeing on the plants chewing on the
00:33:12,00:33:18,plants doing whatever it is on the plants and if you could do that and you could get that information
00:33:18,00:33:23,then you could look to let's say plants that are hidden in museums from the same area from years ago
00:33:23,00:33:27,and you would be able to tell is there a decrease in the population is there an increase so clever
00:33:27,00:33:32,you could look at other it's an interesting way of then looking at how pesticides can travel
00:33:32,00:33:37,across the world on boats and so on and become a pest somewhere else you can then suddenly notice
00:33:37,00:33:43,by testing tea leaves from say barley you'd be like hang on a second there's there's a sudden
00:33:43,00:33:48,showing up of this invasive pest which they don't have here and they can get on top of it before
00:33:48,00:33:53,it then takes over is it clever or is it lazy is it just a scientist saying I could go to barley
00:33:53,00:33:59,or india and investigate this or I could pop to asda pick up some of these tips it could be both
00:33:59,00:34:03,can't it often the clever thing to do is the lazy thing because you're saving resources very good
00:34:03,00:34:08,point yeah but that but that is what literally they were doing they were popping to their local
00:34:08,00:34:12,grocery stores and they were just buying teas from around the world I think it's what's amazing
00:34:12,00:34:15,because they're Trier this university in Germany right that one of the reasons that this is such
00:34:15,00:34:19,a good place to study this is that Trier has a specimen bank and the role of the specimen bank
00:34:19,00:34:24,is just to collect leaves from different trees across Germany and they've been doing it for 35
00:34:24,00:34:29,years they've been doing it for decades I'm not sure what their original justification is in my
00:34:29,00:34:34,garden yeah they gave for a fee and they they freeze the leaves in liquid nitrogen so there's
00:34:34,00:34:39,this German specimen bank which is just a load of leaves in liquid nitrogen I mean it's insane
00:34:39,00:34:44,well and they've just gone we know this will come in handy one day and it has yeah it genuinely has
00:34:44,00:34:49,it's unbelievable yeah the reason the tea is so useful is that if you technically from a herbarium
00:34:49,00:34:54,you know it's a sort of samples of ancient plants that what they do is they keep leaves dark and dry
00:34:54,00:34:58,basically to keep them in a kind of suspended animation and that is basically the same process
00:34:58,00:35:02,as making tea because you're drying the leaves out you're shredding them up and you're just keeping
00:35:02,00:35:07,them in kind of suspended animation in a teabag and so that it's perfect to test that as opposed to
00:35:07,00:35:14,herbarium it's amazing and uh krem winkel this guy he says that straight elva hands christian
00:35:14,00:35:21,anderson novel yeah he said little boy little girl come to my tea and pour him now he's following
00:35:21,00:35:30,the trail of teabags I've left he said probably 99.999% or something like this of DNA which we extract
00:35:30,00:35:36,is the tea DNA and only a tiny fraction of what's left is from insects and he says which of course
00:35:36,00:35:43,is good for tea drinkers because they want to drink the tea and not the insects but he says
00:35:43,00:35:49,that actually it's quite good to know that there's some tiny bits of arthropod DNA because that shows
00:35:49,00:35:55,that they haven't used really loads and loads of pesticides yeah so that's kind of clever yeah and
00:35:55,00:36:01,if you want to try it yourself contribute to his research he claims that you can dry your own plants
00:36:01,00:36:05,now I don't know if he's actually accepting these specimens but he says if you want to dry your own
00:36:05,00:36:10,plants and I thought this was quite cool you just need you can get like a ziploc bag sourced from
00:36:10,00:36:17,some diver presumably and then you dry plants out by just popping in one of those weird silica
00:36:17,00:36:30,packets that you get inside oh I always eat those that's really funny um EDNA oh yeah it floats in
00:36:30,00:36:35,air you just take if you take an air sample there will be tiny tiny amounts of EDNA floating in it
00:36:35,00:36:40,so like if someone comes into this room later today after we've gone home yeah and they took
00:36:40,00:36:46,a jam jar of air they'd be able to get bits of our DNA pretty much yeah it's amazing it's amazing
00:36:46,00:36:50,but this led me on to another fact and this was actually sent to us by a listener recently called
00:36:50,00:36:55,Andrew Ferguson so thank you to Andrew for this and you might find this fact familiar but it's
00:36:55,00:37:02,that on a windy day in San Francisco Zoo strands of giraffe semen can be found floating on the breeze
00:37:02,00:37:07,yeah I remember that fact now that was posted on the qi boards by james 12 years ago
00:37:07,00:37:13,and it's based on an interview with a zookeeper at San Francisco and I followed the link to the
00:37:13,00:37:17,original interview with the zookeeper and it's no longer on the internet they'll have suppressed
00:37:17,00:37:22,that like billy though won't they because that will not do ticket sales any good but I bet that's
00:37:22,00:37:26,one of the facts that we must have posted a dozen times on the internet like that I've tried
00:37:26,00:37:31,about it because it's amazing yeah and it's just taken a life of its own yeah if you test the air
00:37:31,00:37:38,in a zoo yeah with a jam jar you can work out which animals are in the zoo by using e-dna
00:37:38,00:37:44,what how useful how incredibly useful I'm always going to the zoo and not being able to tell which
00:37:44,00:37:49,animals are there well you know for instance you could get go to a zoo get a jam jar get a load
00:37:49,00:37:56,of air close the jam jar take the air away go to a pcr laboratory and then it will tell you
00:37:57,00:38:03,they have giraffes there really interesting really as really useful for when the sign is down
00:38:03,00:38:07,yeah the giraffe enclosure london zoo's actually done away with the guides now they just hand you
00:38:07,00:38:13,a jam jar on arrival it would be an incredibly good kind of like crap alternate zoo it's just
00:38:13,00:38:17,the jam jar zoo it's the cheapskate parents visit to the zoo you don't cross the barriers you just
00:38:17,00:38:24,scoop it to the jar take it home with your kids and go look there's giraffes in here well um there
00:38:24,00:38:29,are two studies that have found this one in Denmark and one in England but one interesting part about
00:38:29,00:38:35,it is that you can not only tell which species are in the zoo but you can get DNA from the food
00:38:35,00:38:43,that's fed to the animals so if you're feeding your giraffe like vole sausages then it would
00:38:43,00:38:48,collect the DNA from the voles as well even though there aren't any voles in your zoo wow and then you
00:38:48,00:38:53,can get the zoo I presume shut down because that feels like it breaches some rules doesn't it
00:38:53,00:38:58,vol sausage that feels like it's an even better zoo now in the jar you know because you're getting
00:38:58,00:39:04,more you're getting more animals than you yeah yeah yeah I don't think does anyone does anyone eat
00:39:04,00:39:10,vole I've never there's not much meat on a vole I don't think no no it needs to be quite desperate
00:39:10,00:39:18,Heston's probably done it yeah um have you got other edna stuff I don't know good stuff cool great
00:39:18,00:39:26,I got some stuff about voles um there was an area of the UK where they used edna in the water
00:39:26,00:39:31,and they found that there must be some water voles there by looking at the edna oh yeah and then a
00:39:31,00:39:36,bit later they put a kind of video camera up and found that there was water voles there so it just
00:39:36,00:39:39,shows that it works great okay that's what I thought you were gonna say it was just giraffes having a
00:39:39,00:39:50,picnic I was looking at the relationships between tea and animals you know like tea pests and there's
00:39:50,00:39:55,actually certain types of tea which rely on tea pests to be made there's the tea green leaf hopper
00:39:55,00:39:59,which is one of the main attacks of the tea plant also has lots of other names it's called the tea
00:39:59,00:40:08,jacid or smoke boy or jumping boy and actually you get special tea which um waits for the tea green
00:40:08,00:40:13,leaf hopper to attack it because then tea releases these chemicals it releases very specific chemicals
00:40:13,00:40:17,depending on what it knows is attacking it and the chemicals it releases when it's attacked by this
00:40:17,00:40:23,creature actually make the tea taste quite nice so if you get it at the right time you get um for
00:40:23,00:40:28,instance something called dong ding oolong um tea which actually I think it's pronounced tongue
00:40:28,00:40:33,ting but I like the idea of changing the phrase ding dong yeah dong ding it's like you know what's
00:40:33,00:40:41,he called leslie philips if leslie philips goes through that layer of salt water he goes dong ding
00:40:41,00:40:49,have you need to know who leslie philips is if you don't know who leslie philips is then why are
00:40:49,00:40:56,you listening to this we can help you yeah anyway brownie it tastes like honey google hq's gonna
00:40:56,00:41:01,freak their nuts but they see the spike on leslie philips it's like you're on it's been a leslie philips
00:41:01,00:41:11,event um the shot hole borough is a teapest shot hole I said um it's latin name is eulacea
00:41:11,00:41:19,fornicatus oh dear do you know how it got the name fornicatus anyone can guess it was the only
00:41:19,00:41:25,was the first specimen found in the act of having sex was it shagging the scientist as he discovered
00:41:25,00:41:31,it no it's because the word fornicate means arch shaped doesn't really it does fornix in latin
00:41:31,00:41:38,means arch and so it's nothing to do with fornication as you guys thought apart from that the word
00:41:38,00:41:44,fornix also meant brothel because brothels were often found in vaults oh wow and that's why we
00:41:44,00:41:49,get the word fornication that's so interesting so if you're not actually in a vault it doesn't
00:41:49,00:41:58,count as fornicating I'm here in a legal loophole you're on it I present the flat roof
00:41:58,00:42:01,which exonerates my client
00:42:01,00:42:10,um one of the guys responsible for tea uh particularly asam tea was robert the bruce
00:42:10,00:42:16,that's it yeah specifically a Scottish man called robert bruce oh come on sorry
00:42:16,00:42:22,middle name there I don't know he's just robert bruce he was a Scottish man who was in India
