start_hhmmss,end_hhmmss,text
00:21:30,00:21:35,because the clay to build their houses they wouldn't have been able to carry that from
00:21:35,00:21:39,wherever that was to next to the fields to build their houses. So instead they had to carry
00:21:39,00:21:43,their corn back to their houses. So their houses are built where the building materials
00:21:43,00:21:46,are. It's annoying to have to make that kind of trade off.
00:21:46,00:21:51,But it's much lighter to carry corn than it is to carry a house but you've got to carry
00:21:51,00:21:55,the house once. Exactly. Oh it's tricky isn't it?
00:21:55,00:22:00,"And you put it on the back of one of those trailers. What trailer? I'm sorry, what?"
00:22:00,00:22:10,"Have you heard about the people who lived in the Old Dubai Gorge in Tanzania? No, no,"
00:22:10,00:22:14,yeah fair enough. This is supposedly where the oldest houses in the
00:22:14,00:22:22,"world are and they're 1.8 million years old. So that's 1.5 million years, 1.5 million years"
00:22:22,00:22:27,older than humans are. There's circles of stone which are... they're not lovely houses
00:22:27,00:22:31,"okay, because obviously they're 1.8 million years old. There are circles of stones and they're"
00:22:31,00:22:36,surrounding slight depressions in the earth in the middle and that's about there about
00:22:36,00:22:43,13 feet across these circles. And some cynics have said these are not houses because they're
00:22:43,00:22:48,just circles of rocks. But you think how do the rocks get into circles? We don't know.
00:22:48,00:22:53,And there's a theory that maybe a growing tree pushed the rocks outwards into a circle
00:22:53,00:22:58,"then the tree died and it leaves a circle of rocks behind. That seems unlikely. That's silly,"
00:22:58,00:23:03,"yeah. But we don't know, but we don't know, but it's theory. They had presumably roofs."
00:23:03,00:23:05,They weren't just circles of stone at the time. We think or were there because if I just
00:23:05,00:23:12,"put a strewed a few pebbles around me and then said look, I've built a house. I don't"
00:23:12,00:23:16,think I'm being employed by any architectural firms. It's tricky because there's no definition
00:23:16,00:23:23,really of what a house is. Yeah. I got a fact about trapdoors because this was about getting
00:23:23,00:23:29,"into a trapdoor. So Russo, the French writer, had a trapdoor in his office for whenever he"
00:23:29,00:23:36,had unexpected guests. Was it to drop them through? He pressed a button. It was to him to
00:23:36,00:23:41,"flee and they'd knock on the door and say, I want to see if Mr. Russo is in. Oh no, sorry."
00:23:41,00:23:47,He's pulling the rug back over him for the trapdoor. I don't know. It's basically that Mark Zuckerberg
00:23:47,00:23:51,"has that as well. Really? Yeah, yeah, yeah. Generally, wow."
00:23:51,00:24:00,"Russo just locked his door. It's not as cool, is it? It's not as cool as the trapdoor."
00:24:00,00:24:06,It's not as cool. They found a few years back what they think is the oldest door in Europe
00:24:06,00:24:11,"and they think it's 5,000 years old and it was found when archaeologists in Zurich were"
00:24:11,00:24:16,"digging, I think it was for a car park and they suddenly found this door. Do you know how"
00:24:16,00:24:23,"they dated it? Someone had put a letter in there and they looked at the postman. Oh, yeah."
00:24:23,00:24:30,"They counted the rings. It was a long shot. Yeah. What a wooden door. It had rings. Yeah,"
00:24:30,00:24:34,"so they were able to count. Very good. I thought you sensed. Yeah, because you'd only know"
00:24:34,00:24:39,"from when it was born, the tree, right? Oh, this is 12 years old. They could have carbon"
00:24:39,00:24:51,"dated it, I guess, right? Yes. It's obviously the yet. Wait, they must. They did. Did they count"
00:24:51,00:24:54,"the rings? They counted the rings, but the rings obviously"
00:24:54,00:25:02,"had, but the tree was chosen. I don't know who wrote this bullshit. I'll tell you what,"
00:25:02,00:25:07,"when we do it in the office, it's embarrassing enough. In front of a thousand people. I really"
00:25:07,00:25:12,"have to question what's going on at this head of mind. Should we, another door, another"
00:25:12,00:25:20,door thing? Yeah. Quickly move on. Some Native American tribes and actually I think some
00:25:20,00:25:26,"East African tribes used to have keyhole-shaped doors. And this, why do you think that is?"
00:25:26,00:25:35,"Of keys. They had really huge keys. Really big kind of dresses, and so it was the shape"
00:25:35,00:25:40,"of them. Oh, that's right. Oh, like a lady's loose sign, which goes out like that, like"
00:25:40,00:25:45,a keyhole. They didn't have houses. They just had a load of lady's lavatories. Right.
00:25:45,00:25:53,"I get it, no, you're all incorrect. They counted the rings. It's the opposite of wearing"
00:25:53,00:25:58,"dresses. It's either, it's like if they were wearing dresses, but upside down. It's keyhole"
00:25:58,00:26:02,"shape because the top is much wider, and it's because people usually wouldn't want to carry"
00:26:02,00:26:07,"big bundles on their heads. And then when they're entering their house, the top is wider"
00:26:07,00:26:10,so that they can fit those bundles through. But you don't want to let all the heat out
00:26:10,00:26:16,"of your house. And so the bottom is much narrower, so you can have heat, very cool. We need to"
00:26:16,00:26:22,"move on to our final fact. Okay, it is time for our final fact of the show, and that is James."
00:26:22,00:26:29,"Okay, my fact this week is that the red triangle slug can escape from frogs by supergluing them"
00:26:29,00:26:37,"to trees. Ah, so cool. It is really cool. So I read the story in New Sciences quite recently."
00:26:37,00:26:49,There was a guy called John Gould from the University of Newcastle in Australia. And he
00:26:49,00:26:55,"made the discovery when he spotted a frog stuck to a tree. And there was a slug next to it,"
00:26:55,00:27:01,presumably kind of rubbing his hands with glue or something. And he cut a bit off the tree.
00:27:01,00:27:11,"He looked how old it was, and then he took it off. I believe it was. And then he took the frog"
00:27:11,00:27:15,"back to his lab, and he left it there for a while to see if it would get free, and it really"
00:27:15,00:27:21,"didn't. Eventually they prized it free, and they put it in a like a little container, and"
00:27:21,00:27:26,then it kept getting stuck to the sides of the container. And it turns out that this slug
00:27:26,00:27:31,"can get this kind of mucus, and it normally has a nice like slippery mucus that it can"
00:27:31,00:27:34,"travel on, but it can also make this really, really sticky mucus."
00:27:34,00:27:40,"Wait, so why did they get the frog? Did they then interview the frog? Would they tell us"
00:27:40,00:27:46,"how this happened? I was just trying to catch a slug, and it got all over my feet."
00:27:46,00:27:50,"But it is so weird, because it's so weird that the slug, because this is an amazing defense"
00:27:50,00:27:54,"mechanism, once it's superglue the frog to the tree, as you said, it just kind of hangs"
00:27:54,00:28:00,"out next to it's the thing that it slugged up. Wow, that is awesome. And it last days"
00:28:00,00:28:05,"doesn't it? Yeah, the glue. So they do get off, but it is a couple of days of what must"
00:28:05,00:28:11,"be horribly embarrassing sort of. Do the slugs invite their mates? Yeah, the other frogs"
00:28:11,00:28:14,"must be like, we're going to go catch that cool frog movie. Do you want to come? I'll be"
00:28:14,00:28:19,"there in a minute. You didn't get stuck, did you? I don't know, it feels like that would"
00:28:19,00:28:25,"be a thing. Yeah, probably. So this mucus is really good, because it's a very unusual"
00:28:25,00:28:32,"thing in that it's very glowy and very sticky, but as it gets wetter, it gets stickier. And"
00:28:32,00:28:36,"this is something that doesn't really happen usually when things dry out, they get, or they"
00:28:36,00:28:40,"adhere more. Like if you think about super glue, when it dries out, it's much more sticky."
00:28:40,00:28:44,"So this works better in wet conditions, and they think we might be able to use it, humans"
00:28:44,00:28:49,"might be able to use it for like fixing wounds, or there are similar ones that they use"
00:28:49,00:28:54,"to kind of put in people's hearts. If you have a lesion in your heart, you can hold"
00:28:54,00:28:57,"that together, because obviously a lot of blood around there and it works there. So this"
00:28:57,00:29:01,might be really useful for us in future. Or blasters that don't fall off in the sea.
00:29:01,00:29:09,"Yes. That's amazing. I'm down with, I'll fund that research. That is weird. That's why"
00:29:09,00:29:12,"when you get a slug slime on your hands, don't put water on it to wash it off because it"
00:29:12,00:29:17,"just makes it worse. Really? Is that right? Yeah, yeah, yeah. Oh, yeah, because slug slime,"
00:29:17,00:29:26,"it can kind of suck up water into it. So it just gets bigger. It drinks the water. Yeah,"
00:29:26,00:29:31,"it can do. So if you think about a slug, they like to be wet, don't they? They like to"
00:29:31,00:29:36,be moist. But then they're always giving out this slug slime all the time. So you think
00:29:36,00:29:40,they would just dry out. But what actually happens is some of that slug slime can take
00:29:40,00:29:43,"in the water because it just gets loads and loads of water in it, and it can actually"
00:29:43,00:29:48,almost drink through this slime. It's crazy. I was reading about banana slugs. They have
00:29:48,00:29:55,"a thing where sometimes when they have sex, the slime itself is so sticky that the male"
00:29:55,00:30:01,slugs penis will get stuck in there. And because it's just too sticky. So their only option
00:30:01,00:30:07,is they bite it off and just leave it. This is where Anna's German guy at the festival
00:30:07,00:30:19,got as ideas from. It's too sticky. It's got to go. Oh God. Yeah. Really? But they do sometimes
00:30:19,00:30:26,"bite each other's penises off anyway, I think. They're not really supposed to, but it's considered"
00:30:26,00:30:33,root. Sorry about it. I wasn't meant to do that. So they're all amaphyridites on this
00:30:33,00:30:36,"slug. So which is good. That means when they have sex, then both can go away pregnant,"
00:30:36,00:30:41,"which is nice. But they will at the end, you have to scamper really fast. Otherwise, your"
00:30:41,00:30:46,"partner might bite off your penis, which is a bit scary. But the best slug mating actually"
00:30:46,00:30:51,"is the leopard slug mating, isn't it? Because the leopard slug has sex while upside down"
00:30:51,00:30:57,hanging from a branch. And the reason it does this is because it's penis is so big that
00:30:57,00:31:09,it needs to use gravity to unroll it. We've all tried that line. My Tinder profile was me
00:31:09,00:31:16,"hanging upside down from a tree. I think you know what this means. This is amazing, though."
00:31:16,00:31:20,"They'll climb up a tree, two slugs on the side of their mating, and then they produce"
00:31:20,00:31:26,slime that can solidify really fast. So it acts like a bungee cord. So they drop down
00:31:26,00:31:31,"off a branch hanging from their slime. And then they unfold these penises, which are almost"
00:31:31,00:31:36,"as big as they are. They're really, really long. And they intertwine their own slug bodies,"
00:31:36,00:31:40,"which looks quite nice like a plant. And then they intertwine their own slug penises, which"
00:31:40,00:31:44,are sort of basically like extra slugs in the end if you look at it. It looks quite nice.
00:31:44,00:31:50,"And then they have sex. You've got such a low bar for what counts as nice, and I like"
00:31:50,00:31:55,"that. It's very pretty. And then when they're done, they eat their way back up the rope."
00:31:55,00:32:03,"Wow. Oh, that's a bit you're disgusted by. He got some weird standards in your castle."
00:32:03,00:32:07,"Oh, what I'm thinking of is that seen in Mission Impossible, now, where he's, is he slowly"
00:32:07,00:32:12,lowers himself down the rope? If he'd got his knob out at the bottom of that rope.
00:32:12,00:32:23,"What are you doing, Ethan? Sorry. I'll eat the rope and come back up."
00:32:23,00:32:30,"There's a thing that I like as well, just on the biting off of penis bed."
00:32:30,00:32:38,"Well, it's about losing body parts, and there's a thing that some slugs can do. There's sea"
00:32:38,00:32:42,"slugs that do this, certain sleas slugs, and there's tail dropper slugs. And what they do is,"
00:32:42,00:32:47,"if there's predator coming towards them, they basically just rip off a bit of their body"
00:32:47,00:32:52,in the tail dropper. It's the tail. And they use it as a decoy bit of bait. So they'll
00:32:52,00:32:57,"be like, go have that. And so the predator will eat that because it's not moving. And while"
00:32:57,00:33:02,"they're munching on the bit of that body, the rest of them can get away. It's not exactly"
00:33:02,00:33:06,right there. I think we mentioned there's a scorpion that does that.
00:33:06,00:33:11,"Oh, yeah, there is one. It breaks off its tail. Well, the problem is it breaks off its anus."
00:33:11,00:33:16,Yes. And then it can't poo anymore. And it can't have a poo ever again. And the poo
00:33:16,00:33:19,just sort of builds up in its body because it's thrown away its tail. So it doesn't get
00:33:19,00:33:24,"eaten, but then three days later it dies of constipation. Yeah. Does it really? Yeah. They"
00:33:24,00:33:29,"don't explode. Yeah, they do die. I wonder if they regress it. I guess you've, you've"
00:33:29,00:33:33,"then, it's then like another mission impossible film. You've got three days left to pass on your"
00:33:33,00:33:40,jeep. But it's quite hard to attract female scorpions because you're getting bigger and
00:33:40,00:33:46,"bigger full of poo. Yeah. Yeah. So that's an exciting pitch, I think, for a film. Ethan"
00:33:46,00:33:58,Hunt has thrown away his own ass. So I've actually been looking at glue and gluing things. Do
00:33:58,00:34:04,"you, because it was about, because it was about glue. So do you remember the guy who, who"
00:34:04,00:34:12,glued himself to Gordon Brown's sleeve? Politics was a lot more fun in those days. There was
00:34:12,00:34:18,"a guy called Dan Glass, and he was an environmental campaigner. He was from a campaign group called"
00:34:18,00:34:23,"Plane Stupid. And he got invited to a reception at Downing Street in 2009 and he thought, now's"
00:34:23,00:34:28,"my chance. And he, so he thought, I'm going to do it. I'm going to glue myself to the Prime"
00:34:28,00:34:35,"Minister to make a point about climate change, fair play. And he said, I was saying to Gordon"
00:34:35,00:34:41,"Brown, you can run away from climate change, but you can't run away from my arm. And, and"
00:34:41,00:34:46,he glued up his hand and he did it. He managed to grab Gordon Brown's sleeve and superglued
00:34:46,00:34:51,"himself to the Prime Minister inside Downing Street. However, the PM managed to outfox him"
00:34:51,00:34:59,"by the relatively simple method of taking off his jacket. Okay, that's it. That is all"
00:34:59,00:35:03,of our facts. Thank you so much for listening. If you would like to get in contact with any
00:35:03,00:35:07,"of us about the things that we've said over the course of this podcast, we can be found"
00:35:07,00:35:13,"on our Twitter accounts. I'm on @SriberlandAndy, @AndyHunterM, James Harkin, and Shazinski."
00:35:13,00:35:17,"You can email us at QI.com. Yep, you can go to our group account, which is @NoSuchThing"
00:35:17,00:35:22,or our website. NoSuchThing is a fish.com. We have everything up there from upcoming tour dates
00:35:22,00:35:27,"to merchandise to all of our previous episodes. Thank you so much, Newcastle. We'll see you"
00:35:27,00:35:29,again. Good bye!
00:35:29,00:35:33,[Applause]
00:35:33,00:35:35,(upbeat music)
00:35:35,00:35:45,[BLANK_AUDIO]
