start_hhmmss,end_hhmmss,text
00:21:36,00:21:42,"Anyway, to raise this obelisk in the Vatican in 1586, it used 800 men, 140 horses,"
00:21:42,00:21:48,"and the best details, spectators were ordered not to speak or make a noise on pain of death."
00:21:48,00:21:52,Oh god. Because hundreds of people were watching this very delicate operation.
00:21:52,00:21:56,Like watching Snooker. It's like watching Snooker. And it was apparently enforced.
00:21:56,00:22:02,"Seymour Cray was there. Will you shut up? Oh, I want to see more Cray."
00:22:05,00:22:10,So was the reason because like often you can't make noise because there's someone
00:22:10,00:22:14,"drumming to make sure everyone goes in the right. It might have, it might well have been that."
00:22:14,00:22:19,I don't know whether it was that or just like a mistake from distraction could have been
00:22:19,00:22:24,"fatal. You know, but yeah, sounds exciting. One last thing on Cray and Cray. In 2005."
00:22:24,00:22:31,"Well, for these things are Cray and Cray. Which one are we talking about? Mechanical Cray."
00:22:33,00:22:36,"This is just a crazy story. It happened in London, south London, 2005."
00:22:36,00:22:44,15 year old girl was found on a crane at night 130 feet above the ground. Riddle me this.
00:22:44,00:22:50,"Well, sleepwalk is the obvious one. She was asleep. She's like, she'd sleepwalked up there and a passer-by"
00:22:50,00:22:54,"had seen someone up there called the authorities and then a fireman went up, crawled out,"
00:22:54,00:22:59,"found her there asleep. Didn't know how to wake her up because thought if I wake her up,"
00:22:59,00:23:07,she might panic. Where was she asleep? I seem to have a vague memory of the story that she was on
00:23:07,00:23:14,"the weight on the other side. It's not even like she was in the cabin bit. No, no, no. She was quite"
00:23:14,00:23:23,not that. Quite not. So it seems like he got her phone out of her pocket and called her parents
00:23:23,00:23:29,"from the phone and said, can you ring back so that I can so that that'll wake her up. How did he get"
00:23:29,00:23:35,her log into her foot? Did he lift up her head and hold the camera in front of it? It's 2006.
00:23:35,00:23:39,"It was a simpler time. It was a simpler time. What if you still had codes on first, did you? Maybe."
00:23:39,00:23:43,"Well, anyway, it was all fine in the end. How do you navigate that opening sentence with the"
00:23:43,00:23:54,parents? Yes. I'm on a crane. A crane crane? Crambrees are named after cranes. Really?
00:23:54,00:24:00,"Crane berries, yeah. The organic crane. Lovely. Because the plant stamens look a bit like the"
00:24:00,00:24:06,"beaks of cranes. Geraniums are named after cranes. Wow. From the Greek Geranus, meaning crane,"
00:24:06,00:24:13,because their seeds look like the crane bills. The Dutch word for geraniums is a stalk beak.
00:24:13,00:24:21,"Stored bill. That's quite similar to that. Pedigree, the word pedigree also comes from the word"
00:24:21,00:24:28,"for crane, the Geranus. That's because the foot of a crane has bits that stick out. When you draw"
00:24:28,00:24:36,"like a family tree, you have bits that stick out. Pediggeranus, foot of a crane. That's really nice."
00:24:36,00:24:40,"Oh, I love these etymology things that suddenly remove the blanket for something."
00:24:40,00:24:49,I love it. That's great. The crane is called a crane because of the noise. They have their
00:24:49,00:24:56,"migratary birds that use the right amount of syllables. Yes, migratary birds. And so they fly over"
00:24:56,00:25:00,"Belgium and Holland in huge groups, sometimes thousands of them. They're quite high up. They have"
00:25:00,00:25:08,have these long necks and then you can hear... they make this crane crane. And so if you want to finish
00:25:08,00:25:12,the etymology the machine is named after the bird and the bird is named after the sound it makes.
00:25:12,00:25:21,And in Belgium we also say crane to tap water tap faucet because they also have... well they used to
00:25:21,00:25:28,"have this vertical piece and then the horizontal piece like a pump. Cranes, Britain's tallest bird."
00:25:28,00:25:34,"What are we talking? Oh nine, ten, twelve feet. That big. Are they? Why have you put them on a hill?"
00:25:34,00:25:40,"Yeah, four feet or something. One one we did twenty something. Yeah, that is four feet."
00:25:40,00:25:45,But they're making a comeback across the UK which is very nice because they were
00:25:45,00:25:52,hunted and eaten to extinction of the UK. Also drying out wetlands. A lot of that went on in
00:25:52,00:25:56,"the Middle Ages and that really damages the habitats. People at cranes, I've never heard of that"
00:25:56,00:26:00,people eating cranes. Apparently they're... I'm afraid to say they're absolutely delicious.
00:26:00,00:26:07,"Well they certainly were in the 14th century when the food was a bit less nice. But no,"
00:26:07,00:26:13,in 1465 there was a new archbishop of York and 204 cranes were roasted to celebrate the fact
00:26:13,00:26:20,"at the feast. Right. And then by 1600 miraculously they were extinct. But they're back,"
00:26:20,00:26:25,they're back and it's partly because of random pair got blown off course as you were saying
00:26:25,00:26:30,leave and they're migratory. In 1979 they got blown off course they ended up in the Norfolk
00:26:30,00:26:35,Broads. And now there are maybe a couple of hundred and lots more breeding pairs which is obviously
00:26:35,00:26:41,"the main thing. And there's a place in Suffolk where they are breeding. An RSPB site,"
00:26:41,00:26:46,Royal Society for the Protection of Birds. And to help them breed the staff have cut runways
00:26:46,00:26:52,"for them in the grasses, in the reeds just to help them take off and land safely. With the light"
00:26:52,00:26:56,"and everything under control and the guy with the ping pong bats. We've got five cranes,"
00:26:56,00:27:03,got three or five faster. Look out you got a bump into a crane. What kind of crane? A crane crane.
00:27:03,00:27:10,Small fact about the light-hearted topic of eating birds into extinction.
00:27:11,00:27:25,"I, this week, I personally ate the stalk into extinction. No, I held with my hands the very last"
00:27:25,00:27:34,"great ock that ever walked on this earth. Really? It was strangled in 1844 on L.A., an island in Iceland."
00:27:35,00:27:43,"And so great orcs got really rare because they can't fly so people used to eat them. And back then,"
00:27:43,00:27:49,"like 19th century, if an animal became really rare, it became super expensive because all the"
00:27:49,00:27:53,collectioners wanted one. It's amazing. I read an article about this where it's like it would
00:27:53,00:27:58,become well known that there was an animal that they were about to go extinct. And what people thought
00:27:58,00:28:03,"was not shall we save them. They were like, this is our last chance to catch one. And so these"
00:28:03,00:28:07,Icelandic sailors could make a nice buck out of strength. You have to strangle them because
00:28:07,00:28:16,all the ways you damaged the meat in the skin. So they know that the last great ock was killed on
00:28:16,00:28:22,that island. The intestines were capped at Copenhagen and for a long time they didn't know where the
00:28:22,00:28:28,skin ended up. And then they did genetic testing on the intestines and on all the 67 great orcs that
00:28:28,00:28:35,are in museums and it's in Brussels. So they found out this is the very last great ock that ever lived.
00:28:35,00:28:42,"And it's now up there. It's in a place called, well, it's our national institute for natural"
00:28:42,00:28:52,"science. They have a huge collection of taxidermy. They have one million mammals, birds, amphibians,"
00:28:52,00:28:57,"reptiles. And then they have, I think, 30 million if you count all the insects with it."
00:28:58,00:29:04,And they have this separate room for extinct species. That is extra secured because they are very
00:29:04,00:29:12,"valuable. I met one of the conservators there. And almost weekly, he makes the sad walk with a new"
00:29:12,00:29:20,"species to the extinction. This is, I want to film this one day, this weekly walk of getting the"
00:29:20,00:29:24,"phone call like, yeah, you know, that bird over there in that island. Well, extinct now put it in"
00:29:24,00:29:30,"it, put it in the special room. And then you have to take an animal to the extinction room."
00:29:30,00:29:33,That's so sad. It is. You got anything funny to end the section? No.
00:29:33,00:29:44,"Okay, it is time for fact number three. And that is Andy. My question is, a single gram"
00:29:44,00:29:54,"of silica gel has an area of 800 square meters. Okay, strap it everyone. This is so much fun."
00:29:54,00:29:58,"You're about to go on the right of your life, guys. There's a fantastic website called Scope of"
00:29:58,00:30:02,"Work. It's really good. It's amazing essays about all sorts of stuff. You know, the silica"
00:30:02,00:30:09,"gel, the little packets do not eat, right? They often come in one gram packets. And they're to dry"
00:30:09,00:30:13,"things out, right? They're to dry things out. They'll be in your shoes when you buy them all. Exactly."
00:30:13,00:30:20,Or a bit of furniture or whatever. And that stuff in there is silica gel. And the reason it's amazing
00:30:20,00:30:28,"at drying things out is that when you zoom in on it, it's not like glass, which is silicon,"
00:30:28,00:30:35,"silicon dioxide. It's much less dense than glass. Silica gel is full of these tiny, tiny, tiny"
00:30:35,00:30:40,"pores. So they're 2.5 nanometers across, which is the width of one strand of DNA."
00:30:40,00:30:47,"But these little balls of silica gel are so riddled with these voids, these holes everywhere,"
00:30:47,00:30:53,that one gram of it has an internal area of 800 square meters. So that's 4 tennis courts.
00:30:53,00:31:00,"They're absolutely amazing at taking on their own weight and water vapor, because it all condenses"
00:31:00,00:31:05,"in their tiny capillaries. So that's why they're so effective. And when you're a, you know,"
00:31:05,00:31:10,"shoemaker, for example, you're trying to say they will say silica gel sellers, how big do you"
00:31:10,00:31:15,want to keep dry? How big an area? How big a volume? And how dry do you want it to be? What's the
00:31:15,00:31:20,maximum moisture you want inside the shoebox? Yes. And they can just gear it exactly because they know
00:31:20,00:31:25,"how much silica gel can absorb. It is pretty amazing. I mean, we all know these packs. We've all"
00:31:25,00:31:31,got them in various items that we've bought. The say do not eat on it turns out that's not because
00:31:31,00:31:36,"as everyone assumes that they're toxic, they're not toxic, they're delicious. They're like the"
00:31:36,00:31:42,"grains. I remember when the Archbishop of Durham came on a few years ago, they had 200,000"
00:31:42,00:31:49,"silica gel packets. So don't eat them, but it's largely for the packet, isn't it? To say,"
00:31:49,00:31:54,"don't eat, it's a choking hazard. It's very fun. We have to say don't eat them, because obviously"
00:31:54,00:31:58,"we're not recommending people eat silica gel, but it doesn't seem like actual. I don't think it"
00:31:58,00:32:05,"would be any good for you, because it would absorb all the water, sorry, it would absorb all the water,"
00:32:05,00:32:10,because it doesn't absorb. Absorb is like a sponge. You get the water goes inside of it.
00:32:10,00:32:15,"Absorb means that it sticks to the outside of it. It's really weird. But the outside is on the inside,"
00:32:15,00:32:21,"precisely. Of the silica gel. It's like a weird net thing. But anyway, so yeah, if I think if you"
00:32:21,00:32:25,"did eat a few of them and you had swallowing problems already, I don't think it would be that good."
00:32:25,00:32:29,"Yeah, definitely. It's not like, you're not going to, people won't find an ancient Egyptian mummy."
00:32:29,00:32:33,"If you, if you, have accidentally swallowing a tiny bit of it, it's not like it dries you into your"
00:32:33,00:32:40,past. An amazing assassination method. Like the end of Indiana Jones. That's how they
00:32:40,00:32:46,achieve that effect. All of these telluses have got a bit of silica gel in them apart from one.
00:32:46,00:32:54,We should say that the only potential reason you should need them is that some of the beads
00:32:54,00:32:58,"might have a little moisture indicator, like which is to indicate when they change color, like"
00:32:58,00:33:03,"color chloride, which could be dangerous if you ate enough of it. Yeah, don't just don't eat them."
00:33:03,00:33:07,Don't eat them. It says don't eat them. It says don't eat them. Take your advice from the packet and
00:33:07,00:33:13,"I'll remind you that you'll be fine. But one thing you could do, which I don't, I see that I get"
00:33:13,00:33:17,"scared. It's toxic, chuck it in the bin. Yes. Actually, collecting them is quite useful because they"
00:33:17,00:33:22,"can be used that aren't to eat. Not to eat. No. Sorry, but we've covered some pretty nerdy"
00:33:22,00:33:29,collections. Surely there are collections. It's not for the sake. It's not like a stamp collection.
00:33:29,00:33:35,"It is for if you drop your phone in the toilet or the bath. Instead of putting it in rice,"
00:33:35,00:33:40,put it in a box full of these little packs and it's going to probably act better than the rice.
00:33:40,00:33:44,So they have their they have their uses. Apparently they're great for defogging windshields as well.
00:33:45,00:33:53,Just chuck your hundred silica packs you've saved. I've heard musty smells of books. Yep. It
00:33:53,00:33:59,add dissolves all of the musty smell. Rust in toolboxes. If you've got like a slightly damp
00:33:59,00:34:02,"garage or something, just pop a bit of that in. Allegedly, if you have a big enough packet,"
00:34:02,00:34:08,you can deodorize your laundry. But why don't we collect them and use them to lower the sea levels
00:34:08,00:34:15,again? Oh yeah. Yeah. Yeah. The thing with these numbers is that people have no idea of how small
00:34:15,00:34:23,atoms are. Yeah. It's just crazy. We can't get our head around it. I used to have an example in
00:34:23,00:34:29,"my show on genetics. I talked about Julius Caesar, who bled to death. Let's say he lost one liter of"
00:34:29,00:34:34,blood. You take one glass of water like I have in front of me. What is the chance that I have a
00:34:34,00:34:40,molecule in here and H2O molecule that literally exited a wound of Caesar as you bled to death?
00:34:40,00:34:44,"It's about 2000 in each glass of water. Wow. Well, you definitely have that in there. Yeah."
00:34:44,00:34:51,"That belongs to the museum, man. Yeah. Well, the thing is that there are a lot more H2O molecules in"
00:34:51,00:34:57,a glass of water than there are glasses of water on earth. But so how much of history is sitting in
00:34:57,00:35:02,that glass right now that everything from the beginning of the planet. Dinosaur piss. Dinosaur piss.
00:35:02,00:35:07,"Oh, a lot of dinosaur piss. That's what I always, that's what I always tell the homeopats. Like"
00:35:07,00:35:12,diluted dinosaur piss. Yeah. But maybe it turns out that actually dinosaur piss is the secret
00:35:12,00:35:17,panacea medicine. And they've been right all this time. Who knows? Yeah. Yeah. I didn't know. I've
00:35:17,00:35:22,been drinking Hitler piss. There's some Dalai Lama piss in there too and some Magandhi piss so it
00:35:22,00:35:29,kind of evens out. Okay. Here's something you can do with silica gel. You can make opals out of it.
00:35:29,00:35:39,So the cars or the stones? The stones. All the fruits. Yeah. Now the stones. Basically opal is made of
00:35:39,00:35:46,silica. But it's dehydrated and it's compressed by nature. But you can make opals in the lab by getting
00:35:46,00:35:52,"a load of silica gel, putting it in water, leaving it for weeks and weeks and months and months until"
00:35:52,00:35:57,it all sinks down and stacks itself perfectly. And then you remove all of the water and it's in a
00:35:57,00:36:03,"perfect lattice. And that's how you make lab made opals. That's very cool. This is the same material,"
00:36:03,00:36:09,"basically, in a different crystal structure. When you start zooming in enough like this,"
00:36:09,00:36:16,everything gets a bit weird. I find like this stuff. Silica gel was first created in the early 20th
00:36:16,00:36:22,century by a researcher at Johns Hopkins University called Walter Patrick and he created it out of a
00:36:22,00:36:30,"material called water glass, which as far as I can tell is water soluble glass. Okay. That's not"
00:36:30,00:36:35,"very useful. What is construction? Quite hard to have a glass. That just feels like sandy water,"
00:36:35,00:36:39,"doesn't it? I think if you pour the, if you pour, if you have a glass of this stuff and you pour some"
00:36:39,00:36:45,"water in, it dissolves, which is a good prank. There's nothing else. But I just, I find it so bizarre"
00:36:45,00:36:51,"that this exists and there's an amazing 1930 paper, The Story of Silica Gel, which I've read too much"
00:36:51,00:36:57,"of, is by the main silica gel making company, basically. And it begins. I just like, people really"
00:36:57,00:37:03,"knew how to write science in the old days. Oh, so it wasn't very dry. Oh my god."
00:37:03,00:37:15,Walk right into that. You said it up yourself. I know. I know. I left the rake out. The story of
00:37:15,00:37:19,"silica gel, just listen to the way this begins. All right. Someday, the true history of mankind will"
00:37:19,00:37:24,"be written, a history that will treat not the struggle of man against man, but of the epic struggle"
00:37:24,00:37:31,"of man against the forces of nature. One great force of nature is oxidation, the intimate union of"
00:37:31,00:37:36,"oxygen and carbon producing combustion, combustion produces heat and primitive man. So this is about"
00:37:36,00:37:41,"silica gel. It's great. Wonderful. It's so good. It's Lord of the Rings-style science. It really is,"
00:37:41,00:37:47,"though, isn't it? Yeah. One of us uses way more silica gel than the others. Can you guess? Is it"
00:37:47,00:37:52,"me because there's a K-pop band called silica gel? That's not the reason. But it is you. Oh, well,"
00:37:52,00:37:58,I think I know why. Go on. I think just through my research. Yeah. I think it's James because of his cat.
00:37:58,00:38:07,"Yes. Okay. Oh, that's how I dry her. But that in the rain. In there with the shoes now."
00:38:07,00:38:17,"Don't eat it. It's cat litter. Cat litter, cat litter. Yeah. I think we've been used it so world"
00:38:17,00:38:24,"one after the invention by Walter Patrick, it was used in gas masks. Yeah. Yeah. Salt shakers"
00:38:24,00:38:30,used to use it in the cap. You would put little bits of it so that the salt wouldn't dry out. Clump up.
00:38:30,00:38:33,"Yeah. So it doesn't clump up because people would put bits of rice in there, right?"
00:38:33,00:38:37,But you would actually put little silica inside the top of salt cap. I'm going to put some in my coffee
00:38:37,00:38:42,tin when I get home. Do not eat. I'm sorry. How many times do we have to tell you? But am I allowed to
00:38:42,00:38:49,drink it? You sounded like a health and safety dog like there. Do not eat. I just imagine that you
00:38:49,00:38:53,put it in your coffee and you pour the water in your coffee and all the water's gone.
00:38:53,00:39:04,Three capsules in here. You can do that with the powder from diapers. It's a typical magic
00:39:04,00:39:09,"trick that you do in science shows. You take like three cups, like non-transparent cups, like"
00:39:09,00:39:15,"paper cups. And in one of them, you put the powder that is inside a diaper, like a baby diaper."
00:39:15,00:39:21,You put it like one or two centimeters at the bottom and then you pour water in all three of them.
00:39:21,00:39:25,"And if you take the one that had the powder, you can turn it around over your head and"
00:39:25,00:39:31,nothing will come out because it absorbs or add soaps. But it also sticks to the sides.
00:39:31,00:39:37,It turns a little bit white or something and I've seen people use it as fake snow bastard.
00:39:37,00:39:40,Really? Don't eat the yellows now though.
00:39:40,00:39:53,I had one more thing about these one atom layers. Oh yeah. Like graphene. So graphene is
00:39:53,00:39:59,stuff that is made of one layer of carbon atoms all in hexagonal shapes.
00:39:59,00:40:06,It's the stuff that your pencil is made of. So you're writing with graphene. And the
00:40:06,00:40:12,"cheapest way that they made one layered graph, it's very difficult to make something of one atom thick."
00:40:12,00:40:19,The cheapest way was with sticky tape. You just put sticky tape on a pencil and you rip it off
00:40:19,00:40:22,and then you put sticky tape on the sticky tape and you rip it off again and you keep going
00:40:22,00:40:26,until there's just one layer left. It's got a low tech way to make to make graphene.
00:40:26,00:40:31,This is silly question. How do you get off the sticky tape? I do not know. I think you study it
00:40:31,00:40:37,"on the sticky tape. Oh okay, so there's not for production. No. No. Then you put electricity on it"
00:40:37,00:40:45,"in there. Yeah. We've met Andre Geim. Yeah. Discovered it, I think. But he won a Nobel prize for"
00:40:45,00:40:53,it definitely and he also won an ignoble prize for levitating frogs. Yes. That's right. He was
00:40:53,00:40:57,at his university and there was a giant magnet and he was walking past it one day. And I think
00:40:57,00:41:04,"on a whim, he chucked a ham sandwich and just to see if it would float and it did. So then he"
00:41:04,00:41:09,"he misses how these people cut like putting a sausage in space, putting a ham sandwich in a magnet."
00:41:09,00:41:14,"You know, these ideas, they seem stupid at the time. We do the impossible. And then 30 years from now,"
00:41:14,00:41:17,"we get the call from the Nobel committee and it's like, yeah, thought that would happen"
00:41:17,00:41:28,later. It was the egg Nobel prize. He won for that one. The Nobel prize. The guy who does the egg
00:41:28,00:41:34,"Nobel prize, it sounds incredibly serious. He's the opposite of the Swedish chef. My favorite"
00:41:34,00:41:40,ignoble prize is also has to do with surface was mathematics. I think it was 2002. Ignoble
00:41:40,00:41:46,prize in mathematics for an Indian researcher who calculated the entire surface if you were to
00:41:46,00:41:53,fold an Indian elephant open. Yeah. So what is the surface? What is the surface of an Indian
00:41:53,00:41:57,elephant if you were to fold it open? What do you mean by that? Yeah. Fold it open. Like you're
00:41:57,00:42:02,doing cut in half and then fold. I think I think fold all the surface area. So it's very wrinkled.
00:42:02,00:42:11,Yeah. And it was really useful research because for especially vats when they had to dose
00:42:11,00:42:15,"medication for elephants, they had to measure the height of the elephant and it was very dangerous."
00:42:15,00:42:22,Because they're moody creatures. People get killed by them. And he could calculate it from a footprint.
00:42:22,00:42:29,So he could just let an elephant walk over some mud and then measure the area of the footprint
00:42:29,00:42:33,and then he could say the entire surface area of the elephant is this. So the dosage of the
00:42:33,00:42:37,medication is this and you don't have to get near it and get killed. Wow. Yeah. You know what they
00:42:37,00:42:41,say about elephants with big feet? They're just big in general. Yeah. That's what they say. That's
00:42:41,00:42:54,another saying here. You don't look like the sausage up there. Okay. It is time for our final
00:42:54,00:42:59,fact of the show. And that is my fact. My fact this week is that the first female scientist to be
00:42:59,00:43:06,celebrated with a marble bust at the Royal Society was never able to visit it because women weren't
00:43:06,00:43:13,allowed in the building. Wow. This is kind of a nice story at the start because she's got a bust.
00:43:13,00:43:18,Yes. And then it tells off quite a lot of the end that. Yeah. And this was a fact that was told to
00:43:18,00:43:23,me directly by a particle accelerator physicist from Australia called Dr. Susie Shihi. It's
00:43:23,00:43:29,SHWHWF. Anyone wants to look her up? She's really awesome. And she was saying it's really fascinating.
00:43:29,00:43:35,This incredible scientist who was born 1780 called Mary Somerville was known as the Queen of
00:43:35,00:43:40,Sciences in her time. She was such an influence that all the members of the society wanted to
00:43:40,00:43:46,commemorate her with a bust in her own lifetime. And they did so. But because the rules of the
00:43:46,00:43:50,"society did not allow women into the building, she was never literally allowed to go and see it."
00:43:50,00:43:55,Yeah. They could have flexed the rules. But they didn't. She said it's outrageous in hindsight.
00:43:55,00:44:02,"It's absolutely outrageous. We could have seen it. I think because in 1834 when she was still alive,"
00:44:02,00:44:07,there was a ship that was named after her called the Mary Somerville ship and the figurehead
00:44:07,00:44:13,"of that ship was copied from that bust. And not only for the ship, a lot of the leading scientists"
00:44:13,00:44:17,of the Royal Society loved it so much that they asked for a casting of it for their own home.
00:44:17,00:44:21,"So she could have gone to their houses as well. Again, these are just bad reasons not to let her in."
00:44:21,00:44:25,"I'm just, I'm just, I'm just livid about it. We're not, we're not saying if this is a good"
