start_hhmmss,end_hhmmss,text
00:00:00,00:00:03,[music]
00:00:03,00:00:07,"Hi everyone, welcome to this week's episode of No Such Things A Fish, where we were joined by a"
00:00:07,00:00:13,"very, very good friend, Leven Scera. Now, regular listeners of No Such Things A Fish will be well"
00:00:13,00:00:18,"aware of Leven. He has been on our show many, many times. He is always absolutely brilliant,"
00:00:18,00:00:24,and we always love it when he comes over from Belgium and tells us all his amazing facts about
00:00:24,00:00:31,"science. Now, if you would like to learn more about a particular kind of science, AI, then do I"
00:00:31,00:00:37,"have good news for you? Because Leven is coming over in March to do a live tour across the UK,"
00:00:37,00:00:42,"North, South, East, West. He's coming along and he will be telling you all about AI. Would you"
00:00:42,00:00:48,believe it's more complicated than just getting a program on your computer and asking it questions
00:00:48,00:00:54,and getting the questions wrong? There is more to it and we're better to learn about it than with
00:00:54,00:01:00,"Leven Scera, the man sometimes called the Stephen Fry of Belgium. I know that quite a lot of companies"
00:01:00,00:01:06,are snapping up tickets because they want their employees to learn all about AI and Leven is
00:01:06,00:01:10,"such a good science communicator. Definitely, it is a place to go if you want to learn about"
00:01:10,00:01:15,"that subject and have a laugh along the way. If you want to know more about that, then go to"
00:01:15,00:01:23,"levenscera.com. Probably you can't spell that if you're British, so he has also bought the domain"
00:01:23,00:01:30,"leaving Shire, like what a hobby it might do. Perhaps leaving Shire.com, if you type that into your"
00:01:30,00:01:35,"address bar, you will get his website and you'll be able to get tickets. If you want to learn more"
00:01:35,00:01:41,"about noses, it's things of fish. Then a good place to go at the moment is patreon.com/nosesthingsofish,"
00:01:41,00:01:46,"where you can join any one of our three tiers, the lowest of which four pounds a month will get you"
00:01:46,00:01:52,"dual droppers of line. Have you ever listened to the show and thought, ""Those guys have got something"
00:01:52,00:01:57,"wrong?"" Well, if you have, then other people have thought that as well and they have sent us emails"
00:01:57,00:02:02,and Andy goes through them and picks out the very best and he quizzes us about them. It's not
00:02:02,00:02:07,"just things we got wrong, it's also people with extra material because there are so many experts"
00:02:07,00:02:13,"listening to our show, so it's a really good place if you've enjoyed the previous episodes to learn"
00:02:13,00:02:19,"a little bit more about those subjects. Patreon's also got a free tier. There's a little bit on there,"
00:02:19,00:02:24,"I think, if you sign up to nosesthingsofish on the free tier, but it's also a place where we will"
00:02:24,00:02:31,announce new things as and when they happen and I could tell you a lot is cooking up and nosesthingsofish HQ.
00:02:31,00:02:37,"So if you want to learn more, go to patreon.com/nosesuchthing as a fish. Anyway, really hope you enjoy this"
00:02:37,00:02:41,week show with Leverna Schiller on with the podcast.
00:02:41,00:03:03,"Hello and welcome to another episode of no such thing as a fish, a weekly podcast coming to you"
00:03:03,00:03:09,"from the QI offices in Hobern. My name is Dan Schreiber, I am sitting here with Andrew Hunter Murray,"
00:03:09,00:03:14,"James Harkin, and Leven Scherah. And once again, we have gathered around the microphones with our"
00:03:14,00:03:20,"four favorite facts from the last seven days and in a particular order, here we go. Starting with"
00:03:20,00:03:27,"fact number one, and that is James. Okay, my fat this week is that when the father of supercomputing"
00:03:27,00:03:34,"Seymour Kray got stuck on a problem, he would go into tunnels, he built under his house and speak to elves."
00:03:34,00:03:43,"My kind of guy. Yeah, so this is a guy called Seymour Kray. He built some of the first supercomputers,"
00:03:43,00:03:49,"and according to one of his colleagues, who's John Role Wagon, Kray said that when he got stuck"
00:03:49,00:03:53,"on a problem, he'd go under there and the elves come with the solutions to his problems. Why"
00:03:53,00:03:58,"certainly true is that he was brilliant at sort of getting a computer problem, going away, just"
00:03:58,00:04:03,"thinking about it and then getting the answer. Yeah, so it's an interesting story because it's sort of,"
00:04:03,00:04:08,he had such weird myths about him. Did he really talk to elves? Was he messing with his friend?
00:04:08,00:04:15,"There was a story that he built his own boat, and at the end of every year, he would burn the boat,"
00:04:15,00:04:19,and then he would build a new boat the next year because he loved building things and he loved
00:04:19,00:04:24,"creating a new thing on the blank page. I heard that he burned a boat just because he'd built a new one,"
00:04:24,00:04:31,"and he didn't want to pay the tax on two boats. Unclared. Well, a lot of people think that he did"
00:04:31,00:04:37,"do that once, and then it became the myth that he did it once a year, but he did like his thinking time."
00:04:37,00:04:43,"Yeah, have you come across this guy, Lever? No, I haven't. Some supercomputers have a great history,"
00:04:43,00:04:47,"you know, that he was Air Force once built the supercomputer out of PlayStation Trees."
00:04:47,00:04:53,No. The Condor console. Really? Yeah. They bought two million dollars of PlayStation Trees.
00:04:53,00:04:59,Wow. They took out the computer chip. What were they trying to play? Analyzing satellite images.
00:04:59,00:05:03,"Cool. And the thing, I've not, I've not played that game. It sounds good. It sounds right up"
00:05:03,00:05:07,"your street in Paris, Andy. Well, once flight simulator has been knocked on the head,"
00:05:07,00:05:15,"you need 1,760 PS3s to to build a supercomputer. The reason they did it was that it saved them eight"
00:05:15,00:05:21,"million dollars, but they weren't using the PlayStation itself. They were extracting a chip from it,"
00:05:21,00:05:26,did you say? I think they used most of the hardware. You could run Linux on it back in the day.
00:05:26,00:05:33,"So you're in the Russian military and your secrets are cracked by 1,700 PS3s. But so what is a"
00:05:33,00:05:38,supercomputer then? Because that's a collection of PlayStation. Does that count as a supercomputer? I think
00:05:38,00:05:43,there's no like official definition of them. But it's a term that I think was coined to make the
00:05:43,00:05:48,difference with the mainstream computing power of that time and that changes constantly.
00:05:48,00:05:55,"Now, the PS3 supercomputer was in the top 50 of computing power at that time, 2010. So it did"
00:05:55,00:06:01,"qualify as a supercomputer. And this guy, Seymour Cray, his computers were super because he basically"
00:06:01,00:06:06,was one of the first people to use transistors. So a transistor is like an electrical switch.
00:06:06,00:06:09,"You know, a computer goes with zeros and one is your transistor. We'll tell you if it's a zero"
00:06:09,00:06:16,"or a one because it switches one way or the other. Before that, they used vacuum tubes so like light bulbs"
00:06:16,00:06:20,"almost. And whether the light bulb was on or whether it was off, that would be your zero or one."
00:06:20,00:06:24,And that's how they work out all the logical things they had to work out. So he could suddenly make
00:06:24,00:06:29,"things much, much smaller. The fastest supercomputer right now. What can it do in the space of a second?"
00:06:29,00:06:34,So the fastest supercomputer I think at the moment is called El Capitan at the Lawrence Livermore
00:06:34,00:06:41,"National Laboratory. And let's say, Dan, you were to do a coin flip against everyone in Japan."
00:06:41,00:06:46,Yeah. Okay. As you do. As I've been trying to do for many decades now. You'll get a yes from
00:06:46,00:06:51,"a commissioner one day. It's a great fun idea. And then once you've done, then Leven does the same"
00:06:51,00:06:56,against everyone in Japan. Yeah. And then Andy does. Then I do. And then everyone in the world
00:06:56,00:07:01,does a coin flip against every single person in Japan. This El Capitan would be able to manage
00:07:01,00:07:09,"all those results in a single second, which is not a long TV show. I can see why AI is ruining the"
00:07:09,00:07:18,arts. Japan against the world. It's petaflop time. But I like this word petaflop. So flop is a floating
00:07:18,00:07:24,floating point operations or an additional or a multiplication. And then petta comes after
00:07:24,00:07:33,"tera, I think mega giga X is after petaflop. X is even bigger. So we've got a new supercomputer in the UK."
00:07:33,00:07:41,It opened up last summer. It's in Bristol. It's called Ismbard AI. And it's going to be used.
00:07:41,00:07:45,The Guardian report of various things is going to be useful. Improving skin cancer detection rates.
00:07:45,00:07:50,Right. Really good. Predicting crowd movements. And maybe if there's going to be an accident on
00:07:50,00:07:55,"a construction site, you know, it can sort of like a brick starts falling. It can work out where"
00:07:55,00:08:01,"it's going to land. Exactly. I mean, or maybe even more useful than that. And also how to spot sick"
00:08:01,00:08:06,dairy cows in Somerset. That's good. And there are a lot of dairy cows in Somerset. And if they get
00:08:06,00:08:11,"if they're getting early signs of mistitis, that's a real pain for them. You know what? I went on to"
00:08:11,00:08:17,Google News last week. Yeah. And I searched for super computer. And these headlines were all on
00:08:17,00:08:24,the first page. Super computer tips Morocco to win 2025 African nation's trophy. Super computer
00:08:24,00:08:30,reveals who's had the easiest ties in the FA Cup. Super computer predicts man United finishes.
00:08:30,00:08:35,Michael Carrick takes over. Super computer delivers leech United versus bollum prediction.
00:08:35,00:08:40,And super computer predicts where FA Cup journey will end for Mansfield Town. I can see who's
00:08:40,00:08:44,funding the research. Yeah. And so that we're using city's worth of war for an electricity to come
00:08:44,00:08:50,out with his vital stuff about Mansfield Town. It's not so weird. But what I think is happening
00:08:50,00:08:56,is a normal computer is doing these calculations in a journalist office somewhere. And they're just
00:08:56,00:09:01,"thinking, let's call out a super computer. I assume that's what's happening, right? Yeah. It's"
00:09:01,00:09:05,"not a protected term, is it? I don't think so. I don't think it is. Super in front of everything."
00:09:05,00:09:11,I feel like Seymour Craze was the first properly called a super computer. Right. I think I just
00:09:11,00:09:16,"won last fact on him. So Dan, you said he had this intense focus. He would spend days in complete"
00:09:16,00:09:21,"seclusion, maybe in the tunnels under his house. There are stories also that he was very afraid about"
00:09:21,00:09:25,"nuclear war. So he dug, he was digging sort of bombshell or having bombshells as dug under his"
00:09:25,00:09:30,home. I don't know how true that is. But apparently he would often on family car journeys
00:09:30,00:09:36,"demand complete silence. So he could think for the entire duration of the journey. I mean,"
00:09:36,00:09:44,"the dream. So, but wait a minute, Charlie, the kids are watching Frozen in the back."
00:09:44,00:09:46,Have they watched that on mute? They're not allowed to watch anything.
00:09:46,00:09:51,What? Family have to stay silent because dad is driving and thinking. They're watching a great man
00:09:51,00:09:56,think. What more entertainment can you have? Let it go is nothing compared to Seymour Craze.
00:09:56,00:10:01,Have a better idea. Pay to watch Seymour Craze think from the back of a car. I don't care how the
00:10:01,00:10:07,wheels are the fucking bus going. I need to work on how many pizza flops in this computer.
00:10:07,00:10:13,Or you will not have the iPad by 2010 to watch your shows on mute.
00:10:13,00:10:17,"Yes, exactly. And then when everybody else is science, you still have the elves bubbling in"
00:10:17,00:10:22,"your ear of course. Shut up, Elf. Can I tell you a man thing about where super computers are going"
00:10:22,00:10:26,"to go next? Oh, yes, please. Have a guess. League 2. That's our results."
00:10:28,00:10:32,"Where it's going to go next? Space. Quantum computing? Oh, computer's in space."
00:10:32,00:10:35,"It's going to go up there. It is. Yeah, for the cooling and the cold."
00:10:35,00:10:39,China are trying to get what lots of people are trying to get a super computer in space.
00:10:39,00:10:44,"Everyone wants it to be in orbit. Bees awesome, all sorts of people."
00:10:44,00:10:51,"Basically, the theory is on the ground, all the computing power uses lots of energy and lots of"
00:10:51,00:10:56,"water for the cooling and things like this. Up there, it's solar power. We have solar power down here,"
00:10:56,00:11:01,"but solar and cooling requirements are not nearly as big. Well, solar power is 24 hours if you choose"
00:11:01,00:11:08,"the right orbit. So you don't have nights. Cooling is a strange thing because it is very cold,"
00:11:08,00:11:14,but also there is very little materials. You're kind of in a vacuum. It's like you can't sweat.
00:11:14,00:11:21,"Yeah, so the ISS has this big gray things that some people think there are solar panels,"
00:11:21,00:11:27,"but they're actually the only way to cool the ISS is by radiation, like radiate the power off,"
00:11:27,00:11:33,and these things are to radiate the power. So you need some sort of cooling in space too.
00:11:33,00:11:38,But it's a different way than liquid cooling that we do here. Could we cook something with
00:11:38,00:11:44,radiation in space and then that comes back to Earth? I guess so. Yeah. I've just had an idea
00:11:44,00:11:48,"that's all I'm just going to write a beasel after this. But why? Andrew, space sausage. I'm thinking"
00:11:48,00:11:56,space sausage. What when space eggs is straight there? Space eggs. Oh my god. I don't want to deal with
00:11:56,00:12:05,"masks. Space sausage. You send the satellite up surrounded by a thick layer of meat, right? It's"
00:12:05,00:12:10,"like a Scotch egg. Don't Scotch egg as well. And as it cooks, it drops off and comes back to Earth."
00:12:10,00:12:15,"When it's cooked, how does it not burn on reentry? Oh, we'd have we'll salt this down the line."
00:12:15,00:12:25,"I'm asking for $100 million. Just bad news. Just quickly on Seymour Cray, he was born and eventually"
00:12:25,00:12:32,set up his offices in a place called Chippewa Falls in Wisconsin. Oh yeah. I tried to see if there
00:12:32,00:12:38,"had any other impact on the world, Chippewa Falls as well. So two I could find a lady called"
00:12:38,00:12:45,"Judith Ann Hensk, who was a singer in America, was the original singer of a song that's had a bit"
00:12:45,00:12:50,"of an influence on the world because the song was called High Flying Bird. Oh, and Nol Gallagher's"
00:12:50,00:12:56,"band is named after it. Nol Gallagher's band is named after that. So yeah, huge influence on"
00:12:56,00:13:01,the world there. That's one. The second one is it's going to be better. I don't think I'd stop that.
00:13:01,00:13:06,"I don't think you're going to cap. Get ready. Go on. It is the hometown of Jack Dawson,"
00:13:07,00:13:14,who sadly died on the Titanic in the movie Titanic. What? Leonardo DiCaprio's character is called
00:13:14,00:13:19,Jack Dawson. Okay. Okay. So there's a scene in the movie where Kate Winslet is standing on the front
00:13:19,00:13:23,and she's about to jump off and he talks her out of it and he talks about the time when he was
00:13:23,00:13:28,"standing on a frozen lake in Chippewa Falls, his hometown and how it cracked and how cold it was when"
00:13:28,00:13:34,he went under and so on. And so that's the other main thing that they're known for except the lake
00:13:34,00:13:40,"wasn't there until after the sinking of the Titanic. So it's a goof. There's a new lake. Yeah,"
00:13:40,00:13:48,it's sort of a man-made lake in Chippewa Falls and it wasn't made until 1917. Gosh. Now James Cameron did
00:13:48,00:13:53,the whole thing where he changed the literal sky to put the stars in the right place when he redid
00:13:53,00:13:57,the Titanic movie because he got it wrong. Neil the Grass Tyson complained about it. Yeah. Neil
00:13:57,00:14:02,the Grass Tyson was watching the movie and at one point said the sky is wrong. I think Neil the Grass
00:14:02,00:14:08,Tyson needs to get his priorities right with the complaining. Well Cameron changed it. He redid it
00:14:08,00:14:12,for the anniversary release and he hasn't changed this. He's going to have to go back now and do it
00:14:12,00:14:16,all over again. Wow. Yeah. You think you have the same authority as Neil the Grass Tyson when it
00:14:16,00:14:21,comes to James Cameron's ear. Hundy P. Hundy P. Of course. Yeah. He'll probably just hand back all the
00:14:21,00:14:28,money. I'm going to stop making Avatar 9 and I'm just going to focus the whole time on time
00:14:28,00:14:33,"traveling this lake back in time. That'll be his solution. Avatar by the way, which is 100%"
00:14:33,00:14:37,"scientifically accurate on my show, right? Yeah, exactly. I haven't seen what the modern"
00:14:37,00:14:43,"computers look like, the supercomputers, but aesthetically they were really beautiful the original"
00:14:43,00:14:49,"Cray supercomputers. So Seymour Cray's Cray 1 was a sort of tall cylinder in the middle. Oh,"
00:14:49,00:14:53,that's right. And then it had sort of like leather seating around the bottom that you could
00:14:53,00:14:59,genuinely sit on and it was because the cooling system that it needed was underneath and it just
00:14:59,00:15:05,"was a thing that was part of the design. Was it heated seats? Yeah, super heated seats. Yeah,"
00:15:05,00:15:10,he's getting referenced as love seats and there's a few suggestions that people would sleep on it.
00:15:10,00:15:19,"Not for 60s. Yeah, but is that a big cylindrical supercomputer in Japan? I'm afraid it's an exafop."
00:15:19,00:15:33,"Okay, it's time for fact number two and that is Lieben. My fact is that a crane is called a crane"
00:15:33,00:15:41,"because it looks like a crane. Any question? Yes. It's crane is wet. Aha. The crane, the machine"
00:15:41,00:15:49,is named after the crane the bird. And what does this have to do with Seymour Cray? Nothing yet.
00:15:49,00:15:55,I'll ask the elves. Yeah. Medieval cranes looked like the birds. Have you seen a medieval crane
00:15:55,00:16:00,"on paintings? Only through the process of researching this, yeah. Oh yeah, before nine. Yeah,"
00:16:00,00:16:08,"so a medieval crane would be a wooden building in a way. And it had these two, what do you call them,"
00:16:08,00:16:13,"where the hamster would want to round them? Tread mills. Yeah, treadmills. So it had two big"
00:16:13,00:16:20,treadmills at the site and people would walk into treadmills to make the rope move. And then from
00:16:20,00:16:26,"these two large treadmills, there was kind of a wooden building diagonally going up like 10,"
00:16:26,00:16:31,"15 meters. And then from the top, there would be a small piece going diagonally down again,"
00:16:31,00:16:37,where the rope would come out. And they would use this in harbours to take loads out of it.
00:16:37,00:16:42,"And these old medieval cranes, they look a lot like a crane, the bird standing in a field."
00:16:42,00:16:47,And so that's why they were called cranes. So cool. They're very beautiful. I had not seen one
00:16:47,00:16:54,of these before. These tread wheel cranes. And they're mad. I think there's a place where they're
00:16:54,00:16:58,trying to build a castle authentically in France. And they're using one or two of these actual
00:16:58,00:17:03,"things. And Tom Scott, who's built this show, has made a video where he goes and like operates this"
00:17:03,00:17:10,crane. It's crazy. And they were used for like quite famous things like column cathedral. So much.
00:17:10,00:17:14,"Salisbury Cathedral. And it turns out that if you have enough people and enough time as well,"
00:17:14,00:17:20,"because it moves slowly. But you can basically lift many, many, many tons in weight just by someone"
00:17:20,00:17:24,"walking around. If you have the right gears. Yeah. If you have the right gears, then you can,"
00:17:24,00:17:30,you can certainly do it. Could you like ratchet it and then use it as a catapult or something?
00:17:30,00:17:34,"A trebuchet. I don't know. I don't know if, because then you need a lot of torque in there. And"
00:17:34,00:17:41,"maybe the wood wouldn't, because I was thinking for Andy's meat in space business. Yes. That's how we'll"
00:17:41,00:17:44,get it back down. That's a good idea. Is that how you're lobbing it up? That's how I was lobbing it up.
00:17:44,00:17:50,"Oh, sorry. Okay. Can I get the sausage up there, mate? Is there that slang expression? I'm not"
00:17:50,00:17:56,"familiar with it. Very, very normal expression here. I'll be okay. But your sausage hot, mate."
00:17:56,00:18:02,"There was a Roman one called a polyspaston, which could lift 3,000 kilos per person walking"
00:18:02,00:18:06,"in this line. I mean, the gearings are amazing. And then they were used in ancient Rome, and then"
00:18:06,00:18:11,"they weren't used for many centuries, and then in medieval times they came back. But they were still"
00:18:11,00:18:16,"being installed in London in the 1850s. Okay. Wow. I think there's one down in Guilford, actually."
00:18:16,00:18:22,It's not in operation to that. It's a historical one. But there are a few that can still be found
00:18:22,00:18:28,"in the sellers of cathedrals, because they used to move up with the floors. So if you've built the"
00:18:28,00:18:33,"first floor, you would disassemble the entire crane and build it again on the first floor."
00:18:33,00:18:37,"So you could work your way up there. And then when they were at the top and the church was finished,"
00:18:37,00:18:41,they would just store it in the seller. Like they wouldn't build it up again. But all the material
00:18:41,00:18:46,would be there. That's very good. Do you know what the world's biggest crane is right now?
00:18:46,00:18:51,"Right now. Probably the bigger machine. We're talking machine still, I think."
00:18:51,00:18:56,"Yes, sure. So this is guessable. Absolutely not. Is it? What would you call it? What would you call it?"
00:18:56,00:19:02,"Manath. Manath. Oh, I see. Master Don't. These are great names. It's called Big Karl."
00:19:02,00:19:08,"And it's named after Karl Sarans, who works. He's a director of Sarans Engineering,"
00:19:08,00:19:14,"which is a Flemish family business. Oh, which what what's it called? Sarans."
00:19:14,00:19:21,Absolutely. I see Sarans cranes all the time. There are family business. They started
00:19:21,00:19:26,moving trees with horses and carts as you do. And now they're into the world's biggest cranes.
00:19:26,00:19:32,Right. And I was reading a trade magazine with an interview with Karl and they said what's going
00:19:32,00:19:37,on with the crane industry and he said the whole industry is picking up. Brilliant.
00:19:37,00:19:42,Which I don't think he deliberately did as a joke. Doesn't translate in Dutch actually.
00:19:42,00:19:50,"That's it. Through the roof. It's so good. In these medieval cranes, we had these big treadmills"
00:19:50,00:19:57,"and they used people to walk in there sometimes children. Actually, in Ghent, there's still a crane"
00:19:57,00:20:03,"children street. Can't get in there. So they weren't like really small kids, but they were like"
00:20:03,00:20:11,"teenagers and that were used. And they used animals. Dogs, for example. There's still pictures of"
00:20:11,00:20:17,dogs standing in these treadmills kind of sealed off of the world with a small wooden wall left
00:20:17,00:20:21,"and right. So in the morning, you would put your dog in a treadmill and it would just walk in"
00:20:21,00:20:24,"and evening, you opened the door and it could come out. You've got to make sure to put the dog"
00:20:24,00:20:28,"in the right way around. Otherwise, you get over the end of the day. It's disassembled half a"
00:20:28,00:20:38,"cathedral. My man. Not again, fee fee. These ones that we used. You've heard of a capstan, maybe."
00:20:38,00:20:43,That's the thing. You see them on board a ship for lifting various things. It's where you've
00:20:43,00:20:48,got a pole vertically and there are four spars coming out of it on the ground and you have people
00:20:48,00:20:53,pushing them around in a circle. Oh yeah. And that lifts something upwards. That was a big thing.
00:20:53,00:21:01,"In the, they were used a lot in the 15th, 16th century, especially to raise obelisks because Rome"
00:21:01,00:21:07,basically got a lot of obelisks from its territories in Egypt. So they were all in Stull. Stull?
00:21:08,00:21:14,"Yeah. Why am I worried about medieval Romans coming at me? Yeah, they were all sort of nicked."
00:21:14,00:21:19,"But basically to raise these, they would use cap stands with hundreds of men and horses involved"
00:21:19,00:21:23,pushing them around to lift them up. And I just love this detail. This comes by the way from
00:21:23,00:21:29,Low Tech magazine. It's amazing. It's about the past and forgotten tech and how it can actually be
00:21:29,00:21:35,very useful today. The website is solar powered. It runs off the author's home solar power system.
