start_hhmmss,end_hhmmss,text
00:37:14,00:37:18,"But if you head out to the countryside and listen to it, it's exactly like that."
00:37:18,00:37:21,"So isn't that, that's worth a pop or two, isn't it?"
00:37:21,00:37:27,"How come there was money to support the, why were, people must have been paying for it."
00:37:27,00:37:32,"Yeah, but it was like just pennies here and there, but they were doing it day in, day out."
00:37:32,00:37:40,"And these people, they had their regulars, so they would go to Miley Bono, to Kensington, because they knew there was someone there who would give them, you know, a few hapenies here and there."
00:37:40,00:37:42,"And that's all they needed to live, really."
00:37:42,00:37:43,Nice.
00:37:43,00:37:47,"So these, like, grinders, as they were called."
00:37:47,00:37:54,"And the particular thing that people got annoyed by was people with barrel organs, because there was a bit of racism in it, because they were mostly from Italy and quite poor."
00:37:54,00:37:58,"And the other thing that annoyed people was, you just turn a handle."
00:37:58,00:37:59,There's no skill involved here.
00:37:59,00:38:00,There's no skill.
00:38:00,00:38:01,You buy a...
00:38:01,00:38:03,The skill of making a violin sound like a screech out.
00:38:03,00:38:04,Like a goat.
00:38:04,00:38:05,Yeah.
00:38:05,00:38:06,"That's been surprised, but not badly."
00:38:06,00:38:07,"Yeah, yeah."
00:38:07,00:38:12,"But, so, like, you just buy a barrel, slot it into the organ, turn the handle."
00:38:12,00:38:14,The same tunes come out every time.
00:38:14,00:38:17,"So it's like, that was a frustrating thing for a lot of people."
00:38:17,00:38:23,"So Charles Dickens, his illustrator, called John Leitch, claimed that he died early, because he..."
00:38:23,00:38:24,He climbed.
00:38:24,00:38:26,"You saw him be cut to me, didn't you, Andy?"
00:38:26,00:38:27,Yeah.
00:38:27,00:38:31,"He said, ""This is killing me,"" and then he died, and he said, ""It's because of this."""
00:38:31,00:38:32,Yeah.
00:38:32,00:38:40,"His final words to fellow artist William Frith were, ""Rather Frith to be tormented in this way, I would prefer to go to the grave where there is no noise."""
00:38:40,00:38:41,There we go.
00:38:41,00:38:42,Where are we going?
00:38:42,00:38:43,"Oh, he really caught on his nerves."
00:38:43,00:38:48,They buried him under the bandstand at Captain Commonside.
00:38:48,00:38:53,"I was looking into what was going on in 1861, London, at the time."
00:38:53,00:38:54,Just curious.
00:38:54,00:38:58,"No, as in, I've got the answer, the invention of the toast sandwich."
00:38:58,00:39:04,"Because Mrs. Beaton's book of household management was first published in 1861, and one of the recipes in there was toast sandwich."
00:39:04,00:39:06,"Get two bits of bread, put your bit of toast inside."
00:39:06,00:39:07,"I've eaten that, actually."
00:39:07,00:39:08,I tried it.
00:39:08,00:39:09,Have you?
00:39:09,00:39:11,"Well, we did mention it on QI once, and I thought I'd see what it's like."
00:39:11,00:39:12,Yeah.
00:39:12,00:39:19,"And it's not as bad as you might think, I would say, because it gives you a little bit of texture to what otherwise is quite a boring piece of bread."
00:39:19,00:39:20,"So, it's bread toast bread."
00:39:20,00:39:21,Yeah.
00:39:21,00:39:24,"Well, people put crisps in sandwiches, don't they, for a bit of crunch."
00:39:24,00:39:25,Yeah.
00:39:25,00:39:26,But there's usually something else.
00:39:26,00:39:27,Yeah.
00:39:27,00:39:30,"Although, I think, actually, a sandwich of just butter and crisps."
00:39:30,00:39:32,"I mean, flavor of choice."
00:39:32,00:39:34,"I mean, I'm ready-salted all the way."
00:39:34,00:39:35,"Oh, ready-salted."
00:39:35,00:39:37,"I think that's probably right with that combo, I think."
00:39:37,00:39:38,"Yeah, something vinegar wouldn't quite..."
00:39:38,00:39:41,It's a lot more about texture than taste.
00:39:41,00:39:44,But you still think you might have a little bit of something else.
00:39:44,00:39:45,Yeah.
00:39:45,00:39:47,"I think there was butter on it, in Mrs. Beaton's version, wasn't it?"
00:39:47,00:39:48,"Yes, yeah, yeah."
00:39:48,00:39:49,"So, that was invented in..."
00:39:49,00:39:54,"That was, well, the book was published, and that was a very notable, very odd bit of recipe."
00:39:54,00:39:55,"Yes, huge."
00:39:55,00:39:56,Black velvet.
00:39:56,00:40:01,"You might have seen people walking around the streets, 1861, drinking black velvet."
00:40:01,00:40:02,Oh.
00:40:02,00:40:05,"Now, this is a Guinness with a glass of champagne."
00:40:05,00:40:06,That's right.
00:40:06,00:40:07,And that's from then.
00:40:07,00:40:10,"Yes, to commemorate a very big death of 1861."
00:40:10,00:40:11,Albert?
00:40:11,00:40:12,That's right.
00:40:12,00:40:14,Albert died December 1861.
00:40:14,00:40:16,He invented a cocktail.
00:40:16,00:40:17,Just before.
00:40:17,00:40:18,"No, no, no."
00:40:18,00:40:20,"He said, ""This cocktail's going to kill me."""
00:40:20,00:40:21,And then he died.
00:40:21,00:40:23,"And then he said, ""I told you."""
00:40:23,00:40:26,Can you think why they might have invented the cocktail?
00:40:26,00:40:27,What?
00:40:27,00:40:30,"I mean, to try and monetise it, in general."
00:40:30,00:40:32,"You know, is it black for a morning?"
00:40:32,00:40:33,Yep.
00:40:33,00:40:35,"So, and then champagne for a royal celebration."
00:40:35,00:40:39,"So, the Guinness would sit like a black band, like mourners were hanging around their arms."
00:40:39,00:40:42,"The idea was, it was a, it's like getting a top on your beer."
00:40:42,00:40:43,Is that a lager top?
00:40:43,00:40:46,"Is that what, which, what is a lager top?"
00:40:46,00:40:49,"It's a normal pint of lager, but they pour out the tiniest bit of the top,"
00:40:49,00:40:52,and they give you a little dash of lemonade just to take the edge off.
00:40:52,00:40:54,"So, it's like a very, very strong chandelier."
00:40:54,00:40:55,"Yes, exactly."
00:40:55,00:40:58,"You know, when you're shandy, it's become a lager top."
00:40:58,00:41:02,"You know, you're just telling yourself, ""That's just beer, mate."""
00:41:02,00:41:07,"And particularly when you say, ""Instead of the beer, use whiskey."""
00:41:07,00:41:10,"Just two more things, because it's quite fun to know."
00:41:10,00:41:16,"It was the publication of Great Expectations, so Dickens obviously had been printing the stories in serials,"
00:41:16,00:41:19,but it was the first full book bringing the chapters together.
00:41:19,00:41:25,"And then the last one that I found was, it was the introduction of Widow Twenky into pantomime."
00:41:25,00:41:26,"Oh, wow."
00:41:26,00:41:28,"Yeah, 1861, the first ever pantomime."
00:41:28,00:41:30,It sounds like a good time to be alive.
00:41:30,00:41:31,"Hello, that's great."
00:41:31,00:41:32,It's great.
00:41:32,00:41:35,"Have you guys heard, just on people being loud and other people being annoyed about that,"
00:41:35,00:41:39,have you heard of the New York Society for the Suppression of Unnecessary Noise?
00:41:39,00:41:40,No.
00:41:40,00:41:42,"This is my kind of organisation, basically."
00:41:42,00:41:45,And yet you said David Mitchell is not very American.
00:41:45,00:41:50,"So this was a doctor called Julia Barnett Rice, okay."
00:41:50,00:41:54,"She was, she qualified in 1885, got a medical degree but didn't practice."
00:41:54,00:41:59,"I think, I don't know if women were allowed to practice in the 1880s, '90s, I'm not sure."
00:41:59,00:42:04,But she really wanted that street vendors not be allowed to shout.
00:42:04,00:42:07,"And she, like, she made it her life's course."
00:42:07,00:42:09,"And she and her husband, he was called Isaac Rice."
00:42:09,00:42:11,He was an interesting guy in various ways.
00:42:11,00:42:15,"He invented a chess opening that was called the Rice Gambit, just so you know."
00:42:15,00:42:19,"And then spent about, apparently, the next 20 years of his life,"
00:42:19,00:42:22,"researching, analysing and testing the soundness of his gambit."
00:42:22,00:42:25,So what a thing to spend your life doing.
00:42:25,00:42:29,But the thing is that I've never heard of that and I followed chess a little bit.
00:42:29,00:42:32,So presumably it wasn't very useful after all those 20 years.
00:42:32,00:42:36,"No, he got to the end of the 20 years, like, ""Oh, it's not allowed to move that way."""
00:42:36,00:42:40,"Oh, cancel that."
00:42:40,00:42:47,I have never in my life met a bishop that could only move diagonally.
00:42:47,00:42:53,"It's just not realistic, whereas castles can't move at all without an earthquake."
00:42:53,00:42:58,"And they just, they had a house on Broadway, way too noisy."
00:42:58,00:43:02,"So they moved up to by the river, right, on Riverside Drive."
00:43:02,00:43:03,They built their own house.
00:43:03,00:43:06,They had a basement vault dug so that they could have somewhere quiet.
00:43:06,00:43:09,"Partly because they had six children, so the house was quite noisy."
00:43:09,00:43:12,"So he stayed in the basement a lot of the time, doing his gambit."
00:43:12,00:43:20,That's actually what the Rice Gambit is.
00:43:20,00:43:25,"Because they were by the river, the riverboats made so much noise blowing their horns all day."
00:43:25,00:43:29,"So she, Julia, she hired students to count the number of toots per day."
00:43:29,00:43:33,"And it was about a thousand toots per day, but if it was foggy, it was 3,000."
00:43:33,00:43:36,"So she started a campaign saying, ""Look, this is very bad for people's health."""
00:43:36,00:43:40,"And it was mostly because she didn't like it, as far as I can tell."
00:43:40,00:43:43,"But the tugboat captains found out about this campaign of hers,"
00:43:43,00:43:47,"and they found out where she lived, and they would gather outside on the river at night"
00:43:47,00:43:49,and all blast their horns.
00:43:49,00:43:52,"But she genuinely got the law changed, and she got Mark Twain involved."
00:43:52,00:43:55,- Wow. - And she established quiet zones around hospitals.
00:43:55,00:43:57,How many boats sank then?
00:43:57,00:44:00,Like shipwrecks.
00:44:00,00:44:02,"Very quiet ones, that was the key."
00:44:02,00:44:05,"Yeah, that's amazing. Another person who hated it was Thomas Carlisle,"
00:44:05,00:44:11,"just to go back to the 1850s in London, and the 1850s and 1860s in London."
00:44:11,00:44:16,He once wrote that he was considering to assassinate a vile Italian organ grinder
00:44:16,00:44:18,who worked near his house.
00:44:18,00:44:21,But I think he might have built the first ever soundproof room
00:44:21,00:44:24,in his house in London. This was in 1853.
00:44:24,00:44:28,"It had double walls, and it had a slated roof with a gap in between"
00:44:28,00:44:33,"where he could get, like, muffling chambers full of air so that the sound couldn't get in."
00:44:33,00:44:37,"And it cost him 170, which, according to one online calculator,"
00:44:37,00:44:40,"I found, said it was about 30,000 today. It cost him."
00:44:40,00:44:42,"For a house extension, that's, you know..."
00:44:42,00:44:45,"Yeah, in those days, I think, yeah."
00:44:45,00:44:50,Why didn't they pay the annoying organ grinder to go away?
00:44:50,00:44:52,"Oh, I think you could do that."
00:44:52,00:44:54,"But I think that is how they earned quite a bit of their money,"
00:44:54,00:44:56,just extorting it from people.
00:44:56,00:44:58,"That must be a glam profession, though."
00:44:58,00:45:00,"You know, ostensibly, you're there to, you know,"
00:45:00,00:45:05,they're here to entertain with our violin. It sounds like a cow.
00:45:05,00:45:09,The real money is for people who desperately want you to go.
00:45:09,00:45:11,"It would be if we went doing live shows like we do,"
00:45:11,00:45:16,and we got on stage and everyone had done a whip round for us not to do the show.
00:45:16,00:45:20,I'm going to give you one last set of buskers. This is in 2009 in Birmingham.
00:45:20,00:45:23,Two buskers who only knew two songs and had been playing them
00:45:23,00:45:27,in the same part of Birmingham for 18 months on end were given Aspose.
00:45:27,00:45:30,And they were... They knew Wonderwall and...
00:45:30,00:45:32,That's the worst review.
00:45:32,00:45:35,"Five-star, four-star, three-star, three-star, one-star,"
00:45:35,00:45:38,and then there is Aspose.
00:45:38,00:45:40,It was Wonderwall and Faith.
00:45:40,00:45:42,They had a guitar and they had a bin lid.
00:45:42,00:45:46,"And, yeah, but they would play it to, like, four or five or six in the morning sometimes."
00:45:46,00:45:50,"One person said, ""To be fair, they didn't do a bad rendition of the songs."""
00:45:50,00:45:52,So that's...
00:45:52,00:45:56,"If you lived in the area, that would become the main version of the song to you."
00:45:56,00:45:58,"And then you'd listen to Oasis doing it and go,"
00:45:58,00:46:01,"""No, they've got that bit wrong."""
00:46:01,00:46:04,There's a few classic London ones I think most tourists will probably remember
00:46:04,00:46:07,"if they've got the tube, like the Henry the Hoover."
00:46:07,00:46:09,What is that person that Henry the Hoover calls people?
00:46:09,00:46:13,"I think next to it on a keyboard, but then he had accompanied by this Henry the Hoover"
00:46:13,00:46:17,"that had the saxophone that would shoot bubbles outside it, yeah."
00:46:17,00:46:19,"So sorry, it's the... Where's the saxophone?"
00:46:19,00:46:21,"In the nozzle, I guess?"
00:46:21,00:46:22,Of the Hoover?
00:46:22,00:46:23,"Yeah, it sucks."
00:46:23,00:46:25,"But wait, the far end of the nozzle, like the bit that does the hoovering,"
00:46:25,00:46:28,or is it right... Have you removed the Hoover's trunk?
00:46:28,00:46:29,I can't believe how...
00:46:29,00:46:30,And you've drowned the saxophone into that.
00:46:30,00:46:34,"Quickly, what I thought was a solid image in my head is collapsed."
00:46:34,00:46:35,It sounds great.
00:46:35,00:46:36,I just made that up there.
00:46:36,00:46:38,I just want a bit of doctrinal reasoning.
00:46:38,00:46:39,Does it suck saxophones?
00:46:39,00:46:42,Does it make the same noise as if you blow a saxophone?
00:46:42,00:46:44,"Wow, great question."
00:46:44,00:46:45,"I don't know, I might do."
00:46:45,00:46:46,"I don't know, I might do."
00:46:46,00:46:47,"Stuming, no."
00:46:47,00:46:48,"You would think that, wouldn't you, mate?"
00:46:48,00:46:49,Yeah.
00:46:49,00:46:50,Because you're sucking it into the...
00:46:50,00:46:52,"Is it the horn, the mouth of the saxophone?"
00:46:52,00:46:53,"The bell end, actually."
00:46:53,00:46:54,Is it called the bell end?
00:46:54,00:46:55,"Yeah, yeah."
00:46:55,00:46:59,"Okay, so it presumably will make the opposite noise."
00:46:59,00:47:01,Does it always have an opposite?
00:47:01,00:47:04,"Well, we know it's quite theological."
00:47:04,00:47:07,What's the opposite noise to February?
00:47:07,00:47:08,"Yeah, mate."
00:47:08,00:47:09,I mean...
00:47:09,00:47:10,"No, I like this."
00:47:10,00:47:11,Yeah.
00:47:11,00:47:12,I like the big...
00:47:12,00:47:15,We're finally getting to the big question.
00:47:15,00:47:17,"That's 500 eps in, finally."
00:47:17,00:47:19,Does the noise have an opposite?
00:47:19,00:47:20,It doesn't always have an opposite.
00:47:20,00:47:22,You can have an opposite wave function.
00:47:22,00:47:24,"Well, they can do things, can't they?"
00:47:24,00:47:27,"Sometimes when, if there's a noise of air conditioning when you're recording something,"
00:47:27,00:47:31,they can record that and in some way invert it and then...
00:47:31,00:47:34,So it sucks that noise out.
00:47:34,00:47:37,"So if you're a hybun, you know what the opposite of the word February is."
00:47:37,00:47:38,Yeah.
00:47:38,00:47:39,Send it in.
00:47:39,00:47:43,It's the noise that you would play over the word February in order to induce silence.
00:47:43,00:47:49,And all these irritable Victorians needed was to have that on their own barrel.
00:47:49,00:47:52,"And turn the handle, and it would go quiet."
00:47:52,00:47:53,That would be amazing.
00:47:53,00:47:54,The opposite of Wonderwall.
00:47:54,00:47:55,Yeah.
00:47:55,00:48:03,"Okay, it's time for our final fact of the show."
00:48:03,00:48:04,And that is my fact.
00:48:04,00:48:09,"My fact is that in 1993, a man in Brazil who robbed a factory of its glue"
00:48:09,00:48:13,"was arrested 36 hours later, still in the factory he was robbing,"
00:48:13,00:48:16,because he was stuck to the glue he was stealing.
00:48:16,00:48:19,Didn't he think to steal the glue in its containers?
00:48:19,00:48:20,I think what happened?
00:48:20,00:48:22,So this is a guy called Edelberg.
00:48:22,00:48:24,He was just putting it in his pockets.
00:48:24,00:48:26,I'll just take the glue loose.
00:48:26,00:48:29,"It's so heavy, these cans."
00:48:29,00:48:32,The police will be looking for tubes of glue.
00:48:32,00:48:34,They won't be looking for raw glue.
00:48:34,00:48:36,It was a 19-year-old.
00:48:36,00:48:39,He was called Edelberg Guamrez.
00:48:39,00:48:41,We don't have to name him.
00:48:41,00:48:45,It's the opposite of that noise.
00:48:45,00:48:49,"I actually think he was probably called Edelberto, because I Googled it."
00:48:49,00:48:52,"I can't find anyone else called Edelberg, but there's a lot of people called Edelberto,"
00:48:52,00:48:55,where it runs over two lines and there's a hyphen.
00:48:55,00:48:58,That's interesting.
00:48:58,00:49:00,So I saw the story in the Washington Post.
00:49:00,00:49:03,"It was part of a yearly roundup, and it was a 19-year-old."
00:49:03,00:49:07,"He did take two large cans, and since something must have happened,"
00:49:07,00:49:10,they tipped over as he was trying to get out of the factory.
00:49:10,00:49:11,Glue spilled everywhere.
00:49:11,00:49:13,He obviously tried to pick up the glue and put it back in.
00:49:13,00:49:15,I don't know.
00:49:15,00:49:17,He then got stuck to where he was.
00:49:17,00:49:19,It is very easy.
00:49:19,00:49:21,"I had to do a minor glue job the other day,"
00:49:21,00:49:23,and the amount of glue on my hands at the end of it was...
00:49:23,00:49:25,"When you say glue job, is that like a bank job?"
00:49:25,00:49:27,Were you also stealing glue?
00:49:27,00:49:30,"Yeah, it's very easy, even with a small..."
00:49:30,00:49:31,Does it dry that quickly?
00:49:31,00:49:33,"Oh, God, it dries so fast."
00:49:33,00:49:34,"Oh, really?"
00:49:34,00:49:36,"Sorry, this is now my..."
00:49:36,00:49:39,"Glue is very, very annoying, because it either doesn't work,"
00:49:39,00:49:41,"like, you know, essentially, Pritz-stick."
00:49:41,00:49:44,There are other brands of glue that don't work.
00:49:44,00:49:46,They sort of go in that...
00:49:46,00:49:49,"OK, it sort of sticks it a bit, but, you know, so does Snot."
00:49:49,00:49:53,"Or it's just so incredibly effective, and you can't be angry with it, can you?"
00:49:53,00:49:58,"Because, you know, yes, it's doing exactly what Snot wanted it to stick together,"
00:49:58,00:50:00,"and, yeah, I didn't say my fingers."
00:50:00,00:50:04,"But, yes, I did apply my two fingers to each other while there was glue on one,"
00:50:04,00:50:08,"and now, you know, but it's like the glue is being facetious."
00:50:08,00:50:11,You know I didn't want to stick my fingers whenever
00:50:11,00:50:14,as anyone wanted to stick their fingers together.
00:50:14,00:50:15,"Yeah, I didn't..."
00:50:15,00:50:17,It was through researching this fact that I didn't realise
00:50:17,00:50:21,how important super glue is to the world of live music.
00:50:21,00:50:22,Oh.
00:50:22,00:50:25,"For live shows, so take a band like the Red Hot Chili Peppers,"
00:50:25,00:50:27,"flea on the bass, very aggressive with his playing,"
00:50:27,00:50:31,"slapping and popping and all sorts, and he'll get huge calluses during the gig."
00:50:31,00:50:34,"And sometimes, with old wounds that he's got, they'll be ripped open."
00:50:34,00:50:36,So he's got missing bits of his hand.
00:50:36,00:50:39,"So he'll run off stage, grab super glue, fill in the hole."
00:50:39,00:50:40,"Oh, no."
00:50:40,00:50:41,"Yeah, yeah, and come back on, John Froschanti does it,"
00:50:41,00:50:44,"the guitarist of the Red Hot Chili Peppers, Stevie Ray Vaughan does it."
00:50:44,00:50:46,There's so many musicians that talk about...
00:50:46,00:50:49,"They've got to give it a minute, or they're going to stick to their instruments."
00:50:49,00:50:51,(LAUGHTER)
00:50:51,00:50:55,"I know how someone else would glue their fingers together, actually."
00:50:55,00:50:56,"Oh, yeah."
00:50:56,00:50:58,For a specific use in film.
00:50:58,00:51:00,Is it something we can guess?
00:51:00,00:51:01,It's something you can guess.
00:51:01,00:51:02,"Oh, okay."
00:51:02,00:51:04,"Oh, yeah, I know it, so I won't say it."
00:51:04,00:51:05,"Oh, great show."
00:51:05,00:51:07,"Here's the only thing I'd say is, like, an additional clue."
00:51:07,00:51:09,I can't do this.
00:51:09,00:51:13,"So if I was in the movie as this character, I would require the super glue as well."
00:51:13,00:51:15,"Well, I'm thinking of one of two things."
00:51:15,00:51:16,Okay.
00:51:16,00:51:18,Is it E.T.?
00:51:18,00:51:19,"Oh, weird fingers."
00:51:19,00:51:20,That's good.
00:51:20,00:51:21,Or...
00:51:21,00:51:22,Or Spock.
00:51:22,00:51:23,It's Spock.
00:51:23,00:51:24,It's Spock.
00:51:24,00:51:25,"Well, you couldn't do it without glue."
00:51:25,00:51:26,Mr...
00:51:26,00:51:27,Spock.
00:51:27,00:51:30,It was Zachary Quinto in the new Star Trek film.
00:51:30,00:51:33,"Couldn't do the Vulcan salute, so they glued it together."
00:51:33,00:51:35,"It's a thing which I can't do, I can't."
00:51:35,00:51:37,"I can do it with one hand, but not with the other."
00:51:37,00:51:38,Right.
00:51:38,00:51:42,"Would you feel, if for that reason you weren't cast as Spock in Star Trek,"
00:51:42,00:51:44,would you feel that that was okay?
00:51:44,00:51:45,I think so.
00:51:45,00:51:46,I think so.
00:51:46,00:51:48,"Yeah, well, would you feel you were being discriminated against?"
00:51:48,00:51:49,"Well, he wasn't discriminated against."
00:51:49,00:51:50,No.
00:51:50,00:51:52,I don't know if he showed up to the audition pre-glued.
00:51:52,00:51:56,"I would say, if I was auditioning for Spock, first thing, can you do that with your hand?"
00:51:56,00:51:59,"If so, okay, let's look at the script."
00:51:59,00:52:05,"In fairness, they don't only cast people with pointy ears, so they do add some kind of..."
00:52:05,00:52:09,"Having said that, though, if some people had pointy ears, they would have a legitimate grievance."
00:52:09,00:52:10,"I mean, talk about it."
00:52:10,00:52:15,"If there were real Vulcans among us, and then suddenly we're getting people to Vulcan up,"
00:52:15,00:52:18,"then that's not appropriate, is it?"
00:52:18,00:52:23,"But because Vulcans don't happen to exist, it's okay to point a ear up non-Vulcans."
00:52:23,00:52:25,"But similarly, the hand thing."
00:52:25,00:52:29,I do feel like Zachary Quinto is taking jobs away from people like me who can do it.
00:52:29,00:52:30,"Yeah, you can do it."
00:52:30,00:52:31,I'm really duddy with both.
00:52:31,00:52:32,You two can.
00:52:32,00:52:35,"I can do it with one and just about with the other, and you can't do it at all."
00:52:35,00:52:36,I can't do it at all.
00:52:36,00:52:37,No.
00:52:37,00:52:38,"Well, you can play Kirk."
00:52:38,00:52:39,That's fine.
00:52:39,00:52:45,There's plenty of parts.
00:52:45,00:52:47,Was William Shatner Kirk?
00:52:47,00:52:48,Yeah.
00:52:48,00:52:50,"So he couldn't do it either, and they tied his fingers..."
00:52:50,00:52:53,"No, no, but he apparently has to do it at one point."
00:52:53,00:52:55,They tied his fingers together with fishing line.
00:52:55,00:52:56,No.
00:52:56,00:52:57,"Oh, my God."
00:52:57,00:52:58,That makes sense.
00:52:58,00:52:59,That's very gloomy.
00:52:59,00:53:00,Lovely.
00:53:00,00:53:05,"You say I'm the least American person, but you ask, ""Was William Shatner Kirk?"""
00:53:05,00:53:13,"I mean, I have to say, I really knew that as a piece of popular culture got through to me."
00:53:13,00:53:18,"""Was Elvis Presley a singer?"""
00:53:18,00:53:23,"Speaking of body parts and glue, do you know what butt glue is?"
00:53:23,00:53:24,"Oh, butt glue."
00:53:24,00:53:25,Butt glue.
00:53:25,00:53:31,"I have a product at home called Butt Clean, but I have a water butt."
00:53:31,00:53:36,You must have been disappointed when you bought that on the internet.
00:53:36,00:53:43,The amount of capsules I wasted for realising they had to be just dropped in the water butt.
00:53:43,00:53:45,So that cleans the water butt there.
00:53:45,00:53:47,"Yeah, you just pop it in and it fizzes a bit."
00:53:47,00:53:51,All the turtles just float to the surface.
00:53:51,00:53:53,This is actually more to do with the Americans.
00:53:53,00:53:54,So what's it called?
00:53:54,00:53:55,Butt glue.
00:53:55,00:53:56,Butt glue.
00:53:56,00:53:59,That's a terrible bum remake.
00:53:59,00:54:00,Butt.
00:54:00,00:54:04,It's not for repairing water butts.
00:54:04,00:54:05,"No, it's not."
00:54:05,00:54:11,It's for the bottoms and it's for people who compete in pageants.
00:54:11,00:54:17,"If you're wearing a very tight bikini, you want it to be exactly straight on your cheeks."
00:54:17,00:54:19,You don't want it to ride up or anything like that.
00:54:19,00:54:22,You put it between the bikini and the bottom.
00:54:22,00:54:25,So it sort of goes on the bikini to get it positioned.
00:54:25,00:54:28,"I was thinking it goes on the bum, but it sort of lifts the bum."
00:54:28,00:54:35,"Well, Andrew, you would be good in the pageant world according to the Bravo show."
00:54:35,00:54:36,I think that too.
00:54:36,00:54:39,I'm amazed that is his line of work.
00:54:39,00:54:46,"You would be an innovator because according to the Bravo show Game of Crowns, which is quite recent,"
