start_hhmmss,end_hhmmss,text
00:19:37,00:19:38,It was quite anarchic.
00:19:38,00:19:40,"Yes, but also equally, you could take a little bit of it."
00:19:40,00:19:42,"It was quite calm, awful at night time, for example."
00:19:42,00:19:46,"So it's very, very reductive of you to use that word."
00:19:46,00:19:50,"So, you know, for example, I think it's very bad to call an apple an apple,"
00:19:50,00:19:53,but you want it to print out of every individual cell.
00:19:53,00:19:56,And that's actually a better way of describing it.
00:19:56,00:19:59,"Anyway, this Anarchy happened and was awful."
00:19:59,00:20:02,And Matilda nearly got to be the queen.
00:20:02,00:20:04,"At one point she was about to be crowned,"
00:20:04,00:20:07,but then the people in London got cross and she had to run away.
00:20:07,00:20:10,And then at another point she was under siege in Oxford Castle
00:20:10,00:20:12,and she ran away through the snow.
00:20:12,00:20:13,It's quite exciting.
00:20:13,00:20:17,"But eventually she gave up and went back to Normandy,"
00:20:17,00:20:21,"which by then her husband, Geoffrey of Anjou, had rested from Stephen."
00:20:21,00:20:27,But then her son does inherit the throne because Stephen's regime essentially peters out.
00:20:27,00:20:28,So they do a deal.
00:20:28,00:20:31,"Matilda's son, Henry, becomes Henry II."
00:20:31,00:20:34,"Plantagenet, named after his father, Geoffrey."
00:20:34,00:20:38,And then you have quite an ordered succession for quite a long time.
00:20:38,00:20:42,"It's all in the first four, you know, the rhyme of all the kings and queens of England."
00:20:42,00:20:44,"It's Willy, Willy, Harry, Stee."
00:20:44,00:20:47,This is all the Harry Stee bit.
00:20:47,00:20:50,"Just that bit, which is Harry Stee."
00:20:50,00:20:53,"I was just jumping a few Henrys ahead, Henry VIII."
00:20:53,00:20:57,I was looking up food because I thought her royal meals sounded a bit odd.
00:20:57,00:21:02,And I discovered that he used to serve this meal called cockentrice or cockentries.
00:21:02,00:21:03,Have you heard of this?
00:21:03,00:21:04,No.
00:21:04,00:21:09,So it was a pig sewn to another animal and he pitched it as a mythical beast.
00:21:09,00:21:12,And he would say this is a mythical beast ring.
00:21:12,00:21:14,"Most like the wings of a bird, is it?"
00:21:14,00:21:17,I think it became in a few different permutations.
00:21:17,00:21:19,I think it always usually had a pig on the front.
00:21:19,00:21:22,"It's a chicken, but with the testicles of a blowfish."
00:21:22,00:21:27,"Yeah, so I just love that."
00:21:27,00:21:31,"Henry VIII would just present, you know, what was effectively the old version of a yeti."
00:21:31,00:21:32,At the table.
00:21:32,00:21:36,"So he would say, not only have I discovered a mythical beast, I've killed it."
00:21:36,00:21:38,And we know what it is.
00:21:38,00:21:40,"And it's the last one, sadly."
00:21:40,00:21:41,But there it is.
00:21:41,00:21:44,You look at it now and then what do you fancy?
00:21:44,00:21:45,A bit of wings.
00:21:45,00:21:46,"And they're like, oh, it tastes a bit like chicken."
00:21:46,00:21:48,It's weird how everything tastes a bit like chicken.
00:21:48,00:21:50,My bit tastes like pork.
00:21:50,00:21:54,"Well, that's the thing about the cockentrice."
00:21:54,00:21:56,It's so full of flavours.
00:21:56,00:21:58,The bottom's got chocolate in it.
00:21:58,00:22:00,[LAUGHTER]
00:22:00,00:22:10,"OK, it is time for fact number two, and that is Andy."
00:22:10,00:22:15,"My fact is that sea turtles have been going to the same restaurant for 3,000 years."
00:22:15,00:22:17,Blowfish served?
00:22:17,00:22:19,"Yeah, it's only blowfish."
00:22:19,00:22:20,"Yeah, that's nice."
00:22:20,00:22:21,You find a thing you like.
00:22:21,00:22:23,"Yeah, just eat that forever."
00:22:23,00:22:24,"Yeah, exactly."
00:22:24,00:22:26,So this is about green sea turtles.
00:22:26,00:22:30,"A new study from the universities of Groningen, Exeter, York, Copenhagen,"
00:22:30,00:22:32,and the Society for the Protection of Turtles.
00:22:32,00:22:33,They've all teamed up.
00:22:33,00:22:35,So they're quite pro-turtles.
00:22:35,00:22:36,Very pro-turtles.
00:22:36,00:22:38,Society for the eradication of turtles.
00:22:38,00:22:39,Didn't get a look at it.
00:22:39,00:22:40,Absolutely not.
00:22:40,00:22:42,That's quite-- I'm not sure if that's appropriate balance.
00:22:42,00:22:45,"If this was on the BBC, you'd have to have one person on the show going,"
00:22:45,00:22:47,"""I fucking hate turtles."""
00:22:47,00:22:49,"So they're a right paint, easy to flip."
00:22:49,00:22:54,"People, you know, Americans use the same words they do for tortoises."
00:22:54,00:22:55,"I mean, it's just confusing."
00:22:55,00:22:57,Let's just have one.
00:22:57,00:23:00,We don't need the aquatic version of those shell people.
00:23:00,00:23:03,I've been trying to book a table at that restaurant for months now.
00:23:03,00:23:08,"Always by the window, party of eight turtles."
00:23:08,00:23:10,Restaurant is such a way of putting it.
00:23:10,00:23:15,"But basically, it's a huge meadow of seagrass off North Africa."
00:23:15,00:23:17,And sea turtles go there to eat.
00:23:17,00:23:19,They spend the first few years of their life drifting around
00:23:19,00:23:24,because they don't have the control to swim and live in these meadows.
00:23:24,00:23:27,"And then when they do get the control, they head to the meadows."
00:23:27,00:23:29,They swim miles and miles and miles to get there.
00:23:29,00:23:32,And they've used archaeology and ancient samples to work out
00:23:32,00:23:38,"these are the same habitats in use that sea turtles 3,000 years ago have been heading to."
00:23:38,00:23:40,And it's just amazing.
00:23:40,00:23:42,"And the meadows all have their own chemical signatures,"
00:23:42,00:23:44,which end up in the bodies of the sea turtles.
00:23:44,00:23:46,Because they're kind of made of these meadows.
00:23:46,00:23:51,"So yeah, sometimes turtles will visit the same 50 meters squared."
00:23:51,00:23:52,"Oh, wow."
00:23:52,00:23:57,It's like having a table in a particular meadow that they return to.
00:23:57,00:23:58,It's pretty amazing.
00:23:58,00:24:02,"Sea turtles, you know, conservationists have always been trying to monitor"
00:24:02,00:24:04,"if they're declining, you know, what's going on."
00:24:04,00:24:08,"And 2023, there was an amazing count that happened."
00:24:08,00:24:09,Volunteers went around.
00:24:09,00:24:12,"They found 74,000 nests bit over that."
00:24:12,00:24:15,"But there's a huge problem that's happening, which is that the sex, the gender,"
00:24:15,00:24:18,is determined by the climate.
00:24:18,00:24:21,"And as it's getting hotter, they tend to be born as female."
00:24:21,00:24:24,And so we're slowly losing all male sea turtles.
00:24:24,00:24:26,There's a genuine worry that we're going to just...
00:24:26,00:24:29,We've got all these women now and no men to sort of...
00:24:29,00:24:31,And you need enough diversity in the population to...
00:24:31,00:24:32,Yeah.
00:24:32,00:24:33,It is a big problem.
00:24:33,00:24:35,"It's to do with the temperature of the sand, I think."
00:24:35,00:24:39,"So if the eggs are laid in sand that's above 31, then they're all female."
00:24:39,00:24:41,"You know, 31 Celsius."
00:24:41,00:24:43,"And if it's below 27, they're all male."
00:24:43,00:24:49,And the species relies on the sand being a range of temperatures in between the...
00:24:49,00:24:50,Yeah.
00:24:50,00:24:53,"And historically it's been, well, it'll be colder years and hotter years,"
00:24:53,00:24:55,so it'll get a reasonable number of both.
00:24:55,00:24:56,Yeah.
00:24:56,00:24:57,That's the problem.
00:24:57,00:24:58,Yeah.
00:24:58,00:24:59,"So no, it is a huge problem."
00:24:59,00:25:04,"So we're hoping for an hour, maybe if you get above like 32, it goes male again."
00:25:04,00:25:08,So actually now we'd be rooting for further global warming
00:25:08,00:25:11,in order to push through to the really...
00:25:11,00:25:17,"The hot guys, let's call them, that come to start coming through again."
00:25:17,00:25:21,"Well, the other problem is that the seagrass meadows are also hugely under threat."
00:25:21,00:25:23,So just everyone in every...
00:25:23,00:25:24,Like lots of sea turtles.
00:25:24,00:25:26,Some sea turtles are doing all right.
00:25:26,00:25:28,"There is, I think, seven different species of sea turtle."
00:25:28,00:25:30,And I think several are endangered.
00:25:30,00:25:32,"But a couple are doing okay, but several are endangered."
00:25:32,00:25:34,"And the meadows, lots of them are off North Africa,"
00:25:34,00:25:36,where there isn't much environmental protection.
00:25:36,00:25:40,And lots of the countries nearest are undergoing quite chaotic times at the moment.
00:25:40,00:25:42,"And so, yeah, there is a risk that..."
00:25:42,00:25:46,Apparently we lose a football pitch's worth of seagrass every 30 minutes.
00:25:46,00:25:47,Jesus.
00:25:47,00:25:49,Every 30 minutes?
00:25:49,00:25:50,Yeah.
00:25:50,00:25:54,"I have to say though, whatever's mowing that seagrass, we want to use that on land,"
00:25:54,00:25:55,because that's really quick.
00:25:55,00:25:58,I think it takes more than half an hour to cut the grass on a football pitch.
00:25:58,00:26:01,And this is just literally the use of...
00:26:01,00:26:04,"I mean, using global warming as a force for gardening."
00:26:04,00:26:05,Yeah.
00:26:05,00:26:07,"Hot turtles, better gardening."
00:26:07,00:26:08,Yeah.
00:26:08,00:26:09,What is this?
00:26:09,00:26:12,I kind of like climate change now.
00:26:12,00:26:13,I am not.
00:26:13,00:26:16,I'm in favor of climate change.
00:26:16,00:26:21,Because the seagrass buries carbon 35 times faster than a tropical rainforest.
00:26:21,00:26:22,Another fact that I read.
00:26:22,00:26:23,It's amazing.
00:26:23,00:26:24,"Yeah, because they just..."
00:26:24,00:26:27,"Seagrass, they take carbon from the water to build their leaves."
00:26:27,00:26:29,The leaves eventually die.
00:26:29,00:26:32,That sediment stays on the ocean floor for hundreds of years.
00:26:32,00:26:34,And so that's how they sequester.
00:26:34,00:26:36,So that's essentially carbon capture.
00:26:36,00:26:38,It's captured in the silt at the bottom.
00:26:38,00:26:40,"Yeah, it's really functional carbon capture."
00:26:40,00:26:46,"And I think 10% of the carbon in the ocean is buried by seagrasses or sequestered by seagrasses,"
00:26:46,00:26:49,despite them being 0.1% of the ocean floor.
00:26:49,00:26:51,So it's really impressive stuff.
00:26:51,00:26:53,"Yeah, we need loads more of it."
00:26:53,00:26:54,Can we plant it?
00:26:54,00:27:00,"There are a few plans to plant 18 hectares around the UK by 2026, which is not..."
00:27:00,00:27:01,It doesn't sound like that.
00:27:01,00:27:05,"I don't know how many hectares in a football pitch, but it sounds like a few hours."
00:27:05,00:27:07,And that's done no good at all.
00:27:07,00:27:10,"It's not... Yes, I think there might be more like pilot schemes,"
00:27:10,00:27:12,but they are trying to get more going.
00:27:12,00:27:14,"And of course, if you protect bits of seafloor, then..."
00:27:14,00:27:16,"Do the turtles, Andy?"
00:27:16,00:27:17,Did they eat seagrass?
00:27:17,00:27:18,They eat the tips of it.
00:27:18,00:27:20,I think that stimulates growth.
00:27:20,00:27:24,"Okay, so there's no cause to eradicate the turtles."
00:27:24,00:27:26,Your anti-turtle society is just not going to be a thing.
00:27:26,00:27:27,Let's just check.
00:27:27,00:27:29,We've just got to be open-minded.
00:27:29,00:27:32,Maybe the turtles are the villains of the piece.
00:27:32,00:27:34,"David, we're blaming ourselves for all our factories,"
00:27:34,00:27:38,but maybe those turtles are cleverer than they look.
00:27:38,00:27:41,"David's wearing a T-shirt, which is saying, ""Stop sea turtles."""
00:27:41,00:27:45,It's really upsetting.
00:27:45,00:27:48,"Outside of seagrass, they're quite fussy eaters, sea turtles."
00:27:48,00:27:51,They're given a bigger menu to play with.
00:27:51,00:27:55,So one of the other problems of the climate at the moment
00:27:55,00:27:58,"is sometimes they're going off course, they're going into colder oceans,"
00:27:58,00:27:59,and they get hypothermia.
00:27:59,00:28:02,"So there's a lot of turtles that wash up onto shore,"
00:28:02,00:28:06,"and either they're dead or they get rescued and taken to turtle hospital,"
00:28:06,00:28:09,where they then get this brilliant menu of different things.
00:28:09,00:28:12,And so each individual turtle has just a different kind of taste.
00:28:12,00:28:15,"Like number seven doesn't like the squid, for example."
00:28:15,00:28:18,A few of them don't like tails.
00:28:18,00:28:21,Don't give them any fishy tails or anything like that.
00:28:21,00:28:25,"Yeah, and also it's creating chaos because turtles are very solitary,"
00:28:25,00:28:27,but they're in tanks together to be fed.
00:28:27,00:28:31,"And so there's turtle bullies that they have to sort of reprimand and tell off and so on,"
00:28:31,00:28:34,because they're eating the tails and so on.
00:28:34,00:28:39,"You can give turtles, if they're not very well, you can give them mayonnaise to eat."
00:28:39,00:28:40,Did you see this?
00:28:40,00:28:45,"So this is if there's been an oil spill, and the turtles have eaten a lot of oil."
00:28:45,00:28:48,"If you give them mayonnaise, it helps them to shit it out."
00:28:48,00:28:54,"And the reason is because obviously mayonnaise, it's oil and whatever it is."
00:28:54,00:28:55,Eggs?
00:28:55,00:28:56,"Yeah, it's an emulsion."
00:28:56,00:28:59,"We're revealing our ignorance here, aren't we?"
00:28:59,00:29:02,"And it's a really base food stuff as well, it's not complicated."
00:29:02,00:29:05,"This is an off menu, we don't need to know anything about food."
00:29:05,00:29:08,"It comes out of a jar, let's be honest."
00:29:08,00:29:12,"Yeah, but it has an emulsifier in it, which mixes water and oil."
00:29:12,00:29:16,"So if you've got oil inside you, the emulsifier inside mayonnaise"
00:29:16,00:29:21,can help the oil to mix with the water already inside the stomach of the turtle
00:29:21,00:29:23,and then just makes it easier to excrete.
00:29:23,00:29:24,That is so interesting.
00:29:24,00:29:25,That's amazing.
00:29:25,00:29:32,"Yeah, so all these oil slicks are basically, they're just a conspiracy by Big Mayo."
00:29:32,00:29:37,That causes massive spikes in the helman's share price.
00:29:37,00:29:43,"Whenever BP has a little mistake, they're suddenly coaching."
00:29:43,00:29:46,I've got a link to the previous fact weirdly.
00:29:46,00:29:49,"Oh yeah, to David's fact, his headline fact."
00:29:49,00:29:54,So seagrasses stop people getting gastroenteritis.
00:29:54,00:29:55,Oh.
00:29:55,00:29:56,Isn't that good?
00:29:56,00:30:00,"So if you have gastroenteritis because you've drunk some water normally,"
00:30:00,00:30:02,"which has the pathogens in it, which cause it."
00:30:02,00:30:07,"Seagrass mayors have way, way, way fewer of those pathogens in and around and among them."
00:30:07,00:30:09,So that water is just cleaner.
00:30:09,00:30:12,You're less likely to get gastroenteritis from there.
00:30:12,00:30:14,And they've tried to calculate it.
00:30:14,00:30:19,Between 8 and 24 million cases of gastroenteritis prevented every year.
00:30:19,00:30:20,Wow.
00:30:20,00:30:25,And I think it's because the seagrass kind of uses it almost like a fertilizer and takes it into its body.
00:30:25,00:30:26,Exactly.
00:30:26,00:30:29,It takes the gastroenteritis pathogens out of water.
00:30:29,00:30:30,Yeah.
00:30:30,00:30:33,But can it grow in non-salty water?
00:30:33,00:30:35,Almost none of it.
00:30:35,00:30:36,No.
00:30:36,00:30:37,"No, I think there's a bit of it."
00:30:37,00:30:38,There's only one fresh water.
00:30:38,00:30:42,"No, there's a problem there in terms of how useful it is."
00:30:42,00:30:47,"Well, if you only drink seawater like me, it's actually fine for you."
00:30:47,00:30:50,"It's still sparkling or salty, I think."
00:30:50,00:30:52,I've just worked out a mnemonic.
00:30:52,00:30:54,So how many cases did I say prevented every year?
00:30:54,00:30:56,"Little quiz, instant recall quiz."
00:30:56,00:30:57,How many million cases?
00:30:57,00:31:00,I think it was a football picture.
00:31:00,00:31:03,It was between 8 and 24 million cases.
00:31:03,00:31:04,"Okay, all right."
00:31:04,00:31:13,"Now, if you need a mnemonic to remember that, those are the ages of Matilda and the Holy Roman Emperor when they were betrothed to each other."
00:31:13,00:31:16,"And if you need a mnemonic the other way around, you're like, how was Matilda?"
00:31:16,00:31:21,"It was like, oh, what's the lower range of cases of gastroenteritis prevented each year by seagrasses?"
00:31:21,00:31:22,Beautiful.
00:31:22,00:31:23,"You're welcome, guys."
00:31:23,00:31:29,"So 8 and 24 when they were betrothed, but 12 and 28 when they were married, so not that."
00:31:29,00:31:30,"No, not that."
00:31:30,00:31:36,That would be to massively overstate the beneficial effect of seagrass on gastroenteritis.
00:31:36,00:31:39,I have a thing which I want to link back to the previous fact as well.
00:31:39,00:31:42,So we have a mystery butcher of the previous fact.
00:31:42,00:31:47,"I found a mystery turtle that I don't know much more about, that I want to find out about."
00:31:47,00:31:52,And it's the first turtle to go over Niagara Falls in a barrel and survive.
00:31:52,00:32:01,So I'm now plunging out an image of people glumly looking at a huge pile of dead turtles at the bottom of Niagara Falls.
00:32:01,00:32:06,"And go, I don't know, maybe try taping an X under the inside of the barrel."
00:32:06,00:32:13,"So this was 1930. There was a guy called George Stathakus, and he had this idea of going over Niagara in a barrel."
00:32:13,00:32:15,And the barrel goes down.
00:32:15,00:32:20,"It doesn't break up, but it gets caught in a sort of a tide that's underneath."
00:32:20,00:32:23,"I don't know what you'd call it, but it's, he can't escape."
00:32:23,00:32:25,And he's there for 18 hours in this barrel.
00:32:25,00:32:27,"So when they find him, he's suffocated."
00:32:27,00:32:28,He's dead.
00:32:28,00:32:30,"And Sonny is, oh, sorry."
00:32:30,00:32:32,"Yeah, there's a dead man in the story."
00:32:32,00:32:34,Do we suspect the turtle in this story?
00:32:34,00:32:36,"Oh, I haven't thought about it."
00:32:36,00:32:38,Only one of us could survive this.
00:32:38,00:32:43,"Well, the turtle might have been feeling quite negatively towards him, to be honest."
00:32:43,00:32:48,"This guy, you know, I'm not, I wouldn't blame the turtle for not giving him a mouth to mouth."
00:32:48,00:32:52,"This is the guy that's, what are we doing now, sir?"
00:32:52,00:32:55,A hundred years old as well.
00:32:55,00:32:56,Exactly.
00:32:56,00:32:57,That's a very old turtle.
00:32:57,00:32:58,It's a really old turtle.
00:32:58,00:32:59,And the barrel is in a museum now.
00:32:59,00:33:01,It's held as a kind of piece of Niagara Falls history.
00:33:01,00:33:02,Right.
00:33:02,00:33:03,But where did Sonny go?
00:33:03,00:33:04,I don't know where he went.
00:33:04,00:33:05,I don't know where he went.
00:33:05,00:33:06,I don't know where he went.
00:33:06,00:33:07,I don't know where he went.
00:33:07,00:33:08,I don't know where he went.
00:33:08,00:33:09,I don't know where he went.
00:33:09,00:33:10,I don't know where he went.
00:33:10,00:33:11,I don't know where he went.
00:33:11,00:33:12,I don't know where he went.
00:33:12,00:33:13,I don't know where he went.
00:33:13,00:33:14,I don't know where he went.
00:33:14,00:33:15,I don't know where he went.
00:33:15,00:33:16,I don't know where he went.
00:33:16,00:33:17,I don't know where he went.
00:33:17,00:33:18,I don't know where he went.
00:33:18,00:33:19,I don't know where he went.
00:33:19,00:33:20,I don't know where he went.
00:33:20,00:33:21,I don't know where he went.
00:33:21,00:33:22,I don't know where he went.
00:33:22,00:33:23,I don't know where he went.
00:33:23,00:33:24,I don't know where he went.
00:33:24,00:33:25,I don't know where he went.
00:33:25,00:33:26,I don't know where he went.
00:33:26,00:33:27,I don't know where he went.
00:33:27,00:33:28,I don't know where he went.
00:33:28,00:33:29,I don't know where he went.
00:33:29,00:33:30,I don't know where he went.
00:33:30,00:33:31,I don't know where he went.
00:33:31,00:33:32,I don't know where he went.
00:33:32,00:33:33,I don't know where he went.
00:33:33,00:33:34,I don't know where he went.
00:33:34,00:33:35,I don't know where he went.
00:33:35,00:33:36,I don't know where he went.
00:33:36,00:33:37,I don't know where he went.
00:33:37,00:33:38,I don't know where he went.
00:33:38,00:33:39,I don't know where he went.
00:33:39,00:33:40,I don't know where he went.
00:33:40,00:33:41,I don't know where he went.
00:33:41,00:33:42,I don't know where he went.
00:33:42,00:33:43,I don't know where he went.
00:33:43,00:33:44,I don't know where he went.
00:33:44,00:33:45,I don't know where he went.
00:33:45,00:33:46,I don't know where he went.
00:33:46,00:33:47,I don't know where he went.
00:33:47,00:33:51,"Okay, it is time for fact number three, and that is James."
00:33:51,00:33:58,"Okay, my fact this week is that in 1861, there was one street musician for every ten streets in London."
00:33:58,00:34:01,What a time to be alive.
00:34:01,00:34:02,What a time.
00:34:02,00:34:03,"Noisy, noisy time."
00:34:03,00:34:06,Sounds like it was a bit of a bad time for quite a lot of Londoners.
00:34:06,00:34:12,"Yeah, so this is according to journalist Henry Mayhew, whose article admittedly was relatively"
00:34:12,00:34:16,"negative towards the street musicians, but he estimated there are approximately a thousand"
00:34:16,00:34:18,"street musicians, 10,500 streets."
00:34:18,00:34:19,Okay.
00:34:19,00:34:20,And it was a real problem.
00:34:20,00:34:24,"We've said before, I think that Babbage really hated them."
00:34:24,00:34:29,"He really got frustrated with them, and he was actually him and the guy called Michael Bass,"
00:34:29,00:34:31,who ran the Bass Brewery.
00:34:31,00:34:38,"They managed to get it regulated in 1864, but for probably the decade up until 1864, London"
00:34:38,00:34:42,"was just an unbelievably loud place to live, largely thanks to these."
00:34:42,00:34:43,Yeah.
00:34:43,00:34:46,"What was their, what genre of music did they favour?"
00:34:46,00:34:47,"Oh, it was all sorts."
00:34:47,00:34:53,"So Mayhew said there were English violinists, Scottish pipers, German brass bandsmen, Italian"
00:34:53,00:34:54,grinders.
00:34:54,00:34:56,So that's be like a...
00:34:56,00:34:57,Organs.
00:34:57,00:34:58,"All grinding, yeah."
00:34:58,00:35:01,And one French hurdy-gurdy player.
00:35:01,00:35:04,One out of all the thousand.
00:35:04,00:35:05,Yeah.
00:35:05,00:35:07,Here he comes.
00:35:07,00:35:09,It was a she and the women.
00:35:09,00:35:10,"Oh, sorry."
00:35:10,00:35:11,I'm sorry.
00:35:11,00:35:12,That's my prejudice though.
00:35:12,00:35:18,"She had an instrument that, according to Mayhew, had a battered, heavy look about it and was"
00:35:18,00:35:21,grievously harsh and out of tune.
00:35:21,00:35:24,"And for 43 years, she had her regular rounds."
00:35:24,00:35:25,43?
00:35:25,00:35:29,"Yeah, so she went to Marleybone on a Monday, Kentish Town on a Tuesday."
00:35:29,00:35:31,So you knew how to avoid it.
00:35:31,00:35:33,"Yeah, exactly."
00:35:33,00:35:36,I saw a hurdy-gurdy player recently.
00:35:36,00:35:41,"I was in Canterbury, and it was a very hurdy-gurdy, it was the very old, old, old bit of Canterbury."
00:35:41,00:35:42,The cathedral.
00:35:42,00:35:43,So you think he was a ghost?
00:35:43,00:35:45,I don't think he was a ghost.
00:35:45,00:35:49,"No, he ran through a wall as soon as I started asking him questions, but he wasn't a ghost."
00:35:49,00:35:51,Can you remind me what...
00:35:51,00:35:55,"There's a handle you wind, and he was doing something with his other hand as well."
00:35:55,00:35:58,And it looks like a small violin with a handle.
00:35:58,00:35:59,"Oh, okay."
00:35:59,00:36:00,How interesting.
00:36:00,00:36:01,This is a really bad instrument.
00:36:01,00:36:02,Is it a stringed instrument?
00:36:02,00:36:03,It is stringed.
00:36:03,00:36:06,"Okay, so the fingers are kind of on the frets, like a guitar."
00:36:06,00:36:09,This is sounding like the car that Homer Simpson designed.
00:36:09,00:36:16,"It has some strings, but also a handle, a little keyboard on the bottom, and then you blow in the end."
00:36:16,00:36:20,I can't remember whether there were strings and frets or whether there were keys to play it.
00:36:20,00:36:24,"I think it might have been keys and a handle, but it was a very much a combo thing."
00:36:24,00:36:25,"Yeah, that's great."
00:36:25,00:36:27,"I only know it as like a comedy word, really."
00:36:27,00:36:28,"I know, I was staggered."
00:36:28,00:36:32,"That's why I said, ""What's that?"" to this guy, and he just went, ""Woo-hoo!"""
00:36:32,00:36:33,That's weird.
00:36:33,00:36:36,"That was the hurdy-gurdy making the noise, isn't it?"
00:36:36,00:36:42,"There was one other person, just while we're on it, described by Mayhew, who was an Italian fiddler"
00:36:42,00:36:48,who would go around imitating all the farmyard animals with his fiddle.
00:36:48,00:36:58,"He said he'd been doing it for 12 years, and he could imitate the bull, the calf, the dog, the cock, the peacock, the ass, and the hen when she's laid an egg."
00:36:58,00:36:59,That's amazing.
00:36:59,00:37:00,Do all that with his fiddle.
00:37:00,00:37:02,But what he couldn't do is play a tune.
00:37:02,00:37:08,"What he found is that if you just bash at a fiddle, it makes this."
00:37:08,00:37:14,"That is exactly the noise a hen makes, and it's just later, you might not be familiar with that, you live in central London."
