start_hhmmss,end_hhmmss,text
00:54:46,00:54:54,some people are using butt glue to actually hold the butt cheeks together to kind of make them seem very pert.
00:54:54,00:55:00,"Because it's not very strongly, but it's what's soluble so you can put some water down there and it'll open them up again."
00:55:00,00:55:03,You just need a thank goodness.
00:55:03,00:55:07,Do not use super glue instead of butt glue.
00:55:07,00:55:09,You're doing your airfix with butt glue.
00:55:09,00:55:12,"It's not like, oh my god."
00:55:12,00:55:18,Is that a common complaint in beauty pageant terms that the buttocks are too far apart?
00:55:18,00:55:20,They're on the side of a criminal disposition.
00:55:20,00:55:23,I don't think they all do this just to say if you're a beauty pageant.
00:55:23,00:55:24,Of course not.
00:55:24,00:55:25,"No, no, no."
00:55:25,00:55:27,I think but just some people do it too.
00:55:27,00:55:28,But I thought there was glue.
00:55:28,00:55:32,There's all sorts of bits of glue for sticking bits of makeup to people's faces.
00:55:32,00:55:34,Surely this is the same as butt glue.
00:55:34,00:55:37,"There's no need to say that this glue, it's skin glue."
00:55:37,00:55:40,It doesn't need to be specifically for the butt.
00:55:40,00:55:42,I think there might be some marketing going on there.
00:55:42,00:55:47,Like I have something called Nerdwax which you use to keep your sunglasses on.
00:55:47,00:55:54,Because my nose is quite small so my sunglasses slip down my nose and you can kind of put it on your nose and it kind of keeps it there.
00:55:54,00:55:56,But really it's just wax.
00:55:56,00:55:59,But they've put it in a nice tube that says Nerdwax on and they maybe want to buy it.
00:55:59,00:56:00,So I think it's a bit of that.
00:56:00,00:56:03,"Yeah, you could use it wherever you want."
00:56:03,00:56:04,Bugger glue.
00:56:04,00:56:05,Anyone heard of bugger glue?
00:56:05,00:56:07,"Okay, bugger as in the Americans."
00:56:07,00:56:10,"Yeah, so I should explain what bugger is to the non-American here."
00:56:10,00:56:17,"I've heard the expression just by being so un-American as in for a unit of snot, isn't it?"
00:56:17,00:56:18,A unit of dry snot.
00:56:18,00:56:19,Like a bogey.
00:56:19,00:56:20,Like a bogey.
00:56:20,00:56:27,Is it used in beauty pageants to hold the nostrils together because they are considered to be more beautiful?
00:56:27,00:56:29,Too far apart nostrils.
00:56:29,00:56:36,Remember when you used to get a bank card through the post and when you would take it off there would be a little bit of glue underneath.
00:56:36,00:56:37,That's clever.
00:56:37,00:56:38,The very snotty bugger glue.
00:56:38,00:56:39,That's bugger glue.
00:56:39,00:56:46,"That's satisfying though because when that comes away it's gone completely, which is actually not the case for snot."
00:56:46,00:56:50,I'd say snot leaves more of a sort of residue.
00:56:50,00:56:51,Better than snot.
00:56:51,00:56:52,Better than snot.
00:56:52,00:56:58,We've invented a better snot but now all we need to do is get it to somehow come out of our noses.
00:56:58,00:57:03,Because at the moment it only manifests on credit cards rather than in packages when you've got a cold.
00:57:03,00:57:06,Come on AI.
00:57:06,00:57:08,I need to wrap us up in a sec.
00:57:08,00:57:09,Can we do some bungling criminals?
00:57:09,00:57:11,Yeah why not a couple of bungling criminals.
00:57:11,00:57:16,There was a man who stole a parcel from Reading.
00:57:16,00:57:21,Wasn't to contain Henry the first to remain.
00:57:21,00:57:24,This is in 1994.
00:57:24,00:57:25,It was in the early 90s.
00:57:25,00:57:28,It could still be the first year.
00:57:28,00:57:30,And it turned out to be a bomb.
00:57:30,00:57:34,It turned out to be an IRA bomb.
00:57:34,00:57:40,"And he ran down the road pointing to the suitcase that he'd stolen shouting it's a bomb, it's a bomb."
00:57:40,00:57:44,And passersby thought that he was high on drugs but he dumped the suitcase outside a shop.
00:57:44,00:57:49,And 200 homes in Reading had to be evacuated while the bomb squad made it safe.
00:57:49,00:57:52,I thought you were going to say blew up.
00:57:52,00:57:57,I'll tell you how safely put it outside a shop.
00:57:57,00:58:00,I'll be honest I think he was panicking.
00:58:00,00:58:03,Because there must have been a moment of realisation of that story.
00:58:03,00:58:05,He's stolen the suitcase.
00:58:05,00:58:07,It's labels IRA bomb.
00:58:07,00:58:10,It's ticking or there's a fuse or something.
00:58:10,00:58:13,"The truth is you would think it probably wasn't a bomb, right?"
00:58:13,00:58:16,But they did make it safe.
00:58:16,00:58:18,So the newspaper report did say that it was a bomb.
00:58:18,00:58:21,A hero butcher.
00:58:21,00:58:23,You want to hear about a hero butcher?
00:58:23,00:58:25,Another one.
00:58:25,00:58:29,This was a man who stole 6 from a butcher.
00:58:29,00:58:32,But the butcher was also an amateur magician.
00:58:32,00:58:36,And rather than raising the alarm because he thought the guy would run away if he said stop thief.
00:58:36,00:58:40,He decided to do a trick where he pretended that 50p had gone missing.
00:58:40,00:58:44,"And he said oh let me find it, it might be about your person."
00:58:44,00:58:48,And he searched the person and found the 6 that he'd stolen.
00:58:48,00:58:51,That's brilliant.
00:58:51,00:58:54,This is in 1976.
00:58:54,00:58:57,People were more willing to stand still then.
00:58:57,00:59:03,The butcher suddenly said I have just stolen 6 and now the butcher is coming round the counter
00:59:03,00:59:06,and doing a bit of a trick about coins.
00:59:06,00:59:09,This is an eerie coincidence.
00:59:09,00:59:12,How can the butcher prove unless the butcher has already written his initials on the 6
00:59:12,00:59:15,which he might have done as part of the magic trick.
00:59:15,00:59:18,"Just saying that's my 6, what are you going to do?"
00:59:18,00:59:23,Maybe it was a coincidence and the butcher always basically stole all the money of the people that came in.
00:59:23,00:59:27,But on this occasion it was just money that he was nicking back.
00:59:27,00:59:34,The reason we know about it is because actually the butcher let the guy go and even gave him some sausages for his tea
00:59:34,00:59:37,because he could see that he was in need of this stuff.
00:59:37,00:59:43,But when the guy was caught for a different robbery he was in court in Newcastle and he asked for this
00:59:43,00:59:47,and a few other crimes to be taken into account and then they brought the butcher in to corroborate it.
00:59:47,00:59:49,So that's how we know it happened.
00:59:49,00:59:53,Why did he mention that when he was being done for something else?
00:59:53,00:59:55,We know that.
00:59:55,00:59:58,He wasn't taking it any further and he said fine have some sausages.
00:59:58,01:00:00,Guess how I got these sausages.
01:00:00,01:00:02,It's a funny story actually.
01:00:02,01:00:05,I can't tell you what I should tell you.
01:00:05,01:00:07,"You know what, I did think that."
01:00:07,01:00:10,"But it is a thing that they asked for other things to be taken into account, don't they?"
01:00:10,01:00:14,But that I think is what they're saying is it precludes future prosecution.
01:00:14,01:00:16,I think that might be it.
01:00:16,01:00:18,"But I think on this, so I suppose maybe."
01:00:18,01:00:20,But on this case no way the butcher is going to go.
01:00:20,01:00:22,Actually I've thought about it.
01:00:22,01:00:24,That was out of order and I want this to be back.
01:00:24,01:00:29,"Do you think it might make the judge look more kindly on you to say alright, I've turned over a new leaf by the way,"
01:00:29,01:00:31,here are some other things.
01:00:31,01:00:33,Well it may be.
01:00:33,01:00:36,"I think if you said to the judge I've never done anything wrong before, that's fine."
01:00:36,01:00:42,"But the difference between saying, talking about five previous robberies rather than four,"
01:00:42,01:00:45,I don't think that's going to meaningfully change the judge's view on you.
01:00:45,01:00:47,Because it's such a funny story.
01:00:47,01:00:50,The judge must get a lot of quite grim cases of theft and burglar and stuff.
01:00:50,01:00:54,And actually this funny thing that happened in a butcher shop would make me look more kindly on a grinder.
01:00:54,01:00:56,Now I know you're a bungling crook.
01:00:56,01:00:58,Bungling crook.
01:00:58,01:01:00,"And then the butcher, anyway, the butcher saw the funny side."
01:01:00,01:01:02,"David, it's awesome."
01:01:02,01:01:04,"Yeah, and then I mugged an old lady."
01:01:04,01:01:13,"Okay, that's it."
01:01:13,01:01:14,That is all of our facts.
01:01:14,01:01:15,Thank you so much for listening.
01:01:15,01:01:19,"If you'd like to get in contact with any of us about the things that we've said over the course of this podcast,"
01:01:19,01:01:21,we can be found on our Twitter accounts.
01:01:21,01:01:22,I'm on @Shyberland.
01:01:22,01:01:23,James.
01:01:23,01:01:24,@JamesHarkin.
01:01:24,01:01:25,Andy.
01:01:25,01:01:26,@AndrewHunterM.
01:01:26,01:01:27,And David.
01:01:27,01:01:28,@RealDMitchell.
01:01:28,01:01:29,Nice.
01:01:29,01:01:32,I don't actually look at any of the replies because it's so poisonous on there.
01:01:32,01:01:33,Yes.
01:01:33,01:01:35,"So, you know, you won't be hearing back from me."
01:01:35,01:01:37,Tweeting you abuse for years.
01:01:37,01:01:38,You mean you haven't written it?
01:01:38,01:01:39,I'm well aware.
01:01:41,01:01:45,"Yeah, or you can go to our group account, which is @NoSuchThing, or go to our website,"
01:01:45,01:01:46,NoSuchThingAsAfish.com.
01:01:46,01:01:49,"All of our previous episodes are up there, so do check them out."
01:01:49,01:01:51,"But most importantly of all, get David's new book."
01:01:51,01:01:54,"It's called Unruly, A History of England's Kings and Queens."
01:01:54,01:01:56,It's out now in all shops and online.
01:01:56,01:01:57,That's it for us.
01:01:57,01:01:59,"We'll be back again next week, and we'll see you then."
01:01:59,01:02:00,Goodbye.
01:02:00,01:02:01,Bye.
01:02:01,01:02:04,[MUSIC PLAYING]
01:02:04,01:02:07,[MUSIC PLAYING]
01:02:07,01:02:10,[MUSIC PLAYING]
01:02:10,01:02:12,you
