start_hhmmss,end_hhmmss,text
00:00:00,00:00:07,"Hi guys, little announcement before the show. We are doing another live show in London."
00:00:07,00:00:12,"It's up the creek in Greenwich where we did a show before and we had a really great time,"
00:00:12,00:00:16,so we decided to beg them to let us back. The show is going to be on the 7th of December
00:00:16,00:00:19,"and it's going to be kind of different this time. First of all, it's going to be filmed"
00:00:19,00:00:26,"for reasons we don't really understand. So, you know, bring your best face and second of all,"
00:00:26,00:00:29,it's going to be a two-parter. So the first part is going to be us doing the podcast
00:00:29,00:00:33,"within the second part. It's going to be same format as you might have heard we did once before,"
00:00:33,00:00:38,"where you guys bring your own facts, you guys in the audience and we talk about them and it's really,"
00:00:38,00:00:43,"really fun. So you should all come, go to qi.com/fishevents to get tickets."
00:00:43,00:00:50,"Also, today's episode features a special guest. An Australian scientist called Dr. Carl Krzyszelnetski."
00:00:50,00:00:56,"Now, this guy is a massive hero of mine. He was Mr. QI in Australia. If you're Australian,"
00:00:56,00:01:00,"you definitely know who he is. If you're not Australian and you haven't heard of him, please check him out."
00:01:00,00:01:05,He's got a new book coming out. It's called Short Back and Science. He's got amazing book titles.
00:01:05,00:01:11,That should be out in Australia now. You can probably order it online. And apologies for the slight
00:01:11,00:01:16,bad audio quality of this. We had a buzz in the room from an air conditioning unit and it was causing
00:01:16,00:01:22,all sorts of disruptions. But it's a good show. He's amazing. Have a listen. Bies book. Thanks so much. On with the show.
00:01:22,00:01:43,"Hello and welcome to another episode of No Such Thing as a Fish, a weekly podcast this week coming to you from the"
00:01:43,00:01:50,"Wardolph Astoria Hotel in Central London. My name is Dan Shriver. I'm sitting here with Andy Murray, Alex Bell and our"
00:01:50,00:01:58,"special guest, Australian scientist author of great named books like House of Carls, Game of Knowns, 50 Shades of Grey Matter."
00:01:58,00:02:05,"It's Dr. Carl Krushal Nitski. Very good pronunciation. Thank you. And once again, we have gathered around the microphones with our"
00:02:05,00:02:11,"four favorite facts from the last seven days. And in no particular order, here we go, starting with you, Dr. Carl."
00:02:11,00:02:23,"Yes, my favorite fact is two people in Sydney every week get bitten by ticks and shortly after become allergic to meat for the rest of their lives."
00:02:23,00:02:35,"Now, I'm hyping it up a little bit. They're only allergic to non-primate mammals. But if they have beef, for example, several months after the event, they can then become"
00:02:35,00:02:47,"allergic to meat for the rest of their life and go into the full anaphylactic reaction. None of these sort of, like, I have the vapors. I must lie down. But the full, I can't breathe. My face is swelling. If you don't not give me a"
00:02:47,00:02:54,"adrenaline, I will die. Anna, as in wrong and relax us to guard. So your body is going into a wrongly triggered immune reaction."
00:02:54,00:03:00,"I really like that a lot of them can still eat chicken and fish, just like most semi-commissive vegetarians."
00:03:00,00:03:09,"No, I'm allergic to all me. Well, I mean, I'm not allergic to fish. And it's the worst punishment for an Australian emotional. Not being able to have a barbecue."
00:03:09,00:03:21,"Oh, yeah. So what happens is that there's a bandicoot and it's carrying around in its blood, in its body, in its meat, a chemical called alpha-gal."
00:03:21,00:03:33,"So the alpha-gal goes, this chemical alpha-gal that goes, goes from the bandicoot into the tick and then into you. We humans do not have it. And here's the weird thing about it."
00:03:33,00:03:48,It's the first known allergen that is the sugar. And the result of that is that two people a week in Sydney will start going into a bit of regular meat and then suddenly start trying to drop dead.
00:03:48,00:03:56,Wow. That's right. Has this been going on for a long time and we've just found out? Or it's not like a new species of super tick?
00:03:56,00:04:03,"Well, the tick is only the vector of the carrier. Yes. Yes. But maybe the tick is now evolving to be able to carry a larger amount."
00:04:03,00:04:11,"Because I was always wrong about evolution. I went to the Glavicus Islands last month. So I read the book ""The Beak of the Finch."" It's amazing. It blew my mind."
00:04:11,00:04:22,"It's about evolution. Evolution happens really quickly. So when you look at it in a fossil record, over hundreds of thousands of millions of years, you're seeing the beginning point and the end point."
00:04:22,00:04:30,"And you don't see it in between, but jumps up and down violently. So yes, your point about the tick evolving could in fact be true."
00:04:30,00:04:40,"So on another thing on parasites and ticks and things like that, tortoises find it very hard to get rid of ticks because of their necks and because of the way they can't stretch around and their shells."
00:04:40,00:04:49,"So North American wood tortoises, they just walk into ants nests and they just sit in the middle of the ants nest and obviously the ants swarm all over them and they eat all the parasites."
00:04:49,00:04:55,And eventually the tortoise thinks right and clean enough and walks out the other side. Wow. That's amazing. Yeah.
00:04:55,00:05:09,"Symbiotic relationships. I read about hunting the way that ticks hunt, which is really nice. The article I read said that they are patient hunters and the idea is that what they do is they wait in a spot where they see where something is coming along."
00:05:09,00:05:17,They wait for the thing to come up to it and then they just step onto it. So that's their hunting. There's no they can't leap. They don't chase anything down. They just wait.
00:05:17,00:05:31,They just wait. Exactly. Yeah. They patiently wait and just step on. They climb up a blade of grass and they cling on with the second and third pairs of legs and their first pair of legs. Actually they've got four pairs of legs haven't they because they're magnets.
00:05:31,00:05:38,But their first pair of legs they just hold out in front of them waiting for something to get near enough for them to hang onto. It's called questing.
00:05:38,00:05:48,"That's a special name for it. That's very good. Yeah. Just on the subject of allergies, odd allergy because I you know that's a that's an amazing thing to get you can't eat me anymore."
00:05:48,00:06:03,"I read a story about a court in France has given 500 pound a month disability allowance, so equivalent 500 pounds a month to a lady who claimed and they've recognized this as an allergy that she's allergic to Wi-Fi."
00:06:03,00:06:19,So she said she was allergic to Wi-Fi. Hyper sensitivity. Ruben is a guy every five years he comes out with something and he says mate you're lying. Right. Ruben is a guy who they guess these people and he they look up electro magnetic hypersensitivity syndrome on a good friend Wikipedia.
00:06:19,00:06:30,Yeah. Ruben 2010 2005 and there's one coming up in 2015 and he's a guy who gets him in a room and then in a double blind says how do you feel the symptoms now?
00:06:30,00:06:37,"At least you're on and off and they always fail. Oh, but you should get over to there. Yeah, I can't believe they gave that to her."
00:06:37,00:06:45,"You know, you can be allergic to egg yolks and not egg whites. Different chemicals again proteins. That's how specific allergies can get."
00:06:45,00:06:54,And you can train yourself out of allergies in some cases and some cases you can't and you can then pick up allergies. The human immune system is wonderfully fiendish.
00:06:54,00:07:07,"So on the training yourself out of allergies thing I read that you can train yourself out of for example a peanut allergy and they tried it with a group of children by slowly exposing them to first very, very small amounts of peanut and then gradually increasing it."
00:07:07,00:07:18,The only thing is if you then can have say 5 or 10 peanuts and experience no effects if you then think oh well that's fine and you stop eating them then the tolerance goes away.
00:07:18,00:07:26,So you have to purposely you have to keep eating peanuts the thing you were allergic to in order to keep yourself not allergic to.
00:07:26,00:07:29,"Wow. Yeah. Isn't that straight? Yeah, that's amazing."
00:07:29,00:07:37,"Wait, so if you're allergic to peanuts what are you actually allergic to because peanut is sound really dumb here but it's not a nut is it? It's a legume."
00:07:37,00:07:48,"Yeah, so it's poorly understood exactly what's going on but the current theory relates to the processing method which involves high temperatures."
00:07:48,00:07:58,"Okay, so if you get nicotine which is sort of drifting off of the side thing here the secret nicotine of itself has various properties not too good not too bad."
00:07:58,00:08:17,Mixed but when you burn it you create so many different chemicals you've heard of that nasty stuff the dioxins if you get a backyard compost pile and just some leaves and and burn it you will create some dioxins because you'll have a range of oxygen availability and temperatures that you will create some nasty chemicals.
00:08:17,00:08:27,So burning anything creates bad stuff pollution is bad in that sense and so in China where they do it the old way no such thing is peanut allergies.
00:08:27,00:08:33,Really don't exist. So there's something going on still trying to find out but we'll find out soon.
00:08:33,00:08:45,Wow. We need to move on to our next fact. Can I can I just check obviously I seem to be a magnet for dubious facts so I just want to check one last allergy.
00:08:45,00:08:54,There was a girl called Grace Morley so she wasn't allergic to apples she wasn't allergic to birch trees but if she ate an apple near a birch tree she had an allergy.
00:08:54,00:09:04,Yeah you can have pre-triggering look up pre-triggering in the magazines and Google search look up the word review.
00:09:04,00:09:12,Okay review and you will find that could possibly be my wife is a GP and she had a patient who was allergic to water.
00:09:12,00:09:16,Oh yes I read about that because when you allergic to your own sweat and so it's it's not.
00:09:16,00:09:25,Yeah well the role you have to do is be around long enough to love another person very much in a special way have babies and then you can die as from an evolutionary point of view.
00:09:25,00:09:28,Actually being alive and comfortable doesn't come into it.
00:09:28,00:09:32,So what is this allergy? They have brushes on their skin if they wash with water.
00:09:32,00:09:44,It's the ions in the water not purified water does something to your skin so if you have to purify all the water that you drink and then pretty much any water that you come into contact with is not including your tears in your sweat bring up like rashes on your skin and it's really uncomfortable.
00:09:44,00:09:53,And there's another allergy which is with the some people some women are allergic to some of the chemicals in sperm semen.
00:09:53,00:10:01,Yes imagine imagine imagine if you were allergic to both sex and water you can get clean you couldn't get dirty.
00:10:01,00:10:04,But you can cross with you.
00:10:04,00:10:11,Time for our second fact and that is Andrew Hunter Murray.
00:10:11,00:10:16,My fact is that the Millennium Bug is going to hit in 2038.
00:10:16,00:10:20,That's my fact and I'm sticking to it. Explain yourself.
00:10:20,00:10:27,Okay so a lot of computers these days run on 32-bit processors.
00:10:27,00:10:37,The processor is the central calculating bit basically and they can handle two to the power of 32 different values and one of the ways they count value is seconds.
00:10:37,00:10:42,For some reason all computers count from the first of January 1970. Notice the epoch.
00:10:42,00:10:52,"So they can store about two billion positive values two billion 147 billion 483,647 positive values or seconds in this."
00:10:52,00:11:01,And that number of seconds after the first of January 1970 it's 314 in the morning and seven seconds on the 19th of March 2038.
00:11:01,00:11:08,And some computers at that point will go a little bit haywire and not be able to keep counting the seconds upwards.
00:11:08,00:11:12,Wow. Now it's not going to be catastrophic.
00:11:12,00:11:14,I'm already panicking. There's seven Millennium bugs.
00:11:14,00:11:26,Well there's good news in one sense because a lot of I mean most new computers these days run on 64-bit processors and those are capable of going for another 292 billion years.
00:11:26,00:11:31,I don't trust them either. We should be more prepared.
00:11:31,00:11:40,"So it's just there are but there will be some 32-bit systems in things like big transport systems, big embedded computers that are really hard to get out or update."
00:11:40,00:11:42,So some of those will have a problem.
00:11:42,00:11:43,Right.
00:11:43,00:11:45,Yeah. So that is the proper Millennium bug.
00:11:45,00:11:58,"Yeah well there be in PLCs, programmable logic controllers. PLCs all over the world controlling how much water goes into a hotel."
00:11:58,00:12:02,The size of the dollop of cream on your little biscuit.
00:12:02,00:12:06,The Australian biscuit called an iced vova. I don't know if you have such.
00:12:06,00:12:13,I think they might be similar similar. PLCs have been designed without security and providing they were only leave them there.
00:12:13,00:12:22,And they're the bugs that are going to cause the problem further down the line because you'll have the machines have moved up from 32-bit to 64.
00:12:22,00:12:37,And people will be aware of it because with the Millennium bug the Y2K as opposed to the Y2K38 basically the world spent about $400 billion fixing make sure it didn't go bad.
00:12:37,00:12:49,And that was things like poker machines or slot machines in Delaware and work and your radiation counters in Japan and work and buses didn't work in Hobart.
00:12:49,00:13:01,And according to my mates in the IT industry they all sweated blood for months and years beforehand getting ready for it because it wasn't so they just did something the night before.
00:13:01,00:13:11,They spent months and months fixing things up so it wouldn't happen. This one is going to be nasty. We've come across maybe even the variation of it in the Boeing 787.
00:13:11,00:13:14,Oh yes. Oh my God. That was terrifying when that came up in the news.
00:13:14,00:13:29,What was this that can I that they recently issued a statement saying we it may be the case that all of our engines will shut down if you leave them on for more than 248 days because that number of seconds the computer can't count more of it.
00:13:29,00:13:34,And it will spontaneously shut down into some sort of failsafe mode even potentially if they're up in the air.
00:13:34,00:13:39,And number one. Did they always turn it off when responsible for the whole desert leaving an engine on for 248 days.
00:13:39,00:13:45,Don't they turn it off when they park the clock is still running in the background because the on off switch is no longer an on off switch.
00:13:45,00:13:53,It's just pretend to be a sleep while the owner is there but keep on reporting their very thoughts to the mothership you have no privacy.
00:13:53,00:14:04,And in fact it turns out that 248 days when you count it in one hundredths of a second is 10 to the 32 one hundredths of a second.
00:14:04,00:14:09,But they didn't announce that people were that out people think well there must be a reason that many days.
00:14:09,00:14:13,And also it was involved with an Aryan rocket doing bad things as well.
00:14:13,00:14:26,"Because that had 16 bit architecture and that only takes you up to 32,000 or so somethings and the Aryan fire which was so much better than the Aryan 4."
00:14:26,00:14:32,It had too much the phrase I used was sideways velocity.
00:14:32,00:14:38,Now I guess they must be using it in some incredibly small unit like micro meters per hour or something.
00:14:38,00:14:46,"But once it gets over 32,000 you've used up the clock on your maximum number like just a bit of a backup for the audience."
00:14:46,00:14:49,Numbers are infinite. You never gonna run out.
00:14:49,00:14:53,So what's this thing about running out of numbers but the trouble is that computers have limited storage.
00:14:53,00:14:55,Think about the odometer on your car.
00:14:55,00:15:00,"It rolls up to 99,000 kilometers or miles and then goes back to zero again."
00:15:00,00:15:04,So that's the whole problem that your clock is suddenly wrong and then you get mismatches.
00:15:04,00:15:07,So the Aryan 5 had a problem with that as well.
00:15:07,00:15:12,"This is also like Donkey Kong where if you get such a high score, you can't handle it."
00:15:12,00:15:13,It goes to the kill screen.
00:15:13,00:15:14,Really?
00:15:14,00:15:15,That's how much does that work?
00:15:15,00:15:17,That's such a high score.
00:15:17,00:15:18,"No, that's what you see."
00:15:18,00:15:20,There's an incredible Donkey.
00:15:20,00:15:21,Donkey Mentry.
00:15:21,00:15:22,A Donkey Mentry.
00:15:22,00:15:23,A Donkey Mentry.
00:15:23,00:15:25,A Donkey Mentry called King of Kong.
00:15:25,00:15:27,Highly recommend watching it and that's it.
00:15:27,00:15:32,You get to the kill screen. It's known as the numbers can't handle it and the whole computer sort of explodes within.
00:15:32,00:15:38,"Well, now that sci-guy, the Korean guy, it was his style of Daniel Stone."
00:15:38,00:15:49,So he nearly killed the YouTube counter because two to the 32 divided by a half takes you up to 2.14 billion views.
00:15:49,00:15:56,And I saw that they were getting close to the 2.14 billion views out of a world population of only seven.
00:15:56,00:16:02,"So they then went to 64 billion, which is 292 billion."
00:16:02,00:16:06,Space Invaders is another game that is the way it is because of a bug.
00:16:06,00:16:11,So you know the point of Space Invaders is that you've got to shoot down all the little ships that are coming down to get you.
00:16:11,00:16:15,"And as you shoot more and more down, they come down faster and there's a difficulty curve."
00:16:15,00:16:17,That wasn't supposed to be the case when they built it.
00:16:17,00:16:23,"It was just that when you played the game, the machines that it was running on weren't fast enough powerful enough."
00:16:23,00:16:25,They weren't powerful enough to run the program at full speed.
00:16:25,00:16:28,So the program was actually running quite slowly at the beginning.
00:16:28,00:16:31,"The more ships you shot down, the less data there was to process."
00:16:31,00:16:32,So the faster it was able to run.
00:16:32,00:16:39,"And when the guy who made the game ran it, he realized that was actually a really great difficulty curve to play the game on."
00:16:39,00:16:43,"So a couple of things about the Millennium Bug, which I thought you might like to know."
00:16:43,00:16:52,"In February 1999, hundreds of people made panicked phone calls to Action 2000, which was the British body for dealing with the Millennium Bug."
00:16:52,00:17:01,"After Richard Maidley, TV host, on this morning, gave people a look at his Millennium cupboard, which was full of tin food and candles."
00:17:01,00:17:06,And he recommended that people stockpile 10 weeks worth of food for after the Millennium.
00:17:06,00:17:07,Oh my god.
00:17:07,00:17:10,I think hundreds of calls just because Richard Maidley had done this.
00:17:10,00:17:13,And the World Health Organization said that nuclear reactors might be at risk.
00:17:13,00:17:15,"Well, there's a lot of clocks in them."
00:17:15,00:17:16,"They've all got clocks, I know."
00:17:16,00:17:20,And we will never know how much was because a lot of money was spent fixing the problem.
00:17:20,00:17:22,And how much was hype?
00:17:22,00:17:23,"I mean, there was definitely hype."
00:17:23,00:17:26,And I think a lot of people made a stack of money selling pieces.
00:17:26,00:17:27,Yeah.
00:17:27,00:17:30,I know a lot of IT people who were honest.
00:17:30,00:17:32,And they said they worked their little butts off.
00:17:32,00:17:33,"Right, yeah."
00:17:33,00:17:33,Right.
00:17:33,00:17:35,We should move on to our next fact.
00:17:35,00:17:37,"One very, very quick last thing."
00:17:37,00:17:38,Go for it.
00:17:38,00:17:39,On the Millennium Bug.
00:17:39,00:17:41,This was a Millennium Style Bug.
00:17:41,00:17:46,"So last year, 2014, the US Army sent 14,000 conscription letters out."
00:17:46,00:17:49,All to men who had been born in the 1800s.
00:17:49,00:17:52,And they sent it to their descendants.
00:17:52,00:17:58,"So they say your great-grandfather must report for military service on pain of a fine or imprisonment, if he doesn't."
00:17:58,00:17:59,There you go.
00:17:59,00:18:02,The youngest of them would have been 117 years old.
00:18:02,00:18:10,"Okay, time for fact number three."
00:18:10,00:18:11,And that is Alex.
00:18:11,00:18:17,My fact this week is that Buckminster Fuller's complete diaries take up over 80 metres of shelf space.
00:18:17,00:18:22,So the thing I'll just quickly go through his life because he's a completely mad individual.
00:18:22,00:18:23,I think he's quite famous in America.
00:18:23,00:18:28,"He was this writer, architect, scientist, inventor, general thinker."
00:18:28,00:18:29,He did an awful lot for science.
00:18:29,00:18:31,He did an awful lot for science fiction.
00:18:31,00:18:34,"He was that kind of area, very kind of theoretical."
00:18:34,00:18:38,"When he was much younger, he wasn't very good at school, but he did a lot of practical mechanics."
00:18:38,00:18:41,He had all sorts of jobs inventing from age 12.
00:18:41,00:18:44,He went to Harvard and got expelled twice.
00:18:44,00:18:46,I can't find anyone else has been expelled twice.
00:18:46,00:18:51,The first time was suspending all his money on a massive party with a vaudeville troupe.
00:18:51,00:18:54,He just took all of the money that he could find and spend all on one big party.
00:18:54,00:18:58,And the second time was for general irresponsibility and lack of interest.
00:18:58,00:19:00,"So I mean, that's pretty impressive."
00:19:00,00:19:05,So he was he was mechanic for a had lots of random jobs in 1927.
00:19:05,00:19:09,He's daughter died of polio and he went into a very deep depression for about a year.
00:19:09,00:19:11,He was on the brink of suicide.
00:19:11,00:19:18,"He went to the edge of Lake Michigan, I think it was, and supposedly had an outer body experience and came out of it realizing,"
00:19:18,00:19:21,"""Okay, I've got to develop the rest of my life to helping to the advance of humanity."""
00:19:21,00:19:26,"So he immediately went into overdrive for the rest of his life and invented all these weird things,"
00:19:26,00:19:31,"made interesting concepts, became went into lecturing and did these incredible lecture circuit tours."
00:19:31,00:19:39,"He wants to just, I mean, because this is a man who his diary takes up as we say 80 meters of shelf space."
00:19:39,00:19:42,"So he was writing his diary every 15 minutes, wasn't he?"
00:19:42,00:19:49,"So every 15 minutes, adding new stuff to it, he once gave a 42 hour long video lecture."
00:19:49,00:19:52,"And it's on YouTube and if you haven't seen it, it's one of his finest moments."
00:19:52,00:19:56,"So not straight, I'm sure there must have been 42 minute lectures."
00:19:56,00:20:02,"No, no, someone once said, and this lecture, by the way, was called ""Everything I Know."""
00:20:02,00:20:09,"But some people who had actually, I read an article by someone whose friend was one of his students,"
00:20:09,00:20:14,"and they said that he could go for no break with no notes from 9 a.m. to 5 p.m., with just not stopping."
00:20:14,00:20:20,"It's just a lecture that, and people used to stay that long because it was a marathon of amazing information coming out from this guy."
00:20:20,00:20:26,"It was very deep, like he was one of the early people to start thinking about the environment."
00:20:26,00:20:32,"And he came up with this thing that he called ""The World Game,"" which on the face of it is basically,"
00:20:32,00:20:38,"how can we make things better for everybody in terms of justice, poverty, education,"
00:20:38,00:20:43,with the limited resources that we have because the earth is not infinite?
00:20:43,00:20:45,"And he loved the word ""diamaxian."""
00:20:45,00:20:47,Now what's the origin of?
00:20:47,00:20:51,"So I think he used it when he was talking to some friends, when he was explaining something,"
00:20:51,00:20:57,"and it's a dynamism, maximum, and ion of the three. It's a poor mancher of those three."
00:20:57,00:21:01,"And it was sort of his brand. He all the inventions, he could have put this name to it."
00:21:01,00:21:05,"So his diary, he called ""The Diamaxian Chronophile,"" which is a great name."
00:21:05,00:21:08,"So the thing he's probably most famous coming up with is the G.R.D. Sixth Fair,"
00:21:08,00:21:14,"which is a structure that is spherical, made of triangles, or a polygon shape."
00:21:14,00:21:18,"And it's this amazingly futuristic piece of architecture, really."
00:21:18,00:21:24,"I really love that he came up with it, and then a few years later, it was discovered in nature."
00:21:24,00:21:28,"And he was really big about taking, he really liked the idea of taking designs from nature"
00:21:28,00:21:31,"because those are going to be the best designs, but he actually found this one."
00:21:31,00:21:34,"And it was found to be in a type of carbon, which is now called Buckman's to Fullerine."
