start_hhmmss,end_hhmmss,text
00:21:34,00:21:35,Oh wow.
00:21:35,00:21:37,Do you know the amazing thing about Buckman's to Fullerine?
00:21:37,00:21:42,Is that footballs are in the shape of Buckman's to Fullerine molecules.
00:21:42,00:21:46,"They're a mix of, what is it? Triangles and some hexagons."
00:21:46,00:21:50,So the Eden project is another example of one of those domes.
00:21:50,00:21:53,"It's made, that one's made of hexagons, but obviously you can divide that up his triangles."
00:21:53,00:21:58,"And the Eden project was originally an association football, and they just kept inflating it."
00:21:58,00:22:00,They never stopped.
00:22:00,00:22:05,"Do you know what, so the Eden project is, the whole building is basically a massive inflatable tent."
00:22:05,00:22:09,"Whenever there's a puncture, which is quite a lot, because they just tape it up."
00:22:09,00:22:10,Does you know that?
00:22:10,00:22:13,"It's just covered in plaster, like a bicycle park."
00:22:13,00:22:18,"Well, because I read that he had a house, which was made of this globe as well."
00:22:18,00:22:23,"And he had a leak, so they tried to get it fixed."
00:22:23,00:22:26,"And as they were fixing it, they burnt the whole place down."
00:22:26,00:22:28,"Yeah, so fixing it with fire."
00:22:28,00:22:33,"I have no idea what they did, but maybe that's why they just sell it to things now."
00:22:33,00:22:36,So his invention that I like most.
00:22:36,00:22:41,"So he made this car of which I think there's only one left now that we have called the Dimaxi in Vehicle,"
00:22:41,00:22:44,"which looked like a Zeppelin, and it had three wheels."
00:22:44,00:22:47,"And apparently when it came out, it was the hit of all cars."
00:22:47,00:22:51,It could apparently maneuver itself to a 180 on the spot.
00:22:51,00:22:53,"So if you were driving, it could literally just go woo!"
00:22:53,00:22:55,Because it had back wheel steering.
00:22:55,00:23:00,It had fixed front wheels and a single rotating back wheel.
00:23:00,00:23:01,That's incredible.
00:23:01,00:23:04,And no rear-view mirror.
00:23:04,00:23:06,It had a periscope.
00:23:06,00:23:07,It just sounds like...
00:23:07,00:23:08,And I've seen a picture.
00:23:08,00:23:09,It looks like a Kombi van.
00:23:09,00:23:13,"It's yeah, and he aspired to make it fly later on."
00:23:13,00:23:15,But that never came back.
00:23:15,00:23:20,But it was so unfair because there was the first prototype of the Dimaxi in Vehicle.
00:23:20,00:23:24,"It'd been on the road for three months, and it was being shown off at the Chicago World's Fair."
00:23:24,00:23:27,"And it was involved in a crash, which killed the driver."
00:23:27,00:23:29,"But it was, I'm seriously injured, a passenger."
00:23:29,00:23:31,But it wasn't the fault of that car.
00:23:31,00:23:33,It was another car which had caused the accident.
00:23:33,00:23:36,But it sort of set the world against it.
00:23:36,00:23:39,And I think only two more were built.
00:23:39,00:23:41,"And as you say, there's only one surviving today."
00:23:41,00:23:42,Yeah.
00:23:42,00:23:45,So he deliberately built it not so much as a car.
00:23:45,00:23:49,But as something that included car-like properties.
00:23:49,00:23:52,So he thought it would be something that would go on water and in the air.
00:23:52,00:23:55,And in fact it was unstable at high speeds on the highway.
00:23:55,00:23:59,Because that's what you needed for us properties to be a moving vehicle.
00:23:59,00:24:01,So he saw it as an intermediate stage.
00:24:01,00:24:05,And it specifically said that it should be driven only by people who were skilled in it.
00:24:05,00:24:08,"In other words, it's a really unstable vehicle, really scary."
00:24:08,00:24:12,And you can kill yourself if you try to drive like a normal car on highway speeds.
00:24:12,00:24:16,But it was great. He came up with 10 cigarettey things as well.
00:24:16,00:24:17,Amazing.
00:24:17,00:24:19,I was just fine. He invented everything for himself.
00:24:19,00:24:21,He invented his own sleep cycle.
00:24:21,00:24:22,He slept.
00:24:22,00:24:25,He would spend six hours awake and 30 minutes asleep.
00:24:25,00:24:26,And he spent two years doing that.
00:24:26,00:24:29,And he says the only reason he gave it up was because his colleagues couldn't keep up with the schedule.
00:24:29,00:24:31,Because he would have 22 hours in the day when he was working.
00:24:31,00:24:34,How did he keep up the diary if he updated every 15 minutes?
00:24:34,00:24:35,I don't know.
00:24:35,00:24:38,"But I mean, maybe he just went back because he knew he was sleeping."
00:24:38,00:24:39,He used to be like 202 sleeping.
00:24:39,00:24:42,How many years did he keep the diary going for?
00:24:42,00:24:44,1920 to 1983.
00:24:44,00:24:45,The half a century.
00:24:45,00:24:47,"He started it when he was 25, finished it."
00:24:47,00:24:51,He included everything he ever wrote apparently since he was four years old.
00:24:51,00:24:54,So he obviously kept everything and then put it all together in a diary.
00:24:54,00:24:56,Did you hear the story about how he died?
00:24:56,00:24:57,Yes.
00:24:57,00:24:59,It's kind of like the notebook.
00:24:59,00:25:04,"The movie the note, but he basically he was according to some sources."
00:25:04,00:25:07,How he died was he was at his wife's bedside and she was in a coma.
00:25:07,00:25:09,And so he was visiting her at hospital.
00:25:09,00:25:15,They said that he got over excited by the fact that he felt as if she had squeezed his hand back.
00:25:15,00:25:18,As if he had had some contact and the over excitement is kind of what ended him.
00:25:18,00:25:19,And they both died.
00:25:19,00:25:22,I think it was in the same week and within hours.
00:25:22,00:25:23,"Within hours, right."
00:25:23,00:25:24,Yeah.
00:25:24,00:25:25,"I mean, it's very."
00:25:25,00:25:26,Yeah.
00:25:26,00:25:29,He had to have what he has on his gravestone.
00:25:29,00:25:30,Yeah.
00:25:30,00:25:35,"Call me trim tab, which is the trim tab is a little mechanical component in aeroplane that makes tiny movements,"
00:25:35,00:25:37,but moves the entire rudder of blame.
00:25:37,00:25:39,And that makes that that steers an entire plane.
00:25:39,00:25:40,And that was what he wanted to be.
00:25:40,00:25:41,He wanted to be.
00:25:41,00:25:44,He really believed that a single person can make a huge difference.
00:25:44,00:25:47,So he wanted to be that person that was helping to govern humanity and to greater.
00:25:47,00:25:49,"He popularized the phrase, spaceship birth."
00:25:49,00:25:51,He was one of the people who was really blind.
00:25:51,00:25:52,I love that.
00:25:52,00:25:54,I love the idea that the earth is a spaceship.
00:25:54,00:25:58,We have limited resources and we need to act as a big team to kind of keep it running.
00:25:58,00:25:59,"It's such a good message, isn't it?"
00:25:59,00:26:00,It's so good.
00:26:00,00:26:02,I've got one last thing on him.
00:26:02,00:26:03,He released an LP.
00:26:03,00:26:04,A music album.
00:26:04,00:26:05,No.
00:26:05,00:26:06,"Yes, he did."
00:26:06,00:26:10,"No, so it includes a song which you can see on YouTube."
00:26:10,00:26:12,You can see him actually singing on YouTube.
00:26:12,00:26:15,"So it's the, you know, the song Home on the Range."
00:26:15,00:26:19,"So he's saying that, but he rewrote the lyrics to call it ""Rome Home to a Dome""."
00:26:19,00:26:20,Oh.
00:26:20,00:26:21,Yeah.
00:26:21,00:26:22,And that's on YouTube.
00:26:22,00:26:24,"Yeah, exactly."
00:26:24,00:26:28,"It was very, very favorite of Buckminster Fuller's inventions."
00:26:28,00:26:32,"He, when he used stairs, didn't say I'm going upstairs or downstairs."
00:26:32,00:26:38,"He said, I'm going in stairs or out stairs because you're either going in towards the center of the planet."
00:26:38,00:26:41,Or you're going out away from the center of the planet.
00:26:41,00:26:43,That was his thing about spaceship earth.
00:26:43,00:26:47,"It just makes you think, oh yeah, I am actually moving towards the center of the earth."
00:26:47,00:26:49,Whereas I thought I was going downstairs.
00:26:49,00:26:50,Right.
00:26:50,00:26:52,He specializes in making up his own words.
00:26:52,00:26:54,He was somewhat convoluted.
00:26:54,00:26:55,He was really convoluted.
00:26:55,00:26:56,It's really convoluted.
00:26:56,00:27:00,"It's like Omni Self Regenerative, Omni Wellin, he loved Omni, everything was Omni."
00:27:00,00:27:03,He also claimed to have invented the word debunk.
00:27:03,00:27:04,Yeah.
00:27:04,00:27:06,But no one can debunk it because he's out of his mind.
00:27:06,00:27:07,He's out of his mind.
00:27:07,00:27:08,He's out of his mind.
00:27:08,00:27:09,He's out of his mind.
00:27:09,00:27:13,"Okay, time for our final fact of the show."
00:27:13,00:27:14,And that is my fact.
00:27:14,00:27:19,My fact this week is that Australian scientists have recently named a newly discovered species of fish.
00:27:19,00:27:20,Blue bastard.
00:27:20,00:27:22,That's the name that they've given it.
00:27:22,00:27:28,"There is a Latin name that they've given this fish, which is something I cannot pronounce."
00:27:28,00:27:29,It's so long.
00:27:29,00:27:30,Do you want to have a go?
00:27:30,00:27:31,I'll have a go.
00:27:31,00:27:34,I think it's called Plectorinches chiruleonothus.
00:27:34,00:27:35,Yep.
00:27:35,00:27:43,"So it's the chiruleonothus, which when you break it down into two separate words, is blue in Latin and bastard."
00:27:43,00:27:47,It's quite nice because that was apparently it was a local fish in Australia.
00:27:47,00:27:52,"That was apparently it was a local fish in Australia that the fishermen, the local fishermen used to call blue bastard"
00:27:52,00:27:54,because they weren't quite sure what it was.
00:27:54,00:27:56,They eventually got their hands on it.
00:27:56,00:27:59,Scientists and they named it as a species found out it was a new species.
00:27:59,00:28:00,And yeah.
00:28:00,00:28:01,And that's...
00:28:01,00:28:03,They called it blue because it was blue in colour.
00:28:03,00:28:06,"It started off with a yellowish colour and the older it got, the bluer it got."
00:28:06,00:28:09,And bastard because it was really hard to catch.
00:28:09,00:28:14,Because it hung around in murky waters where there were either sharks or crocodiles or both.
00:28:14,00:28:22,And it came into the modern parlance via some fisherman in Weeper photographing it.
00:28:22,00:28:24,And here's something weird for you.
00:28:24,00:28:31,"Weeper is one of the few places in the world where instead of getting two high tides and two low tides a day,"
00:28:31,00:28:32,you want to get one?
00:28:32,00:28:33,That was in my eighth book.
00:28:33,00:28:35,[Laughter]
00:28:35,00:28:36,"Oh, how come?"
00:28:36,00:28:40,Because you get the water flooding into the rivers from the high tide.
00:28:40,00:28:44,"And as it comes back, it exactly counteracts the next tide."
00:28:44,00:28:46,The low tide fills it out and smers it out into nothing.
00:28:46,00:28:51,Think of a bathtub and then a large breadboard.
00:28:51,00:28:54,"Then with a breadboard, it went into the bathtub, it's full of water."
00:28:54,00:28:56,You just sort of pat.
00:28:56,00:28:59,And then you wait for the wave to go down to the other end and come back.
00:28:59,00:29:04,"And then depending on when you do the next pat, you can either wipe out the wave."
00:29:04,00:29:07,Or you can build it up into something that will swoosh over the edge.
00:29:07,00:29:13,So it's a resonance thing. I found that out by talking to people at the National Tidal Centre in Flinders University of Australia.
00:29:13,00:29:16,You've got it by dropping a breadboard into a bathtub.
00:29:16,00:29:20,I've been finding out about Australian fish because we've got a lot of great Australian.
00:29:20,00:29:23,You guys have a lot of great Australian fish.
00:29:23,00:29:24,Thank you.
00:29:24,00:29:26,The number of fish that you've got.
00:29:26,00:29:31,"You've got unicorn cod, squirrel fishes, wasp fishes, armored sea robins."
00:29:31,00:29:34,I love this out of an armored sea robin.
00:29:34,00:29:36,"Sea bats, wolf herrings."
00:29:36,00:29:38,"Gobble guts, pony fishes."
00:29:38,00:29:40,Gobble guts sounds very Aussie.
00:29:40,00:29:41,Gobble guts is amazing.
00:29:41,00:29:44,"I can't remember whether this is Australian or not, but there is a fish called the Slippery Dick."
00:29:44,00:29:45,Just one of them.
00:29:45,00:29:48,"Yeah, I don't think it is an Aussie, but yeah, there is one called the Slippery Dick."
00:29:48,00:29:50,It's a creature's lot of mucous.
00:29:50,00:30:00,"I've just got a couple of things just because as an Australian, very proud that all these species of fish are being named in a nice Australian fashion."
00:30:00,00:30:10,"And it was also big news for Australian science because the ignobiles, the prizes that make you laugh and make you think, awarded a prize to an Australian scientist."
00:30:10,00:30:17,And it was a chemistry professor called Colin Rasten and he's worked out how to unboil an egg.
00:30:17,00:30:20,And so that he won an award for unboiling an egg.
00:30:20,00:30:22,Which means that you could unboil it.
00:30:22,00:30:25,Separate out the yolk and give it to the people who are allergic to the white.
00:30:25,00:30:26,Yeah.
00:30:26,00:30:33,"But is it if your eggs been incorrectly boiled, you can say, take this back, please unboil it and re-boil it for three minutes."
00:30:33,00:30:34,And off a six.
00:30:34,00:30:36,"Well, it might be when you're at home and you've eaten too much."
00:30:36,00:30:38,What are we going to do with this boiled egg?
00:30:38,00:30:41,Let's unboil it and re-boil it on duty.
00:30:41,00:30:43,"No, I don't want to boil it once you've eaten it."
00:30:43,00:30:44,All right.
00:30:44,00:30:45,What about mad cow disease?
00:30:45,00:30:46,Proteins.
00:30:46,00:30:47,Uh-huh.
00:30:47,00:30:48,Right.
00:30:48,00:30:55,"So imagine we have a situation where in the United Kingdom, some people are carrying pre-ons, prions, PR-I-O-N-S in their blood."
00:30:55,00:30:58,Which are just proteins that have been misformed.
00:30:58,00:31:01,"And when they kiss another similar protein, they misform that."
00:31:01,00:31:04,Imagine you can reverse the process.
00:31:04,00:31:10,"Ah, see, it makes you think and it makes you laugh and learn at the same time the ignobiles."
00:31:10,00:31:12,I do love the ignoble prizes.
00:31:12,00:31:16,And I should mention at the beginning that I myself have won an ignoble prizes.
00:31:16,00:31:17,That's extraordinary.
00:31:17,00:31:24,"So for those listening who don't know what the ignoble prizes are, that is the yearly award system given to scientists who first come up with research."
00:31:24,00:31:28,That in the eyes of the ignobiles make you laugh and then make you think.
00:31:28,00:31:29,That's right.
00:31:29,00:31:30,Laugh and learn.
00:31:30,00:31:34,And my groundbreaking research was for belly button fluff and why it's almost always blue.
00:31:34,00:31:35,No.
00:31:35,00:31:37,"And for that, I got my ignoble prizes."
00:31:37,00:31:44,And Harvard showed me so much respect that they flew me all away from Sydney to Harvard at my own expense.
00:31:44,00:31:47,They would not insult me by offering me money.
00:31:47,00:31:49,That's how much respect it is.
00:31:49,00:31:59,"That is how highly valued this prize is and then for the next month I had people wanting to have a section as a share of my $1 million prize,"
00:31:59,00:32:03,"which they thought was wrongly the noble prize, not the ignoble prize."
00:32:03,00:32:06,It was sort of red wind up chattering teeth on a stick.
00:32:06,00:32:07,"Right, that was the prize."
00:32:07,00:32:08,That was the prize.
00:32:08,00:32:12,"On a tile written in very bad, it's the colour that faded immediately."
00:32:12,00:32:13,Right.
00:32:13,00:32:16,"Wow, I didn't realise we had the ignoble prize."
00:32:16,00:32:23,I was trying to keep someone out of part from bringing it up into every conversation I possibly can as a very first sentence.
00:32:23,00:32:28,"So not only is Colin Raston and yourself, Dr. Carl, ignoble winners."
00:32:28,00:32:29,There are more.
00:32:29,00:32:31,Lawyers prefer to call themselves.
00:32:31,00:32:33,Nick Enfield.
00:32:33,00:32:35,He did have it.
00:32:35,00:32:36,"Yeah, he works out that."
00:32:36,00:32:43,"It was a universal word amongst languages, universal word amongst languages."
00:32:43,00:32:45,Is there a universal meeting?
00:32:45,00:32:46,Huh.
00:32:46,00:32:47,Huh.
00:32:47,00:32:50,"Hey, there's an Australian was called aha."
00:32:50,00:32:57,It was discovered by a guy called Arnold Minky in 1977 and he called it that because he went aha when he found it.
00:32:57,00:32:59,"So where does the actual har, sorry, the additional har."
00:32:59,00:33:02,"I don't know where the second har comes from, but it's called aha."
00:33:02,00:33:05,That's when he told someone about it and they said aha.
00:33:05,00:33:07,So his number plate.
00:33:07,00:33:09,Did he name the fish after his number plate?
00:33:09,00:33:10,"No, he got the number plate."
00:33:10,00:33:11,He was very proud.
00:33:11,00:33:12,It was a wasp.
00:33:12,00:33:14,"Sorry, sorry wasp."
00:33:14,00:33:32,"Can I can I mention one more ignoble winner, which was it was in the mathematics prize for the ignobels and it was a some Australian scientists and they want it for calculating the number of photographs that mathematically will make it highly unlikely that anyone in a group photo has their eyes closed."
00:33:32,00:33:34,"Oh, Nick, she was my work experience person."
00:33:34,00:33:35,"Oh, really?"
00:33:35,00:33:44,"Yeah, I'm like, well, I bring this up because it's the subject of photos and when we were looking into just a few things about you as you were coming on the show."
00:33:44,00:33:49,We discovered that you have a claim to the coining of the word selfie.
00:33:49,00:33:51,You're a part of its origin story.
00:33:51,00:33:52,Yeah.
00:33:52,00:33:56,"So way back in 2012, this is in my 34th book, The House of Karlsman."
00:33:56,00:33:58,Maybe I don't forget the name this too many times.
00:33:58,00:34:11,So a guy called Nigel Hope here after known as Hopi because we Australian shortened things down remove all the following syllables and just put a vowel in so not afternoon but arvo and Hopi
00:34:11,00:34:20,posted that he had fallen over and he'd put his teeth through his lower lip and he had a stitch and she was itchy and how long would it take to stop itching.
00:34:20,00:34:27,"And then the dialogue flowed backwards and forwards and it's 3.19 in the afternoon, I forget the exact day in 2003."
00:34:27,00:34:28,I think it was something September.
00:34:28,00:34:31,"He then posted, look, okay, guys, I was drunk."
00:34:31,00:34:32,I fell over.
00:34:32,00:34:34,Here's a selfie.
00:34:34,00:34:35,"Sorry, it's out of focus."
00:34:35,00:34:37,Here's a photo of my face.
00:34:37,00:34:38,"Sorry, it's out of focus."
00:34:38,00:34:39,Here's the exact words.
00:34:39,00:34:41,"Sorry, it's out of focus, comma."
00:34:41,00:34:43,It's a selfie.
00:34:43,00:35:00,"And that, according to the Oxford English Dictionary who made that word, the word of the year in 2013, that was the first time ever in the history of the human race, that the word was written down in any medium, now known all here after yet to be devised and guess whose home page it appeared on."
00:35:00,00:35:02,Mine.
00:35:02,00:35:05,Dr. Carl Q&A home page.
00:35:05,00:35:06,That's so good.
00:35:06,00:35:17,"Okay, that's it. That's all of our facts. Thank you so much for listening. If you'd like to get in touch with any of us about the things we said over the course of this podcast, we can all be found on Twitter."
00:35:17,00:35:19,I'm on @Sriberland.
00:35:19,00:35:20,Alex.
00:35:20,00:35:21,Alex Bell under school.
00:35:21,00:35:22,Andy.
00:35:22,00:35:23,Andrew Hunter M.
00:35:23,00:35:24,Dr. Carl.
00:35:24,00:35:28,D-O-C-T-O-R-K-A-R-L.
00:35:28,00:35:29,The long version.
00:35:29,00:35:31,The long version of Dr. Carl?
00:35:31,00:35:39,"Okay, so you can also go to Dr. Carl's website. He has so many blogs. They're amazing. We find a lot of the stuff on this show through Dr. Carl. He's absolutely here as far as."
00:35:39,00:35:48,"And if you want to hear our other episodes, you can go to no such thing as fish.com. We've got our backlog of episodes there. We will be back again next week. Thank you so much for listening. See you then. Goodbye."
00:35:48,00:36:06,[Music]
00:36:06,00:36:32,"That architect saying, ""I was soliciting, rich clients and hards to their knees, just give your home in a great circle down, where the stresses and strains are at ease. Run home to a door on the crest of a neighboring hill, where the chores are all done."
00:36:32,00:36:58,"Before they've begun, that eclectic nonsense is near. Let modern folk scream, out glass boxes are seen, out of lungs, superb of the way, split levels, split lungs, split red minerals, no down money, life time to die. Run home to a door."
00:36:58,00:37:10,"No backer would back will you die? No mortgage to show? No payments to go? Well, you dream well and spend your own time."""
00:37:10,00:37:14,[Applause]
00:37:14,00:37:24,"I'm shy about the voice, but... [Laughter]"
