start_hhmmss,end_hhmmss,text
00:00:00,00:00:03,"Hey everyone, big news, no such thing as a fish is turning three."
00:00:03,00:00:10,"Yeah, it's our birthday coming up on March the 9th and we are going to celebrate it by throwing a big party."
00:00:10,00:00:13,"Well, actually, it's a live recording, but we're calling it a big party."
00:00:13,00:00:16,"And if you want to come along, it's going to be in London."
00:00:16,00:00:20,"It's going to be at our regular recording venue, which is up the creek, which is in Greenwich."
00:00:20,00:00:25,And we're going to be starting at 7.30pm on the 28th of February.
00:00:25,00:00:29,"Tickets are going to be going on sale this coming Monday, the 20th of February."
00:00:29,00:00:35,And they're going to be available at qi.com/fishevents and the tickets will go live at 11am.
00:00:35,00:00:37,It's going to be really fun. There's going to be balloons.
00:00:37,00:00:43,"I've just decided. I've just decided. There's going to be balloons and cake, cake."
00:00:43,00:00:50,We're going to have a cake and Andy is going to do a strip tease and it is going to be packed all together with a live recording.
00:00:50,00:00:52,You'll get to see a show recorded live.
00:00:52,00:00:56,"So please come along, go get the tickets. Again, they'll be available at 11am."
00:00:56,00:00:58,"Monday, the 20th, go to qi.com/fishevents."
00:00:58,00:01:00,"Okay, on with the show."
00:01:00,00:01:04,Three-year-olds birthday party for strip tease.
00:01:04,00:01:09,"And also if you're not interstripping and you're into wearing stuff,"
00:01:09,00:01:11,then we have a hoodie.
00:01:11,00:01:13,No such thing as a fish hoodie.
00:01:13,00:01:17,And you can buy that by going to qi.com/hoody.
00:01:17,00:01:22,"And we also have t-shirts and we have vinyls, but they've just had a big new delivery of the hoodies that come in basically."
00:01:22,00:01:24,All the sizes you could want.
00:01:24,00:01:30,And it has on the back of the hoodie a huge list of our headline facts that we've done in the first year of our podcast.
00:01:30,00:01:35,You want to celebrate the end of winter and the return of wall weather with a new hoodie?
00:01:35,00:01:38,Go ahead and come slash hoodie.
00:01:38,00:01:40,"Okay, on with the show."
00:01:40,00:02:02,"Hello and welcome to another episode of no such thing as a fish, a weekly podcast coming to you from the qi offices in Covent Garden."
00:02:02,00:02:08,"My name is Dan Schreiber and I'm sitting here with James Harkin, Andrew Hunter Murray and Anna Chazinski."
00:02:08,00:02:14,"And once again, we have gathered around the microphones with our four favorite facts from the last seven days and in no particular order."
00:02:14,00:02:17,"Here we go, starting with you Andy."
00:02:17,00:02:25,My fact is the doomsday clock was originally set at seven minutes to midnight because the artist responsible for it thought it looked good.
00:02:25,00:02:27,Those were literally her words.
00:02:27,00:02:35,"She was a lady called Martil Langsdorf and she was asked to come up with a cover for a magazine, basically, but the magazine was the bulletin of atomic scientists."
00:02:36,00:02:41,And she said it looked good to my eye when she drew the doomsday clock at the original thing.
00:02:41,00:02:48,So the doomsday clock for anyone who doesn't know is is a sort of theoretical clock saying how know we are to the end of the world.
00:02:48,00:02:55,And it's put together by a body of atomic scientists and nuclear weapons experts and they have just moved it.
00:02:55,00:03:00,"So we're now two and a half minutes to midnight, which is just about the closest it's ever been."
00:03:00,00:03:03,I think at one point it might have been on two minutes.
00:03:03,00:03:05,"Yeah, I think it was on two at one point. Yeah, you're right."
00:03:05,00:03:07,"Yeah, it was. It was around Cuba Missile Crisis time."
00:03:07,00:03:09,"No, that's the weird thing."
00:03:09,00:03:12,They didn't move it for the Cuba Missile Crisis. Do you know why?
00:03:12,00:03:12,What?
00:03:12,00:03:14,They had no idea what was going on.
00:03:14,00:03:16,They said we just don't have any data to make a judgment.
00:03:16,00:03:18,"Ah, but it wasn't the newspapers."
00:03:18,00:03:24,"Yeah, I don't think they knew whether the missiles were being primed or loaded or whether they were going to get to Cuba or"
00:03:24,00:03:27,but that's one of the times where they didn't change the clock at all.
00:03:27,00:03:29,So were they this artist?
00:03:29,00:03:33,"Hey, was she an atomic scientist as well by night? No, it's by day or?"
00:03:33,00:03:40,"No, she was married to a guy who worked on both the magazine and was also part of the Manhattan project, I believe."
00:03:40,00:03:43,He was one of the scientists who was helping out on that.
00:03:43,00:03:46,She was just asked to design a cover.
00:03:46,00:03:49,So she wasn't even designing a Doomsday clock as such.
00:03:49,00:03:53,"She thought she was going to do a U, the letter U, for uranium as the cover."
00:03:53,00:03:57,"But she noticed in the talk that a deadline was sort of looming and she thought,"
00:03:57,00:04:00,"like a clock going to 12, it's just on its way kind of thing."
00:04:00,00:04:02,"It's an analog clock as well, isn't it?"
00:04:02,00:04:06,So we don't know for sure that it's not like two minutes to midday.
00:04:06,00:04:08,"Yeah, absolutely fine."
00:04:08,00:04:11,"Oh, that's great. We're whole 12 hours away."
00:04:11,00:04:15,I think they gave us not very much wiggle room by putting it seven minutes to.
00:04:15,00:04:17,"And I think that's causing the problem now, isn't it?"
00:04:17,00:04:20,"Because actually the world could get much, much more dangerous before catastrophe."
00:04:20,00:04:26,"And so for instance, now is the first time that they've only added half a minute rather than a full minute."
00:04:26,00:04:29,"Yeah, because clearly we're getting closer and closer to midnight,"
00:04:29,00:04:32,but you don't want to say we've gone a full third of the way closer.
00:04:32,00:04:36,"It is like a parent saying, I'm going to count to three to a naughty child."
00:04:36,00:04:42,"And like one, two, two and a half, two and a half, two and three quarters."
00:04:42,00:04:46,Do they factor in for when the clock's going forward?
00:04:46,00:04:52,I think the important thing for everyone listening is that there is no scientific basis
00:04:52,00:04:54,or proper scale to this clock.
00:04:54,00:04:57,They just kind of wing it. There is scientific basis as in.
00:04:57,00:05:01,It's a load of scientists who come up with it and assess whether the world is more dangerous or less dangerous.
00:05:01,00:05:05,"Yeah, but it's sort of an arbitrary scale, you know, they haven't actually worked out."
00:05:05,00:05:08,This is 20% more dangerous than it was yesterday in it.
00:05:08,00:05:13,"But it's just, I think it's just 10 scientists and security experts and they just get together in a room, don't they?"
00:05:13,00:05:15,And they just kind of discuss things.
00:05:15,00:05:20,"And then at the end of the day before they crack open the whiskey, they go, okay, what we're going to say?"
00:05:20,00:05:22,"Two minutes. Pretty much that, isn't it?"
00:05:22,00:05:26,"So the Manhattan project, you know, when it was underway."
00:05:26,00:05:30,"So this is when they, obviously, Oppenheimer and co-exploded an atomic bomb."
00:05:30,00:05:38,"They discussed at the time when they were planning the Manhattan project, the possibility that it could, in fact, blow up the entire world."
00:05:38,00:05:47,"So one of the guys working on it, Edward Teller did some calculations and he said that it was possible that the explosion they generated would create this"
00:05:47,00:05:53,"vision reaction that generated heat so intense that it would trigger, run away fusion in the atmosphere."
00:05:53,00:05:55,"Now, I only know what a few of those words mean."
00:05:55,00:06:01,"Essentially, the explosion was going to generate such a huge heat that the fusion in the atmosphere would spread all around the world."
00:06:01,00:06:02,And the world would explode.
00:06:02,00:06:07,"We'd basically become a sun, which is like the sun's energy comes from nuclear fusion, isn't it?"
00:06:07,00:06:09,"Yeah, exactly."
00:06:09,00:06:15,"I really like that Oppenheimer said at one point, and this is before the Manhattan project, that in an interview he said,"
00:06:15,00:06:20,"""Two great loves are physics and desert country. It's a pity they can't be combined."""
00:06:20,00:06:24,And then he actually had the chance to marry his two great loves.
00:06:24,00:06:28,But marry them by blowing one of them up.
00:06:28,00:06:35,"My third love, of course, is tiny uninhabited islands in the South Pacific."
00:06:35,00:06:42,"So on the end of the world, there are lots of stories recently about preppers, I think, like us."
00:06:42,00:06:45,"And people, so there's been a recent news story that everyone is buying a house in New Zealand."
00:06:45,00:06:50,"Everyone, everyone who's anyone and has a billion pounds is buying a house in New Zealand."
00:06:50,00:06:53,My buddy Reese bought a house in New Zealand recently.
00:06:53,00:06:54,He's from New Zealand.
00:06:54,00:06:55,"Yeah, he lives there."
00:06:55,00:06:58,I don't think he counts as a prepper in that case.
00:06:58,00:07:03,Because they think it's less likely to be bombed because everyone basically likes people from New Zealand.
00:07:03,00:07:05,They're pretty innocuous people.
00:07:05,00:07:08,But what about Mordor? That's there. That's very dangerous.
00:07:08,00:07:10,"That's true. That is a rogue nation, if ever there was one."
00:07:10,00:07:15,"But did you know, before the American election in November,"
00:07:15,00:07:21,"prepper meal firms, a lot of them saw sales triple in the three weeks leading up to the election."
00:07:21,00:07:22,Wow. Yeah.
00:07:22,00:07:27,Which is substantial because people were thinking it's all going to kick off once we've had the election.
00:07:27,00:07:29,Do they think that would be his first move?
00:07:29,00:07:31,"Literally get into the White House, the red button."
00:07:31,00:07:37,I was reading a prepper's list of things that you take into your bunker with you.
00:07:37,00:07:39,"Should the apocalypse happen, do as they arrive?"
00:07:40,00:07:43,This was actually a crack article and they were saying that one of the things that's on the list
00:07:43,00:07:48,that sticks out as quite odd is non-lubricated condoms.
00:07:48,00:07:51,And they say you should have lots of non-lubricated condoms.
00:07:51,00:07:52,Lubricated condoms?
00:07:52,00:07:54,"So cracked, they start saying, okay, it kind of makes sense."
00:07:54,00:07:57,Imagine if there's a big group down there and suddenly STI starts spreading.
00:07:57,00:08:00,So you want to make sure that in any sex that that's happening.
00:08:00,00:08:02,"But then you think, okay, why non-lubricated condoms?"
00:08:02,00:08:07,Turns out that condoms are incredibly practical as a thing to have.
00:08:07,00:08:10,It's almost like if you were out in a bare-grill situation with nothing.
00:08:10,00:08:12,"You can carry water in them, can you?"
00:08:12,00:08:14,"You can carry water in them, where it's called the..."
00:08:14,00:08:16,"Yeah, yeah, yeah, I can carry two leaders."
00:08:16,00:08:17,They're non-lubricated as well.
00:08:17,00:08:20,I'm just going to put a bottle in the bunker and carry my water in there.
00:08:20,00:08:22,You'll be totally around your condom.
00:08:22,00:08:25,You can put them around your head and blow it up with your nose.
00:08:25,00:08:26,"Yeah, for fun, yeah."
00:08:26,00:08:30,"Because you need entertainment in these bunkers, very dry places."
00:08:30,00:08:31,You can make a slingshot out of them.
00:08:31,00:08:32,"No, you can't."
00:08:32,00:08:33,"Yeah, you can."
00:08:33,00:08:37,"So, there's the Prepper's Journal and they have 11 ways a condom can save your life."
00:08:37,00:08:43,And one of them is make a slingshot and it acts as the actual bit of rubber that you pull back on.
00:08:43,00:08:48,"And they show you how to make it, so you carve out the wood and then you strap two condoms and tie them up."
00:08:48,00:08:49,That's going to save your life.
00:08:49,00:08:54,It says a giant coming and you need to send a small boy to defeat him.
00:08:54,00:08:58,"And in the post-New Clear Landscape, there probably will be giants walking around there."
00:08:58,00:08:59,I hope to be for this.
00:08:59,00:09:02,Any other ways a condom can save your life?
00:09:02,00:09:04,"Starting fires, starting fire."
00:09:04,00:09:05,Starting fires.
00:09:05,00:09:08,That's why sex is such a dangerous business.
00:09:08,00:09:09,That's the song.
00:09:09,00:09:11,This sex is on fire.
00:09:11,00:09:14,Due to this non-lubricated condom.
00:09:14,00:09:18,It's that friction.
00:09:18,00:09:20,Does it say how you might start a fire with a condom?
00:09:20,00:09:25,"Well, actually, it's not about starting the fire, it's about protecting Tinder from moisture."
00:09:25,00:09:27,Not your Tinder app.
00:09:30,00:09:34,It does feel like that list is compiled by completely insane people.
00:09:34,00:09:36,"Well, no, it's on this amazing site called Preparations.com."
00:09:36,00:09:38,"Yeah, I think they're completely insane people."
00:09:38,00:09:40,They're really secretive as well.
00:09:40,00:09:45,So the New York did a profile and the journalist writing the article was approaching
00:09:45,00:09:47,possible preppers to interview them.
00:09:47,00:09:51,"And one prepper wrote back saying, asking to see my prepper stash."
00:09:51,00:09:55,You just asked me one of the most personal things I've ever heard.
00:09:55,00:09:58,"That is effectively like going to someone's house, meeting their new girlfriend."
00:09:59,00:10:00,Have you got any condoms?
00:10:00,00:10:02,"Yeah, he said."
00:10:02,00:10:04,It's like saying I'd like to see her naked and have sex with her.
00:10:04,00:10:07,So they are very secretive about it.
00:10:07,00:10:09,That's because I think they're the kind of people who's prepper stash
00:10:09,00:10:11,does contain 100 blow-up dolls.
00:10:11,00:10:17,We should say that this is genuinely really quite widespread in America.
00:10:17,00:10:22,So there was a study done recently that found 22% of Americans believe
00:10:22,00:10:25,that the world will end in their lifetime.
00:10:25,00:10:29,"Another study, the National Geographic did, that said 40% of Americans,"
00:10:29,00:10:32,"almost half, think that's stocking up on end to the world's applies."
00:10:32,00:10:37,"It's a more sensible idea than getting a pension scheme, getting a mortgage scheme."
00:10:37,00:10:38,Right.
00:10:38,00:10:42,"If you don't get a pension, but you do have a lot of can food and water,"
00:10:42,00:10:45,"you can, once you retire, just go and live in your bunker anyway."
00:10:45,00:10:47,It doesn't matter that the world's starting.
00:10:47,00:10:51,It doesn't really affect you whether the world's going on or not.
00:10:51,00:10:56,It's the red time and everyone's always dreamed of. The windowless can food dependent
00:10:56,00:10:59,30 years post-working life.
00:10:59,00:11:09,"OK, it's time for fact number two, and that is James."
00:11:09,00:11:13,"OK, my fact this week is that some villagers in the Central African Republic"
00:11:13,00:11:19,deliberately allow lions to live nearby so they can steal their food.
00:11:19,00:11:24,"So what would normally happen if if you lived in a village and there were lions nearby,"
00:11:24,00:11:25,you would always try and shoot them away.
00:11:25,00:11:28,But these guys kind of allow them to live nearby.
00:11:28,00:11:31,They don't try and get rid of them because what they know will happen is these
00:11:31,00:11:35,"lions will catch bits of meat and whatever, and then they can shoot them away"
00:11:35,00:11:39,or they can sneak upon them and they can grab the meat and they'll be able to eat it.
00:11:39,00:11:42,Have you seen the video of people doing this though?
00:11:42,00:11:43,With the lions.
00:11:43,00:11:45,"I saw the, no."
00:11:46,00:11:49,What are you about to say? I bought up the YouTube page.
00:11:49,00:11:50,"Yes, I've seen the crown."
00:11:50,00:11:52,"Great, it's 10 parts series. Amazing."
00:11:52,00:11:55,I've bought up the YouTube page and I saw all the videos but I didn't press play on them.
00:11:55,00:12:00,"So I saw the screen gram that holds the video, but I'm not the advert before it came out."
00:12:00,00:12:05,"There's a new Nokia, so I know you've actually seen the videos."
00:12:05,00:12:06,I have the really good.
00:12:06,00:12:12,"So basically, I think I saw a video that was of the Derobo hunters in Southern Kenya."
00:12:12,00:12:15,"So as James says, this happens in various places."
00:12:15,00:12:20,"And what they do is they're about 10 lions gathered round a corpse, I think it's a gazelle or something."
00:12:20,00:12:24,"So 10 lions, males and females, and there are three hunters and they, you know,"
00:12:24,00:12:28,scrawny little humans and they just go up to them.
00:12:28,00:12:32,"I think two of them had little spears just wouldn't stick, essentially."
00:12:32,00:12:34,And the key is confidence.
00:12:34,00:12:39,"And if you just stride up and look like you definitely own the show, then the lions just leave."
00:12:39,00:12:42,So there's kind of a staring contest in a battle of wills.
00:12:42,00:12:46,Walk towards the lions and the lions look up at them and sort of meet their eye and size them up.
00:12:46,00:12:52,"And then for some reason, this pride of 10 lions thinks, no, I can't handle these three small skinny men."
00:12:52,00:12:57,"And they go away, but they know they have to cut the meat off the animal really quickly."
00:12:57,00:13:01,"Because if the lions stay and watch them long enough and size them up properly,"
00:13:01,00:13:05,then they'll realize that actually I probably can take those guys back.
00:13:05,00:13:08,So how do you do it at the end? You just walk off?
00:13:08,00:13:09,Just walk away.
00:13:09,00:13:11,Just casually stride away.
00:13:11,00:13:15,"Like these guys have read the game, but with lions."
00:13:15,00:13:19,"Just this is completely off subject, but about staring people out."
00:13:19,00:13:24,"Dan, what do you think is the record in the world staring someone out competition?"
00:13:24,00:13:26,So is this the same as a no blinking?
00:13:26,00:13:35,"So if you and I are kind of who's going to blink the latest, what you reckon, the two people who were in the final,"
00:13:35,00:13:37,"a person who went out, how long do you think it was?"
00:13:38,00:13:45,I can't imagine. Is it 1962 between Kennedy and Christophe at the height of the Cuban Missile Crisis?
00:13:45,00:13:49,That is pretty old satire.
00:13:49,00:13:52,It's because we were talking about the Cuban Missile Crisis.
00:13:52,00:13:54,It was timely.
00:13:54,00:13:58,It was weirdly topical.
00:13:58,00:14:02,"Just going from my own eyeballs, your own record, you get my own record."
00:14:02,00:14:05,"I'd say no longer than half an hour or no, no, no, no, no, sorry, sorry."
00:14:06,00:14:09,"Well, half a minute, how do you think someone's not blinking for half an hour?"
00:14:09,00:14:14,"James is asking what I think the record is, and I know it's got to be more than half a minute."
00:14:14,00:14:15,So I'm saying half an hour.
00:14:15,00:14:18,I'm saying half a minute.
00:14:18,00:14:21,I believe it's about 40 minutes.
00:14:21,00:14:25,"No, that was one of them dead."
00:14:25,00:14:27,And they haven't realised.
00:14:27,00:14:31,That's amazing.
00:14:31,00:14:35,"Did you know that in Nepal, they do the same thing that James is talking about, but with tigers."
00:14:36,00:14:39,"There's kleptoparasitism, humans do this with tigers."
00:14:39,00:14:44,"But it's very often in Nepal elephant trainers who do it, and they do it by, they'll lead their elephants"
00:14:44,00:14:46,into the undergrowth to feed them and things like that.
00:14:46,00:14:51,"And then if there's a tiger nearby, then they take the elephant with them and they use the elephant"
00:14:51,00:14:53,"to scare away the tiger, to scare the tiger off a carcass."
00:14:53,00:14:58,So they employ the elephants as their henchmen in order to get the tiger to scarper.
00:14:58,00:14:59,"Wow, that's very cool."
00:14:59,00:15:00,Here's the thing.
00:15:00,00:15:05,"So the worst time for being attacked by lions, as in the time it's most likely to happen,"
00:15:06,00:15:07,it's always bad.
00:15:07,00:15:12,The time it happens most often is just after the full moon.
00:15:12,00:15:13,Okay.
00:15:13,00:15:17,And that's because lions hunt best when it's dark.
00:15:17,00:15:19,"And when it's light at night time, there's a full moon."
00:15:19,00:15:22,They tend to not really hunt that much and so they don't eat that much.
00:15:22,00:15:25,"And so just after the full moon, they're really hungry."
00:15:25,00:15:27,And so they're more likely to attack you.
00:15:27,00:15:28,Really?
00:15:28,00:15:33,You know how you lure a lion to you if you want it to come to you?
00:15:33,00:15:34,With some meat.
00:15:34,00:15:39,"Yeah, you could look as Elkostiub and you front around looking incompetent."
00:15:39,00:15:43,"No, it's an interesting trick that's used by a lot of photographers"
00:15:43,00:15:47,when they're trying to lure them to camera traps to set off to take photos
00:15:47,00:15:48,for jaguars and for lions.
00:15:48,00:15:50,It tends to be men's aftershave.
00:15:50,00:15:56,"So with lions, a photographer that I was reading about said that they use old spice"
00:15:56,00:16:01,"and what they do is they just spray it all over, say, the leaves of the area where the camera is."
00:16:01,00:16:02,And that tends to lure the men.
00:16:03,00:16:08,"So the mass eye, obviously, are known for lion killing, the lion killing ways."
00:16:08,00:16:11,And it's the right of passage in mass eye culture to use it.
00:16:11,00:16:16,"Yeah, when you hit adolescence, then you go out and you kill a lion and that means you're a man"
00:16:16,00:16:19,and it means you're very brave and you come back and the person you killed the lion
00:16:19,00:16:24,gets to wear the mane on his head at special events and the tails all bejeweled by the women in the tribe.
00:16:24,00:16:28,And they've started cutting down a bit now because lion populations are under threat.
00:16:28,00:16:30,So it used to be more individuals that went out.
00:16:30,00:16:32,Now it's more groups.
00:16:32,00:16:38,"But because there's a kind of increasing awareness about how lion populations are in trouble amongst mass eye people,"
00:16:38,00:16:43,that was in Kenya 10 years ago and even then I met a couple of mass eye guys who were campaigning in their tribes
00:16:43,00:16:46,against killing animals because they don't think they should do it.
00:16:46,00:16:51,"So because there's this increasing awareness, they've started the mass eye Olympics as an alternative way"
00:16:51,00:16:54,for men to prove their kind of status in society.
00:16:54,00:16:59,"And they have all the same kind of skills that it would take to hunt a lion, like sprinting or long distance running,"
00:16:59,00:17:02,but they don't have to kill lions anymore.
00:17:02,00:17:08,"I watched, just thinking about humans living with lions."
00:17:08,00:17:15,"I was watching a video of, do you remember that Melanie Griffith, those pictures came out that she grew up with lions?"
00:17:15,00:17:16,Who's Melanie Griffith?
00:17:16,00:17:22,"She's an actor, very famous, but you might know her through, she was married for years to Antonio Banderas."
00:17:22,00:17:24,"And she was, whose daughter was she?"
00:17:24,00:17:25,To be Hadron.
00:17:25,00:17:26,"Yeah, to be Hadron."
00:17:26,00:17:27,"Oh, yeah."
00:17:27,00:17:29,"That's more your era, isn't it Andy?"
00:17:29,00:17:30,"Yeah, yeah, absolutely."
00:17:30,00:17:36,"The 1962 good old days, Hitchcock was alive, the Rolling Stones were still good."
00:17:36,00:17:41,"The Cold Wall was still going, so all your jokes still made sense."
00:17:41,00:17:45,"Hey guys, what about those missile bases in Hungary, huh?"
00:17:45,00:17:51,"Yeah, so Melanie Griffith, the actor, she, when she was growing up, lived with lions"
00:17:51,00:17:54,"and there's all these photos of them playing in the pool, sleeping in the same bed and so on,"
00:17:54,00:18:02,"her parents made a movie called Roar, which is a very, very famous movie in which they used actual lions and tigers in the movie."
00:18:02,00:18:05,"And a few of them, I think Melanie Griffith actually got a bit mulled in it."
00:18:05,00:18:09,"She had like a hundred stitches off the back of it, but you can see that footage on the DVD that they've released."
00:18:09,00:18:16,But you can watch the sort of collected clips from Roar on YouTube of all the lion and tiger attacks in the movie.
00:18:16,00:18:18,And it is nuts.
00:18:18,00:18:21,"And they lived with like 100 lions, the family itself."
00:18:21,00:18:22,So Melanie Griffith grew up with these lions.
00:18:23,00:18:30,"Yes, I promise it was like 100 lions and tigers and you can see in the footage because they went, they went all in the house like it was an outdoor area."
00:18:30,00:18:33,Just the sleeping arrangements sort of be that enough.
00:18:33,00:18:35,We'll put you in the 98th bedroom.
00:18:35,00:18:38,"It still has got a lion in it, obviously. We have a hundred lions."
00:18:38,00:18:44,But it's not one of the two rooms that I've got two lions in it.
00:18:44,00:18:45,No.
00:18:45,00:18:49,You'd never say yes to a sleep over would you?
00:18:50,00:18:57,"OK, it is time for fact number three."
00:18:57,00:19:07,"And that is my fact, my fact this week is that there is a Victorian time capsule buried in London that contains photographs of the 12 best looking women in England."
