start_hhmmss,end_hhmmss,text
00:37:24,00:37:27,And did you see that thing this week speaking of nursing other species?
00:37:27,00:37:31,"The woman in Peru who was being interviewed about floods in Peru at the moment,"
00:37:31,00:37:34,"which had devastating agriculture, things like that."
00:37:34,00:37:38,"She was holding a piglet and as the interviewer was interviewing her, she lifted up"
00:37:38,00:37:41,her shirt and just started suckling the pig on their own breast.
00:37:41,00:37:44,And the cameraman's so tactful.
00:37:44,00:37:48,I would the camera swings away from that image faster than you can bring.
00:37:48,00:37:53,It just suddenly takes a real interest in the surrounding scenery.
00:37:53,00:37:54,Very weird.
00:37:54,00:37:58,So there are obviously loads and loads and loads of stories about breastfeeding.
00:37:58,00:38:03,"You know, saints who miraculously started lactating when they were starving in the desert."
00:38:03,00:38:07,"So one of them is the Christian holy woman, Christine the astonishing."
00:38:07,00:38:10,I seem to remember could Christine the astonishing fly as well?
00:38:10,00:38:14,"From her name, I wouldn't be surprised by anything she could do."
00:38:14,00:38:18,I have a feeling she was in a church once and she flew up into the eaves of the church.
00:38:18,00:38:22,"So also in the Bible, they used to depict the Virgin Mary breastfeeding Jesus."
00:38:22,00:38:24,But sometimes they didn't want her breast to seem sexy.
00:38:24,00:38:28,So they put her breasts on her collarbone instead of a breast level.
00:38:28,00:38:29,So there are all these pictures.
00:38:29,00:38:33,"It's less sexy. It is less sexy. It's more weird, isn't it?"
00:38:33,00:38:35,Which makes it a bit less sexy.
00:38:35,00:38:36,Yeah.
00:38:36,00:38:37,That's really funny.
00:38:37,00:38:41,So there are all these pictures of having a breast of way up here and Jesus feeding on them.
00:38:41,00:38:43,Did you know that?
00:38:43,00:38:44,A possums.
00:38:44,00:38:47,"So you know, a possums like possums, but American."
00:38:47,00:38:53,Their nipples grow up to 35 times their original length when they're being suckled.
00:38:53,00:38:56,"Did they start off really small, aren't they?"
00:38:56,00:39:00,"Really, really long. They're quite normal size they get incredibly long."
00:39:00,00:39:05,So baby possums climb up into their mother's pouch when they're very undeveloped.
00:39:05,00:39:06,And they have to latch on immediately.
00:39:06,00:39:09,"And if you don't find a nipple really quickly, you die straight away."
00:39:09,00:39:13,So you latch on and they latch on and then the nipple swells up inside their mouth.
00:39:13,00:39:16,So they're locked on and they stay locked on for two months.
00:39:16,00:39:18,So it becomes like an unbilical cord.
00:39:18,00:39:22,It grows up to 35 times its own length down into the body.
00:39:23,00:39:27,Yeah. What is that? Is not sexy.
00:39:27,00:39:29,Oh my god. Yeah.
00:39:29,00:39:30,"It's weird, isn't it?"
00:39:30,00:39:33,"And because it's so swollen up inside it, it's so latched on."
00:39:33,00:39:38,"If you try to detach one from the other, then you tear the nipple because they're locked."
00:39:38,00:39:39,They're locked tight.
00:39:39,00:39:42,"Nope. No, no, no, no."
00:39:42,00:39:44,"No, thank you."
00:39:44,00:39:46,Do you know the effect that breasts have on men?
00:39:46,00:39:49,Yeah.
00:39:49,00:39:55,"Well, they have done experiments on men who they divided men into two groups."
00:39:55,00:39:56,Normal men and pervert.
00:39:56,00:40:01,"No, they asked them to do the experiment like, you know, the experiment with children,"
00:40:01,00:40:04,we have a marshmallow now or too much amount later.
00:40:04,00:40:08,So they said you can have one breast now or two breast later.
00:40:08,00:40:14,"No, they asked them if they would be willing to delay gratification to get a small cash amount now or a large cash amount later."
00:40:14,00:40:17,"And then they show the two groups of men, two different films."
00:40:17,00:40:21,"One of them was a woman running along a beach in slow motion, like in Baywatch."
00:40:21,00:40:24,And the other was some countryside.
00:40:24,00:40:25,Right.
00:40:25,00:40:27,"And the men who watched the other countryside, was there anything?"
00:40:27,00:40:29,"Was it just, was there a piglet there?"
00:40:29,00:40:30,"No, no, a piglet."
00:40:30,00:40:36,There were no rutting balls.
00:40:36,00:40:39,"No, so just like boring countryside."
00:40:39,00:40:45,And the men who watched the Baywatch style video were much like clear to take the small payout now
00:40:45,00:40:47,rather than wait and defer their gratification.
00:40:47,00:40:52,So it's believed that the sort of the neurochemical circuits of the brain get hijacked.
00:40:52,00:40:55,"And they're basically saying, pleasure now, take pleasure now."
00:40:55,00:40:57,That makes a lot of sense.
00:40:57,00:40:58,Okay.
00:40:58,00:41:02,"When I was researching this, I remembered a scene that I watched in a movie called The Last Emperor,"
00:41:02,00:41:07,"which is about the Chinese, the final Chinese Emperor before Mao Zitong kicked him out of power."
00:41:07,00:41:14,"And there was, there's a scene in it where he's quite old and he's being breastfed by one of his nurses."
00:41:14,00:41:17,"He's like eight, nine, something like that in there."
00:41:17,00:41:21,So I quickly looked into it and that was a thing of Chinese emperors that you can actually see.
00:41:21,00:41:27,"This really cool looking device, which is a big steel thing with a hole in the middle."
00:41:27,00:41:34,And women who were basically auditioning their breasts or the emperor would come to have their breasts checked.
00:41:34,00:41:37,And to see if they were giving enough milk and so on.
00:41:37,00:41:42,"So they would audition people and be like, you, why would you have a breast factor?"
00:41:42,00:41:45,"Basically, why would they need the steel with the hole in the middle?"
00:41:45,00:41:49,"Why, you don't need to put your breasts through a hole in order to breastfeed."
00:41:49,00:41:53,But it was like the voice way you're not allowed to see their faces.
00:41:53,00:41:56,"No, so it wasn't a full steel door."
00:41:56,00:42:00,"It was just, it was just for the breast and there was a hole at the front where I, presumably, then you went through."
00:42:00,00:42:01,How big was it?
00:42:01,00:42:04,"I would say a, a hard back book."
00:42:04,00:42:06,Like the private eye annual.
00:42:06,00:42:09,"Like the, like no, small in the private eye annual."
00:42:09,00:42:09,"Oh, okay."
00:42:10,00:42:13,"But the third book of general ignorance, where is the previous books of general ignorance?"
00:42:13,00:42:15,We're a smaller format edition.
00:42:15,00:42:18,"Yeah, all available at qi.com/shop."
00:42:18,00:42:21,And that is the worst plug for anything.
00:42:21,00:42:24,"One of our books, which are of different sizes to the breastplates,"
00:42:24,00:42:27,fully used to feed the emperor.
00:42:27,00:42:36,"Okay, that's it."
00:42:36,00:42:37,That's all of our facts.
00:42:37,00:42:39,Thank you so much for listening.
00:42:39,00:42:43,"If you'd like to get in contact with any of us about the things that we've said over the course of this podcast,"
00:42:43,00:42:45,we can be found on our Twitter accounts.
00:42:45,00:42:47,I'm on @Sriberland James.
00:42:47,00:42:51,That's X-shaped Andy at Andrew Hunter M and Shazinsky.
00:42:51,00:42:53,You can email podcast at qi.com.
00:42:53,00:42:57,"Yep, or you can go to our group account, qi podcast, or you can go to our website."
00:42:57,00:42:59,No such thing as a fish.com.
00:42:59,00:43:02,We will be back again next week with another episode.
00:43:02,00:43:03,We will see you then.
00:43:03,00:43:04,Goodbye.
00:43:04,00:43:14,[Music]
00:43:14,00:43:16,(upbeat music)
