start_hhmmss,end_hhmmss,text
00:00:00,00:00:04,[Music]
00:00:04,00:00:09,Hi everyone and welcome to the last episode of Gnosis Like This Fish before Christmas.
00:00:09,00:00:14,We're getting really close to Christmas now so obviously very very much in the last minute
00:00:14,00:00:21,stocking filler area but if you have very odd shaped stockings then maybe you would like to
00:00:21,00:00:25,buy some of our books because probably from some online retailers you'll be able to get them just
00:00:25,00:00:31,in time if you're listening to this on Friday or Saturday so let me remind you what we have.
00:00:31,00:00:35,Andrew Hunter Murray has written a number of novels but his latest one is A Beginner's
00:00:35,00:00:40,"Guides to Breaking and Entering. It is a book that shows off everything you love about Andy,"
00:00:40,00:00:46,"it's very funny, very witty and at the same time has his classic thriller structure as they all do,"
00:00:46,00:00:52,"all of his books. Dan Schreiber has a book called Impossible Things, it is a children's book and"
00:00:52,00:00:57,it is a way to get your children to think like Dan Schreiber. Is that the kind of thing you
00:00:57,00:01:02,"want? Well let's be honest it is, he has a unique brain and his books are absolutely amazing and"
00:01:02,00:01:07,it really gets kids interested in everything that's going on around them and if you're an
00:01:07,00:01:11,adult which you probably are if you're listening to this then you can get the theory of everything
00:01:11,00:01:16,else which is his adult's version of that book. When I say adult I mean it's for adults not that
00:01:16,00:01:23,"it has anything naughty in it, it is complete family friendly fun. Of course Anna and I also"
00:01:23,00:01:28,"have a book it's called A Load of All Balls, doesn't sound very family friendly does it but it is our"
00:01:28,00:01:32,look at the world of sports. If you've got any difficulty buying for relatives but you know
00:01:32,00:01:37,that they like any kind of sport then this is one to get for them because it is a classic
00:01:37,00:01:43,QI thing of all the kind of weird facts that even the biggest sports fan in your family will not know
00:01:43,00:01:47,and actually even if you don't like sports we know that you will like this because there's a
00:01:47,00:01:53,book full of facts and it really gives you an idea of why humans like this thing that a lot of us
00:01:53,00:01:58,really find quite impenetrable. Anyway so that's the books from the three of us get them now they're
00:01:58,00:02:03,the perfect present for any fish fan in your life but don't worry if you can't or don't want to get
00:02:03,00:02:08,those it's absolutely no problem all we really want is that you listen to and enjoy the podcast
00:02:08,00:02:13,which is free and which will always be free so there's nothing more to say I suppose then Merry
00:02:13,00:02:23,Christmas hope you have a great time over the next couple of weeks and on with the podcast
00:02:37,00:02:44,Hello and welcome to another episode of no such thing as a fish a weekly podcast
00:02:44,00:02:47,this week coming to you live from Melbourne
00:02:47,00:02:58,"My name is Dan Schreiber I am sitting here with Anna Tyshensky, Andrew Hunter Murray and James"
00:02:58,00:03:03,Harkin and once again we have gathered around the microphones with our four favorite facts
00:03:03,00:03:10,from the last seven days and in no particular order here we go starting with fact number one
00:03:10,00:03:17,and that is Anna. My fact this week is that to get a good close-up photo in the early 1900s
00:03:17,00:03:25,your camera had to be 20 feet long which was tough to take in hand luggage we've got a photo of it
00:03:25,00:03:30,up on the screen a black and white photo we do so there's a picture here of the two people who had
00:03:30,00:03:35,to operate this camera who were David and Marion Fairchild I think we mentioned them briefly on
00:03:35,00:03:41,the show before she was Alexander Graham Bell's daughter and this is around 1913 and David really
00:03:41,00:03:46,wanted to take some close-ups of insects he thought they were very very beautiful uh creepy
00:03:46,00:03:50,crawlies and he was annoyed that the only way you could look at them close-up was by killing
00:03:50,00:03:53,them squashing them drying them out and putting them in a book so he was like let's try take some
00:03:53,00:04:00,pictures but in order to get the magnification you need this incredibly long extension tube
00:04:00,00:04:05,or you did when the tech was a little bit simpler and so you've got the lens at one end
00:04:05,00:04:11,which person number one is having to hold and then at the very other end of the camera you
00:04:11,00:04:17,have the person who takes the photo and eventually you get an insect in very high definition well
00:04:17,00:04:22,these insects living can I ask Anna they were not it was actually quite amazing what they did so
00:04:22,00:04:25,yeah so it wasn't I thought at first how lovely he wanted to keep them alive to photograph them
00:04:25,00:04:30,no he just didn't want them dried out so Marianne actually came up because I've already needed an
00:04:30,00:04:35,exposure of 80 seconds yeah which are no insects no matter how well trained is going to sit there
00:04:35,00:04:39,I can't sit there they might be asleep right they might be asleep they might be asleep sorry I've
00:04:39,00:04:43,seen insects stay still for long periods of time but these ones were deceased and the way they did
00:04:43,00:04:49,it was Marianne would cover a block of wood with a layer of candle wax and then she'd put a leaf
00:04:49,00:04:54,on top so it looks like it's in a realistic position because insects hang out on leaves
00:04:54,00:04:58,and then with a little pin made a few holes for each foot of the insect in the leaf
00:04:58,00:05:02,and the feet would stick to the wax underneath and so then it would look like they were naturally
00:05:02,00:05:07,just standing on this leaf right okay there are some other ways of doing it these days if you
00:05:07,00:05:12,have forums of how to photograph insects they come up with ideas one idea is to put them in the
00:05:12,00:05:17,freezer for 20 minutes and that will keep them still but it won't kill them right which is good
00:05:17,00:05:22,another one is if you let's say it's one that doesn't fly if you put it on a table and then put
00:05:22,00:05:27,vapor rub fix vapor rub around it then it won't be able to get out of there and so it'll just stay
00:05:27,00:05:30,in that little I thought you were going to say they're superstitious and they won't step over
00:05:30,00:05:36,it's like summoning a demon that's okay they just slip around and one of the earliest this wasn't
00:05:36,00:05:41,photography but one of the earliest close-up books was Robert Huck's micrographia so that
00:05:41,00:05:47,will have been what 17th century I guess and he drew lots of pictures of tiny insects that he could
00:05:47,00:05:51,see through these new lenses that have been invented and the way that he did it was that he
00:05:51,00:05:59,would give a fly a quarter of a pint of brandy oh no sorry what do you mean give a fly a quarter of
00:05:59,00:06:07,all right lightweight if even Anna is quibbling over the you know I'm not sure I can wouldn't he
00:06:07,00:06:12,would he drop them in it yeah he would put them in it oh no he probably could have gone for a bit
00:06:12,00:06:17,less brandy but maybe yeah the photos by the way that they took so it published in the book called
00:06:17,00:06:22,the book of monsters and they are terrifying and what it really gives you for the first time
00:06:22,00:06:28,anyone really had it was the sort of point of view of say like an ant coming up against a giant
00:06:28,00:06:34,cockroach or a worm and it's terrifying the insect world is it's scary in black and white when it's
00:06:34,00:06:41,big it is they named the camera which is quite nice oh they call it long tom did you guys come
00:06:41,00:06:48,across Frank Percy Smith no okay I was looking up pioneers of insect photography um a crowded field
00:06:48,00:06:55,I think Frank Percy Smith is the other one 1880 to 1945 was his lifespan and he got okay
00:06:55,00:07:00,I'm just going to read out a quote I found Frank Percy Smith got his big break after he was so bored
00:07:00,00:07:07,at his day job that he adopted a pet blue bottle keeping it on a tiny lead and feeding it milk
00:07:07,00:07:13,that's so amazing now do we mean feeding it or submerging it in milk I was just thinking
00:07:13,00:07:17,we were chatting today Anna because I've been playing golf and there's loads of flies everywhere
00:07:17,00:07:22,and you said that a single fly followed you for about 45 minutes when you're walking to the
00:07:22,00:07:26,I didn't know the information about my private life was going to be brought to the table today
00:07:26,00:07:31,yes it was trying to domesticate itself I think it was and you were rejecting its overtures that's
00:07:31,00:07:36,very sad all the way down St Kilda road it's very annoying but he genuinely he had a pet fly
00:07:36,00:07:39,yeah he just had a pet blue bottle on his deck I mean that's I feel like people should be more
00:07:39,00:07:44,staggered about this yeah I mean he had it on a lead and he had a lead anyway how long did it live
00:07:44,00:07:50,sauce does not relate um but he he took close-up photos of the fly drinking its milk in the morning
00:07:50,00:07:55,okay um and he showed it to a film distributor who specialized in insects a guy called Charles Urban
00:07:55,00:08:00,and um this was in the 1900s he was so he was a young man at the time and he he's he would film
00:08:00,00:08:07,amazing footage of a fly juggling uh like a ball or a piece of corn or some twine really big bigger
00:08:07,00:08:12,than it was like much bigger than it was and it turned out the way he had done this okay it's
00:08:12,00:08:18,not great but what he had done was he had glued it upside down to something so his legs were all
00:08:18,00:08:24,sticking in the air and then put a little piece of fluff or whatever on it and it just bats it around
00:08:24,00:08:29,with his legs and it looks very very amusingly like it's juggling um the fly would be dead by now
00:08:29,00:08:33,anyway I think it's important to say that and um wait how was it bashing something around with
00:08:33,00:08:37,his legs if it's dead no no no it was alive at the time yeah he glued it upside down to the thing so
00:08:37,00:08:41,it would at least just saying that it's not offensive because the fly's dead but he will have
00:08:41,00:08:47,hundreds and hundreds of thousands of relatives exactly yeah many of them in tonight but he's
00:08:47,00:08:51,saying they're all waiting for you at the stage door right um but he's this was the little thing
00:08:51,00:08:56,but he said about his work he said I've always endeavored to administer the powder of instruction
00:08:56,00:09:02,in the jam of entertainment what a good motto for is it like the powder is the medicine like giving
00:09:02,00:09:07,your dog some some medicine or whatever I see yeah when he was a child Frank Percy Smith he was so
00:09:07,00:09:13,into nature uh that he lay down on a frozen lake with his head in a hole looking at the things that
00:09:13,00:09:18,were happening underneath the water and his friend found him like that and he'd become frozen to the
00:09:18,00:09:25,ice and had to be freed no really my goodness that's amazing um I've got a thing on early
00:09:25,00:09:31,photography here and I have a little riddle for you and I guess only you as well um which is 1837
00:09:31,00:09:39,the first ever photo is taken it's called boulevard de temple and in it you see the photographer is
00:09:39,00:09:44,looking down over a sort of promenade there's a big road and there's just one human there okay
00:09:44,00:09:48,so that's all you see it's the first photo so far as we know of a human in a photo
00:09:48,00:09:56,however the photo was basically taken during rush hour so there should have been horses there
00:09:56,00:10:04,should have been lots of people why is it just one man vampire's I guess yeah I've got it I've
00:10:04,00:10:10,got it now hang on please guys please let's see if the guy with the microphone can get it first
00:10:12,00:10:18,right the man the man who what did appear in the photo was a scuba diver who was stuck in a tree
00:10:18,00:10:26,and yes so it's because of the exposure exactly took seven minutes to get the exposure done right
00:10:26,00:10:31,he's still living statue he wasn't living statue he was having his shoe polished so he's standing
00:10:31,00:10:36,with one leg up which is clearly having the shoe polished and everyone else all the horses all the
00:10:36,00:10:39,everything that was going the people they just didn't connect with the photo because they weren't
00:10:39,00:10:45,in one spot for so long can I ask the guy who was polishing his shoes was he sort of doing this
00:10:45,00:10:49,you get you get a bit of him he's slightly there so he almost makes it into the first ever photo
00:10:49,00:10:56,of a human but that's it it looks like a desolate area with just one person and it's wow yeah you see
00:10:56,00:11:02,the jam of entertainment was the quiz and the powder of instruction was the information I think
00:11:02,00:11:08,that's what we do it's what we do it's what the largest camera on the planet yeah we're doing a
00:11:08,00:11:13,very long camera here long tom the largest camera on the planet was built in 1900 specifically to
00:11:13,00:11:19,take a photo the largest photo in the world large camera large photo what was it to photograph
00:11:19,00:11:26,oh okay was it a large building it was a large object the galaxy a moving object smaller than
00:11:26,00:11:33,the galaxy okay what was new and sexy and cool in 1900 more or less motor cars a bit older
00:11:33,00:11:39,but moving but moving I think yeah it was the handsomest train on the planet oh was that its
00:11:39,00:11:44,name or a train yeah it was it was blurbed as like this was the the pr around it was this is the
00:11:44,00:11:48,coolest most gorgeous train you'll ever see and it was it was called the Alton Limited built in
00:11:48,00:11:54,Illinois and the big deal was it was symmetrical that apparently I have no idea what previous
00:11:54,00:11:59,trains look like apparently completely like bulging on one side and they fell off the tracks a lot
00:11:59,00:12:03,yeah basically everything was the same length and height in it and that was amazing and they
00:12:03,00:12:06,had to make a single photo plate you know those plates that old photographers have dipped in it
00:12:06,00:12:10,was eight feet wide and four and a half feet tall it was like there was a giant needed to drop it
00:12:10,00:12:14,into the camera and the camera was 20 feet long as well and they got the shot that's very cool that's
00:12:14,00:12:21,awesome yeah love that good shot it's fine that doesn't say much for the handsomest train
00:12:23,00:12:30,here's a little quiz for you there is a thing called the Nikon Small World Photo Micrography
00:12:30,00:12:34,competition and it's a competition where you take photos of very very small things
00:12:34,00:12:41,and whichever is the most beautiful wint okay okay so in 1975 the winner was a photo of oxalic acid
00:12:41,00:12:51,crystals that were magnified 100 times okay so that's 1975 100 times in 2024 how many times
00:12:51,00:12:57,magnified was the winner so it's 100 times in 1975 okay it's either going to be 50 quadrillion or it's
00:12:57,00:13:05,going to be like twice as magnified yeah that's it 102 no um 100 times magnified 1975 yeah i'll say 100
00:13:05,00:13:10,uh i'll say half a million 500 000 times it's in between of the two extremities that you were
00:13:10,00:13:17,going for because it's actually still 100 so it was 100 in 1975 and it was 100 in 2024 and they
00:13:17,00:13:24,haven't been able to improve it since then really and the reason is physics it's just physics these
00:13:24,00:13:29,are not like electron microscopes or scanning tunneling microscopes or these special things that
00:13:29,00:13:35,physicists have these have got to be light photographs and once you get smaller than 100
00:13:35,00:13:41,times magnified the very light itself starts to diffract into each other and you can't see things
00:13:41,00:13:45,really right and even if you push your fingers out was an out was on the screen of your iphone
00:13:45,00:13:54,eventually believe it or not you will reach a limit wow that's so funny that's so it's an
00:13:54,00:14:02,annoying quiz which is why he said it i understand okay here's another early uh former photography
00:14:02,00:14:08,that was experimented with have you guys heard of thoughtography thought yeah thought photography
00:14:08,00:14:12,picturing parts of your brain and working out what people are thinking about from the neural
00:14:12,00:14:18,activity no it's uh it's basically psychic photography you have to stare at what you want
00:14:18,00:14:27,to be appearing on the photo and then gradually it comes onto the photo except it doesn't well tell
00:14:27,00:14:34,that to urie geller who is able to photograph himself with the lens cap on the camera although
00:14:34,00:14:38,for some reason he only takes photos of his forehead i can't work out why that is but um
00:14:38,00:14:44,but that's urie geller's our source is he uh yep oh no switch source cool well how about how about
00:14:44,00:14:53,this one optography octography yeah octo octography okay octo okay um so eight sided photographs
00:14:53,00:14:59,this is no i didn't actually look up the etymology um it's this was something that was actually
00:14:59,00:15:03,practiced in the late 1800s that they thought might be a thing it was when someone if they'd been
00:15:03,00:15:09,murdered you would take a photo of their eyes because they believed that the eyes captured
00:15:09,00:15:15,the final image it ever saw and they would see the murderer sort of like in the in the eye going
00:15:15,00:15:24,or whatever and they would then go that's martin and and fuss it's optography i think with a p right
00:15:24,00:15:29,that would make more sense wouldn't it unless people had eight eyes back then only spy does it
00:15:29,00:15:35,work yeah and it's always either an old woman or a bird that's the culprit i i remember reading
00:15:35,00:15:41,about this and i think so many people believed it that there were murders where they removed the
00:15:41,00:15:46,eyes because they thought the eyes would give them a yeah that's dark murderers dark murderers
00:15:46,00:15:59,it is time for fact number two and that is my fact my fact this week is that
00:15:59,00:16:06,in america there is a secret society called the order of the occult hand whose sole mission
00:16:06,00:16:12,is to sneak a very specific phrase into newspapers and we have no idea what that phrase is
00:16:12,00:16:23,so this is this started back in 1965 an american journalist called joseph flanders put into a
00:16:23,00:16:27,report that he was writing about where there was a murder and these words came up and said
00:16:27,00:16:33,it was as if some occult hand had moved pawn after pawn until they were in the right with
00:16:33,00:16:40,a w i think yeah how does it make sense when it's the other one it doesn't you could have
00:16:40,00:16:44,could have murdered in a newsagents which has moved palm after palm
00:16:44,00:16:54,how did they get the corpse onto the top shelf man found dead in penthouse the other kind of penthouse
00:16:54,00:17:06,so it was as if some occult hand had moved pawn after pawn until they were in the right place
00:17:06,00:17:11,and then tragedy and so that phrase made it in there that uh that little phrase about the occult
00:17:11,00:17:14,hand and he went to the pub and his buddies were giving him crap about this saying what that was
00:17:14,00:17:18,such a funny ridiculous thing and they decided we're going to start a secret society whereas
00:17:18,00:17:24,many journalists are going to try and slip that exact phrasing it was as if some occult hand had
00:17:24,00:17:29,dot dot dot into it and that was good because it was so pretentious yeah exactly it was just
00:17:29,00:17:35,such a ridiculous thing to write and so for 40 odd years it kept appearing in newspapers
00:17:35,00:17:39,and it started to be a thing where editors would find out that people were doing that
00:17:39,00:17:44,and so when it came to a final proofread of the articles that were going out they had to do
00:17:44,00:17:49,an occult hand check to make sure that the phrase hadn't been slipped into it and we only know what
00:17:49,00:17:55,the phrase is because in 2006 it got properly outed so instead of it dismantling they have
00:17:55,00:18:00,a new phrase now and we don't know what that is right so in the newspapers globally there is one
00:18:00,00:18:04,particular phrase that will still be appearing and until we know what that is it's going to be
00:18:04,00:18:13,their secret it's not trump has won the election is it imagine um yeah it is fantastic and newspaper
00:18:13,00:18:17,language is very you know specific about this kind of stuff so obviously the headlines you miss out a
00:18:17,00:18:22,lot of conjunctions and prepositions you miss out anything which slows down the phrase yeah
00:18:22,00:18:28,ideally dog bites man not a dog has bitten a man exactly exactly that and so it's obviously it makes
00:18:28,00:18:33,it spicier and more exciting and draws the reader in which is the whole point but sometimes you get
00:18:33,00:18:38,headlines which don't quite work as a result so there was a headline from 2014 Patrick Stewart
00:18:38,00:18:46,surprises fan with life-threatening illness which what a bastard
00:18:46,00:18:52,i'm afraid you won't live long in prosper
00:18:52,00:19:00,i like there are lots of things that are sort of concealed in newspapers aren't there lots of
00:19:00,00:19:06,kind of within fleet street jokes um often they happen when there's a bit of a disagreement between
00:19:06,00:19:11,the journalists who are writing this stuff and the owners of a newspaper and often those journalists
00:19:11,00:19:17,don't like those owners so in 2001 for instance Stephen Pollard was sacked from the express and
00:19:17,00:19:22,the express had recently been taken over by a guy called Richard Desmond and Pollard's last article
00:19:22,00:19:28,was just a very innocuous commentary on organic farming but the first letters of each sentence
00:19:28,00:19:36,spelled out fuck you Desmond she's very good and i also james may you got do you guys have top gear
00:19:37,00:19:45,james yeah james may of top gear fame in 1992 he was fired from auto car magazine because he
00:19:45,00:19:50,been asked to write 42 pages of like a roundup of the cars of the year and he had to do a little
00:19:50,00:19:56,review of each car and i think he thought this is a very tedious task but it's 42 pages of reviews
00:19:56,00:20:01,so he had to come up with a very long kind of a cross stick so the first letter of each review
00:20:01,00:20:06,spelled out so you think it's really good yeah you should try making the bloody thing up it's a real
00:20:06,00:20:12,pain in the arse wow that's really good we had to read quite a lot of old articles for this and
00:20:12,00:20:17,one of the ones that i get this is a bit non-sequitur but i read this amazing article in the new york
00:20:17,00:20:24,times about the grunge movement in seattle okay this is in 1992 and it had a list of grunge terms
00:20:24,00:20:28,and i just thought i could do a little quiz all right and see if you could say where they are
00:20:28,00:20:36,so in seattle in the 90s early 90s what was a cob nobler cob nobler oh uh shoe shiner shoe shiner
00:20:36,00:20:43,no i didn't really have so many shoe shines in seattle in the early night not for a dime sir
00:20:43,00:20:52,is it what you um is it what you call the little um thing that you stick into the
00:20:52,00:20:59,corner of the cob like it's a little knob oh i see no it's just a word for a loser um okay uh lame
00:20:59,00:21:04,stain lame lame stain sounds like another word for a loser it's another word for a loser uh wax
00:21:04,00:21:11,slacks uh all right james we get it you don't like hanging out with this um the trousers some kind
00:21:11,00:21:17,of yeah all drip jeans and swinging on the flippity flop oh that's just being a cool guy hanging out
00:21:17,00:21:26,it is is it hanging out that is honestly that's that's amazing andy you could have been in early
00:21:26,00:21:34,90s seattle in the grunge scene apart from the fact that they were all made up oh they were made up
00:21:34,00:21:39,by uh people who didn't like the fact that their scene was getting into the national press and so
00:21:39,00:21:44,they did a fake interview where they made up all of these words and it got into the times
00:21:44,00:21:49,and it was years later when they found out that it was that these were all fake and the new york
00:21:49,00:21:55,times dismissed the prank as irritating oh they really care about the this sort of accuracy of
00:21:55,00:21:59,everything they sort of check everything so many times i do think this phrase like what this phrase
00:21:59,00:22:03,might be is interesting yeah because they'll have been smuggling it in they will have been
00:22:03,00:22:10,concealing the powder of instruction in the jam of entertainment yes we might
00:22:10,00:22:14,the way i feel about it yeah yeah this is food for thought isn't it that's what's called purple
00:22:14,00:22:19,pros that's what journalists often refer to so this was a thing it's a style off the back of a
