start_hhmmss,end_hhmmss,text
00:45:46,00:45:50,get a 3d tattoo the photos of it are unbelievable i wish i could show you all now i wish i brought a
00:45:50,00:45:56,bit of paper with it printed out because it looks so so realistic isn't there a model with a fake
00:45:56,00:46:00,belly button or not maybe i thought there was a model with no belly button or there's a model
00:46:00,00:46:04,with three belly button no there can't be a model with three belly buttons there's something um but
00:46:04,00:46:07,the recipient said it was so good that her son wanted to sort of put his finger in it because
00:46:07,00:46:12,he couldn't believe it wasn't real it does and it looks unbelievably good i think the thing is
00:46:12,00:46:18,about belly buttons as well is depending on how high or how low they are it can be like a visual
00:46:18,00:46:23,illusion of how long your legs are or how high your torso is so you could deliberately get your
00:46:23,00:46:27,belly button a little bit higher or a little bit maybe not right up there because legs go all the
00:46:27,00:46:34,way up to his nipples so hard because there was that claimed trend wasn't there in somewhere like
00:46:34,00:46:39,china people having belly buttons put on their stomachs higher up yeah that's what we're talking
00:46:39,00:46:44,about yeah unless you have any regrets andy i think you could brought an a4 print out of this belly
00:46:44,00:46:50,button here tonight it wouldn't have made a difference to anyone's lives right good point
00:46:50,00:46:54,another another weird interesting new tattoo that i've never seen before but someone showed us the
00:46:54,00:47:00,other night we went out drinking with one of the old wiggles a couple nights ago sam the former yellow
00:47:00,00:47:06,wiggle and um he's got amazing tattoos he's got a tattoo on one arm which is every country he goes
00:47:06,00:47:10,to whatever is stamped into his passport he gets tattooed onto his arm while he's in the country
00:47:10,00:47:16,so his arm is covered in passport stamps but on his right arm you can't see it it's in uv you get
00:47:16,00:47:21,uv tattoos now which i hadn't heard of but that might be very obvious to a lot of people but yeah
00:47:21,00:47:26,so yeah so you have to go under uv light in order to see it and it comes through um but it's invisible
00:47:26,00:47:32,during the day really awesome so you have to keep going clubbing yeah well he showed me as we were
00:47:32,00:47:46,shooting up heroin in a public toilet and it really pops when you see it but that is it for now
00:47:46,00:47:52,that is all of our facts thank you so much for listening melbourne you've been amazing we will
00:47:52,00:48:08,be back thank you very much for the rest of you we'll see you next week
