start_hhmmss,end_hhmmss,text
00:22:19,00:22:26,quote of a roman poet hoarse someone would basically patch purple onto their clothing
00:22:26,00:22:32,in order to make them look more rich but it was so badly done it was so obvious and so trying to be
00:22:32,00:22:37,pretentious that you would notice it immediately and for journalists uses purple pros yeah yeah
00:22:37,00:22:42,that's where i was from yeah um we should talk about australian hackery as well okay as australia
00:22:42,00:22:48,is home to you know great newspapers and and a great newspaper family
00:22:48,00:22:57,i'm so glad he's like that no sorry um who was that was that your elizabeth murdoch
00:22:57,00:23:06,um great australian headlines uh the northern territory news i i imagine it's
00:23:06,00:23:11,oh yeah mostly read in the northern territory but you know if you if you if you do subscribe
00:23:11,00:23:17,you will have doubtless been delighted by the 2013 headline why i stuck a cracker up my clacker
00:23:17,00:23:23,which was a first person account by a man who put a firework up his bottom
00:23:23,00:23:29,and it won its writer awokely which i gather is the highest award in australian journalism
00:23:30,00:23:37,is the Aussie Pulitzer as far as i can tell what is i haven't heard of that awokely oh well
00:23:37,00:23:43,so this before was about putting things into newspapers or tricking a newspaper of course
00:23:43,00:23:50,newspapers can trick their readers as well and it often happens on april the first usually quite
00:23:50,00:23:55,irritating i think actually there's someone who fell for the old spaghetti tree
00:23:57,00:24:04,but some of the like some of the worst april fools tricks in 1998 on the first of april in
00:24:04,00:24:11,iraq the newspaper that was owned by saddam hussein's son uday said that president clinton had decided
00:24:11,00:24:23,to lift all sanctions against iraq it was funny if you were there it is mental and then the next
00:24:23,00:24:33,day they had to admit they were joking ah gotcha no good um in 1927 uh princeton their internal
00:24:33,00:24:38,newspaper the daily prinstonian uh they revealed that the university was going to begin admitting
00:24:38,00:24:48,women oh can't believe anyone fell for that one and then in 1864 there was the evening star of
00:24:48,00:24:53,hislington they announced there was going to be a grand exhibition of donkeys at the agricultural
00:24:53,00:24:58,hall yeah and so the next day everyone went to see the donkeys and of course they were the donkeys
00:24:58,00:25:03,themselves oh i thought that's quite a good one that's very good i thought it was going to be that
00:25:03,00:25:07,people all brought their donkeys the next day like a load of donkey keepers would fell for it as well
00:25:07,00:25:11,but it doesn't sound like that happened no if you've got a donkey you probably can't do things
00:25:11,00:25:15,at one day's notice you probably have a plan if someone announces as an exhibition of something
00:25:15,00:25:20,you can't bring your own version if you see there's an art exhibition on make to disagree
00:25:20,00:25:26,make to disagree i frequently frequently take my sketches to the gallery i'd be turned up at cold
00:25:26,00:25:32,play with his guitar the other day no one could tell the difference um uh
00:25:32,00:25:44,it is time for fact number three that is james okay my fact this week is that 18th century king
00:25:44,00:25:55,of sweden gustav the third was into larping mm now so larping um live action roleplay for the
00:25:55,00:26:00,uninitiated but that is where you pretend to be someone from history so what's his excuse because
00:26:00,00:26:08,he's from history yeah but interestingly at the time he was from the present yeah right right it's
00:26:08,00:26:13,like so who was he dressing was he dressing up as someone further back from history can't can't
00:26:13,00:26:18,that's how time works yeah i mean that's like something i should have asked i don't know what
00:26:18,00:26:25,happened there how's a weird glitch uh so this is something i read at the museum of world culture
00:26:25,00:26:31,in gothenberg when we played gothenberg quite recently and he was a king who was really into
00:26:31,00:26:38,the arts and he knew that it would be good for promoting the monarchy and so he started these
00:26:38,00:26:42,festivals where there was loads of jousting tournaments and masquerades and stuff like that
00:26:42,00:26:49,that wasn't new but what was new is that he and his other royals would take part and they would act
00:26:49,00:26:56,out um battles from the past and show how great the monarchy was right and it's not that i made
00:26:56,00:27:02,up but i didn't sex it up by saying larping yeah no how could you um it was that is specifically
00:27:02,00:27:07,what it said in the gothenberg museum that it was larping okay but he didn't call it larping no no
00:27:07,00:27:12,because the initials would be different in swedish wouldn't they yeah that's what he said do we know
00:27:12,00:27:18,who he dressed up as specifically or uh it will have been his former relatives relatives yeah
00:27:18,00:27:24,ancestors his ancestors yeah okay right and this is the really so he was such a thespy king
00:27:24,00:27:27,basically i mean you know royalty is already full of pageantry and flummary and you know we
00:27:27,00:27:37,know you guys love that but um but his love of larp killed him he was uh i mean it really genuinely
00:27:37,00:27:43,did he was he he was at a look out nerds is what are you saying sorry go on he was at a masquerade
00:27:43,00:27:47,ball uh which he was excited about throwing you know everyone was in masks and dressed up and all
00:27:47,00:27:52,that he was in costume he was clearly identifiable as the king because he had a very notable star
00:27:52,00:27:57,medallion on his breast so he was clear who he was uh he had received multiple warnings not to go by
00:27:57,00:28:01,letter saying someone's going to kill you slash we're going to kill you slash don't go oh really
00:28:01,00:28:05,yeah he's at loads he got at the very end of supper just before the ball started he got one
00:28:05,00:28:11,final letter saying someone's going to try and kill you disregarded it went along anyway uh and was
00:28:11,00:28:16,and was was attacked who's delivering the letter like like as in i think it was a spies warning
00:28:16,00:28:20,that i've uncovered some kind of plot everyone's in masks though aren't they so it could have been
00:28:20,00:28:25,anyone yeah that's true except that we know who it was yeah we did well yeah we know who was um killed
00:28:25,00:28:33,for it don't we point a it was Jacob Johan and castrom whoa um we can't it's always the one you
00:28:33,00:28:41,least suspect csi Stockholm 1792 we can't keep making encouraging noises after every fact that
00:28:41,00:28:48,we say yeah that's my thing back off no b the assassination itself was extraordinary i i'm
00:28:48,00:28:52,actually kind of obsessed with Gustav III and i think he's an amazing person if a bit of a weirdo
00:28:52,00:28:57,and one of the things i love is how the assassination went down so it's 1792
00:28:57,00:29:04,and this guy Jacob comes with a cavalry pistol a big pistol and it's loaded with two balls or
00:29:04,00:29:11,bullets uh a bunch of nails 14 assorted scraps of lead and iron and he put the muzzle straight
00:29:11,00:29:16,into Gustav's back it was you know it was point blank pulled the trigger Gustav staggered but
00:29:16,00:29:22,didn't even fall over and the the assassin was so shocked he dropped all of his weapons he had
00:29:22,00:29:28,two guns on him and a knife and he dropped them all and uh Gustav had a hole so big in his back
00:29:28,00:29:35,you could put your whole fist in up to your wrist wow he still lived for two more weeks he did and
00:29:35,00:29:40,he's cool about it he tried to walk to hospital to start with as well and then he was like fuck
00:29:40,00:29:48,"and and they got him a chair and he was in Australia, he was in Australia, fuck mate,"
00:29:48,00:29:51,put a fist in that
00:29:51,00:29:59,he wasn't to role play but not that much into role play
00:29:59,00:30:05,and then he and then he sat back down on his chair and they carried the chair to where he was
00:30:05,00:30:09,getting medical attention that's one of those things where because it was such a documented
00:30:09,00:30:15,moment you can go visit the masquerade clothes that he's wearing that he was wearing in a museum
00:30:15,00:30:19,and they've still got supposedly the chair which is bloodstained and so on that you can visit as
00:30:19,00:30:24,well as like relics of Gustav and have you heard what he said when he was told who did it oh shit
00:30:24,00:30:33,mate it was in yeah it was that bonza what did he say he he was told who the culprit was because
00:30:33,00:30:39,they caught the assassin and he just said and he's got a fist-sized wrist deep hole in his back at
00:30:39,00:30:44,this point and he just says i don't want to know the names it's only their political plan i should
00:30:44,00:30:48,like to know about some time or other because i'm curious to see whether there was anything sensible
00:30:48,00:30:58,in it wow what a guy well and castrum was publicly flogged his right hand was cut off his head was
00:30:58,00:31:08,removed and his corpse was cut into quarters wow until he apologized and he had two accomplices
00:31:08,00:31:12,who were stripped of their titles and expelled from the country and they were called ribbing and
00:31:12,00:31:21,horn what ribbing ribbing ribbing and horn good no no further questions one more thing on masquerade
00:31:21,00:31:26,bowls really quickly just because we're on the topic there was a moral panic in the uk even about
00:31:26,00:31:32,masquerade bowls in the 18th century because they become really really popular in the upper class
00:31:32,00:31:38,and the bishop of london said that it was a plot devised by the french to neutralize the beauty
00:31:38,00:31:47,of english women okay so it's not the only way those disgusting french people can get any sex in
00:31:47,00:31:51,the uk is by everyone wearing masks yeah it makes sense what are you saying what what what is the
00:31:51,00:31:58,tone of sarcasm that i sense here i think it's an interesting point because i in my single days if
00:31:58,00:32:03,you go to a halloween party right everyone looks so hot but they would be not who they were right
00:32:03,00:32:10,it'd be like wow look at that skeleton she's awesome and and then she took up her outfit you put on a
00:32:10,00:32:21,lot of weight but there was a study that showed that uh people found during the covid pandemic
00:32:21,00:32:27,times that wearing a mask enhanced the hotness of the face people mistake oh really glamour yeah
00:32:27,00:32:38,exactly misty mystery hygiene sanitizer but i genuinely i i scored a date on her at a halloween
00:32:38,00:32:44,party and then we went on the actual date and like unfortunately ironically she was frightened
00:32:44,00:32:49,more on the date yeah when you turned up and i preferred her as a tetris block it was uh which
00:32:49,00:33:00,one the square no she was the l nice yeah um just a little bit more just have the third please
00:33:00,00:33:08,sorry to go sorry i know we're doing dan's dating history but he was incredibly interesting he was
00:33:08,00:33:13,the third swedish monarch to die of being shot in 160 years right apart from his father who
00:33:13,00:33:21,died after eating 14 helpings of sembler buns um just loved loved buns but he he did so many
00:33:21,00:33:26,different i mean he was a despot he he took over and he he rolled government back he was he was
00:33:26,00:33:32,anti-democratic but he banned torture and contributed to culture so he did a lot of self-promotion
00:33:32,00:33:38,and one of the most interesting things he did was he he was engaged at the age of five uh too young
00:33:38,00:33:43,to be married to be sorry here to be married to another five-year-old right oh that's not too
00:33:43,00:33:49,that princess from Denmark yes princess Sophia Magdalena of Denmark and then when they were 20
00:33:49,00:33:55,they got married but he wasn't there so you could do this thing of getting married by proxy yeah in
00:33:55,00:33:59,the old days if you were marrying another ruler then they were busy because they were on a campaign
00:33:59,00:34:03,or something yeah you would just have someone else step in so the bride's half-brother Frederick
00:34:03,00:34:08,played the role of the groom just at the ceremony just sort of in a purely ceremonial function
00:34:08,00:34:14,and only half brother exactly and then she came to Sweden and they properly got married um but they
00:34:14,00:34:19,did have to have a kind of um love tutor as in they they needed to be slightly taught the facts of
00:34:19,00:34:25,life uh because for 10 years they did not consummate the marriage and um they had to have a coach
00:34:25,00:34:33,who was Count Adolf Frederick Munch Alfvölkula who was the that's that sounds like a sexy Dracula
00:34:34,00:34:36,Count Fulkula
00:34:36,00:34:41,I want to suck you up nevermind
00:34:41,00:34:51,but there were rumors that Count Adolf was the father but when they eventually did have a child
00:34:51,00:34:56,and spread by his mom so Perot Gustav's mom Gustav's mom thought he was impotent was like he can't
00:34:56,00:35:02,perform sexually no way did he father that child and spread the rumor where even even in his own
00:35:02,00:35:08,diary Count Adolf unfortunate name said that he was obliged to physically touch and guide them
00:35:08,00:35:14,to the right positions because somewhat mysteriously he said they had both had anatomical problems
00:35:14,00:35:22,which caused some trouble what were they I must know um but yeah the mum was like my son is
00:35:22,00:35:26,bad in bed there's no way he's rather that child I bet it belongs to the count
00:35:27,00:35:32,Gustav the third he gave us the sweet you know the vegetable the sweet
00:35:32,00:35:37,it came from him because he's Swedish what what do you mean when you say gave us
00:35:37,00:35:43,well I'm going to explain but it's literal um so there was a guy called Patrick Miller who
00:35:43,00:35:48,invented a new kind of paddle steamer and he tried to sell it this feels like a start of a very long
00:35:48,00:35:54,story now we have to go back to Patrick Miller
00:35:54,00:36:00,you'll see why he's imported much later
00:36:00,00:36:06,so Patrick Miller I'm on tanto experience even if that one else is he tries to sell
00:36:06,00:36:12,his paddle steamer to Denmark and Denmark said we don't need your paddle steamer
00:36:12,00:36:18,but Denmark was at war with sweden at the time and so Miller went to sweden and said do you want
00:36:18,00:36:22,our paddle steamer and they said yes great we love paddle steamers so he sent the paddle
00:36:22,00:36:27,steamer over to sweden and by the time it got there the war had already finished this is like
00:36:27,00:36:34,grandpa simpson's story does he go to shelbyville with an onion in his pocket it was the fashion
00:36:34,00:36:44,at the time Andy okay so they got this pointless paddle steamer but he was really happy Gustav
00:36:44,00:36:50,and so he sent Patrick Miller a gold snuff box and a painting of the paddle steamer
00:36:50,00:36:59,and a swedish flag and a swede and the swede came with finally
00:36:59,00:37:06,and the um the swede came with some seeds that said plant me and he planted them and from then on
00:37:06,00:37:12,the uk could grow its own swedes right and because they came from sweden we called them swedes
00:37:12,00:37:14,and is anyone still here because i'm not sure
00:37:14,00:37:24,it is our it's time for our final fact and that is
00:37:24,00:37:29,Andy my fact is that some people have tattoos on the inside of their bottoms
00:37:29,00:37:39,um this is really interesting yeah so fashion not fashion the reverse necessity um
00:37:40,00:37:46,is that the reverse of controversial controversial yeah okay this is really interesting there is a
00:37:46,00:37:50,thing called endoscopic tattooing uh and it's colon tattooing so it's tattooing you know right
00:37:50,00:37:56,inside your bottom and the reason is that some people have lesions they have areas of unusual
00:37:56,00:38:01,tissue inside their bottoms and they might become dangerous in future years they're not now but they
00:38:01,00:38:05,need to be monitored you know if they if they change it's like having you know a mole that you're
00:38:05,00:38:09,keeping an eye on just in case it changes or anything yeah so they need to be kept an eye on
00:38:09,00:38:15,and for that they need to be marked and so this this in 2022 the american chemical society launched
00:38:15,00:38:19,a new ink that was going to be used for endoscopic tattooing so that's how i found this fact um
00:38:19,00:38:23,and basically it marks just sort of next to it because you can't mark the area itself but you
00:38:23,00:38:28,mark look here's the size here's the shape here's and there's a kind of whole code language of
00:38:28,00:38:32,what you are showing with this tattoo so that any future doctor can have a look at it and say
00:38:32,00:38:36,ah that's okay it hasn't changed or oh it has we need to might need to do something here so it's
00:38:36,00:38:44,just a brilliant area of do you know how do they get the pen up there like is it how do they do it
00:38:44,00:38:50,it's very hard to draw the dolphin with um i actually don't know i think i think it's like
00:38:50,00:38:55,endoscopes it's not the endoscope yeah it's endoscopes and it's very common and it's and it
00:38:55,00:38:59,serves a few purposes it's you know it's it's sometimes marks a site for surgical removal if
00:38:59,00:39:04,there's something that's been decided has to come out anyway um sometimes it says like here's a place
00:39:04,00:39:09,for follow-up to just check this out we've done some surgery just check it out but it is um it is
00:39:09,00:39:15,very cool i was very surprised to find a reddit thread about it from a surgeon who i guess operates
00:39:15,00:39:22,on areas that might have been previously tattooed to take away certain things and a big thing in this
00:39:22,00:39:29,industry is not tattooing the rectum so you you tattoo further up the colon but rectum don't
00:39:29,00:39:34,need to do it and the reddit thread the headline was please don't tattoo the rectum don't worry
00:39:34,00:39:39,we will find a tumor if it's there the tattoo gets in the way and makes everything hard to see
00:39:39,00:39:43,and dissect please which i was just very surprised that surgeons are using reddit as a way to say to
00:39:43,00:39:49,other surgeons please stop tattooing people's rectum that's so interesting there is i mean
00:39:49,00:39:54,there are people who will have tattoos down there for fashion reasons yeah uh there's a guy called
00:39:54,00:40:00,randy candy uh who will ink you anywhere you want and he'll give you a discount if you choose to do
00:40:00,00:40:09,it on your bum hole uh he's i don't want it yeah but sometimes if you don't have quite so much money
00:40:09,00:40:17,beggars can't be choosers can they andy you want to have i love mum somewhere um he's had he's done
00:40:17,00:40:23,like an enormous spider exiting someone's body oh cool that was extremely cheap he says basically
00:40:23,00:40:30,the weirder it gets the cheaper it becomes did you guys hear uh of the project whole glory in
00:40:30,00:40:35,2016 now whole glory this was it's not as bad as it sounds um there's a tattoo artist called scott
00:40:35,00:40:40,campbell who said anyone who puts their arm through this hole will get a tattoo all right you can't
00:40:40,00:40:47,decide what it's of which oh i see thank god you get no communication you just put and it was in
00:40:47,00:40:52,an art gallery that it happened so you would put your arm through and he was a sort of very famous
00:40:52,00:40:57,and decorated tattoo artist and did he do it like sometimes it was good and sometimes it was bad
00:40:57,00:41:02,that's right some of them were spelt well some of them were just one in five was like swastikas
00:41:04,00:41:11,i don't think i don't think he did that on swastikas um oh yes it's always good to drop them in um
00:41:11,00:41:18,if you were given the chance of having a swastika face tattoo yeah or losing your dominant hand
00:41:18,00:41:23,having it amputated which would you choose um i'm allowed to put a big eye patch on over the
00:41:23,00:41:28,tattoo for example what is it over your eye your whole face your whole face i'm sorry it's the
00:41:28,00:41:34,whole thing i think balaclava i think yeah the mystery that the mystery that dan was talking
00:41:34,00:41:39,about you know who's that guy why why do you think most people would say what did you i don't
00:41:39,00:41:44,even think i've read a study yeah 70 of people would rather have their dominant hand amputated
00:41:44,00:41:48,than have a swastika face tattoo that's fascinating yeah wow and it makes sense and
00:41:48,00:41:53,what a weird thing to cheer but yes yeah yeah it does make sense yeah okay well how about a wrong
00:41:53,00:41:58,tattoo i really like these so there's a this year uh an england football supporter was so
00:41:58,00:42:06,confident about england's chances in the euro's football that he got england euro 2024 winners
00:42:06,00:42:11,and the picture of the cup tattooed on his leg he's called dan thomas he's a data consultant
00:42:11,00:42:17,ironically and he he predicted a win for england in the final he said they're gonna win two one
00:42:17,00:42:22,and he one might remember england lost two one and he said he will get it altered after they
00:42:22,00:42:29,win in 2028 that's good so confident you can always get the word not tattooed above that
00:42:29,00:42:35,i like the person i've read about is probably a mate of this guy but um this is a guy called
00:42:35,00:42:42,tom washington he's from grinsby he got a lifetime ban from the airline jet two as a result of
00:42:42,00:42:48,exposing his pinocchio penis tattoo on the plane and i've seen a photo of it it's actually really
00:42:48,00:42:53,funny so i i don't see what the because he showed he just showed like the top so he didn't he didn't
00:42:53,00:43:00,take out his member what's his name uh what you want me to doubly name him tom washington
00:43:00,00:43:05,yeah yeah i think that's very funny are you lying tom they call him but yeah it's happened
00:43:05,00:43:09,there's an amazing thing so we're talking about medical tattoos basically medical tattoos have
00:43:09,00:43:15,been happening for basically since we've found a properly preserved human so uzi we've mentioned
00:43:15,00:43:20,this before so he was the iceman that was found in the alps yeah exactly and we found tattoos
00:43:20,00:43:24,all over his body and they think that it was almost like acupuncture spots like it was so that
00:43:24,00:43:29,they could spot where he needed to have things done but um all over the world tattoos are used
00:43:29,00:43:35,for similar reasons so there's a tribe in berma called the pakoku and they do a thing where
00:43:35,00:43:41,they're a snake society they play with snakes and they use them for rituals and so on all the time
00:43:41,00:43:45,but they're poisonous snakes and so what they do is they tattoo themselves once a week where they
00:43:45,00:43:50,mix the ink with the venom of the snake and it inoculates them to make sure that if they do get
00:43:50,00:43:54,bitten their body already has it inside so that they're okay and they have to do it as a weekly
00:43:54,00:44:00,ritual to do that so they get tattooed every week because it is mad that our bodies don't destroy
00:44:00,00:44:06,tattoos even you know a tattoo is any foreign object that you inject into your body is bad as
00:44:06,00:44:10,far as your body's concerned and it was quite confusing for a long time that our bodies don't
00:44:10,00:44:17,just get rid of the ink and the reason is much like a lactose intolerant person who loves pizza
00:44:17,00:44:25,the microfages the white blood cells love the taste of tattoo ink but can't digest it so it's so
00:44:25,00:44:29,interesting so if they could digest it well they would literally just eat the ink up you know they'd
00:44:29,00:44:33,be like foreign body inserted into you eat the ink up digest it get rid of it the tattoo would
00:44:33,00:44:38,disappear but they eat the ink and their bodies can't digest it and so it just sits there so when
00:44:38,00:44:44,you're seeing a tattoo you're seeing the stomachs of millions and millions of bacteria with ink inside
00:44:44,00:44:50,them the bacteria with terrible indigestion going how do i get rid of this and then they die and
00:44:50,00:44:55,another bacteria quickly eats the thing that they found in their stomach and it keeps on happening
00:44:55,00:44:58,that amazing that's so cool and makes them even more sexy if anything
00:44:58,00:45:07,the word tattoo comes from Tahitian and we've got it from Captain Cog's first flight so we got it
00:45:07,00:45:16,in English around 1760 1770 and according to the OED the word is onomatopoeic so it comes from the
00:45:16,00:45:24,sound so the tat comes from the tapping of a tattooing instrument into the skin and the ooo comes
00:45:24,00:45:31,from the cry of pain from the person being tattooed brilliant that's amazing that's so good um have
00:45:31,00:45:36,you heard of 3d tattoos no these are brilliant okay these are another medical innovation they're
00:45:36,00:45:40,so good um so i was reading about a woman from the isle of wight who she had to have a hernia
00:45:40,00:45:46,operation and she lost her belly button okay so she felt a bit self-conscious and she decided to
