start_hhmmss,end_hhmmss,text
00:00:00,00:00:14,[Instrumental Music]
00:00:14,00:00:22,"Hello and welcome to another episode of ""No Such Thing as a Fish"" a weekly podcast"
00:00:22,00:00:26,this week coming to you live from the Hammersmith event of my party!
00:00:26,00:00:31,[Cheering]
00:00:31,00:00:37,"My name is Dan Schreiber, I am sitting here with Annotasinski, Andrew Hunter Murray, and"
00:00:37,00:00:41,"James Harkin, and once again we have gathered around the microphones with our four favorite"
00:00:41,00:00:46,"facts from the last seven days, and in no particular order, here we go."
00:00:46,00:00:48,"Starting with you, James."
00:00:48,00:00:54,"Okay, my fat this week is that in the 18th century London plays written by David Garrick"
00:00:54,00:01:01,and starring David Garrick would often be shown in theatres owned by David Garrick.
00:01:01,00:01:09,They would then be reviewed by David Garrick in newspapers owned by David Garrick.
00:01:09,00:01:11,"Amazing guy, wasn't he?"
00:01:11,00:01:19,"He was a man of many talents, apparently according to the reviews I read."
00:01:19,00:01:23,"So yeah, I mean, he ran the Dory Lane theatre, he was a great actor, a lot of you will have"
00:01:23,00:01:24,heard of him.
00:01:24,00:01:30,"He also had the St. James' Chronicle and the public advertiser, in the Chronicle it said Mr."
00:01:30,00:01:37,Garrick was most extraordinarily accurate in every syllable which he uttered.
00:01:37,00:01:41,"And his spelling is really good, too."
00:01:41,00:01:45,"He was a really exciting character for theatre, he was someone who brought in the old, he championed"
00:01:45,00:01:49,"Shakespeare, but he also was looking at new technologies to make plays more interesting."
00:01:49,00:01:54,"So for example, when he played Hamlet, he designed a wig that when the ghost of his father"
00:01:54,00:02:01,"walked in, stood up on edge, he did change the way people acted weirdly."
00:02:01,00:02:07,"So before Garrick came along, then for instance, spectators would be on the stage, you guys"
00:02:07,00:02:12,"would be up here with us, like during the performance into mingling and he said, ""Let's not"
00:02:12,00:02:13,"do that."""
00:02:13,00:02:14,"No, let's not do that."
00:02:14,00:02:15,Let's definitely not do that.
00:02:15,00:02:16,Let's do that.
00:02:16,00:02:23,"He made actors come to rehearsals, which really pissed them off, he abolished the practice"
00:02:23,00:02:29,"of people, audience members coming in at the interval for half price, so people were coming in the"
00:02:29,00:02:34,"middle of Hamlet and then spent the whole time going, ""So who's that guy?"
00:02:34,00:02:37,"Why is she so upset?"""
00:02:37,00:02:39,"But actually that was really, really controversial, wasn't it?"
00:02:39,00:02:41,There were riots because of that.
00:02:41,00:02:47,"So when he decided against the half price thing, he came on stage and all the people in the"
00:02:47,00:02:50,"pit, so it used to be that you had rich people in the top and you'd have really poor people"
00:02:50,00:02:55,"in the pit, or poorer people in the pit."
00:02:55,00:02:58,Let's hear it from the rich people up there.
00:02:58,00:03:03,They're all the same price.
00:03:03,00:03:09,"So he came on stage and the people in the pit said that he had to stop this half price thing,"
00:03:09,00:03:13,"""Oh, bring it back,"" I should say, and he said he'd have to consult his business partner"
00:03:13,00:03:15,and he was booed off stage.
00:03:15,00:03:17,Was this business partner David Garrick?
00:03:17,00:03:21,That's him in massage.
00:03:21,00:03:26,"And then the actors came on and then they were also booed off stage and then finally, according"
00:03:26,00:03:30,"to the article from the time that I read, ""At eight o'clock the ladies were asked to leave"
00:03:30,00:03:32,"so the house might be burnt."""
00:03:32,00:03:33,Whoa.
00:03:33,00:03:38,"Oh, that's so thoughtful."
00:03:38,00:03:40,"It's really, like the theatre was a riser's place."
00:03:40,00:03:45,"So the character, sitting on the stage thing, that was the result of a 15 year campaign."
00:03:45,00:03:48,It took 15 years to get people to stop sitting on the stage.
00:03:48,00:03:54,"And there was also Garrick, the way he changed acting as well was very cool because before Garrick,"
00:03:54,00:03:59,"and there was another guy called Maclin, who was a huge rival of Garricks, but before that,"
00:03:59,00:04:04,"actors were basically stand with their feet at 10 and to shouting, essentially shouting."
00:04:04,00:04:08,And Garrick was such a good actor because he paid attention to the other people he was on
00:04:08,00:04:10,"stage with, rather than just waiting for news."
00:04:10,00:04:15,So James Quinn told that.
00:04:15,00:04:20,But the reviews would say things like he even acts when he's not acting.
00:04:20,00:04:21,There's blue people's minds.
00:04:21,00:04:22,What does that mean?
00:04:22,00:04:26,It means he pretended to listen to the other people on stage.
00:04:26,00:04:27,He was playing a part.
00:04:27,00:04:30,"He stayed in character, rather than just going back to standing neutrally like a dummy waiting"
00:04:30,00:04:31,for his turn to shout.
00:04:31,00:04:32,"Oh, okay, right."
00:04:32,00:04:36,"Well, wondering off stage, when it's not your line, you just go and get a coffee and come"
00:04:36,00:04:37,again.
00:04:37,00:04:38,Yeah.
00:04:38,00:04:43,"So acting did used to be very different, as we said beforehand, the leading actor, the"
00:04:43,00:04:47,"greatest rival to Garrick was a guy called James Quinn, who was known as the bellower."
00:04:47,00:04:51,And he was London's best actor because he had a very loud voice.
00:04:51,00:04:53,"And also, he was very good at gesticulating."
00:04:53,00:04:58,"So there were three hallmarks of great acting, number one, very loud voice, number two, excessive"
00:04:58,00:05:02,"gesticulating, and number three, incredibly long pauses."
00:05:02,00:05:07,So actors at the time were schooled in three different types of pauses.
00:05:07,00:05:11,"You had moderate, longer, and grand."
00:05:11,00:05:12,Wow.
00:05:12,00:05:13,Wow.
00:05:13,00:05:15,"He sounds like very much like Brian Blessed, doesn't he?"
00:05:15,00:05:16,He sounds so much.
00:05:16,00:05:20,But was he not famous for killing people?
00:05:20,00:05:21,I think.
00:05:21,00:05:22,"He was in a lot of jewels, Quinn."
00:05:22,00:05:23,Yes.
00:05:23,00:05:24,Right.
00:05:24,00:05:25,Right.
00:05:25,00:05:30,I read that he killed a fellow actor who mispronounced the word Kato as Kato on stage.
00:05:30,00:05:31,What?
00:05:31,00:05:32,I think that's fair enough.
00:05:32,00:05:36,"Dan, you would not have lasted five minutes if you've seen that."
00:05:36,00:05:38,"But that was, like, that did happen."
00:05:38,00:05:43,"So you mentioned Andy Charles McClend, who was Garek's rival, I think."
00:05:43,00:05:46,And McClend once killed a fellow actor for borrowing his wig.
00:05:46,00:05:47,That's harsh.
00:05:47,00:05:50,"Well, because he had that one that stood up, and not many people had."
00:05:50,00:05:51,"Yes, true."
00:05:51,00:05:53,So we mentioned the riots briefly.
00:05:53,00:05:54,"Oh, yes."
00:05:54,00:05:56,I just had a one theatrical riot I wanted to share with you guys.
00:05:56,00:05:58,So this was in Dury Lane.
00:05:58,00:06:04,"It was in 1755, and a Swiss ballet master had brought a festival to Dury Lane, very exciting."
00:06:04,00:06:08,And the press were furious because he had brought Frenchmen and French women onto an English
00:06:08,00:06:10,"stage, and they would live it."
00:06:10,00:06:15,"So someone in a gallery cried out that the dancers were disguised French soldiers, which"
00:06:15,00:06:16,obviously they were not.
00:06:16,00:06:18,It was a ballet festival.
00:06:18,00:06:22,"And one of the actors shouted back, ""I'm not French, I'm Swiss."""
00:06:22,00:06:26,"And one of the protestors then shouted back, ""Swiss, what the devil do we know of Swiss?"
00:06:26,00:06:27,"A Swiss is a foreigner."""
00:06:27,00:06:32,And all foreigners are Frenchmen.
00:06:32,00:06:37,"So this went on for a few nights, and then on the fifth night, they just started the spectators"
00:06:37,00:06:41,to start ripping up the benches and destroying the chandeliers and destroying the scenery on
00:06:41,00:06:42,stage.
00:06:42,00:06:44,"Constantly, we're doing it, tearing theaters apart."
00:06:44,00:06:46,I don't know how many theaters are still standing.
00:06:46,00:06:51,"I think one of the most famous theatre riots was in 1809, and that was the Covent Garden"
00:06:51,00:06:52,theatre riots.
00:06:52,00:06:55,"Basically, the Covent Garden theatre had been burned down, and they thought we'll use this"
00:06:55,00:06:58,as an excuse to rebuild it and put up prices.
00:06:58,00:07:02,"And they also rebuilt it so that if you were in the upper tiers, you could only see the"
00:07:02,00:07:04,legs of the people on stage.
00:07:04,00:07:06,And this really annoying people.
00:07:06,00:07:07,And they properly rioted.
00:07:07,00:07:11,"So they had this chart, which was old prices, old prices."
00:07:11,00:07:16,The noise was so bad that soldiers were constantly having to be sent up to restore order.
00:07:16,00:07:17,The rioting lasted three months.
00:07:17,00:07:22,And the audiences did things like they would bring live pigs into the audience.
00:07:22,00:07:24,"They brought rattles, they brought trumpets."
00:07:24,00:07:28,They brought pigeons very often and released them into the auditorium.
00:07:28,00:07:32,"And they wore these badges with OPs, standing for old price."
00:07:32,00:07:37,"It was quite nice, but of merch for the rioters."
00:07:37,00:07:40,"In the same year as the Swiss riot, Garrix Theatre posted an advert in the press to try and"
00:07:40,00:07:45,find out who it was that flung a hard piece of cheese of near half a pound weight from one
00:07:45,00:07:49,of the galleries last Tuesday night and greatly hurt a young lady in the pit.
00:07:49,00:07:54,"Oh my god, was it spelt greatly, like, GR80?"
00:07:54,00:08:02,"Do you know that he went to, when he was at school, he was taught by Samuel Johnson."
00:08:02,00:08:03,Yeah.
00:08:03,00:08:04,"Yeah, yeah."
00:08:04,00:08:05,And this was in Litchfield.
00:08:05,00:08:09,"And Samuel Johnson had to start a school, basically, because he was not allowed to be"
00:08:09,00:08:12,a part of an already existing school.
00:08:12,00:08:15,"And the reason that they said is, it was feared that the way that he was able to distort"
00:08:15,00:08:18,his face all the time would scare the children.
00:08:18,00:08:20,"So they were like, your face is too scary."
00:08:20,00:08:21,You can't teach here.
00:08:21,00:08:23,"So he set up, yeah, he set up his own school."
00:08:23,00:08:27,"And there were only three pupils at it, one of which was David Garrix."
00:08:27,00:08:30,"And then after school, they went to London together."
00:08:30,00:08:31,That's...
00:08:31,00:08:33,"The school shut down, didn't it, because it had three pupils."
00:08:33,00:08:34,Yeah.
00:08:34,00:08:35,So then they went to London.
00:08:35,00:08:36,Yeah.
00:08:36,00:08:40,"Can I just one more thing about a very exciting event in the 18th century, Theatre World."
00:08:40,00:08:44,Another big thing was 1749 at the Haymarket Theatre.
00:08:44,00:08:48,"They were adverted all over London, that the bottle conjurer was going to be performing."
00:08:48,00:08:50,And no one knew who this was.
00:08:50,00:08:52,It's a mystery to this very day.
00:08:52,00:08:57,"But what was advertised was that, various things, it said that you could give him a walking"
00:08:57,00:09:01,"cane on stage, and he would tap it and play the sound of any instrument you liked with"
00:09:01,00:09:03,his tapping.
00:09:03,00:09:07,"You could wear a mask, and even if you wore a mask, he'd be able to tell you who you were."
00:09:07,00:09:13,"And then the P.S. to resistance was, he'll have a common wine bottle on stage."
00:09:13,00:09:17,"He will go into it, and sing in it."
00:09:17,00:09:18,And did you...
00:09:18,00:09:19,So we would climb into the bottle?
00:09:19,00:09:21,"You would climb into the wine bottle, yes."
00:09:21,00:09:26,"And sing in the wine bottle, and during his stay in the bottle, any person may handle it."
00:09:26,00:09:27,And so...
00:09:27,00:09:28,This must...
00:09:28,00:09:31,"And I've seen some of your wine bottles, and they are pretty big."
00:09:31,00:09:34,Why do they make them next so tiny?
00:09:34,00:09:36,"Otherwise, I'd go in myself."
00:09:36,00:09:41,"But this huge audience turned up, because it was a court, so which I think it was about"
00:09:41,00:09:44,"a bit bigger than a normal wine bottle, a liter or whatever."
00:09:44,00:09:49,"But a massive audience turned up, including the king's son, lots of nobility."
00:09:49,00:09:53,"There was obviously a ruse, he wasn't going to climb inside a wine bottle."
00:09:53,00:09:57,"And so people got really pissed off, and so they went, and he didn't turn up, no one came"
00:09:57,00:09:58,on stage.
00:09:58,00:10:01,"And the benches were torn out, this was the Haymarket Theatre, Big Theatre, Scenery"
00:10:01,00:10:06,"Totally Destroyed, Debris was dragged out of the theatre, and all of the stuff inside"
00:10:06,00:10:08,the theatre was set on fire.
00:10:08,00:10:12,"And one newspaper explained this the next day, the fact that the guy hadn't turned up"
00:10:12,00:10:17,"and climbed inside a wine bottle, explained it by saying he had given a private audience"
00:10:17,00:10:18,beforehand.
00:10:18,00:10:23,"And we're upon receiving a demonstration of the trick, the viewer, as in that private audience"
00:10:23,00:10:28,had caulked up the bottle and whipped it in his pocket and made of.
00:10:28,00:10:38,"Of, okay, it is time for fact number two, and that is my fact."
00:10:38,00:10:44,My fact this week is that the main source for Sigmund Freud's work on paranoid schizophrenia
00:10:44,00:10:50,was the memoirs of a man who made unbelievable and ludicrous claims.
00:10:50,00:10:56,That man's name was Dan Schreber.
00:10:56,00:10:59,Daniel Paul Schreber was his name.
00:10:59,00:11:08,"This is a guy he lived from 1842 to 1911, and he wrote a memoir, memoirs of my nervous illness,"
00:11:08,00:11:11,and in it he was kind of trying to show what it was like from the inside of someone who
00:11:11,00:11:17,"was having all of these thoughts and so on, published the book, and Freud picked it up,"
00:11:17,00:11:18,and never met him.
00:11:18,00:11:21,"They lived at the same time, but didn't want to meet him because he didn't want to be influenced"
00:11:21,00:11:22,by it.
00:11:22,00:11:23,He just used the book.
00:11:23,00:11:26,And that was the basis for a lot of his Freud's work.
00:11:26,00:11:30,"Daniel Schreber's book is still in publication, if you go into book shops, that memoir."
00:11:30,00:11:32,It's how important it is.
00:11:32,00:11:37,So Schreber thought that there were little men living inside his feet that were taking
00:11:37,00:11:41,out his genitals and then putting female genitals in so he could have God's child.
00:11:41,00:11:42,Yes.
00:11:42,00:11:47,Putting female genitals into his feet or into the place where they're normally are.
00:11:47,00:11:48,Oh yeah.
00:11:48,00:11:51,But it was very hard to walk.
00:11:51,00:11:52,Yeah.
00:11:52,00:11:55,"He was mad, wasn't he, Freud?"
00:11:55,00:11:56,Freud.
00:11:56,00:11:57,"Freud was, yeah."
00:11:57,00:12:01,"Not this guy with the vagina in his foot, I think he was fine."
00:12:01,00:12:04,There were just so many things that were wrong about what he thought.
00:12:04,00:12:07,So he had a lifelong fear of trains.
00:12:07,00:12:13,They went for it and that was based on an experience he had in his early childhood which he explained
00:12:13,00:12:16,in a letter 40 years after the event.
00:12:16,00:12:21,"And he explained to one of his friends that when he was three years old, he'd moved house,"
00:12:21,00:12:24,"his whole family had moved house, not just him."
00:12:24,00:12:29,"And they'd moved, gone by train and he explained that he'd seen his mother naked on the overnight"
00:12:29,00:12:34,"train and he thought, you know, from that experience, he'd been permanently traumatized"
00:12:34,00:12:38,by seeing his mother naked and obviously being sexually attracted to her.
00:12:38,00:12:42,So there is an idea that he had this theory of the eat-up as complex.
00:12:42,00:12:47,"And now it's thought that maybe he had one, but it's not true that everyone has one."
00:12:47,00:12:50,"You know, he was almost not a psychiatrist."
00:12:50,00:12:55,He first started the first paper that he ever published was on eels and it was his attempt
00:12:55,00:12:57,to locate their testicles.
00:12:57,00:12:59,That was what he was doing.
00:12:59,00:13:04,"He dissected 400 eels looking for their testicles, just was obsessed."
00:13:04,00:13:06,"He was like, they've got to be somewhere."
00:13:06,00:13:10,"And at what stage do you go, I've done 399?"
00:13:10,00:13:11,Yeah.
00:13:11,00:13:13,"400, 400 was the same."
00:13:13,00:13:14,"Yeah, yeah."
00:13:14,00:13:19,"Because he published the paper saying, didn't find them, but this was one of the great mysteries"
00:13:19,00:13:20,of the age.
00:13:20,00:13:21,It was.
00:13:21,00:13:22,We don't know who he was.
00:13:22,00:13:23,So what?
00:13:23,00:13:28,No one knew where eels bred and male eels only have gonads when they need them basically.
00:13:28,00:13:31,So Aristotle said that eels came from nothing.
00:13:31,00:13:34,That was his great theory.
00:13:34,00:13:37,I don't like to do what a chance is.
00:13:37,00:13:40,He sometimes said they came from the guts of wet soil as well.
00:13:40,00:13:41,Yes.
00:13:41,00:13:42,Yeah.
00:13:42,00:13:43,And some people said they came out of thash roofs.
00:13:43,00:13:44,"I mean, no one knew."
00:13:44,00:13:48,"So, but the thing was Freud, when he wrote this paper, he said, well, they must have all"
00:13:48,00:13:49,been female.
00:13:49,00:13:52,That's the only explanation I can think of rather than that he got it wrong.
00:13:52,00:13:55,"And I read a great essay online which asked, you know, what, this must have been very"
00:13:55,00:14:00,"formative for Freud, it said, we know now that Freud viewed most people's problems through"
00:14:00,00:14:05,"a sexual lens, but was that lens tinted by the set of testicles he couldn't find a lifetime"
00:14:05,00:14:06,ago?
00:14:06,00:14:13,Did his inability to locate the eels reproductive organs prove so prominent in his studies that
00:14:13,00:14:18,he saw them everywhere he went in the manner that a rare car owner begins to see his car
00:14:18,00:14:22,everywhere soon after driving it off the lot?
00:14:22,00:14:26,So weird as similarly I've ever heard.
00:14:26,00:14:27,"He hated women though, didn't he?"
00:14:27,00:14:29,Maybe that's all about the eels testicles as well.
00:14:29,00:14:31,He was the heinous sexist.
00:14:31,00:14:35,So he said that women should be basically avoided because they were too susceptible to
00:14:35,00:14:37,being seduced.
00:14:37,00:14:40,He advised his friends against hanging out with them at all.
00:14:40,00:14:47,"He said that they have an ineptitude for serious life tasks that they are unstable, incapable"
00:14:47,00:14:52,of grasping their own unimportance and their people.
00:14:52,00:14:56,He said nature's inclined them to be vain and he said the only thing that women contributed
00:14:56,00:15:02,"to society are a plating and weaving because women traditionally were, they did do a lot"
00:15:02,00:15:08,of weaving and plating and he attributed this to obviously their desire to have a penis.
00:15:08,00:15:15,And so what he said was women are so upset about not having a penis that their plotting
00:15:15,00:15:19,is expressing their desire to plot their pubic hair in order to conceal the fact that they
00:15:19,00:15:22,have no male genitals on their face.
00:15:22,00:15:23,It's a killer.
00:15:23,00:15:28,"What's interesting is, you say he didn't like women but it was a woman who actually helped"
00:15:28,00:15:33,him get to his biggest breakthrough in psychiatry when sitting with them and she was appropriately
00:15:33,00:15:36,called Fanny.
00:15:36,00:15:37,Fanny Moser was her name.
00:15:37,00:15:44,He was treating her and he used to do it through hypnosis but he was a terrible hypnotist.
00:15:44,00:15:50,"You're unstable, you're weak, you wish you had a penis."
00:15:50,00:15:54,"So he used to do that, you're getting sleepy thing and Fanny Moser said actually I don't"
00:15:54,00:15:58,"think I am and he was like no you aren't, I really don't think I am."
00:15:58,00:16:02,So she just started talking and she was laying on the couch and kept talking and kept talking
00:16:02,00:16:04,"and he thought hang on a second, this is amazing."
00:16:04,00:16:08,I'm actually getting stuff here that's real and raw and that was the game changer for
00:16:08,00:16:09,him.
00:16:09,00:16:13,"In a way, the talking here was invented because a woman told him to shut the fuck up"
00:16:13,00:16:22,"because she, honestly because he, because Fanny, he used to say his theories to her and"
00:16:22,00:16:26,at one point she just said honestly please shut up because without your comments I can properly
00:16:26,00:16:31,"let my mind wander and work out what's going on and he was like okay cool, I'll just"
00:16:31,00:16:32,step back.
00:16:32,00:16:34,"Yeah, while he saw sex everywhere, didn't he?"
00:16:34,00:16:38,He thought anything elongated such as sticks or tree trunks or umbrellas represented the
00:16:38,00:16:44,penis. He said that walking up and down steps symbolise a sexual act.
00:16:44,00:16:48,You guys in the circle?
00:16:48,00:16:49,Sounds like it.
00:16:49,00:16:53,What was his day to day like but he just saw penises everywhere.
00:16:53,00:16:56,It must have been so distracting.
00:16:56,00:16:59,Do you guys know what the first Freudian slip was?
00:16:59,00:17:00,Oh no.
00:17:00,00:17:01,No.
00:17:01,00:17:07,"So the first Freudian slip was a young man who said Xoriare, X nostris or Cibus Ulto, when"
00:17:07,00:17:15,"as you all know, he should have said Xoriare, Alicuis, nostris, X, Cibus, Ulto, so I mean it's"
00:17:15,00:17:16,obvious isn't it?
00:17:16,00:17:21,I think it's like maybe a loving at that.
00:17:21,00:17:25,So basically it was the suppression of the word Alicuis meant that he must have had some
00:17:25,00:17:27,association with that word.
00:17:27,00:17:32,So he did a word association and said what does that make you think of and eventually got
00:17:32,00:17:40,to a word which was Saint Genuarius and Saint Genuarius kept his blood in a file which was supposed
00:17:40,00:17:44,to have turned into liquid once a year and then was solid the rest of the time and then
00:17:44,00:17:49,the man confessed that his girlfriend had missed her period and so Freud concluded that
00:17:49,00:17:54,he had blocked out this word from ten minutes ago because he associated that with the fact
00:17:54,00:18:00,that his girlfriend might be pregnant.
00:18:00,00:18:07,"You shouldn't give your blood in a file, it makes the cardboard soggy."
00:18:07,00:18:12,"Have we talked about the cocaine, I don't think we have, a huge fan of cocaine."
00:18:12,00:18:16,He experimented with it as a student believing it would alleviate his depression and anxiety
00:18:16,00:18:21,"and great news it did and he just started posting, it was this bizarre period where you were"
00:18:21,00:18:24,just posting cocaine around because it wasn't really illegal so he sent it to his fiancee
00:18:24,00:18:32,to make us strong. She must have been plotting like mad after that.
00:18:32,00:18:36,He gave it to his great friend who was called Fleischel because Fleischel was addicted to
00:18:36,00:18:42,"morphine and he said I know something that will cure you morphine addiction, try cocaine."
00:18:42,00:18:48,Fleischel then became completely addicted to cocaine and he claimed it had been a success
00:18:48,00:18:49,but it had not.
00:18:49,00:18:53,One of the things he justified it with when he was recommending it to this guy whose life
00:18:53,00:18:58,"was ruined by Freud forcing cocaine on him. Freud said the wonderful thing about cocaine,"
00:18:58,00:19:03,the best thing about it is there is absolutely no craving for the further use of cocaine
00:19:03,00:19:13,after your first take it or even repeatedly.
00:19:13,00:19:20,Your seat number has been taken down but I was looking into with Freud just off the back
00:19:20,00:19:25,of David Garrick I thought what did he do as hobbies did he go to the theater for example
00:19:25,00:19:29,and I could only find one example and it was to see a guy who we've mentioned very briefly
00:19:29,00:19:34,on this podcast before called Le Petalmaine.
00:19:34,00:19:37,"Le Petalmaine, the fighter, his act was to just fart on stage."
00:19:37,00:19:42,What's interesting is it wasn't that he was eating generating gas and farting he was sucking
00:19:42,00:19:47,air up into his bum and farting it back out so he discovered this when he was in the
00:19:47,00:19:53,ocean and he was almost drowning he notices the ocean getting very slightly lower.
00:19:53,00:19:57,As he was drowning he went and it went both in and up at the same time and he was like
00:19:57,00:20:02,that's weird he came back to the surface he went to the beach and it all flooded out
00:20:02,00:20:06,of his butt and he thought what's happening here so highlights of his act they involved
00:20:06,00:20:10,the effects of cannon fire and thunderstorms from his bum.
00:20:10,00:20:15,He could play Osolomio through a sort of rubber tube in his bum.
00:20:15,00:20:18,I don't know that would you mind performing it?
00:20:18,00:20:22,We know it as just one conneto.
