start_hhmmss,end_hhmmss,text
00:16:50,00:16:54,And it was so exciting that we started talking about the regular numbers of the King's
00:16:54,00:16:55,and Queen's England.
00:16:55,00:16:56,I'm so sorry.
00:16:56,00:16:57,I couldn't make it.
00:16:57,00:16:58,He's going to be great.
00:16:58,00:16:59,He's going to be great.
00:16:59,00:17:00,He's going to be great.
00:17:00,00:17:01,"Edward the Ninth, I think we found."
00:17:01,00:17:02,That was what you thought that was.
00:17:02,00:17:03,That's what the book he's reckon.
00:17:03,00:17:04,Is it?
00:17:04,00:17:05,I think so.
00:17:05,00:17:10,"The main fact itself, I've read this in a few places, found a few sources, but nothing that"
00:17:10,00:17:14,"I would say is concrete enough that I truly, I want to see the card."
00:17:14,00:17:16,And if anyone knows if the card exists.
00:17:16,00:17:21,"So the source for this, the original source was Queen Louise's niece Dollar, who was the"
00:17:21,00:17:23,Margraveen of Baden.
00:17:23,00:17:24,I don't know what that means.
00:17:24,00:17:27,"But anyway, it was a relative who first said this."
00:17:27,00:17:28,Yeah.
00:17:28,00:17:29,Okay.
00:17:29,00:17:30,There's a good source.
00:17:30,00:17:31,Thank you.
00:17:31,00:17:32,Thank you all for helping me out.
00:17:32,00:17:42,It's been reset.
00:17:42,00:17:43,Okay.
00:17:43,00:17:45,It is time for our final fact of the show.
00:17:45,00:17:46,And that is James.
00:17:46,00:17:47,Okay.
00:17:47,00:17:52,"My fact this week is that last year in the UK, two eight-year-olds were caught speeding."
00:17:52,00:17:57,This came from a freedom of information question that was posed to the driver and vehicle licensing
00:17:57,00:17:58,agency.
00:17:58,00:18:03,They asked for all of the different statistics and they also found out that 900 people in their
00:18:03,00:18:09,"90s got penalty points for speeding last year, including three people aged 99."
00:18:09,00:18:11,Although I reckon 99.
00:18:11,00:18:14,"That's the oldest, but it's quite coincidence that it's 99 and not 100 and something."
00:18:14,00:18:18,"So I reckon anyone that's over 99, they just put 99, maybe there's only two spaces in"
00:18:18,00:18:19,the farm.
00:18:19,00:18:20,Oh yeah.
00:18:20,00:18:21,I reckon.
00:18:21,00:18:25,Or you just don't find someone who's 100 or more for speeding.
00:18:25,00:18:26,No.
00:18:26,00:18:28,"I don't fare enough, mate."
00:18:28,00:18:31,"On further, you docked the 99-year-old though."
00:18:31,00:18:32,"Well, you know."
00:18:32,00:18:33,One more year in your home.
00:18:33,00:18:36,"Yeah, you've got to hang on to your 100th birthday."
00:18:36,00:18:39,"That's like saying on further, you won't let the 15-year-olds smoke when the 16-year-olds"
00:18:39,00:18:40,allowed to.
00:18:40,00:18:42,"I mean, you've got to draw the line somewhere, haven't you?"
00:18:42,00:18:43,"Okay, sure."
00:18:43,00:18:44,That's a line.
00:18:44,00:18:45,That's a line.
00:18:45,00:18:46,"Sorry, I also think the smoking age might have gone up since I was a smoker."
00:18:46,00:18:52,"So 16-year-olds, if it's illegal, just check."
00:18:52,00:18:57,"Or, you know, whatever, don't smoke, consider that."
00:18:57,00:19:03,"There have been quite a lot of weird speeding fines and driving fines this year, so there"
00:19:03,00:19:07,have been two instances of people getting caught driving to the hospital because their wives
00:19:07,00:19:09,were in labour and getting stopped for speeding.
00:19:09,00:19:13,"And so one was in the UK going at 101 miles an hour, and then there was another guy in"
00:19:13,00:19:16,the US who missed the birth of his child because he was taken to a cell.
00:19:16,00:19:17,"Oh, no."
00:19:17,00:19:18,Yeah.
00:19:18,00:19:19,"Oh, that's hard."
00:19:19,00:19:20,Wow.
00:19:20,00:19:21,"It's really rough, isn't it?"
00:19:21,00:19:22,Yeah.
00:19:22,00:19:23,I don't think so.
00:19:23,00:19:24,Yeah.
00:19:24,00:19:25,"It's really rough, isn't it?"
00:19:25,00:19:26,"It's really rough, isn't it?"
00:19:26,00:19:27,"It's really rough, isn't it?"
00:19:27,00:19:28,"It's really rough, isn't it?"
00:19:28,00:19:29,"It's really rough, isn't it?"
00:19:29,00:19:30,"It's really rough, isn't it?"
00:19:30,00:19:31,"Yeah, it's really rough, isn't it?"
00:19:31,00:19:32,"It's really rough, isn't it?"
00:19:32,00:19:33,"It's really rough, isn't it?"
00:19:33,00:19:34,"It's really rough, isn't it?"
00:19:34,00:19:35,"It's really rough, isn't it?"
00:19:35,00:19:36,"It's really rough, isn't it?"
00:19:36,00:19:37,"It's really rough, isn't it?"
00:19:37,00:19:38,"It's really rough, isn't it?"
00:19:38,00:19:39,"It's really rough, isn't it?"
00:19:39,00:19:40,"It's really rough, isn't it?"
00:19:40,00:19:41,"It's really rough, isn't it?"
00:19:41,00:19:42,"It's really rough, isn't it?"
00:19:42,00:19:49,"It's really rough, isn't it?"
00:19:49,00:19:50,"It's really rough, isn't it?"
00:19:50,00:19:51,"It's really rough, isn't it?"
00:19:51,00:19:52,"It's really rough, isn't it?"
00:19:52,00:19:53,"It's really rough, isn't it?"
00:19:53,00:19:54,"It's really rough, isn't it?"
00:19:54,00:19:55,"It's really rough, isn't it?"
00:19:55,00:19:56,"It's really rough, isn't it?"
00:19:56,00:19:57,"It's really rough, isn't it?"
00:19:57,00:19:58,"It's really rough, isn't it?"
00:19:58,00:19:59,"It's really rough, isn't it?"
00:19:59,00:20:00,"It's really rough, isn't it?"
00:20:00,00:20:01,"It's really rough, isn't it?"
00:20:01,00:20:02,"It's really rough, isn't it?"
00:20:02,00:20:03,"It's really rough, isn't it?"
00:20:03,00:20:04,"It's really rough, isn't it?"
00:20:04,00:20:05,"It's really rough, isn't it?"
00:20:05,00:20:06,"It's really rough, isn't it?"
00:20:06,00:20:07,"It's really rough, isn't it?"
00:20:07,00:20:08,"It's really rough, isn't it?"
00:20:09,00:20:10,"Wow, that's good."
00:20:10,00:20:14,I really hope he did the names Bond James Bond.
00:20:14,00:20:15,But I'm going to show you your license.
00:20:15,00:20:16,Two kills.
00:20:16,00:20:20,And any actual license.
00:20:20,00:20:26,"We have in our book, we've got a similar sort of story."
00:20:26,00:20:27,What book's that done?
00:20:27,00:20:28,It's called The Book of the Year 2018.
00:20:28,00:20:31,You're a definitive guide to the world's weirdest news.
00:20:31,00:20:32,Do you know when it comes out?
00:20:32,00:20:33,"Yeah, October the 18th."
00:20:33,00:20:34,"Okay, where's it available?"
00:20:34,00:20:35,It's going to be in bookshops.
00:20:35,00:20:36,It's going to be online.
00:20:36,00:20:37,"Yeah, it's..."
00:20:37,00:20:39,"And at least not here, we can say Amazon."
00:20:39,00:20:40,"Amazon, it's going to be on Amazon."
00:20:40,00:20:42,"Yes, this is the first time I've heard of it."
00:20:42,00:20:46,Remember we found that thing of the guy who was done for drink driving?
00:20:46,00:20:48,"But it's claimed that he wasn't drink driving,"
00:20:48,00:20:51,because he was only drinking every time he got to a traffic stop site.
00:20:51,00:20:54,So it stopped ever swig.
00:20:54,00:20:55,Are they going to go?
00:20:55,00:20:56,We're going to go.
00:20:56,00:20:57,This is...
00:20:57,00:20:58,"Sorry, go on."
00:20:58,00:20:59,"No, you can if I was just sighing."
00:20:59,00:21:00,I just want to stay alive.
00:21:00,00:21:05,Did you know the first person to pass a driving test was called Mr. Beer?
00:21:05,00:21:07,"No, I didn't know that."
00:21:07,00:21:11,"So in 1935, he paid 37.5P, just found that out."
00:21:11,00:21:15,"And also found out this weird thing that driving tests were suspended in the second world war, which makes sense."
00:21:15,00:21:19,"And they were suspended again during the Suez crisis, which is quite weird."
00:21:19,00:21:23,"And especially given that during the Suez crisis, learners were allowed to drive on a company."
00:21:23,00:21:24,And then...
00:21:24,00:21:27,"And I think I don't know about Suez crisis, but it's definitely true of the second world war,"
00:21:27,00:21:31,"that if you learn to drive during the war, they just gave you a license."
00:21:31,00:21:32,You didn't need to take a test at all.
00:21:32,00:21:36,"Oh, just because you've been through the war and how to drive."
00:21:36,00:21:40,"If you could drive enough to defeat the Nazis, then you could drive enough to go to the shop."
00:21:40,00:21:44,"If you can drive a tank through a minefield and not get blown up, I think you can manage the M25."
00:21:44,00:21:48,"Speaking of tanks, I read this yesterday."
00:21:48,00:21:52,So you're allowed to drive a tank on the road in the UK.
00:21:52,00:21:55,You need a special license.
00:21:55,00:21:59,"But if you could get a provisional license, which is really easy, a provisional tank license,"
00:21:59,00:22:03,"then as long as there's someone sat next to you who can drive a tank, then you can drive a tank"
00:22:03,00:22:06,through the streets of the UK at any time.
00:22:06,00:22:09,But you need to have learner plates on the tank.
00:22:09,00:22:11,But you will be at the school.
00:22:11,00:22:15,I knew that because the QIs production coordinator was telling me a great story about how she had to get James Blunt
00:22:15,00:22:17,to drive a tank through the BBC.
00:22:17,00:22:19,That was...
00:22:19,00:22:21,"Because he was an army guy, so he knows how to drive a tank."
00:22:21,00:22:23,But where do you get a tank?
00:22:23,00:22:25,This still feels like the main stomping block.
00:22:25,00:22:29,"Yeah, she just knew a guy."
00:22:29,00:22:31,Who's your buddy?
00:22:31,00:22:33,"You've met Ed once, we met him outside Bergershire."
00:22:33,00:22:35,"Oh, you have a tank?"
00:22:35,00:22:37,Yes.
00:22:37,00:22:39,It's a superior.
00:22:39,00:22:41,He's just trying to find someone to park.
00:22:41,00:22:44,He used to have it parked outside Ash Gardner of Empress's house.
00:22:44,00:22:46,They were neighbours and outside was his tank.
00:22:46,00:22:48,We used to go and sit inside it.
00:22:48,00:22:52,"He made it into this really nice sort of, you know, where you have Netflix nights."
00:22:52,00:22:54,"Oh, it was a hipster tank."
00:22:54,00:22:56,It was a long time.
00:22:56,00:23:04,"Okay, that is it. That is all of our facts."
00:23:04,00:23:06,Thank you so much for listening.
00:23:06,00:23:10,"If you'd like to get in contact with any of us about the things that we've said over the course of this podcast,"
00:23:10,00:23:12,we can be found on our Twitter accounts.
00:23:12,00:23:14,"I'm on @Streiberland, James."
00:23:14,00:23:16,"@JamesHarkin, Alex."
00:23:16,00:23:17,@AlexBel.
00:23:17,00:23:18,And Jizinski.
00:23:18,00:23:20,You can email podcast@QI.com.
00:23:20,00:23:24,"Yep, or you can go to our group Twitter account which is @NoSuchThing or to our website."
00:23:24,00:23:26,NoSuchThing is a fish.com.
00:23:26,00:23:27,It's just been remade.
00:23:27,00:23:30,It has everything you would need from us if you wanted anything from us.
00:23:30,00:23:33,It's got links to tickets as all of our previous episodes.
00:23:33,00:23:34,It has all of our merchandise.
00:23:34,00:23:36,It looks awesome.
00:23:36,00:23:37,Back off speed up.
00:23:37,00:23:38,"Okay, that's it."
00:23:38,00:23:39,We'll see you next week.
00:23:39,00:23:41,Goodbye.
00:23:41,00:24:01,[Music]
00:24:01,00:24:04,(upbeat music)
