start_hhmmss,end_hhmmss,text
00:40:18,00:40:22,But it's actually crematoriums that are using it to heat their own crematoriums.
00:40:22,00:40:24,"So if you're waiting in a crematorium, yeah, yeah."
00:40:24,00:40:27,"You don't need that. I mean, having been into a crematorium,"
00:40:27,00:40:29,it's like a room. How much heat do you need?
00:40:29,00:40:31,"Oh, there's a waiting room. There's the front desk."
00:40:31,00:40:32,You've got a person gone off this.
00:40:32,00:40:33,You've got a whole system there.
00:40:33,00:40:34,What country is this in?
00:40:34,00:40:36,Sweden. Sweden gets very cold then.
00:40:36,00:40:38,"Does get colder there, yeah, fair enough."
00:40:38,00:40:38,Yeah.
00:40:38,00:40:40,So they're using that.
00:40:40,00:40:42,"I love, just by the way, Andy, that thing you said with the coin that you snapped."
00:40:42,00:40:44,That technology is going wild at the moment.
00:40:44,00:40:48,I was at an arcade down the road from where I live.
00:40:48,00:40:51,And my son had enough tickets to win a prize.
00:40:51,00:40:53,And he got an inflatable hammer.
00:40:53,00:40:54,"And instead of having to blow it up,"
00:40:54,00:40:56,you just snap a thing inside it now and inflate.
00:40:56,00:40:58,"Yeah, okay."
00:40:58,00:41:01,I was not on board with this anecdote until I heard the end of it.
00:41:01,00:41:02,And I'm so on board with it.
00:41:02,00:41:05,And somebody's had to blow up lots of inflates in the last year or so.
00:41:05,00:41:08,"Yeah, this giant hammer that you don't do anything to,"
00:41:08,00:41:10,other than snapping a thing in the middle.
00:41:10,00:41:12,"I asked the guy behind the counter and he was like, I don't know, mate."
00:41:12,00:41:19,I didn't actually construct everything you see.
00:41:19,00:41:21,I'm not Wallace for Wallace and Gromit.
00:41:22,00:41:23,That's the first thing I do.
00:41:23,00:41:25,"I'd be like, hello, how do these hammers inflate?"
00:41:25,00:41:28,I really do just operate the till and I open up and close the shop at night.
00:41:28,00:41:33,Can I do a quick facts on Caroline before we move on?
00:41:33,00:41:33,"Oh, yeah, yeah."
00:41:33,00:41:36,Because that was the name of this so-called kettle.
00:41:36,00:41:42,Do you remember a few days ago when England won the Euros?
00:41:42,00:41:47,And we all sang sweet Caroline.
00:41:47,00:41:51,"Yeah, my Prime Minister Farage came out to shake the hands of the boys."
00:41:51,00:41:54,We're both recording in the past and in a parallel universe.
00:41:54,00:41:57,So we recorded this before the Euros.
00:41:57,00:42:03,"But at the time of recording, we had just absolutely battered Slovakia"
00:42:03,00:42:06,to one after extra time.
00:42:06,00:42:08,"And we did sing sweet Caroline, or the England fans did."
00:42:08,00:42:13,"And sweet Caroline is written by Neil Diamond about his wife, Marsha."
00:42:13,00:42:18,And he called it Caroline because Marsha doesn't scan the tune.
00:42:19,00:42:24,But what's interesting is that the reason England sings sweet Caroline is there was
00:42:24,00:42:28,"a DJ at Wembley Stadium called Tony Perry, who was supposed to play something else."
00:42:28,00:42:32,And he played sweet Caroline before the game and it had gone really well.
00:42:32,00:42:35,"And so after England won, this was against Germany."
00:42:35,00:42:37,"He thought, well, I'm going to play it again."
00:42:37,00:42:39,And he played it again and it really kind of took off.
00:42:39,00:42:44,"And when the women's football team won the Euros, whenever that was a few years ago,"
00:42:44,00:42:47,it was the big sort of song for them.
00:42:47,00:42:49,And it is the big song for England teams now.
00:42:49,00:42:55,"And this guy, Tony Perry, he's said something really interesting in an interview,"
00:42:55,00:42:58,which is like he's quite important for the team.
00:42:58,00:43:04,"Because if you imagine like England played Denmark a few years ago and there were 15 minutes left,"
00:43:04,00:43:05,England are winning.
00:43:05,00:43:07,They have the halftime of extra time.
00:43:07,00:43:09,"The fans again, really nervous."
00:43:09,00:43:14,The nerves of the fans can kind of go to the nerves of the players and it can kind of affect the game.
00:43:14,00:43:17,But what he can do is he can get the fans going
00:43:17,00:43:21,and he would play Freeford Desire by whoever that's by.
00:43:21,00:43:23,It's like a real proper dance anthem.
00:43:23,00:43:25,The crowd go absolutely mad.
00:43:25,00:43:30,"The crowd are suddenly really, really infused and that helps the team to do the job."
00:43:30,00:43:34,So actually the DJ who's at the football stadium can affect the game.
00:43:34,00:43:35,"Can alter the game, that's amazing."
00:43:35,00:43:37,I didn't know they had DJs in football stadiums.
00:43:37,00:43:38,"Yeah, they do."
00:43:38,00:43:39,But where do they set up?
00:43:39,00:43:41,"They're going to annoy the people on either side of them, aren't they?"
00:43:43,00:43:47,"They're not in decks in the middle of the pitch, they're just in a little booth in there."
00:43:47,00:43:53,So if England does lose and you want to take out some steam of your own sort of anger.
00:43:53,00:43:54,You mean in the next world?
00:43:54,00:43:55,Obviously we won't be able to.
00:43:55,00:43:58,"In the next World Cup, yeah, find the DJ and kick the shit out of them."
00:43:58,00:44:00,Didn't do his job.
00:44:00,00:44:03,I thought it was all chanting the referees of anchor and stuff like that.
00:44:03,00:44:05,Is that gone out these days?
00:44:05,00:44:08,"Well, during halftime, you don't just sit there shouting the referee."
00:44:08,00:44:09,"I mean, the referee's having a cup of tea."
00:44:09,00:44:12,"You can't hear anything, there's no point."
00:44:12,00:44:13,"Okay, that's interesting."
00:44:13,00:44:14,But then they'll play music.
00:44:14,00:44:16,They'll play loads of music.
00:44:16,00:44:19,And there's specific DJs whose job it is to do all these big events.
00:44:19,00:44:23,And they'll do the Super Bowl and do the World Cup and all that kind of stuff.
00:44:23,00:44:26,And they make their living by knowing what will get the crowd going.
00:44:26,00:44:27,That's interesting.
00:44:27,00:44:28,Do they take requests?
00:44:28,00:44:31,"Can I pop to the booth and say, could you please be a bit quiet?"
00:44:31,00:44:40,"Okay, it is time for our final fact of the show."
00:44:40,00:44:42,And that is my fact.
00:44:42,00:44:45,"My fact this week is that the classic textbook,"
00:44:45,00:44:49,"The Art of Editing, was co-written by Jack Scissors."
00:44:49,00:44:51,Very good.
00:44:51,00:44:52,"Yeah, that's great."
00:44:52,00:44:53,It's 432 pages.
00:44:53,00:44:57,"It was 434, though, before Jack got involved."
00:44:57,00:45:03,"Do you know that in the old newspapers, when they were editing,"
00:45:03,00:45:08,is they used to use scissors because big part of making your newspaper
00:45:08,00:45:11,was you would take all the stories from all the other newspapers
00:45:11,00:45:15,and you would cut them up and then you would put them on a sheet of paper
00:45:15,00:45:18,to make sure that they all fit it in the right place.
00:45:18,00:45:22,And then you would send them to your printer who would then print them.
00:45:22,00:45:25,"Hang on, that implies that to do your newspaper,"
00:45:25,00:45:27,you're just taking other stories from other newspapers.
00:45:27,00:45:29,What are the first newspapers?
00:45:29,00:45:31,"Well, they borrowed from your edition yesterday."
00:45:31,00:45:34,That's basically kind of how it works.
00:45:34,00:45:36,"So if you're a national newspaper,"
00:45:36,00:45:39,you would take it from the towns and stuff like that.
00:45:39,00:45:42,"In the really early days, there were things called avici,"
00:45:42,00:45:45,which were like newsletters that were sent round people
00:45:45,00:45:46,and then they would be all sent to the newspaper
00:45:46,00:45:48,and they would cut those up.
00:45:48,00:45:51,"But actually, all the newspapers would just copy off each other a lot of the time."
00:45:51,00:45:54,"And obviously, you had to have someone who wrote it originally,"
00:45:54,00:45:57,"but there were so many newspapers and so many pages to fill,"
00:45:57,00:45:59,you wouldn't have enough reporters to do all that.
00:45:59,00:46:00,So you did have to do that.
00:46:00,00:46:03,And you would usually credit wherever you got it from.
00:46:03,00:46:08,"In the same way that today, it would say this is an associated press report"
00:46:08,00:46:10,that is in the BBC or whatever.
00:46:10,00:46:12,"And that was really, really common."
00:46:12,00:46:14,"That's amazing because if you got something just completely wrong,"
00:46:14,00:46:16,"usually you'd think as a local newspaper,"
00:46:16,00:46:19,"you go, ""Well, at least only a couple of thousand people saw that."""
00:46:19,00:46:23,"Suddenly, it's global news, literally by the name of it."
00:46:23,00:46:26,"There was the Charlotte News, this was in 1902."
00:46:26,00:46:27,"So towards the end of when they were doing this,"
00:46:27,00:46:32,but they set up a trap saying that there was a gang of anarchists
00:46:32,00:46:36,in the Vladivostok who were going to kill all of the prominent rulers on the globe.
00:46:36,00:46:41,And the leader was Count Robgian Ruomoth Lyetsu.
00:46:41,00:46:46,"And if you read that backwards, it says, ""We steal from our neighbour."""
00:46:46,00:46:47,"Oh, very good."
00:46:47,00:46:53,"That method of cutting out and arranging on the page,"
00:46:53,00:46:56,"that survived Private Eye Magazine, where I work, also."
00:46:56,00:46:58,I took quite recently.
00:46:58,00:46:58,Yeah?
00:46:58,00:47:00,"Oh, is that done now?"
00:47:00,00:47:02,No longer. It has gone out now.
00:47:02,00:47:04,But it's during my time working there.
00:47:04,00:47:05,I think that it stopped.
00:47:05,00:47:07,I one day popped into the office while you were there
00:47:07,00:47:08,and you showed me how it was laid out.
00:47:08,00:47:09,It was fascinating.
00:47:09,00:47:12,"And sometimes, if someone picks up one of the finished pages,"
00:47:12,00:47:14,"carries it across the room, there is a bow or everyone goes,"
00:47:14,00:47:17,"""Oh, just no one coughed to that like it really."""
00:47:17,00:47:18,Yeah.
00:47:18,00:47:20,So scissors.
00:47:20,00:47:20,Yeah.
00:47:20,00:47:21,Scissors.
00:47:21,00:47:21,Scissors.
00:47:21,00:47:24,I was looking into a few words around the world
00:47:24,00:47:26,for what scissors are in different languages.
00:47:26,00:47:27,"Oh, yeah, that's a good idea."
00:47:27,00:47:28,It's quite fun.
00:47:29,00:47:33,So the Māori for scissors is kāti kāti or kūti kūti.
00:47:33,00:47:34,"German, Andy, you speak German."
00:47:34,00:47:36,Do you know what scissors are?
00:47:36,00:47:37,"Is something, isn't it shais?"
00:47:37,00:47:38,It's like shia.
00:47:38,00:47:39,"Yeah, shia, yeah."
00:47:39,00:47:40,So like shearing has a…
00:47:40,00:47:41,"Say it in English, I guess."
00:47:41,00:47:42,Shias.
00:47:42,00:47:43,This is the most interesting one.
00:47:43,00:47:45,Hungarian word for it is olo.
00:47:45,00:47:46,Olo.
00:47:46,00:47:47,Yeah.
00:47:47,00:47:48,"Now, why is that interesting?"
00:47:48,00:47:50,Is it because it looks like a pair of scissors?
00:47:50,00:47:51,It looks like a pair of scissors.
00:47:51,00:47:54,"Yeah, is that why it's called that or not?"
00:47:54,00:47:55,"Well, that's what that's…"
00:47:55,00:47:56,"Actually, what you've drawn looks like a penis."
00:47:56,00:48:00,That's a pair of cheeky testicles on the other side.
00:48:00,00:48:02,Is that great?
00:48:02,00:48:03,"Yeah, good on them."
00:48:03,00:48:04,That isn't presumably why it's called that.
00:48:04,00:48:05,"No, I don't think so."
00:48:05,00:48:06,I think it might.
00:48:06,00:48:10,"I mean, but it's hard to think that that's not why it's called that."
00:48:10,00:48:11,They're still made in the UK.
00:48:11,00:48:12,Scissors.
00:48:12,00:48:13,Scissors aren't.
00:48:13,00:48:15,"Yeah, but lots of manufacturing's gone elsewhere."
00:48:15,00:48:19,"In Sheffield, bingo, there used to be, in Sheffield,"
00:48:19,00:48:22,"40,000 workers in the scissors and cutlery trade."
00:48:22,00:48:23,Mostly cutlery.
00:48:23,00:48:24,Mostly cutlery.
00:48:24,00:48:25,But some scissors too.
00:48:25,00:48:29,"And obviously, a lot of them aren't in business anymore,"
00:48:29,00:48:32,but I think there might still be two.
00:48:32,00:48:35,"There's Whiteley, who've been going since 1760, at least,"
00:48:35,00:48:37,and there's also Ernest Wright and Son.
00:48:37,00:48:40,"They have two, what they're called, master putter-togetherers."
00:48:40,00:48:43,Is their job literally…
00:48:43,00:48:43,That's the title.
00:48:43,00:48:47,That is what the title is for anyone who does the job of putting scissors together.
00:48:47,00:48:49,They'll put her together.
00:48:49,00:48:50,"And they're proper, you know, they're metal,"
00:48:50,00:48:52,"all the way, handle, blade, everything."
00:48:52,00:48:53,They're sort of proper…
00:48:53,00:48:54,"Stay in the steel, I guess."
00:48:54,00:48:55,Yeah.
00:48:55,00:48:58,And there was a brilliant video in 2014 showing the trade
00:48:58,00:48:59,and how it still operated.
00:48:59,00:49:01,"So I don't know if this guy is still working there anymore,"
00:49:01,00:49:03,because he'd been there about 50 years when this was made.
00:49:03,00:49:05,So he probably isn't still there now.
00:49:05,00:49:07,"But he, one of the two master putter-togetherers,"
00:49:07,00:49:09,was called Eric Stones.
00:49:09,00:49:13,"Now, you would have wet stones in there."
00:49:13,00:49:14,"Yeah, just show them."
00:49:14,00:49:15,"Oh, I was thinking…"
00:49:15,00:49:15,Grind stones.
00:49:15,00:49:17,"I was thinking like, rock, paper, scissors."
00:49:17,00:49:18,What's another word for rock?
00:49:18,00:49:19,"Oh, I see."
00:49:19,00:49:19,A stone.
00:49:19,00:49:19,A stone.
00:49:19,00:49:19,A stone.
00:49:19,00:49:21,"Do you, does anyone ever say stone, paper, scissors?"
00:49:21,00:49:23,"Yeah, and in other countries."
00:49:23,00:49:24,There we go.
00:49:24,00:49:26,I did see a story of someone trying to rob a shoe shop
00:49:26,00:49:27,with a stone.
00:49:27,00:49:29,But the person behind the counter…
00:49:29,00:49:30,That's some paper.
00:49:30,00:49:31,"No, had some scissors."
00:49:31,00:49:32,"Oh, sorry."
00:49:32,00:49:34,But the story made it into the papers.
00:49:34,00:49:36,So you've got all three there.
00:49:36,00:49:39,"Anyway, Sheffield, yes, did used to make even more exciting scissors."
00:49:39,00:49:42,They made the smallest pair of scissors in the world
00:49:42,00:49:43,in the 19th century.
00:49:43,00:49:43,Did they?
00:49:43,00:49:44,"Yeah, they did."
00:49:44,00:49:45,So they claimed…
00:49:45,00:49:48,"Was it for cutting something very small, or was it just for fun?"
00:49:48,00:49:49,I think it was just for fun.
00:49:49,00:49:53,"And to entertain the royal family, they went to show them all."
00:49:53,00:49:55,Britain's chief industry until the mid-20th century
00:49:55,00:49:57,was just doing things to impress the Queen.
00:49:57,00:49:59,It was actually the 1820s.
00:49:59,00:50:01,So it was King George IV.
00:50:01,00:50:04,And the manufacturer was Joseph Rogers and Sons.
00:50:04,00:50:06,And they took some tiny scissors to show George IV.
00:50:06,00:50:09,"And according to Sheffield museums,"
00:50:09,00:50:10,"they dropped them on its carpet,"
00:50:10,00:50:11,and they were so small that they were never found.
00:50:11,00:50:13,"No, get out."
00:50:13,00:50:17,They're still there on the floor of Focke and Palace.
00:50:17,00:50:18,"That's a risk, isn't it?"
00:50:18,00:50:20,"You know, you don't want to walk around barefoot, do you?"
00:50:20,00:50:20,No.
00:50:20,00:50:23,You want to be in a carpet where you know there's a pair of scissors here somewhere.
00:50:23,00:50:24,That's why the royals are always wearing shoes.
00:50:24,00:50:30,From small scissors to large scissors.
00:50:30,00:50:31,I didn't know this.
00:50:31,00:50:34,"But often, you know those large scissors that you get"
00:50:34,00:50:36,when someone's unvaving something?
00:50:36,00:50:38,"Oh, yeah, the novelty of cutting a ribbon."
00:50:38,00:50:38,Ribbon cuts it.
00:50:38,00:50:40,"They don't look very sharp, though."
00:50:40,00:50:41,I don't think they are.
00:50:41,00:50:41,No.
00:50:41,00:50:42,I think… I don't know.
00:50:42,00:50:43,"Oh, they're sharp enough for a ribbon."
00:50:43,00:50:44,"Oh, yeah."
00:50:44,00:50:47,Ribbons really aren't that hard to cut.
00:50:47,00:50:49,They can't do micro-surgery or anything like that.
00:50:49,00:50:50,But why would you want them to?
00:50:50,00:50:52,"But normally, they're…"
00:50:52,00:50:54,Your doctor brought those out during micro-surgery.
00:50:54,00:50:57,The last thing you see is you're doing the couch for the anesthesia.
00:50:57,00:50:59,"Five, six, what the fuck?"
00:50:59,00:51:05,"But normally, you hire them."
00:51:05,00:51:09,I guess because why on earth would you want to keep a two-foot-long pair of scissors?
00:51:09,00:51:10,It's just…
00:51:10,00:51:12,There can't be many in the country.
00:51:12,00:51:13,"There aren't many in the country, James."
00:51:13,00:51:14,I'm so glad.
00:51:14,00:51:17,"So, in the UK, there's unveiling curtains.co.uk."
00:51:17,00:51:18,"Oh, yeah."
00:51:18,00:51:22,And they say no unveiling ceremony is complete without a pair of our giant ceremony ribbon
00:51:22,00:51:23,scissors.
00:51:23,00:51:25,"But in America, there's goldenopenings.com."
00:51:25,00:51:27,"Oh, I saw their website, really great."
00:51:27,00:51:29,"Yeah, and Goldenert, what were you googling when you found that?"
00:51:29,00:51:33,But they are 40 inches long.
00:51:33,00:51:36,They advertise themselves as the largest working scissors in the world.
00:51:36,00:51:40,Someone who apparently keeps scissors on them at all times is…
00:51:40,00:51:42,A hairdresser.
00:51:42,00:51:47,"A hairdresser, yes, in this very specific case, Richard Branson."
00:51:47,00:51:48,Oh.
00:51:48,00:51:50,This is such an odd thing that he does.
00:51:50,00:51:53,He hates when people are a bit too formal.
00:51:53,00:51:55,He thinks that businesses should be relaxed.
00:51:55,00:51:57,"He's often asked by CEOs, ""How can I make my business more relaxed?"""
00:51:57,00:52:01,"If he sees anyone around the table with a tie on, he gets his scissors out."
00:52:01,00:52:02,He goes over and he cuts their tie off.
00:52:02,00:52:04,"And he says, ""Everyone laughs."
00:52:04,00:52:06,"Everyone has a great old time."""
00:52:06,00:52:06,But that's his thing.
00:52:06,00:52:09,I'm sure they'll continue laughing when he's left the room.
00:52:09,00:52:10,"Yeah, exactly."
00:52:10,00:52:11,I don't just call him a wanker.
00:52:11,00:52:12,Yeah.
00:52:12,00:52:14,I must have said this tie was given to me by my grandfather.
00:52:16,00:52:17,Does he have special…
00:52:17,00:52:18,They must be quite sharp scissors.
00:52:18,00:52:19,I'm sure they are.
00:52:19,00:52:20,But…
00:52:20,00:52:21,"You know, how strong are you?"
00:52:21,00:52:22,Do you have ties made of wood?
00:52:22,00:52:27,"No, to cut through a tie in a single amusing chief executive gesture."
00:52:27,00:52:28,It's quite…
00:52:28,00:52:30,He must have killed thousands of underlings.
00:52:30,00:52:34,"I do have a tie made of wood, like a bow tie made of wood out of cork."
00:52:34,00:52:34,Of course you do.
00:52:34,00:52:37,"But I think if I ever meet Richard Branson, I'm going to wear it"
00:52:37,00:52:39,and see how strong a scissors really is.
00:52:39,00:52:40,Exactly.
00:52:40,00:52:44,There's a pair of scissors that I've only ever used three times.
00:52:45,00:52:45,What are they?
00:52:45,00:52:48,I know what they are.
00:52:48,00:52:49,"Oh, yeah."
00:52:49,00:52:50,Unfilical cord scissors.
00:52:50,00:52:51,I don't own them myself.
00:52:51,00:52:52,I've only ever used them.
00:52:52,00:52:56,"But yeah, umbilical scissors, which I have used three times"
00:52:56,00:52:58,because I have three kids in hospital.
00:52:58,00:52:59,"Okay, you haven't used the same."
00:52:59,00:53:01,It's not like you bought some especially.
00:53:01,00:53:02,"No, they're labelled…"
00:53:02,00:53:03,They're hanging up in the hospital and they're labelled
00:53:03,00:53:04,"""property of defibrillation""."
00:53:04,00:53:05,Do not touch.
00:53:05,00:53:07,He will be back for another one soon.
00:53:07,00:53:10,"Yeah, I used the ones that were in the hospital."
00:53:10,00:53:12,I was asked if I'd want to cut the umbilical cord.
00:53:12,00:53:13,But did you say…
00:53:13,00:53:14,Did you say yes every time?
00:53:14,00:53:17,"I would say yes because I was like, ""Why would I… why?"""
00:53:17,00:53:18,"Oh, right."
00:53:18,00:53:19,Everyone said yes.
00:53:19,00:53:20,"Why would I, though?"
00:53:20,00:53:23,Why would I want to do something that a professional can do?
00:53:23,00:53:24,Will you offer the chance?
00:53:24,00:53:24,"Yeah, of course."
00:53:24,00:53:25,I think they always offer the chance.
00:53:25,00:53:27,I frequently will sneak into hospitals
00:53:27,00:53:29,and ask if I can pretend to use…
00:53:29,00:53:32,"Like, ""Oh, when the time comes, can I do the cutting?"""
00:53:32,00:53:33,You're subbed in.
00:53:33,00:53:34,You're there on the sidelines.
00:53:34,00:53:34,Yeah.
00:53:34,00:53:36,Is it quite thick and so grisly?
00:53:36,00:53:37,It is.
00:53:37,00:53:39,It's a bit odd and you're a bit nervous when you're doing it
00:53:39,00:53:41,"because you think, ""What if I get this wrong?"""
00:53:41,00:53:43,Nothing can happen.
00:53:43,00:53:44,"Well, you don't know that in the moment."
00:53:44,00:53:46,"Unless you get really wrong and like,"
00:53:46,00:53:47,"""Shop your baby's willy off,"" or something."
00:53:47,00:53:48,Yeah.
00:53:48,00:53:50,That's not the umbilical cord.
00:53:50,00:53:53,It was a very well endowed baby.
00:53:53,00:53:56,That's so funny.
00:53:56,00:53:57,"No, but you can…"
00:53:57,00:53:58,I looked online.
00:53:58,00:54:01,You can buy from Amazon umbilical cord scissors
00:54:01,00:54:03,"to use on your own at home,"
00:54:03,00:54:04,"say for home births, right?"
00:54:04,00:54:04,No.
00:54:04,00:54:06,That would be good if you were opening
00:54:06,00:54:08,a new wing of a maternity ward.
00:54:08,00:54:11,"You could, like, instead of a ribbon,"
00:54:11,00:54:13,you could have an umbilical cord.
00:54:13,00:54:14,"So if you have a newborn baby,"
00:54:14,00:54:16,just slowly pull away from your mother.
00:54:16,00:54:18,Your mother just after birth.
00:54:18,00:54:18,Sorry.
00:54:18,00:54:21,Do you mind if we just move you to the ceremony room?
00:54:21,00:54:23,It's the grand opening.
00:54:23,00:54:23,Yeah.
00:54:23,00:54:26,But is there anything special about them
00:54:26,00:54:29,except a gimmick to get money out of people on Amazon?
00:54:29,00:54:29,These are used.
00:54:29,00:54:30,These are used.
00:54:30,00:54:32,Are they any more special then?
00:54:32,00:54:33,"Oh, they're specially shaped."
00:54:33,00:54:34,They're different types of scissors.
00:54:34,00:54:36,"Yeah, to what you don't use, your classic scissors."
00:54:36,00:54:37,"Oh, I think they're sort of curved."
00:54:37,00:54:38,I think they're sort of curved.
00:54:38,00:54:39,I thought they just need to be sharp.
00:54:39,00:54:39,Really?
00:54:39,00:54:41,"No, I think they're slightly curved"
00:54:41,00:54:42,"and, like, half moon-shaped."
00:54:42,00:54:42,Yes.
00:54:42,00:54:43,Are they?
00:54:43,00:54:44,"But, yeah, I had a one-star review."
00:54:44,00:54:47,This main pair that comes up.
00:54:47,00:54:49,"Wait, is it one-star?"
00:54:49,00:54:50,Baby's still attached.
00:54:50,00:54:51,He's four years old now.
00:54:51,00:54:55,"Yeah, it basically said does not cut well."
00:54:55,00:54:58,"Stiff to use needed several attempts to cut,"
00:54:58,00:55:00,which is a bit terrifying.
00:55:00,00:55:01,But I was trying to look into them.
00:55:01,00:55:03,"This is a very random tangent,"
00:55:03,00:55:04,"but I discovered a guy who said,"
00:55:04,00:55:05,"""Hey, when you're in the hospital"
00:55:05,00:55:08,"and you are offered to cut the baby's umbilical cord,"
00:55:08,00:55:10,why not suggest biting it off
00:55:10,00:55:12,"instead of using the scissors?"""
00:55:12,00:55:13,And Brian Blessed.
00:55:13,00:55:14,Like Brian Blessed's style.
00:55:14,00:55:14,That's right.
00:55:14,00:55:16,He did that in a park.
00:55:16,00:55:17,"Well, he did it when he said that he did."
00:55:17,00:55:18,He said that he did.
00:55:18,00:55:20,But this guy said that he did.
00:55:20,00:55:21,"He said, ""I went in."
00:55:21,00:55:24,"I said to them, 'Is it cool if I do the umbilical cutting?'"
00:55:24,00:55:27,"He believed that because I started the baby with my seed,"
00:55:27,00:55:29,this is me ending the process
00:55:29,00:55:31,"by using my mouth to bite into it."""
00:55:31,00:55:32,It's a bit.
00:55:32,00:55:33,"He said it tastes like calamari,"
00:55:33,00:55:34,the rubbery kind of...
00:55:34,00:55:35,It wouldn't taste like calamari.
00:55:35,00:55:36,"Yes, it tastes like blood."
00:55:36,00:55:38,"Yes, his wife was a squid."
00:55:38,00:55:42,[LAUGHTER]
00:55:42,00:55:44,Were you watching My Octopus Keeper
00:55:44,00:55:45,or whatever that thing is?
00:55:45,00:55:46,Yeah.
00:55:46,00:55:46,"No, no."
00:55:46,00:55:47,"He said it was basically like blood,"
00:55:47,00:55:50,"iron-like, the texture of it was calamari-like."
00:55:50,00:55:54,"And apparently, if you ask, they might say yes."
00:55:54,00:55:55,So if anyone fancies it...
00:55:55,00:55:56,Worth asking.
00:55:56,00:55:57,Worth asking.
00:55:57,00:55:59,"They'll think you're a real weirdo,"
00:55:59,00:56:00,but they might say yes.
00:56:00,00:56:02,Can I give you a riddle?
00:56:02,00:56:02,Yeah.
00:56:02,00:56:03,Okay.
