start_hhmmss,end_hhmmss,text
00:20:42,00:20:48,"That's a good point because I have been thinking he's going to have this deep booming voice,"
00:20:48,00:20:56,but I've completely forgot he was a eunuch. One of the reasons they think that he was chosen
00:20:56,00:21:01,"is because he was also a Muslim. And they were going, yeah, and they were sailing part of where"
00:21:01,00:21:07,they got to was the Gulf. And so he was going to be in lots of Islamic territory. And so the
00:21:07,00:21:11,"idea is it's a diplomatic mission to go and make contact with these places and basically say,"
00:21:11,00:21:15,"will you acknowledge that China is the best country in the world? And if you do that,"
00:21:15,00:21:18,"we sort of won't take over you. And it was lots of Muslim countries. So, you know,"
00:21:18,00:21:21,"he would have been able to go and be like, hey, I get you and my dad went to Mecca."
00:21:21,00:21:25,"Is China the best? Yes, great. Right. He sounds amazingly impressive,"
00:21:25,00:21:29,"Chang He. And I'm interested also in why their voyages ended, because there's lots of debate"
00:21:29,00:21:34,"about what brought them to an end. One theory is that they're worried about Mongolian invasions,"
00:21:34,00:21:38,"and obviously, Mongolians have paid over land. But another reason they were discontinued,"
00:21:38,00:21:43,"potentially, is that there was a conflict between the Confucians and the eunuchs."
00:21:43,00:21:48,"Yeah. There's this big eunuch power base in the court. And there was a eunuch establishment,"
00:21:48,00:21:51,"partly because it was thought, oh, well, if eunuchs can't have children,"
00:21:51,00:21:55,then they're not going to be seizing power and starting a dynasty.
00:21:55,00:21:58,"That's why they were chosen. That's why they were the court assistants, really, wasn't it?"
00:21:58,00:22:01,"That's what I mean. Yeah, yeah. But for some reason, obviously, that builds up into a powerful"
00:22:01,00:22:06,"bureaucracy. It feels like the movie franchise we're all waiting for, the bureaucrats versus the"
00:22:06,00:22:11,"eunuchs. I mean, it's weird, isn't it? There being this court of eunuchs and then this court of"
00:22:11,00:22:15,"Confucian bureaucrats, and there's war between them. I'm joking for position."
00:22:15,00:22:21,"When Zhong He died, basically, he was the main eunuch. When he died, there was kind of a vacuum"
00:22:21,00:22:25,"in the eunuch world, and it meant that the Confucianists could jump him."
00:22:25,00:22:28,"In addition to the obvious vacuum in the eunuch world, of course."
00:22:28,00:22:35,"And it was a new emperor as well. So Zhong He's emperor, who took him on, had died. A new emperor"
00:22:35,00:22:38,came on. He became part of the expansion of the Great Wall of China. There were lots of different
00:22:38,00:22:44,"projects going on. He talked him into one final adventure going out, and Zhong He died on the"
00:22:44,00:22:48,way back. So then that was kind of it. I think that's it. Kind of like you can't spend all your
00:22:48,00:22:53,"money making a massive wall to stop the Mongolians coming in, and you can't spend the same money"
00:22:53,00:22:57,making massive ships to go to the Muslim lands. You have to choose one or the other.
00:22:57,00:23:01,"We'll tell that to the Labour Party, who apparently aren't even going to raise taxes, James. No, I"
00:23:01,00:23:10,guess. Wow. I can see why you've got a denabel and not a satire bell in your home.
00:23:10,00:23:13,"So yeah, I think the main thing was you say the Confucian bureaucrats, and mostly the bureaucrats"
00:23:13,00:23:18,complained whether it was thick and expensive. And there was one claim that it cost half of the
00:23:18,00:23:22,"tax revenue of a whole year to send them out, which is mad, and probably an exaggeration."
00:23:22,00:23:26,"But also, there's one other theory that they just done what they wanted to do."
00:23:26,00:23:30,"I mean, they got, as far as the East African coast, they got to Somalia. They've shown everyone"
00:23:30,00:23:35,"how good they are. Everyone has said, ""Yeah, you're the best."" Yeah, they've gone, ""Cool. Job done."""
00:23:35,00:23:45,"Zhong He supposedly named the durian fruit. Yeah. Supposedly, he ate it when he was on one of"
00:23:45,00:23:51,"his journeys, and he was so delicious, he forgot where he was, and he stayed there for three days,"
00:23:51,00:23:56,"and then realized, ""Oh, wait a minute. I'm supposed to be doing this three days."""
00:23:56,00:24:00,"And so he went back again, and the name durian means to linger and forget to return."
00:24:00,00:24:07,"Supposedly named by him. And also, he supposedly invented the queenfish."
00:24:07,00:24:14,So the queenfish is like a fish which has got like five spots on it. And the theory goes that
00:24:14,00:24:21,"there was a big storm. There's a hole in his boat. He prays to God, and the storm dissipates,"
00:24:21,00:24:25,and they realize that they haven't sunk because there's a fish in the hole in the boat.
00:24:25,00:24:32,Brilliant. Okay. And it's this queenfish. He takes it out. His five fingerprints go onto the fish
00:24:32,00:24:37,"and forever are on this fish. And for that reason, Chinese people in Malaysia don't eat queenfish,"
00:24:37,00:24:41,although some skeptics point out the fact that it is quite poisonous.
00:24:41,00:24:48,"Just the second best reason not to eat it. Obviously, the Shanghai thing is the main reason"
00:24:48,00:24:53,we don't eat it. There's another thing about these giant ships. They had rigging that was
00:24:53,00:24:58,decorated with yellow flags. The sails were dyed red with henna. The hulls were painted with huge
00:24:58,00:25:04,"elaborate birds, and on the front were large eyes painted onto the bow. So as it was coming towards"
00:25:04,00:25:10,"you, just the sense of a big face heading towards you. I mean, that's what an image. What a striking"
00:25:10,00:25:16,"thing. And a seven foot giant walks off the ship, be like, ""Avatar, have we been invaded? Is it aliens?"""
00:25:18,00:25:25,"Here's a last legacy of the treasure fleets. This is a New York Times report from 1999, right?"
00:25:25,00:25:28,What? One year after the most French thing that has ever happened.
00:25:28,00:25:34,"Two years after the death of Diana. They had a reporter called Nicholas Kristof, right? And he"
00:25:34,00:25:40,"went to this tiny island off the coast of Kenya, which was called, I think it's called Pate, P-A-T-E."
00:25:40,00:25:46,"It might be Pate, it might be Pate. I think it's Pate. It's called Pate. It's pretty squishy ground."
00:25:48,00:25:52,"And he found there a number of elderly men, and they claimed to be Chinese, right? Now they looked"
00:25:52,00:25:56,"like they might have Asian ancestry, East Asian ancestry, and they claimed they'd been there for"
00:25:56,00:26:01,"600 years. Well, they claimed that their ancestors had got there 600 years ago. They claimed that"
00:26:01,00:26:06,they were descended from the sailors of the treasure fleet who'd been shipwrecked on Pate
00:26:06,00:26:11,"600 years ago. And supposedly they had some very ancient porcelain in their home, some"
00:26:13,00:26:18,"which is incredible. It's true, that is unbelievable. I mean, you know, big tongs on that one, but it"
00:26:18,00:26:21,"does sound. But you would have thought you could tell when you go somewhere if someone's, because"
00:26:21,00:26:25,they can't have shacked much outside if they've only been there. Can't we take a swab or something?
00:26:25,00:26:29,"Like, we've got technology now. It might have been pre-swab. I don't know. If anyone listening is"
00:26:29,00:26:35,"in Pate, can you write it and tell us? In return, we'll send you some very small bits of toast."
00:26:35,00:26:42,"Vikings had big ships. Oh, yeah. Famously. I mean, not by comparison."
00:26:42,00:26:45,"But they were also quite decorated, like the ones we were talking about. Yeah, yeah."
00:26:45,00:26:51,You should always realize. But it turns out they had woolen sails. I was just saying that I was
00:26:51,00:26:57,reading about wool today. That's why I bring this up. And there's a traditional handicraft expert
00:26:57,00:27:04,called Amy Lightfoot who decided to try and make a sail like a Viking woolen sail. And she and her
00:27:04,00:27:12,"colleagues had to spin 188,000 meters of yarn to make the sail. It took them three years to complete"
00:27:12,00:27:17,and it used the equivalent of a year's production of wool from 2000 sheep.
00:27:17,00:27:21,Wow. To make a single sail. That's insane.
00:27:21,00:27:27,So how did the Vikings manage to make all these sails? Is there an answer that you can tell us?
00:27:27,00:27:32,"Okay, okay, okay. We can get this. Did they tie together their clothes and make a sort of amusing"
00:27:32,00:27:38,like... Like they're trying to escape from a building. How would they do it?
00:27:38,00:27:42,They had 2000 sheep. They had lots of sheep. They had lots of sheep as half of the answer.
00:27:42,00:27:47,"Okay. And lots of people and lots of time. No telling. Yeah, that's basically all of it. The only"
00:27:47,00:27:53,missing bit is that obviously there were lots of them going on sailing missions. So they didn't
00:27:53,00:27:58,really have time to make the sails. Did they knit as the... So who made the sails? Did they knit as
00:27:58,00:28:02,"they sailed? Let you row and then you knit a little bit. I guess the winds that could make them,"
00:28:02,00:28:08,"they settled. Precisely. It was all the women, basically. All the women would live near the coast"
00:28:08,00:28:12,and they would make all of their sails for the ships. I feel like we were really working our way
00:28:12,00:28:17,"towards a good wrong answer there. I know. I was so more ruined by like... So sorry. Reminding you,"
00:28:17,00:28:22,"women were also existing in times. Actually, just on what you were saying and on women,"
00:28:22,00:28:27,"I was reading about wool earlier today. Oh, gosh. And you know the herring girls, do you remember"
00:28:27,00:28:33,them? Yeah. They were like gut herring and they would start in the north of Scotland because
00:28:33,00:28:38,the herring shoals would come down the coast of England and they would follow the coast because
00:28:38,00:28:43,"they would follow the herring. So as the year went on, they would just like get further and"
00:28:43,00:28:47,further down the coast until they ended up in Great Yarmouth and they would stop off at the
00:28:47,00:28:52,"gutting centres. But as they went, because they were walking this whole way, they would knit as"
00:28:52,00:28:56,they went and then they would sell their goods as they were walking down. So they would do walking
00:28:56,00:29:00,"and knitting, walking and knitting, sell their stuff and then do your gutting and then do walking,"
00:29:00,00:29:04,"knitting, walking, knitting. Do you think it was right? You know when you see someone on their"
00:29:04,00:29:07,"phone walking down the street and you're like, ""Oh, for God's sake, just put it away."" Do you think"
00:29:07,00:29:12,people thought that when they saw them? Yeah. Just admire the scenery for a minute. Do you remember
00:29:12,00:29:18,"we talked about the drovers? Yeah, yeah. Similar. With their magic dogs. Do you remember they walked"
00:29:18,00:29:23,"long knitting as well, didn't they? Well, they had woolen socks for their pigs, didn't they?"
00:29:23,00:29:27,"Yeah, it's quite romantic. The idea of, you know, a drover and a herring girl meeting."
00:29:27,00:29:32,"Yeah, they wouldn't ever meet as close. That's quite a long distance between shoreline"
00:29:32,00:29:36,"and... Yeah, but if you're drovering in from the coast, maybe, I don't know. Maybe you do, yeah."
00:29:36,00:29:40,"Romantic like they accidentally swap balls of yarn and then, ""Oh, no."" And then they got to get"
00:29:40,00:29:43,"back to each other. I just think it's like... I don't know, it's the same ball of yarn and it's"
00:29:43,00:29:46,"like in Lady and the Tramp. It's reverse Lady and the Tramp. They're getting further apart,"
00:29:46,00:29:50,"but connected by the same yarn. James, you're shaking your head. It's the default. It's a break-up"
00:29:50,00:29:56,story. There's a screenplay in this somewhere. He was a drover. She gutted herring for a living.
00:29:56,00:30:02,Can I make it any more obvious? Let's not imply any historical consultants
00:30:02,00:30:05,"when they get this far. No, no, no. Or geographical ones."
00:30:05,00:30:16,"Okay, it is time for fact number three and that is Andy. My fact is that the largest"
00:30:16,00:30:22,kettle in Hamburg is called Caroline. This is about a very large kettle called Caroline. Caroline
00:30:22,00:30:27,with a K. Does she get offended if you misspell it? You were quite specific about that.
00:30:27,00:30:33,"So this is because there's a lot of renewable energy being built in Europe at the moment,"
00:30:33,00:30:39,"mostly wind and solar. And it's pretty cheap, especially during sunny or windy hours, basically."
00:30:39,00:30:42,"Prices drop massively. It just gets really, really cheap because there's so much access"
00:30:42,00:30:46,"being produced. And in some cases, the prices get negative because the power has to go"
00:30:46,00:30:50,"somewhere. And so it's kind of not totally ideal because you want to put power to good use,"
00:30:50,00:30:54,"basically, when you're generating it. You just see what I mean. This is all from an article"
00:30:54,00:30:58,in The Economist. And you need to use the power a bit better. You need to link to other countries
00:30:58,00:31:03,"which don't have a surplus at that moment, maybe, or you shift demand. So like everyone charges"
00:31:03,00:31:07,"out their cars in hours where there's lots of power on the grid, whatever. And another option"
00:31:07,00:31:12,"is to boil up the largest kettle in Hamburg, Caroline. Just tease all around. Just tease"
00:31:12,00:31:17,everyone in Hamburg whether they want one or not is getting a cup of tea. This is a giant
00:31:17,00:31:22,"electric kettle, basically. And it turns surplus wind energy into heat. It heats up water using"
00:31:22,00:31:27,"the electricity. And it gets used in, I think, a district heating network, which is like where"
00:31:27,00:31:34,"everyone's hot water comes from Caroline. And sort of 20,000 houses, I think, are on this system."
00:31:34,00:31:39,"So yeah, and that's Caroline. Good honor. I know. And she doesn't look like, you know,"
00:31:39,00:31:43,"she doesn't whistle and she doesn't have a spout and a handle, right? She looks like a big tank,"
00:31:43,00:31:49,"presumably. Basically, a big container of hot water is what I have chosen a kettle is."
00:31:49,00:31:54,"Yeah, fair enough. That's fine. I think that's fine. It heats up to very, very hot. And yeah, nice."
00:31:54,00:32:02,"Renewable energy. Well, I think it's amazing because we're at a point now in history where"
00:32:02,00:32:05,"we're literally looking at everything around us going, how do we turn this renewable? How can"
00:32:05,00:32:09,"we do using this to be? I was reading the other day that there's, in toilets now, there's a thing"
00:32:09,00:32:14,"that they're trialing whereby, how do you create renewable energy off the back of toilets? Oh,"
00:32:14,00:32:18,what if you put in the equivalent of a wind turbine into the pipe for your farts?
00:32:18,00:32:29,"You lean over a fart at the little windmill. Yeah, yeah. That's good. No, it's using the"
00:32:29,00:32:33,idea of the water. It's using the water. Do you mean a watermill? More like a watermill.
00:32:34,00:32:38,"Sorry, I forgot about that. I'm trying to talk to the kids. Sorry,"
00:32:38,00:32:44,"I haven't got allo-lo references to this, but it's basically your flush and it spins and it creates"
00:32:44,00:32:49,energy. Do you have a great idea? I actually came up with this idea quite a few years ago of putting
00:32:49,00:32:55,"many sort of water wheels in everyone's gutters. That's why I thought, I thought it was a brilliant"
00:32:55,00:32:59,"idea that no one had thought of. Right, yeah. And then I never pursued it. And it seems like"
00:32:59,00:33:04,it's actually going to become reality. It's not none of these. We should go back over all the
00:33:04,00:33:09,things quirky renewable energy ideas we've mentioned over the years and look at how many of
00:33:09,00:33:18,"them have come to giant fruition. Big aisle. Sorry, I must clarify here. I am incredibly pro"
00:33:18,00:33:22,"investing huge amounts of money in the big scale ones, but quite a lot of these little"
00:33:22,00:33:25,"ideas are so nice, aren't they? But they can't scale up and you can't like fix them into the"
00:33:25,00:33:30,end. But I reckon they're like a good science fiction idea. They're worth saying out loud
00:33:30,00:33:33,"as much as possible because someone listening out there somewhere will go, that's a great idea."
00:33:33,00:33:38,"Actually, I could do this with that and turn that into I just think as much as it pumped out."
00:33:38,00:33:44,"What happens when a poo gets stuck in the water wheel again? Again, every day, every day."
00:33:44,00:33:48,"Millions of engineers are going to be called out. Yeah. Unaccountably, there's a poo in the water"
00:33:48,00:33:54,wheel again. Here's the thing about kettles. This is crazy. It comes from a book I read recently.
00:33:54,00:33:57,I think I may have mentioned it before. It's called Power Up. It's a great book.
00:33:57,00:34:01,"This is about the world's first ever coal powered public power station, right? Right."
00:34:01,00:34:07,So it was called the Edison Electric Light Station. It was built in London in 1882
00:34:07,00:34:15,and it generated enough electricity power 30 modern kettles. Wow. That is partly it was a
00:34:15,00:34:21,small power station. It's also partly British kettles are world leading. They're just so powerful.
00:34:21,00:34:24,Sounds actually like the dream would be that your kettle didn't use that much power in order to do
00:34:24,00:34:31,"the same thing. Yes. No, no, no, no. You want tea now. That's the point. Did they call this power place"
00:34:31,00:34:37,"Electric Eels? No, they didn't. It was the Edison Electric Light Station. They should have done."
00:34:37,00:34:43,"They should have done, but they didn't. And it generated 93 kilowatts of electricity at one time,"
00:34:43,00:34:47,which was for lights in the local area. Yeah. But basically it's partly a function of just
00:34:47,00:34:52,British kettles being absolutely punishingly powerful. That's the thing we should say to foreign
00:34:52,00:34:57,"listeners, especially Americans, what a kettle is, right? Yeah. Americans don't have kettles."
00:34:57,00:35:00,It's like a saucepan with a lid. Yeah. If you want to make tea with water that's
00:35:00,00:35:05,"more than 40 degrees in temperature and that's Celsius, not your Fahrenheit system."
00:35:05,00:35:10,"You know what? I think if we start a battle with the Americans over tea, then we're only going to lose."
00:35:10,00:35:15,"What do you think? Oh, I see. It's a funny reference. It's a reference to the Boston Tea"
00:35:15,00:35:21,"Party. Yeah, yeah, yeah. Very nice. Very lovely. Don't rig that satire bell again."
00:35:22,00:35:28,"Another China fact for this section, the world's largest hydroelectric plant is in China,"
00:35:28,00:35:32,"unsurprisingly. Yeah. Like the world's largest, most things. And it's the Three Gorgeous Dam,"
00:35:32,00:35:36,"which you've probably heard of, and it's obviously massive and... Gorgeous, sorry."
00:35:36,00:35:42,"Sorry? I heard gorgeous. The Three Gorgeous Dam. Well, it is gorgeous. I think it is gorgeous. Yeah, yeah."
00:35:42,00:35:46,"Do you think it's gorgeous, the displacement of over a million people? I don't know."
00:35:46,00:35:49,They would say what about the people living downstream of the Three Gorgeous Dam?
00:35:49,00:35:56,"Andy, oh, I dropped you in that one, mate. Do you think it's gorgeous, the submerged villages?"
00:35:56,00:35:59,"Do you think it's complicated and they have to be trade-offs, Anna?"
00:35:59,00:36:04,"Yeah, I look at them with you, and obviously produces a huge amount of power. But it does"
00:36:04,00:36:10,"slow the earth down. What? Oh, yeah. Really? I think it was NASA who verified this in the end,"
00:36:10,00:36:14,because there are rumors that it slowed down the rotation of the earth and lengthened our day a
00:36:14,00:36:20,"little bit. So, if it's 459 and you're at work looking at your watch right now,"
00:36:20,00:36:27,"you can blame the Three Gorgeous Dam. Yeah. Yeah, it's the dam's fault. Dam it."
00:36:27,00:36:37,"Anyway, it's quite... In fact, kind of everything does that when you move mass around,"
00:36:37,00:36:41,"but it does it to a measurable extent. And so, it's because it's... This huge amount of water"
00:36:41,00:36:48,is being held. It's 39 trillion kilograms of water is held 175 meters high above sea level
00:36:48,00:36:53,"in this dam. So, that's a huge amount of water that's being held quite a big distance from the"
00:36:53,00:36:58,"centre of the earth. Imagine you're spinning round on a chair, right? You're spinning round at a steady"
00:36:58,00:37:04,"speed, and then you get a huge water balloon, and you hold it in your right hand at arm's length."
00:37:04,00:37:07,It's going to slow you down a little bit. And it actually... That is crazy.
00:37:07,00:37:13,"Has slowed us down by 0.06 microseconds, a microsecond being a millionth of a second."
00:37:13,00:37:18,"So, where does that matter most? Like, what business? The Olympics, you know? So,"
00:37:18,00:37:23,Usain Bolt has always just missed out smashing the 100 meters.
00:37:23,00:37:29,"That would be good, wouldn't it, if you could just let the water out at the same time."
00:37:29,00:37:36,"You are all running in the same direction in the 100 meters, I suppose."
00:37:36,00:37:38,"Yes, it's true. There will be a use, I'm sure."
00:37:38,00:37:42,"The next Chinese Olympics, they're taking notes. I can imagine them doing that sort of thing."
00:37:42,00:37:44,But you know that got proposed in 1919.
00:37:44,00:37:47,"Well, they drain the dam just to help someone win 100 meters of sprint."
00:37:47,00:37:52,"The building of the dam was proposed by Sun Yat-sen, first president of China."
00:37:52,00:37:58,"Really? Yeah. And it took... It was partly because they got insane floods about once every decade,"
00:37:58,00:38:02,"that were just totally destructive. So, it was partly that and partly for electricity."
00:38:03,00:38:08,"And the water that they store up there gets dropped through tubes and turned a turbine,"
00:38:08,00:38:15,"much like Dan's toilet idea. But it drops 185 meters, which is two statues of liberty in height."
00:38:15,00:38:21,"Like, it really is... And it generates so much power. It's just extraordinary. I think it's 20%"
00:38:21,00:38:24,of China's electricity. It's a lot. It comes from hydro power.
00:38:24,00:38:26,And China's big. And China's big.
00:38:26,00:38:29,"And they had... Also, the construction of it, they had to divert the entire Yangtze River"
00:38:30,00:38:34,while they built the dam. Imagine. It's just... It's stunning.
00:38:34,00:38:38,"Yeah, it's good. I can see who the propaganda is working on, Andy."
00:38:38,00:38:40,Is China the best country?
00:38:40,00:38:47,"For this? Yes. So, there's another heating plan operating at the moment, because waste heat is"
00:38:47,00:38:52,"like massive. Like, waste heat, if it can be used, would be an enormous resource."
00:38:52,00:38:57,"So, there is currently a project going on. You know, when you're somewhere cold and you get those"
00:38:58,00:39:01,"little hand warmers where you snap a coin. Yes, I do know those."
00:39:01,00:39:03,"And it heats up. So, yeah, it's like this jelly..."
00:39:03,00:39:04,Use them on the golf course.
00:39:04,00:39:08,"Yeah, it's got like stored heat and you snap the coin, this little metal thing in it."
00:39:08,00:39:12,I always thought it's like two little chemicals sort of mixed together.
00:39:12,00:39:14,"And then that heats, it's an exothermic reaction."
00:39:14,00:39:17,"That's exactly it. And then you can put the heat back in. Like, you can reheat it."
00:39:17,00:39:18,And it's sort of...
00:39:18,00:39:19,"Oh, that's amazing."
00:39:19,00:39:22,"Those things only last about, like, 40 times, right, those little hand warmers."
00:39:22,00:39:27,But there is a system currently being worked on to charge thermal batteries from...
00:39:28,00:39:29,"Like, places where they burn rubbish, for example."
00:39:29,00:39:34,And then transport the heat back into the centre of London
00:39:34,00:39:36,and use the heat there where it's needed.
00:39:36,00:39:36,Right.
00:39:36,00:39:40,"Like, really creative things that are being proposed to deal with energy loss."
00:39:40,00:39:41,"Using burning rubbish, basically."
00:39:41,00:39:46,"Well, that's already used. For example, maybe you'd only generate a bit of electricity from that."
00:39:46,00:39:48,But it gives off a lot of waste heat in the process.
00:39:48,00:39:49,That's amazing.
00:39:49,00:39:56,"Catch that. Well, similarly, if you swim in redditch in the Abbey Stadium Leisure Centre,"
00:39:57,00:40:01,"anyone who's ever done that, you are being heated by dead bodies from the crematorium."
00:40:01,00:40:03,And they came up with the idea in...
00:40:03,00:40:05,I think it was 2012 that they started implementing it.
00:40:05,00:40:09,And it saves 40% on the Leisure Centre's energy bills.
00:40:09,00:40:11,Because it's so much cheaper.
00:40:11,00:40:15,"And, you know, what a useful thing to contribute in your last moments on this earth."
00:40:15,00:40:18,"They're doing this system in Sweden, by the way, as well."
