start_hhmmss,end_hhmmss,text
00:17:38,00:17:42,They've got about 15 Raymond Burr exclusive categories.
00:17:42,00:17:43,It's very bizarre.
00:17:43,00:17:45,That's so good.
00:17:45,00:17:48,"I know Netflix, I guess, from the last, let's say,"
00:17:48,00:17:51,"five years, I think that's when I started using it."
00:17:51,00:17:55,I had no idea that Netflix has been around since 1997.
00:17:55,00:17:56,It's an extremely old company.
00:17:56,00:17:58,It was extremely old.
00:17:58,00:18:01,"It's not general electric, is it?"
00:18:01,00:18:05,It's old for what-- I think most people
00:18:05,00:18:10,"perceive to be very, you know, 2000s, at least 2010s,"
00:18:10,00:18:11,something like that.
00:18:11,00:18:12,It's kind of that thing.
00:18:12,00:18:14,So I was looking into it.
00:18:14,00:18:16,And it's a very interesting backstory.
00:18:16,00:18:20,There's a number of stories that their creator and Netflix
00:18:20,00:18:22,founder read Hastings puts out.
00:18:22,00:18:25,One is that he got a very big bill for a VHS
00:18:25,00:18:27,that he sent back into late.
00:18:27,00:18:29,"It was Apollo 13, and he thought there's"
00:18:29,00:18:30,got to be a better system.
00:18:30,00:18:32,So he created it.
00:18:32,00:18:34,"And what it used to be is, like all those things"
00:18:34,00:18:36,"where you would order a DVD off the internet,"
00:18:36,00:18:38,the difference was rather than getting a booklet that
00:18:38,00:18:40,told you everything that was in it.
00:18:40,00:18:43,"Back in 1997, there was a website that would send you"
00:18:43,00:18:45,"a VHS, and so you would just pick it from the website"
00:18:45,00:18:46,and order it.
00:18:46,00:18:48,So we already had a web presence back then.
00:18:48,00:18:49,"But yeah, that's--"
00:18:49,00:18:51,"I remember when it was just DVDs, and they send you DVDs"
00:18:51,00:18:54,"through the post, and that still exists, that business."
00:18:54,00:18:55,And it's still making money.
00:18:55,00:18:58,"But actually, in 2000, Reed Hastings approached"
00:18:58,00:19:01,blockbusters and asked them to buy Netflix
00:19:01,00:19:04,"for $50 million, the entire company."
00:19:04,00:19:06,And they refused.
00:19:06,00:19:07,And--
00:19:07,00:19:07,Wow.
00:19:07,00:19:11,"That did not age well, that decision, didn't it?"
00:19:11,00:19:13,"Just one tiny little nugget about Reed Hastings,"
00:19:13,00:19:15,when I was reading into him.
00:19:15,00:19:18,"His grandfather was a very famous physicist,"
00:19:18,00:19:23,and he was very important in the roles of inventing radar
00:19:23,00:19:26,and the atomic bomb for World War II.
00:19:26,00:19:31,And President Roosevelt said of Reed's grandfather
00:19:31,00:19:34,that he was a civilian who was second perhaps only
00:19:34,00:19:37,to Winston Churchill in facilitating the allied victory
00:19:37,00:19:38,in World War II.
00:19:38,00:19:42,So his grandfather is a seriously important character.
00:19:42,00:19:45,"Yeah, sort of an unknown name to the general public."
00:19:45,00:19:48,"Wow, they've both made equally important contributions,"
00:19:48,00:19:51,"I would say, to the able happiness of the world."
00:19:51,00:19:53,The Reed Hastings story about its inception
00:19:53,00:19:56,"is quite amused as me, because there is this story he tells"
00:19:56,00:19:58,"when it starts, how did you come up with Netflix?"
00:19:58,00:20:01,"He says, I was overcharged for a film."
00:20:01,00:20:02,And I was charged $40.
00:20:02,00:20:04,"It was a poly 13, charged $40."
00:20:04,00:20:05,I'd lost the film.
00:20:05,00:20:07,"He said, I didn't want to tell my wife about it."
00:20:07,00:20:09,"And I said to myself, am I really"
00:20:09,00:20:11,going to compromise the integrity of my marriage over a late
00:20:11,00:20:14,"fee, which I would say is marriage is on shaky ground,"
00:20:14,00:20:17,if that's going to compromise its integrity?
00:20:17,00:20:20,"But so then he thought, OK, I'm going to start up"
00:20:20,00:20:21,a new company that doesn't do this.
00:20:21,00:20:24,But his co-founder is called Mark Randolph.
00:20:24,00:20:26,And he just keeps killing this story.
00:20:26,00:20:28,"So maybe he's exaggerated the story over time,"
00:20:28,00:20:31,or he's piecing things together that weren't together at the time.
00:20:31,00:20:33,"And Mark Randolph, every time he's interviewed,"
00:20:33,00:20:35,"is like, no, it's bullshit, Reed Hastings story."
00:20:35,00:20:36,"No, no, it didn't happen."
00:20:36,00:20:38,"But it's a nice story, isn't it?"
00:20:38,00:20:39,So I let him tell it.
00:20:39,00:20:41,Wow.
00:20:41,00:20:43,"Oh, I'm getting a story straight, guys."
00:20:43,00:20:46,"So Netflix and chill is the thing, isn't it?"
00:20:46,00:20:48,There's an article on fusion.com
00:20:48,00:20:50,about the history of that phrase.
00:20:50,00:20:52,And they said that the first use was in January 2009
00:20:52,00:20:55,by @NoFaceNina on Twitter.
00:20:55,00:21:01,"And by summer of 2014, it had a slightly sexual meaning."
00:21:01,00:21:04,"And then by October, so a few months later,"
00:21:04,00:21:06,someone said that Netflix and chill never
00:21:06,00:21:10,"means Netflix and chill now, these days, lol."
00:21:10,00:21:15,"OK, so that was @itisIsak on Twitter."
00:21:15,00:21:16,How many A's is that?
00:21:16,00:21:17,Quite a lot.
00:21:17,00:21:20,"Well, maybe I just pressed the key too long on my keyboard,"
00:21:20,00:21:21,I'm sure.
00:21:21,00:21:24,"And then by the end of that year, it was all over Twitter."
00:21:24,00:21:27,"And then by August 2015, US parents"
00:21:27,00:21:30,were asking their kids what Netflix and chill meant.
00:21:30,00:21:31,And they were using it.
00:21:31,00:21:33,And that became the end of the meme.
00:21:33,00:21:38,"So basically, it lasted for less than six years"
00:21:38,00:21:40,from going from nothing to cool.
00:21:40,00:21:42,To don't say that anymore.
00:21:42,00:21:43,Yeah.
00:21:43,00:21:46,My wife didn't know what Netflix and chill meant.
00:21:46,00:21:48,The sexual context of it.
00:21:48,00:21:48,And whenever--
00:21:48,00:21:50,"No, she had a baby, don't you?"
00:21:50,00:21:52,"We do have a baby, yeah."
00:21:52,00:21:54,And we were watching grownups for the 50th time
00:21:54,00:21:57,when we conceived him.
00:21:57,00:22:00,"But we-- yeah, so whenever work finished for her,"
00:22:00,00:22:02,"her bosses would be like, what are you up to tonight?"
00:22:02,00:22:05,"I'm just going to be home with my husband, Netflix and chill."
00:22:05,00:22:07,"She thought, oh, we're just chilling."
00:22:07,00:22:11,"And I told her on a train what it meant and her face went, what?"
00:22:11,00:22:13,But at least she wasn't saying I'm going home
00:22:13,00:22:15,"to see my mum, Netflix and chill, you know?"
00:22:15,00:22:17,"Like the husband, that's actually OK."
00:22:17,00:22:18,That's true.
00:22:18,00:22:20,Do you know that Netflix knows exactly
00:22:20,00:22:22,when you will get hooked on a series?
00:22:22,00:22:25,"This is quite creepy, but it's also quite interesting."
00:22:25,00:22:28,So it works out the exact point.
00:22:28,00:22:30,The definition of being hooked is it
00:22:30,00:22:33,works out the exact point at which 70% of people
00:22:33,00:22:35,go on to finish the series.
00:22:35,00:22:37,So that's the definition of being hooked.
00:22:37,00:22:41,"So breaking bad, you will be hooked by episode 2"
00:22:41,00:22:42,on average.
00:22:42,00:22:44,"How I met your mother, episode 8."
00:22:44,00:22:47,I wonder with breaking bad if it's quicker to get hooked
00:22:47,00:22:51,watching the show or taking Crystal Mep?
00:22:51,00:22:54,Yeah.
00:22:54,00:22:57,The Big Bang Theory apparently never.
00:22:57,00:23:05,"And for fans of the Big Bang Theory, that was a laugh."
00:23:11,00:23:15,We have made a powerful enemy to actually talk.
00:23:15,00:23:19,"Just on the subject of breaking bad and drugs and being hooked,"
00:23:19,00:23:23,Netflix actually co-created drugs and released drugs.
00:23:23,00:23:25,"Well, it's a really old company, isn't it?"
00:23:25,00:23:27,Yeah.
00:23:27,00:23:31,"No, Netflix co-created a set of cannabis strains"
00:23:31,00:23:34,based on a selection of its popular original shows.
00:23:34,00:23:35,And they did this.
00:23:35,00:23:37,It was a pop-up event in West Hollywood
00:23:37,00:23:40,for the alternative herbal health services
00:23:40,00:23:42,and the set of drugs that you could buy
00:23:42,00:23:44,were called the Netflix collection.
00:23:44,00:23:46,And they were a part of helping to create these.
00:23:46,00:23:49,So you could get ones that were made to tie in oranges
00:23:49,00:23:52,"and new black, you were tying with that."
00:23:52,00:23:54,"There were ones for arrested development,"
00:23:54,00:23:56,which were labeled the banana stand-cush.
00:23:56,00:24:01,"Yeah, ideally for a big yellow joint."
00:24:01,00:24:03,That was the thing.
00:24:03,00:24:06,And they did it for the Grace and Frankie TV show as well.
00:24:06,00:24:10,"So you can buy cannabis, which is co-created"
00:24:10,00:24:12,by Netflix and smoke it while you binge.
00:24:12,00:24:15,"And do they do the thing where you have two toaks and you go,"
00:24:15,00:24:16,"oh, that's good."
00:24:16,00:24:18,"And someone comes up and goes, I think you might also"
00:24:18,00:24:19,"like this, by the way."
00:24:19,00:24:21,You say this?
00:24:21,00:24:23,And maybe this one over there.
00:24:23,00:24:24,Yeah.
00:24:24,00:24:26,"They don't make any profit from it, by the way."
00:24:26,00:24:28,It was just that they just want to get people high.
00:24:28,00:24:29,Come on.
00:24:29,00:24:34,"Did you know there is a Spanish platform, which is related?"
00:24:34,00:24:37,"In fact, no, sorry, legally, it's unrelated."
00:24:37,00:24:41,"But there is a Spanish platform called Napflex, which"
00:24:41,00:24:44,"is TV to fall asleep very easily, too."
00:24:44,00:24:45,And it might just be me.
00:24:45,00:24:49,But I think all the stuff on it sounds really good.
00:24:49,00:24:50,So there's a big bang theory.
00:24:50,00:24:54,[LAUGHTER]
00:24:54,00:24:58,"Please, please edit those jokes at the show."
00:24:58,00:25:00,"Do you have the hope of having to come here on that one day, then?"
00:25:00,00:25:03,"No, I just don't want to be killed by an army of nerds."
00:25:03,00:25:04,I just don't know.
00:25:04,00:25:06,"They've got-- you might like this, James."
00:25:06,00:25:09,We've got a four-hour video of the World Chess Championship 2013.
00:25:09,00:25:10,You like chess?
00:25:10,00:25:10,"Yes, I do."
00:25:10,00:25:13,I subscribe to a special chess channel.
00:25:13,00:25:15,Do you?
00:25:15,00:25:19,And I have a one-slug in a fan's of the big bang theory.
00:25:19,00:25:20,Yeah.
00:25:20,00:25:23,So Napflex ran a competition to fix its algorithm.
00:25:23,00:25:25,So the thing it does where it recommends stuff
00:25:25,00:25:27,"that you might like, it has been a massively difficult thing"
00:25:27,00:25:29,to achieve over the years.
00:25:29,00:25:32,"In 2006, there was a $1 million award for anyone"
00:25:32,00:25:35,who could improve the recommendations algorithm.
00:25:35,00:25:38,So it could actually recommend stuff that you genuinely would like.
00:25:38,00:25:39,And it took three years to be won.
00:25:39,00:25:41,It was won by this collective.
00:25:41,00:25:44,And it improved the accuracy of the one they had by 10%.
00:25:44,00:25:46,And it's so weird.
00:25:46,00:25:48,So all these coders were competing for it.
00:25:48,00:25:49,It took three years.
00:25:49,00:25:52,"And then the people who won, and the people who came second,"
00:25:52,00:25:55,only submitted their bits 20 minutes apart.
00:25:55,00:25:57,So they lost $1 million by 20 minutes.
00:25:57,00:25:58,Wow.
00:25:58,00:26:00,But the main challenge for these coders
00:26:00,00:26:02,is Napoleon Dynamite.
00:26:02,00:26:03,So--
00:26:03,00:26:04,How do you mean?
00:26:04,00:26:06,No algorithms seem to know if someone's
00:26:06,00:26:10,going to like Napoleon Dynamite.
00:26:10,00:26:10,That was it.
00:26:10,00:26:11,And that was the challenge it was set.
00:26:11,00:26:14,"It was like, can you work out if someone will like Napoleon Dynamite?"
00:26:14,00:26:15,Because we don't know.
00:26:15,00:26:17,There seems to be no rhyme or reason to it.
00:26:17,00:26:18,Wow.
00:26:18,00:26:18,That's incredible.
00:26:18,00:26:21,"So I'm making $1 million in 20 minutes, which"
00:26:21,00:26:25,"is, coincidentally, what the cost of the big bank theory do."
00:26:25,00:26:28,"We're going to have to move on in the set, guys, for our next fact."
00:26:28,00:26:30,Did you see the survey that Napflex did last year
00:26:30,00:26:32,on how people are watching?
00:26:32,00:26:35,"And so two-thirds of people watch Napflex in public now,"
00:26:35,00:26:38,"or watch Stream in public, which I think is weird."
00:26:38,00:26:40,"Do you mean like on the train, or on the bus?"
00:26:40,00:26:41,"Yeah, on the train, on the commuter work, whatever."
00:26:41,00:26:45,"I know I have a phone from 2001, so maybe that's why I don't do it."
00:26:45,00:26:49,"So this is last year, and it found that 65% of people"
00:26:49,00:26:52,have burst out laughing on public transport while watching it.
00:26:52,00:26:56,"20% have cried in public, and then been embarrassed about it."
00:26:56,00:26:59,But 27% of people who've been streaming stuff
00:26:59,00:27:01,"in public on public transport, for example,"
00:27:01,00:27:03,have had strangers interrupt them while they're
00:27:03,00:27:07,watching to start talking about the show that they're watching.
00:27:07,00:27:09,Is that a thing?
00:27:09,00:27:13,I once-- OK.
00:27:13,00:27:15,I was in Japan once.
00:27:15,00:27:18,"I was in Tokyo, and I was on one of the subway trains."
00:27:18,00:27:21,And I noticed the phone of the guy sitting next to me.
00:27:21,00:27:23,"He was a wester guy, and he was listening"
00:27:23,00:27:26,to no such thing as a fish.
00:27:26,00:27:28,"And I-- no, hang on."
00:27:28,00:27:32,"He was-- no, wait, the story hang on."
00:27:32,00:27:35,"He was watching QI, and I leaned over to him,"
00:27:35,00:27:41,"and I said, I wrote that, and he did not believe me."
00:27:41,00:27:45,"And I know from the way he said, oh, OK."
00:27:45,00:27:47,And they got off at the next stop.
00:27:47,00:27:51,"On the flight over from Australia to New Zealand,"
00:27:51,00:27:53,"there was a guy sat in front of me, you, and Anna,"
00:27:53,00:27:55,who was listening to no such thing as a fish.
00:27:55,00:27:56,"Yeah, that's right."
00:27:56,00:27:57,And we were chatting behind him.
00:27:57,00:28:02,He must have been so freaked out when he took his headphones off.
00:28:02,00:28:07,This has all got a bit more boring very quickly.
00:28:07,00:28:09,"We need to move on to our next fact, guys."
00:28:09,00:28:13,"OK, and it's time for fact number three, and that is James."
00:28:13,00:28:16,"OK, my fact this week is that in Sacred Maché combat,"
00:28:16,00:28:19,"the aim was not to kill your opponent,"
00:28:19,00:28:22,but to knock his hat off.
00:28:22,00:28:23,"And the loser didn't go off that easily,"
00:28:23,00:28:26,"though, because he would immediately be sacrificed."
00:28:26,00:28:28,"No, you lose your hat."
00:28:28,00:28:33,"But fortunately, you won't have a head anymore to put it on."
00:28:33,00:28:37,So the Maché were a civilization from Peru.
00:28:37,00:28:41,And I learned this last year when I visited the Laco Museum
00:28:41,00:28:43,of Pre-Columbian Art in Lima.
00:28:43,00:28:45,"And we know about this because all we know about these people,"
00:28:45,00:28:47,"they're really mysterious, but everything"
00:28:47,00:28:49,we know comes from their pottery.
00:28:49,00:28:53,And we have kind of the like little cartoons of what happens.
00:28:53,00:28:54,So that's how we know about it.
00:28:54,00:28:55,That's very cool.
00:28:55,00:28:57,What kind of hats are they?
00:28:57,00:28:58,Is it like a top hat?
00:28:58,00:28:59,"Because the top hat would be quite easy to knock off,"
00:28:59,00:29:02,but then a beanie is quite difficult.
00:29:02,00:29:03,That's true.
00:29:03,00:29:04,"And a bike helmet, almost impossible."
00:29:04,00:29:05,Yeah.
00:29:05,00:29:09,They were large feathery kind of feather pieces.
00:29:09,00:29:09,Sounds easy.
00:29:09,00:29:10,Sounds easy.
00:29:10,00:29:11,"Yeah, it is easy."
00:29:11,00:29:14,"Well, really, they just wanted someone to sacrifice."
00:29:14,00:29:16,"Yeah, I don't think they really gave a shit who it was."
00:29:16,00:29:19,"And I think sometimes they also then sacrifice the winner,"
00:29:19,00:29:19,right?
00:29:19,00:29:21,"There's someone who's the thing in me, so I don't know how I can go."
00:29:21,00:29:23,"But they'd sacrifice a guy whose hat got knocked off,"
00:29:23,00:29:25,"but then they thought the gods also deserved their best warriors,"
00:29:25,00:29:28,so they would sometimes also sacrifice the one
00:29:28,00:29:29,who'd won the battle.
00:29:29,00:29:29,Wow.
00:29:29,00:29:31,"It's a real catch, 22."
00:29:31,00:29:32,"That's terrible, yeah."
00:29:32,00:29:33,"Oh, it is."
00:29:33,00:29:34,"It's a matter of the pre-show interview,"
00:29:34,00:29:35,like the pre-match interviews.
00:29:35,00:29:37,How are you feeling about the match?
00:29:37,00:29:37,Not good.
00:29:37,00:29:40,[LAUGHTER]
00:29:40,00:29:43,"Yeah, I didn't know that they made rubber balls."
00:29:43,00:29:45,"Yes, they did."
00:29:45,00:29:46,"Some of them, yeah."
00:29:46,00:29:47,"The old mechs, especially."
00:29:47,00:29:49,"Yes, the sum of me, so Americans, they made rubber balls."
00:29:49,00:29:51,"And they could make a match, different compounds."
00:29:51,00:29:52,This is very cool.
00:29:52,00:29:55,And some of them had the scientists believe
00:29:55,00:29:59,"that they made 16,000 balls a year in special rubber ball factories."
00:29:59,00:30:00,Wow.
00:30:00,00:30:01,"Yeah, this is--"
00:30:01,00:30:02,"Yeah, this is impressive."
00:30:02,00:30:04,"This is very true, though, does it?"
00:30:04,00:30:06,"Not factories, come on."
00:30:06,00:30:08,"It's got the word fact in it, James."
00:30:08,00:30:10,[LAUGHTER]
00:30:10,00:30:13,Is this the mezzo-American ballgame that we're talking about?
00:30:13,00:30:15,Is this-- I thought that was a much slightly slightly different
00:30:15,00:30:18,to Sacred Mote hat combat.
00:30:18,00:30:20,It's the later mezzo-American ballgame.
00:30:20,00:30:21,"Yeah, they play with these balls,"
00:30:21,00:30:22,and it's a crazy game.
00:30:22,00:30:25,"And again, historians are not quite sure"
00:30:25,00:30:26,whether when the loser and the winner
00:30:26,00:30:28,are determined who were the ones that
00:30:28,00:30:32,were murdered and sacrificed off the back of it.
00:30:32,00:30:34,So they think it might have been the losers who got sacrificed.
00:30:34,00:30:36,"But actually, the gods were more interested"
00:30:36,00:30:38,in the best blood and the most skillful.
00:30:38,00:30:42,"So actually, you would probably kill the better team,"
00:30:42,00:30:43,the winners.
00:30:43,00:30:46,And there was this extra thing where they would chop their heads off.
00:30:46,00:30:48,And some historians believe that then
00:30:48,00:30:50,they took the heads of the opponents
00:30:50,00:30:52,and then used those as a post-match ballgame
00:30:52,00:30:54,to then play with their heads.
00:30:54,00:30:56,There are pictures of that happening.
00:30:56,00:30:56,Pictures?
00:30:56,00:31:00,"Yeah, the drawings that we have of them doing that."
00:31:00,00:31:02,And they would also drink out of them sometimes.
00:31:02,00:31:06,So the post-match skull would be used as a drinking vessel.
00:31:06,00:31:07,Wow.
00:31:07,00:31:08,They would recycle.
00:31:08,00:31:10,"It's not a way to drive up the quality of the game,"
00:31:10,00:31:13,"I think, to kill good teams and bad teams alike."
00:31:13,00:31:14,Yeah.
00:31:14,00:31:16,I think that's why we should say they almost certainly
00:31:16,00:31:19,didn't do this the vast majority of the time.
00:31:19,00:31:21,"I read a really good analogy, which was,"
00:31:21,00:31:23,"imagine if in 5,000 years people looked"
00:31:23,00:31:26,at all of the Christian art that we have now
00:31:26,00:31:27,"and thought, wow, this is so weird."
00:31:27,00:31:29,"They just crucified people left, right, and set"
00:31:29,00:31:31,her every time they went to church.
00:31:31,00:31:33,Just because that's the thing that remains.
00:31:33,00:31:34,The image that remains.
00:31:34,00:31:38,"It probably did happen, but probably not often."
00:31:38,00:31:40,"Yeah, they seem to have really disliked"
00:31:40,00:31:42,a particular look in people.
00:31:42,00:31:44,"And if you had a beard and you had dark hair,"
00:31:44,00:31:45,you'd be crucified.
00:31:45,00:31:46,There was--
00:31:46,00:31:50,"So they do have really interesting pottery, the Maché people."
00:31:50,00:31:54,And there was an exhibition in Paris a few years ago
00:31:54,00:31:56,about it was called Sex Death and Sacrifice
00:31:56,00:31:57,in the Maché religion.
00:31:57,00:32:00,"And it had to have a warning on the way in about explicit content,"
00:32:00,00:32:04,"even though this is from how long ago, 2,000 years ago?"
00:32:04,00:32:05,"Yeah, best part of that."
00:32:05,00:32:06,But have you seen it?
00:32:06,00:32:09,Because it is pretty hard-cut.
00:32:09,00:32:12,I've got some good things on my computer
00:32:12,00:32:13,that stop me having to look at that sort of thing.
00:32:13,00:32:14,"Well, I do not have that."
00:32:14,00:32:16,[LAUGHTER]
00:32:16,00:32:18,"Although actually in Venice, I went to this museum."
00:32:18,00:32:23,"So this Laco museum, they have an annex for erotic pottery."
00:32:23,00:32:24,Your pottery.
00:32:24,00:32:30,"There's also, if you can't get down to Lima,"
00:32:30,00:32:32,there's a really good article on Traveller.com
00:32:32,00:32:35,about that annex entitled Fifty Shades of Clay.
00:32:35,00:32:39,[LAUGHTER]
00:32:39,00:32:40,Superb.
00:32:40,00:32:44,"But in the museum, they're under different categories."
00:32:44,00:32:45,"Like Netflix, kind of."
00:32:45,00:32:50,"And there's the union of animals, fruits, and deities,"
00:32:50,00:32:53,sexual activity of the dead.
00:32:53,00:32:55,That's not in Netflix category.
00:32:55,00:32:57,[LAUGHTER]
00:32:57,00:33:00,I better have that special thing on your Netflix.
00:33:00,00:33:02,It doesn't let you watch those.
00:33:02,00:33:04,It costs between animals.
00:33:04,00:33:07,"That includes frogs, mice, dogs, llamas, monkeys,"
00:33:07,00:33:08,and ears of corn.
00:33:08,00:33:11,[LAUGHTER]
00:33:11,00:33:12,Wow.
00:33:12,00:33:15,"In that museum, they have a part of a man receiving oral sex"
00:33:15,00:33:17,"that they call in the museum, the Bill Clinton pot."
00:33:17,00:33:22,[LAUGHTER]
00:33:22,00:33:25,Is it-- they were such an advanced civilization
00:33:25,00:33:27,that bought trade.
00:33:27,00:33:28,Incredible.
00:33:28,00:33:29,They are.
00:33:29,00:33:30,"When these are referred to, they're always referred"
00:33:30,00:33:31,to as sex pots.
00:33:31,00:33:34,"And this is in, like, archaeological papers."
00:33:34,00:33:36,And they talk about the amount of sex pots.
00:33:36,00:33:38,And you can't take it seriously at all.
00:33:38,00:33:39,"Crass over, Crass over."
00:33:39,00:33:39,Oh my god.
00:33:39,00:33:41,"It's a Crass over, Crass over."
00:33:41,00:33:41,"Yeah, yeah, yeah."
00:33:41,00:33:42,"What they can do, what they're going to do,"
00:33:42,00:33:43,how they're going to get it together?
00:33:43,00:33:45,Oh.
00:33:45,00:33:46,"Yeah, so the Mocce are--"
00:33:46,00:33:49,[LAUGHTER]
00:33:49,00:33:51,"OK, so where were we, guys?"
00:33:51,00:33:52,How about you would just tell us about--
00:33:52,00:33:55,"I don't know, James, it was three months ago."
00:33:55,00:33:57,You would tell us about sex pots.
00:33:57,00:33:59,"Ah, sex pots."
00:33:59,00:34:01,"Yes, but actually, I wanted to move on now"
00:34:01,00:34:03,to talk about knocking hats off.
00:34:03,00:34:03,Can we do that?
00:34:03,00:34:04,This is a fact about knocking hats off.
00:34:04,00:34:06,"That's right, yeah."
00:34:06,00:34:09,"So I was looking into the history of that,"
00:34:09,00:34:11,an easy thing to research.
00:34:11,00:34:13,"And I found out that 200 years ago, in the Ottoman Empire,"
00:34:13,00:34:15,"if you knocked off someone's turban,"
00:34:15,00:34:16,it was punishable by death.
00:34:16,00:34:17,Wow.
00:34:17,00:34:19,And I discovered this because I was reading an account
00:34:19,00:34:23,"in 1799 of a Christian who was taken to court,"
00:34:23,00:34:27,because they were accused of knocking off a Muslim's turban.
00:34:27,00:34:28,"And the Christian's explanation, which"
00:34:28,00:34:30,"seemed to be believed by the court,"
00:34:30,00:34:32,"was that the Muslim had been wearing a blue turban, which"
00:34:32,00:34:35,looked exactly like the turban that his friend usually wore.
00:34:35,00:34:37,"So he said he'd knocked it off as a prank,"
00:34:37,00:34:38,because he thought it was his mate.
00:34:38,00:34:39,And then the guy had turned around and it wasn't.
00:34:39,00:34:42,"And in fact, he ended up getting off Scott free,"
00:34:42,00:34:44,and the judge ended up punishing the Muslim for wearing
00:34:44,00:34:47,a blue turban when he was supposed to be wearing a green one.
00:34:47,00:34:48,"Oh, no, that's cool."
00:34:48,00:34:50,"I got a couple of hat things, just very quickly."
00:34:50,00:34:52,"On George Orwell's 110th birthday,"
00:34:52,00:34:55,it was celebrated in a little Dutch town
00:34:55,00:34:59,by these artists putting little hats on every single CCTV
00:34:59,00:35:01,camera around there.
00:35:01,00:35:02,Apparently it's loaded.
00:35:02,00:35:03,"Well, just to make them look cute."
00:35:03,00:35:06,"Just to sort of show how his vision has come true, basically,"
00:35:06,00:35:07,from the book.
