start_hhmmss,end_hhmmss,text
00:00:00,00:00:02,"- Hey everyone, welcome to this week's episode"
00:00:02,00:00:03,of No Such Thing as a Fish.
00:00:03,00:00:05,"Before we get going, we just wanna let you know"
00:00:05,00:00:08,that this is a particularly interesting episode.
00:00:08,00:00:10,It's what we like to call a crossover episode.
00:00:10,00:00:12,"You may be aware of crossover movies,"
00:00:12,00:00:14,take the latest Avengers movie
00:00:14,00:00:16,where they had Guardians of the Galaxy involved.
00:00:16,00:00:20,We've decided to do a crossover episode with ourselves.
00:00:20,00:00:24,"It's very ambitious, but I think we've managed it."
00:00:24,00:00:25,"- We screwed up, didn't we, Dan?"
00:00:25,00:00:26,"- We did, we screwed up."
00:00:26,00:00:29,"We were in Wellington, we were on stage,"
00:00:29,00:00:31,"Wellington is in New Zealand,"
00:00:31,00:00:34,"and we were recording a show as part of our tour,"
00:00:34,00:00:37,and we've only just found out that the final two facts
00:00:37,00:00:40,"are missing, the recording is gone."
00:00:40,00:00:42,"- Or the final one and a half facts, I think,"
00:00:42,00:00:43,"and you'll notice, I believe."
00:00:43,00:00:44,"- Yeah, so what it'll sound like"
00:00:44,00:00:47,"is that all of our jokes are falling really, really flat."
00:00:47,00:00:49,(laughing)
00:00:49,00:00:50,- How will listeners tell the difference?
00:00:50,00:00:52,(laughing)
00:00:52,00:00:54,"- Okay, so listen carefully,"
00:00:54,00:00:55,'cause you might actually miss it.
00:00:55,00:00:57,"We'll do our best to make sure it's flagged up,"
00:00:57,00:00:59,"but if we've done our job well, you won't notice."
00:00:59,00:01:01,"- Okay, on with the show."
00:01:01,00:01:03,(bell rings)
00:01:03,00:01:04,- Do you know what it is?
00:01:04,00:01:05,- Who the fuck is this?
00:01:05,00:01:06,(bell rings)
00:01:06,00:01:07,- Who the fuck is that?
00:01:07,00:01:08,(bell rings)
00:01:08,00:01:09,Do you know what it is?
00:01:09,00:01:12,(upbeat music)
00:01:12,00:01:14,"- Hello, and welcome to another episode"
00:01:14,00:01:17,"of ""No Such Thing as a Fish"", a weekly podcast."
00:01:17,00:01:20,"This week, coming to you from Wellington!"
00:01:20,00:01:23,(audience cheering)
00:01:28,00:01:30,"- My name is Dan Schreiber,"
00:01:30,00:01:33,"and I am sitting here with Anna Chazinski,"
00:01:33,00:01:35,"Andrew Hunter Murray, and James Harkin,"
00:01:35,00:01:38,"and once again, we have gathered around the microphones"
00:01:38,00:01:41,"with our four favorite facts from the last seven days,"
00:01:41,00:01:45,"and in no particular order, here we go."
00:01:45,00:01:49,"Starting with fact number one, and that is Chazinski."
00:01:49,00:01:52,- My fact is that if a lamb starts being born
00:01:52,00:01:54,"the wrong way up, the farmer pushes it"
00:01:54,00:01:57,right back up into the womb and gets it to start again.
00:01:57,00:01:59,(audience laughing)
00:01:59,00:02:03,"And I thought I'd do a fact about sheep, because we're here."
00:02:03,00:02:06,(audience laughing)
00:02:06,00:02:08,"- Wow, that is a risky start, Anna."
00:02:08,00:02:11,"- See, not everyone in the room is a sheep farmer."
00:02:11,00:02:12,(audience laughing)
00:02:12,00:02:14,"But on the size of love, about half of the mile."
00:02:14,00:02:15,"- Yeah, but."
00:02:15,00:02:20,"- So yeah, I think I first came across as a New Yorker piece"
00:02:20,00:02:22,"that was an interview with a guy called James Rebanks,"
00:02:22,00:02:24,who's a sheep farmer in Cumbria in the UK.
00:02:24,00:02:26,"And he was saying, yeah, most lambs,"
00:02:26,00:02:28,"if they're being born well, they come out like a diver."
00:02:28,00:02:30,So it's like head and front legs first.
00:02:30,00:02:32,"But if the legs and the head come out in the wrong order,"
00:02:32,00:02:34,"at all, you literally have to shove it right back up there"
00:02:34,00:02:37,and rearrange them in order that they come out
00:02:37,00:02:38,the right way.
00:02:38,00:02:42,And so he gave various instances of ways
00:02:42,00:02:42,that it could go wrong.
00:02:42,00:02:45,"So if the legs come out without a head,"
00:02:45,00:02:47,"then you have to go, that means the head."
00:02:47,00:02:49,That doesn't mean it's left the head right behind
00:02:49,00:02:51,in the uterus.
00:02:51,00:02:53,It just means the head's a bit bent.
00:02:53,00:02:55,So you've got to return it and rearrange it.
00:02:55,00:02:57,"And when you do rearrange it, they have"
00:02:57,00:03:00,to cup the mouth of the lamb so that the lamb's teeth don't tear
00:03:00,00:03:02,at the birthing canal in the uterus.
00:03:02,00:03:03,Crikey.
00:03:03,00:03:05,It's a combination of extremely sweet and extremely
00:03:05,00:03:06,disgusting.
00:03:06,00:03:10,I'm yet to hear the sweet part.
00:03:10,00:03:12,He's helping the little lamb get out intact.
00:03:12,00:03:14,"OK, where do you put it like that?"
00:03:14,00:03:17,What does the sheep think as the baby's birthing
00:03:17,00:03:20,is suddenly pushed back in like that?
00:03:20,00:03:23,That's got to be the weirdest experience ever.
00:03:23,00:03:24,We don't have any records on what they think.
00:03:24,00:03:26,"But they must be concerned, right?"
00:03:26,00:03:30,I read a thing that sheep have an incredible peripheral vision.
00:03:30,00:03:32,They've not that incredible that they can see up there.
00:03:32,00:03:36,[LAUGHTER]
00:03:36,00:03:38,But they think they can go almost to 360.
00:03:38,00:03:40,"They've almost got 360 views, which are nice."
00:03:40,00:03:42,It's almost impossible to sneak up on them.
00:03:42,00:03:44,Yeah.
00:03:44,00:03:46,"There's piece of a lot of experience, doesn't it?"
00:03:46,00:03:51,"Almost, but not quite."
00:03:51,00:03:54,[LAUGHTER]
00:03:54,00:03:56,But they must as it's being shoved back in.
00:03:56,00:03:59,"They must have us put in like, what are you doing?"
00:03:59,00:04:01,You can see you.
00:04:01,00:04:02,They're very dappy.
00:04:02,00:04:04,"I mean, genuinely, they are quite--"
00:04:04,00:04:06,"I think they're quite crap mothers, at least at the start."
00:04:06,00:04:11,So I read so many farming blogs and turns out
00:04:11,00:04:14,you are very bad at knowing which ones are their babies.
00:04:14,00:04:16,And the babies are very bad at knowing which ones are their mothers.
00:04:16,00:04:18,And they're constantly getting confused about this
00:04:18,00:04:20,and going off with the wrong parent.
00:04:20,00:04:22,And so a lamb will accidentally pick the wrong parent
00:04:22,00:04:25,that won't be able to produce milk and so it'll starve.
00:04:25,00:04:29,"And there's this weird thing where farmers,"
00:04:29,00:04:32,"sometimes, a lamb will be born and be an orphan,"
00:04:32,00:04:33,so that you might die in childbirth.
00:04:33,00:04:36,And it's an amazing thing that farmers do to trick
00:04:36,00:04:40,use into believing that another lamb is their lamb.
00:04:40,00:04:43,And what they do is there'll be a you that's pregnant
00:04:43,00:04:44,with one lamb.
00:04:44,00:04:45,And it gives birth to it.
00:04:45,00:04:47,And the farmer then he's to trick the you
00:04:47,00:04:49,into thinking it's about to have twins.
00:04:49,00:04:52,"And so what he does, prepare yourselves,"
00:04:52,00:04:54,"is, first of all, he covers the orphan lamb"
00:04:54,00:04:58,in the birthing fluid so that it smells right from the other one.
00:04:58,00:05:01,And he ties its legs together because often that lamb's
00:05:01,00:05:03,"day old or so, and they can run away."
00:05:03,00:05:05,"And if you're just given birth or something,"
00:05:05,00:05:07,it's very unusual for it to immediately go
00:05:07,00:05:09,gallopanting over the fields.
00:05:09,00:05:13,And then what he does is he sort of puts inserts his hand
00:05:13,00:05:18,into the you and pretends that his hand is the second lamb
00:05:18,00:05:19,that's being born.
00:05:19,00:05:22,And then you will be convinced that she's having contractions
00:05:22,00:05:24,and think that she's giving birth and you keep it in there.
00:05:24,00:05:25,And then you whip it out.
00:05:25,00:05:28,And then you quickly do the magic trick of quickly
00:05:28,00:05:31,shoving the orphan lamb under the used nose.
00:05:31,00:05:33,"And then things, oh, that must be what just came out of me."
00:05:33,00:05:37,I've got effects about lambing sound effects.
00:05:37,00:05:40,So this is from the long running radio four
00:05:40,00:05:42,show the archers.
00:05:42,00:05:44,They have a style guide on how to do the sound effect
00:05:44,00:05:45,of a lamb being born.
00:05:45,00:05:46,Wow.
00:05:46,00:05:49,So you have to overlay agitated barring.
00:05:49,00:05:51,That's very important.
00:05:51,00:05:53,So there's barring going on and it sounds stressed.
00:05:53,00:05:55,And then you put a soaking wet towel on your shoulder.
00:05:55,00:05:56,It's really heavy.
00:05:56,00:05:58,And then you squeeze a huge amount of yogurt
00:05:58,00:06:00,through your gloved hands.
00:06:00,00:06:02,And then you drop the wet towel onto a bed
00:06:02,00:06:04,of old recording tape.
00:06:04,00:06:06,Wow.
00:06:06,00:06:07,Why don't they just use the recording
00:06:07,00:06:10,of an actual lamb being born?
00:06:10,00:06:11,"Often they don't sound right, do they?"
00:06:11,00:06:13,"When you do the actual thing, it"
00:06:13,00:06:14,doesn't sound like what you would expect.
00:06:14,00:06:16,"It might happen that if you recorded that,"
00:06:16,00:06:19,it would just sound like an old towel being dropped off
00:06:19,00:06:22,of some yogurt as if it's trained.
00:06:22,00:06:25,I thought I would find out what farmers did.
00:06:25,00:06:26,But I forgot to look on the blogs.
00:06:26,00:06:28,I went on to Reddit.
00:06:28,00:06:32,And there was an AMA with a sheep farmer.
00:06:32,00:06:34,"And one of the top questions was,"
00:06:34,00:06:38,why do they have such shitty asses?
00:06:38,00:06:41,The farmers are the sheep.
00:06:41,00:06:43,They were speaking about the sheep.
00:06:43,00:06:44,"The guy said, this is true."
00:06:44,00:06:46,As though they have zero control or awareness
00:06:46,00:06:48,of what comes out.
00:06:48,00:06:51,And they actually sell jackets to go over the sheep
00:06:51,00:06:53,to protect the wool from getting dirty for those
00:06:53,00:06:55,who want super clean wool.
00:06:55,00:06:58,So you get some sheep who are wearing like an all-in-one
00:06:58,00:07:00,onesie with a little hole.
00:07:00,00:07:01,And it keeps them clean.
00:07:01,00:07:06,And will that be made of a previous sheep?
00:07:06,00:07:08,"Well, there is one thing that they do."
00:07:08,00:07:11,"Again, if they want a you to adopt an orphan sheep,"
00:07:11,00:07:15,they will shave the wool off one of its real offspring
00:07:15,00:07:18,and then put it on the other one as a disguise.
00:07:18,00:07:21,So they literally wear the other lambs clothes.
00:07:21,00:07:23,So it's like a sheep in sheep's clothing.
00:07:23,00:07:26,[LAUGHTER]
00:07:26,00:07:27,It's a lamin lambs clothing.
00:07:27,00:07:29,"But yeah, I think everyone gets the idea."
00:07:29,00:07:30,It's a great clever.
00:07:30,00:07:32,Did you know that sheep have their own weather forecast?
00:07:32,00:07:33,What?
00:07:33,00:07:34,"In the UK, sheep have their own weather forecast."
00:07:34,00:07:35,"No, they don't."
00:07:35,00:07:35,They do.
00:07:35,00:07:36,It's just been launched.
00:07:36,00:07:37,It's in Bristol.
00:07:37,00:07:40,"And it's a traffic light system of warnings, which"
00:07:40,00:07:42,measures whether-- and it works out the risk of-- there's
00:07:42,00:07:45,a very particular parasite they get called pneumatodirus.
00:07:45,00:07:46,"And if you are a pneumatodirus, and I've"
00:07:46,00:07:49,"pronounced it wrong, please don't write in."
00:07:49,00:07:50,But it's very useful.
00:07:50,00:07:53,The only problem with it is that they
00:07:53,00:07:57,have not called it the sheeping forecast.
00:07:57,00:07:58,Guys?
00:07:58,00:07:59,"Thank you, growing there."
00:07:59,00:08:01,When you met a supportive hearty chuckle.
00:08:01,00:08:04,"So it's a forecast not of weather, but of parasites?"
00:08:04,00:08:05,Yes.
00:08:05,00:08:08,"Well, it's weather, which tells you when the parasites are"
00:08:08,00:08:09,going to be coming in.
00:08:09,00:08:09,Wow.
00:08:09,00:08:11,And it tells the humans not the sheep.
00:08:11,00:08:13,"It's really a focus of farmers, isn't it?"
00:08:13,00:08:17,"Or do the sheep gather around 5 p.m. every Monday, actually?"
00:08:17,00:08:19,There'll be a lot of parasites out there tonight.
00:08:19,00:08:22,"Look, lively, stay sharp."
00:08:22,00:08:26,That's-- I was reading a medical report about--
00:08:26,00:08:27,it just gives you virus.
00:08:27,00:08:29,"It talks about viruses and parasites and so on, that come up."
00:08:29,00:08:31,And these people who are reading it
00:08:31,00:08:34,"noticed a very odd entry in it, which"
00:08:34,00:08:37,is that a few people who were farmers who
00:08:37,00:08:41,were involved in castrating lambs when they were born
00:08:41,00:08:43,got very ill very quickly.
00:08:43,00:08:45,And it was 12 people who got ill.
00:08:45,00:08:47,But they worked out that two of them got ill
00:08:47,00:08:50,because they were castrating with an old method that still
00:08:50,00:08:52,"goes on these days, not completely,"
00:08:52,00:08:55,but in the 1800s all the time.
00:08:55,00:08:56,They castrate using their teeth.
00:08:56,00:09:01,So these are humans who go and two of these guys
00:09:01,00:09:04,were castrating these lambs with their teeth.
00:09:04,00:09:06,And they got very ill.
00:09:06,00:09:09,One of my best friends has done that in Australia.
00:09:09,00:09:10,- Really? - In Western Australia.
00:09:10,00:09:11,- Yep. - Did they get ill?
00:09:11,00:09:14,"He's-- well, he's pretty insane, but he's not sick."
00:09:14,00:09:15,"Oh, OK."
00:09:15,00:09:18,"I think he is sick, yeah."
00:09:18,00:09:19,"And they go by on a conveyor belt, right?"
00:09:19,00:09:20,"And you lie underneath them, and he just"
00:09:20,00:09:21,weaponize one by one.
00:09:21,00:09:23,What?
00:09:23,00:09:27,"Well, you come up like jaws, but you just go bite off the balls."
00:09:27,00:09:29,"It's your friend, Australian."
00:09:29,00:09:30,He lived in Australia for a year.
00:09:30,00:09:31,"Well, he was British."
00:09:31,00:09:32,Yeah.
00:09:32,00:09:35,Feels like they kind of saw him coming down there.
00:09:35,00:09:36,"Yeah, we all do this, mate."
00:09:36,00:09:38,[LAUGHTER]
00:09:38,00:09:42,This guy looks like I'll bite the balls off anything.
00:09:42,00:09:45,Do you know how farmers can tell when she perv made it?
00:09:45,00:09:46,This is an interesting thing.
00:09:46,00:09:48,"Well, they wait nine months."
00:09:48,00:09:50,Yeah.
00:09:50,00:09:52,"So what they do-- well, in a lot of farms, what they do is"
00:09:52,00:09:56,they draw on the males with crayon.
00:09:56,00:09:57,OK?
00:09:57,00:09:59,"And then, if they come back later--"
00:09:59,00:10:00,so they draw on the underside of the males with crayon.
00:10:00,00:10:02,"And if they come back later, because you"
00:10:02,00:10:04,"can't be watching the sheep all the time, it's--"
00:10:04,00:10:06,Oh.
00:10:06,00:10:08,"It might be chalk here, but in some places,"
00:10:08,00:10:11,"and in the sources I found, it was crayon."
00:10:11,00:10:14,"Anyway, if they come back later and the females got crayon,"
00:10:14,00:10:17,or chalk?
00:10:17,00:10:21,"On her back, then they know that mating has occurred."
00:10:21,00:10:23,"But you wouldn't think that crayon would work, right?"
00:10:23,00:10:24,"Yeah, you'd--"
00:10:24,00:10:28,[LAUGHTER]
00:10:28,00:10:30,It too harking.
00:10:32,00:10:37,"Hey, another weird thing that happens to female pregnant--"
00:10:37,00:10:40,"sorry, sheep-- is that they get really heavy with the weight"
00:10:40,00:10:42,and their wool gets really heavy.
00:10:42,00:10:45,"So sometimes they lose balance, and they tip over."
00:10:45,00:10:48,"And they fall on their back, like a turtle,"
00:10:48,00:10:49,and they can't get back up.
00:10:49,00:10:50,So they get stuck.
00:10:50,00:10:54,So farmers have to go and bring pregnant sheep back onto their feet.
00:10:54,00:10:56,"Otherwise, they've just stuck their upside down."
00:10:56,00:10:57,"Wow, really?"
00:10:57,00:10:57,Yeah.
00:10:57,00:10:58,Sheep spinning.
00:10:58,00:10:59,"They are stupid, aren't they?"
00:10:59,00:11:01,They are.
00:11:01,00:11:03,Someone sent me a text in the break.
00:11:03,00:11:05,"And I can't remember who it is, and I've turned my phone off,"
00:11:05,00:11:08,"sorry, but they said that when it snows,"
00:11:08,00:11:12,the sheep can't believe that the grass is underneath the snow.
00:11:12,00:11:14,They think it's just disappeared.
00:11:14,00:11:17,And so they'll just starve to death if you don't kind of clear
00:11:17,00:11:18,them a little clearing.
00:11:18,00:11:20,Is it another one of those magic tricks
00:11:20,00:11:23,"they think have happened, like the swapping of the land?"
00:11:23,00:11:26,"And apparently, like cows and cattle, they all clear it away."
00:11:26,00:11:28,But sheep are just stupid.
00:11:28,00:11:32,They sometimes-- so they have to groom their lambs when they give birth to them.
00:11:32,00:11:36,And sometimes they get so carried away with grooming that they bite their tails off.
00:11:36,00:11:37,"Wait, sorry."
00:11:37,00:11:38,The mother.
00:11:38,00:11:42,I thought you meant this was your friend biting.
00:11:42,00:11:44,I think your friend just really likes lamb.
00:11:44,00:11:48,"But yeah, the mothers, they've got to lick off all the afterbirth and stuff,"
00:11:48,00:11:51,"but they get really excited, and they'll bite the umbilical cord,"
00:11:51,00:11:52,and they'll just bite the tail off.
00:11:52,00:11:55,"And the farmers don't know what to do because you're not supposed to get involved,"
00:11:55,00:11:57,"because otherwise, that might separate the mother from the lamb."
00:11:57,00:12:00,"And so they just have to watch, sort of going, no, stop it."
00:12:00,00:12:02,Stop biting them tail of your child.
00:12:02,00:12:04,"Oh, my God."
00:12:04,00:12:07,"Guys, we're going to have to move on shortly to our next fact."
00:12:07,00:12:09,"Just one last thing, Mary had a little lamb."
00:12:09,00:12:12,The nursery rhyme is based on a true story.
00:12:12,00:12:15,[LAUGHTER]
00:12:15,00:12:16,You know that?
00:12:16,00:12:17,Yeah.
00:12:17,00:12:19,"Well, there's nothing supernatural in there already."
00:12:19,00:12:20,Yeah.
00:12:20,00:12:22,It's just about someone called Mary who had a little lamb.
00:12:22,00:12:23,It's a quite believable--
00:12:23,00:12:26,And the sheep followed her wherever she-- it's a good herder.
00:12:26,00:12:30,"She's-- yeah, it's a very-- what's your point, Andy?"
00:12:30,00:12:31,Was she famous?
00:12:31,00:12:32,Was she a famous Mary?
00:12:32,00:12:33,She was not.
00:12:33,00:12:36,She was a woman called Mary Sawyer.
00:12:36,00:12:38,It was a Massachusetts in 1830.
00:12:38,00:12:43,"She had a lamb, and it followed her all over the place, and then a friend."
00:12:43,00:12:44,Interesting.
00:12:44,00:12:45,"No, no, no, the interesting thing thing was,"
00:12:45,00:12:48,"it's fleece was as white as snow, and then--"
00:12:48,00:12:51,[LAUGHTER]
00:12:51,00:12:54,"So when I've disappeared, where am I?"
00:12:54,00:12:57,[MUSIC PLAYING]
00:12:57,00:13:01,"OK, it is time for fact number two, and that is Andy."
00:13:01,00:13:03,"My fact is that the Netflix category,"
00:13:03,00:13:10,"Gory Canadian Revenge Movies, only has one film in it."
00:13:10,00:13:12,"Wow, on what's the film, Deena?"
00:13:12,00:13:12,I don't.
00:13:12,00:13:14,I'm going to rip it down.
00:13:14,00:13:17,Sauce.
00:13:17,00:13:18,"Your research today has been very lax,"
00:13:18,00:13:23,because it's of reciting nursery rhymes and having a fun fact.
00:13:23,00:13:26,So what the thing that happens is there
00:13:26,00:13:28,are these microcategories on Netflix.
00:13:28,00:13:30,"And if you have a Netflix account, you might have seen them."
00:13:30,00:13:36,"So goofy werewolf comedies is one, or sentimental movies"
00:13:36,00:13:38,about horses for ages 11 to 12.
00:13:38,00:13:43,[LAUGHTER]
00:13:43,00:13:45,And some of them-- this is the bizarre thing.
00:13:45,00:13:49,"Netflix has made 76,897 unique categories,"
00:13:49,00:13:51,according to the last count done.
00:13:51,00:13:53,And some of them have nothing in them.
00:13:53,00:13:57,So that feel good romantic Spanish language TV show.
00:13:57,00:13:59,"Netflix has none, but they've created the category,"
00:13:59,00:14:00,because some will exist.
00:14:00,00:14:01,Wow.
00:14:01,00:14:05,"So for instance, skiing, nonfiction, none of those."
00:14:05,00:14:08,"Iranian comedies, none of those."
00:14:08,00:14:09,[LAUGHTER]
00:14:09,00:14:11,So we're just waiting to discover them.
00:14:11,00:14:12,I guess so.
00:14:12,00:14:15,It's like when they knew India existed and they tried to find it.
00:14:15,00:14:17,"If you pitch a show to Netflix to make,"
00:14:17,00:14:19,"they'll probably be like, well, it's a shit idea,"
00:14:19,00:14:22,but we need one of those.
00:14:22,00:14:23,You've got the money.
00:14:23,00:14:27,They actually-- there was a role that was advertised in the UK
00:14:27,00:14:30,for someone specifically to create these kind of categories.
00:14:30,00:14:33,So the idea was they advertised for someone
00:14:33,00:14:35,who would basically binge watch Netflix.
00:14:35,00:14:37,They would just sit and watch movie after movie.
00:14:37,00:14:38,"And while they were watching, they"
00:14:38,00:14:40,would think of unique different tags
00:14:40,00:14:42,that they could give to each of those movies
00:14:42,00:14:44,to create these kind of categories.
00:14:44,00:14:47,"But the other thing is, they have professional watches."
00:14:47,00:14:49,"So this is-- this fact is from a piece in The Atlantic, which"
00:14:49,00:14:51,was fantastic.
00:14:51,00:14:55,"It was a journalist who ran a script to download all 76,000."
00:14:55,00:14:57,"The guys who professionally watch Netflix,"
00:14:57,00:15:00,they tag movies with all kinds of data.
00:15:00,00:15:04,So it's not just how rude the plot is or whether there's violence.
00:15:04,00:15:06,They tag how conclusive the plot is.
00:15:06,00:15:08,They tag how moral the characters are.
00:15:08,00:15:10,And they just analyze everything.
00:15:10,00:15:13,And all they want is to get you to watch more Netflix.
00:15:13,00:15:16,"So one of them said, you might like what I consider"
00:15:16,00:15:17,to be horrible movies.
00:15:17,00:15:20,But my job right now is to get you to watch all those horrible
00:15:20,00:15:21,movies that you want.
00:15:21,00:15:24,And they have thousands of categories designed specifically
00:15:24,00:15:25,for that.
00:15:25,00:15:27,Who's specifically looking for things like this?
00:15:27,00:15:28,That's what's so weird.
00:15:28,00:15:31,Who wants a thing that's 80% conclusive
00:15:31,00:15:32,with moderately moral characters?
00:15:32,00:15:34,No one's searching for that in every week.
00:15:34,00:15:35,That sounds fun.
00:15:35,00:15:37,"No, OK, maybe."
00:15:37,00:15:40,"Also, I think that there are films in their categorization"
00:15:40,00:15:42,filling isn't very good.
00:15:42,00:15:44,So one of the ones that has nothing in it
00:15:44,00:15:46,is suspenseful time travel movies.
00:15:46,00:15:48,There's definitely got to be some of those.
00:15:48,00:15:50,"Back to the future is suspenseful, right?"
00:15:50,00:15:52,"Yes, yeah."
00:15:52,00:15:54,Sentimental action and adventure.
00:15:54,00:15:56,There must be one sentimental action film out there.
00:15:56,00:15:58,"Yeah, not everything's on Netflix, though."
00:15:58,00:16:00,"That's the issue, I guess."
00:16:00,00:16:03,"Back to the future, I don't think is on Netflix."
00:16:03,00:16:04,"Therefore, maybe they're just waiting to--"
00:16:04,00:16:07,"Yeah, it is, then, apparently."
00:16:07,00:16:11,That guy at the back watched it this morning.
00:16:11,00:16:14,Right after birthing his lambs.
00:16:14,00:16:18,So Netflix released a load of their stats from 2017.
00:16:18,00:16:20,"And apparently, someone in New Zealand"
00:16:20,00:16:25,"watched grown-ups 331 times, like you."
00:16:25,00:16:26,Great movie.
00:16:26,00:16:27,Absolutely.
00:16:27,00:16:30,"Great movie, but 331 times in a year."
00:16:30,00:16:33,"Apparently, there's a podcast called ""The worst idea"
00:16:33,00:16:34,"of all time"" where they tell you to do that."
00:16:34,00:16:36,So that's why they did that.
00:16:36,00:16:38,"Ah, cool."
00:16:38,00:16:41,And there was one viewer in Antarctica
00:16:41,00:16:43,who binged on Shameless.
00:16:43,00:16:44,And there was one person in America
00:16:44,00:16:46,who watched the first Pirates of the Caribbean movie
00:16:46,00:16:49,every single day for a year.
00:16:49,00:16:50,Wow.
00:16:50,00:16:53,I'd rather do that than watch the fourth Pirates of the Caribbean
00:16:53,00:16:54,movie once.
00:16:54,00:16:56,[LAUGHTER]
00:16:56,00:17:01,"Netflix has shamed people for this, though."
00:17:01,00:17:03,"They sent our tweet in December last year,"
00:17:03,00:17:05,"saying, ""To the 53 people who've"
00:17:05,00:17:09,"been watching a Christmas Prince every day for the past 18 days,"
00:17:09,00:17:10,"who hurt you?"""
00:17:10,00:17:12,[LAUGHTER]
00:17:12,00:17:14,"Oh, that's pretty mean."
00:17:14,00:17:19,"It's a combination of mean, creepy."
00:17:19,00:17:22,Just one more thing that they've got about category-wise.
00:17:22,00:17:27,They've got so many things starring the actor Raymond Burr.
00:17:27,00:17:28,Uh-huh.
00:17:28,00:17:29,Yeah.
00:17:29,00:17:31,They've got suspenseful movies starring Raymond Burr.
00:17:31,00:17:34,They've got cerebral mysteries starring Raymond Burr.
00:17:34,00:17:38,They've got understated suspenseful dramas starring Raymond Burr.
