start_hhmmss,end_hhmmss,text
00:34:34,00:34:35,And this just means it doesn't.
00:34:35,00:34:36,No.
00:34:36,00:34:42,Do you think I'll recommend a group therapy to a guy who's a fear of social environment?
00:34:42,00:34:46,"It's okay to laugh, because he came back the following week, and within a year he was"
00:34:46,00:34:48,running groups by himself as well.
00:34:48,00:34:49,And now he's got a fear of being alone.
00:34:49,00:34:50,[laughter]
00:34:50,00:34:52,He's in the group all the time.
00:34:52,00:34:57,"I was looking up what, because I was like, ""What a spider's scared of,"" because, you know,"
00:34:57,00:34:59,everyone's scared of spiders.
00:34:59,00:35:03,"Most spiders are terrified of ants, because ants contain formic acid, which is really about"
00:35:03,00:35:04,spiders.
00:35:04,00:35:09,"And a lot of them will run for their lives if they see an ant, as it were."
00:35:09,00:35:13,"That's like a quote, like a researcher said, ""It sort of run away."""
00:35:13,00:35:18,"But the University of Canterbury found that they even run away from, some spiders will even"
00:35:18,00:35:23,"run away from another species of spider called a jumping spider, which the gregarious jumping"
00:35:23,00:35:25,"spider, which pretends to be an ant."
00:35:25,00:35:26,That's its defense mechanism.
00:35:26,00:35:27,Right.
00:35:27,00:35:28,And it scares away other spiders.
00:35:28,00:35:29,"So, it hides its legs."
00:35:29,00:35:32,"I think we said that they hide that two of their legs, don't they?"
00:35:32,00:35:35,"So, some species spiders do that, and pretend to be ants, and that scares other species"
00:35:35,00:35:36,who are scared of ants.
00:35:36,00:35:37,Wow.
00:35:37,00:35:41,"Well, someone who's scared of spiders myself a little bit, if I was to dress as a massive"
00:35:41,00:35:42,ant.
00:35:42,00:35:44,"So, do you think that all kind of just leave me alone?"
00:35:44,00:35:45,Possibly.
00:35:45,00:35:50,"So, the spiders in the TV series, I'm a celebrity, get me out of here, must be feeling good"
00:35:50,00:35:54,"this year, because they're going to be missing a big ant on the set this year."
00:35:54,00:35:55,"Oh, sorry."
00:35:55,00:35:56,Good.
00:35:56,00:36:04,"Well, I do think you should never pick up a trancheter, because I hate them because I might"
00:36:04,00:36:08,"ship myself, and if I ship myself, no one's going to hang out with me anyway."
00:36:08,00:36:09,Right.
00:36:09,00:36:10,That makes your social phobia even worse.
00:36:10,00:36:11,Yeah.
00:36:11,00:36:12,"Because you'll scare them too much, and they'll die."
00:36:12,00:36:15,"It's similar, so it's for their sake."
00:36:15,00:36:19,"So, their abdomens are incredibly thin, and one little touch on the abdomen with your fingernail"
00:36:19,00:36:21,"could split it open, and they'll spill their guts all over the place."
00:36:21,00:36:23,"So, you can't just like tickle it on its tummy or anything."
00:36:23,00:36:24,They hate a tummy tingle.
00:36:24,00:36:25,Oh.
00:36:25,00:36:26,"So, don't do that."
00:36:26,00:36:28,"And if you drop a trancheter, it'll almost certainly die."
00:36:28,00:36:29,Really?
00:36:29,00:36:35,"Yeah, this is the advice of the British Trancheter Society, which is a bit of a QI favourite,"
00:36:35,00:36:39,"I think, because it was founded in the 1980s, but the woman who founded it was called"
00:36:39,00:36:41,"Animal and Web, which--"
00:36:41,00:36:42,"Oh, yeah."
00:36:42,00:36:43,Yeah.
00:36:43,00:36:47,"That's going to make watching Home Alone again a more harrowing experience, knowing that that"
00:36:47,00:36:51,"tarantula that gets loose and gets dropped, and I mean, they must have had a stunt spider"
00:36:51,00:36:55,"dressed as a tarantula, if that's the case, because he would have burst open in some"
00:36:55,00:36:56,of the scenes.
00:36:56,00:36:59,I think you're assuming too much knowledge of Home Alone from some of us.
00:36:59,00:37:00,Home Alone?
00:37:00,00:37:01,I can't immediately remember the tarantula scene.
00:37:01,00:37:02,"Oh, you're on stage, though."
00:37:02,00:37:03,Yeah.
00:37:03,00:37:07,"The only thing I remember is Kevin with his hands to his face, screaming, because he's"
00:37:07,00:37:09,been left home alone.
00:37:09,00:37:10,Yeah.
00:37:10,00:37:11,So you've memorized the poster.
00:37:11,00:37:12,That's not-- sorry.
00:37:12,00:37:13,I'm going to have to catch you again.
00:37:13,00:37:15,He's not screaming because he's left home alone.
00:37:15,00:37:16,He's screaming because he put aftershave on his face.
00:37:16,00:37:17,Yeah.
00:37:17,00:37:18,We'll see.
00:37:18,00:37:19,"Yeah, yeah, yeah."
00:37:19,00:37:20,He's pretending because he saw his dad screaming like that.
00:37:20,00:37:21,I don't think so.
00:37:21,00:37:26,"And then you suggestively in the poster, so I mean, he looked like he's screaming at the"
00:37:26,00:37:30,"two robbers who were either side of him, in the famous poster, but in the context of the"
00:37:30,00:37:31,"film, he's never screaming."
00:37:31,00:37:34,"I have an extremely clear, extremely fake memory."
00:37:34,00:37:36,His mom screams.
00:37:36,00:37:38,"His mom sits up on the phone and goes, ""Kevin, that's--."""
00:37:38,00:37:40,"Does he not say-- no, he doesn't say ""Kevin."""
00:37:40,00:37:42,Why did he say his own name?
00:37:42,00:37:43,Does he make any sense?
00:37:43,00:37:45,"I still think you're right, though."
00:37:45,00:37:47,[LAUGHTER]
00:37:47,00:37:49,"What about in home alone, too?"
00:37:49,00:37:50,Does he do it there?
00:37:50,00:37:51,"No, because he's lost in New York."
00:37:51,00:37:52,And that--
00:37:52,00:37:53,Although she says Kevin again in a scream.
00:37:53,00:37:55,"You know, in the Edward Monks, the scream."
00:37:55,00:37:56,Does he do it?
00:37:56,00:37:57,"No, that's actually--"
00:37:57,00:37:59,He's just put aftershave lives.
00:37:59,00:38:00,Yeah.
00:38:00,00:38:05,[MUSIC PLAYING]
00:38:05,00:38:07,"OK, that is it."
00:38:07,00:38:08,That is all of our facts.
00:38:08,00:38:09,Thank you so much for listening.
00:38:09,00:38:13,If you'd like to get in contact with any of us about the things that we've said over the
00:38:13,00:38:16,"course of this podcast, we can be found on our Twitter accounts."
00:38:16,00:38:17,I'm on @Sriberland.
00:38:17,00:38:18,James.
00:38:18,00:38:19,@James Harkin.
00:38:19,00:38:20,Alex.
00:38:20,00:38:21,@AlexBell.
00:38:21,00:38:22,And Chazinski.
00:38:22,00:38:23,You can email podcast@QI.com.
00:38:23,00:38:24,Yeah.
00:38:24,00:38:27,Or you can go to our group account at no such thing or Facebook page.
00:38:27,00:38:29,No such thing as a fish or our website.
00:38:29,00:38:31,No such thing as a fish.com.
00:38:31,00:38:32,Alex designed it.
00:38:32,00:38:33,"Thanks, Alex."
00:38:33,00:38:35,"Has everything linked to our tour, our new book."
00:38:35,00:38:40,"It's got a behind-the-scenes documentary called Behind the Gills, which shows how we act on"
00:38:40,00:38:41,tour.
00:38:41,00:38:42,It's a lot of ironing.
00:38:42,00:38:46,And everything else of all of previous episodes and so on is up there.
00:38:46,00:38:47,So check it out.
00:38:47,00:38:48,No such thing as a fish.com.
00:38:48,00:38:50,We're going to be back again next week with another episode.
00:38:50,00:38:51,We'll see you then.
00:38:51,00:38:52,Goodbye.
00:38:52,00:39:02,[MUSIC]
