start_hhmmss,end_hhmmss,text
00:00:00,00:00:02,[Bell]
00:00:02,00:00:04,Do you know what it is? Who do you want to work at?
00:00:04,00:00:06,[Bell]
00:00:06,00:00:08,[Bell]
00:00:08,00:00:10,[Bell]
00:00:10,00:00:12,[Bell]
00:00:12,00:00:16,Hello and welcome to another episode of
00:00:16,00:00:20,"No Such Thing as a Fish, a weekly podcast"
00:00:20,00:00:24,this week coming to you from the wilderness festival!
00:00:24,00:00:28,[Cheering]
00:00:28,00:00:33,"My name is Dan Schreiber and I'm sitting here with Ani Chazinski, James"
00:00:33,00:00:36,Harkin and Andrew Hunter Murray and once again we have gathered around the
00:00:36,00:00:40,microphones with our four favorite facts from the last seven days
00:00:40,00:00:44,"and in no particular order, here we go. Starting with our first"
00:00:44,00:00:48,"fact, this week that's my fact. My fact is, according to a new scientific"
00:00:48,00:00:53,"study, the best way to perform CPR is to do it while humming"
00:00:53,00:00:59,the Macarena. How cool is that? And I think they recommend humming it because
00:00:59,00:01:02,they probably don't believe if you're trying to save someone life and you're
00:01:02,00:01:06,"going ""hamadamba temadamba temamakarena, you're the right person to be doing it."""
00:01:06,00:01:08,Are they even chalyrics? Are you just dead then?
00:01:08,00:01:12,Does anyone know the actual lyrics? I think everyone knows the word macarena
00:01:12,00:01:15,"and know what the word in that song is. Yeah, exactly. But it's what it is about"
00:01:15,00:01:20,this song is that it has a BPM so every song has a B per minute and this BPM
00:01:20,00:01:24,"is 103 and as a result, when they're trying to teach people the perfect"
00:01:24,00:01:28,"counts that you need on a chest as you're trying to save someone's life,"
00:01:28,00:01:31,"the macarena happens to be the perfect amount. And before that, they used to"
00:01:31,00:01:35,think it was staying alive by the beaches. That's right.
00:01:35,00:01:40,Because that's about 103 or 104 as well. Yeah. But actually also maybe it's
00:01:40,00:01:44,"supposed to be about 100 is the best, right? But macarena is good because"
00:01:44,00:01:47,everyone kind of knows the beat of that so it's good to do. But I thought I'd
00:01:47,00:01:50,look at some others that are 100 beats per minute. So if anyone's having a
00:01:50,00:01:55,"heart attack, you should try these ones. Crazy and loved by Beyoncé."
00:01:55,00:01:58,Yeah. Independent women by Destiny's Child.
00:01:58,00:02:03,Any of these work. Hips don't lie by Shakira. That's my favourite.
00:02:03,00:02:07,Or my chemical romance dead. Yeah. Not a good one.
00:02:07,00:02:11,That's not a good one. I've found a few more. So Simon and Garfunkel bridge over
00:02:11,00:02:15,"Troubled Water. If it's just a nice mood, you want to chill everyone out with that?"
00:02:15,00:02:18,Sometimes the situation doesn't need something fun.
00:02:18,00:02:20,Okay. Sometimes poignancy is needed.
00:02:20,00:02:24,"Well, the way they sing that on the X Factor, which is the slowest song in the"
00:02:24,00:02:26,"history of time. Oh, okay. Well, how about this one?"
00:02:26,00:02:29,"It doesn't have any beat. It doesn't have any beat. You just, you'd pause on"
00:02:29,00:02:34,Lacka Bridge. That is how you do slow.
00:02:34,00:03:04,"Da, da, da, da, da, da, da, da, da, da, da, da, da, da, da, da, da, da, da, da, da, da, da, da, da, da, da, da, da, da, da, da, da, da, da, da, da, da, da, da, da, da, da, da, da, da, da, da, da, da, da, da, da, da, da, da, da, da, da, da, da, da, da, da, da, da, da, da, da, da, da, da, da, da, da, da, da, da, da, da, da, da, da, da, da, da, da, da, da, da, da, da, da, da, da, da, da, da, da, da, da, da, da, da, da, da, da, da, da, da"
00:03:04,00:03:11,It gets to the next. It's a good way of multitasking and fair sharing. So Macarena is by lost Del Rio. Yes
00:03:11,00:03:16,"Okay, and this is very much a one-hit wonder isn't it? They never had any other hits. Oh James"
00:03:16,00:03:23,I have got at least one of the other hits right here on my paper. What? It's Macarena Christmas
00:03:23,00:03:30,It's released about 18 months after Macarena and it is a kiddie not the worst song ever released
00:03:30,00:03:35,It's a it's a medley of jingle bells joined to the world rude off the Red Nose reindeer and the Macarena
00:03:35,00:03:39,"Wow, and they just break off and they do a bit of Macarena"
00:03:39,00:03:43,I'm at least I think five or six albums. One of them was Macarena non-stop
00:03:43,00:03:48,Which the compilation album it only has eight tracks and five of them at the Macarena
00:03:48,00:03:54,But you know what's amazing about lost Del Rio this band they got together in
00:03:54,00:04:00,1964 I believe it was 62 or 64 the same year that the Rolling Stones got together
00:04:00,00:04:04,"Okay, they had their hit 32 years into their career"
00:04:04,00:04:09,That was finally they were like should we give up I'm sure we're gonna hit it one day mates
00:04:09,00:04:12,Let's do it and they did and then they must have thought wow
00:04:12,00:04:14,We've made it and that was the end of their career. Yeah
00:04:14,00:04:20,That's still going that's still performing. But are they I when I'm researching this I read an article from
00:04:20,00:04:26,"1999 the headline of which was does anyone remember the Macarena? I mean, and that's what was that what a stupid article"
00:04:27,00:04:34,Everyone remembers the Macarena I watched a video you know you come see these on YouTube where they show teenagers stuff from the 90s
00:04:34,00:04:38,"Or whatever and see if they know what it is. Yeah, every single one of them knew what the Macarena was"
00:04:38,00:04:45,"Yeah, no one knew the band, but they all knew the song. Yeah, and in 2003 so that's 10 years after the record was released"
00:04:45,00:04:49,They were still making a quarter of a million dollars a year royalties. Wow
00:04:49,00:04:55,And it's extraordinary the original Macarena dance there was an original this that was the second dance
00:04:55,00:05:02,It was when they made the video when there was a remix done of the song the first one was an incredibly complicated flamingo dance
00:05:02,00:05:06,That was done in clubs. You would have to be an expert in order to do it
00:05:06,00:05:08,It had doubled the amount of moves that the original
00:05:08,00:05:15,"Verse had was invented by a don't like a random aerobic teacher or dance teacher or something. Yeah, me a fire"
00:05:15,00:05:21,"Yeah, yeah, yeah, or me a fry. She was in the video clip and so she wanted something that kids could dance to and adults"
00:05:22,00:05:28,"Who have to go to nightclubs, but don't know how to dance could dance to so the four of us bow to her"
00:05:28,00:05:33,You've saved us actually Macarena. It's about a woman called Macarena
00:05:33,00:05:41,But the name Macarena was originally Mac Delayna and it was just a word for like a sensuous woman and it comes from Mary Mac Delayna
00:05:41,00:05:45,"Then it was a word for any kind of prostitute and then it was a word for a sensuous woman, right?"
00:05:45,00:05:48,So really it should be hey Mac Delayna hey prostitute
00:05:48,00:05:55,"Well, and it's about a woman who prostitute in the song the lyrics are actually the woman saying"
00:05:55,00:05:58,Don't worry about my boyfriend. He's gone off to fight
00:05:58,00:06:03,You two are his best mates. Do you want to shag and said is that Macarena?
00:06:03,00:06:09,It's not a good message to be sending 12 year olds at this goes no
00:06:09,00:06:15,This is this is just a little nugget. I enjoyed it went to number one in France
00:06:15,00:06:18,"It went to number one in a number of countries, but not in the UK not in the UK"
00:06:18,00:06:22,because because it was the world by
00:06:22,00:06:26,TLC no one to be by the spice girls. No
00:06:26,00:06:30,"Wow, that's bad look wasn't it because it's like the biggest song of all time"
00:06:30,00:06:37,"But yeah, I'm up against there was a big there was a big gospel around the room at that 20-year-old chopped news. Yeah"
00:06:37,00:06:41,Hey guys and blood be to aces to number one as well
00:06:43,00:06:48,How do you think they were probably sad but quietly confident going? It's all right
00:06:48,00:06:50,We've got Macarena Christmas in the bag. We'll be
00:06:50,00:06:54,We'll be back and then to become one came out they have
00:06:54,00:06:59,So in France they went to number one. Do you know what song they knocked off the number one?
00:06:59,00:07:05,"Oh, it's a French song. No, no, it's gonna regret re-en the only French time anyone knows"
00:07:05,00:07:09,"It was the theme tune to the ex files. Oh, yeah"
00:07:11,00:07:16,That was number one that was number one in France. I think that was the one that you oh it did well in the UK
00:07:16,00:07:22,Isn't that tubular bells Mike feel Mike old field did a cover of it later. How weird is that?
00:07:22,00:07:26,You're thinking the exorcist. Yeah. Yeah. Should we talk about CPR?
00:07:26,00:07:28,Yes
00:07:28,00:07:35,If you have a problem with CPR as in so a lot of people are quite light and it's you need a lot of pressure to get
00:07:35,00:07:38,Someone's just deep enough to get the blood flowing while you wait for the ambulance
00:07:38,00:07:45,So if you are like a tip is to jump on the person who you're trying to administer you could actually be doing the macarena
00:07:45,00:07:46,"Well, kind of yes you could"
00:07:46,00:07:53,"Wow, sorry. I say tip and I like there's no medical advice on this stage. I think I was better say yes"
00:07:53,00:07:56,Don't use this tip. There is a doctor though who does recommend using the feet
00:07:56,00:07:59,I think people have said especially if you're a bit older
00:07:59,00:08:04,You've lost some of your muscle strength and but also advice now or advice releasing 2010
00:08:04,00:08:10,It's always changing is don't do the breathing anymore none of the snogging you just do the hands to the heart
00:08:10,00:08:15,"Don't you just do the heart. So you're doing a bit there isn't so much fun. Yeah, exactly just the jumping up and down"
00:08:15,00:08:19,The mouth to mouth one is really weird because it kind of was discovered in the 18th century
00:08:19,00:08:24,And then it just got forgotten about for about 50 to 100 years and basically no one did it at all
00:08:24,00:08:30,And then it came back and the reason they stopped it is because they realized what was coming out of your mouth when you breathe
00:08:30,00:08:36,"And it's carbon dioxide and they were saying well, what's the point of breathing carbon dioxide into someone's lungs because they breathe oxygen"
00:08:36,00:08:39,"Yeah, and you know what the answer is to know why that's not true"
00:08:39,00:08:47,"No, it's because when you breathe in and breathe out you actually only absorb about 40% of the oxygen sort of still plenty of oxygen in your breath"
00:08:47,00:08:51,"Any kind of oxygen is better than okay, so how long if we started it?"
00:08:51,00:08:56,So if someone breathed in at the edge of the room here and then they passed the breath around the room
00:08:57,00:09:06,"How long would it be before there was no point in that exercise? I think it's worth a try, isn't it? All right. I feel an experiment coming up. Okay. I think we should start with that topless guy. You're in that old"
00:09:06,00:09:10,But people that tried all sorts of weird CPR over the ages
00:09:10,00:09:16,They used to be the barrel type where you there was a big round barrel and you were sort of strapped to it
00:09:16,00:09:23,Face down with your stomach over the barrel and I don't know how you did this so quickly when someone's obviously dying of a heart attack in front of you
00:09:23,00:09:27,And then as the person who's saving them you sort of stood in between their legs and you roll them
00:09:27,00:09:32,"On and off the barrel, don't you? And it was the idea was that it eventually forced your heart into going in really?"
00:09:32,00:09:37,"Yeah, yeah, it's like one of those did you ever go to playgrounds where you would run on a barrel that span round and round"
00:09:37,00:09:39,"Yeah, but I've seen cartoons where that helped. Right"
00:09:39,00:09:43,That will that's medical advice from the Victorian age
00:09:43,00:09:50,"Hey, we need to move on to our next fact shortly. Oh, can I just there was so you know how people are always giving mouth to mouth and CPR to animals"
00:09:50,00:09:52,"Weirdly successfully. Yeah, I've no"
00:09:54,00:10:01,"Yeah, you know how people are always giving mouth to mouth to animals. Weirdly successful. There was a guy this you're gonna talk about the guy this year with the"
00:10:01,00:10:08,"Frog there's a guy this year who did it with a frog after the frog happening here. Oh, is this your fact? No, it's not mine"
00:10:08,00:10:13,Actually mine was the one I was gonna say down. Let's do your effect. You do the frog thing. Let's
00:10:13,00:10:22,"No, this was a this was a deer and it was a deer who was drowning in a swimming pool and an RSP-ZA officer was called and he got the deer out of the pool"
00:10:22,00:10:28,And he gave it chest compressions and see CPR and mouth to mouth. Give it the kiss of life until it choked
00:10:28,00:10:30,He said it properly like in films coughed water into his mouth
00:10:30,00:10:36,And then and then he started choking it then had to give him CPR
00:10:36,00:10:39,Where does the frog come into this? Yeah
00:10:39,00:10:45,And you know the deer got up he brushed it down and then he said the deer looked at him and then ran away
00:10:45,00:10:51,"Sweet, yeah, it's a good story, I know, but I just wonder has anything happened with any smaller maybe amphibious?"
00:10:51,00:10:55,"No, it hasn't I think we're moving on interestingly a frog"
00:10:55,00:11:02,This is a great story. There was a I can't wait this guy was walking just
00:11:02,00:11:06,Minding his own business when he came across a snake on the ground and the snake was choking
00:11:06,00:11:10,And he thought I'm not gonna give CPR to a snake. How could you tell a snake is choking? It was sort of like doing that
00:11:10,00:11:14,"Okay, yeah, yeah, and suddenly out of its mouth shoots a frog"
00:11:14,00:11:18,"So it swallowed the frog, but the the frog forced its way back out"
00:11:18,00:11:25,"Okay, but in the process died the man saw the frog and he gave CPR to the frog and he brought it back to life"
00:11:25,00:11:28,"Yeah, and he brought the rope home. What happens to this snake?"
00:11:28,00:11:31,He doesn't feature in the rest of the story
00:11:31,00:11:44,"All right, look we need to be about to our next fact it is time for fact number two and that is Chazinsky"
00:11:44,00:11:51,My fact this week is that Donald Trump negotiated an extremely bad deal for himself when he wrote the art of the deal
00:11:51,00:11:59,This is because a so Tony Schwartz was a guy who ghost wrote the art of the deal with Trump and he gave a talk a while back
00:11:59,00:12:05,And he openly said Trump negotiated an extremely bad deal with me. I got a great deal out of it
00:12:05,00:12:11,He didn't unheard of things so there was an advance of half a million dollars for the art of the deal and Trump gave his
00:12:11,00:12:15,Ghostwriter 50% of the advance and then 50% of all the royalties
00:12:15,00:12:19,So this guy has just been making millions and millions from this book
00:12:19,00:12:23,This is unheard of in publishing. I think someone who a negotiating professor
00:12:23,00:12:29,Called Deepak Malhotra said there is not a better deal out there in the world for ghost writing
00:12:29,00:12:36,And then when the book came out Trump hosted an absolutely massive party then he and Trump tower
00:12:36,00:12:39,I think it was there was a big red carpet loads of celebrities came
00:12:39,00:12:44,There was a giant cake replica of Trump tower and then he went to his ghost writer and he went well
00:12:44,00:12:49,"You owe me 50% for the price of this party and the ghost writer went, I don't think so"
00:12:49,00:12:54,And he ended up paying about a thousand pounds just fed the drinks that him and his friends
00:12:54,00:12:58,Do you know what the inspiration for the book was for the book the art of the deal?
00:12:58,00:13:04,"No, there was an article all about Trump in GQ and it was a popular article as in that issue of GQ"
00:13:04,00:13:08,So well because Trump was on the front cover. He was a businessman at the time and then they thought
00:13:08,00:13:10,Why don't we see if we can turn this into a book?
00:13:10,00:13:15,So they tested out what the book would look like they designed a dummy cover and then it had a picture of him
00:13:15,00:13:20,looking heroic on the front and then they wrapped it around a thick Russian novel and thought what it would look like a
00:13:20,00:13:23,thick Russian novel
00:13:23,00:13:32,"Guys the clues were there from the stars. Wow. No, okay. All right. Oh, we go"
00:13:33,00:13:38,What's exciting is you've all heard something that won't be in the actual show and we release it so that's
00:13:38,00:13:45,"He has a bad record of deal-making though, right? He's this was actually an article by Jonathan Frieden"
00:13:45,00:13:52,"I think in the Guardian pointed out his deal-making history, but so the apprentice first series extremely successful"
00:13:52,00:13:57,So he asked for an increase in what he was paid. I think it's per episode. He got 50 grand
00:13:57,00:14:00,He asked for an increase to one million dollars
00:14:01,00:14:05,"That's good deal-making, isn't it? That sounds like a deal-making. He ended up with 60 grand"
00:14:05,00:14:12,"But no, a lot of people say not a good deal-maker someone else who's done a deal with him said he seems way too keen"
00:14:12,00:14:18,You've got to seem cool. He sort of paces around the room like he's wearing a sign saying desperate and who said that Vladimir
00:14:18,00:14:20,What was he called?
00:14:20,00:14:22,He chose to remain anonymous
00:14:23,00:14:29,Do you know he he released a novel years ago? Yeah called Trump Tower and and then he
00:14:29,00:14:34,"Effectively unreleased it in that the novel still exists, but he took his name off"
00:14:34,00:14:38,So it was ghost-ridden by someone else and he had his name though
00:14:38,00:14:44,It was a Donald Trump book. It was called Trump Tower and it was a it was a book based on an idea for a TV show that he developed
00:14:44,00:14:49,Which was meant to be Trump Tower done like the TV show Dallas or all those American soaps
00:14:49,00:14:53,It was the life of all the people that worked in Trump Tower and they got a pilot
00:14:53,00:14:57,But the pilot didn't get made so they ended up doing this book and on the front
00:14:57,00:15:01,It said it was the sexiest novel of the decade. Wow. Which decade?
00:15:01,00:15:08,It was 2011 was it was it was old 2011. It's a current. It's he's he's predicted
00:15:08,00:15:16,"We still cannot top the sexiness of this book. Wow. It was an erotic novel, wasn't it? Yeah, that's novel and so I was reading some snippets of it"
00:15:16,00:15:18,It is this is how erotic it is
00:15:18,00:15:26,So someone walks into a room a guest in Trump Tower and sees at least six women not wearing tops and says I must be dead
00:15:26,00:15:28,I've gone to boob heaven
00:15:28,00:15:30,That's an actual line in an actual novel
00:15:30,00:15:37,He's just very quickly. He's also really good for books Donald Trump because anytime he tweets about a book
00:15:37,00:15:39,That he doesn't like it does really well
00:15:39,00:15:43,So for example fire and fury became massive off the back of him taking it down
00:15:43,00:15:48,"Yeah, and there was a very famous. He's a civil rights icon in America called John Lewis and he wrote a number of books"
00:15:48,00:15:54,And he wrote a tweet saying I don't think he's fit for president and Trump took him down massively as a result
00:15:54,00:15:57,The sales increase of his books were over a hundred thousand percent
00:15:57,00:16:06,And in the weekend of the tweet seven of the top 20 books were attributed to John Lewis all his books just rose to the top
00:16:06,00:16:09,"Wow, he's actually good for book sales if he hates you"
00:16:09,00:16:12,"The John Lewis Brown is very different in America, isn't it?"
00:16:12,00:16:19,"Yes, yeah, I've got a couple of bad deals from history. Okay, I've researched so the fact being that"
00:16:19,00:16:23,Trump negotiated a bad deal for the order of the deal. I thought this was quite fun
00:16:23,00:16:27,There's a in America the NFL. There's a team the Green Bay Packers and they had a player called Mirror
00:16:27,00:16:30,MIRER
00:16:30,00:16:34,"Yeah, I never heard of it. Okay. He was he was a big deal back in the day and his contract"
00:16:34,00:16:41,He was so wanted by this team that his agent put a clause in the contract that they eventually the team had to sign and the clause was
00:16:41,00:16:49,"That my mirror would be paid under all conditions, and then this is the clause up to and including the end of the world"
00:16:49,00:16:53,Including the end of the world
00:16:53,00:16:56,So if some people survived and he was one of them and they were one of them
00:16:56,00:17:01,They would still pay him for all the apocalyptic future that they lived through
00:17:01,00:17:04,They were the last two people other
00:17:05,00:17:13,"I've got a bad deal. Oh, yeah, so there's a famous story about the Dutch buying Manhattan Island from the Native Americans for a very small amount of money and"
00:17:13,00:17:17,Them's thinking oh these Native Americans they don't understand the value of property
00:17:17,00:17:24,They don't stand the contact of property rights. They absolutely did the problem was the Dutch bought Manhattan from the Canasi Native Americans
00:17:24,00:17:30,Who happened to live next door in Long Island and did not live in Manhattan?
00:17:30,00:17:34,They only use the island of Manhattan to get drunk in
00:17:35,00:17:39,The Dutch showed up and they offered to buy the place on these people saying is this your place? Oh great. We'll buy this for it
00:17:39,00:17:43,So it's like going to a pub and offering a random man standing outside the pub quite drunk
00:17:43,00:17:47,"100,000 pounds for this building. I got another sporty one"
00:17:47,00:17:51,This is a there's a Swedish soccer player called Stefan Schwartz. Do you remember him James?
00:17:51,00:18:00,So he was paid a four million pound deal with Sunderland for the English Premier League the condition that he had to sign when he was signing
00:18:00,00:18:04,Which for him was a bad deal is he was not allowed to go to space
00:18:04,00:18:06,That was the oh
00:18:06,00:18:09,"Yeah, he wanted to be a space Taurus. He was obsessed with going to space"
00:18:09,00:18:14,"They were like he's obsessed so much. We just have to say no you've got to play football. Yeah, we're gonna"
00:18:14,00:18:18,Put that in the contract to me. That's a deal breaker - is it right?
00:18:18,00:18:26,We need to move on to our next facts. We do that. Okay. It is time for fact number three and that is Andy
00:18:26,00:18:32,My fact is that on the bio tapestry you can tell how important someone is by the size of their horse's penis
00:18:32,00:18:39,"Um, so there's a professor at the University of Oxford. He's called George Garnett"
00:18:39,00:18:44,He has gone through the bio tapestry the whole thing rigorously counting the horses and their penises
00:18:44,00:18:47,And the human there are the same number of penises as
00:18:47,00:18:54,"Well, it might be some female horses. There are some female horses. I've got they didn't have penises. Yeah"
00:18:54,00:18:56,I think they all work for full you
00:18:58,00:19:03,"Um, I think they're written out. I think they might be hidden by a leg or yeah"
00:19:03,00:19:08,Sometimes someone standing in front of the horse or a musically holding a vase in front of the horse
00:19:08,00:19:11,"Yeah, or the horse is wearing a pair of novelty trousers"
00:19:11,00:19:16,"Or it's a pantomime horse and they famously don't have penis. Well, they have two some of them"
00:19:16,00:19:21,"Oh, my horses. Very good point. Um, so he counted all of these and he points out that"
00:19:21,00:19:22,King Harold
00:19:22,00:19:28,Who came second in the Battle of Hastings? He has a horse which has a very large penis
00:19:28,00:19:33,But there's one larger horse penis and that belongs to William the Conqueror
00:19:33,00:19:38,So it's a it's a clear the the man who wins the battle has the largest horse's penis
00:19:38,00:19:42,"Wow, and this is new right this is a brother. No, no Tubby 66"
00:19:42,00:19:50,This is this is new. This is new research. This is breaking. This is to lot of people in the room
00:19:50,00:19:54,This is like this is like the Spice Girls and the Macarena all over again. Yeah
00:19:54,00:20:00,"Yeah, so this is very exciting previously neglected research he counted all the human ones as well"
00:20:00,00:20:03,He did sorry. There are four and a half would you say?
00:20:03,00:20:14,But I think what happened was a lot of people have kind of paid attention to this in the past because in Victorian times
00:20:14,00:20:15,They were all edited out
00:20:15,00:20:22,"Yeah, and there is one guy who had a pair of underpants drawn on him or tapestry on him by the Victorians"
00:20:22,00:20:26,"That was in the in the English one, right? There's an English wrap. Yeah, sorry in the replica"
00:20:26,00:20:30,"Yeah, exactly, but this is the first time people have looked at all of them including the horse ones"
00:20:30,00:20:36,"Yeah, yeah, yeah, so I can believe the so I don't actually know much about the Bay of Tapestry"
00:20:36,00:20:41,"Not being English myself, so this yeah, and it's a frequent topic of conversation in English hubs of children"
