start_hhmmss,end_hhmmss,text
00:00:00,00:00:04,"Hi everybody, before we start this week's podcast, just a quick reminder to remain indoors,"
00:00:04,00:00:11,"and also to say we have an announcement to make. A few weeks ago, as some of you may know,"
00:00:11,00:00:19,we put up back online the second complete year of fish. We put up 52 episodes. We are now doing
00:00:19,00:00:26,"the same thing with the first complete year of fish. Those episodes are all going back up online,"
00:00:26,00:00:31,and they are a kind of insight into how the podcast started in the first place.
00:00:31,00:00:36,"There's lots of crazy brilliant stuff on there, and if you're listening to reverse chronological"
00:00:36,00:00:41,"order, you could notice the sound quality, audibly diminish, like week on week, as we get back to"
00:00:41,00:00:45,the first episode where we had a single microphone and we recorded it in a cupboard.
00:00:45,00:00:51,"So if you'd like to check that out, please do so. There is another amazing thing you can get."
00:00:51,00:00:56,"When we first put out the first year of fish on sale, it had a special accompanying vinyl LP,"
00:00:56,00:01:03,"which was brilliant, and that came with a bonus episode that we recorded. That vinyl is going on"
00:01:03,00:01:08,"a special flash sale this weekend. It's going to be just 12 quid, and you can check it out at no such"
00:01:08,00:01:14,"thing as a fish.com. Also, of course, the cassette tape USB that we did with the complete second"
00:01:14,00:01:18,"year of fish is up there too, if you want to check it out. They're both great fun, and we love"
00:01:18,00:01:24,"working with the companies who made them and made them a reality, so do check them out and enjoy"
00:01:24,00:01:34,"the episodes, and enjoy this episode. Oh, with the show."
00:01:34,00:01:47,"Hello, and welcome to another working from home episode of no such thing as a fish,"
00:01:47,00:01:52,"a weekly podcast. My name is Dan Schreiber. I am sitting here with Anacizinski, Andrew Hunter Murray,"
00:01:52,00:01:57,"and James Harkin. And once again, we have gathered around our microphones with our four favorite"
00:01:57,00:02:04,"facts from the last seven days, and in no particular order, here we go. Starting with you, Andy."
00:02:04,00:02:10,"My fact is that the inventor of condensed milk, Gail Borden, had previously tried inventing a biscuit"
00:02:10,00:02:19,"made of meat. Sounds delicious. I don't like condensed milk, but I've read about this meat biscuit,"
00:02:19,00:02:26,"and it sounds amazing. It kind of sounds a bit like dog food, I think, but for people."
00:02:26,00:02:33,"That doesn't sound amazing, but I guess we have different tastes. He was alive in the mid-19th century,"
00:02:33,00:02:39,"and there were all these problems about preserving food at the time, and feeding large numbers of"
00:02:39,00:02:44,"people at a distance, or at a distance of time, so especially feeding your armies, things like this."
00:02:44,00:02:50,"This was a couple of decades before the Civil War, so he would have known there was a Civil War"
00:02:50,00:02:55,"coming, needed to feed people for that. He had amazing powers of foresight, didn't he, this inventor?"
00:02:55,00:03:02,"Yeah, I mean, incredible, actually. Sort of weird, he didn't make his money out of that, but he invented"
00:03:02,00:03:08,"so much stuff. And one of the things he invented was a beef broth, which he then evaporated into"
00:03:08,00:03:15,"this kind of syrup, and you could either fry or bake that syrup into a biscuit, and it was a universally"
00:03:15,00:03:20,"derided, not actually not, you know, the scientific American said it was one of the best discoveries"
00:03:20,00:03:26,"of modern times. Okay, that was a good review. It also won a gold medal at the Great Exhibition"
00:03:26,00:03:33,"in 1851, but the army tried it, and they declared it was not only unpalatable, but failed to appease"
00:03:33,00:03:39,"the craving of hunger, producing headache, nausea, and great muscular depression. Picky, picky."
00:03:39,00:03:47,But can we talk about some of the other stuff that bored and invented? Because he was incredible.
00:03:47,00:03:52,"So lots of his relatives, very sadly, died of yellow fever. His mother, his wife and his son had"
00:03:52,00:03:57,"all passed away because of yellow fever. So it was a summer disease, predominantly, and one thing he"
00:03:57,00:04:03,decided to invent was a giant refrigerator to keep people in until they got better. That didn't
00:04:03,00:04:12,work. Did you read about the amphibious machine he invented? The Teretqueus. Yeah. It was
00:04:12,00:04:17,"basically one of those things that you get on the Thames in London, wasn't it? Well, like a"
00:04:17,00:04:23,Dock ribbitor. It was a Dock ribbitor. It was built for prairies. It was like a wagon that could ride
00:04:23,00:04:29,"you along the prairies, but then it transformed into a boat at the click of a button or the erection"
00:04:29,00:04:35,"of a sail, I guess, once it hit the water. It was horse drawn, wasn't it, as well? Yes. So I guess the"
00:04:35,00:04:41,"horse stayed on shore. No, you then attached seahorses to it once it got in the water. Yeah, the poor"
00:04:41,00:04:45,"horse didn't get to ride the boat, but it was pretty unsuccessful. I think on its first outing,"
00:04:45,00:04:50,"all its occupants ended up in the water, right? Oh, no. Yeah, it did. So he went out a couple times"
00:04:50,00:04:54,"to the ocean. One time, as you say, it tipped over the people into the ocean. Other times, they were"
00:04:54,00:04:59,"just too afraid to let him take the boat in. And I was reading an account of that, which gives you an"
00:04:59,00:05:04,"idea of other food inventions that he had, because he hosted a dinner before he took everyone out on"
00:05:04,00:05:09,"this boat. And there's a quote, which is from which he talked about the food that he'd concocted"
00:05:09,00:05:14,"that evening out of material, from which if you knew what they were, you would turn to loathing and"
00:05:14,00:05:21,horror. I have transmuted even the dirt itself into delicacies. That was dinner before the horror
00:05:21,00:05:28,"show boat experience. That's brilliant. Interestingly, you know when he invented this biscuit. I just"
00:05:28,00:05:32,"want to go back to the biscuit, which I do think is pretty cool. Yeah, so he invented this biscuit."
00:05:32,00:05:37,"And then he went to the Great Exhibition in 1851. And everyone said it was amazing. Like I said,"
00:05:37,00:05:41,the scientific American said it was amazing. Everyone thought this was going to be the next big
00:05:41,00:05:47,"thing. And so he opened up a big office in New York. Okay, where he could sell these biscuits"
00:05:47,00:05:56,"from. And it was opened on Maiden Lane in New York. And it was, and I can't quite tell from Google maps."
00:05:56,00:06:01,"It was either the same building or it's next door to the building where the Hamilton's song,"
00:06:01,00:06:07,the room where it happens. That room is in a building on the same street and it's either the same
00:06:07,00:06:12,"one or it's next door to it. So are you implying that the song, the room where it happened, is about"
00:06:12,00:06:18,"the room where the meat biscuit almost took off. The original probably was, right? It probably was"
00:06:18,00:06:22,"about the meat biscuit and then they thought, oh, you know what, it's not doing as well as we thought,"
00:06:22,00:06:26,let's change this musical from what used to be about the meat biscuit business. Now let's add
00:06:26,00:06:33,into something about Hamilton. If only. I didn't know what the room where it happens is. I assumed
00:06:33,00:06:37,"it was a metaphor of some kind, but you're saying there's an actual room. And Anna knows the story"
00:06:37,00:06:43,"better than me, but I think is it not where they all got together and decided that the country would"
00:06:43,00:06:48,"be a federal system or something like that? It was the bargaining moment, I think, between Hamilton and"
00:06:48,00:06:55,Jefferson and his second in command who was Madison. And Burr was not allowed into the meeting.
00:06:55,00:07:00,And that's the meeting he wanted to be in because that said that's where power was and meat biscuits.
00:07:00,00:07:06,"Madison actually came out of that with his own set of demands, which is that he wanted to have"
00:07:06,00:07:11,some square gardens named after them in New York. So everyone got what they wanted a little bit.
00:07:11,00:07:19,"Back to Gail Borden for a second. Did you find, so quite a few of the biogs of him say he was"
00:07:19,00:07:25,Biven eccentric and he used to ride around Galveston on a pet bull apparently and he was quite an
00:07:25,00:07:31,"important guy. So he lived in this place called Galveston in Texas, but he actually also helped design"
00:07:31,00:07:37,"it apparently. So this is in 1829, he moved there and then he helped set up all the streets of this place."
00:07:37,00:07:41,And the way they measured streets was it was by the number of longhorn cattle that could move a
00:07:41,00:07:46,"breast down the street. So it shows in Texas at the time what was most important, the most important"
00:07:46,00:07:51,thing to transport. So a hundred foot wide street could fit 14 head of longhorn cattle.
00:07:51,00:07:56,"Wow. And then Borden basically then went on to make his condensed milk, didn't he?"
00:07:56,00:08:01,Andy. Yes. And that's what we know him best for today. So what we know and love him for today.
00:08:01,00:08:06,"But then Borden's milk is like I think in America still perhaps one of the big brands, is it?"
00:08:06,00:08:10,"Yeah it is, but it wasn't called Borden's until after he died I believe. He was actually inspired"
00:08:10,00:08:15,"to make the condensed milk on the way back from collecting his prize for the meat biscuit, right?"
00:08:15,00:08:19,He was obviously on a roll. Yeah. It was on the boat on the way back from London and there was cows
00:08:19,00:08:25,there were cows on board to help feed the young kids on board and they were too distressed to produce
00:08:25,00:08:30,their milk selfishly because of all the waves. And so a lot of the kids on board died and he
00:08:30,00:08:34,thought we've got to have a way of getting milk that doesn't require sucking out the orders of a cow
00:08:34,00:08:39,directly. Well the reason that he became so popular is that his milk was way better than
00:08:39,00:08:45,everyone else's because he had what was called the dairy man's 10 commandments. And if anyone was
00:08:45,00:08:51,going to sell him milk to condense it had to fit him with certain things that he said had to happen.
00:08:51,00:08:56,So for instance they had to wash the cow's udders before milking and they had to sweep the
00:08:56,00:09:01,barns clean and they had to dry the strainer's every morning and night and stuff like that. But he
00:09:01,00:09:05,came up with these specific rules that you had to adhere to if you wanted to give him milk.
00:09:05,00:09:10,"Well he was working on his milk round about the time where milk was incredibly controversial,"
00:09:10,00:09:15,"wasn't he? Because this is the 1850s and I didn't know about this thing, the great milk swill"
00:09:15,00:09:23,"crisis, but I'm sure everyone else knows about it, which is basically this thing happened where until"
00:09:23,00:09:27,industrialisation people really did have a farmer bring a cow round to their door and they'd order
00:09:27,00:09:32,milk from it. So you met the cow and you got to okay it. But with like urbanisation and stuff then
00:09:32,00:09:38,you just had to buy milk without having met the cow firsthand. And so people used to start tampering
00:09:38,00:09:43,"with it. And a major problem was distilleries, always a bit rougish, used to basically set up"
00:09:43,00:09:49,side alleys in dairy farming and they just fill and then they just feed cows all the leftover
00:09:49,00:09:54,"kind of corn, rye, swilly mash and it was really badly infected and they'd sort of the milk would come"
00:09:54,00:09:59,out and it would be a gross watery blue colour and then they'd fill it up with things like chalk
00:09:59,00:10:04,and plaster to make it look white and like real milk. And people were just dying by the bucket load
00:10:04,00:10:09,because these incompetent whiskey makers were trying to give the milk. And so there was this huge
00:10:09,00:10:14,huge crisis and huge controversy and once they cleared that up I think death rates went down about
00:10:14,00:10:19,"five times in New York. Wow. That's so interesting about, sorry to pick up on a very minor thing you said"
00:10:19,00:10:26,"in that really, it's quite intense, I think about my exciting. But meeting the cow they gave you milk"
00:10:26,00:10:33,"and sort of knowing its name, that's why I guess they must have the spokes cow that they have for"
00:10:33,00:10:38,"orders milk which is LC. Yes. Because you would feel like okay LC's in charge here, she's"
00:10:38,00:10:43,she's looking after so they've had over 50 LC's over the year. Do you think everyone in America
00:10:43,00:10:49,thinks that they're all getting milk from this one exhaust account? She puts on such a brave front
00:10:49,00:10:57,"but my girl, she's naked. Yeah. We've mentioned LC before. Anyway, like incredibly briefly, we mentioned"
00:10:57,00:11:03,her when we were talking about I think she was censored because she had others and LC has undergone a
00:11:03,00:11:09,bit of a transformation from the first time she appeared. She used to be a complete cow. She used to be
00:11:09,00:11:15,"actually a cow and then she's kind of started, she was put on her hind legs and she was dressed in"
00:11:15,00:11:20,pinnifles and things and so she was in the kind of uncanny valley between human and cow and I think
00:11:20,00:11:26,"Hollywood censored her because she was a bit too sexy that for a cat, sexier than a cow should be"
00:11:26,00:11:30,basically. You do want to be turned on while you're trying to eat your breakfast cereal. No way.
00:11:31,00:11:37,"The fake cow. Okay. I do actually just if we're on milk, I have one more thing about condensed milk"
00:11:37,00:11:42,because I think I might have found an earlier example of condensed milk which is St. Cuthbert.
00:11:42,00:11:51,"St. Cuthbert was alive in the 7th century AD and he, according to legend, he chopped his own leg off"
00:11:51,00:11:58,after speaking angrily to his parents and it was then replaced with a cast that was made of milk
00:11:58,00:12:04,and so I think that is a possible example of earlier milk conversation. What are you talking about?
00:12:04,00:12:11,"So, you know, miracles happen and if you've cut your own leg off because you've been speaking"
00:12:11,00:12:14,"angrily to your parents and you're a morseful, sometimes God will grant you a new leg and his new"
00:12:14,00:12:20,"one happened to be made of milk. Anyway, there's one weird connection which is that there is a St. Cuthbert's"
00:12:20,00:12:26,cooperative society which was a shop. It's now called Scottmid so it's one of the big Scottish
00:12:26,00:12:38,"grocery shops and they hired in 1944 Sean Connery as a milkman today. No way. Yeah. So, so what's the link"
00:12:38,00:12:49,"again? Well, the Supermarket. It's called St. Cuthbert's cooperative. And Sean Connery got to do"
00:12:49,00:12:56,"that. Has he got a leg made of milk? Yeah, it's the man with the milk he liked. They see"
00:12:56,00:13:01,it with the man with the golden gun. It was one of Cue's less popular gadgets.
00:13:01,00:13:12,"Okay, it is time for fact number two and that is my fact. My fact this week is that in 2014"
00:13:12,00:13:18,four non-related economists with the surname Goodman published a paper about the economics of
00:13:18,00:13:25,surname sharing. The paper was titled A Few Good Men. Very clever. You've got to wonder what came
00:13:25,00:13:31,first that title or any of the rest of it. Actually none of them was called Goodman when they first
00:13:31,00:13:36,"started the paper. They all had name changes. Well, they were very strict about that actually because"
00:13:36,00:13:41,they claimed that this is the first paper co-authored by four non-related surname sharing economists
00:13:41,00:13:45,and there was a thought that this could be challenged because there was a paper published by
00:13:45,00:13:53,"Scarbeck, Scarbeck, Scarbeck and Scarbeck back in 2012. But they disqualified it from beating them"
00:13:53,00:13:57,to it because they said it was written by two brothers and there are two wives. So they argued that
00:13:57,00:14:04,first the fact that the two wives had their maiden names before they started the paper and then
00:14:04,00:14:10,took on the name Scarbeck disqualifies them. So they did it during the research and also one of the
00:14:10,00:14:16,brothers and his wife are not economists. They're attorneys and so that also knocked them out. They were
00:14:16,00:14:22,very thorough. So in this paper they looked at how likely it is for other groups of economists with
00:14:22,00:14:29,"the same name to share papers, didn't they? They had a data set with loads of names of economists and"
00:14:29,00:14:34,they found that 45% of them share a surname with at least one other economist. So I think that it
00:14:34,00:14:40,might be helpful. But the main reason that they think this whole thing might help is that if you
00:14:40,00:14:45,have loads of people with the same name then you don't have that problem where the paper is by Dan
00:14:45,00:14:52,Schreiber et al and we don't see who the other people who wrote the paper are. Why do they just pluralise
00:14:52,00:14:58,this surname basically? By four Goodmans. They just say by Goodman et al but they don't refer to exactly
00:14:58,00:15:06,which Goodman is the first Goodman. So actually everyone is getting equal billing. It's like if we
00:15:06,00:15:11,all changed our name to Toshinsky and then we went to do a gig and then in big lights on the
00:15:11,00:15:15,"theatre it said Toshinsky, Toshinsky, Toshinsky, Toshinsky and Toshinsky. We wouldn't know who was the"
00:15:15,00:15:20,"top of the bill. Of course it would be me but we wouldn't know who it was. Yeah, exactly. I'm not"
00:15:20,00:15:26,fully for that. I'm not rocking up to a fish gig with Harkin and et al. Nice try buddy.
00:15:26,00:15:30,I wouldn't think about surnames and actually this is a Beatles fact so Dan I'm probably going to
00:15:30,00:15:37,defer to you on this one. But is it the case that Paul McCartney wrote yesterday? Yes.
00:15:37,00:15:45,This quiz is easy. All right. Next. Okay. No but I read that John Lennon became furious when he
00:15:45,00:15:50,was in hotels because quite a lot of the time the person playing the piano in the hotel would play
00:15:50,00:15:56,yesterday as a tribute to him and he hadn't written any of that song at all. It wasn't a Lennon
00:15:56,00:16:02,"McCartney song. It was just a McCartney song and so that made him furious. Yeah, that's true. Yeah."
00:16:02,00:16:10,"So if you're if you ever see Andy in a hotel and you want to pay tribute to him,"
00:16:10,00:16:14,don't play him the episode of No Switch Things A Fish where Alex Bell was here instead of him
00:16:14,00:16:19,because that'll just annoy him. Exactly. I'll be so angry. I'll be amazed at your piano skills
00:16:19,00:16:27,if you can play that. Go imagine those poor penis getting requests. Do you know episode 313?
00:16:27,00:16:34,"No such thing as a banana with Wi-Fi? It's the same, dude. Everyone's the same."
00:16:34,00:16:42,I'm on surnames in academia and problems at this poses. So the same surname problem is a
00:16:42,00:16:49,"serious issue and it's especially an issue in China because in China there are 200,000 people per"
00:16:49,00:16:55,"unique surname. So they've got far fewer surnames in China and I read a piece written by a Wang,"
00:16:55,00:17:04,"a J Wang, who is saying there are more than 1200 J Wangs in nano-science alone. So this is hell."
00:17:04,00:17:08,"So if you want to find an individual academic, you can't find them because you have, you know,"
00:17:08,00:17:13,"200,000 Wangs to deal with. So now in academia you get something called your orchid, which is"
00:17:13,00:17:19,"standardized now across most journals. So rather than being one of a billion, you know, Smiths,"
00:17:19,00:17:24,"Wangs, you have to have a 16-digit number. But there is an issue because dead scientists probably"
00:17:24,00:17:30,won't sign up to this orchid system because they can't. And so the worry is that now if you're a
00:17:30,00:17:33,"deceased scientist, your academic work is going to become harder and harder to source."
00:17:33,00:17:41,"So have you guys heard of Dick Astman? No, I've never heard of it. He was a gas station employee from"
00:17:41,00:17:47,"Canada and his name, if you look him up on Wikipedia, his name propelled him to celebrity status across"
00:17:47,00:17:56,"North America for four months in 1995. Wow, that is like the, who is it? The Andy Warhol, isn't it? It's"
00:17:56,00:18:02,"there. Everyone has their four months of fame. Yeah, exactly. I think it's because David Letterman"
00:18:02,00:18:06,"found out that there was someone called Dick Astman. He found this so funny that he, you know,"
00:18:06,00:18:14,"kept on referring to him. This became known as Asmania and eventually, eventually, his dad, by the way,"
00:18:14,00:18:19,"was called Adolf Astman, which is amazing. I mean, what an amazing. Yeah. Wow. If you were only"
00:18:19,00:18:24,"allowed to change one of those names, it's so hard to know which shoes."
00:18:24,00:18:35,He became super famous and then he faded into obscurity. But there was another Astman recently who
00:18:35,00:18:40,"got in trouble over a vanity license plate. Another Canadian, I believe, who had Astman on his license plate"
00:18:40,00:18:44,"and the authorities said, ""No, you can't have that."" Anyway, that's that name. I have a very random"
00:18:44,00:18:51,"surname fact while we're just lobbing in some good old surname. I just read this late last night,"
00:18:51,00:18:57,"Silla Black, the singer and TB show host. I found out what her real surname is. Do you guys know"
00:18:57,00:19:04,where her real surname is? No. Silla White. And she only got the name change as a result of a
00:19:04,00:19:09,misprint in a mercy beat newspaper when she was starting out that called her Silla Black. And she
00:19:09,00:19:15,"just went, ""Oh, that's a bit of a misprint, isn't it?"" It's a massive type. Yeah, it's not a type"
00:19:15,00:19:25,"or an old. It's literally the difference between black and white. Yeah, good, cool. But I can't believe"
00:19:25,00:19:30,"she styled it out and just went, ""Oh, yeah, yeah, that's me."" Like, when a boss says your name wrong in"
00:19:30,00:19:35,"a meeting, you just go, ""Okay, I guess I'm Mike for this meeting."" Yeah, she did it for her whole career."
00:19:35,00:19:44,"Okay, it's time for fact number three and that is Anna. My fault this week is that if you wanted to have"
00:19:44,00:19:52,"a bath in Paris in the 1820s, you could have one delivered to your door. This is the bath delivery"
00:19:52,00:19:58,service. Did you have to take the bath outside of the door or could you bring it into your house?
00:19:59,00:20:03,"Oh, what? It was brought into your house. Sorry, so it was delivered to your door and then up your"
00:20:03,00:20:08,stairs and into whatever room you chose to bathe in. So this was called the Bant and Domicille
00:20:08,00:20:14,"and it was so popular in Paris in the 1820s. And yeah, someone would come along, a guy called"
00:20:14,00:20:20,a thermo floor would deliver a bath to your doorway and then they'd also bring these metal rails
00:20:20,00:20:26,"so they could wheel it up the stairs on these rails, plunk it down. They also came with a dressing"
00:20:26,00:20:33,"gown and a towel and you could order your flavour of bath. So if you wanted a hot bath, you would say,"
00:20:33,00:20:37,"if you wanted a refreshing cold bath that I may have been less money, I don't know, but that was"
00:20:37,00:20:42,"also an option. I know when you say flavours, I don't usually associate hot and cold as flavours."
00:20:42,00:20:48,So was there any of the anything else that you could choose like pistachio?
00:20:48,00:20:55,"I think there was one other choice. Mineral. Yeah, it's not again, not a flavour. Mineral is not a flavour."
00:20:56,00:21:00,"Well, I think it spices up bath time a bit if you do refer to them as flavours."
00:21:00,00:21:04,"Turn on the hot flavour, cold flavour. Sure. Try it next time."
00:21:04,00:21:09,I love the fact that they brought a longer towel. That feels like the least important bit of the
00:21:09,00:21:15,entire enterprise. What? So was there a porcelain bath they were bringing? Or was it made of something like?
00:21:15,00:21:20,"Andy, what do you do? Do you just trip dry whenever you get out of the bath? Of course I do."
00:21:20,00:21:24,Of course I do. Just stand in the street letting nature do its work.
00:21:24,00:21:30,"It's very important to bath time to have a towel, obviously."
00:21:30,00:21:34,Do you jump out like a dog and shake all of the water off you?
00:21:34,00:21:38,I just shake it off once and then I'm normal again.
00:21:38,00:21:43,"Sorry, you were saying, was it a porcelain? Anna, was it porcelain?"
00:21:43,00:21:50,"They were made of various different materials. Apparently someone made of leather and some were foldable,"
00:21:50,00:21:57,"pleabla, apparently, said in one article. But I guess if it was leather and you had like a hot"
00:21:57,00:22:02,"flavoured bath then it might what? I don't, maybe they had better technology that we've now forgotten."
