start_hhmmss,end_hhmmss,text
00:22:02,00:22:08,"Like secret leather, yeah. Yeah. I love the bath. Your playing is a weird sex game."
00:22:08,00:22:15,I must have been a no questions asked service.
00:22:17,00:22:22,"Anyway, what a great service. It seemed to sort of disappear, as I guess trends do."
00:22:22,00:22:28,I think there were a thousand of these baths for Rent in Paris by the mid-1820s.
00:22:28,00:22:33,And then they receded again. Bathroom was a bit controversial. I think some people thought it was a bit
00:22:33,00:22:38,"lascivious. There was a famous prostitute, a quarter-seff, French quarter-san, who had two baths."
00:22:38,00:22:42,"And that was a bit frowned upon. Like, oh, that's the kind of thing courtesans do."
00:22:42,00:22:47,"And one of her baths that was made of silver, she had three taps."
00:22:48,00:22:51,One of which delivered water and another delivered milk and the other champagne.
00:22:51,00:22:56,"Just on the flavour thing though, because James was saying stuff about, what did you say? Like"
00:22:56,00:23:00,"almond and stuff like that? I said pistachio, but it was just the first flavour that came into it."
00:23:00,00:23:06,"Yeah, but that was a thing. Like, there was the sort of prototype back then of the bath bomb that"
00:23:06,00:23:12,"gives the colour and aroma that you get with them in the form of things like clouded, powdered,"
00:23:12,00:23:19,almond paste. And then milk was another big one. And largely I think that was a modesty thing for women.
00:23:19,00:23:24,"The idea was that you would have the bath, not necessarily in a bathroom, but possibly in an open room."
00:23:24,00:23:28,And so it just created a layer of camouflage to stop your bits from being seen.
00:23:28,00:23:34,"You see that, but I think, let's say you have some nice redox in your bath or something,"
00:23:34,00:23:38,"and it smells of lavender, then you come out of your bath and you smell like lavender."
00:23:39,00:23:44,I probably don't want to smell like milk after you get out of the bath. Don't you know what I mean?
00:23:44,00:23:49,"I like milk. I wouldn't mind smelling like, is the milk fresh? That's the big question."
00:23:49,00:23:52,"To begin with, it will be. That's a really good challenge."
00:23:52,00:23:58,"If you're using the Peyton Murray drip dry method, then over time that milk will curdle."
00:23:58,00:24:03,"Also, I don't know how clean you can claim you are if you're stepping out of the bath and you're"
00:24:03,00:24:08,sort of covered in bits of pine nut and almond seed and whatever else it was that they had.
00:24:08,00:24:12,"Well, there was another thing where you used to have, and this was more for the aristocracy,"
00:24:12,00:24:15,"you would have two baths. So you would have the bath that had the bath bomb in it,"
00:24:15,00:24:19,"like the milk and the almond, you'd go in and wash down, then you'd get out and go into your next bath,"
00:24:19,00:24:24,"and that would be just the clear water, and you could just wash in the purity of that and then get out."
00:24:24,00:24:28,"According to the Smithsonian, I read this on the website. Sometimes you wouldn't actually get"
00:24:28,00:24:34,into your actual bath. You would wrap yourself in blankets and then you would lie or sit on sticks of
00:24:34,00:24:41,wood which were balanced across the tub of water. I can't believe this is true. You're being steamed.
00:24:41,00:24:46,"Yeah. Basically, yeah. I mean, I really can't believe this is true. Is that to make you more healthy"
00:24:46,00:24:51,"to consume and to give you a more satisfying crunch? That's why you do it to broccoli, isn't it?"
00:24:51,00:24:58,"It's weird that we're talking about baths in this one, and someone we've talked about earlier"
00:24:58,00:25:07,"in this podcast has quite a strong connection to bathing. Adolf Asman. Adolf Asman, I dread to think"
00:25:07,00:25:15,of the bath that he'd come up with. Gelborden of meat biscuit fame. Also invented a wagon which
00:25:15,00:25:20,"women could wheel down the beach into the shore, and then they could descend from there into the water"
00:25:20,00:25:24,"without anyone saying them, which we had in the Victorian era, but he invented that in America,"
00:25:24,00:25:30,"that's the ladies to use, so a bathing entrepreneur as well. Do you guys know who invented the"
00:25:30,00:25:37,"heart shaped bath tub? No, I can't believe they're not famous for it though. Have you guys heard of"
00:25:37,00:25:44,"the heart shaped bath? No. No. Okay, so this is a thing in America, I think, which is where you have"
00:25:44,00:25:50,"a bath tub which is shaped in the classic heart, you know, so I guess the two of you sit, it's for"
00:25:50,00:25:56,"couples. The invention of this thing was a guy called Morris Benjamin Wilkins, and I just, I like him so"
00:25:56,00:26:02,"much this guy, because he served in the US Navy, he was in submarines, and then he came out of the navy,"
00:26:02,00:26:07,"came out of the submarine and decided to invent a new kind of bath tub, I guess, to preserve a bit"
00:26:07,00:26:13,"of the submarine experience. And again, that's the opposite. That's the opposite experience."
00:26:15,00:26:22,"In a submarine, you're out of the water. You're right, if you wanted to do that, he would just be in"
00:26:22,00:26:28,the sheath inside the bath. Yeah. He would be in like a metal sheath. Yeah. Okay. Or laying on the
00:26:28,00:26:33,twigs above the bath like your other invention. Did he get fired from being a submarine? Because
00:26:33,00:26:41,"you get trying to fill up the submarine. Okay, I badly misspoke. He hated submarines so much"
00:26:41,00:26:48,"that he vowed to create the opposite of a submarine, which was a bath. But he, he, if you look him up,"
00:26:48,00:26:53,"again, on Wikipedia, it says that he is credited with making the Pocono Mountains in Northeast"
00:26:53,00:26:59,"Pennsylvania, the honeymoon capital of the world. Now, I have never heard of these mountains before now,"
00:26:59,00:27:04,"so I don't know if they really are. But he invented this bathtub, and then he was so emboldened by it,"
00:27:04,00:27:10,"Wilkins, that he went on to create the champagne glass bath tub. This is unbelievable. It's seven,"
00:27:10,00:27:16,"it's an actual champagne glass, and you know, one of the shallow ones, not a very high flute."
00:27:16,00:27:22,"That'd be a disaster. One that's based on Murray Antoinette's press. Exactly. Yes. And it's, it's that"
00:27:22,00:27:27,"shallow shape of a coupe, and you can both sit in there, but you are seven feet off the ground,"
00:27:27,00:27:33,"and supported by this incredibly narrow look. Wow. Yeah, it's really cool. How do you get in there?"
00:27:33,00:27:38,"Oh, I think you need a ladder to get in there. No, you're in, you're in a much higher champagne"
00:27:38,00:27:46,"flute, and you kind of roll over the edge into that. Okay, it's time for our final"
00:27:46,00:27:51,"fact of the show, and that is James. Okay, my fact this week is that dogs can suffer from a"
00:27:51,00:28:01,"sprained tail if they get too happy. Sweet. So nice. Yeah, it's sweet, isn't it? So this, I read"
00:28:01,00:28:07,"about this in a news article about Rolo, who was a seven-year-old Daxund, who managed to strain his"
00:28:07,00:28:14,"tail by wagging it so hard. His family are at home a lot more at the moment, and so he's always happy"
00:28:14,00:28:20,"because his humans are around. And so he kept wagging his tail, and he strained the ligaments."
00:28:20,00:28:26,And it turns out that strained tails is a thing with dogs that you need to worry about. I've never
00:28:26,00:28:30,"had a dog, so I didn't know about this, but apparently it's a problem. How problematic is it? Because"
00:28:30,00:28:34,"their tails aren't offering that much, are they? A bit of balance, but if you sprain it, it's not"
00:28:34,00:28:41,like an ankle. I guess it's just more painful than awkward for their lives. It's a thing called
00:28:41,00:28:47,"limber tail. It's also called dead tail, swimmers tail, cold tail, frozen tail, sprained tail,"
00:28:47,00:28:54,"limp tail, sprung tail and broken tail. Lots of synonyms for it. Did you say swimmers tail? Swimmers"
00:28:54,00:29:00,"tail, because that's one of the main times you get a sore tail if you're a dog. If you get swimming"
00:29:00,00:29:07,"in water that's too cold or too hot, so either of the flavours, then it narrows the space"
00:29:07,00:29:15,"where your spinal cord goes through, and that can cause basically the bones to rub against the"
00:29:15,00:29:20,"ligaments and stuff, and that can cause problems and cause you to have injured ligaments."
00:29:20,00:29:23,"Ouch, so always request the mineral option for your dog bath."
00:29:23,00:29:28,"It's exactly, yeah. Is this quite common, James? Is this something that a lot of people"
00:29:28,00:29:33,"who have dogs are off to have the vet for? I don't think it's the most common thing in the world,"
00:29:33,00:29:37,"but it is definitely a thing that happens if you look on the internet and Google ""Engine"
00:29:37,00:29:44,"Tail."" Like I say, I don't have a dog, and I do have a cat and she seems fine. Yeah, it's not as"
00:29:44,00:29:50,"common as worms, is it? No, it's less common than worms, but more common than being hit by a meteorite."
00:29:50,00:29:56,"I've grown up with dogs and we never had to take them to the vet for a sprained tail, but then we"
00:29:56,00:30:03,made sure they were never happy. Just didn't want the hassle. It's not just happy that they
00:30:03,00:30:08,"wag their tails when they are, right? It's strong. They do it when they're angry, they do it when"
00:30:08,00:30:13,"they're about to attack. There's different kinds of wax, and I was reading, there was a guy"
00:30:13,00:30:23,"called Dr. Roger Mugford who invented a wagometer, and the wagometer, so Dr. Mugford, probably best known"
00:30:23,00:30:27,for retraining Prince Anne's bull terrier dotty after a bit two boys. That's how I know him.
00:30:27,00:30:36,"Best known. Unbelievable. So he created the wagometer, which can indicate whether or not the dog is happy"
00:30:36,00:30:41,"or angry or about to attack, and it's a sensor that's attached to its tail. What it's used for, though,"
00:30:41,00:30:47,"is when they do dog shows, they want to sometimes tell who's the happiest dog, so the wagometer"
00:30:47,00:30:54,"is put on the dogs, and it monitors the wag that's going on to then officially scientifically"
00:30:54,00:30:59,using Mugford's wagometer to determine who the happiest is. I think we're all Mugford's here.
00:30:59,00:31:05,"They do definitely have different wags, though, that you can kind of tell, so if it's,"
00:31:05,00:31:11,"apparently if they do like a really slow, quite stiff wag, then that's when they're saying, go away,"
00:31:11,00:31:17,"I might attack you, I'm anxious. But left and right is the difference, too. So if they I had no idea"
00:31:17,00:31:22,"about this before looking this up, that a tail wagging to the left is negative emotions,"
00:31:22,00:31:26,and wagging to the right is happy. And I thought that dogs just wag their tails left and right.
00:31:26,00:31:30,"Yeah. The wag was a wag. I would have thought a wag would be left and right,"
00:31:30,00:31:36,"then left and right. Exactly. Yeah. Oh no, they lean. They tend to one side, unless our dogs"
00:31:36,00:31:41,"are a bit lopsided, but they don't. Is it a stage left or? Is it a dog's left or is it my left?"
00:31:41,00:31:45,"It's the dog's left. Yeah. Is that important to know? It's from the perspective of the dog,"
00:31:45,00:31:50,"because it's about brain hemispheres, right? The same is in Yemen. So amazingly, they've got similar"
00:31:50,00:31:55,"brain hemisphere responsibilities as we do. And so when they're wagging to the right and they're happy,"
00:31:55,00:32:01,that's because the left side of their brain is kind of active when they're feeling relaxed and chill.
00:32:01,00:32:05,And then the right side of their brain is active when it's an emergency. And so that's why they
00:32:05,00:32:09,"then wag the left. That's where, because whenever I do the hoki-koki, whenever I put the right"
00:32:09,00:32:13,"leg in, it always feels really relaxed. But then as soon as I put the left leg in, I feel really anxious."
00:32:13,00:32:25,You're misaligned. There are researchers at Keo University. They have invented a tale for humans.
00:32:25,00:32:33,That's great. So a full-sized tale for humans. And the idea is that it will help you to walk around
00:32:33,00:32:39,bend over and anything that you might find a little bit tough to do because your body has
00:32:39,00:32:45,"things that it can't do. The tale will just help balance you. When you say a full-sized tale,"
00:32:45,00:32:50,"do you mean are we talking kangaroo length or are we talking dog length? More kangaroo-y than dog,"
00:32:50,00:32:55,because it has to balance your entire upper body. So let's say you're running a bath and you have
00:32:55,00:33:01,to bend over. I've got a shower kind of screen next to my bath. So it's kind of hard to bend
00:33:01,00:33:06,"around and turn my bath on without getting in the bath. But if I had a tale, I could do it easily,"
00:33:06,00:33:10,because that would just balance me out. And I could kind of bend my body in any direction. And it
00:33:10,00:33:17,"might be useful, especially for elderly people who have, like, limited mobility. It might help them"
00:33:17,00:33:21,to bend over and reach things that they can't normally reach. So it might be that when you get to a
00:33:21,00:33:27,"certain age, you get a tale attached. That would be amazing. Something to look forward to."
00:33:27,00:33:33,"It's not surgically attached, is it? They just sort of strap it on you. At the moment, it's strap-on."
00:33:33,00:33:39,"Well, that'll bring a bit of spice to the 70th birthday party, won't it?"
00:33:39,00:33:47,"Granddad, we bought you a strap-on. It's a hell of an intimidating strap-on to walk in a room on"
00:33:47,00:33:51,"kangaroo length. Whoa. You've got it on the wrong side, Granddad."
00:33:52,00:34:01,"It's supposed to be sticking out the back. Oh, Jesus. Oh, dear. Some sheep, when they're nursing"
00:34:01,00:34:06,they're young. They get so carried away grooming newborn lambs that they lick off their entire tails.
00:34:06,00:34:12,"Wow. They sort of chew them. They're chewing the larger chew out some of the debris in their fur,"
00:34:12,00:34:16,"but they really love them. You know, sometimes a parent, if you really love your baby,"
00:34:16,00:34:20,"you've got a baby, Dan. You kind of want to sort of bite it. But they're in, they'd like that,"
00:34:20,00:34:25,"and they accidentally chew off their tail. Dan, this child's leg is made of condensed milk, so it's a bit"
00:34:25,00:34:32,"easier for him. That is remarkable, though. Like, wow. You'd resent your parent. Do you know why"
00:34:32,00:34:38,rabbits have white tails? No. I've always thought. It does seem stupid. Because whenever you see a
00:34:38,00:34:42,"rabbit running around in the countryside, they're really easy to spot because they have this white,"
00:34:42,00:34:46,"fluffy tail that jumps around. Yeah. And you can see them from anywhere, so you would think that"
00:34:46,00:34:52,"a fox would have the same skill, right? Well, it turns out that while you do notice them immediately,"
00:34:52,00:34:56,they're really good for kind of tricking you as to which direction rabbits go.
00:34:56,00:35:01,"Because if you do see a rabbit running away, they kind of dart from left to right, from left to right."
00:35:01,00:35:06,"And so when they're directly in front of you, you see the tail, but as soon as they dodge to the left,"
00:35:06,00:35:10,"or the right, you can't see the tail anymore. You can only see the dark, but you can't see the light"
00:35:10,00:35:15,"bit. So for a second, you can't tell whether they've gone left or right. So basically,"
00:35:15,00:35:19,"confuses any predators. So that's so good. Yeah, it's really good."
00:35:19,00:35:25,"Tail decoys and animals are so fascinating, like how, you know, how lizards can just drop their"
00:35:25,00:35:32,"tail off. I was reading about geckos and the fact that the way that their tails are made up,"
00:35:32,00:35:38,"they're kind of like toilet paper. They're kind of serrated already. They're pre-serrated, so that"
00:35:38,00:35:43,they help the process of the tail to be bitten off by clenching muscles. They're actually
00:35:43,00:35:48,"actively part of it, which is why if a gecko is already dead, it's much harder to bite off its tail,"
00:35:48,00:35:54,"because it's not helping the animal eating it to do it. Yeah. And there was this really cool thing,"
00:35:54,00:35:58,"which is it's very fatty, their tails. And so if the predator then pursues the gecko and the"
00:35:58,00:36:03,"gecko still gets away, the gecko will then go back and eat the tail, because it's so fatty,"
00:36:03,00:36:09,"it's got so much nutrients in it. Yeah, so it's effectively also an emergency meal for them."
00:36:09,00:36:14,Do we know if they sort of cry as they're doing it? Because I think if you had to eat your own limb to
00:36:14,00:36:19,"survive, you would. Yeah. Crocodile tears, but even so. Actually, the longest tail in nature is a"
00:36:19,00:36:25,"lizard, isn't it? Which can be deposited at will. It's the Asian grass lizard, which looks so funny."
00:36:25,00:36:32,"It looks like a child got carried away when drawing the tail. So its tail, its tail is 25 centimeters,"
00:36:32,00:36:38,"which is over three times the length of its body. It's so sweet. And I also quite like the term,"
00:36:38,00:36:41,"the terminology when they're talking about the length of lizards compared to their tails,"
00:36:41,00:36:49,"they talk about snout to vent. Snout to vent, length is six centimeters. Is the vent the bottom? The"
00:36:49,00:36:56,"vent is the bottom, yes, from which you vent air and other things. I just like that phrase, how"
00:36:56,00:37:02,"tall is he snout to vent? Yeah, that's true actually, because people who have long legs"
00:37:02,00:37:07,"is like having a long tail, it's not as important, is it? Yeah. The most important bit is from your"
00:37:07,00:37:13,nose to your anus. Yeah. That's really what happens below that is just incidental. I agree. All these
00:37:13,00:37:25,"basket bull is bragging. Snout to vent, they're barely different to us. Okay, that's it, that's all"
00:37:25,00:37:29,of our facts. Thank you so much for listening. If you'd like to get in contact with any of us about
00:37:29,00:37:33,"the things that we've said over the course of this podcast, we can be found on our Twitter accounts."
00:37:33,00:37:40,"I'm on @Streiberland, James. @JamesHarkin, Andy @AndruhunterM, and Shazinsky. You can email"
00:37:40,00:37:46,"podcast@QI.com. Yeah, but you could go to our group account at no such thing or our website. No such"
00:37:46,00:37:50,"thing as a fish.com. We've got everything up there from all of our previous episodes, and when we"
00:37:50,00:37:55,"say all, we mean all. Every single one that disappeared from the internet a couple of years ago is"
00:37:55,00:37:59,"back up there, so there's over now a hundred episodes for you to re-listen to from the first and"
00:37:59,00:38:04,"second years of fish. And also, if you'd like to buy the cassette or the vinyl, they're there too."
00:38:04,00:38:08,"And we will be back again next week with another working from home episode. Guys, we really hope"
00:38:08,00:38:13,"you're doing okay. Stay home, stay safe, love to your family. We'll see you again next week. Goodbye."
00:38:13,00:38:27,"Let's say, for instance, oh, I get hear birds. Yeah, I can too. Yeah, me too. Yeah."
00:38:27,00:38:33,"Anna, can you hear birds in the foreground? Is that a problem? That's a problem, isn't it?"
00:38:33,00:38:40,"I'm recording outside the space. Maybe next time, don't keep fish and chips next to your computer."
00:38:40,00:38:43,"Anna, is this your pitch to be on Tested Island dish?"
00:38:44,00:38:46,[laughter]
00:38:46,00:38:58,[music]
