start_hhmmss,end_hhmmss,text
00:21:33,00:21:40,"So there's a statue of the little mermaid in Copenhagen, which I think is one of the most suffering statues of all time, right?"
00:21:40,00:21:44,"So, yeah, she's she's in the harbor. She's sitting on a rock. She's beautiful"
00:21:44,00:21:50,"She's washing her hair or something whatever, but she's hands Christian Anderson's little mermaid because that's his original story"
00:21:50,00:21:54,"Which is very different. It's a bit more gruesome in the ending. You know, it's not quite as Disney-ish, but it's you know"
00:21:54,00:21:56,It's a classic fairy tale
00:21:56,00:22:01,"Anyway, this statue has been absolutely through the ring. All right, she was decapitated in 1964 and"
00:22:01,00:22:04,1998 her right arm was cut off in the 80s
00:22:04,00:22:09,She was partially decapitated in 1990 in 2003. She was blown up with dynamite
00:22:09,00:22:13,This statue has just had it people haven't go at this statue all the time
00:22:13,00:22:17,"I think it's exciting. Oh, just because she's so famous. She's such an icon. Well, it's all sorts of reasons"
00:22:17,00:22:21,So what there was one group of radical feminists who claimed
00:22:22,00:22:26,That they had done it to sort of point out to create a simple
00:22:26,00:22:32,They claimed they're kind of a head to create a symbol of the sexually fixated and male misogynist dream of women as being bodies without heads
00:22:32,00:22:34,I point well made I think
00:22:34,00:22:38,Didn't they then find that actually they didn't have enough evidence and they probably didn't do it
00:22:38,00:22:43,"So they set a murder squad on the case which I love, you know, they all like every single time she's been defaced"
00:22:43,00:22:45,They get the murders
00:22:47,00:22:54,But basically in 1990 an anonymous tip tip-off guy rang up a TV camera man
00:22:54,00:22:57,Freelance TV camera man called Michael Poulsen and said go and check out the Little Mermaid's head
00:22:57,00:23:03,It's gone and he got to the scene of the crime and though two people apparently roller skating away saying too late and
00:23:03,00:23:10,Then on day four the head turned up and it was returned by a masked figure to a TV station
00:23:10,00:23:16,And the return happened to be filmed by a freelance TV camera man called Michael Poulsen
00:23:16,00:23:23,who was the one who got the original beheading scoop and he made lots of money selling both sets of shots and he was arrested as
00:23:23,00:23:28,Having maybe and doing it himself and did he get found guilty or he was released
00:23:28,00:23:31,He was questioned and then released so it wasn't him in the end
00:23:31,00:23:35,But it was thought that the whole thing would be done as a kind of thing to get some PR
00:23:35,00:23:41,"But that wasn't it. No, I don't know if they got the 1991. Is it hard to decapitate a statue? Oh, yeah"
00:23:41,00:23:46,"So that's a lot of that bronze is hard to bronze is hard. Yeah, I'm surprised that they managed to do it"
00:23:46,00:23:50,"Yeah, it seems to have just been hacked sword off every time whenever I've been there"
00:23:50,00:23:54,There's always a lot of tourists nearby so like you'd have to do in the middle of a night or something
00:23:54,00:24:01,"Yeah, I think they do. Yeah, I think it was exciting for her because biggest statue must be mostly so boring"
00:24:01,00:24:05,There was an article in 2017 written in June and said literally by June that year
00:24:05,00:24:11,"She'd already Warner Birker held a sex toy and been covered in paint twice. I mean, what a gig"
00:24:11,00:24:16,"Yeah, unless you're a racist as a statue, you see no action basically"
00:24:16,00:24:21,"But she's not she's not racist. No, no, no, but I'm just saying the only other stat"
00:24:21,00:24:27,"Yes, arguably I don't know what people's motivation was but probably when she was wearing a Birker holding a sex toy"
00:24:27,00:24:31,She was racist at that moment. I don't know. I don't know. She was doing them both at the same time
00:24:31,00:24:33,I don't know if that makes it better
00:24:33,00:24:35,Is she complicit to
00:24:37,00:24:44,"You know the Millennium dome. Yeah, man, think of it from above, right? Yeah, what does it look circle like a yeah"
00:24:44,00:24:48,What else does it feature some like there's like some wires that go down to that?
00:24:48,00:24:52,"Yes, there's that and you can actually walk over the top of it now"
00:24:52,00:24:56,It's a cool tourist thing you can do. There's a massive hole in the side of the Millennium dome
00:24:56,00:25:04,"That no one ever talks about okay, and what it is is it's got it's a huge tower like a ventilation tower for the"
00:25:04,00:25:08,Blackwall tunnel which runs under London and they needed to have a vent tower
00:25:08,00:25:11,No way they said but that's where we want to build the Millennium dome
00:25:11,00:25:12,"They said well, sorry"
00:25:12,00:25:17,That's where our big towers going and it's just in the middle of the Millennium dome and they convinced them by saying don't worry
00:25:17,00:25:18,No one will notice
00:25:18,00:25:22,It turns out you're the first person to notice. We just not pay attention to it. Look at it
00:25:22,00:25:24,It's got a massive hole in the top
00:25:24,00:25:29,"That's really weird. This big tunnel in Norway has a ventilation. Oh, yeah, this net"
00:25:29,00:25:36,"Yeah, I think halfway through we mentioned in the podcast few weeks ago that you need to have these big fans in tunnels to make sure that the"
00:25:36,00:25:40,Air goes through but not just Andy standing in every tunnel saying
00:25:40,00:25:51,But the one in Norway it comes out and like the top of a mountain somewhere
00:25:51,00:25:55,"I tried to find out on Google Maps and I could find the area, but I couldn't see the the hole"
00:25:56,00:25:58,With a big cork
00:25:58,00:26:03,I was thinking exactly the same thing well done and going one step further
00:26:03,00:26:07,I think what a cool film or adventure to go in there and crawl all the way through
00:26:07,00:26:11,But when the Great Western Railway was built
00:26:11,00:26:16,There's quite a lot of tunnels there and there's a guy called Dionysus Lardner who said
00:26:16,00:26:24,"I mean, they knew how to name babies in those days"
00:26:25,00:26:30,But he said that if you put any train in a tunnel as long as like say let's say the box tunnel
00:26:30,00:26:33,Which is one of the big ones in the Great Western Railway
00:26:33,00:26:39,They said that the train would use up so much oxygen when it was moving that there wouldn't be anything for the passengers to breathe
00:26:39,00:26:41,And then one would just die
00:26:41,00:26:46,What and he was he saying that he was saying that and he isn't right about those tunnels
00:26:46,00:26:50,"But he is right that you do need a lot of ventilation in those tunnels. Yeah, yeah tough gig"
00:26:52,00:26:56,And I do our tunnel that there's a sort of railway legend about
00:26:56,00:27:02,Which was this was designed by is embarking on Brunel. It was in the 19th century
00:27:02,00:27:08,"It is the box tunnel near bath. Do you know that time? That's one I just mentioned. Oh, okay. Sorry. All right, so"
00:27:08,00:27:11,This was built
00:27:11,00:27:18,With an idea that it was done deliberately so that light would shine from one end to the other through right?
00:27:18,00:27:23,It's like one of these big legends because first beyond his birthday is meant to be on his birthday
00:27:23,00:27:31,And the idea was not really confirmed until 200 years later when it was shut down and they were able to properly look through it on a morning
00:27:31,00:27:36,"I don't think it's been confirmed that it's for sure like that was the reason. Oh, no"
00:27:36,00:27:40,"No, exactly, but the but the legend that the Sun would be seen on either side of the tunnel"
00:27:40,00:27:43,It was a thing and that was done because it was said it was
00:27:43,00:27:50,"Architecturally built so that it would do that on the birthday of Brunel and that was the 9th of April, which is today"
00:27:50,00:27:57,We asked the railway company once if we could go and film it
00:27:57,00:28:03,"Oh, really for qi and they said for some reason they would stop the entire rail network just so we"
00:28:03,00:28:08,They stop it a lot of the time anyway for much worse reasons
00:28:09,00:28:14,"And is it that if you hold the prism in the right place, it shows you where the Ark of the Covenant is buried"
00:28:14,00:28:17,"Yes, yeah, yeah, so we need to find it before the Nazis do"
00:28:17,00:28:22,This I'm just jumping back to this submarine that went around the world
00:28:22,00:28:28,It was a pretty amazing like the psychology of what do you do when you keep people for 60 days?
00:28:28,00:28:34,Which is roughly how long they were under they had psychologists on board to monitor that and work out what was going on
00:28:34,00:28:39,They did things like make people quit smoking because everyone was smoking up until recently
00:28:39,00:28:45,"It's only been banned smoking on submarines. So yeah, so they they did days of testing psychologically"
00:28:45,00:28:50,What does it do when you stop smoking? It did bad things. Everyone was really irritable
00:28:50,00:28:53,So they allowed them to start smoking again
00:28:53,00:28:58,They treated it a bit like a bit of a sightseeing tour the whole of the trip
00:28:58,00:29:03,So anytime they got near land the periscope would go up and everyone was allowed a turn of just having a look
00:29:03,00:29:06,They got to Easter Island and everyone had a good old look
00:29:06,00:29:09,They pulled up to certain islands
00:29:09,00:29:14,Whereas some of the members on board had family living there and asked them to out like locate the house on the shore
00:29:14,00:29:18,So one guy actually spotted his mom and dad's house through the periscope
00:29:18,00:29:22,"Yeah, and I think that's why this guy this Filipino guy found them"
00:29:22,00:29:28,Wasn't it because they take him the same route as Ferdinand Magellan did when he went around the world
00:29:28,00:29:34,And at one stage they saw that they were near like a statue of Magellan or something
00:29:34,00:29:37,And so they put the periscope up up so everyone could see the statue and that's where he was
00:29:37,00:29:42,There's one detail where his story wasn't believed or so we're told
00:29:42,00:29:46,Because this happened to have happened on April Fool's Day
00:29:46,00:29:48,And so when he came back and said I saw a sea monster
00:29:48,00:29:53,"And I was like, okay, yeah, sure thing. Nice one. You wouldn't believe it"
00:29:53,00:29:57,"You know, would you believe it every other day of the year someone comes to me say they've seen a sea monster"
00:29:57,00:30:01,"There's like literally no day of the year except maybe Christmas is a present to them that I say, oh, yeah, really cool"
00:30:01,00:30:07,"Yeah, probably April Fool's Day is the one day where you go. Okay. Well, that's just too obvious to be an April Fool's"
00:30:07,00:30:10,It must be true. Yeah
00:30:10,00:30:17,Ascension Island was an absolutely key part of the Falklands War wasn't it? They use his staging post
00:30:17,00:30:23,"Oh, was it? Yeah, because that's one of the three. There are three islands aren't they? Ascension Tristan de Cunha and"
00:30:23,00:30:31,The UK took over Ascension Island when Napoleon was in St. Helena because they thought that
00:30:31,00:30:39,"Yeah, he might escape. Yeah, it's a very convenient only 2,000 mile away hop, skip and a jump to save Napoleon and we can't let it happen"
00:30:39,00:30:44,It's lots given that it's so remote so many people visited it
00:30:44,00:30:50,"For example, the guy who discovered it was a Portuguese called Juan de Nova"
00:30:51,00:30:54,Who's known for some reason in St. Helena as John Newcastle and
00:30:54,00:31:02,He was on his way to India on the and one of the crewmen on his voyage was a marigo Vespucci after whom America is named
00:31:02,00:31:04,"Oh, really? And then there's"
00:31:04,00:31:08,Captain Joshua Slocum the first man to sail single-handed round the world
00:31:08,00:31:14,Who dropped in there on in 1898 and he sailed the whole way around the world
00:31:14,00:31:17,"You may have done this before without being able to swim which is an extraordinary fact, isn't it?"
00:31:18,00:31:22,"Well, I think it helps gives you more of an incentive to sail. What do you think?"
00:31:22,00:31:27,"Yeah, like we've got to get back there because if we don't get that I think a lot of sailors, you know way back"
00:31:27,00:31:31,Deliberately didn't learn to swim because they they didn't want to prolong the drowning
00:31:31,00:31:35,Really rather have a quick quick one. Yeah
00:31:35,00:31:42,One of the great forges of all time Elmira de Hore he was an artist himself
00:31:42,00:31:46,"And but he wasn't a very good one. Well, he's kind of okay"
00:31:46,00:31:53,"But when he showed one of his paintings to woman called Lady Malcolm Campbell, she saw her and she said oh is that a Picasso and he was like"
00:31:53,00:31:58,"No, no, it's me and I can't really sell it but Picasso seems to be selling quite well"
00:31:58,00:32:03,So from now on I'm just gonna paint my stuff and pretend it's from a Picasso. Nice
00:32:03,00:32:07,And he became really massive throughout the 40s
00:32:07,00:32:10,He was making all sorts of these forgeries of Picasso and Matisse
00:32:11,00:32:18,So he created so many Modigliani forgeries that it's still now it's impossible to compile a catalogue of Modigliani's work
00:32:18,00:32:23,"Really? Yeah, because we don't know which ones are his and which ones are the Horeys"
00:32:23,00:32:30,And his collection is run now and he was such a big forger that people want to see his paintings
00:32:30,00:32:32,And it's run by a guy called Mark Forgey
00:32:37,00:32:44,"On the attribution of you know, who did what a Nazi officer saw Gernica when Picasso was"
00:32:44,00:32:49,There and he said did you do that and Picasso said no you did it nice
00:32:49,00:32:54,His only political painting really
00:32:54,00:33:00,Really went off his paintings during this because he was obsessed with himself and drawing his women and how tortured they were
00:33:00,00:33:05,And what horrible time they were having because he was having affairs and basically he went out with Dora Ma
00:33:05,00:33:12,"Who was very political she politicized him. He did Gernica. It became a huge anti-war symbol, didn't it?"
00:33:12,00:33:15,There was a painting of there was a huge sort of like
00:33:15,00:33:23,"Aircraft bombing of a village in Spain during the Spanish Civil War, right? By the by their allies of ashes by the Nazis and the Italians"
00:33:23,00:33:29,"Which was in fact a birthday present sweetly from Göring to Hitler sweet, so sweet"
00:33:32,00:33:38,I just I wonder what were the circumstances and the situation in which Picasso replied that to a Nazi
00:33:38,00:33:44,"Was we talking post-war here? Are we talking like he wasn't in Nazi Germany, right?"
00:33:44,00:33:50,"That's a pretty bold thing to say to a Nazi is all I'm saying. Well, I presumably during the war wasn't it?"
00:33:50,00:33:57,Occupation wild. What was the next sentence on the Nazi side because I think he was in Paris when the Nazis came into Paris
00:33:57,00:34:01,"Wasn't he I think yes, it reminds me of"
00:34:02,00:34:05,the famous story about Sigmund Freud when he was
00:34:05,00:34:10,Asked to in order to get out of of Germany under the
00:34:10,00:34:16,Nazis he was asked to sign a disclaimer saying that he hadn't been badly treated and
00:34:16,00:34:20,He wrote I can heartily recommend the Gestapo to anyone
00:34:26,00:34:31,Do you know which national anthem contains the word moss this is a question for Randy really?
00:34:31,00:34:36,Is it a biggie Japan
00:34:36,00:34:45,Anna's got it. Wow. They bloody love musto may your world go on for thousands of years until pebbles merge into one giant rock and
00:34:45,00:34:47,Covered with moss. That's the dream
00:34:50,00:34:56,In a national anthem survey 79% of Americans know the first line of the star-spangled banner
00:34:56,00:35:01,But only 37% of Canadians know the first line to oh Canada
00:35:01,00:35:06,Which is really pathetic considering the first line of oh Canada is oh Canada
00:35:06,00:35:16,Can I just learn the fact tangentially terminate - one best sound effects editing in 1992?
00:35:16,00:35:18,And I think there was this famous moment where
00:35:18,00:35:21,"T1,000 who I believe is one of the characters"
00:35:21,00:35:27,Goes through some metal bars and the sound effect was achieved by pouring dog food out of a can and it's it's quite cool
00:35:27,00:35:35,To watch when you know that but I didn't know the director of that had such a good money-saving cheat for two separate scenes where
00:35:35,00:35:39,"The terminator all T1,000 I think can disguise himself as someone else"
00:35:39,00:35:45,And so you see a character looking at their reflection and then that character turns around and the reflection still looking at them
00:35:45,00:35:49,"And you realize it's T1,000. Do you know how he achieved that effect?"
00:35:49,00:35:54,With a window I'll give you a clue. Have you ever seen the film?
00:35:54,00:36:01,"Yes, it's the same concept as the big reveal in that he used Arnold Schwarzenegger's twin. He used identical"
00:36:01,00:36:08,He used identical twins twice in this film
00:36:08,00:36:16,"There's an identical twin so there's Don and Dan Stanton played a character called Lewis and then T1,000 pretending to be him"
00:36:16,00:36:21,"And then Linda Hamilton, who I think was a famous part in that had an identical twin called Leslie Hamilton"
00:36:21,00:36:28,"And whenever he needed, you know, one of them to do something body-doubly, isn't it? Was he hiring actors entirely based on that way?"
00:36:28,00:36:30,Yeah
00:36:30,00:36:32,So heads of state and cows
00:36:32,00:36:37,President Taft of America kept a cow called Pauline on the White House lawn. Do you remember that?
00:36:37,00:36:43,"No, I didn't remember it. No, so I was collecting names of naming animals of odd names"
00:36:43,00:36:47,So Byron had a pet wolf called Lion
00:36:47,00:36:52,Either reveal is bad right when you mean it
00:36:52,00:36:55,Einstein had a cat called Tiger
00:36:55,00:37:01,Climbs Gustav Klint had a cat called Catskate. He said and the Times journalist Andrew Billan
00:37:01,00:37:06,"I read the other day is called he's got a cat called Vommie, which is Bode's ill, doesn't it?"
00:37:06,00:37:08,And I did I did really like this
00:37:08,00:37:15,Elgar the composer spent a lot of time with the Hereford Cathedral organist dog who's called Dan
00:37:15,00:37:22,"Anyway, when Dan fell into the river wine swam upstream to find a landing place"
00:37:22,00:37:28,Somebody suggested that Elgar set the whole adventure to music and he did he said I've done it
00:37:28,00:37:30,It was called the enigma variations
00:37:30,00:37:34,Inspired by Dan the dog who fell into the river
00:37:35,00:37:42,"Dan I think he's just replaced you as my favorite Dan. Oh, I thought that changed long ago. Yeah. That's very cool"
00:37:42,00:37:47,I love whoever that journalist was what a billing he got to share just then out of nowhere
00:37:47,00:37:54,He's a really good guy
00:37:54,00:38:03,"What's Swindon famous for the Oxford United's big rivals? Yeah, I could say about the football team"
00:38:03,00:38:08,What do they make in Swindon? Dianna Dawes is famous. She's a Swindon girl and
00:38:08,00:38:12,The mayor was introducing it once he was terribly nervous because
00:38:12,00:38:17,Her maiden name was Dianna Fluck like Peter Fluck
00:38:17,00:38:22,And he said it's a gentleman may introduce
00:38:22,00:38:26,That lady used to be called Diana Clunter
00:38:26,00:38:37,"Alright, there you go, that is all of our outtakes"
00:38:37,00:38:43,If you want to write to any of us about the things that were said in this episode podcast at qi.com
00:38:43,00:38:48,All those emails go to Andy he goes through them and some of them make their way to drop us a line of which
00:38:48,00:38:53,There'll be another episode popping into your club fish feed in the next couple of weeks
00:38:53,00:38:57,So do write in if you want to have yours read out on the show one
00:38:57,00:39:01,Correction from the outtakes which we thought worth keeping in any way
00:39:01,00:39:06,Sometimes we just tell stories out loud because someone has said something while we're on a tangent
00:39:06,00:39:12,And I just wanted to add a few corrections that brilliantly funny Steve Martin story that I told earlier
00:39:12,00:39:16,So just in case you're thinking can't wait for this episode to end
00:39:16,00:39:19,I absolutely want to get out there and start spreading the story
00:39:19,00:39:26,There's a few corrections to add about it one is that he was filming Roxanne and he did go into a bar
00:39:26,00:39:29,"However, it wasn't because it was the end of the day and he was looking for a drink"
00:39:29,00:39:34,It's because they were halfway through the filming day. He had the prosthetics on he really needed the bathroom
00:39:34,00:39:37,There wasn't one around someone pointed him to that place
00:39:37,00:39:42,He walked in and then the story is pretty much the same. He gets looks from all the locals
00:39:42,00:39:48,He's thinking oh am I welcome here or not and a man walks up to him looks him up and down and says why the long face
00:39:49,00:39:53,There you go. You can now go out into the wild and spread that hilarious story
00:39:53,00:39:55,"All right, that is it everyone"
00:39:55,00:39:58,We are gonna be back as I say with a drop us a line in a couple of weeks
00:39:58,00:40:01,We will see you all then and hopefully some of you in Sheffield
00:40:01,00:40:06,No such thing as a fish calm check that out and find yourself some tickets. All right guys. Take care
00:40:06,00:40:09,Hope you all doing well. We'll speak to you soon. Goodbye
00:40:09,00:40:11,You
00:40:11,00:40:13,You
00:40:13,00:40:15,You
00:40:15,00:40:17,You
00:40:17,00:40:19,(upbeat music)
