start_hhmmss,end_hhmmss,text
00:40:27,00:40:31,"that group of what were they, Women's Institute people doing it the first time."
00:40:31,00:40:38,"You've repeatedly turned down my idea, James, for a fish nude calendar where we're all hiding behind"
00:40:38,00:40:44,"facts. But this trend of people doing this? Well, I'll just give you a line from the"
00:40:44,00:40:50,"photographer who said... Who said, ""It's very cold in the Kengars."""
00:40:50,00:40:56,"Taking pictures of my naked friends and colleagues, not to mention my girlfriend's mum"
00:40:56,00:41:01,"was certainly a surreal experience. I can't believe they fell for it, who said?"
00:41:01,00:41:10,She goes from town to town posing naked calendars. It's really nice to hear for a
00:41:10,00:41:17,"perfect scam, isn't it? Just go to another office. Hello! I'm just wondering if you like a naked"
00:41:17,00:41:29,"calendar or a cherry. Oh, I want a dark film, ""Canada Girls"" because I can't put that lens on it."
00:41:29,00:41:37,"Oh, dear. Good gracious. More stuff on reindeer, guys. They are very fast. The robbers are right."
00:41:37,00:41:43,And they're fast and very young. They can outrun an Olympic sprinter when they're only a day old.
00:41:43,00:41:49,"Stop it. That's so cool. What? Newborns can stand and walk almost straight away,"
00:41:49,00:41:54,"and then within an hour, they can run. That is very good. Which is good. It makes me wonder if"
00:41:54,00:41:59,"they do that competition within 15 minutes. Some parents are like, ""Mine's actually running already."""
00:41:59,00:42:06,You should get Santa's reindeer to be your financial advisors.
00:42:06,00:42:10,Because they're not employed for the rest of the year. Very nice.
00:42:11,00:42:16,Or they're free in January for the tax deadline. Exactly. They're twiddling their hooves otherwise.
00:42:16,00:42:22,"So what it is is that a team of researchers at Dartmouth College, bearing in mind this is an"
00:42:22,00:42:28,"Ivy League University, right? They did a very, very serious study where they got a bunch of"
00:42:28,00:42:35,"Santa's reindeer at a local kind of Christmas theme park. They were Dasha, Dancer, Prancer, Vixen, Comet,"
00:42:35,00:42:41,"Cupid, Donna, Blitz and Rudolph, and Boris. Boris was a trainee."
00:42:41,00:42:46,"Can I just ask, are these real reindeer, and are they really Santa's reindeer?"
00:42:46,00:42:52,"They are real reindeer, and Santa is real. Okay, cool. So they're living reindeer. It wasn't like,"
00:42:52,00:42:57,"""Mod, okay, right?"" And what they did was they laid out copies of the Wall Street Journal's stock"
00:42:57,00:43:03,"pages on the floor of their barn, and they got them to select stocks that they wanted them to buy."
00:43:03,00:43:08,"So they made hoof prints on the newspaper pages, and then they went and purchased these stocks to"
00:43:08,00:43:16,"create a reindeer portfolio. And they found that it outdid the S&P 500, which is the kind of top"
00:43:16,00:43:22,"500 companies in the US. It outdid the growth of those companies by 5%. And apparently, that's"
00:43:22,00:43:29,statistically significant. What? Is it? Is it apparently so? There's the Ivy League researchers.
00:43:29,00:43:36,"But the thing that they did... Sorry, just to say, that is significant. If you could make 5% more"
00:43:36,00:43:40,"than the average on the stock market, and you could consistently do that, then you'd be very"
00:43:40,00:43:45,"rich. Yeah, you'd be doing well. That's the consistently thing, isn't it? Well, all we have is"
00:43:45,00:43:50,"evidence that they are consistent. No, over six months. But the reason why they did this was"
00:43:50,00:43:56,"kind of to prove that senators and congressmen, who are often in America accused of using their"
00:43:56,00:44:02,"inside knowledge to play the stock market, that what they did was they compared the portfolios"
00:44:02,00:44:08,of the senators to the reindeer portfolio and found that the reindeer was still better than the
00:44:08,00:44:14,senators and the congressmen who had inside knowledge. And one of the researchers actually said
00:44:14,00:44:19,that it turns out that these politicians are as feckless as the rest of us at stock pickings.
00:44:19,00:44:24,"Well, it could be that they're scrupulously honest, and they don't use any of their internal"
00:44:24,00:44:28,"knowledge. Very, very good point. Very good point. And maybe they prove that with the reindeer"
00:44:28,00:44:33,portfolio. Or it could be reindeers are absolutely massive inside of it. They're going around the
00:44:33,00:44:38,"country once a year, like while Santas delivering the presents, they're hecking into emails. They go"
00:44:38,00:44:42,"through the filing cabinet. Yeah, they always take a bite out of the apple, drink the sherry,"
00:44:42,00:44:47,and go through all of your books. Why are there hoof prints left inside the house after he's been?
00:44:47,00:44:50,"It doesn't make any sense. No, you're so right. Do they fall down the chimney? This should be on"
00:44:50,00:44:55,"the roof. Yeah, who found the roof. That's a good title for a children's book. Lovely. Don't"
00:44:55,00:45:00,"give your reindeer's carrots. Why not? I don't know any reindeers. Next question. No, I'm listening."
00:45:00,00:45:05,"I do. Yeah. Well, just because we were saying about, you know, sherry and Ms. Pisces, I mean,"
00:45:05,00:45:10,"don't give them them either. But yeah, they can't digest them. But what am I going to cover my penis"
00:45:10,00:45:17,with in the naked calendar? Maybe there's some other baby vegetables that they make. I don't know.
00:45:20,00:45:21,Let's see if I can find a runner bean.
00:45:21,00:45:34,"Great stuff. Okay. All right, it's time to pee. Do you want to go now?"
00:45:34,00:45:35,A pee's not going to be big enough.
00:45:46,00:45:51,"Okay, it is time for our final fact this week, and that is James. Okay,"
00:45:51,00:45:58,"my fact this week is that from 1841 to 1851, the MP for thirst thought he was a bird."
00:45:58,00:46:02,He was then replaced by a man who was later killed by a turnip.
00:46:02,00:46:08,Was he killed by an actual turnip or another MP who thought he was a turnip?
00:46:08,00:46:13,He was killed by an actual turnip. Did it get into the campaign literature?
00:46:13,00:46:15,Vote for me. The other guy thinks he's a bird.
00:46:16,00:46:17,I'm safe around turnips.
00:46:17,00:46:24,"There wasn't much in the way of campaigning in these days, especially in thirst."
00:46:24,00:46:30,All of these people all got in without any opponents. Who do you want to hear about first?
00:46:30,00:46:36,"The bird of the bird man, I think. Okay, the bird man of thirst was a guy called John Bell."
00:46:36,00:46:42,"Basically, in this area, they had to have an MP. They had a railway and there were a few people"
00:46:42,00:46:48,"living there. They had to have an MP, and there wasn't really anyone to do it. A few people from"
00:46:48,00:46:52,"outside of the town came in. They might want to do it, but no one in the town wanted to vote for"
00:46:52,00:46:57,them. So they all voted for this guy called John Bell because his family owned half of the houses
00:46:57,00:47:02,"in the town, and everyone liked them. He was the right man for the job, really."
00:47:02,00:47:07,"So they voted for him, but after he'd been in there for a little while, it turned out that he"
00:47:07,00:47:15,"was of unsound mind, and they did an inquiry as to his unsoundness of mind, which took place at"
00:47:15,00:47:21,"the three tons hotel in thirst, which is now a Weatherspoons. In this inquiry, they said that"
00:47:21,00:47:26,he sometimes fancied himself to be an eagle and made motions with his arms as if endeavouring
00:47:26,00:47:31,to raise himself from the ground to fly. He was also convinced that someone was trying to poison
00:47:31,00:47:38,"him with iodine in his tea. A bit of a callback to the last episode, iodine. And then on other"
00:47:38,00:47:42,"occasions, when in company, he would forget that he was at the dinner table and start to undress"
00:47:42,00:47:48,"himself. But in those days, there was no way to get rid of someone. If they were an MP and there"
00:47:48,00:47:52,"wasn't an election, and even if there was an election and people there wanted to send back"
00:47:52,00:47:58,"the same guy, there's no way to get rid of them if they were of unsound mind. I guess I don't even"
00:47:58,00:48:03,"know how you would now, because in fact, then legislation was introduced, and then there were"
00:48:03,00:48:07,"various upgrades to it. But I think it was all repealed in about 2012 or 13. So, you know..."
00:48:07,00:48:12,I can't imagine any of our politicians would be of unsound mind.
00:48:12,00:48:16,"You're right. It's just not relevant anymore. And anyway, he unfortunately died."
00:48:16,00:48:21,"Was he an honest MP, by the way, or was he feathering his own nest?"
00:48:21,00:48:22,Very good. Thank you. Any more of that?
00:48:22,00:48:27,"No, no, no. I just had that one stored up and I didn't want it to sit around inside me."
00:48:27,00:48:33,I can't wait for your turnip pun that's upcoming. Because he was replaced by a guy called Sir
00:48:33,00:48:40,"William Payne Galway, and he was out shooting in the parish, and he walked across a turnip field,"
00:48:40,00:48:45,and he fell with his body onto a turnip. I'm quoting from the York Herald here.
00:48:45,00:48:50,"He fell with his body onto a turnip, sustaining severe internal injuries."
00:48:50,00:48:54,"No, that's a fake excuse when you're talking to the hospital, isn't it?"
00:48:55,00:48:59,"And in the Hoover, I just kicked him when the vacuum was on."
00:48:59,00:49:03,"He was nakedly shooting in a field, and he fell and the turnip went up his arse."
00:49:03,00:49:11,"No, he fell on the turnip and injured himself, and the next day he failed to recover."
00:49:11,00:49:17,"And turnips are not funny things to fall onto. They're big serious. They're big hard things, you know."
00:49:17,00:49:20,"I mean, turnips are inherently funny, I think. Sorry. I don't know why I said that,"
00:49:20,00:49:25,but they're not really funny. He wasn't the only MP who died in a turnip-related incident.
00:49:25,00:49:29,"I don't know if you guys found the story of Lewis Fenton, the wig MP for Huddersfield."
00:49:29,00:49:37,"So he died a little earlier than this. This was 1833, about 50 years before,"
00:49:37,00:49:40,"and he fell out of a window at home. Very sadly, he died of his injuries,"
00:49:40,00:49:45,"you know, tragic, and his widow explained that he was in the habit of going up to the attic"
00:49:45,00:49:49,to look out of the window at a piece of ground where his turnips were growing.
00:49:49,00:49:50,"Oh, yeah."
00:49:50,00:49:54,"To make sure that the cows had not, also his cows, had not got into the turnip enclosure,"
00:49:54,00:49:56,"and were not, you know, yet."
00:49:56,00:49:59,"So when he'd disappear for hours at a time, he'd be like, ""No, darling, you know,"
00:49:59,00:50:01,"I'm watching the turnips. I promise I'm watching the turnips."""
00:50:01,00:50:05,"Some strange noises come out of the attic. No, no, that's my turnip watching."
00:50:05,00:50:08,I don't think we're going to imply anything unsavory about a turnip.
00:50:08,00:50:13,"The band's dead, well, he should be, you know, and he probably just was looking so much that"
00:50:13,00:50:16,"he overbalanced and tipped out of the window. Must have been, must have been, yeah."
00:50:16,00:50:22,"I was just, just the word for the mental disorder that you have when you think you are,"
00:50:22,00:50:26,"let's say, a bird is clinical lycanthropy, which I just looked up and I was wondering"
00:50:26,00:50:27,whether it was a thing.
00:50:27,00:50:28,Like a werewolf.
00:50:28,00:50:30,I think lycanthropy must be werewolf.
00:50:30,00:50:33,"It comes from the idea of, yeah, exactly, being like a wolf,"
00:50:33,00:50:35,but it applies to thinking you're like any animal.
00:50:35,00:50:36,I guess they couldn't be asked to come up with a different word for thinking you're like.
00:50:36,00:50:39,You were thinking it would be zotropy or something.
00:50:39,00:50:43,"Yeah, I get, but it must be more common to think you're a wolf."
00:50:43,00:50:47,"But I just, I like the Wikipedia page on clinical lycanthropy"
00:50:47,00:50:51,just because it used the case history of a 25 year old man who was sent for treatment
00:50:51,00:50:55,"during a period of excessive hand washing, irritable behaviour, decreased sleep,"
00:50:55,00:50:56,and acting like a buffalo.
00:50:56,00:51:02,Buffaloes famously obsessively wash their hands.
00:51:02,00:51:02,They do.
00:51:02,00:51:04,"No, that's a bison."
00:51:04,00:51:06,"Brilliant, there we go. Brilliant."
00:51:06,00:51:10,That's a bucket list joke.
00:51:10,00:51:13,That was one.
00:51:13,00:51:18,"I got that from a Christmas cracker 25 years ago and I've been trying to, she hold it in."
00:51:20,00:51:20,Oh my god.
00:51:20,00:51:27,The MP's page on Wikipedia for notable MPs with records in various directions
00:51:27,00:51:28,is unbelievably good.
00:51:28,00:51:29,"I don't know who's written that, but it's..."
00:51:29,00:51:31,What do you mean records in directions?
00:51:31,00:51:32,So here's one.
00:51:32,00:51:34,The youngest MP ever in the House of Commons in England.
00:51:34,00:51:35,Oh yeah.
00:51:35,00:51:38,Christopher Monk who was elected MP for Devon aged 13.
00:51:38,00:51:39,Yeah.
00:51:39,00:51:41,How old did he become a monk?
00:51:41,00:51:41,That's the question.
00:51:41,00:51:43,Brilliant.
00:51:43,00:51:46,You know the interesting thing about Christopher Monk?
00:51:46,00:51:48,"I haven't seen that page, but I do have him in my notes."
00:51:48,00:51:49,Fantastic.
00:51:49,00:51:56,"And he in 1681 arranged a boxing match between his butler and his butcher,"
00:51:56,00:51:58,which is the first recorded boxing match in England.
00:51:58,00:52:00,That's really good.
00:52:00,00:52:01,"Yeah, 1681."
00:52:01,00:52:03,"He's a real man of the people as well, wasn't he?"
00:52:03,00:52:09,"And the butcher won, we know, but we don't know much more about that."
00:52:09,00:52:11,"He had a big right hook, didn't he?"
00:52:11,00:52:12,"Yeah, I like it."
00:52:12,00:52:13,Nice.
00:52:13,00:52:14,Thank you.
00:52:14,00:52:15,They're all coming out tonight.
00:52:15,00:52:15,Oh yeah.
00:52:15,00:52:18,Wow.
00:52:18,00:52:21,"But the oldest MP, Samuel Young, are on a list."
00:52:21,00:52:23,"No, that's brilliant."
00:52:23,00:52:25,Served until he was 96 years old.
00:52:25,00:52:26,Really impressive.
00:52:26,00:52:30,How old was Baroness Trumpington when she died?
00:52:30,00:52:31,She was really old.
00:52:31,00:52:35,"She was in the Lords, and I think most people in the Lords are at least 90, aren't they?"
00:52:35,00:52:39,"But you know, Parliament wasn't for a long time, it was very unofficial,"
00:52:39,00:52:42,"but you know, it was local landowners, and then it was Barons,"
00:52:42,00:52:45,"and then as they gradually extended the right to vote to more people,"
00:52:45,00:52:48,"they gradually thought, ""Probably can't be only Baroness."
00:52:48,00:52:49,"We've got it in the house of Trump."""
00:52:49,00:52:49,Whatever.
00:52:49,00:52:51,"Yeah, yeah."
00:52:51,00:52:55,"I liked George Sitwell, who's actually Edith Sitwell, the poet's dad,"
00:52:55,00:53:00,"but he was an MP in the 1880s and 90s, MP for Scarborough,"
00:53:00,00:53:03,and he was just a fun guy.
00:53:03,00:53:04,He spent his time writing books.
00:53:04,00:53:08,"He wrote books on pig keeping in the 13th century, lepers squints."
00:53:08,00:53:11,Acorns is an article of medieval diet and the history of the fork.
00:53:11,00:53:13,Lepers squints.
00:53:13,00:53:14,"Yeah, wrote a book."
00:53:14,00:53:16,I don't think he got these books published.
00:53:16,00:53:19,He sounds very much like a QI researcher.
00:53:19,00:53:20,"Yeah, he really does."
00:53:20,00:53:22,Researching random topics of his own interest.
00:53:22,00:53:26,"He does, and actually, very creative as well, as we all have to be,"
00:53:26,00:53:31,because he invented a musical toothbrush that played a song while you cleaned your teeth.
00:53:31,00:53:32,That is good.
00:53:32,00:53:32,That's good.
00:53:32,00:53:33,This one in the 1880s.
00:53:33,00:53:34,Yeah.
00:53:34,00:53:38,"He also invented a mini gun for shooting wasps, and the Sitwell egg."
00:53:38,00:53:43,"It was nothing, you know, you didn't sit on it."
00:53:43,00:53:45,It wasn't a Gwyneth Paltrow kind of freak.
00:53:45,00:53:48,You're sitting well.
00:53:48,00:53:51,Tell me about it.
00:53:51,00:53:52,Got the egg up there.
00:53:52,00:53:56,"No, it was made of smoked meat, which was the yolk,"
00:53:56,00:53:58,"and then it was wrapped in the white, which was rice,"
00:53:58,00:54:02,"and then a synthetic shell around it, and he tried to sell it into his self-ridges."
00:54:02,00:54:05,"So he was trying to have a new Scotch egg, basically."
00:54:05,00:54:07,"But we go stock with rice, did you say?"
00:54:07,00:54:08,"With rice, exactly."
00:54:08,00:54:11,"Well, that's like an umu subi, like the kind of Japanese one."
00:54:11,00:54:12,"Yes, I was actually going to say sushi,"
00:54:12,00:54:14,but it sounds like you've said the proper thing that it is.
00:54:14,00:54:19,"Apparently, when he went to self-ridges,"
00:54:19,00:54:21,"he walked into the front door and said,"
00:54:21,00:54:24,"""I am Sir George Sitwell, and I brought my egg with me."""
00:54:24,00:54:28,"Hello, dragons."
00:54:28,00:54:38,I love Ignatius Timothy Trebich Lincoln.
00:54:38,00:54:39,So do I.
00:54:39,00:54:41,"Another man of the people judging by his name, clearly."
00:54:41,00:54:46,But he had the most insane CV of anybody I have ever heard of.
00:54:46,00:54:50,So he was born in Hungary to an Orthodox Jewish family.
00:54:50,00:54:54,"He was a student rabbi, but then he became wanted for petty theft."
00:54:54,00:54:56,"So he fled to London, he became a Christian,"
00:54:56,00:54:59,"and then he went to Canada as a Presbyterian missionary,"
00:54:59,00:55:02,"and then he went back to England as an Anglican curate,"
00:55:02,00:55:06,and then he was an MP for Darlington in 1910.
00:55:06,00:55:09,"He ran out of money, so he stopped being an MP."
00:55:09,00:55:12,"He became a speculator in Romanian oil,"
00:55:12,00:55:15,"a German continental spy in World War I,"
00:55:15,00:55:17,and then a munition merchant in China.
00:55:17,00:55:21,"And then he converted to Buddhism, became a monk,"
00:55:21,00:55:24,and then tried to become a Nazi collaborator.
00:55:24,00:55:27,That all sounds very tiring.
00:55:27,00:55:28,He could have just been a liar.
00:55:28,00:55:32,And then you could do all that stuff.
00:55:32,00:55:36,"That's true, but the absolute cherry on the cake for me is that"
00:55:36,00:55:38,"he made contact with the Nazis, right?"
00:55:38,00:55:40,"Because he said to him, ""Listen,"
00:55:40,00:55:42,"I have declared myself the Dalai Lama."""
00:55:42,00:55:47,And I am backed by the Japanese.
00:55:47,00:55:49,"The Tibetans were less keen on this idea,"
00:55:49,00:55:50,"but the Japanese were like,"
00:55:50,00:55:54,"""Yeah, this random Hungarian Jewish Christian MP guy,"
00:55:54,00:55:56,"he can be our Dalai Lama."""
00:55:56,00:55:59,"And he said, ""I can help you lead a Buddhist uprising"
00:55:59,00:56:01,"in the East for the Nazis."""
00:56:01,00:56:04,That's a great alternative history of the war.
00:56:04,00:56:05,Right.
00:56:05,00:56:05,Did they go for it?
00:56:06,00:56:09,"Unfortunately, they didn't, sadly."
00:56:09,00:56:10,Sadly.
00:56:10,00:56:12,"Sadly, the Nazis did the war."
00:56:12,00:56:15,But how amazing would history would have been
00:56:15,00:56:17,if the Hungarian Dalai Lama?
00:56:17,00:56:18,Good grief.
00:56:18,00:56:18,The names are incredible.
00:56:18,00:56:20,What's he called it? Ignatius?
00:56:20,00:56:22,Ignatius Timothy Trebuch Lincoln.
00:56:22,00:56:24,They do have just good...
00:56:24,00:56:26,I don't know whether it's like minor aristocracy
00:56:26,00:56:28,"who are the kind of people who wear MPs in the 17th century,"
00:56:28,00:56:30,but Sir Freshville Hollars.
00:56:30,00:56:31,Lovely.
00:56:31,00:56:32,Grimsby.
00:56:32,00:56:35,I was looking at MPs who'd been injured in the line of...
00:56:35,00:56:37,"Not the line of duty, actually, just in their lives in general,"
00:56:37,00:56:40,"because there were lots who'd lost arms in sea battles,"
00:56:40,00:56:41,as Sir Freshville did.
00:56:41,00:56:44,Sackville Tufton was wounded in the Battle of Schuenevelt.
00:56:44,00:56:49,Brooke Watson lost his right leg to a shark in Havana in 1749.
00:56:49,00:56:51,"I mean, these guys had really interesting careers."
00:56:51,00:56:52,What's he doing there?
00:56:52,00:56:53,Sailing around.
00:56:53,00:56:55,"He was being used as an ore, wasn't he?"
00:56:55,00:57:00,"John Stubbs, I love this."
00:57:00,00:57:00,This is a really interesting one.
00:57:00,00:57:02,He was the MP for Great Yarmouth.
00:57:02,00:57:05,He lost a hand for distributing a pamphlet
00:57:05,00:57:06,in 1579.
00:57:06,00:57:07,"What, to a lion?"
00:57:07,00:57:08,"Oh, to a pamphlet."
00:57:08,00:57:08,Paper cut.
00:57:08,00:57:11,Bad paper cut.
00:57:11,00:57:13,"His pamphlet was titled,"
00:57:13,00:57:15,"""The discovery of a gaping gulf where unto England"
00:57:15,00:57:18,is like to be swallowed by another French marriage
00:57:18,00:57:20,"if the Lord forbid not the bans."""
00:57:20,00:57:21,And it was arguing that Queen Elizabeth
00:57:21,00:57:23,"was too old to have children,"
00:57:23,00:57:26,"and she should therefore not marry the Duke of Anjou,"
00:57:26,00:57:28,"who was a French prince,"
00:57:28,00:57:30,and he was sentenced to death.
00:57:30,00:57:32,And then that was commuted to losing a hand.
00:57:32,00:57:34,"And then just before it happened,"
00:57:34,00:57:36,"he said, ""Pray for me now."
00:57:36,00:57:37,"My calamity is at hand."""
00:57:37,00:57:38,"Oh, yeah."
00:57:38,00:57:39,"Oh, funny."
00:57:39,00:57:41,It's just nice of a pun to go before...
00:57:41,00:57:42,It should have had a podcast.
00:57:42,00:57:46,"He would have loved my bison gel, Gary."
00:57:46,00:57:48,"Speaking of excellent names,"
00:57:48,00:57:49,just a very quick one here for you.
00:57:49,00:57:54,The Labour MP for Brockstow from 1929 to 1953
00:57:54,00:57:55,was called Seymour Cox.
00:57:55,00:57:57,Brilliant.
00:57:57,00:57:58,Wow.
00:57:58,00:57:59,Brilliant.
00:57:59,00:58:00,Can't believe I've never heard of him.
00:58:00,00:58:03,"I mean, as if you're not going to cross next to his name."
00:58:03,00:58:05,"You don't need to come after Seymour, do you?"
00:58:05,00:58:07,Seymour Cox.
00:58:07,00:58:09,"Yeah, that was his name."
00:58:09,00:58:10,It was also his campaign slogan.
00:58:10,00:58:16,But that's like a name that Bart would ring up most bar with.
00:58:16,00:58:18,Seymour Cox.
00:58:18,00:58:21,I don't know what x-rated Simpsons you've been watching.
00:58:21,00:58:26,Wow.
00:58:26,00:58:27,Seymour Cox.
00:58:27,00:58:30,"Um, just one more said the MP."
00:58:30,00:58:31,"Or, except for MP."
00:58:31,00:58:32,Yeah.
00:58:32,00:58:34,"Um, God, it's so hard to choose."
00:58:34,00:58:37,"There have been so many, but I do like John Mitten,"
00:58:37,00:58:40,who was a Tory MP in 1819.
00:58:40,00:58:42,"Not for very long, because he found it really boring."
00:58:42,00:58:45,But he just did lots of fun stuff.
00:58:45,00:58:48,He once rode a horse into a hotel in Leamington Spa
00:58:48,00:58:50,and rode it up the grand staircase in the middle
00:58:50,00:58:54,onto a balcony and then jumped it down from the balcony
00:58:54,00:58:55,over the diners in the restaurant below
00:58:55,00:58:56,and out through the window.
00:58:56,00:58:59,"If you're rich and a man here, a middle class,"
00:58:59,00:59:01,you could be a cuck for me.
00:59:01,00:59:03,"I don't even think it was middle class, to be honest."
00:59:03,00:59:05,"He was very, very, very..."
00:59:05,00:59:08,He would hunt a lot and like to do it naked.
00:59:08,00:59:09,Sometimes he'd start to hunt clothes
00:59:09,00:59:11,and then apparently get so excited mid-hunt
00:59:11,00:59:12,that he'd strip off all his clothes
00:59:12,00:59:14,and then arrive back naked.
00:59:14,00:59:16,"And in winter as well, so quite hardy,"
00:59:16,00:59:19,then he hunted ducks on a frozen lake naked as well.
00:59:19,00:59:23,"He liked animals, I don't know if that ingrates you."
00:59:23,00:59:25,"It doesn't sound like he did,"
00:59:25,00:59:27,because he was hunting all the time.
00:59:27,00:59:29,He liked very specific animals.
00:59:29,00:59:30,I love animals.
00:59:30,00:59:31,I love shooting them.
00:59:31,00:59:32,I love hunting them.
00:59:32,00:59:35,Much like a lot of people who like hunting
00:59:35,00:59:36,and killing certain animals.
00:59:36,00:59:38,"He loved other animals, like his horse,"
00:59:38,00:59:40,who he used to nap with by the fireplace
00:59:40,00:59:42,and who lived inside his house with him.
00:59:42,00:59:44,He's one of these people who...
00:59:44,00:59:45,The stories are incredible
00:59:45,00:59:46,and you think he would have been a nightmare
00:59:46,00:59:47,to have in your extended family
00:59:47,00:59:49,because it's always Mad Jack Mittens turned up
00:59:49,00:59:50,and done something wacky again.
00:59:50,00:59:52,"And I think he died in poverty, in debt,"
00:59:52,00:59:54,in prison at the age of about 30.
00:59:54,00:59:55,"Yeah, yeah, yeah."
00:59:55,00:59:57,Am I allowed to say good?
00:59:58,01:00:00,"Well, yeah, you can tell what you like."
01:00:00,01:00:02,"Yeah, he was a very eccentric dude."
01:00:02,01:00:03,"He was, he loved being naked."
01:00:03,01:00:06,That's not eccentric.
01:00:06,01:00:08,"No, it's illegal."
01:00:08,01:00:09,It's not illegal.
