start_hhmmss,end_hhmmss,text
01:00:09,01:00:10,It's actually only illegal
01:00:10,01:00:12,if you're causing hard-walled distress or intending to.
01:00:12,01:00:14,"Sorry, you don't need to justify yourself to me."
01:00:14,01:00:18,And that very well-positioned baby carrot
01:00:18,01:00:20,saves your blushes anyway.
01:00:20,01:00:24,"My calendar, it's not a company one."
01:00:24,01:00:27,"It's just, this is actually legal calendar, 2024."
01:00:27,01:00:29,I'm not intending a larval distress.
01:00:29,01:00:31,"And if you feel it, that's on you."
01:00:31,01:00:34,"Well, I apologise if."
01:00:34,01:00:37,Sorry about the way you feel calendar.
01:00:37,01:00:45,"Okay, that's all of our facts"
01:00:45,01:00:47,and thank you so much for listening.
01:00:47,01:00:48,We'll be back again next week
01:00:48,01:00:49,with another episode.
01:00:49,01:00:52,"In the meantime, you can get in touch with any of us"
01:00:52,01:00:54,on various social media accounts.
01:00:54,01:00:55,James.
01:00:55,01:00:57,I'm on Twitter @JamesHarken.
01:00:57,01:00:58,Andy.
01:00:58,01:00:59,@AndrewHunterM.
01:00:59,01:01:00,Liam.
01:01:00,01:01:01,I'm not on anything.
01:01:01,01:01:03,"Good on you, me neither."
01:01:03,01:01:06,"But if you want to get in touch with a lot of us,"
01:01:06,01:01:08,you can email podcast.qi.com
01:01:08,01:01:10,or you can tweet @NoSuchThing.
01:01:10,01:01:12,Or feel free to go to our website
01:01:12,01:01:14,where you can get all our episodes
01:01:14,01:01:16,and links to various other things that we do.
01:01:16,01:01:18,That's no such thing as a fish.com.
01:01:18,01:01:21,"That will also give you a link to Club Fish,"
01:01:21,01:01:23,"which is our special secret society,"
01:01:23,01:01:26,subscriber society where we put all of our good content.
01:01:26,01:01:30,"I think it's where you can buy Andy's new calendar, isn't it?"
01:01:30,01:01:30,Certainly is.
01:01:30,01:01:34,You actually get someone whether you want to or not.
01:01:34,01:01:36,You have to pay extra not to get the calendar.
01:01:36,01:01:41,"And other than that,"
01:01:41,01:01:44,please join us again next week for another episode.
01:01:44,01:01:45,Thank you so much for listening.
01:01:45,01:01:47,We'll see you again.
01:01:47,01:01:47,Goodbye.
01:01:47,01:01:57,[Music]
01:01:57,01:02:07,[BLANK_AUDIO]
