start_hhmmss,end_hhmmss,text
00:19:48,00:19:53,"that Christina Thompson in her book refers to is Commodore George Anson, who was involved in the"
00:19:53,00:19:57,"War of Jenkins-Ear, which I think we must have mentioned. I don't think we have. And again,"
00:19:57,00:20:01,"for international listeners, this was a huge deal for Britain, the War of Jenkins-Ear. I actually"
00:20:01,00:20:07,"think the British listeners, the War of Jenkins-Ear is, I don't think it's GCSE syllabus."
00:20:07,00:20:11,"It was about 70, no, I'm thinking of the Seven Years' War. Sorry, no, disregard that. That was"
00:20:11,00:20:16,"a bigger deal. I would say it goes World War II, World War I, War of Jenkins-Ear are the three main"
00:20:16,00:20:21,"things on the syllabus in English schools, certainly. And basically, there's a War of Jenkins-Ear in"
00:20:21,00:20:27,"1740, which was named after a humorous slam in Parliament, where someone waved an ear around,"
00:20:27,00:20:30,Google it. I thought it was someone. I thought it was someone.
00:20:30,00:20:34,It faded a little. Jenkins-Ear got cut off in a naval fracar.
00:20:34,00:20:37,I thought it did. Didn't the cut off ear get waved around? I think I might have made up
00:20:37,00:20:41,that bit. I've embellished it in my head. Yeah. I don't think you allow props in the
00:20:41,00:20:44,hands of Parliament. That's their rule. You're right.
00:20:44,00:20:47,That's why they've had to remove the official rubber chicken from Parliament.
00:20:47,00:20:50,"It's really said they're an out-of-the-sector, and that's the one prop they have here."
00:20:50,00:20:57,"Anyway, this captain recorded in his diary in 1740 that we dared not venture any sail abroad,"
00:20:57,00:21:01,"so instead we had to put the helm of weather, as in, I think, face the helm towards the wind"
00:21:01,00:21:06,"and man the four shrouds. And in kind of classic 1700s understatement, he recorded,"
00:21:06,00:21:10,"""It proved successful for the end intended, although one of our best men did go overboard."""
00:21:10,00:21:13,"Wow. So, yeah, good trick."
00:21:13,00:21:17,"Feels like a rare move. Yeah, it must have been. They might have been doing it often."
00:21:17,00:21:21,I would say it was what we might call a life hack. It came up a bit. I was reading in a...
00:21:21,00:21:28,In Captain's Weekly. These 12 weird tricks. You won't believe number eight.
00:21:28,00:21:35,"I think it was... Silas, hate him. But, like, was that the only thing they used the sailors for?"
00:21:35,00:21:38,"Could you have used one as an oar, for instance? Lovely. Yeah."
00:21:38,00:21:43,"Your tallest, straightest soldier could be used. Bigster Tony. Yeah, exactly, yeah."
00:21:43,00:21:50,"I didn't... You could look into that, because they did sometimes. I read one thing in an 1810"
00:21:50,00:21:55,"book of sailing instructions that said, ""If you're in a gale, you either man the four shrouds,"
00:21:55,00:21:58,"or if you've got some spare canvas or hammocks,"" which, I guess, the sailors are desperately"
00:21:58,00:22:02,"struggling for hammocks at this point to get up there instead. If you've got some hammocks,"
00:22:02,00:22:06,"you put them up there instead. Yeah. Well, that did actually happen once with the"
00:22:06,00:22:12,"hammocks. But in the 1920s, so that was a good, what, 200 years after? They were still using"
00:22:12,00:22:17,"random hammocks and blankets and things. So why were they doing that? Yeah, so there was a US"
00:22:17,00:22:22,"submarine that ran out of fuel and lost communications. A sail not very useful in the submarine, I would say."
00:22:22,00:22:26,What? What? You would think. You would think. There should be a milk cow around here somewhere.
00:22:26,00:22:32,"We'll be actually taking them all out at that point. They thought, ""How are we going to get home?"""
00:22:32,00:22:39,And so the commanding officer basically commanded his men to grab the hammocks and grab the blankets
00:22:39,00:22:47,and grab the bunk bed frames. And they built masts and sails and put them on their submarine
00:22:47,00:22:52,"and sailed their submarine home. That is so cool. Because submarines weren't mostly surface vessels,"
00:22:52,00:22:55,"weren't they, in the '10s and '20s? Were they? Well, they just called Marines then."
00:22:55,00:23:00,"Well, they couldn't go down for long, could they? They could, like, early proto-submarines."
00:23:00,00:23:02,Did everyone on board have to hold their breath?
00:23:02,00:23:11,"Age of sail stuff is so, is so cool. I just, I really, really like all of it. So I got some"
00:23:11,00:23:15,"nautical slang for you. The manning the foreshadows thing, I thought. This is to a"
00:23:15,00:23:18,guide to nautical slang from John Hard. And it was published only about 30 years ago. So it's
00:23:18,00:23:26,"got some more modern stuff. ""Bronzy bronzy"". It's where you conferred in a battle. That's right."
00:23:27,00:23:32,"Really bad result. Cold and silver. And you're like, ""Ah, bad news. We got bronzy bronzy this time."""
00:23:32,00:23:36,"You didn't even lose. No, that's suntanned, if you're suntanned."
00:23:36,00:23:44,Bunch of bastards. The French. Always correct. But it's also some tangled rope.
00:23:44,00:23:53,"Bunghole. Ah, no. Is it the Agnes? The newest recruit always had to,"
00:23:53,00:23:57,"it was part of the initiation ceremony, wasn't it? Bunghole. No, that's just some cheese."
00:23:57,00:24:00,"What? Cheese. Is it, do they use the cheese sometimes to bung up holes?"
00:24:00,00:24:06,"Yeah, maybe. So it's just, bunghole is cheese. Do you know what a nip cheese was? Oh, no."
00:24:06,00:24:11,"This was in a book called The Sailor's Word book, an alphabetical digest of nautical terms,"
00:24:11,00:24:17,"which is a very, very old. Nip cheese. Nip cheese. So I'm imagining it's not a kind of cheese."
00:24:17,00:24:21,"Is it just mice on boats? Oh, that's a great one. No, it's not quite that."
00:24:21,00:24:28,"We ain't got any ideas. Oh, I mean, yes, but... I'm not sure."
00:24:28,00:24:33,"Is it a nipple thing? No, it's not an Andy. Well, quite, as if, like, you guys are parents,"
00:24:33,00:24:37,"you've heard of like neck cheese, right? Oh, as in they get stuck in the folds."
00:24:37,00:24:41,"Yeah, you know, like, you know, kind of when a baby's breastfeeding and then"
00:24:41,00:24:45,the breast milk kind of dribbles down and then kind of gets stuck in the folds of their neck.
00:24:45,00:24:49,"Yeah, yeah. It's never got to a cheese like status, I have to say, in my experience. I've"
00:24:49,00:24:53,"never been able to ferment it properly. But despite your best efforts, is it?"
00:24:53,00:24:57,"Oh, yeah. I love any cheese. No, it's not the same as that, but on the nipples."
00:24:57,00:25:02,"It's the name for a purse's steward. So the person who looks after the money,"
00:25:02,00:25:07,"if you imagine, like, cutting bits of cheese to kind of share the money."
00:25:07,00:25:11,"He's like cheese pairing. Yeah, exactly like that. Stingy. Yeah, yeah."
00:25:11,00:25:14,Do you know why we call a poop deck a poop deck? Everyone shouts on it.
00:25:14,00:25:21,I don't know. Everyone shouts on it. That's what they did with it. Yeah. What's a poop deck?
00:25:21,00:25:26,"Well, a particular deck on the ship, not the main deck. The back. Well, there's the four deck,"
00:25:26,00:25:30,"there's the main deck and I don't know where the poop deck is actually. Well, if you knew that,"
00:25:30,00:25:34,it might give you a clue. Is it at the back? It's on the stern and it comes from the French
00:25:34,00:25:41,"la poop, which means the stern. Love the boat. And for that reason, you have some other things."
00:25:41,00:25:48,You have the pooping sea and that is where you're going down the sea and the current is going at
00:25:48,00:25:54,the same speed as your stern. So your rudder can't really get any purchase because you're
00:25:54,00:25:57,going at the same speed as the water. That's great. Do you know what a bunting tosser is?
00:25:57,00:26:01,Someone from the Jubilee. Is it? That's right.
00:26:01,00:26:08,"Actually, you're dead on. Oh, have I? Well, it kind of, it is flag-related."
00:26:09,00:26:13,It's a radio operator and that would traditionally have been a signalman
00:26:13,00:26:17,who has is raising the signal flags and so bunting tosser. That's exactly what I said.
00:26:17,00:26:29,"Snorkers. Just sausages guys. Just sausages. Oh, okay. And the beach master. The beach master."
00:26:29,00:26:35,"He was someone who stood on the beach and said, ""This way guys. This way. Keep going. Keep going."
00:26:35,00:26:38,"Keep going. Oh, too far. Too far. Oh, shit. Do you know what? I'm going to give you that."
00:26:38,00:26:42,"Well, and again, this is going to be something completely different."
00:26:42,00:26:47,Did he have those kind of like ping pong bats? That's it. Yeah. It's a superior officer who is
00:26:47,00:26:53,appointed to lead the storming party. The beach master. So yeah. Do you remember we talked two
00:26:53,00:27:01,weeks ago about elephant seals? They're beach masters. Our heaps of jubia. Is there ever been
00:27:01,00:27:07,a situation where an elephant seal beach master and the British naval beach master have been
00:27:07,00:27:14,"mixed up with hilarious consequences? Dozens. Oh, no. The storming party is just one"
00:27:14,00:27:18,"elephant seal with his harem of a hundred females. That's great. I mean, you would run away, wouldn't"
00:27:18,00:27:25,"you? Yeah. Scary. This is sort of relates back to the Bletchleef Act, but there was a Cornish"
00:27:25,00:27:32,"pirate called Robert Culliford, and he once loaded their cannons with China crockery in the hope that"
00:27:32,00:27:39,"it would tear the sails of the opposition ships. That's a great idea, didn't it? How'd that work?"
00:27:39,00:27:44,It did not work well. They actually exploded into a fine powder by the time they had met the enemy
00:27:44,00:27:49,"sails. So just rained down. Nice bit of rain. Yes. I think they also, they did that in the"
00:27:49,00:27:57,"Trojan War, didn't they? And that's why Greek people, to this day, smash plates at the end of a meal."
00:27:57,00:28:02,Have you heard of the pine tree riot? This is a thing that pretty much prompted the American War
00:28:02,00:28:07,"of Independence and was directly related to the navy. Okay. Well, was it tax related? Yes."
00:28:07,00:28:13,"Just getting it all right. I mean, actually, you have got it right. Yeah. So basically,"
00:28:13,00:28:19,"Britain and France both wanted to build ships and to build a ship with a big mast, you need a big"
00:28:19,00:28:23,"tree. I got this, by the way, from a brilliant book called The Age of Wood, which is such a"
00:28:23,00:28:29,"good book. You thought it was something different, didn't you? Britain had very little forest at this"
00:28:29,00:28:34,"time, partly because it's kind of all into ships, and had to get them from America, because in America"
00:28:34,00:28:40,there are these gorgeous massive pine trees that will make a cracking mast. Yeah. And they had all
00:28:40,00:28:45,"sorts of trouble. They basically decreed, right, all trees over 24 inches across, which is what you"
00:28:45,00:28:50,"need for a ship mast. They belong to the Crown, and we mark them with a little arrow and their"
00:28:50,00:28:54,"hours, and you can't have them, you colonists. And in fact, having wide floorboards was a sign that"
00:28:54,00:28:59,"you were a patriotic American colonist that you were just cocking a snook at the British,"
00:28:59,00:29:03,because you had used these wide trees. Nice. Rather than glowing the British up.
00:29:03,00:29:09,You rebel you with your wide floorboards. And this all led to this confrontation where the British
00:29:09,00:29:13,"sent the authorities to try and say, look, these really are our trees, and the Americans kind of"
00:29:13,00:29:16,sent them away with their tail between their legs and embarrassed them and humiliated them.
00:29:16,00:29:21,"And this was a thing called the Pine Tree Riot, and that was 1772, and that pretty much led"
00:29:21,00:29:28,"on to the Boston Tea Party, 1773, and from there, you know, everything went downhill."
00:29:28,00:29:36,"Yeah, but that was like, that was mostly mast related. Interesting. Yeah. The age of wood,"
00:29:36,00:29:42,"by the way, just count the rigs, that'll do it. Fantastic. James, we did spend a 300 paid contract"
00:29:43,00:29:50,"with the British. I was looking a bit into what sails are made out of. And nowadays,"
00:29:50,00:29:56,"they can be all sorts from natural fibers like cotton and blacks to synthetic fibers like nylon,"
00:29:56,00:30:01,"polyester, all of that. But one thing I found that was quite interesting to me was that hemp"
00:30:01,00:30:07,"was used basically throughout the ship for everything. So hemp oil was used in the lamps,"
00:30:08,00:30:13,"the sailors would wear clothing made out of hemp, the ship's logs would be written on hemp paper."
00:30:13,00:30:18,"But it turns out that some of these massive sailing ships, they would actually carry hemp"
00:30:18,00:30:24,"seeds with them so that if they ended up in a shipwreck or they had damage, they could plant the"
00:30:24,00:30:31,"seeds to grow hemp. Grow your ship! And then mend their rope or their canvas, because hemp is one"
00:30:31,00:30:37,of the fastest growing plants on earth. That's fantastic. That's really cool. And they would use
00:30:37,00:30:46,hemp to make the canvas for the sails and the ropes. And the word canvas actually comes from
00:30:46,00:30:54,"the word cannabis. Get away! It's good. Which is the same plant as hemp. Which is, yeah. For any"
00:30:54,00:30:59,"squares listening. Sorry, just quick mention of the old wacky-backy."
00:30:59,00:31:10,"Okay, we should move on to fact number three. And that is Andy."
00:31:10,00:31:16,"My fact is that reindeer can chew in their sleep. Oh, that's useful. It's so cool."
00:31:16,00:31:19,"Gavaskorn must do a good business in the reindeer community, wasn't it?"
00:31:21,00:31:25,So it's really clever. It's all to do with where they live because they live in the very high regions
00:31:25,00:31:34,"of the earth. Not necessarily higher, I would say. I mean further north. Not like on top of Everest."
00:31:34,00:31:38,"Okay, we're being squares about it. This is why you never travel north of Watford. You're like,"
00:31:38,00:31:44,"""Oh, I'm so higher."" I can't get the oxygen. Okay, they live in the Arctic Circle. We're being"
00:31:44,00:31:49,"like, ""Do we be?"" Yeah, sure. And obviously the light there changes a lot, doesn't it? So some"
00:31:49,00:31:54,"of the year, it's always light. Some of the year, it's never light. It's dark for ages."
00:31:54,00:32:00,"And they have a very, very weak body clock. So in summer, they have to eat a great deal all the"
00:32:00,00:32:05,"time to gain weight to survive the winter. And they're ruminants, so they bring food back up"
00:32:05,00:32:10,from one of their stomachs and they keep chewing it. And because they're having to do a lot of this
00:32:10,00:32:16,"during the summer, they will regurgitate food and they will keep chewing it while they're asleep."
00:32:16,00:32:19,We weren't sure before what they were doing. They just look a bit dazed and a bit
00:32:19,00:32:24,dozy. And the Norwegian Institute of Bioeconomy Research have measured their brainwaves while
00:32:24,00:32:29,"they're doing this, standing around chewing. And it sounds like they are in a light stage of sleep"
00:32:29,00:32:32,"while they're eating. That's brilliant. Wait, we couldn't tell if they were asleep. Do they not"
00:32:32,00:32:37,"have their eyes closed? I think brain activity is a better guide, isn't it, than whether you've got"
00:32:37,00:32:41,"your eyes closed. It's not like every time you close your eyes, you're asleep. No, I know. I just"
00:32:41,00:32:45,"feel like I'd know if I just looked at the reindeer. You'd be like, ""Well, they're obviously asleep."""
00:32:45,00:32:46,You've just fell asleep for a second there.
00:32:46,00:32:54,"That thing is really interesting about the body clocks because it means they don't get jet-lagged,"
00:32:54,00:33:00,"right? So our body clock is 24 hours. We deal with the light, the dark, we're on a 24-hour clock."
00:33:00,00:33:07,"If we go through some time zones, then we're not on 24 hours anymore and we're all over the place."
00:33:07,00:33:14,"But if reindeers would do regular flights to Australia, like they might do once a year"
00:33:14,00:33:20,"to deliver presents, for instance, they wouldn't get jet-lagged. And the interesting thing about"
00:33:20,00:33:25,"that is, you know, there are gene variants that cause this and maybe we can turn those genes on"
00:33:25,00:33:29,and off in humans one day to stop humans from getting jet-lagged. That feels like a drastic
00:33:29,00:33:38,"intervention for jet lag. Yeah, we would also grow horns. Yeah, reindeer. Reindeer are cool,"
00:33:38,00:33:41,aren't they? Most of my facts are about the Sami people who are obsessed with reindeer.
00:33:42,00:33:47,"But, well, I say obsessed. Obsessed with, usually, reliant on them for their survival."
00:33:47,00:33:49,"Guys, get over there. Obsessed with oxygen and water."
00:33:49,00:33:57,"No, I love the Sami people. They are the people who live up in the Arctic Circle, really,"
00:33:57,00:34:00,in the northern parts of Norway and Sweden and Finland. The high places of the earth.
00:34:00,00:34:06,"The high places, yes. So they paid their taxes in live reindeer for a long time. They have special"
00:34:06,00:34:11,designations sort of in the sort of equivalent of the Magna Carta of that region. So it's called
00:34:11,00:34:16,the Lap Kodassil and it was a clause added to the 1751 Treaty which designated the borders of all
00:34:16,00:34:21,those countries. And it said that they are allowed to move totally freely across borders because the
00:34:21,00:34:25,reindeer need to move across borders and they need to herd them. Although herding reindeer is
00:34:25,00:34:30,"basically just following them, I think. Oh, really? The reindeer go where they want to find"
00:34:30,00:34:34,food to get sustenance to go to better climates and the Sami people just follow them to make sure
00:34:34,00:34:39,they keep. That is mostly true. You can get them to go in the direction you want. And the way you
00:34:39,00:34:45,do that is you piss in a bottle and you carry it around with you and if they start going in the
00:34:45,00:34:49,"direction you don't want them to go in, you pour a little bit in this direction and they all go,"
00:34:49,00:34:54,"""Oh, piss lovely"" and they all walk towards where the piss smell is because it's like got salt and"
00:34:54,00:35:01,"minerals and stuff like that. Oh, just a life hack, we call that. Good to know. Anyway, they have over"
00:35:01,00:35:07,a thousand words for reindeer and they really do because reindeer are so important. So they have
00:35:07,00:35:13,"like a liami, which means a short fat female reindeer. They have a snari, a reindeer whose"
00:35:13,00:35:18,antlers are short and branched. A nijiru is an unmanageable female. And they're a bit sexist
00:35:18,00:35:25,"these names, aren't they? There's no room for your woke political niceties in the unforgiving"
00:35:25,00:35:30,"tundra, James. Well, there's a lot of snowflakes up there I have heard."
00:35:34,00:35:40,That's cool. They do have a word for a bull with one testicle. So maybe the feminist reindeer are
00:35:40,00:35:45,"getting upset and cutting off the testicles of the males. They have night vision goggles,"
00:35:45,00:35:53,"effectively, inside their eyes. Reindeer. So reindeer's eyes change colour over the season."
00:35:53,00:35:58,So they're golden in summer and then they're blue in the winter. And the reason that's helpful
00:35:58,00:36:05,is that in winter they can see a lot more UV light. And the reason that UV light is helpful
00:36:05,00:36:10,"is that their favourite food is this thing called reindeer moss. Disappointingly, it's a kind of"
00:36:10,00:36:16,lichen. But it's really yummy and it's very nutritious and there's a lot of it about in the
00:36:16,00:36:21,Arctic. So reindeer love it and they like to find it. And it's impossible for a human to find it
00:36:21,00:36:25,because it's pale. But to a reindeer it's incredibly obvious where the patches of reindeer moss are
00:36:25,00:36:29,"because it looks a completely different colour to them. Because I think snow gives off UV light,"
00:36:29,00:36:34,doesn't it? Whereas it doesn't. So it looks like dark because they have this ability to see the UV
00:36:34,00:36:39,"light. They can see what the moss is. So it's very, very cool. They're very well adapted for their"
00:36:39,00:36:44,environment. What's interesting is that they're not actually 100% sure how the eyeball actually
00:36:44,00:36:48,changes from golden to blue. And we should say as well actually that the colour changes not in your
00:36:48,00:36:54,"iris. No, because otherwise it sounds insane that they've discovered this in like 2030. It's like"
00:36:54,00:36:59,"wait a minute, we've domesticated these guys for how long? We've not looked at their eyes? So yeah,"
00:36:59,00:37:03,it's not that you're looking at them on the outside and their eye colour changes. It's the inside.
00:37:03,00:37:08,"It's the thing called the tappatum lucidum, I think I'm saying that correctly,"
00:37:08,00:37:12,which is kind of on the back of the eye and it does all of the reflecting of the light
00:37:12,00:37:18,"around your eye. Well, you would see that, I reckon, is if you were taking a photo of a load"
00:37:18,00:37:23,"of reindeer and one of them looked directly at the flash, I reckon you would see the changes over"
00:37:23,00:37:27,"there. Is that right? Yeah, that's why if you photograph animals in the dark, yeah, that's their"
00:37:27,00:37:31,"tappatum lucidum. Because that's why we get red eyes is because the back of our eyes is red,"
00:37:31,00:37:36,"because it's got a lot of blood in there. And so when the flash goes, you see the light goes into"
00:37:36,00:37:40,the back of your eye where all the blood vessels are. And that's why you get red eyes. Is that why
00:37:40,00:37:45,"you get red eyes? In old, like mostly in old, is it from film photos? Do you get that on digital"
00:37:45,00:37:51,"photos now? I've seen newer photos, yeah. Do you? Yeah, yeah. I've never done that. So that doesn't"
00:37:51,00:37:56,"point that no one had ever taken a photograph of a reindeer. I've never taken it with flash, at least."
00:37:56,00:38:00,"I think it's quite hard to take a photo of reindeer with flash. They're very camera shy, aren't they?"
00:38:00,00:38:07,"Well, they have a very shiny nose. Oh, your nose has come out red in this one and this one."
00:38:09,00:38:13,I didn't know the UK has reindeer. I was incredibly excited to find that out.
00:38:13,00:38:21,"There's one wild herd of reindeer and they're at the Cairngorm reindeer centre, but they are wild."
00:38:21,00:38:26,"It's not a zoo or an enclosure. They're not penned. High up. Very high up, near Inverness. I mean,"
00:38:26,00:38:30,probably in the top of the mountains because it's the Cairngorms I was thinking as opposed to.
00:38:30,00:38:36,"Well, that too. And they were introduced by this great couple, Mikkel Utsi and his wife,"
00:38:36,00:38:41,"Dr Ethel Lindgren in 1952, probably overshadowed by the change of monarchy and the Everest"
00:38:41,00:38:45,"expedition. But still, and they gave them all these furious reasons of why we could, because"
00:38:45,00:38:49,"it's basically early rewilding, you know, just by any other name. And the reasons they gave these"
00:38:49,00:38:53,"two scientists, they said, well, great source of meat, great source of fur, useful for military"
00:38:53,00:38:58,"transport in case of the Cold War turning hot. Sure. I saw that and I couldn't work out what,"
00:38:58,00:39:03,did they imagine that they would be bringing the reindeer to the Soviet Union and using them to
00:39:03,00:39:09,"transport stuff like military equipment or maybe are we being invaded? Nuclear winter,"
00:39:09,00:39:15,maybe. And so we get a load of snow. They might be useful. There was a story in the Russian press
00:39:15,00:39:22,"in the, when was this? It was in the 2000s that criminals like gangs were using reindeer to do"
00:39:22,00:39:28,their crimes. And the reason being that they were in Siberia. So the police are coming to get them.
00:39:28,00:39:32,"And the police had snowmobiles, but the reindeer were quicker than the snowmobiles."
00:39:32,00:39:36,And so the criminals realised that and they would use them to...
00:39:36,00:39:40,"Is there like getaway vehicle? Yeah, yeah, getaway. Cool."
00:39:40,00:39:44,"Would they ride them? No, they'd be pulled on sleighs. Yeah."
00:39:44,00:39:49,"Doesn't sound weird, these got-nick-russian criminals being pulled by..."
00:39:49,00:39:51,And children running to them.
00:39:51,00:39:57,"Well, if you've just robbed a bank, though, you've probably got sacks of money waiting on the back"
00:39:57,00:40:01,of the sleigh. Yeah. And one will fall off. Maybe that's the origin of the Santa Claus myth.
00:40:01,00:40:07,"But the Kengor reindeer-centred staff, very excitingly, they did a naked calendar just"
00:40:07,00:40:12,"a few years ago. Naked humans or naked reindeer? Naked the reindeer, I think,"
00:40:12,00:40:18,were mostly in harnesses and things. They didn't shave them all. They all died of cold.
00:40:18,00:40:23,"No, but there were 17 herders and they're all posing in the hall together to raise money for"
00:40:23,00:40:27,"the Kengor mountain rescue team. Did we approve of this? I mean, like, I don't mind"
