start_hhmmss,end_hhmmss,text
00:00:00,00:00:06,"Hi everyone, welcome to this week's episode of No Such Thing as a Fish. Dan Shriver is"
00:00:06,00:00:13,"not with us today, unfortunately. He is off doing community service. By which I mean he's"
00:00:13,00:00:18,"doing jury duty, which means he won't be here this week or next. But in his place, we are"
00:00:18,00:00:26,"joined by our colleague and very, very good friend, Liying Li. Now, some of you, the Super"
00:00:26,00:00:33,"Duper Fish fans, will already know who Liying is. She has appeared on our Meet the Elves feature in"
00:00:33,00:00:39,Club Fish. She was so good on that that we decided to ask her onto the main podcast. I'm sure you're
00:00:39,00:00:43,"going to really enjoy it. She's absolutely brilliant. If you want to know more about all the other elves,"
00:00:43,00:00:50,"then go to nosuchthingsafish.com/apple and nosuchthingsafish.com/patreon. And if you go there,"
00:00:50,00:00:54,"you can hear all the other episodes of Meet the Elves, as well as Drop As Aligned, which is our"
00:00:54,00:01:00,"mailbag show, compilations, and much, much more. Anyway, there's not much more to say today, apart"
00:01:00,00:01:04,from really hope you enjoy the show with Liying. And on with the podcast!
00:01:21,00:01:26,"Hello, and welcome to No Such Thing as a Fish, a weekly podcast coming to you from the QI"
00:01:26,00:01:31,"offices in Hoban. My name is Anna Tyshinski, and I'm sitting here with James Harkin, Andrew Hunter"
00:01:31,00:01:36,"Murray, and Liying Li, and we are gathered here today with our four favourite facts from the last"
00:01:36,00:01:43,"seven days. So in no particular order, here we go. Liying, what's your fact? My fact this week is"
00:01:43,00:01:50,"that during World War II, Bletchley Park was forced to have a teacup amnesty. So it was an amnesty"
00:01:50,00:01:54,"like where you have to go and turn your teacup in. Yeah, and you won't be arrested. You won't be"
00:01:54,00:01:58,"arrested. And you won't be arrested. There was a memo that was sent out that said, ""It is regretted"
00:01:58,00:02:03,"that owing to losses, it is no longer possible to provide service crockery for morning and afternoon"
00:02:03,00:02:09,"teas."" Wow. And that was all they did at Bletchley. Yeah, they only drank tea. They didn't do any"
00:02:09,00:02:14,important work at all. No longer providing service crockery for morning and afternoon teas. I feel
00:02:14,00:02:19,"like that's the point at which England really started to decline. Yeah, the start of England's"
00:02:19,00:02:25,decline was the middle of World War II. Is that what we're saying? Yeah. The counterpoint.
00:02:25,00:02:31,Wasn't the famous thing about Bletchley was that Alan Turing who worked there used to chain his mug
00:02:31,00:02:38,to the radiator as the story is. And then poor Alan would be teased by people picking the lock
00:02:38,00:02:45,on the chain and nicking his teacup just to annoy him. If he can't set a code on his lock that's
00:02:45,00:02:50,"not possible to break by the others, then I don't know if I trust this guy to win our war."
00:02:50,00:02:56,"The thing about Turing is I read an interview with someone else who worked at Bletchley,"
00:02:56,00:03:00,"and apparently when he wasn't in his office, he used to tie his mug to his hand. So if they go"
00:03:00,00:03:04,"outside, there's a big lake at Bletchley, and they'd often have like a picnic out there,"
00:03:04,00:03:09,and he would be there with it tied by rope to his hand so no one could steal it. Fantastic.
00:03:09,00:03:13,Wasn't there a rumour that they threw crockery into the lake? Do we think that was just a rumour?
00:03:13,00:03:19,"Well, yeah, that's an interesting question. So I found quite a lot of sources, kind of diary"
00:03:19,00:03:25,"entries and things like that. So sources or sources. Very good, very good. I went to Bletchley myself"
00:03:25,00:03:32,"and dredged the lake and found sources, and I found some sources that people like Josh Cooper,"
00:03:32,00:03:37,"who was the really kind of eccentric head of the air section, he would go around the lake,"
00:03:37,00:03:44,finish his coffee and then throw his cup into the lake. And also there's a good reason for
00:03:44,00:03:50,"Alan Turing to chain his mug up because apparently his deputy, Hugh Alexander, would also be known"
00:03:50,00:03:55,to throw his teacups into the lake. Why? Was there a reason for it? Was it like a celebration or was
00:03:55,00:04:00,"it, oh, we've cracked today's code? They were all Greek. Right, so is it? They would just smash"
00:04:00,00:04:04,"the plates and throw the teacups away. Yeah, it feels like that, doesn't it? Yeah, and well,"
00:04:04,00:04:09,it wasn't just lakes as well. There was another memo that said that they ended up finding loads
00:04:09,00:04:16,of cups and sources in the shrubs. It feels like there was some kind of weird Easter egg hunt game
00:04:16,00:04:19,"going on that we don't know about. If we know anything, it's that they were good at keeping"
00:04:19,00:04:23,"secrets at Bletchley. And I think this one is still Official Secrets Act. Yeah, because"
00:04:23,00:04:28,"Liam, you emailed them and asked them if it was true, right? Yeah, well, the thing that was mostly"
00:04:28,00:04:33,"interesting checking was something that said that after the war, the administrators at Bletchley"
00:04:33,00:04:38,"dredged the lake, hoping to find kind of discarded equipment that was used to kind of crack the"
00:04:38,00:04:43,"enigma code and really fascinating kind of historical artifacts. And instead, all they found"
00:04:43,00:04:49,"was giant heaps of cutlery and crockery and resources and stuff, which would have been fantastic."
00:04:49,00:04:54,"So I emailed them just a double check. And I talked to this amazing woman called Heather,"
00:04:54,00:05:00,"hi Heather, if you're listening. And she said that she's always listening. She's actually"
00:05:00,00:05:03,"translating what we're saying into three languages simultaneously. Yeah, it's being"
00:05:03,00:05:10,"encrypted right now. But she said, unfortunately, they think it's a myth or certainly a bit of an"
00:05:10,00:05:17,exaggeration. But they do know that certainly Josh Cooper may have thrown a cup in once.
00:05:17,00:05:24,"So interesting. Yeah, they're drawing us away from the real story. I think that's it. That's it."
00:05:24,00:05:30,"As I said, maybe actually, it's something very secret to do with the way that we cracked codes"
00:05:30,00:05:34,or fought the war. And they just don't want people to know. Fair enough. Should we say for
00:05:34,00:05:37,maybe for international listeners? I think we should. Like what Bletchley was. I think I know
00:05:37,00:05:42,"we've been speaking ten minutes. Right. So early 40s, Britain on the ropes. There's a war going on."
00:05:42,00:05:48,There's a war going on. We're about to go downhill. The tea services declined dramatically.
00:05:48,00:05:54,The Nazis have overrun Europe. And they are communicating using enigma machines.
00:05:54,00:05:58,They look like typewriters. And they allow you very easily to to encrypt what you're saying.
00:05:58,00:06:03,It divides it into blocks of letters. It looks like complete rubbish. And the Germans are so
00:06:03,00:06:08,"confident about the security of enigma, because there are 364 billion possible codes. And there's"
00:06:08,00:06:13,a new code every day. They're so confident they just transmit the messages. They don't try and
00:06:13,00:06:18,jam the signal or anything. So these messages are out there. And they're undecyparable. There's a
00:06:18,00:06:24,"nightmare. You know, completely impossible. Cocky. And that was their mistake. Because Polish"
00:06:24,00:06:28,"intelligence had just cracked enigma just before the war and handed part of the secret, a big part"
00:06:28,00:06:33,"of it, to British intelligence. So at Bletchley Park, which is this country estate in England,"
00:06:33,00:06:38,the British government gathers together hundreds and hundreds of codecrackers and administrators
00:06:38,00:06:43,"and people who set to work, including famously Alan Turing, but thousands of people by the end."
00:06:43,00:06:47,"Who do a variety of stuff, right? Famous chess players or people who are great at solving crosswords."
00:06:47,00:06:51,Yeah. It's an odd collection. Like everyone just sort of piles in to Bletchley Park and start solving
00:06:51,00:06:55,codes and cracking codes. And it goes on until the war ends. And it's amazingly successful.
00:06:55,00:07:01,"It is. And also the thing about Bletchley, again, that it's famous for here is the fact that it was"
00:07:01,00:07:06,"mostly women. So it was a women outnumbered men at Bletchley by about eight to one, I think. And"
00:07:06,00:07:10,"they were there doing that mechanical work of every day, taking down all the codes that were coming"
00:07:10,00:07:16,"through. Yeah. In fact, I hadn't realized that Baroness Trumpington, who was a real character"
00:07:16,00:07:21,"in British politics until she died a few years ago, was at Bletchley. I swear there was a period"
00:07:21,00:07:26,where sort of any elderly posh woman in sort of the nineties when I was growing up had actually
00:07:26,00:07:29,"been at Bletchley at some point. Because also they weren't allowed to say anything, were they?"
00:07:29,00:07:34,"So it was like national secrets for so long, so long, so long. And then the nineties came along"
00:07:34,00:07:39,"and everything got declassified. And everyone went, oh yeah, I was there. Yeah, so was I. I was."
00:07:39,00:07:43,"Well, they had a whole thing where they were trying to recruit what they called boffins and"
00:07:43,00:07:50,"devs, boffins being kind of clever people and devs being debutants, as in high society,"
00:07:50,00:07:56,"socialite women. Oh, why? Because they felt that, you know, they had that kind of level of education."
00:07:56,00:08:01,And they were often not bilingual. Exactly. They often they could speak French or they could speak
00:08:01,00:08:05,"German or they'd had a university education. And so as you say, it turns out that a lot of the"
00:08:05,00:08:11,"people there came from quite high society and then they found themselves, you know, bunking with all"
00:08:11,00:08:15,"of these. Yeah. In the class. In Bletchley. Because they were posh, they were often like quite"
00:08:15,00:08:20,eccentric and prone to misbehavior because they could get away with it. So a lot of the women
00:08:20,00:08:24,"would bunk off constantly and go and shag their boyfriends. For instance, there was one woman who"
00:08:24,00:08:27,"was in charge called Pamela Rose, who she was actually an actress. She wanted to be in the"
00:08:27,00:08:33,West End. And she was in charge of overseeing 50 women in one of the huts. And one of them was
00:08:33,00:08:37,"actually Baroness Trumpington, who was called Jean Campbell Harris at the time. And at one point"
00:08:37,00:08:42,she had to stuff Baroness Trumpington into a laundry basket and rolled her down the corridor
00:08:42,00:08:47,"into an officer's room, I think, who was quite annoyed, who was trying to do serious work."
00:08:47,00:08:51,Was that to make her escape? I think it might have been a bit of japery. I'm not sure if it was a
00:08:51,00:08:56,"genuine punishment or having a half. Bad news. Bad news. We've lost another 30,000 troops at C."
00:08:56,00:09:00,"One of the convoys has been sunk by the U-boats, which was due to us not cracking a vital message."
00:09:00,00:09:04,Good news. We all had a great team building exercise. We've got a laundry basket.
00:09:04,00:09:08,"I think it was amazing. They would, when they turned up, they would be asked two questions."
00:09:08,00:09:14,"One, do you like crossword puzzles? Two, are you engaged to be married? That was your first two"
00:09:14,00:09:18,"questions. And then if you said, yes, I like crosswords and no, I'm not engaged, they go,"
00:09:18,00:09:24,"okay, now you can have an interview. Oh, you're through. I know also the thing,"
00:09:24,00:09:27,"the amazing thing about the secrecy is just how secret it was, as in, you don't know what the"
00:09:27,00:09:30,person in the next hut is doing. You don't know what the people in the same room as you were doing.
00:09:30,00:09:36,So often you don't know what you're doing. I've been in some jobs where I didn't know what I was
00:09:36,00:09:40,doing. I didn't really know what anyone else was doing. Is it possible you've worked at GCHQ
00:09:40,00:09:45,without knowing it? That could be true. I thought I was an accountant because it's just numbers.
00:09:45,00:09:50,"Oh my, you've done some significant stuff, I bet, without really. But who?"
00:09:50,00:09:56,Because you're just like cracking these cut and you're grinding through huge numbers of
00:09:56,00:10:00,"huge amounts of information. And Churchill wrote a six volume history of the second reward,"
00:10:00,00:10:04,"never mentioned Bletchley, because it was still super, super secret, because they had to hide the"
00:10:04,00:10:07,"fact that towards the end of the war, Hitler was an open book. As in, Bletchley Parker were getting"
00:10:07,00:10:12,"and translating and deciphering his messages before, like, Rommel or Girl or whatever. That's"
00:10:12,00:10:18,"incredible. And then you have to turn, they haven't. Yeah. And the fact that the secrecy lasted for so"
00:10:18,00:10:22,"long as well, there are so many veterans who, you know, took the secrets of their graves or"
00:10:22,00:10:28,"there are amazing stories of, you know, husband and wives who met at Bletchley, but didn't actually"
00:10:28,00:10:31,know what the other person was doing. And then they had kids and they couldn't tell their kids
00:10:31,00:10:37,what they were doing during the war as well. And so it was just decades and decades and decades
00:10:37,00:10:43,of secrecy. And what's really fascinating to me is that the first person to kind of publish a book
00:10:43,00:10:49,about what happened at Bletchley was treated as such a traitor by a lot of the veterans who were
00:10:49,00:10:54,"there. It was quite self aggrandizing. It was, you know, kind of like, oh, I did this and I did"
00:10:54,00:10:58,this. That's vital to the war effort and all of this. That was probably another reason he sounded
00:10:58,00:11:02,"like a bit of an arrogant prick. But for a lot of the veterans at Bletchley, it was one of those"
00:11:02,00:11:06,"things where it was, you know, it's secret and we're going to take these secrets to our graves."
00:11:06,00:11:11,"Have you guys been there? Yeah. A while ago, actually, I can't remember much about it,"
00:11:11,00:11:16,"but that's okay. I was there for a public speaking competition as a teenager. Unfortunately,"
00:11:16,00:11:23,"you were engaged to be married, so you could get a job there. Crosswords. That's cool."
00:11:23,00:11:26,Do you know if you were interviewed there? Another question you might be asked was if you
00:11:26,00:11:32,"were interviewed by Dilly Knox, who was one of the most important people at Bletchley and he was a"
00:11:32,00:11:39,"real eccentric. And he would ask people the question, which way round the hands of a clock go?"
00:11:39,00:11:42,Brilliant. What would you say for that? Mark wise.
00:11:42,00:11:47,You're out. You put the minute hand on first and then the hour hand.
00:11:47,00:11:50,And then the second hand. You're building a clock.
00:11:50,00:11:54,"Oh, I see you've, you've interpreted it that way. Second hand goes right at the bottom, I think."
00:11:54,00:11:58,"You've thought outside the box, but no, the correct answer according to him is it depends"
00:11:58,00:12:01,whether you're looking at the clock or whether you are the clock. Brilliant.
00:12:01,00:12:08,That's interesting because I imagine no one got that right. So how on earth do we get anyone?
00:12:08,00:12:14,It sounds a lot like the kind of questions that you think get asked at Oxbridge interviews
00:12:14,00:12:18,"and things like that. And considering that so many people there were from Oxbridge,"
00:12:18,00:12:22,maybe they did kind of think outside the box in that way. I think it was that sort of thing.
00:12:22,00:12:26,What was the name of the person that you said wanted to be a West End actress?
00:12:26,00:12:30,"That was Pamela Rose. Pamela Rose. So I wonder when Pamela Rose was at Bletchley,"
00:12:30,00:12:33,whether or not she joined the Bletchley Park Dramatic Club.
00:12:33,00:12:40,"She did. She loved it. Yeah, I'm sure she did. I loved reading about this. So at Bletchley,"
00:12:40,00:12:44,"it turns out that there was quite a campus-like feel there. A lot of people, you know, their"
00:12:44,00:12:50,"university was interrupted by the war and they got recruited by Bletchley. And so,"
00:12:50,00:12:55,one particular veteran described it as being like their university. So there was all the other kind
00:12:55,00:13:02,of stuff that you'd associate with uni. There was like social clubs. They had Christmas pantos
00:13:02,00:13:07,"that they put on. And he's like, I don't remember any of this at uni. I remember being de-bagged a"
00:13:07,00:13:15,lot. You were the one in the laundry basket with me. But one person that I found that I
00:13:15,00:13:21,"thought was so interesting is that Olivia Newton-John's dad, Bryn Newton-John, he was an officer"
00:13:21,00:13:28,"at Bletchley and he was a member of the Drama Club. No way, really. He'd find his name Bryn"
00:13:28,00:13:33,Newton-John in all of the programmes for all the shows that they'd put on. Just on the results
00:13:33,00:13:38,"they got. Because it is quite abstract and it's very sort of, you know, there's people like"
00:13:38,00:13:41,"poshos in the countryside and actually lots of them weren't posh. Lots of them were Rens,"
00:13:41,00:13:45,"women's Royal Naval Service, who were getting on with the like basic work every single day."
00:13:45,00:13:50,"But some of the things they did, for example, they worked out the location of every milk cow"
00:13:50,00:13:56,in the Atlantic Ocean. That's pretty easy. I reckon I could do that now. Not the one on the bottom.
00:14:00,00:14:05,So the milk cows were the tankers that were in the Atlantic and they were to refuel
00:14:05,00:14:10,"German U-boats. Oh, really? There were, you know, a couple of dozen maximum and they obviously were"
00:14:10,00:14:15,the most significant thing for the entire U-boat operation. They were all located thanks to Enigma
00:14:15,00:14:18,"and they were all sunk. So the U-boat, that was a big part of winning the war against the U-boats."
00:14:18,00:14:23,"I really like one of the ways that they worked. Like you say, the Germans had improved the"
00:14:23,00:14:28,"Enigma. So we did know how they worked, but it was still hard to crack the codes every day."
00:14:28,00:14:33,"And so what you needed was some information that you knew. So when they sent the information,"
00:14:33,00:14:38,you know what you're looking for. And so what they did was they would drop bombs in very obvious
00:14:38,00:14:43,places and they drop in a place where you know exactly where it is. And so the Germans then
00:14:43,00:14:49,"would send a message saying there's been a bomb in, you know, 25 miles north of Dresden or something."
00:14:49,00:14:54,"And you know what 25 miles north of Dresden is. And you know, probably might even by then know"
00:14:54,00:14:59,"that you're looking for the word ""Meinen"", which is German for a mine or a bomb. So you would know"
00:14:59,00:15:04,"what you're looking for. And it's called ""Gardening"". I think this is the kind of thing where we're like,"
00:15:04,00:15:07,"that's so clever. And if you were one of the actual code breakers listening, you'd be like,"
00:15:07,00:15:14,"God, that's the most basic thing. Wow. Can I give you something on crockery and throwing"
00:15:14,00:15:20,crockery around? So this fact was perhaps about people throwing crockery. So I thought I'd look
00:15:20,00:15:26,at plate smashing in Greece. I've seen various articles about where it comes from. And some
00:15:26,00:15:31,"people say, oh, it's an ancient Greek thing that they would do in funerals. I'm not really so sure."
00:15:31,00:15:38,"I think it might be quite a modern thing that came in the 1960s and 70s. But actually in 1969,"
00:15:38,00:15:45,"it was banned by the military dictator, Georgeus Papadopoulos. He banned any plate smashing in"
00:15:45,00:15:50,"Greece because it was so dangerous. Oh, not because we didn't have enough crockery for"
00:15:50,00:15:57,"art and tea anymore. No, because they set up these factories where you would make fake crockery."
00:15:57,00:16:02,"Amazing. So it was like, it was real crockery. It was made of china and stuff, but it was like"
00:16:02,00:16:05,"really low quality. There was no patterns on it, anything like that. It was just something that"
00:16:05,00:16:12,was made deliberately so you could then smash it. And there were 53 manufacturers of these fake
00:16:12,00:16:19,"plates in Thessaloniki alone. Stop it! Yeah, honestly. Very good. How many plates were being"
00:16:19,00:16:27,"smashed? There was in the 60s up to 100,000 per month, it's estimated. Why? At the end of your"
00:16:27,00:16:31,"meal, if you've got a great restaurant, they'll smash the plates for you. It's just like a"
00:16:31,00:16:34,"tradition. They'll smash it for you. You don't even get to do the smashing. Well, you used to do it"
00:16:34,00:16:40,"yourself and then like health and safety came in and you would get like some waiters would,"
00:16:40,00:16:44,"you know, put on their glasses so that they don't get any peace in their eyes and do it."
00:16:44,00:16:46,They'd actually take them away for the controlled explosion.
00:16:46,00:16:53,And today there's only one manufacturer of fake plates in the whole of Thessaloniki.
00:16:53,00:16:58,That was actually what we remember when the Greeks had the terrible recession around the time of the
00:16:58,00:17:02,"credit crunch. That was mostly caused by the fake plate industry, wasn't it? Yeah. But like,"
00:17:02,00:17:06,what is a fake plate? Is in what's a fake plate? It's interesting because you could still use them
00:17:06,00:17:11,as a plate. Absolutely. But they're much cheaper to manufacture. They're not bothered if there's
00:17:11,00:17:15,cracks in there or anything like that. There's no patterns on there. They're just white
00:17:15,00:17:19,"china plates. Not as fun to smash, though. I bet there were proper hardcore smashes who still went"
00:17:19,00:17:24,"for the sort of £100 property there. Yeah. Do you still go to the, to the museum in Athens?"
00:17:24,00:17:30,Is this why we're not giving the Parthenon marbles back? Do you think they're going to be used to
00:17:30,00:17:37,"this sort of smash orgy? I don't know if you've seen the Elgi marbles, but they are quite smashed"
00:17:37,00:17:41,"orgy. Well, why do you think they got like that in the first place?"
00:17:41,00:17:52,"Okay, it's time for fact number two. And that's my fact. My fact is that 18th century sea captains"
00:17:52,00:18:00,sometimes use their sailors as sails. Brilliant. This is actually in a book called See People
00:18:00,00:18:04,"by a woman called Christina Thompson, and it's such a good book. It's so fantastically written."
00:18:04,00:18:11,And this is a practice called Manning the Four Shrouds. And it was used throughout kind of the
00:18:11,00:18:16,"great age of sail, which I suppose was 15th century to 19th century, a long period. And basically,"
00:18:16,00:18:19,"if the wind is too high, if there's a big gale, if there's a storm, then it's very dangerous to put"
00:18:19,00:18:25,your sails up because they could be completely shredded. The mask could be toppled. The boat's
00:18:25,00:18:28,"going to be there. Oh, yeah. You don't want to get any of your sails shredded instead. Put one of"
00:18:28,00:18:35,"your men up there. We've got 400 sailors and only one big sail. No, that makes sense."
00:18:35,00:18:42,Send up Stanley Big Shirt. Is that a reference to my friend? Yeah. That's very good because we've
00:18:42,00:18:45,never mentioned him on here. Probably. I don't think so. You used to have a friend whose nickname
00:18:45,00:18:50,"was Stanley Big Shirt. That's so good because it worked for the listener, and then it worked"
00:18:50,00:18:55,even better for James on a higher level. Thank you. So this is where the captain of a ship would
00:18:55,00:19:00,"say to Stanley Big Shirt and Co, ""Could you please climb up onto the Four Shrouds?"" So the"
00:19:00,00:19:06,"shrouds of a ship are, if you see a big sailing ship, there's what look like, you know, like a salt"
00:19:06,00:19:12,"coarse rope platters and climbing frames. Yeah, rigging frames kind of thing. Yeah, exactly. That"
00:19:12,00:19:16,"rigging is what the shrouds are, and they're what support the masks, and you can climb up them really"
00:19:16,00:19:20,"easily. So the sailors would all climb up, and they'd spread out their hands and legs, and they'd"
00:19:20,00:19:26,"literally just face up against the wind. Just sounds like utter nonsense, doesn't it? So they'd need"
00:19:26,00:19:33,a density of sailors such that it was the solid wall of sailors. Yeah. That's a lot of sailors.
00:19:33,00:19:36,"Well, it's a lot of sailors. So it's kind of holding, can't it, and still be pretty functional,"
00:19:36,00:19:40,but you get most of the effect. I think that was because you didn't want it to be too strong. That
00:19:40,00:19:43,"was the thing. They're not going to be as strong as a sail, but there was one. There was a ship"
00:19:43,00:19:48,"captain by Sir Hyde Parker in the 1700s, where 200 sailors were sent up into the rigging. The one"
