start_hhmmss,end_hhmmss,text
00:33:04,00:33:06,by recording the voice track first
00:33:06,00:33:08,and then they puppeteer's mime to it.
00:33:08,00:33:11,"And of course, they're made of rubber."
00:33:11,00:33:14,So when a puppet touched the desk
00:33:14,00:33:16,"and it was a pre-recorded thing, nothing happened."
00:33:16,00:33:18,"So the two guys, two sound guys,"
00:33:18,00:33:21,absolute geniuses stood up literally all night
00:33:21,00:33:23,"doing all that, you know, touching the table,"
00:33:23,00:33:26,"banging each other's heads, scratching their clothes."
00:33:26,00:33:28,And suddenly it comes alive.
00:33:28,00:33:30,"No, it was an amazing thing"
00:33:30,00:33:33,'cause actually we owe the whole existence
00:33:33,00:33:34,of Splitting Image to those two guys.
00:33:34,00:33:36,- Yeah.
00:33:36,00:33:39,I was talking about this Foley artist called Alison D. Moore.
00:33:39,00:33:40,I read an interview with her.
00:33:40,00:33:41,It was really interesting.
00:33:41,00:33:43,She said that there are more astronauts on earth
00:33:43,00:33:46,than people working in Foley at the moment.
00:33:46,00:33:47,- What?
00:33:47,00:33:50,- So I reckon that there's about 100 people doing Foley.
00:33:50,00:33:54,And there are more people who've been in space than that.
00:33:54,00:33:56,She said that they can literally change the rating
00:33:56,00:33:59,of a film by the sounds that they put in.
00:33:59,00:34:04,"So if there is, for instance, an oral sex scene,"
00:34:04,00:34:07,"if they make it sound really filthy,"
00:34:07,00:34:10,then it can go up from a 15 to an 18.
00:34:10,00:34:12,"- But what's the, what's the, is it just like..."
00:34:12,00:34:16,"- That's normal oral sex, that's how that sounds."
00:34:16,00:34:19,- I think that downgrades it to like a U if you do that.
00:34:20,00:34:23,"- It is important to say that the Foley is a specific thing,"
00:34:23,00:34:25,which is something that's made on the spot.
00:34:25,00:34:27,Isn't it not like a recording?
00:34:27,00:34:28,- Yeah.
00:34:28,00:34:29,- That doesn't count as a Foley.
00:34:29,00:34:31,- You get lots of sound effects artists.
00:34:31,00:34:34,- But I just wanted to give some people a hint
00:34:34,00:34:37,"of things, recordings that could be useful in other contexts."
00:34:37,00:34:39,"So for example, the roar of a leopard"
00:34:39,00:34:41,sounds like someone roughly sawing wood.
00:34:41,00:34:42,- Okay.
00:34:42,00:34:43,- Which is useful.
00:34:43,00:34:44,"- Okay, good to know."
00:34:44,00:34:47,"- Bill Bailey said, without the beat in the background,"
00:34:47,00:34:49,jazz basically sounds like an armadillo
00:34:49,00:34:51,was let loose on the keyboard.
00:34:51,00:34:52,So if you wanted that sound...
00:34:52,00:34:56,"- It's amazing though, because since BBC started"
00:34:56,00:35:00,"recording their stuff and other massive production studios,"
00:35:00,00:35:03,there's these huge Foley archives that now exist.
00:35:03,00:35:05,And a lot of them have been made available to the public.
00:35:05,00:35:08,"So the BBC have over 33,000 of its sound effects"
00:35:08,00:35:11,that are just on a website you can download
00:35:11,00:35:13,and use as part of whatever you want to use.
00:35:13,00:35:15,It's open to the public.
00:35:15,00:35:17,Hanna-Barbera also is used a lot.
00:35:17,00:35:21,So Hanna-Barbera that made the Flintstones and so on.
00:35:21,00:35:24,Their sounds have been used in so many places
00:35:24,00:35:26,you wouldn't expect multiple Mario Kart
00:35:26,00:35:28,and Mario video games have the sounds
00:35:28,00:35:30,that would have been used in the Flintstones
00:35:30,00:35:32,that are sort of peppered all the way through.
00:35:32,00:35:33,- Really?
00:35:33,00:35:34,- Yeah.
00:35:34,00:35:35,- And they made those sounds by getting a pterodactyl
00:35:35,00:35:37,to put their beak on a record player.
00:35:37,00:35:40,(laughing)
00:35:40,00:35:43,"- Yeah, but it's, yeah, it's pretty wild."
00:35:43,00:35:46,"And we missed, I think it was the first 10 years"
00:35:46,00:35:49,of any kind of recording with BBC radio
00:35:49,00:35:52,until the arrival of a thing called the Blatner phone.
00:35:52,00:35:54,It was only one machine that was recording
00:35:54,00:35:55,all the radio output at the time
00:35:55,00:35:57,that was coming from the BBC.
00:35:57,00:35:59,"And it wasn't a great recording necessarily,"
00:35:59,00:36:03,"but the machine, the spools that would hold the tape"
00:36:03,00:36:05,were ginormous and the tape would be traveling
00:36:05,00:36:06,at really high speeds.
00:36:06,00:36:09,So it would be traveling at five feet per second
00:36:09,00:36:11,"to record it, which was really dangerous"
00:36:11,00:36:13,for anyone who had to monitor the tape
00:36:13,00:36:15,"because if it broke off,"
00:36:15,00:36:18,it would be like shrapnel shooting out the tape.
00:36:18,00:36:19,And it was like a razor's edge.
00:36:19,00:36:21,You would be cut to pieces if it shot.
00:36:21,00:36:23,"- Oh, like a ninja?"
00:36:23,00:36:23,"- Yeah, yeah."
00:36:23,00:36:24,So it was incredibly dangerous.
00:36:24,00:36:25,- That's a great murder mystery.
00:36:25,00:36:26,That should be a Jonathan Creek episode.
00:36:26,00:36:28,"- Yes, that's true, yeah."
00:36:28,00:36:29,"And that would happen, it would be more dangerous"
00:36:29,00:36:32,"because eventually they got two of these machines,"
00:36:32,00:36:34,"the Blatner phone, which meant that they could change tape"
00:36:34,00:36:36,on one while recording on the other.
00:36:36,00:36:38,So that was a seriously dangerous thing.
00:36:38,00:36:40,They used to have to wear heavy gloves
00:36:40,00:36:42,and any time they were doing something
00:36:42,00:36:42,"that looked a bit delicate,"
00:36:42,00:36:44,they would run to the other side of the room
00:36:44,00:36:46,in case it exploded on them.
00:36:46,00:36:47,"- Hang on, presumably when you change the tape,"
00:36:47,00:36:48,"you stop the, you stop the tape."
00:36:48,00:36:50,"- Yeah, yeah, but just, I mean, the think and overheat,"
00:36:50,00:36:53,"they had incidences basically, where it just got too much."
00:36:53,00:36:55,- It was the most dangerous job in the world
00:36:55,00:36:57,working for the BBC in the '50s.
00:36:57,00:36:57,- It was.
00:36:57,00:36:58,- I'm the '70s.
00:36:58,00:36:59,(laughing)
00:36:59,00:37:02,(upbeat music)
00:37:02,00:37:07,"- Okay, it is time for a final fact of the show"
00:37:07,00:37:09,and that is Anna.
00:37:09,00:37:10,"- My fact this week is that every year,"
00:37:10,00:37:14,tens of thousands of people attend Rwanda's
00:37:14,00:37:17,annual gorilla baby naming ceremony.
00:37:17,00:37:21,"- Oh, that sounds good. - Isn't it sweet?"
00:37:21,00:37:22,It is good.
00:37:22,00:37:23,- Is it sweet?
00:37:23,00:37:24,"- It is sweet, yes."
00:37:24,00:37:25,"Yeah, yeah, nothing dark to it."
00:37:25,00:37:29,"Quita izina, which means to give a name in Nkinyawanda,"
00:37:29,00:37:31,which is the language.
00:37:31,00:37:33,And this is so cool.
00:37:33,00:37:36,It's this whole full week of activities devoted to gorillas
00:37:36,00:37:39,and it's all about their conservation and their protection
00:37:39,00:37:40,'cause there's a huge deal in Rwanda.
00:37:40,00:37:42,And the highlight is this naming ceremony
00:37:42,00:37:46,"where they've got a huge, really cool looking stage,"
00:37:46,00:37:49,which is a wicker sculpture of a gorilla
00:37:49,00:37:52,or a bamboo sculpture of a gorilla the size of a house.
00:37:52,00:37:55,And then a celebrity and all researchers.
00:37:55,00:37:56,- Who's the celebrity?
00:37:56,00:37:58,- Lots of different celebrities.
00:37:58,00:37:59,We'll get to the list.
00:37:59,00:38:01,- Probably some of your mates.
00:38:01,00:38:02,(laughing)
00:38:02,00:38:05,- John Richardson's gotta have a look in naming a gorilla.
00:38:05,00:38:07,"- John Keveny goes there often, doesn't he?"
00:38:07,00:38:08,- Yeah.
00:38:09,00:38:11,- There are multiple characters who will come up on stage
00:38:11,00:38:14,and then they'll name one of the new baby gorillas
00:38:14,00:38:15,that's been born that year.
00:38:15,00:38:16,And a big picture comes up behind
00:38:16,00:38:19,"and they say, I name this gorilla"
00:38:19,00:38:20,and they give them sensible.
00:38:20,00:38:22,They don't call them sort of barry.
00:38:22,00:38:26,"- Well, quite a lot of the Arsenal footballers go there"
00:38:26,00:38:28,'cause Arsenal are sponsored by Rwanda.
00:38:28,00:38:29,"- So they are, yeah."
00:38:29,00:38:31,So 'cause the president's a big Arsenal fan.
00:38:31,00:38:32,"- He is, yeah."
00:38:32,00:38:34,"So in 2018, Alex Scott went."
00:38:34,00:38:37,"In 2019, David Louise went."
00:38:37,00:38:42,"In 2020, Hector Bellerin and Patrick Obamiang went."
00:38:42,00:38:47,"Obamiang named a 14-year-old gorilla Ligitego, meaning goal,"
00:38:47,00:38:53,"and Bellerin chose Mjugarriro, meaning defender."
00:38:53,00:38:55,So it's like appropriate stuff for them.
00:38:55,00:38:58,So maybe next year they'll be runner-up
00:38:58,00:39:01,or smashed by Paris Saint-Germain.
00:39:01,00:39:02,- Boom.
00:39:04,00:39:07,- So do these poor gorillas have to wait
00:39:07,00:39:10,sometimes nearly a year before they get a name?
00:39:10,00:39:11,"- Yes, I suppose they do."
00:39:11,00:39:12,They probably have a holding name.
00:39:12,00:39:15,- They might have their own name in their own language
00:39:15,00:39:17,and they might not care what we call them.
00:39:17,00:39:18,"- No, I doubt it."
00:39:18,00:39:19,"- That's it, well, no, they couldn't."
00:39:19,00:39:21,"I don't know about gorillas,"
00:39:21,00:39:23,but did you know that Marma sets
00:39:23,00:39:26,are the only non-human primate that call each other by name?
00:39:26,00:39:27,- Do they?
00:39:27,00:39:28,- Yeah.
00:39:28,00:39:29,"And they say, ""Hello, Barry."""
00:39:29,00:39:31,- And there's always Barry.
00:39:31,00:39:32,- Always Barry.
00:39:32,00:39:33,They all call Barry.
00:39:33,00:39:34,"- It's got a point in us, really."
00:39:34,00:39:35,- Of course it may not be their name at all.
00:39:35,00:39:37,"It may be just a, all right, Sam."
00:39:37,00:39:38,- It's just a burp.
00:39:38,00:39:43,"Idris Elba called, they get big names."
00:39:43,00:39:45,"Called Juan Narame, meaning long life."
00:39:45,00:39:48,David Attenborough's obviously named one.
00:39:48,00:39:49,"But yeah, it sounds really fun."
00:39:49,00:39:51,And the idea is to protect gorillas.
00:39:51,00:39:53,And the story of protecting gorillas in Rwanda
00:39:53,00:39:56,"is an amazing success story, isn't it?"
00:39:56,00:39:57,So they-
00:39:57,00:39:58,- Diane Fossey.
00:39:58,00:40:02,"- Diane Fossey, yes, who I'm sure we'll talk about."
00:40:02,00:40:04,"It's estimated that one mountain gorilla,"
00:40:04,00:40:05,and it's mountain gorillas there.
00:40:05,00:40:08,So there are four species and subspecies of gorilla.
00:40:08,00:40:11,But one mountain gorilla can generate $3 million
00:40:11,00:40:12,during its lifetime from tourism.
00:40:12,00:40:15,And that all goes back into conservation.
00:40:15,00:40:16,To protection.
00:40:16,00:40:19,"To the extent, and I found this really interesting."
00:40:19,00:40:20,"So there are, like I say,"
00:40:20,00:40:23,four species and subspecies of gorilla.
00:40:23,00:40:24,"There's western lowland,"
00:40:24,00:40:29,"of which there are between 150 and 300,000."
00:40:29,00:40:29,Remember that.
00:40:29,00:40:31,"There's cross river gorillas,"
00:40:31,00:40:32,of which there are about 300.
00:40:32,00:40:33,"Mountain gorilla,"
00:40:33,00:40:35,"I think there are about 800 to 1,000."
00:40:35,00:40:38,"And grower's gorilla, 6,500."
00:40:38,00:40:40,"All are critically endangered,"
00:40:40,00:40:43,"except one, which is just endangered."
00:40:43,00:40:43,- Right.
00:40:43,00:40:45,"- Now, have you memorized all the figures?"
00:40:45,00:40:47,"- Yeah, the lowland western gorillas, you said."
00:40:47,00:40:48,- There you go.
00:40:48,00:40:50,"The western lowland, 150 to 300,000."
00:40:50,00:40:52,Surely they're just endangered.
00:40:52,00:40:54,"No, they're critically endangered."
00:40:54,00:40:56,And the mountain gorilla from Rwanda
00:40:56,00:40:58,"is the only one that's only endangered,"
00:40:58,00:41:00,"even though there are only 800,"
00:41:00,00:41:01,because their numbers are going up.
00:41:01,00:41:02,- Because they're going up.
00:41:02,00:41:04,"But that's, I think that's how they do it, right?"
00:41:04,00:41:05,"- No, of course it's how they do it."
00:41:05,00:41:07,But I think it's an extraordinary discrepancy
00:41:07,00:41:11,"between 300,800, but only one is critically endangered."
00:41:11,00:41:13,"- And it's kind of surprising that they're going up,"
00:41:13,00:41:16,"well, certainly over the last 30 years or so,"
00:41:16,00:41:18,'cause they had a big old war in Rwanda.
00:41:18,00:41:19,- Yeah.
00:41:19,00:41:21,"- And in actual facts,"
00:41:21,00:41:24,there were 16 gorillas killed during that civil war.
00:41:24,00:41:26,But the population still--
00:41:26,00:41:27,- This is a problem now.
00:41:27,00:41:29,Gorillas or guerrillas?
00:41:29,00:41:32,"- Yeah, guerrillas or guerrillas."
00:41:32,00:41:34,"- I should check that actually,"
00:41:34,00:41:36,that I'm not talking about guerrillas.
00:41:36,00:41:38,- What do you call a gorilla with a machine gun?
00:41:38,00:41:39,"- I don't know, John."
00:41:39,00:41:40,- Sir.
00:41:40,00:41:42,(laughing)
00:41:42,00:41:45,"- But yeah, basically the gorillas moved up"
00:41:45,00:41:46,into the mountains away from all the humans
00:41:46,00:41:48,and all the violence.
00:41:48,00:41:50,And so that's why their numbers went way higher.
00:41:50,00:41:52,"And also, none of the factions"
00:41:52,00:41:54,wanted the bad publicity of killing gorillas.
00:41:54,00:41:55,- Yeah.
00:41:55,00:41:56,"- So yeah, they--"
00:41:56,00:41:58,"- And that is amazing, but mostly the reason,"
00:41:58,00:41:59,"'cause it is such a success story,"
00:41:59,00:42:01,is because Rwanda's run an extraordinary
00:42:01,00:42:04,"protection program since then,"
00:42:04,00:42:06,which basically means that they--
00:42:06,00:42:07,- How have they stopped the poaching?
00:42:07,00:42:09,Is there sort of security force?
00:42:09,00:42:10,- There's just been an amazing investment
00:42:10,00:42:11,in local communities.
00:42:11,00:42:12,"So a lot of the poachers,"
00:42:12,00:42:14,"'cause people, I always think poachers get a bad rep,"
00:42:14,00:42:16,"largely they're poaching for survival, right?"
00:42:16,00:42:17,That these were people in a country
00:42:17,00:42:20,"that were so poor, people were struggling,"
00:42:20,00:42:22,and the poachers are now involved in conservation.
00:42:22,00:42:23,So there are a lot of poachers
00:42:23,00:42:25,who do various tourist things now.
00:42:25,00:42:28,And it's just giving them real national pride
00:42:28,00:42:30,"in this thing, like this big ceremony,"
00:42:30,00:42:31,which means it literally doesn't happen.
00:42:31,00:42:32,"- Yeah, because they worked out, as you say,"
00:42:32,00:42:35,one gorilla can bring 3 million in an entire lifetime.
00:42:35,00:42:38,So it's more profitable now to be a tourist guide
00:42:38,00:42:40,rather than to kill one and get a one-off payment.
00:42:40,00:42:44,"Which, and so that, I mean, it has largely come down"
00:42:44,00:42:46,from the stuff I've read to Diane Fosse.
00:42:46,00:42:48,"I mean, I know she's the ambassador name,"
00:42:48,00:42:51,"but she really kind of, she moved there back in the '70s,"
00:42:51,00:42:53,"plopped herself on the side of the mountain,"
00:42:53,00:42:55,when there was virtually no one doing that.
00:42:55,00:42:56,"She was given a name,"
00:42:56,00:42:59,which was the woman who lives alone in the forest
00:42:59,00:42:59,by all the locals.
00:42:59,00:43:01,"- Big ceremony, was it?"
00:43:01,00:43:03,(all laughing)
00:43:03,00:43:05,- Natalie Potman Cableog.
00:43:05,00:43:07,- She had to wait a year before they thought of it.
00:43:07,00:43:11,"- But yeah, so Diane Fosse, the reason she went out there"
00:43:11,00:43:14,"was this was off the back of a man called Lewis Leakey,"
00:43:14,00:43:16,"who we've mentioned before,"
00:43:16,00:43:17,one of my favorite people in the world
00:43:17,00:43:20,"of paleoanthropology, had wild theories"
00:43:20,00:43:22,and also had a lot of discoveries
00:43:22,00:43:26,about ancient versions of Homo sapiens and so on.
00:43:26,00:43:29,"- Dan, a few episodes ago, we had to fade you out"
00:43:29,00:43:31,when you started going into this kind of thing.
00:43:31,00:43:31,(all laughing)
00:43:31,00:43:32,"- Well, he thinks that the reason"
00:43:32,00:43:34,that we became the dominant species of planet Earth
00:43:34,00:43:36,"is because we were too smelly to eat,"
00:43:36,00:43:39,"as we were in the wild, he's a brilliant guy."
00:43:39,00:43:42,But he thought that the people who should go out
00:43:42,00:43:44,and study apes should be a single woman
00:43:44,00:43:46,with no scientific training.
00:43:46,00:43:50,He's very much the Picasso of the paleoanthropology world
00:43:50,00:43:52,in that he was a bit dubious with women.
00:43:52,00:43:54,He had a lot of researchers around him
00:43:54,00:43:58,"who were, let's say, at his whim."
00:43:58,00:44:01,"He was a bit of deviant, but he did amazing things."
00:44:01,00:44:03,- Did you say he was your favorite?
00:44:03,00:44:04,- Do you know what?
00:44:04,00:44:04,"We can edit that, right?"
00:44:04,00:44:07,(all laughing)
00:44:07,00:44:08,But he picked Diane Fosse.
00:44:08,00:44:10,He thought she'd be perfect.
00:44:10,00:44:11,"And he said to her,"
00:44:11,00:44:12,"""The only thing that you need to have to go out there"
00:44:12,00:44:13,"is no appendix."""
00:44:13,00:44:16,And so she took her appendix out to go.
00:44:16,00:44:17,- Someone else must have taken it out.
00:44:17,00:44:18,"- Yeah, a doctor took it out."
00:44:18,00:44:20,"And then she got a letter six weeks later from him saying,"
00:44:20,00:44:22,"by the way, I was joking about the whole appendix thing."
00:44:22,00:44:24,- No. - Yeah.
00:44:24,00:44:25,It was too late.
00:44:25,00:44:27,She already did it by then.
00:44:27,00:44:28,- That's a problem with deadpan humor.
00:44:28,00:44:30,"If you don't put the emoji afterwards,"
00:44:30,00:44:32,we wouldn't get it.
00:44:32,00:44:34,"- She was quite controversial though, Diane Fosse, right?"
00:44:34,00:44:35,- Absolutely.
00:44:35,00:44:37,"- I read that once she captured,"
00:44:37,00:44:41,"or her associates captured a poacher,"
00:44:41,00:44:43,"stripped him of his clothes,"
00:44:43,00:44:44,laid him spread eagle on the ground
00:44:44,00:44:46,and lashed his genitals with nettles.
00:44:46,00:44:48,"- Yeah, that's how I saw it."
00:44:48,00:44:49,- And she thought basically the way
00:44:49,00:44:52,"that you deal with poachers is not like Anna says,"
00:44:52,00:44:54,improving society and giving them other ways
00:44:54,00:44:55,of making money.
00:44:55,00:44:57,You should just beat it out of them.
00:44:57,00:44:58,- Yeah.
00:44:58,00:45:00,"- I mean, that to be fair is kind of the twist"
00:45:00,00:45:03,in her story is that she arrived as a conservationist.
00:45:03,00:45:04,"She learned so much about gorillas,"
00:45:04,00:45:07,wrote that incredible book.
00:45:07,00:45:07,What's it called?
00:45:07,00:45:09,"- Gorillas in the Mist is a movie based on her, right?"
00:45:09,00:45:11,"- Yeah, based, but that's off her book."
00:45:11,00:45:12,"So she wrote a book,"
00:45:12,00:45:14,which was a memoir of her time there.
00:45:14,00:45:17,And then when poachers killed a gorilla
00:45:17,00:45:19,"that she'd really become close with,"
00:45:19,00:45:21,they'd lobbed the gorillas head off.
00:45:21,00:45:22,"- Digit, it was called digit."
00:45:22,00:45:23,- That's right.
00:45:23,00:45:25,There was a turning point where she goes
00:45:25,00:45:28,from conservationist really to poacher killer.
00:45:28,00:45:30,And she was furious.
00:45:30,00:45:32,And anyone who was in her way was part of the problem.
00:45:32,00:45:34,"So even the anti-poaching league,"
00:45:34,00:45:36,"she thought, no, you're part of it as well."
00:45:36,00:45:37,"And to be fair,"
00:45:37,00:45:38,she had a horrific time in her early days there.
00:45:38,00:45:40,She was kidnapped by rebels.
00:45:40,00:45:42,She was sexually assaulted.
00:45:42,00:45:45,She had a lot of bad times there.
00:45:45,00:45:47,"- Yeah, she was tough as nails, woman."
00:45:47,00:45:49,"I mean, bad childhood tough times there."
00:45:49,00:45:51,Extraordinary person.
00:45:51,00:45:54,"But then she did go a little bit,"
00:45:54,00:45:54,"well, she just went hard line,"
00:45:54,00:45:56,"didn't she, towards the end? - She did."
00:45:56,00:45:57,"- And sort of beat up poachers,"
00:45:57,00:45:58,which is quite hardcore.
00:45:58,00:45:59,And I had actually had no idea
00:45:59,00:46:01,"that she was murdered, Diane Fossey."
00:46:01,00:46:03,"- Yes. - And to research this, but..."
00:46:03,00:46:05,- It's just such a wild story.
00:46:05,00:46:07,So Digit was decapitated by the poachers
00:46:07,00:46:10,and his hands cut off to make ashtrays out of.
00:46:10,00:46:11,- And she was horribly mad.
00:46:11,00:46:12,She was found dead in her cabin
00:46:12,00:46:16,and bizarrely blamed on a jealous fellow researcher
00:46:16,00:46:19,"in absentia, who I don't think was ever really solved."
00:46:19,00:46:21,I think we assume it was angry poachers.
00:46:21,00:46:22,"- Yeah, we still don't know."
00:46:22,00:46:24,There's so many theories out there.
00:46:24,00:46:25,And she's still there though.
00:46:25,00:46:27,She's buried in the gorilla cemetery.
00:46:27,00:46:28,- Next to Digit.
00:46:28,00:46:30,"She's buried next to Digit, yes."
00:46:30,00:46:33,"- Gorillas though, amazing animals."
00:46:33,00:46:35,- They get high by spinning in circles.
00:46:35,00:46:37,That's a new discovery recently.
00:46:37,00:46:41,"And that was like, I really loved this bit of science."
00:46:41,00:46:43,"Basically, there was a viral clip that went around"
00:46:43,00:46:46,of a gorilla spinning round.
00:46:46,00:46:47,"And they thought, oh, that looks fun."
00:46:47,00:46:49,Let's see if anyone else does that.
00:46:49,00:46:51,And then they did more research and found out
00:46:51,00:46:53,"that yeah, they do do that."
00:46:53,00:46:54,"- Well, if you will withhold drugs from the kids,"
00:46:54,00:46:56,"they'll find a way, won't they?"
00:46:56,00:46:58,"They make a, you know how we make a big deal"
00:46:58,00:47:00,about lions and tigers roaring?
00:47:00,00:47:03,I think the gorilla roar is the most frightening.
00:47:03,00:47:05,"So they do that and then they make the belch sound,"
00:47:05,00:47:08,which is the other main kind of vocalization.
00:47:08,00:47:11,"And that's a little, sort of like a little burp or a growl,"
00:47:11,00:47:13,"which says, I'm here, don't worry, I'm your friend."
00:47:13,00:47:15,"And so if researchers are working with gorillas,"
00:47:15,00:47:17,then they learn to make that sound straight away
00:47:17,00:47:19,"to reassure them because you're in the jungle,"
00:47:19,00:47:20,you don't have that good visibility.
00:47:20,00:47:23,So it's not as much about facial recognition.
00:47:23,00:47:26,Although the other thing that researchers have to do
00:47:26,00:47:28,is learn to memorize.
00:47:28,00:47:30,And this is something that I think was pioneered
00:47:30,00:47:31,"a little bit by Diane Fossey,"
00:47:31,00:47:33,but learn to memorize their nose prints.
00:47:33,00:47:35,"So that after a few months,"
00:47:35,00:47:37,you can spot one 50 yards away and immediately know.
00:47:37,00:47:38,"- Well, that makes sense."
00:47:38,00:47:39,- Barry.
00:47:39,00:47:40,"- Yeah, that's great."
00:47:40,00:47:42,- Is it that obvious what the prints are?
00:47:42,00:47:44,Or do you have to get really close?
00:47:44,00:47:45,"'Cause like fingerprints,"
00:47:45,00:47:47,"you need to put your fingers in ink, right?"
00:47:47,00:47:49,- It's definitely more obvious than that.
00:47:49,00:47:52,"It's like wrinkles on a face, on quite a wrinkly face."
00:47:52,00:47:54,- Okay.
00:47:54,00:47:56,I noticed you were looking at me when you said that.
00:47:56,00:47:57,- I was looking past you.
00:47:57,00:48:02,"- Do you know that when you arrive into Rwanda,"
00:48:02,00:48:06,"they go through like any airport security,"
00:48:06,00:48:08,there's certain countries you can't bring fruit in and so on.
00:48:08,00:48:10,Do you know what you're not allowed to bring in to Rwanda?
00:48:10,00:48:12,- Drugs.
00:48:12,00:48:13,- Not drugs.
00:48:13,00:48:14,"- Oh, you are allowed to bring drugs."
00:48:14,00:48:16,"- No, it's just not the answer I'm looking for."
00:48:16,00:48:17,- Okay.
00:48:17,00:48:19,- What's the answer you're looking for?
00:48:19,00:48:21,- Plastic bags.
00:48:21,00:48:23,"- If you go to the official tourism website,"
00:48:23,00:48:25,that's on there saying you will be stopped
00:48:25,00:48:26,and you can get in serious trouble
00:48:26,00:48:29,if you're trying to smuggle plastic bags into the country.
00:48:29,00:48:31,- 12 months in prison for using plastic bags.
00:48:31,00:48:32,- Wow.
00:48:32,00:48:33,- Is it your joking?
00:48:33,00:48:37,- 100% and the fine of up to $540.
00:48:37,00:48:41,Now that law is really in place for large companies
00:48:41,00:48:42,who are breaking the law.
00:48:42,00:48:44,"Like if you or I brought a plastic bag in,"
00:48:44,00:48:46,"we probably wouldn't get 12 months in prison,"
00:48:46,00:48:48,but it is actually on the law books.
00:48:48,00:48:50,That is the punishment.
00:48:50,00:48:51,"- Yeah, I remember that happening."
00:48:51,00:48:52,We all thought mad.
00:48:52,00:48:55,Imagine living without plastic bags.
00:48:55,00:48:57,And now we all sort of do.
00:48:57,00:48:58,"- We don't, do we?"
