start_hhmmss,end_hhmmss,text
00:00:00,00:00:01,(upbeat music)
00:00:01,00:00:04,"Hi everyone, welcome to another episode of No Such Things"
00:00:04,00:00:05,of Fish.
00:00:05,00:00:08,Andrew Hunter Murray is away on holiday
00:00:08,00:00:11,looking for rare species of moss
00:00:11,00:00:14,or perhaps covering his entire house in solar panels.
00:00:14,00:00:17,"I'm not sure what he's doing, but he's not here."
00:00:17,00:00:22,"And so in his place, we have the founder of QI, John Lloyd."
00:00:22,00:00:25,Now you'll all know John because he's been on this show
00:00:25,00:00:27,"many, many times, but if you're a new listener,"
00:00:27,00:00:31,"then he is, he's like a master of British comedy"
00:00:31,00:00:33,"over the last 40, 50 years."
00:00:33,00:00:36,"He was instrumental in things like not the nine o'clock news,"
00:00:36,00:00:40,"black-hatter, QI of course, spitting image."
00:00:40,00:00:42,"If you were a fan of that back in the day,"
00:00:42,00:00:44,there's a really nice anecdote later on in this episode
00:00:44,00:00:46,where he talks about that.
00:00:46,00:00:48,"Basically, he's an all-round genius"
00:00:48,00:00:51,and I'm sure you'll enjoy his talents on this week's show.
00:00:51,00:00:53,"I should quickly say, because I know he would want me to,"
00:00:53,00:00:58,"that his son, Harry, who is a good friend of all of us,"
00:00:58,00:01:00,he is in a band and they have a new single out.
00:01:00,00:01:02,The band is called Waiting for Smith.
00:01:02,00:01:04,"So if you're interested in that,"
00:01:04,00:01:07,then go to anywhere where you get your music
00:01:07,00:01:09,or any bit of social media search for Waiting for Smith
00:01:09,00:01:11,and you will find all about that.
00:01:11,00:01:13,"Anyway, without further ado,"
00:01:13,00:01:15,let us continue with another episode
00:01:15,00:01:19,of No Such Things as a Fish with Mr. John Lloyd
00:01:19,00:01:20,on with a podcast.
00:01:20,00:01:23,(upbeat music)
00:01:23,00:01:38,- Hello and welcome to another episode
00:01:38,00:01:40,"of No Such Things as a Fish,"
00:01:40,00:01:42,a weekly podcast coming to you
00:01:42,00:01:44,from the QI offices in Hoburn.
00:01:44,00:01:45,My name is Dan Schreiber.
00:01:45,00:01:48,"I am sitting here with James Harkin, Anna Tyshinski"
00:01:48,00:01:50,and John Lloyd.
00:01:50,00:01:52,"And once again, we have gathered round the microphones"
00:01:52,00:01:55,with our four favorite facts from the last seven days
00:01:55,00:01:58,"and in no particular order, here we go."
00:01:58,00:02:01,"Starting with fact number one, that is Lloydy."
00:02:01,00:02:06,- So my fact is that Picasso inhaled his first cigar
00:02:06,00:02:09,on the day he was born.
00:02:09,00:02:11,(laughing)
00:02:11,00:02:16,"So Picasso was born at home on the 25th of October, 1881."
00:02:17,00:02:18,He had a very difficult birth
00:02:18,00:02:21,and he was unusually small and undeveloped.
00:02:21,00:02:23,The midwife wrote him off as stillborn.
00:02:23,00:02:24,- Oh no. - Right.
00:02:24,00:02:26,- And literally parked him on a side table
00:02:26,00:02:28,while she looked after his mum.
00:02:28,00:02:29,- Right.
00:02:29,00:02:32,"- And it was fortunate because Picasso's uncle,"
00:02:32,00:02:36,"his father's brother, Salvador Ruiz Blasco,"
00:02:36,00:02:38,"who was also a doctor, happened to be there."
00:02:38,00:02:41,And he was smoking a cigar as you do in those doors.
00:02:41,00:02:42,"- Of course, yep."
00:02:42,00:02:45,- And he strode over and puffed a great waft of smoke
00:02:45,00:02:47,"into Picasso's face and the baby went,"
00:02:47,00:02:48,(screaming)
00:02:48,00:02:50,- Oh really? - In a horrible face.
00:02:50,00:02:51,- Okay.
00:02:51,00:02:53,- And then he lasered a huge yell and saved his life.
00:02:53,00:02:53,- Wow. - Okay.
00:02:53,00:02:55,- So he didn't enjoy his first smoke.
00:02:55,00:02:57,"Like many of us, it sounds like"
00:02:57,00:02:59,he didn't embrace it first time round.
00:02:59,00:03:01,"- Well, he came round quickly"
00:03:01,00:03:03,'cause he was a lifelong smoker.
00:03:03,00:03:06,"In fact, he smoked until seven years before his death,"
00:03:06,00:03:10,"age 91, but tellingly, he never inhaled."
00:03:10,00:03:10,- Is that right?
00:03:10,00:03:11,- So there you are.
00:03:11,00:03:12,- The Bill Clinton.
00:03:12,00:03:13,- Yeah.
00:03:13,00:03:15,(laughing)
00:03:15,00:03:19,"- Yeah, he died in 1973."
00:03:19,00:03:20,- Yeah.
00:03:20,00:03:22,"- Which I worked out meant that he could, in theory,"
00:03:22,00:03:26,"have met Pharrell Williams, the pop star."
00:03:26,00:03:27,- Okay.
00:03:27,00:03:28,- And do you think they would have got along?
00:03:28,00:03:30,"- Well, Pharrell was only three days old"
00:03:30,00:03:32,"when Picasso died and for all that time,"
00:03:32,00:03:35,Pharrell was in Virginia and Picasso was in France.
00:03:35,00:03:35,So at least one of them
00:03:35,00:03:37,would have had to make quite a lengthy trip.
00:03:37,00:03:38,- Yes.
00:03:38,00:03:39,- Or a Zoom call.
00:03:39,00:03:41,"- A Zoom call, yeah."
00:03:41,00:03:44,- What are you thinking we're missing out on
00:03:44,00:03:45,by them not meeting?
00:03:45,00:03:46,Why them two specifically?
00:03:46,00:03:47,"- Well, I just think Pharrell"
00:03:47,00:03:50,"is a very, very modern day name, right?"
00:03:50,00:03:50,"- Yes, right."
00:03:50,00:03:52,"- And Picasso, for anyone who was born"
00:03:52,00:03:54,"after he died, like myself,"
00:03:54,00:03:56,he feels like someone in the past.
00:03:56,00:03:57,Do you know what I mean?
00:03:57,00:03:58,So I think it's quite surprising
00:03:58,00:03:59,"that those two could, in theory, have met."
00:03:59,00:04:02,"- And, of course, Virginia, the home of tobacco,"
00:04:02,00:04:03,Virginia ready-rubbed and so on.
00:04:03,00:04:04,- What a good point.
00:04:04,00:04:05,- It would have got on really well.
00:04:05,00:04:06,- Yes.
00:04:06,00:04:09,(laughing)
00:04:09,00:04:12,"He was baptized Pablo Diego, Jose Francisco de Palo,"
00:04:12,00:04:17,"Juan Nepum Maceno, Crispiniano Maria de los Remedios,"
00:04:17,00:04:22,de la Santissima Trinidad Rui Picasso.
00:04:22,00:04:26,"- Actually not, because the priest made--"
00:04:26,00:04:27,"- Well, you could have said that before I started."
00:04:27,00:04:29,(laughing)
00:04:29,00:04:30,- The priest made a spelling mistake.
00:04:30,00:04:31,"- Oh, did he?"
00:04:31,00:04:33,"- He was supposed to be called Crispiniano,"
00:04:33,00:04:36,"because St. Crispin's Day, the 25th of October,"
00:04:36,00:04:37,was the day he was born.
00:04:37,00:04:39,And the priest made a spelling mistake
00:04:39,00:04:40,and called him Chipriano.
00:04:40,00:04:42,"- Chipriano, which is a brand of crisps."
00:04:42,00:04:45,(laughing)
00:04:45,00:04:48,"- His first word, there's a legend behind that,"
00:04:48,00:04:51,"that his mother says, which is that it was pencil."
00:04:51,00:04:55,"So he seems like a child of destiny, in a way."
00:04:55,00:04:58,"Yeah, I'm not allowed to do the accent"
00:04:58,00:04:59,"on the show anymore, John,"
00:04:59,00:05:01,so I might as well pronounce the English versions.
00:05:01,00:05:04,- Is that like for penis in Spanish as well?
00:05:04,00:05:05,I think it might be.
00:05:05,00:05:06,- Is it?
00:05:06,00:05:09,"- Well, pencil means little penis, doesn't it, penicillus?"
00:05:09,00:05:12,"- Yeah, we'll never know which he was referring to"
00:05:12,00:05:13,at the age of one and a half.
00:05:13,00:05:15,"- They both could have been quite prescient, couldn't they?"
00:05:15,00:05:18,"- They were sort of his two leading tools, I would say."
00:05:18,00:05:21,(laughing)
00:05:21,00:05:23,"We should say, for anyone who's already switched off,"
00:05:23,00:05:25,"'cause we're talking about Picasso,"
00:05:25,00:05:27,"his reputation has taken a bit of a dive,"
00:05:27,00:05:28,"hasn't it, the last 10 years?"
00:05:28,00:05:30,I hadn't quite realized how much his mistresses
00:05:30,00:05:32,were in basically all of his art.
00:05:32,00:05:36,So it was sort of all about his sex life and his shagging.
00:05:36,00:05:38,And a lot of people do criticize the way
00:05:38,00:05:41,"that he exploited women and, you know,"
00:05:41,00:05:45,people say women were tools to be exploited for his art.
00:05:45,00:05:47,"And he did once say, every time I change wives,"
00:05:47,00:05:50,"I should burn the last one so that, you know,"
00:05:50,00:05:50,you can wipe the slate clean.
00:05:50,00:05:52,- The last wife or the last painting?
00:05:52,00:05:53,- The last wife.
00:05:53,00:05:54,- The last wife.
00:05:54,00:05:54,"- Oh, okay."
00:05:54,00:05:56,"And he only actually married twice,"
00:05:56,00:05:59,but I think he's referring to all his mistresses then.
00:05:59,00:06:02,"- Two types of women, he said, goddesses and doormats."
00:06:02,00:06:03,Yeah.
00:06:03,00:06:06,"- One of his early lovers, Francoise Chilot,"
00:06:06,00:06:08,"is part of one of my favorite facts,"
00:06:08,00:06:11,"which is that she later married Jonah Salk,"
00:06:11,00:06:13,who developed the polio jab.
00:06:13,00:06:14,"- Oh, that's a good fact."
00:06:14,00:06:14,- Yeah.
00:06:14,00:06:17,"- So she was basically Picasso's muse,"
00:06:17,00:06:20,and then she married this guy who saved the world
00:06:20,00:06:21,"a little bit really,"
00:06:21,00:06:24,'cause so many people were dying of polio in those days.
00:06:24,00:06:27,But people asked her later why she was attracted
00:06:27,00:06:29,to such outstanding men.
00:06:29,00:06:30,"And she replied,"
00:06:30,00:06:32,"""I think I am just as interesting as they."
00:06:32,00:06:36,"""Lions mate with lions, they don't mate with mice."""
00:06:36,00:06:37,- That's very good.
00:06:37,00:06:39,- But wasn't she the only muse who left him?
00:06:39,00:06:42,"- Yes, she was immune to his charms."
00:06:42,00:06:43,"She's such a,"
00:06:43,00:06:45,she's a nice person to read about
00:06:45,00:06:47,after I suppose all these women who ended up
00:06:47,00:06:49,according to some accounts destroyed.
00:06:49,00:06:52,"She just said, ""He didn't know me very well at all."
00:06:52,00:06:55,"""I'm very secretive, I smile politely, but I don't agree."
00:06:55,00:06:57,"""And I didn't invest my narcissism"
00:06:57,00:06:59,"""in being represented by him."
00:06:59,00:07:00,"""I couldn't care less."""
00:07:00,00:07:01,- Yeah.
00:07:01,00:07:02,- And walked off.
00:07:02,00:07:03,"- She wrote a book about him, a very famous book,"
00:07:03,00:07:03,"""Life with Picasso."""
00:07:03,00:07:06,"I actually read it when I was like 15 years old,"
00:07:06,00:07:08,"I saw it in a library, it's an amazing book."
00:07:08,00:07:10,And it basically caused a lot of problems
00:07:10,00:07:11,"when it came out,"
00:07:11,00:07:13,because no one wanted to know this side about Picasso.
00:07:13,00:07:14,"When it was released,"
00:07:14,00:07:16,there were 40 intellectuals who signed a petition
00:07:16,00:07:18,to have it banned and scrapped and pulped.
00:07:18,00:07:20,- But were there intellectuals?
00:07:20,00:07:20,"- Yeah, yeah."
00:07:20,00:07:21,- They thought his reputation will--
00:07:21,00:07:24,"- Yeah, including one of the major biographers"
00:07:24,00:07:26,"who wrote numerous volumes on Picasso's life afterwards,"
00:07:26,00:07:29,saying that this should be in like a tabloid
00:07:29,00:07:30,as opposed to a book shop.
00:07:30,00:07:31,- Is that John Richardson?
00:07:31,00:07:32,"- Yeah, John Richardson."
00:07:32,00:07:34,- From A.R.10 Cats and Scatham.
00:07:34,00:07:38,"- Yeah, he was fuming, he was furious."
00:07:38,00:07:40,"But interestingly, she was asked about this"
00:07:40,00:07:42,in her 90s about this biography.
00:07:42,00:07:43,"And she said, ""All these men who wrote that"
00:07:43,00:07:45,"had never met me, didn't know what I was talking about."""
00:07:45,00:07:48,"And she and John Richardson became really good friends,"
00:07:48,00:07:49,despite him slagging it off.
00:07:49,00:07:50,- How interesting.
00:07:50,00:07:53,"- Yeah, and you will see her on ""Capture Countdown."""
00:07:53,00:07:55,- When Rachel Riley's off of a tourniquet.
00:07:55,00:07:56,- Yeah.
00:07:56,00:07:56,- Yeah.
00:07:56,00:07:59,"And yeah, Richardson argued that his art"
00:07:59,00:08:04,was almost parodying the mitchismo of Andalusian males
00:08:04,00:08:07,rather than him actually being like that.
00:08:07,00:08:09,Which I don't believe.
00:08:09,00:08:10,"- Yes, very."
00:08:10,00:08:11,- It's a really interesting thing.
00:08:11,00:08:13,"I always believe that when you're at work,"
00:08:13,00:08:16,"if you're going to do it well, you mustn't have an ego."
00:08:16,00:08:18,"And I used to say for years and years,"
00:08:18,00:08:21,Picasso famously didn't behave terribly well
00:08:21,00:08:22,in all sorts of ways.
00:08:22,00:08:26,"But I'm guessing that when he went in front of the easel,"
00:08:26,00:08:28,that all went away.
00:08:28,00:08:31,"And years later, I found this wonderful quote saying,"
00:08:31,00:08:33,"""When I enter my studio,"
00:08:33,00:08:35,"""I leave my personality outside the door"
00:08:35,00:08:39,"""as a Muslim leaves his slippers outside the mosque."""
00:08:39,00:08:42,"- He did spend a lot of time at the easel though, didn't he?"
00:08:42,00:08:44,"Like, it's hard to find the exact number of works"
00:08:44,00:08:45,"that he did, but it was a lot."
00:08:45,00:08:46,- It's insane.
00:08:46,00:08:49,"- 147,800, but that's not exact."
00:08:49,00:08:51,It's...
00:08:51,00:08:54,- That's according to the official website.
00:08:54,00:08:55,"Yeah, they've done counting up and they,"
00:08:55,00:08:58,"and we've lost a lot of it because in his early days,"
00:08:58,00:09:01,he used to burn his bits of art to keep his fire going.
00:09:01,00:09:03,"- Yeah, along with his wives."
00:09:03,00:09:05,"Yeah, they taught them all on the boom fire."
00:09:05,00:09:07,- I worked out that that's one work of art
00:09:07,00:09:10,"for every five hours, 25 minutes of his life."
00:09:10,00:09:13,If he started as a baby and carried on going
00:09:13,00:09:15,until he met Pharrell that time.
00:09:15,00:09:16,"- Which once you've had your first smoke,"
00:09:16,00:09:18,you might as well end up with a paintbrush.
00:09:18,00:09:22,"He also was responsible for a major art theft,"
00:09:22,00:09:24,which I hadn't realized because we'd mentioned before
00:09:24,00:09:27,on the show that he was accused of stealing the Mona Lisa.
00:09:27,00:09:28,"- He was interviewed by the police, right?"
00:09:28,00:09:29,- Yes. - He was.
00:09:29,00:09:30,- Yes.
00:09:30,00:09:31,"- Because a pollinair, his friend,"
00:09:31,00:09:33,shopped him to the police.
00:09:33,00:09:34,- Yes.
00:09:34,00:09:35,- And Picasso then went to court and denied
00:09:35,00:09:38,"he'd ever met him, even though he's one of his best friends."
00:09:38,00:09:39,- It's serious.
00:09:39,00:09:41,"- It's quite a low moment, isn't it?"
00:09:41,00:09:43,"In their friendship, in their moral lives."
00:09:43,00:09:46,- That's probably the best indication of the power
00:09:46,00:09:48,that Picasso had that he thought he could jedi his way
00:09:48,00:09:49,"through, like..."
00:09:49,00:09:51,"- The thing was, when he described the person"
00:09:51,00:09:53,"who actually stole it, the police did a sketch"
00:09:53,00:09:55,and the noses on this side of his face
00:09:55,00:09:58,and the eyebrows on this side.
00:09:58,00:09:59,"- But there's more to it, isn't there?"
00:09:59,00:10:01,"- Well, there is more to it, yes, because..."
00:10:01,00:10:04,"So that was 1911, but actually in 1907,"
00:10:04,00:10:06,there were these two Iberian statues
00:10:06,00:10:07,stolen from the Louvre.
00:10:07,00:10:09,And I think there's just been a book written
00:10:09,00:10:11,"which puts all the pieces together,"
00:10:11,00:10:14,"but Picasso had first spotted them in about 1904,"
00:10:14,00:10:16,"fallen in love with them, told all his mates,"
00:10:16,00:10:17,love these statues.
00:10:17,00:10:19,They were put in storage.
00:10:19,00:10:20,Then they disappeared.
00:10:20,00:10:24,Turned out they'd been stolen by this chap called Pierre.
00:10:24,00:10:27,And he was mates with Picasso and the dodgy Apollinaire.
00:10:27,00:10:29,"- He was Apollinaire's secretary, I think."
00:10:29,00:10:30,"- He was Apollinaire's secretary, yes."
00:10:30,00:10:32,"But it turned, basically,"
00:10:32,00:10:35,"Picasso's lover at the time, Fernanda Olivier,"
00:10:35,00:10:38,said that he had all lots of artworks around his house.
00:10:38,00:10:41,And then he had these two statue heads
00:10:41,00:10:43,under some clothes in his wardrobe.
00:10:43,00:10:44,"And she asked him about them once and he said,"
00:10:44,00:10:47,"""Oh, we shouldn't display them anywhere too prominent."""
00:10:47,00:10:50,And it turned out to be these two stolen statues
00:10:50,00:10:52,from the Louvre.
00:10:52,00:10:55,- But we assume that Pierre had given them to Picasso.
00:10:55,00:10:57,Maybe Picasso had asked him to steal them.
00:10:57,00:10:59,Some people say that Pierre couldn't have carried them
00:10:59,00:11:02,"both out under his coat, which is what he claimed."
00:11:02,00:11:03,So maybe Picasso was there.
00:11:03,00:11:05,- It's a lot easier to steal stuff
00:11:05,00:11:06,"from the Louvre in those days, wasn't it?"
00:11:06,00:11:07,"- I was a piece of this, yeah."
00:11:07,00:11:10,"- Yeah, the lousy security, didn't they?"
00:11:10,00:11:12,"- Yeah, I think there was a story"
00:11:12,00:11:13,"that Pierre once once said to his girlfriend,"
00:11:13,00:11:15,"""I'm going to the Louvre today."
00:11:15,00:11:16,"Do you want me to pick anything else for you?"""
00:11:16,00:11:18,(laughing)
00:11:18,00:11:22,"And then ironically, Picasso is the most stolen artist"
00:11:22,00:11:23,in history now.
00:11:23,00:11:26,"But I think it's largely 'cause he made so much, right?"
00:11:26,00:11:28,"- You can't help stealing one, you pick up a sketch."
00:11:28,00:11:29,"- Yeah, and following the secretary"
00:11:29,00:11:32,"had something to do with it, I'm sure."
00:11:32,00:11:34,Shifting his stuff back to...
00:11:34,00:11:37,"- So even when he was in his 70s and 80s,"
00:11:37,00:11:40,"he was quite a womanizer, Picasso."
00:11:40,00:11:43,"And whenever anyone came to his house who he fancied,"
00:11:43,00:11:47,he would make a little sculpture of a little man
00:11:47,00:11:50,with an enormous phallus and then give it to them
00:11:50,00:11:52,as like a love gift.
00:11:52,00:11:53,- Right.
00:11:53,00:11:56,- Did that work a high percentage of the time?
00:11:56,00:11:59,- It didn't work so often because he quite often
00:11:59,00:12:01,did it in front of his wife.
00:12:01,00:12:05,And anyone who'd been given this phallic item
00:12:05,00:12:07,was not allowed back in the house.
00:12:07,00:12:09,"'Cause his wife would just be like,"
00:12:09,00:12:10,"""Well, you're obviously not coming back."""
00:12:10,00:12:11,"- Yeah, yeah."
00:12:11,00:12:14,"- And again, this is going to John Richardson."
00:12:14,00:12:14,- John Richardson.
00:12:14,00:12:18,"- To say, given all these sort of anecdotal things"
00:12:18,00:12:22,and the naughtiness that he was an extraordinary painter
00:12:22,00:12:25,and those two statues he mentioned inspired him
00:12:25,00:12:27,for Les Demoiselles d'Avignon.
00:12:27,00:12:29,"- Yeah, which is a great painting."
00:12:29,00:12:31,"- Is described by John Golding, the art critic,"
00:12:31,00:12:33,as the greatest painting of the 20th century.
00:12:33,00:12:34,It's so influential.
00:12:34,00:12:36,"- It's kind of cool for him to take,"
00:12:36,00:12:38,"like looking back at it now,"
00:12:38,00:12:40,"if the ends justify the means,"
00:12:40,00:12:41,it's fine that he stole those things
00:12:41,00:12:43,if they inspired those great works.
00:12:43,00:12:44,"- Yeah, and no one gave us just about"
00:12:44,00:12:46,two random Iberian statues
00:12:46,00:12:48,from 2000 years ago in storage.
00:12:48,00:12:50,- Remind me to not have James as my lawyer.
00:12:50,00:12:54,We were going to do a fact about them
00:12:54,00:12:56,in the podcast the next week.
00:12:56,00:12:59,- He used to make some of his paints as well.
00:12:59,00:13:01,"There's a particular brown that he made,"
00:13:01,00:13:04,which we only now know what the secret source was.
00:13:04,00:13:05,- HP.
00:13:05,00:13:10,"- No, not quite."
00:13:10,00:13:14,- It was his three-year-old daughter's poo.
00:13:14,00:13:16,"- Oh, come on, Dan, no."
00:13:16,00:13:19,"- Poocasso, they called the article."
00:13:19,00:13:23,"Yeah, he used to say that the best feces as well"
00:13:23,00:13:26,would be from a mother who the infant was being breastfed.
00:13:26,00:13:27,"- Well, I would say that like,"
00:13:27,00:13:30,"this is a three-year-old child, right?"
00:13:30,00:13:33,But definitely the poo of a much younger baby
00:13:33,00:13:35,is a color that you can't really see anywhere else
00:13:35,00:13:37,"in the world. - Oh, true, yes."
00:13:37,00:13:39,- I never see the felt tip the same color
00:13:39,00:13:41,as a nappy from a two-month-old.
00:13:41,00:13:44,"- Well, you've seen my tie, though, it's very similar."
00:13:44,00:13:50,"- Listeners, John is wearing a tie,"
00:13:50,00:13:52,which is like 50 shades of feces.
00:13:52,00:13:59,"- But nice, orangey baby feces, the harmless kind."
00:13:59,00:14:01,"- He also, I mean, we're talking about his paintings,"
00:14:01,00:14:03,but he predicted in his own lifetime
00:14:03,00:14:06,that he would be more known for his poetry than his paintings.
00:14:06,00:14:08,"- Poocasso. - Yeah, after his death."
00:14:08,00:14:11,"He wrote over 300 poems,"
00:14:11,00:14:13,and he also wrote two surrealist plays.
00:14:13,00:14:16,"- He can't really have believed,"
00:14:16,00:14:18,'cause he was incredibly famous for his paintings
00:14:18,00:14:19,throughout his life.
00:14:19,00:14:21,"And no one was going, ""Do you know what, Poocasso?"
00:14:21,00:14:22,"""People should make more of your poems."
00:14:22,00:14:23,"""Did he really think?"" - Well, he just,"
00:14:23,00:14:25,he probably thought they'll forget about it one day
00:14:25,00:14:26,and my poems will live on after me.
00:14:26,00:14:29,"- I think this is a common theme with artists, though."
00:14:29,00:14:31,"You know, rock bands who always pick the wrong songs"
00:14:31,00:14:34,gonna be successful and hate the one that's famous.
00:14:34,00:14:36,"- Yeah, John Richardson, as always,"
00:14:36,00:14:37,"they're asking him in interviews about,"
00:14:37,00:14:39,"""Hey, I've done cuts to this countdown."""
00:14:39,00:14:40,"And they never ask him about his Poocasso,"
00:14:40,00:14:43,but at first they don't.
00:14:43,00:14:45,"- But like that author, Karen Doyle, quote,"
00:14:45,00:14:47,"""You must have touched before that if in 100 years"
00:14:47,00:14:49,"""I'm remembered just for Sherlock Holmes,"
00:14:49,00:14:51,"""I would have considered my life a failure."""
00:14:51,00:14:55,"- Yeah, sorry, mate, embrace it."
00:14:55,00:15:04,"- Okay, it is time for fact number two, and that is James."
00:15:04,00:15:05,"- Okay, my fact this week"
00:15:05,00:15:08,is that the national song of St. Helena
00:15:08,00:15:10,was written by a man who had never been there.
00:15:10,00:15:14,He based his lyrics on a postcard that he had seen.
00:15:14,00:15:15,- Incredible.
00:15:15,00:15:16,Let's hear it.
00:15:16,00:15:19,"- ♪ God save our great, no ♪"
00:15:19,00:15:20,That is the national anthem of St. Helena
00:15:20,00:15:23,because it's a British territory.
00:15:23,00:15:26,- So did he base it on the stamp of the postcard?
00:15:26,00:15:30,"- He wrote another anthem called ""My St. Helena Island"""
00:15:30,00:15:32,and is kind of the de facto anthem.
00:15:32,00:15:34,"It's not the official national anthem,"
00:15:34,00:15:36,"but it's the one that all saints, as they're known as,"
00:15:36,00:15:38,in St. Helena would sing.
00:15:38,00:15:40,And it was written by an American
00:15:40,00:15:42,who is better known for his appearances
00:15:42,00:15:44,on the eight out of 10 cats does countdown
00:15:44,00:15:46,called David Mitchell.
00:15:46,00:15:50,- It's stunning.
00:15:50,00:15:53,"- David Mitchell, he was nicknamed Old Saddle Bags"
00:15:53,00:15:55,"and he was a DJ on a sentient island,"
00:15:55,00:15:58,"which is, I was gonna say nearby, it's not nearby,"
00:15:58,00:16:01,"but it's the nearest place to St. Helena,"
00:16:01,00:16:03,St. Helena's in the middle of the ocean.
00:16:03,00:16:06,He became friends with some people from St. Helena
00:16:06,00:16:08,and they suggested that he writes a song for them.
00:16:08,00:16:10,And he was a bit reluctant to do that
00:16:10,00:16:11,"'cause he's never been there,"
00:16:11,00:16:15,but they sent him some postcards and he wrote this song.
00:16:15,00:16:16,And that's what happened.
00:16:16,00:16:17,"It goes, ""My heart is drifting southwards"
00:16:17,00:16:19,"""to my home down in the sea,"
00:16:19,00:16:21,"""to the Isle of St. Helena,"
00:16:21,00:16:23,"""where my loved ones wait for me."
00:16:23,00:16:24,"""We're having a lovely time,"
00:16:24,00:16:27,"""whether it's changeable, food is awful, wish you were here."""
00:16:27,00:16:29,(laughing)
00:16:29,00:16:30,- That's great.
00:16:30,00:16:31,- Genius.
00:16:31,00:16:31,- It's really good.
00:16:31,00:16:33,"And he recorded them officially, the songs,"
00:16:33,00:16:34,and they made records of it.
00:16:34,00:16:36,And he sent a bunch of records
00:16:36,00:16:38,"and pictures of himself to St. Helena as part of like,"
00:16:38,00:16:40,"""Here's the merch that you can have."""
00:16:40,00:16:42,"But he's not really known anywhere,"
00:16:42,00:16:45,"even in his hometown, in Memphis."
00:16:45,00:16:47,"But yeah, he's someone who's still around."
00:16:47,00:16:49,"I mean, it's not that long ago, right?"
00:16:49,00:16:49,So--
