start_hhmmss,end_hhmmss,text
00:37:53,00:37:58,"So with a doubly at the end, which I just think sounds delightful."
00:37:58,00:38:02,"Describe in 1875, this great burly fellows with bluff faces,"
00:38:02,00:38:07,"deep chests, and still deeper voices with a smack of the watermelon about them,"
00:38:07,00:38:11,"and a faculty for mental arithmetic, which is perfectly surprising,"
00:38:11,00:38:12,there's the words of James Greenwood.
00:38:12,00:38:15,It was a middle man on a fish market.
00:38:15,00:38:19,"Usually, I think the term was attached to Billingsgate fish market, particularly."
00:38:19,00:38:22,"So it was like a commerce, but it was like a retail position, basically."
00:38:22,00:38:24,"But in fish, specifically."
00:38:24,00:38:27,"But they obviously had this reputation for being big, burly, bluff men."
00:38:27,00:38:29,"Yeah, nice. Very cool."
00:38:29,00:38:31,"I mean, it's such an interesting world, the world of craft land."
00:38:31,00:38:35,"This book, by the way, I'll just give a shout out to Francesca at the Margate Bookshop"
00:38:35,00:38:39,"who told me about this amazing bookshop, if you haven't that bit of the country."
00:38:39,00:38:45,"She showed it to me, and basically it covers 280 crafts that are still practice in Britain."
00:38:45,00:38:49,But what was noticed by James Fox is that half of them or more are endangered.
00:38:49,00:38:54,"So we're sort of losing, we're getting down to the final person who is able to do certain things."
00:38:54,00:39:00,And there's an example that he gives of one person who is able to tune English church bells.
00:39:00,00:39:05,"He's called Gidda Vad Hooker, and while he's doing it, he writes little things on each bell,"
00:39:05,00:39:10,almost like little mottos on it to sort of give it something extra.
00:39:10,00:39:14,"Yeah, so like he'll write on, for example, on one of the bells, or..."
00:39:14,00:39:16,Don't. And he should write Tom.
00:39:16,00:39:17,Absolutely.
00:39:17,00:39:19,I've run out.
00:39:19,00:39:22,"Bung and Bing. Oh, for God's idiot."
00:39:22,00:39:23,"Yeah, yeah, yeah, God."
00:39:23,00:39:27,"There's a list, isn't there, of heritage crafts that are endangered?"
00:39:27,00:39:33,"There's a list of ones that have gone completely now, and there's a list of ones that are endangered,"
00:39:33,00:39:38,which means there's only one or maybe two people in the country who do it.
00:39:38,00:39:45,"So in the UK, there are only one or two people who make arrows, bells, musical bows,"
00:39:45,00:39:53,"clogs, fans, gloves, pianos, ballet shoes, sauce, scissors, clay pipes, glass eyes, watches and horse whips."
00:39:53,00:39:58,"So if we get cut off from the rest of the world, what's of those can we not do without?"
00:39:58,00:39:59,Scissors.
00:39:59,00:40:02,"Scissors is going to be tough. Ballet shoes, probably fine."
00:40:02,00:40:07,"Yeah, horse whips will improvise, but scissors are fiddly."
00:40:07,00:40:08,Glass eyes?
00:40:08,00:40:10,"Oh, you don't want access."
00:40:10,00:40:12,"Yeah, you never know when you need one."
00:40:12,00:40:14,"Well, it's scary, scary stuff."
00:40:14,00:40:19,"I went today to see a guy called Andy Peters, who is the only person in the UK"
00:40:19,00:40:23,who makes the wooden figure heads for boats.
00:40:23,00:40:24,Oh.
00:40:24,00:40:27,Which feels like something we could probably do without.
00:40:27,00:40:29,"No, we can't."
00:40:29,00:40:31,Did you tell that to him to his face?
00:40:31,00:40:36,"Well, my thought was like people were doing this in the olden days, right?"
00:40:36,00:40:41,And it takes him like five months to make one of these things.
00:40:41,00:40:43,How do you make money like that?
00:40:43,00:40:46,Because it's not like everyone needs one.
00:40:46,00:40:49,Pirates will pay a fortune.
00:40:49,00:40:50,An arm and a leg.
00:40:50,00:40:51,Thank you.
00:40:51,00:40:54,I haven't seen the new aircraft carriers that we've got.
00:40:54,00:40:57,Have they got some of Andy Peters' work up front?
00:40:57,00:41:02,"No, they haven't, but he does, he makes them for yachts, like super yachts sometimes."
00:41:02,00:41:05,I have genuinely seen some of his work within the last fortnight.
00:41:05,00:41:06,Really?
00:41:06,00:41:07,"Well, you're super yachts."
00:41:07,00:41:08,That's right.
00:41:08,00:41:11,I don't want super yachts to have them.
00:41:11,00:41:12,Fair enough. This is a better one.
00:41:12,00:41:13,You know Cutty Sark?
00:41:13,00:41:14,Yeah.
00:41:14,00:41:19,"Cutty Sark in Greenwich has a figurehead at the front, and I'm sure it's an Andy Peters thing."
00:41:19,00:41:20,I think I've read a thing.
00:41:20,00:41:21,"Yeah, it is."
00:41:21,00:41:22,He did the...
00:41:22,00:41:26,"Basically, there was a restoration that was done, and then they found some old pictures"
00:41:26,00:41:29,"and realized that what they'd restored looked off in light, what it originally looked like."
00:41:29,00:41:31,So they asked him to make a new one.
00:41:31,00:41:32,That's so cool.
00:41:32,00:41:36,"And they have a massive collection of ships, figureheads, around the prow of the Cutty Sark."
00:41:36,00:41:37,Yeah. It's an awesome display.
00:41:37,00:41:42,"Actually, now there are definitely more figureheads in museums than there are among ships."
00:41:42,00:41:43,Right.
00:41:43,00:41:44,I think that's it.
00:41:44,00:41:47,But it's interesting becoming the last person who makes something.
00:41:47,00:41:53,"So James Fox is talking about a watchmaker who only produces five watches a year,"
00:41:53,00:41:55,but he does them entirely on his own.
00:41:55,00:41:59,And the difference is watchmakers generally don't make an entire watch on their own.
00:41:59,00:42:02,"Usually, if you were making a really well-crafted one,"
00:42:02,00:42:05,would involve probably 20 different people doing different bits.
00:42:05,00:42:07,It's different disciplines coming together.
00:42:07,00:42:11,He trained himself as a kid to make watches entirely on his own.
00:42:11,00:42:14,He was a guest with this guy who was a master watchmaker.
00:42:14,00:42:17,And he brought him his first watch after a year and showed it to him.
00:42:17,00:42:19,"And he said, ""Rubbish, after spending a whole year on it."""
00:42:19,00:42:22,"So he went away for five years and made another watch, brought it back."
00:42:22,00:42:24,"And he went, ""Yes, you are a watchmaker."""
00:42:24,00:42:25,So he now makes five a year.
00:42:25,00:42:29,"And each one sells for roughly 300,000 per watch."
00:42:29,00:42:33,Does he write tick or talk on them as he finishes?
00:42:33,00:42:35,Because he should.
00:42:35,00:42:39,"So the Heritage Crafts website is really interesting, well worth a look."
00:42:39,00:42:43,"I've just joined, you can join and sign up to support some of the craft."
00:42:43,00:42:44,It's very cool.
00:42:44,00:42:48,"So extinct ones are things like mouth-blown sheet glass making,"
00:42:48,00:42:52,"which survived until 1992, which I'm quite surprised by, to be honest."
00:42:52,00:42:56,"But there is one of the very oldest, in fact, sorry,"
00:42:56,00:43:00,the oldest thing anyone's done professionally is still going strong.
00:43:00,00:43:04,"Because they list Heritage Crafts, some of which are currently viable."
00:43:04,00:43:05,Flint napping.
00:43:05,00:43:06,"Oh, yeah."
00:43:06,00:43:08,I met a Flint napper like two weeks ago.
00:43:08,00:43:09,Did you?
00:43:09,00:43:10,Yeah.
00:43:10,00:43:13,"I wish I hadn't said it because there's no anecdote that goes with it, but it's good."
00:43:13,00:43:14,Yeah.
00:43:14,00:43:15,What is it?
00:43:15,00:43:16,What's Flint napping?
00:43:16,00:43:19,It's like you get a piece of stone and you hit it with a harder piece of stone
00:43:19,00:43:23,and you get tiny bits of Flint and you can use them for cutting things and for shaving.
00:43:23,00:43:27,"You can either do it to sort of repair a wall, which a Flint wall,"
00:43:27,00:43:32,or in the old times people would be making arrowheads or sharp instruments or tools like that.
00:43:32,00:43:34,"And this, I find this absolutely unbelievable."
00:43:34,00:43:38,There are still a few people doing it these days to make rep because they bring historic objects
00:43:38,00:43:41,and maybe ten more doing it to shape Flint for masonry.
00:43:41,00:43:43,"So it is currently viable, although small."
00:43:43,00:43:47,But it is 3.3 million years old as a trade.
00:43:47,00:43:48,Wow.
00:43:48,00:43:51,It is more than ten times as old as our species.
00:43:51,00:43:52,Wow.
00:43:52,00:43:55,It's 11 times as old as homo sapiens as a thing.
00:43:55,00:43:57,Is it still the same family running out?
00:43:57,00:43:58,It's the same family.
00:43:58,00:44:00,"Close shop, mate."
00:44:00,00:44:01,Close shop.
00:44:01,00:44:02,They won't let you in.
00:44:02,00:44:04,We'll just find that bizarre.
00:44:04,00:44:06,Like the older shaped Flint tools.
00:44:06,00:44:07,But date back.
00:44:07,00:44:09,"Yeah, that's very cool."
00:44:09,00:44:13,"Well, interestingly, one of the old jobs that used to be able to be was a caveman."
00:44:13,00:44:16,And that was not a craft.
00:44:16,00:44:20,"No, it was because you were responsible for the removal of clinkers and ashes"
00:44:20,00:44:23,from the cave or tunnel beneath a furnace.
00:44:23,00:44:26,You were called a caveman as a result.
00:44:26,00:44:27,Here's another thing.
00:44:27,00:44:29,Two things that have a different meaning today.
00:44:29,00:44:30,A mugger.
00:44:30,00:44:31,Do you know what a mugger was?
00:44:31,00:44:33,It was a job that you could...
00:44:33,00:44:34,A mug maker?
00:44:34,00:44:35,Yeah.
00:44:35,00:44:39,"For the first hundred years of that word, the word mugger meant someone who sold mugs."
00:44:39,00:44:43,"Was there an amusing crossover period where someone said, ""I'm a mugger."""
00:44:43,00:44:45,"I'm sorry, I've got plenty of mugs at home."
00:44:45,00:44:46,Thank you.
00:44:46,00:44:48,"No, no, no, you misunderstand."
00:44:48,00:44:49,Give me your mugs.
00:44:49,00:44:52,Yeah.
00:44:52,00:44:54,And a badger.
00:44:54,00:44:55,Badger.
00:44:55,00:44:58,Badger was someone who...
00:44:58,00:45:00,It was a bit like Rachel's fish person.
00:45:00,00:45:06,It was someone who got some food from one place and then took it to someone to sell it from another place.
00:45:06,00:45:10,"But they often got in trouble because they would hoard food, hoard grain and hoard bread."
00:45:10,00:45:11,"It types of, yeah."
00:45:11,00:45:15,"There was also, I read also about badgers, which was like..."
00:45:15,00:45:19,There was young boys who played like a bugle or trumpet or something.
00:45:19,00:45:22,And that call was used to like call men to war.
00:45:22,00:45:23,Badgers.
00:45:23,00:45:24,Wow.
00:45:24,00:45:25,Sources needed for this.
00:45:25,00:45:26,But badgers was definitely...
00:45:26,00:45:28,"Yeah, badgers was like sort of slang term for that job."
00:45:28,00:45:29,Nice.
00:45:29,00:45:31,And also a bodger as well as a badger.
00:45:31,00:45:33,"No, it's just serious."
00:45:33,00:45:34,Really?
00:45:34,00:45:36,"Yeah, bodger would have made chair legs."
00:45:36,00:45:37,That's very funny.
00:45:37,00:45:38,But badly.
00:45:38,00:45:39,But badly.
00:45:39,00:45:41,Do any of us have a craft?
00:45:41,00:45:42,I can't think of that.
00:45:42,00:45:43,What do you mean you...
00:45:43,00:45:45,This is our craft.
00:45:45,00:45:46,Stage craft.
00:45:46,00:45:47,"Yeah, but a real one."
00:45:47,00:45:48,"You know, like a proper one."
00:45:48,00:45:49,Yeah.
00:45:49,00:45:50,"No, I don't have a craft."
00:45:50,00:45:53,Now you make like chocolate sausages or something.
00:45:53,00:45:55,You've got like a weird...
00:45:55,00:45:56,What?
00:45:56,00:45:58,That's what he calls it when he's cut back for the bathroom.
00:45:58,00:46:00,It's like a chocolate sausage.
00:46:00,00:46:03,I don't want to talk about my time in the American prison system.
00:46:03,00:46:04,"All right, Dan."
00:46:04,00:46:05,But...
00:46:05,00:46:07,"God, this guy's flirting. It's really weird."
00:46:07,00:46:09,It's really weird.
00:46:09,00:46:12,Dan is referring to a private incident where I made a tasty...
00:46:12,00:46:13,What was it?
00:46:13,00:46:14,"Like, what's it called?"
00:46:14,00:46:16,That sausage that you...
00:46:16,00:46:18,What is it called?
00:46:18,00:46:19,A chocolate salami.
00:46:19,00:46:21,Has anyone ever made a chocolate salad?
00:46:21,00:46:23,"It has, even worse."
00:46:23,00:46:25,"It's a delicious pudding,"
00:46:25,00:46:27,but it's also an amusing trick.
00:46:27,00:46:29,"Because, you know, you bring out..."
00:46:29,00:46:30,"Oh, it's pudding time, everyone."
00:46:30,00:46:32,You bring out what looks like a salami.
00:46:32,00:46:33,It's covered in icing sugar.
00:46:33,00:46:34,You put netting around it.
00:46:34,00:46:35,You put string around it.
00:46:35,00:46:37,"Yeah, like a proper salami."
00:46:37,00:46:38,It's a tad.
00:46:38,00:46:42,"Well, okay, Dan."
00:46:42,00:46:45,"Well, you're off the pudding list for life now."
00:46:45,00:46:46,Okay.
00:46:46,00:46:53,"That is it, unfortunately."
00:46:53,00:46:55,That is all of our facts.
00:46:55,00:46:56,Thank you so much for listening.
00:46:56,00:47:00,"If you'd like to get in contact with any of us about the things that we have said over the course of this podcast,"
00:47:00,00:47:02,we can all be found online.
00:47:02,00:47:05,"I'm on @Streiberland on Instagram, James."
00:47:05,00:47:07,My Instagram is on Instagram is on Instagram.
00:47:07,00:47:08,Andy.
00:47:08,00:47:09,And Rache.
00:47:09,00:47:11,And Rachel S.V. Paris.
00:47:11,00:47:17,"Yeah, and just a reminder to everyone listening, Rachel's book is out now introducing Mrs. Collins."
00:47:17,00:47:18,It is just...
00:47:18,00:47:20,"Give a quick blurb on it, Rache."
00:47:20,00:47:23,It follows Charlotte Lucas from Pride and Regulus after she marries Mr. Collins
00:47:23,00:47:25,and all that happens in the next few years.
00:47:25,00:47:27,"Super cool, very exciting."
00:47:27,00:47:32,"And yeah, if you want to get in contact with us as a group, podcast@QI.com, send us an email"
00:47:32,00:47:38,"and we'll put it onto a very exciting secret show called Jewel Drop us a Line,"
00:47:38,00:47:41,"which is part of our Club Fish World, which is our secret members club."
00:47:41,00:47:46,"It's kind of like the Hellfire Club, but with less orgies."
00:47:46,00:47:52,"For just $3.99 a month, we will release a baboon into your home."
00:47:52,00:47:57,"Yeah, or, hey, just come back again next week, because we'll be back with another episode."
00:47:57,00:47:58,We'll see you then.
00:47:58,00:47:59,Goodbye!
00:47:59,00:48:00,Thank you.
00:48:01,00:48:02,[Applause]
00:48:03,00:48:12,[Music]
00:48:12,00:48:19,[BLANK_AUDIO]
