start_hhmmss,end_hhmmss,text
00:19:51,00:19:55,"And actually, Mythbusters, the TV show, experimented with this."
00:19:55,00:19:59,And they found that only if you could consistently add electricity.
00:19:59,00:20:02,"If you could use electrolysis, you could corrode the bars using the salsa."
00:20:02,00:20:05,But he probably didn't have access to that on the inside.
00:20:05,00:20:06,Right.
00:20:06,00:20:08,"So that seems to not be true, I think."
00:20:08,00:20:09,Wow.
00:20:09,00:20:10,"OK, here's a quiz for you."
00:20:10,00:20:14,"Stephen J. Russell, American con artist, sense prison."
00:20:14,00:20:17,He escaped using a green felt tip.
00:20:17,00:20:18,What did he do?
00:20:18,00:20:19,Oh.
00:20:19,00:20:24,"He colored his food and said, this is so badly off"
00:20:24,00:20:27,that I'm going to need to pass it back through the food slot.
00:20:27,00:20:31,And they disguised himself as a sausage.
00:20:31,00:20:32,Yes.
00:20:32,00:20:38,Did he use the felt tip and to make some part of his body look really ill?
00:20:38,00:20:39,"Oh, that's good."
00:20:39,00:20:40,Yes.
00:20:40,00:20:41,"That's good, but not quite right."
00:20:41,00:20:42,Not quite right.
00:20:42,00:20:45,He had a white jumpsuit and he colored it in green
00:20:45,00:20:48,and disguised himself as a doctor and walked out.
00:20:48,00:20:49,No.
00:20:49,00:20:50,Wow.
00:20:50,00:20:54,How much of that ink was in that pen?
00:20:54,00:20:57,I get like two minutes out of a highlighter.
00:20:57,00:20:58,That's pretty impressive.
00:20:58,00:20:59,Check this guy out.
00:20:59,00:21:00,This is a phenomenal one.
00:21:00,00:21:03,"There was a prison in America, which was known to be escape proof."
00:21:03,00:21:08,"21st of July, 1971, a guy called Warren George Briggs escapes from it."
00:21:08,00:21:11,And four other people help him to get out.
00:21:11,00:21:14,Bullets are fired at them and he manages to escape.
00:21:14,00:21:18,He eventually turns himself in and he says the only reason that he escaped it
00:21:18,00:21:23,"is because he wanted to get some press, some PR for the fact that while inside jail"
00:21:23,00:21:26,he had invented and developed a water desalting process
00:21:26,00:21:31,that would enable mankind to purify sea water at a reasonable price.
00:21:31,00:21:33,"And he was like, no one's listening to me."
00:21:33,00:21:37,"So I'm going to escape this inescapable jail and all the headlines are going to say,"
00:21:37,00:21:40,"man escapes, but invent water source."
00:21:40,00:21:41,And did it work?
00:21:41,00:21:42,Did his thing work?
00:21:42,00:21:47,There's been no further story about Warren George Briggs.
00:21:47,00:21:48,Superb.
00:21:48,00:21:53,One of the archetypes of one of the places that is most famous for escapes
00:21:53,00:21:58,"is Colditz, the German castle during the Second World War,"
00:21:58,00:22:02,which was where lots of people were put and was supposedly escape proof
00:22:02,00:22:05,and it's where lots of people who had escaped other places were sent.
00:22:05,00:22:06,Sorry to interrupt.
00:22:06,00:22:09,"Like all these prisons, like stop calling them escape proof."
00:22:09,00:22:12,"You can't escape, it's like calling boats unsinkable."
00:22:12,00:22:14,"Like really, you're tempting fate."
00:22:14,00:22:15,You're so right.
00:22:15,00:22:17,And Colditz was a terrible place to try and keep prisoners
00:22:17,00:22:18,at 700 rooms.
00:22:18,00:22:21,"It was this huge, like it was really quite hard to defend, I would say."
00:22:21,00:22:24,"And it had to have its own escape committee,"
00:22:24,00:22:27,because so many of the men in there were plotting their own escapes.
00:22:27,00:22:29,"And they had to basically say, you can't escape on Tuesday."
00:22:29,00:22:31,Terry's escaping on Tuesday.
00:22:31,00:22:33,You can go Thursday 9/15 to 9/30.
00:22:33,00:22:36,"But don't go over 9/30, because Barry's getting out."
00:22:36,00:22:39,"And it just, some officers, this is really interesting."
00:22:39,00:22:41,Let's see if you can work out why.
00:22:41,00:22:43,Pretended to escape.
00:22:43,00:22:45,They only pretended to escape Colditz.
00:22:45,00:22:49,"To see what would happen, what the punishment would be if they got caught."
00:22:49,00:22:50,Not quite.
00:22:50,00:22:51,"Oh, wait, nice guess."
00:22:51,00:22:54,So they pretended as if they hid in the jail.
00:22:54,00:22:56,So then they thought he's escaped.
00:22:56,00:22:58,And then they stopped looking for him within the jail.
00:22:58,00:23:02,And then he could get a highlighter and draw all over.
00:23:02,00:23:03,You're close.
00:23:03,00:23:05,They escaped and they hid within the jail.
00:23:05,00:23:06,"Yeah, within Colditz."
00:23:06,00:23:07,"Rachel, do you want to have a guess?"
00:23:07,00:23:08,No.
00:23:08,00:23:09,All right.
00:23:09,00:23:14,"So the reasoning was, they were escaped and then hide."
00:23:14,00:23:19,More TV quizzes should just have that as an answer.
00:23:19,00:23:21,"Basically, they escaped and then they hid."
00:23:21,00:23:25,"So that when a different officer actually did escape,"
00:23:25,00:23:29,the hiders would pretend to be the actual escapee
00:23:29,00:23:31,so that they could delay their discovery.
00:23:31,00:23:34,So no one was looking for the guy who had actually escaped
00:23:34,00:23:36,because they thought he was still there.
00:23:36,00:23:37,Right.
00:23:37,00:23:38,OK.
00:23:38,00:23:40,It feels like still only one person's escaped.
00:23:40,00:23:42,"Well, look, we won the war in the end."
00:23:42,00:23:43,That's the main thing.
00:23:43,00:23:46,[LAUGHTER]
00:23:46,00:23:49,Can I tell you what toilets are used for in American prisons?
00:23:49,00:23:51,Apart from the obvious.
00:23:51,00:23:53,Is it going to be a contraband thing?
00:23:53,00:23:54,It's not.
00:23:54,00:23:58,"So this is quite a few different facilities in America,"
00:23:58,00:24:00,"especially Union County jail in New Jersey,"
00:24:00,00:24:02,which is where I read about it.
00:24:02,00:24:06,And some prisoners are flirting with each other using their toilets.
00:24:06,00:24:09,And what they do is they take all of the water out
00:24:09,00:24:13,"and they say, ""This one's not for normal use."""
00:24:13,00:24:15,And then it's attached to all of the pipes
00:24:15,00:24:17,and so you can yell into it.
00:24:17,00:24:20,And then people in another cell can hear what you're saying.
00:24:20,00:24:21,Romeo.
00:24:21,00:24:23,[LAUGHTER]
00:24:23,00:24:26,And apparently you have one cell where everyone knows
00:24:26,00:24:28,that's the place people go for the flirting.
00:24:28,00:24:32,"Like if there's, let's say, that the men's wing is on one part"
00:24:32,00:24:34,"and the women's wing is somewhere else, but they're attached."
00:24:34,00:24:35,"Oh, OK."
00:24:35,00:24:38,"So one man would go in here, one woman would go in there,"
00:24:38,00:24:40,and they had like a special knock.
00:24:40,00:24:43,So you know that it's your particular girlfriend or boyfriend.
00:24:43,00:24:44,"Oh, wow."
00:24:44,00:24:47,"And yeah, this is the thing that's happening in America right now."
00:24:47,00:24:51,And it's not just they have phone sex through the toilets.
00:24:51,00:24:55,"Sorry, James, how do you do phone sex through a toilet?"
00:24:55,00:24:57,Do you know all the stuff that I said a bit ago
00:24:57,00:25:00,about how they're using it like a phone?
00:25:00,00:25:01,"Oh, OK."
00:25:01,00:25:02,"Yeah, yeah, yeah."
00:25:02,00:25:04,"No, I thought you were then introducing a phone"
00:25:04,00:25:06,as like an extra thing.
00:25:06,00:25:07,Got it.
00:25:07,00:25:09,So how will you pick phone sexes?
00:25:09,00:25:11,You actually introduce the phone sometimes.
00:25:11,00:25:13,"Actually, prism phones do have to be introduced to get them"
00:25:13,00:25:14,onto the premises.
00:25:14,00:25:15,So that's--
00:25:15,00:25:18,"I would've done on this, but you mean just spoken sex."
00:25:18,00:25:19,"Well, shout it."
00:25:19,00:25:20,Shout it into it.
00:25:20,00:25:21,Shout it out.
00:25:21,00:25:22,"No, no, no, no, no."
00:25:22,00:25:23,I do Rachel drink sex with my wife.
00:25:23,00:25:26,"Go, honey, have you seen the new iPhone?"
00:25:26,00:25:27,She's got this new feature.
00:25:27,00:25:29,"OK, so they talk, yeah."
00:25:29,00:25:30,Talk sex.
00:25:30,00:25:31,"They talk sex, he works with each other."
00:25:31,00:25:34,And they also carry out religious conversions.
00:25:34,00:25:35,They pass news.
00:25:35,00:25:36,News.
00:25:36,00:25:37,What?
00:25:37,00:25:38,"You don't want to mistake it, the phone exchange,"
00:25:38,00:25:39,when that's happening to you.
00:25:39,00:25:45,[MUSIC PLAYING]
00:25:45,00:25:48,"OK, it is time for fact number three."
00:25:48,00:25:49,And that is James.
00:25:49,00:25:52,"OK, my fact this week is that one of Britain's greatest"
00:25:52,00:25:56,"living playwrights, Tom Stoppard, wrote the final draft"
00:25:56,00:25:58,"of the movie, ""Bate Hulvin."""
00:25:58,00:25:59,There you go.
00:25:59,00:26:02,"So, yeah, this is Tom Stoppard, great playwright."
00:26:02,00:26:05,And he does a lot of work on the side for movies.
00:26:05,00:26:07,"It turns out, which I didn't know."
00:26:07,00:26:10,"He has polished scripts for 102 Dalmatians,"
00:26:10,00:26:13,Indiana Jones and the last Crusade.
00:26:13,00:26:16,And one very exciting thing that I found about
00:26:16,00:26:20,when looking through an inventory of his papers in America
00:26:20,00:26:23,"is that I don't know if he wrote the final script,"
00:26:23,00:26:25,"but he definitely did some work on Stoppard,"
00:26:25,00:26:26,my mum will shoot.
00:26:26,00:26:27,"Oh, no."
00:26:27,00:26:28,Friend of the podcast.
00:26:28,00:26:29,Our white whale of a film.
00:26:29,00:26:30,"Oh, absolutely."
00:26:30,00:26:31,Yeah.
00:26:31,00:26:35,"But he basically says that he finds the work frustrating,"
00:26:35,00:26:37,but in a certain time wasting.
00:26:37,00:26:40,"But at the end of the day, you have to wear money somehow."
00:26:40,00:26:44,"And these, when you're doing it for a very big movie,"
00:26:44,00:26:47,"so he worked on Indiana Jones, for instance,"
00:26:47,00:26:49,he earns an awful lot of money for it.
00:26:49,00:26:51,So much that you can't really turn it down.
00:26:51,00:26:54,"Yeah, and it's not even just polishing scripts."
00:26:54,00:26:57,"Like, for example, he was in the shower one day,"
00:26:57,00:26:59,"and his phone was ringing and he jumped out,"
00:26:59,00:27:02,"and it was Steven Spielberg, and Spielberg was like,"
00:27:02,00:27:04,"""I'm filming Schindler's List right now,"
00:27:04,00:27:05,and this scene doesn't work.
00:27:05,00:27:07,"What would you do in this situation?"""
00:27:07,00:27:08,"And he would go, you know,"
00:27:08,00:27:11,"so he's like standing naked in his shower room,"
00:27:11,00:27:13,solving problems while they're on set.
00:27:13,00:27:15,"And that was part of the gig as well,"
00:27:15,00:27:17,that they would just go to him as a brain.
00:27:17,00:27:20,Is he the only person to have worked on both Schindler's List
00:27:20,00:27:22,"and Stoppard, my mum will shoot?"
00:27:22,00:27:24,It can't be a long list.
00:27:24,00:27:26,"That's not going to be a huge list, no."
00:27:26,00:27:31,"But we should say, so, Beethoven is a classic of the '90s."
00:27:31,00:27:33,I'm sure some of you've seen it.
00:27:33,00:27:35,"The dog is a real comic character,"
00:27:35,00:27:38,"full of pratfalls, making life hell for the dad of the family."
00:27:38,00:27:39,"He's like, what would you call that?"
00:27:39,00:27:40,St. Bernard dog.
00:27:40,00:27:43,"Yeah, it's a St. Bernard dog, and he's always like,"
00:27:43,00:27:45,"if he runs, he ruins the whole house."
00:27:45,00:27:51,The dog that was used was a descendant of Buster Keaton's own dog.
00:27:51,00:27:53,"So Buster Keaton had a dog,"
00:27:53,00:27:55,"and his wife Eleanor started breeding them,"
00:27:55,00:27:58,"and these St. Bernard dogs then became the stars,"
00:27:58,00:28:00,and stunt doubles of Beethoven the movie.
00:28:00,00:28:02,"They have them one best picture, of course."
00:28:02,00:28:03,What? What?
00:28:03,00:28:06,"At the American Humane Society Awards,"
00:28:06,00:28:11,for outstanding words which raised public awareness of animal issues.
00:28:11,00:28:14,"Other winners include Babe, Black Beauty,"
00:28:14,00:28:15,Free Willy and Chicken Run.
00:28:15,00:28:18,Do you know what? Those are all good films.
00:28:18,00:28:22,"They are, in 2011, this best picture to raise awareness"
00:28:22,00:28:25,of animal issues was won by how to train your dragon.
00:28:25,00:28:28,[laughter]
00:28:28,00:28:31,A thin year.
00:28:31,00:28:32,A thin year.
00:28:32,00:28:35,"And 2012, it was won by Rise of the Planet of the Apes."
00:28:35,00:28:39,"Oh, which I think is a documentary about the Earl of Sandwich, isn't it?"
00:28:39,00:28:42,"But actually, Beethoven's second,"
00:28:42,00:28:46,"so there have been five, actually, I think eight Beethoven movies."
00:28:46,00:28:48,"But there's Beethoven, Beethoven's second,"
00:28:48,00:28:50,"Beethoven's third, Beethoven's fourth,"
00:28:50,00:28:52,Beethoven's fifth.
00:28:52,00:28:55,And you kind of got the feeling that they had to do that
00:28:55,00:28:57,to get the Beethoven's fifth joke.
00:28:57,00:28:59,That's why they did all those.
00:28:59,00:29:02,But Beethoven's second was nominated for an Academy Award.
00:29:02,00:29:03,It was.
00:29:03,00:29:04,In the category.
00:29:04,00:29:05,[laughter]
00:29:05,00:29:08,"Best dog. No, it was a best song, best original song,"
00:29:08,00:29:11,or a dolly cut and song that's in that.
00:29:11,00:29:13,"Wow, that's very exciting."
00:29:13,00:29:16,Tom Back to Tom Stopbard for a second.
00:29:16,00:29:19,"He wrote a play, which was called The Real Thing,"
00:29:19,00:29:23,"and in 2014, there was a revival of The Real Thing,"
00:29:23,00:29:25,"put on stage, which he was part of,"
00:29:25,00:29:28,and you and McGregor was the lead role in it.
00:29:28,00:29:30,"And during an interview, someone said,"
00:29:30,00:29:33,"""Wow, what's it like working with you and McGregor again?"""
00:29:33,00:29:36,"And he said, ""I don't know, I've never worked with you and McGregor before."""
00:29:36,00:29:37,"And he said, ""No, you have."""
00:29:37,00:29:42,"You did a rewrite of Star Wars Episode 3, Revenge of the Sith."
00:29:42,00:29:46,And you would have ridden some Jedi dialogue for you and McGregor.
00:29:46,00:29:48,I did look up some of the lines from that film
00:29:48,00:29:51,just to see if any of them have the stop-hard magic.
00:29:51,00:29:54,What about the droid attack on the wookies?
00:29:54,00:29:56,It feels like him.
00:29:56,00:30:01,I have seen a security hologram of him killing younglings.
00:30:01,00:30:03,Clearly stop-hard.
00:30:03,00:30:05,"What stop-hardian is in the OED,"
00:30:05,00:30:07,but I never read any Tom Stop-hard.
00:30:07,00:30:10,So what is his genre? It's kind of witty.
00:30:10,00:30:14,"I don't, yeah, they're brilliantly sort of funny and clever."
00:30:14,00:30:16,"And for a long time, people accused him of being,"
00:30:16,00:30:18,"as a ten-man of British theatre,"
00:30:18,00:30:20,"because he was writing plays that were intellectually stimulating,"
00:30:20,00:30:22,but didn't kind of captivate the emotions.
00:30:22,00:30:24,"I've been in the same room as him once,"
00:30:24,00:30:26,and it was so exciting.
00:30:26,00:30:27,It was really genuinely exciting.
00:30:27,00:30:29,It was the day my first ever book had come out.
00:30:29,00:30:34,"And my publisher took me to dinner after the launch party,"
00:30:34,00:30:35,and it was so exciting.
00:30:35,00:30:38,And Tom Stop-hard was at a nearby table hanging out with other famous people.
00:30:38,00:30:41,"I thought, ""This is my life from now on. I haven't seen him since."""
00:30:41,00:30:42,I just haven't seen him since.
00:30:42,00:30:45,Did you read out those lines from Revenge of the Sith?
00:30:45,00:30:48,"His head snapped around, his eyes light up, yeah."
00:30:48,00:30:49,"No, no, no."
00:30:49,00:30:53,The practice of someone taking a pass at a film script
00:30:53,00:30:55,"is quite common in Hollywood, isn't it?"
00:30:55,00:30:57,And I know there have been lots of comedy films in Hollywood
00:30:57,00:30:59,where they've actually been offered up
00:30:59,00:31:03,to like every British comedian I know has taken a crack
00:31:03,00:31:05,at a few modern film scripts.
00:31:05,00:31:06,Really?
00:31:06,00:31:07,"I've done, I've had a cracker."
00:31:07,00:31:08,"Oh, yeah. What are you doing?"
00:31:08,00:31:09,I'll tell you afterwards.
00:31:09,00:31:10,"Oh, come on."
00:31:10,00:31:12,I don't think I got any lines in.
00:31:12,00:31:16,"But I know there was like, there was one that was made recently,"
00:31:16,00:31:21,there was a Christmas film that I know at least 10 comedians
00:31:21,00:31:22,who had a crack at it.
00:31:22,00:31:23,Really?
00:31:23,00:31:25,So just adding extra lines to it?
00:31:25,00:31:27,"Yeah, yeah, yeah, yeah, submitting them and they see if they like them more."
00:31:27,00:31:28,"Yeah, yeah."
00:31:28,00:31:31,But I wanted to tell you about one not related to Stop-hard
00:31:31,00:31:35,that is close to my heart because my book is all about Charlotte Lucas
00:31:35,00:31:36,from Pride and Prejudice.
00:31:36,00:31:40,And Emma Thompson famously wrote the amazing screenplay
00:31:40,00:31:41,of sense and sensibility.
00:31:41,00:31:45,But she took a pass at the 2005 Pride and Prejudice.
00:31:45,00:31:49,"And the line that became a meme that Charlotte Lucas says,"
00:31:49,00:31:51,"she says, I'm 27 years old."
00:31:51,00:31:53,I've no money and no prospects.
00:31:53,00:31:55,I'm already a burden to my parents.
00:31:55,00:31:56,And I'm frightened.
00:31:56,00:31:58,And Emma Thompson wrote those lines.
00:31:58,00:32:00,"Joe Wright, the director said he went to Emma Thompson said,"
00:32:00,00:32:01,can you help?
00:32:01,00:32:03,"And she said, get a notebook out."
00:32:03,00:32:04,Write this down.
00:32:04,00:32:06,And she just improvised those lines.
00:32:06,00:32:07,"Wow, wow."
00:32:07,00:32:12,"Yeah, that apparently among Gen Zed and millennials has become a massive meme"
00:32:12,00:32:14,for like very hard relate.
00:32:14,00:32:15,I'm 27 years old.
00:32:15,00:32:17,I've no money and no prospects.
00:32:17,00:32:19,I'm already a burden to my parents.
00:32:19,00:32:20,And I'm frightened.
00:32:20,00:32:22,That's so good.
00:32:22,00:32:25,Can I tell you one of the greatest script doctors of all time?
00:32:25,00:32:26,Yeah.
00:32:26,00:32:29,"Because lots of people, Carrie Fisher was a great she worked on loads."
00:32:29,00:32:34,"Roll Dal did a little bit on you only live twice, which I find interesting."
00:32:34,00:32:39,El Ron Hubbard of the Church of Scientology founder of.
00:32:39,00:32:41,"Oh, that one."
00:32:41,00:32:45,Thanks for clarifying.
00:32:45,00:32:49,So there's this really bad film called Battlefield Earth.
00:32:49,00:32:50,"Oh, yeah."
00:32:50,00:32:51,John Travolta.
00:32:51,00:32:52,John Travolta.
00:32:52,00:32:57,"Now, Hubbard had written a book called Battlefield Earth."
00:32:57,00:32:59,And it's about aliens.
00:32:59,00:33:01,It's a saga of the year 3000.
00:33:01,00:33:02,It's a thousand pages long.
00:33:02,00:33:05,It's lightweight for real SF fans.
00:33:05,00:33:07,But he really wanted it to be a movie.
00:33:07,00:33:09,"Travolta loved it, was a Scientologist."
00:33:09,00:33:12,Now Travolta really wanted to make it.
00:33:12,00:33:16,And a writer called JD Shapiro got attached to the project.
00:33:16,00:33:19,And he wrote a script.
00:33:19,00:33:21,And he got a load of script notes.
00:33:21,00:33:23,"And he said, these come right from the top."
00:33:23,00:33:25,"I mean, they come from El Ron Hubbard."
00:33:25,00:33:30,"The interesting thing about it is, Hubbard had died about ten years before."
00:33:30,00:33:35,"So as far as I could tell, the only posthumous script doctor."
00:33:35,00:33:36,Very cool.
00:33:36,00:33:37,Very cool.
00:33:37,00:33:41,Do you know the script doctoring work of M. Knight Shyamalan?
00:33:41,00:33:45,"So he wrote the sixth sense, that incredible movie."
00:33:45,00:33:49,"And then that kind of plot twist reveal became kind of his signature move, right?"
00:33:49,00:33:51,So Signs was another movie of his--
00:33:51,00:33:52,The Village.
00:33:52,00:33:53,"The Village, exactly."
00:33:53,00:33:57,But he was also trying to make it as a writer.
00:33:57,00:33:59,And so had to do a lot of different projects.
00:33:59,00:34:01,"At the same time, while he was doing the sixth sense."
00:34:01,00:34:04,"So in the same year, he then had a movie come out in December."
00:34:04,00:34:07,His follow-up movie with his name on the credits.
00:34:07,00:34:09,And that movie was...
00:34:09,00:34:11,Stuart Little.
00:34:11,00:34:13,Can you believe that about the cartoon mouse?
00:34:13,00:34:14,"Well, it's not cartoon."
00:34:14,00:34:18,"Well, I guess it's a normal movie with animated mouse as the other lead character."
00:34:18,00:34:20,And all the humans are dead at the end.
00:34:20,00:34:21,Sorry?
00:34:21,00:34:23,And all the humans were dead all that time.
00:34:23,00:34:24,"It was, yeah."
00:34:24,00:34:28,"Well, he also, he did the script doctoring for She's All That."
00:34:28,00:34:29,I don't remember.
00:34:29,00:34:31,Do you remember Rachel Lee Cook?
00:34:31,00:34:37,She's an incredibly hideous woman because she wears glasses.
00:34:37,00:34:38,What if she--
00:34:38,00:34:40,"If you spend half an hour with her, that wears off."
00:34:40,00:34:41,"Oh, yeah, yeah."
00:34:41,00:34:43,The charm begins to come through.
00:34:43,00:34:48,"But classic M Night Shyamalan plot twist, she takes the glasses off."
00:34:48,00:34:50,"And suddenly, she's really beautiful."
00:34:50,00:34:51,And...
00:34:51,00:34:53,Have you ever tried that done?
00:34:53,00:34:55,You need to wear a red dress as well.
00:34:55,00:34:56,Yeah.
00:34:56,00:34:57,Yeah.
00:34:57,00:34:59,I think-- do we have to move on there?
00:34:59,00:35:00,We do have to move on there.
00:35:00,00:35:01,We do have to move on there.
00:35:01,00:35:03,"Just going back to Tom Stophard, very briefly."
00:35:03,00:35:07,He became massive when he wrote Rosencrantz and Gilden Stern at Dead.
00:35:07,00:35:10,It's basically two characters from Hamlet and it's their story.
00:35:10,00:35:11,And I didn't know this.
00:35:11,00:35:15,It premiered at the Edinburgh Fringe in 1966.
00:35:15,00:35:17,But it was absolutely massive there.
00:35:17,00:35:19,And then he went to London and it was absolutely massive there.
00:35:19,00:35:21,And then it went to New York.
00:35:21,00:35:25,"And at the New York Premier, a journalist asked him, what is it about?"
00:35:25,00:35:28,"And he said, it's about to make me a lot of money."
00:35:28,00:35:31,[laughter]
00:35:31,00:35:35,And he was a journalist at the Bristol Evening Post when it debuted.
00:35:35,00:35:37,That's how he'd been making his living.
00:35:37,00:35:39,"And again, this is an example of his amazing lines."
00:35:39,00:35:41,An editor tried to catch him out.
00:35:41,00:35:44,His news editor tried to catch him out because he said he was interested in current affairs.
00:35:44,00:35:47,"And the editor said, all right, well, who's the current home secretary?"
00:35:47,00:35:51,"And Stophard said, I said I was interested in politics, not obsessed by them."
00:35:51,00:35:53,[laughter]
00:35:53,00:35:55,That's very good of us.
00:35:55,00:35:59,[music]
00:35:59,00:36:02,Let's move on to our final fact.
00:36:02,00:36:04,"Okay, it is time for our final fact."
00:36:04,00:36:06,And that is my fact.
00:36:06,00:36:11,"My fact this week is, old jobs in the UK that you used to be able to do,"
00:36:11,00:36:18,"included but-woman, baller, boner, and bottom-stainer."
00:36:18,00:36:25,"Now, this is from the back end of a book that is called ""Craftland"" by James Fox,"
00:36:25,00:36:29,who was actually here at the festival earlier today doing a talk.
00:36:29,00:36:30,He did a 12 p.m. today.
00:36:30,00:36:36,He's released this book where he's looking into craft jobs that are either endangered in the modern world
00:36:36,00:36:40,or people that are just carrying on with it and that we might not know about.
00:36:40,00:36:46,But it includes an index of all of these jobs that he says are on the brink of extinction or endangered.
00:36:46,00:36:49,"I think in the case of the ones I just read, they must be basically-"
00:36:49,00:36:51,Can you tell us what they do?
00:36:51,00:36:53,"Like, what is a boner?"
00:36:53,00:36:54,A boner.
00:36:54,00:36:59,"Okay, so a boner used to be someone who would be the insertor of whale bones into a corset."
00:36:59,00:37:03,"So when you were building a corset, yeah, that used to be used to help give it-"
00:37:03,00:37:08,"And, but-woman, that sounds like it's the female version of Butman."
00:37:08,00:37:12,"Yeah, and-well, it's the seller of flatfish on a key side."
00:37:12,00:37:15,"Yeah, but-well, okay."
00:37:15,00:37:16,What's a boner?
00:37:16,00:37:20,"A boner is someone who would check, let's say if you were working in textiles,"
00:37:20,00:37:23,you would check the balls of wool in advance of spinning.
00:37:23,00:37:25,"So you would go around and go, ""Yep, nice ball."""
00:37:25,00:37:30,"Dan, as you're explaining that, you're doing like really egregious hand gestures"
00:37:30,00:37:33,that don't match up with what your words say.
00:37:33,00:37:36,"It's just-for the room, yeah."
00:37:36,00:37:37,"For all of us, yeah."
00:37:37,00:37:41,Could you give us some gestures for bottom stator?
00:37:41,00:37:46,That would be putting a stain on a bottom of a boot or a shoe.
00:37:46,00:37:48,I also had a bump.
00:37:48,00:37:51,"So this isn't to do with craft exactly, but bummer-y."
00:37:51,00:37:52,"Oh, what's bummer-y?"
00:37:52,00:37:53,I think bummer-y.
