start_hhmmss,end_hhmmss,text
00:24:23,00:24:28,and then they ship the water out and then on the other side they put the same bubbles back in.
00:24:30,00:24:33,It's the same. It's the fact that it's the same bubbles that makes it impossible.
00:24:33,00:24:40,"It's got to be the same ones. We've got bubbles. Yeah, and then I told Ash I was like after we found"
00:24:40,00:24:45,"out that it wasn't real, which like there's no even way to Google. It's not the same thing. I was"
00:24:45,00:24:50,"like, Ash, it's like that wasn't real and he was like, yeah, I know I found it wasn't real ages ago,"
00:24:50,00:24:57,"yeah. That was the same episode when you said that if you have water which you can't drink,"
00:24:57,00:25:01,you can feed it to a camel and it vomits it out and then it'll be completely drinkable.
00:25:01,00:25:09,"And I still stand behind that back. I'm pretty sure an explorer wrote into us and said,"
00:25:09,00:25:11,I'll do you mock at you. I wrote you. Are you wrote into it?
00:25:11,00:25:17,"I am an explorer of sorts. Yeah, I found in a book. It was like a 19th century explorer's book"
00:25:17,00:25:22,and he said a good way to treat dehydration is to drink the vomit of a camel. So I mean it was
00:25:22,00:25:26,obviously nonsense at the time but I think people have believed it for a while. I'd definitely
00:25:26,00:25:29,remember reading a reference. But that's for dehydration and not for poison.
00:25:29,00:25:32,"I'm no sorry it was about a sorry it was for poison. It was a toxin thing, yeah."
00:25:32,00:25:38,So it's the jury's out on whether if you dehydrated you should drink camel vomit. It's got liquid content.
00:25:38,00:25:40,Why are we all being so squeamish about this?
00:25:40,00:25:47,That fact actually reminds me of bees. I think bees air condition themselves by spitting inside
00:25:47,00:25:51,"of their hives, don't they? So that it creates like a nice bit of condensation which calls"
00:25:51,00:25:57,them down in summer. They spit on each other's faces to call each other. So why you've been doing
00:25:57,00:26:08,that to me? No. Okay. Turkey Vultures we down their own legs to call themselves Stone.
00:26:08,00:26:15,Which is why I've been doing that. This is actually sorry but you've mentioned Vultures. This is
00:26:15,00:26:20,one of my favourite facts I found on this series of QI we just research which is the reason the
00:26:20,00:26:24,"Vultures have their necks, they don't have fur on their necks is because it's quite hard for them"
00:26:24,00:26:28,to scavenge actually because it's quite hard to get into the body of a dead animal. So if there's
00:26:28,00:26:33,not an open wound then they find the easiest orifice to enter through and so they either go in through
00:26:33,00:26:38,the eyeballs of you know your dead deer all they just go straight up the arse and the reason
00:26:38,00:26:43,that they they have that little bear bit is so they don't pull their heads out covered in feces
00:26:43,00:26:50,from the animal that they've been scavenging inside. They do and they'll cover in feces but it doesn't
00:26:50,00:26:55,kind of stick there because they don't have all the feathers. Yeah yeah yeah it's easier to remove
00:26:55,00:27:01,just to clarify that. Wait so that's literally why they've evolved like that so they don't get the
00:27:01,00:27:05,rest of their body covered in shit but their head is... Well they don't usually need to crawl up
00:27:05,00:27:11,entirely inside the animal usually just the neck is enough. I know but it's just odd that they haven't
00:27:11,00:27:16,worked out how to eat something else so they've just thought well let's just lose all the feathers
00:27:16,00:27:24,here and then we can keep getting shit all over our heads. This is about German international
00:27:24,00:27:36,development agencies. Ah who is that? Joe hi Joe. I pretty much already read all of it. The German
00:27:36,00:27:46,international development agency is called Chiz. It's called GIZ and then Open brackets Giz.
00:27:46,00:27:55,Is GIZ that an acronym? Yeah but you you do call it Giz. Great.
00:27:55,00:28:05,Andy have you if you got one? Yes. Mine is also about German and about squirrels
00:28:06,00:28:13,anybody? Hello what's your name? Ed. Hello. Ed's back to his. The German word for squirrel literally
00:28:13,00:28:25,means oak croissant. Icon hind yeah can we get some verification from the back? No. They've left.
00:28:29,00:28:39,Citation needed I think. This one's about kangaroos and it's got a drawing on it. Is that ring a bell
00:28:39,00:28:43,with anybody? Hello. Oh right at the back. What's your name? Clint.
00:28:43,00:28:53,Lewis. There's facts from Lewis and it's I'm going to read it out verbatim. My fact is rubbish but I
00:28:53,00:29:00,didn't Google it. Brackets for shame on you Googlers. Then we get to the meter the master.
00:29:00,00:29:07,A kangaroo licks its arms to stay cool and then there's a drawing of a kangaroo
00:29:07,00:29:15,licking its arms. It's really good. That's great. Don't they pose with their biceps when they're
00:29:15,00:29:19,trying to pick up lady kangaroos? Yeah there's all these photos of kangaroos are like oh
00:29:19,00:29:25,do you want me to get that? Like genuinely bicep. That's sort of bodybuilding. They also very
00:29:25,00:29:32,famously have three vaginas don't they? Yes. Very famously within the QI office. It's not in the
00:29:32,00:29:39,Australian national anthem isn't it? Speaking of things which have three vaginas. No wait a minute
00:29:39,00:29:44,no. Are you going to say what I think you're going to say? I think I know. She doesn't have
00:29:44,00:29:49,three vaginas. No. But do you want us to you talk about it? So a kangaroo has three vaginas which
00:29:49,00:29:55,means it has two wombs because it has two extra kind of bits that go out to a womb and does anyone
00:29:55,00:30:00,know some body else who has two wombs? James found this out just today and he can't stop. I want
00:30:00,00:30:07,to use it. I wanted to use it for the show but they wouldn't let me. Mary Berry. Mary Berry has two
00:30:07,00:30:20,wombs. As two and three vaginas. That's no way to speak about Melonsou and Paul Hollywood.
00:30:20,00:30:38,[Music]
