start_hhmmss,end_hhmmss,text
00:22:54,00:22:58,"water slides off the outside, right? So it's very hydrophobic, I guess, so it's good at protecting"
00:22:58,00:23:06,"you from water, but it not absorbs, it adsorbs water easily, right? So if you have water vapor"
00:23:06,00:23:11,"in here, it kind of makes its way into the wool, like underneath the scales. So once the water"
00:23:11,00:23:17,"gets in, that keeps you nicely cool, for example. Wait, so sorry, it's pushing off water. It pushes"
00:23:17,00:23:23,"off liquid water, but it takes in water vapor, okay? So you try to wear a wool jumper in summer,"
00:23:23,00:23:28,"and then winter as well. Oh, sorry, yeah, yeah. It releases heat, so that can also warm you up,"
00:23:28,00:23:31,even if it's got water vapor inside it. So that's the way of keeping you warm. So if you fall in a
00:23:31,00:23:38,"river that's freezing cold, and then you get to dry land, be wearing wool. Like, don't wear cotton"
00:23:38,00:23:43,"if you've done that. Right. Basically, because you'll be much less harmed if you're wearing wool,"
00:23:43,00:23:49,"which has repelled the outside water, it's not wet on the inside. That's a top tip. Yeah. It's a top"
00:23:49,00:23:55,"tip. If there's two of you on like a raft, and only one of you can stay on the raft, the one who's"
00:23:55,00:24:00,"wearing wool gets pushed in, is what you're saying. Yeah, exactly. Right. Don't be on a raft with"
00:24:00,00:24:05,"James. They've invented a new kind of sheep this year, that's exciting. A new kind of sheep. They've"
00:24:05,00:24:10,"bred a multifunctional sheep for the first time, which is very exciting. Okay, let's go for the"
00:24:10,00:24:15,"functions. Does it do your diary, organise it on a cook? It just does wool and meat, basically."
00:24:15,00:24:20,But that's new. And have the two been mutually exclusive before that? I think this is the most
00:24:20,00:24:26,multifunctional sheep they've ever come up with. Wow. The sheep three. It's a sheep three. Is it
00:24:26,00:24:32,"not working? Just drop it. Drop it from a short height. Well, yeah, that's incredible. I knew"
00:24:32,00:24:38,"sheep. That's amazing. Oh, I saw an amazing picture online, which I want to go see in person. If you"
00:24:38,00:24:43,"go to which museum is it? I think it's in the Science Museum. Yeah, it's a Science Museum."
00:24:43,00:24:49,"There's a jumper there made of wool, which is on display. Can you guess why the Science Museum"
00:24:49,00:24:55,"would have a notable jumper of wool? Knitted by expedition. That's good. No, no. So it's not"
00:24:55,00:25:00,been to the North Pole? Not been to the North Pole. Knitted by Einstein. Knitted by some famous
00:25:00,00:25:06,scientist. No. What's their famous sheep? Dolly. Dolly's jumper. There we go. It is wool from the
00:25:06,00:25:12,"first mammal ever cloned, Dolly. The sheared wool turned into a jumper. And they've only made one."
00:25:12,00:25:20,"Idiots. Yeah. And it's got sheep on it. It's really beautiful. That's not beautiful, but it's, you"
00:25:20,00:25:26,"know, it's a bit cartoony. Pretty cool though, isn't it? It's very cool. The wool industry was so"
00:25:26,00:25:32,important for Britain that they had to do loads of laws for it. So there was this thing with the
00:25:32,00:25:36,"burials. But there was another thing where they tried to get rid of all the wolves, because obviously"
00:25:36,00:25:43,"the wolves were killing the sheep. So Edward I paid one guy, Peter Corbett, to destroy all the wolves"
00:25:43,00:25:50,"in Britain, which he managed. We don't have any wolves anymore. Hey, what are you up to? I'm just"
00:25:50,00:25:56,killing all the wolves in Britain. And William the Conqueror would grant land to people in North
00:25:56,00:26:01,umberland and Cumberland on the condition that they would defend the land from any wolves and any
00:26:01,00:26:09,"Scotsman. It was mean putting them second in the list. Did you know, I'm sure you knew, it's about"
00:26:09,00:26:17,the wool sack that is in the House of Parliament. It looks like a sort of giant cushion called the
00:26:17,00:26:23,"wool sack, and it's where the Lord Speaker sits. And that was introduced by some, I had it written"
00:26:23,00:26:27,"down, I've lost it, some king, basically a long time ago, to commemorate how important the wool"
00:26:27,00:26:31,"trade is. And now it's stuffed with wool, a blended wool from Britain and the other wool"
00:26:31,00:26:36,"producing nations of the Commonwealth, the ones we stole. Common wolf more like."
00:26:37,00:26:46,"He's a slow hand clap. It didn't feel empowering. I didn't feel. No, just on the wool sack, they,"
00:26:46,00:26:51,"I think that it was, it's centuries old, it's really, really old. And in 1938, they opened it up"
00:26:51,00:26:56,"and they found out, oh, it's horse hair, completely full of horse hair, full of wool."
00:26:56,00:27:04,"Scandal, that is. So now they filled it with the Commonwealth wool. Do you know where we almost"
00:27:04,00:27:09,"had wool? Where? It's such a, like, on our bodies. Do you mean like humans used to have? On our bodies,"
00:27:09,00:27:18,"yes. The legs. No. The arms. No. Running short. The teeth, the teeth woman. No, no, inside the body."
00:27:18,00:27:27,"Yes. Oh. What? How drunk are we? We used to have some kind of... No, no, no, we didn't use to, we"
00:27:27,00:27:35,"almost had. Didn't we almost have the wool inside? We almost had wool in our, in our, in our livers,"
00:27:35,00:27:44,"lungs, hearts. Boobies. We almost had woolen boobies. Extraordinary claims require extraordinary"
00:27:44,00:27:50,"evidence there. So, in the 1950s, there was a lot of experiments going on. In the 1950s? Yeah,"
00:27:50,00:27:56,"there were... We didn't get boobs in the 1950s as a species. Oh, we did, we did. But what we did have"
00:27:56,00:28:00,"was plastic surgery, where people were having their breasts enhanced, and there were many materials"
00:28:00,00:28:04,that were tested out as what we would be using for breast... That is an itchy tits.
00:28:04,00:28:15,"You do get itchy tits. If that is made of wool, that is... Itchy on the inside. Oh, that's... They"
00:28:15,00:28:21,"tried wool? They tried wool. They tried sponges. They tried ivory balls. They tried ivory. Yeah,"
00:28:21,00:28:25,they tried a lot of stuff. And then eventually it was the silicon implants that they worked in.
00:28:25,00:28:29,"Sponges, so you could maybe decrease and increase them, depending on how much water you put."
00:28:29,00:28:34,"Yeah, yeah. Sounds good. Anyway, I need to move us on to our next fact. Do you want to say one more"
00:28:34,00:28:39,"thing before we do? Well, I was just going to talk about the wool factories that we had. So,"
00:28:39,00:28:44,"a lot of the wool factories in the north, they would have families who basically lived in the"
00:28:44,00:28:48,"shadow of them, and the factories would kind of look after them, feed them. They would go to"
00:28:48,00:28:53,"church with the factory owners, all that kind of stuff. And I was reading about one called the"
00:28:53,00:29:00,"Fox's Woolen Mill. They invented khaki, the stuff that you... The khaki? The thing you used to get"
00:29:00,00:29:06,"into your car. Yeah, yeah. Oh, that's not what I thought you said, sorry. No, the khaki material."
00:29:06,00:29:14,"Cool. And they said that the children would get free woolen clothing, and they would be sewn into"
00:29:14,00:29:22,"their woolen underwear in September, and then let out again in May. Wow. I think they must have had"
00:29:22,00:29:27,"an opening. Yeah, there's an engineering problem there. I think so. Wow. But yeah, imagine that."
00:29:27,00:29:33,Put a tube in. You stay warm. Yeah. But being sewn into your underwear for six months of the year.
00:29:33,00:29:37,Living Newton-John was sewn into those trousers in Greece. That's true. And they had to unpick her
00:29:37,00:29:42,"every time she needed to. There was a story, wasn't there, that Franz Ferdinand, when he was shot,"
00:29:42,00:29:48,"he'd been sewn into his uniform and... You had the band. The band. I was like, what? They're going,"
00:29:48,00:30:04,"take me out. Take me out. It is time for fact number three, and that is my fact. My fact this week"
00:30:04,00:30:11,"is that in 1914, women were only allowed to visit the Natural History Museum if a man agreed to"
00:30:11,00:30:19,"sign a note promising that they would behave themselves. So this is, yeah, this is, as I say,"
00:30:19,00:30:25,"1914. I got this fact, by the way, from Dr. Fern Riddell. She's a historian. She's written in books"
00:30:25,00:30:30,about suffragettes and the history of sex and all that sort. She's brilliant. You can find her on
00:30:30,00:30:36,"Twitter. And she put up this link, which was for one of the museums by an author called Kerry"
00:30:36,00:30:42,"Lotzvaz. And it was the story of suffragettes. And during 1912 to 1914, there was so much damage"
00:30:42,00:30:48,"that was going on in the name of trying to get their message out, much the way that we see modern"
00:30:48,00:30:53,"protesting, that they would take... They would do quite sort of big acts when they are destroying"
00:30:53,00:30:58,things. And museums were a particular target. And so museums basically had to shut down for a while.
00:30:58,00:31:04,You had to go by appointment in some cases. But women specifically had a note that was
00:31:04,00:31:09,"presented to a man, and they would have to hand in at the door, that then gave them access. And"
00:31:09,00:31:14,"if they did damage something, the man would be liable for the damage that they did. And the woman."
00:31:14,00:31:22,"Honestly. Yeah, it was wild, wasn't it? The Natural History Museums weren't sure exactly what they might"
00:31:22,00:31:27,"target. The head of the museum said that unless explosives are used, the large mammals are not"
00:31:27,00:31:33,likely to suffer very seriously. But they were bombing things at the time. So there was a chance
00:31:33,00:31:36,"they might... If I know, they're not worried about women's rights. They're like, ""Fucking hell, those"
00:31:36,00:31:42,"elephants. They need protecting."" Well, they were mostly bothered about the coral. Apparently."
00:31:42,00:31:48,"Famously. Order of priorities. Men, coral, women. But it was such a big deal. Lloyds of London actually"
00:31:48,00:31:53,"started issuing householders comprehensive insurance policies that covered damages by airplanes,"
00:31:53,00:31:59,"riots and suffragettes. No. That was part of your insurance. As a woman, you did go to a museum."
00:31:59,00:32:04,"You had to surrender your parcels, your muff and your umbrella at the door. Because all they were"
00:32:04,00:32:11,"all used to conceal objects you... Well, the suffragettes, they actually... The suffragettes"
00:32:11,00:32:16,came out saying that we're going to put hammers in our muffs. You'd be amazed what some women can do.
00:32:16,00:32:24,"""Must Hammer"" is a good, cool nickname for a suffragette, isn't it? WWE Muff Hammer."
00:32:25,00:32:32,Making her way to the ring. She's got a note from her husband. But he hasn't signed it!
00:32:32,00:32:40,"Oh, also, we should all be saying suffragettes. Oh, really? Because they were very, very initially."
00:32:40,00:32:45,"Well, the word was coined by a newspaper writer, and they were originally referred to as suffragettes,"
00:32:45,00:32:49,"because... And they took it on because they said, ""We're going to get the vote."" It was the Daily Mail."
00:32:50,00:32:54,"The Daily Mail coined the word ""suffragette"" where everyone's... But as a slam of a word?"
00:32:54,00:32:59,"It was a slam, because they were not the nice ones. Distinguished from the women's social and"
00:32:59,00:33:04,political union. The suffragists were the ones who were being peaceful campaigners. But then it
00:33:04,00:33:08,"became like, ""Yeah, we are suffragettes. Fuck you."" Yeah, yeah. Just on the museums, just one last thing."
00:33:08,00:33:14,"The assistant keeper of the National Portrait Gallery, who was called James Milner,"
00:33:14,00:33:19,"said that if women are to be admitted into public galleries, there seems to be no alternative,"
00:33:19,00:33:26,"but to handcuff their hands behind their backs, and to put up a grill in front of all the pictures"
00:33:26,00:33:34,to stop them headbutting them. Sensible policies for a safer Britain. Wow. Wow. Isn't that amazing?
00:33:34,00:33:38,"So depressing. Yes, they really, really got up people's noses, I think is what they're saying."
00:33:38,00:33:43,"That's one word for it. Do you know that? Yeah. Emily Wilding Davidson. Yeah. Davidson,"
00:33:43,00:33:48,"the one who threw herself under the King's horse, so famously... She was the first human casualty."
00:33:48,00:33:53,"I was reading about her, and she was actually super violent, and had been for a very long time,"
00:33:53,00:33:57,"was throwing rocks. She kept trying to throw rocks at Lloyd George, but kept mistaking someone."
00:33:57,00:34:03,"And she was so violent that Pankhurst was like, ""Get her out. This is too much. We think she's"
00:34:03,00:34:07,"going to do something nuts."" Yeah, because she was just attacking people, throwing herself at people."
00:34:07,00:34:11,"Because they all did jiu-jitsu, didn't they? They were trained in jiu-jitsu by one of the suffragettes,"
00:34:11,00:34:16,"Edith Garrard. Garrard led the teaching, because she knew how to do jiu-jitsu."
00:34:17,00:34:21,"And the idea behind the training was that appointed bodyguards would surround leaders,"
00:34:21,00:34:25,"like the Pankhurst, basically, so that they had people in front of them to do jiu-jitsu."
00:34:25,00:34:28,But they also had big wooden clubs concealed about their person.
00:34:28,00:34:33,"In their muff hammers. Well, I don't know. Like, no muff is big enough to hide these clubs."
00:34:33,00:34:35,"They had to hide them in their dressers. Oh, baby, you don't know!"
00:34:35,00:34:43,I was reading about the slow pace of female emancipation. Just that Saudi Arabia gave women
00:34:43,00:34:50,"the right to vote in 2015, leaving Vatican City as the only place where women's suffrage is still"
00:34:50,00:34:56,"denied today. Right. Yeah. Well, Switzerland only got it in 1991 as the whole country."
00:34:56,00:35:03,So it was 1971 that the country had universal suffrage. But all the cantons were allowed to vote
00:35:03,00:35:06,"on it themselves. And they're like the sort of counties. They're like the counties, yeah. But"
00:35:06,00:35:10,"they have a lot of things that they can kind of decide by themselves. And there was one canton,"
00:35:10,00:35:18,"the Appenzell in a Holden canton, that voted against women's suffrage in '73, '82 and 1990."
00:35:18,00:35:24,"Fucking hell. Come on, canton. Get with it. I know. And the thing is, it's slightly weird,"
00:35:24,00:35:28,"because the way that they vote there, they don't like going to a voting booth. They all go into"
00:35:28,00:35:36,"the town hall square and kind of shout. Fuck women! I said it 15 years ago, and I stand by it!"
00:35:38,00:35:44,"Shut up, Sandra! Yeah. And then in 1991, the federal government had to step in and say,"
00:35:44,00:35:48,"look, this is the rule, guys. Guys, you're embarrassing us. You're an embarrassing uncle."
00:35:48,00:35:51,It's getting really embarrassing. Have you heard of the board game Suffragetto?
00:35:51,00:35:59,"No. Have you heard of the board game Pankersquith? Yeah, they came out roughly at the same time."
00:35:59,00:36:04,"Really? Yeah, yeah. What's yours? My one is a game whereby it kind of looks like a chessboard,"
00:36:04,00:36:08,"and you have all these pieces, and on one side, you're team Suffragette, and then the other side,"
00:36:08,00:36:14,"you're team police, and you need to get as many... I want this game. This sounds amazing. Yeah, well,"
00:36:14,00:36:18,"there's only one remaining copy of it, and it's in the Bodleian Library. I'm going to go with my"
00:36:18,00:36:24,"Marfan Steelem, before I headbutt a painting. I think you used to be able to, like, download,"
00:36:24,00:36:28,"I was going to say PDFs, but I think you could, like, download the board and stuff."
00:36:28,00:36:33,"Oh, yeah, right, cool. Yeah, but Pankersquith, because it was Asquith, the Prime Minister?"
00:36:33,00:36:37,"It was the Prime Minister at the time, and this was 1909, and it was a board game."
00:36:37,00:36:41,"You had to get across the board and avoid arrest. It was the same kind of premise. Yeah, yeah."
00:36:41,00:36:47,"But the violence of the Suffragette movement was part of this game of suffragetto, because"
00:36:47,00:36:52,"if you caught one of the suffragettes, they went to prison, and if you caught one of the policemen,"
00:36:52,00:36:59,"they went to hospital. Yes. Yeah. And this was made by the suffragettes, I think, the board game?"
00:36:59,00:37:03,"Yeah, so it was their own issued game. They had a lot of merch. They had a load of merch."
00:37:03,00:37:08,Women love merch. We'll buy a tote bag. We don't care what's on it. We do not care.
00:37:08,00:37:12,"What other merch did they have? Oh, they had sort of scarves, and they had badges, and they had"
00:37:12,00:37:15,"lots of postcards. Well, the colours, the big thing was the purple one, and then they put that on"
00:37:15,00:37:19,"jewellery, as well, and you'd have it on rings, and it was like a secret. You could wear the colours"
00:37:19,00:37:22,"separately, and everyone would be like, ""Oh, I know what you vote for."" That was one of the things"
00:37:22,00:37:30,"of the, at the 2012 Olympics, they had a suffragette display as part of the opening ceremony,"
00:37:30,00:37:37,and someone came out as Emily Davison wearing the purple sash that was Emily Davison's. That's
00:37:37,00:37:42,"the genuine article. Yeah, which is pretty cool. We should probably say there is a bit of a debate"
00:37:42,00:37:48,"about whether suffragette tactics won the day in the end, because they suspended all militant"
00:37:48,00:37:52,"activities at the start of the First World War, and then by the end of the war, women were so"
00:37:52,00:37:57,"integrated in industry, factories, all of that. Are you saying war's good? Is that where there's"
00:37:57,00:38:06,"going? Or are you saying the suffragettes are bad? Yeah. Which one, Andy? Because the live audience"
00:38:06,00:38:10,"and the people listening at home would like to know. Well, actually, I'm probably saying both."
00:38:10,00:38:18,"Welcome to GB News. But no, there is a debate, isn't there? Well, like, it did actually,"
00:38:18,00:38:21,"actually did they achieve anything, because they made themselves very, very hated at the time,"
00:38:21,00:38:25,"and then the impression was that by the end of the war, that women were just so much more"
00:38:25,00:38:28,into society. But then would that have happened without them doing that movement in the first
00:38:28,00:38:32,"phase? I don't know, yeah. It would have been four long years. Yeah, yeah. But it's definitely like,"
00:38:32,00:38:35,"the tosses argue, isn't it? The tosses argue. Can I quickly, just speaking of people hiding"
00:38:35,00:38:40,"things in their muffs, it just reminded me of my favourite headline of all time."
00:38:40,00:38:47,"So the author, Cormac McCarthy, died earlier this year, and it was a headline that I saw years ago."
00:38:47,00:38:51,"This is the headline. So he only just makes a cameo, and this is not really to do with him."
00:38:51,00:38:58,Cormac McCarthy's ex-wife pulls gun from vagina during argument over aliens.
00:38:58,00:39:04,"Tell me you're clicking on that link immediately. The Daily Telegraph has changed, hasn't it?"
00:39:04,00:39:10,"What was that? Where was that? It was in a newspaper. Oh, great. Yeah."
00:39:10,00:39:15,"In Iraq. Yeah, by Vince Mancini. In Iraq. Yeah."
00:39:15,00:39:18,"Check this out. Anyway, yeah, I've been wanting to say that for years on this podcast."
00:39:18,00:39:31,"Okay, it is time for our final fact of the show, and that is James. Okay, my fact this week is that"
00:39:31,00:39:38,a designer from Indonesia who recycles cow dung has found a way to make stools from stools.
00:39:41,00:39:48,"Very nice. Thank you. Yeah, it's just a joke that stools and stools are the same thing,"
00:39:48,00:39:53,"but this is a thing that happened. This was a display from the last Singapore Design Week,"
00:39:53,00:39:58,which I read about. It's all about upcycling. So they made lighting from old washing machine
00:39:58,00:40:05,"pipes. They made rugs from dog hair. And this guy called Adhi Nugraha has his team, basically,"
00:40:05,00:40:11,at his university has taken this dung. They remove the water. That gets rid of the smell.
00:40:11,00:40:15,They add a load of wood glue and stuff like that. And then they mould it into
00:40:15,00:40:19,"into anything you want. You can get speakers, you can get stools, you can get flower pots,"
00:40:19,00:40:27,"all sorts. It's a very cool thing. It's a good way of recycling poo. A lot of it is burned,"
00:40:27,00:40:31,"isn't it? Cow dung in India, which is really bad for the environment. I mean, cows themselves are"
00:40:31,00:40:35,"very bad for the environment. And the dung, like it's full of methane and it just burning it,"
00:40:35,00:40:40,"just a bad idea. But it can be used to coat walls. Yeah, that's another thing. Adobe, for instance."
00:40:40,00:40:47,"Yeah. Adobe. Poo and wool combined. Well, so I was reading a thing about astronaut poo and what"
00:40:47,00:40:53,"it might be used for for. Oh, yeah. And this is an exciting development. So it might be in future"
00:40:53,00:40:58,that astronauts are able to power their own spaceship using polymers from their own poo.
00:40:58,00:41:04,"So that's thrilling, as in you can send astronauts to Mars and be like, make your own way home."
00:41:05,00:41:10,"When you hear some fruit and fiber. Yeah, exactly. Six months. And the other thing is they might be"
00:41:10,00:41:15,"able to grow their own. This is a bit is a bit of a growth factor, but trying to disregard it. So"
00:41:15,00:41:24,they might be able to grow their own food from control. No one's ready. There were scientists
00:41:24,00:41:29,"at Pennsylvania in 2017. They researched this thing, a bio reactor, right? So you effectively,"
00:41:29,00:41:38,you poo in the tube and then the tube tube. That's a good name for it. That's actually going
00:41:38,00:41:43,"to make it much more palatable to people, I think. And it produces gas. It sort of gives off various"
00:41:43,00:41:50,"biological gases and that fuels a microbial goo. Oh, God, that's the worst word you've used so far."
00:41:50,00:41:56,"We were all on board until microbial goo. Be squeamish. Microbial goo, chief."
00:41:57,00:42:02,"They create a reactor and the good news, good or bad news, as I suppose it works."
00:42:02,00:42:07,"And so that. So what is the reaction? Is it power or is it, what are they getting out of it?"
00:42:07,00:42:11,"This is to produce the Vegemite like microbial goo. Oh, you're going to eat it."
00:42:11,00:42:16,"You're not, and I should stress, you're not eating anything that you have. It's completely"
00:42:16,00:42:20,"safe. You're filtering. It's like, it's all filtration. If I go to a restaurant, I don't want"
00:42:20,00:42:27,"others to go, it is completely safe. Yes, it was once your ship, but it's not anymore. People change."
00:42:27,00:42:32,"I thought as well, when you said about spearing stuff on walls, I thought that was a thing that"
00:42:32,00:42:35,they were talking about deep space exploration. Because one of the problems that you have when
00:42:35,00:42:40,you're flying further into space is that you go into these radiation bands where suddenly
00:42:40,00:42:44,you're just getting smashed by it. And if you put poo all over your walls.
00:42:44,00:42:48,"Outside of the spaceship. Oh, is it on the outside? I believe so."
00:42:48,00:42:51,"Who's doing that? I thought it was on the inside. Yeah, who's, who's"
00:42:51,00:42:54,who's going outside? You can go on a spacewalk. You can go on a spacewalk.
00:42:54,00:42:57,What is your son doing at NASA again?
00:42:57,00:43:05,"Peanuts, PDFs, actually. Just tell them Arthur, you smear shit on the outside of a spaceship,"
00:43:05,00:43:13,"and we should be proud of him. Jesus Christ. You can imagine slowly, you're sort of like 30 years"
00:43:13,00:43:17,into an intergalactic mission. You're outside your spaceship. You're smearing your laided
00:43:17,00:43:22,"batch of shit on the outside guy. They're taking the fucking piss, aren't they?"
00:43:22,00:43:26,"I should have done that drama degree, man. It's like, it's just not worth it."
00:43:26,00:43:30,"I was saying, you're the fucking muffin. Go to space, they said. See the universe, they said."
00:43:30,00:43:37,"I like the usual way it was on the inside. That was normal. You were like, yeah, yeah,"
00:43:37,00:43:41,"living in like a shit hole. Well, it makes more sense. Should we,"
00:43:41,00:43:44,"been going on a spacewalk to smear shit all over your ship? Yeah, I think it does."
00:43:45,00:43:51,"I can just imagine NASA checking in with you, Dan, a few months into the mission."
00:43:51,00:43:56,"Sorry, sorry, astronaut Shriver. We lost control and have you been..."
00:43:56,00:44:05,"Okay, send him home. Send him home. All right, astronaut Shriver, you're going to need to"
00:44:05,00:44:10,"turn your entire spaceship inside out. No, Dan, you need to poo into the tube."
00:44:12,00:44:13,"Wait, I meant to filter it before eating it?"
00:44:13,00:44:20,The video on poo tube isn't loading. I couldn't see it.
00:44:20,00:44:25,Recycling. Recycling. Recycling.
00:44:25,00:44:33,"Paper. Paper, right? Paper. Well, this is insane. Like, okay, you recycle paper. Sure."
