start_hhmmss,end_hhmmss,text
00:00:00,00:00:03,"Hi everyone, welcome to this week's episode of No Such Things as a Fish, where we were"
00:00:03,00:00:09,joined at the Soho Theatre in London by the incredible Kariad Lloyd. Now if you are a regular
00:00:09,00:00:14,"listener to No Such Things as a Fish, you will know of course who Kariad is. She's a very good"
00:00:14,00:00:19,"friend of ours, she's a comedian, she's an actor, she's a podcaster, she's just an all-round genius,"
00:00:19,00:00:24,"let's be honest. She has a book out which you definitely should check out, it's called You Are"
00:00:24,00:00:30,"Not Alone, it's about death but that sounds like it's going to be depressing but it really isn't,"
00:00:30,00:00:35,"it's extremely uplifting that book and there's loads of facts in there as well, it's definitely one"
00:00:35,00:00:41,"that I think you'll really, really enjoy. And the other thing to say is that Kariad does an"
00:00:41,00:00:47,"improvised show called Ostentatious. Now this is a really amazing show, what happens is you turn up,"
00:00:47,00:00:55,"someone in the audience gives them a hitherto lost, let's say, Jane Austen play title that they've"
00:00:55,00:01:01,"made up, the guys have never heard it before and they do an entire Jane Austen play completely"
00:01:01,00:01:06,"improvised. It is absolutely stunningly brilliant, if you haven't seen it you can't miss it, if you"
00:01:06,00:01:10,have seen it go again because it's different every single night and they are about to do
00:01:10,00:01:16,another run at London's West End at the Arts Theatre. Now the best way to find out about those
00:01:16,00:01:25,tickets is to go to ostentatiousimpro.com that's A-U-S-T-E-N-T-A-T-I-O-U-S-I-M-P-R-O.com
00:01:25,00:01:31,"but let's be honest, who types in URLs these days? Just go to a search engine, search for"
00:01:31,00:01:36,ostentatious and you will find all the information there. Anyway really hope you enjoy this week's
00:01:36,00:01:40,"show with Kariad Lloyd, all that's left to say is on with the podcast!"
00:01:40,00:02:02,"Hello and welcome to another episode of No Such Thing as a Fish, a weekly podcast this week"
00:02:02,00:02:05,coming to you live from the Soho Theatre in London!
00:02:08,00:02:13,"My name is Dan Schreiber, I am sitting here with James Harkin, Andrew Hunter Murray and"
00:02:13,00:02:20,Kariad Lloyd and once again we have gathered round the microphones with our four favourite facts
00:02:20,00:02:26,from the last seven days and in no particular order here we go starting with fact number one
00:02:26,00:02:35,and that is Andy. My fact is that the maximum PDF file you can send is bigger than Belgium.
00:02:35,00:02:43,Can we replace Belgium? Just with a PDF?
00:02:43,00:02:49,"Of Belgium, yes you can! Okay in fact it's bigger than that, okay right, the maximum"
00:02:49,00:02:56,"PDF size you can send is the square with size that are 381 kilometres long, that is bigger than"
00:02:56,00:03:02,"Belgium, Monaco, San Marino, Liechtenstein, Malta, Andorra, Luxembourg, Montenegro, Slovenia, Albania"
00:03:02,00:03:10,and Moldova combined. It is huge! It's mega! Has anyone sent something that big?
00:03:10,00:03:20,Unclear! So I worked out that if you wanted to print it out on A4 paper it would take 2.3 trillion
00:03:20,00:03:29,pieces and if I did it on my printer at home I could have started it off at the time when the
00:03:29,00:03:34,first human fossils were appearing in the fossil records and it would be just about finishing now.
00:03:34,00:03:41,"No! Subject to jams and cartridge replacements, that's brilliant, that's so good, I should say"
00:03:41,00:03:45,"where I got this from, I saw a guy called Steve Bobrick put it up on Twitter and basically"
00:03:45,00:03:55,we should say this appears to only be an adobe acrobat limit. Damn them controlling us as always!
00:03:55,00:04:02,Theoretically there could be a bigger PDF out there. So this is what in the adobe rules it says
00:04:02,00:04:06,"that this is the maximum you're allowed or something. Yeah it's the adobe acrobat, it's 15"
00:04:06,00:04:14,"million inches by 15 million inches. It's just the rules, it's not even... No it's their internal"
00:04:14,00:04:19,limit but the file format itself might not be bound by the adobe. They would probably just have
00:04:19,00:04:24,"to click and write 25 million and maybe we'd be able to get even bigger. Maybe, maybe, but I don't"
00:04:24,00:04:28,"think anyone's ever actually sent one that's this big. No, why would you? Why would he be insane?"
00:04:28,00:04:36,"Is that an email attachment or are we talking we transfer here? Oh I think that's a dropbox,"
00:04:36,00:04:48,"I don't think you can we transfer that. So PDFs, pretty dry, pretty dry. It's amazing when we send"
00:04:48,00:04:53,each other our facts round and we have to then go and research them of course and Andy sent us
00:04:53,00:04:59,the PDF and said maybe it's the most boring fact you've ever sent. Yeah and James said it's not
00:04:59,00:05:07,"even close, not even top ten. But I mean we can get on to more general stuff but I do just want to"
00:05:07,00:05:13,"say that adobe, you know adobe acrobat the program that do the PDFs is named after some mud. Named"
00:05:13,00:05:21,after some mud. Adobe it's a building material isn't it? It is. You make it half like poo and wool
00:05:21,00:05:30,I think. Here is mud. James don't attempt poo and wool and be like this is it we can make a house.
00:05:30,00:05:36,That's the worst three little pigs ever isn't it? And the fourth little pig made his house out of
00:05:36,00:05:41,poo and wool. And the wolf said I'm all right actually because you guys you stay in there it's
00:05:41,00:05:47,fine. I should just explain the mud thing sorry I want to call it a year. Because otherwise I could
00:05:47,00:05:50,feel the tension in the room. Or they were waiting they were just desperate to know. When is he going to explain about the mud?
00:05:50,00:05:58,"The founder of adobe, I'm sorry. You thought you cut to live podcast this is a conference for adobe"
00:05:58,00:06:03,and this is how they get their employees in. It's there's a creek which goes past the home
00:06:03,00:06:07,of the founder who's called John Warnock and it has this it has this mud in it it's this very malleable
00:06:07,00:06:12,clay. I did go on a little wild goose chase trying to find out who the original adobe acrobat actually
00:06:12,00:06:20,was. There wasn't one that wasn't right. That would make it an interesting story. Okay and so he named it after
00:06:20,00:06:27,the some mud some mud by the yeah exactly yeah but it's malleable but pdf's are famously inflexible
00:06:27,00:06:32,you're right completely untangible. Are you just like I'm just sending you paper like why did he
00:06:32,00:06:38,think oh yeah this clay this reminds me of mine. An acrobat's so flexible as well. Yeah everything
00:06:38,00:06:43,is completely wide open. The rules the idea that this is what they would say this is the limits
00:06:43,00:06:50,to what you have. I find it kind of funny when there are computer rules that just are just so
00:06:50,00:06:54,makeshift and and sort of seemingly why would you ever say that out loud. Apple three I don't know if
00:06:54,00:07:01,anyone is old enough to remember Apple three but so it was their third. No wait Apple three was the third.
00:07:01,00:07:11,What this is crazy. So yeah it was a it was a hard drive basically that suffered because
00:07:11,00:07:16,there was no fan on it and Steve Jobs had this thing where he just hated the sound of fans
00:07:16,00:07:22,and so he was like let's not include yeah and so it overheated all the time and when it overheated
00:07:22,00:07:26,it meant that any disk going in would suddenly just melt and so you're pulling out the hard drive
00:07:26,00:07:32,disk and so yeah so it was a big big problem and one of the employees of Apple was so angry with
00:07:32,00:07:37,it that he slammed it down out of frustration onto his desk and discovered that that made it work
00:07:37,00:07:43,again so if you called up Apple saying it does not work their official line was lift it up lift
00:07:43,00:07:48,the computer up by two inches and just drop it on the table and that's what fixed it that was the
00:07:48,00:07:52,official line that came from them. Percussive maintenance they call that don't they. What's
00:07:52,00:07:58,that. Just whacking something and hope it works. Oh yeah right yeah yeah. I don't I don't think
00:07:58,00:08:00,we've mentioned this before we might have done. Do you know what the longest a computer has been
00:08:00,00:08:05,left running is or the longest running computer ever. I haven't turned my laptop off since 2016.
00:08:05,00:08:10,Period seven years. You don't need to just rest it's asleep then it wakes up again. Yeah yeah
00:08:10,00:08:14,nothing works. Do you mean not even closing the lid. I reckon this one might not even have a lid.
00:08:14,00:08:22,Whoa. Right. James is right. I didn't and I was about to say the longest like the running computer
00:08:22,00:08:29,on earth but then I didn't say that. Clue. So it's not an earth. That's right. Great.
00:08:29,00:08:36,Is it in a spaceship. It's in a spaceship. Right. It's the Voyager ones. Voyager ones which
00:08:36,00:08:42,have been on since more than 40 years now. The 70s I guess. Yeah since the 70s. And they're still
00:08:42,00:08:47,working. They're still working. It's a pair of link computers on board Voyager which just sent
00:08:47,00:08:51,towards the edge of the solar system and it's still going. Each one has 70 kilobytes of memory.
00:08:51,00:08:55,I mean they're really tiny. Are they like 1970s computers though? They're like old school. They're
00:08:55,00:09:00,not huge. They're not room sized. They're much smaller than that. If they start working they'll
00:09:00,00:09:05,slam them into Pluto aren't they. They've got a big monitor and you have to run like CS DOS on it.
00:09:05,00:09:14,I know some things about computers. They had this really big problem in 2015 because the
00:09:14,00:09:18,last of the original programmers was a guy called Larry Zottarelli and he retired
00:09:18,00:09:23,and they were stuffed because it was like you need to learn ancient cuneiform of computer
00:09:23,00:09:28,languages. Right. To get it. To get this. Like no one is teaching these computer languages. He's
00:09:28,00:09:31,still alive. You're not dead. Just call him up. He's retired. He's old. He's retired. He doesn't
00:09:31,00:09:39,want to be. Get him to write out a handover sheet. People know. I'm sure NASA know about. He's like
00:09:39,00:09:46,no I'm done. That's it. You've had my time. It's hard. It's hard to learn the systems required. No. Okay.
00:09:46,00:09:53,Yeah. All right. There was a computer that analyzed 4000 computer science papers
00:09:53,00:09:57,and it came up with what they call the best computer scientists in the world.
00:09:57,00:10:01,They describe him as the Michael Jordan of computer science. Do you know who it is?
00:10:01,00:10:03,No. It's Michael Jordan.
00:10:03,00:10:11,Is it someone with the same name or is it the answer? Okay. The Michael Jordan of computer
00:10:11,00:10:16,science is Michael Jordan. Call your kids Michael Jordan. That's clear. It's nominative determinism.
00:10:16,00:10:21,Just Michael Jordan. That's really fun. Yeah. Yeah. Yeah. Yeah. Do they refer to Michael Jordan
00:10:21,00:10:27,as the Michael Jordan of basketball? Have you had a Fernando Corbato?
00:10:27,00:10:36,I can't tell until you pronounce it properly. I want to be the Fernando Corbato of something.
00:10:37,00:10:43,"Yeah. Well, he was. He was the Fernando Corbato of. He died in 2019. He was 93 years old and he"
00:10:43,00:10:52,"invented something we all have. Oh, and we've got loads of them. Oh, personalities. Daddy issues."
00:11:00,00:11:06,Nudge yourself closer to the topic at hand. I'll go for transistors. No? Passwords.
00:11:06,00:11:10,"Oh, did he? The man who invented the computer password. Always his mother's maiden name."
00:11:10,00:11:18,Michael Jordan. Michael Jordan. But with the numbers changed for the letters. Yeah. I think it was
00:11:18,00:11:21,the 50s that he invented it and it was because most computers worked on one thing at a time because
00:11:21,00:11:26,"they were the size of rooms and they were, you know, they had processing power but not much and"
00:11:26,00:11:30,he was trying to work out a way like a timeshare system so lots of people could work on the
00:11:30,00:11:34,"same computer different tasks, you know. And so he just reasoned that that's the best way of hiding"
00:11:34,00:11:39,your files from each other inside the computer. Wow. And I've entered that. Yeah. In 2003.
00:11:39,00:11:46,"That is, you're right. It was a sexy fact. But the thing is we don't whistle at facts anymore."
00:11:46,00:11:54,"Well, wait, I mean. It's just, it's not okay. I'm sorry. I don't want to be a downer."
00:11:54,00:12:02,"Actually, Cariad, it made me feel empowered. There's always one working against the movement."
00:12:02,00:12:10,"What can I say? In 2003, a survey found that 90% of office workers passing through Waterloo"
00:12:10,00:12:17,Station would give away their computer password in exchange for a biro. Just a biro? Not even a
00:12:17,00:12:21,"chocolate? Well, another one. Another survey in 2003 found that 70% of people would do it in exchange"
00:12:21,00:12:27,for some chocolate. 100%. 34% of people just gave their password without even needing the bribe.
00:12:27,00:12:32,So what's your password? They just told them. That's so good. That was in the past when you
00:12:32,00:12:37,"you only needed like four, right? Yeah. There's no way you can even remember them. Yeah. That's"
00:12:37,00:12:44,amazing. I got a quick story about a Microsoft laptop that there was a mystery. It kept crashing.
00:12:44,00:12:50,This is 2005. So the culprit of the problem was Janet Jackson.
00:12:50,00:12:56,Is it the real Janet Jackson? The real Janet Jackson. And it was her song Rhythm Nation.
00:12:56,00:13:04,And what it was is that the frequency of it was at such the same level of which the disk was spinning
00:13:04,00:13:09,that it would send the disk into a wobble and it would crash. And even if Rhythm Nation was playing
00:13:09,00:13:15,"from one laptop but being heard by another laptop, that would crash as well. Like Dogwist or just"
00:13:15,00:13:20,"be like, is it me? Yeah, yeah, exactly. So it was, yeah. So Janet Jackson was responsible for a"
00:13:20,00:13:25,whole software update or whatever of a Microsoft laptop. She's constantly innovating. She is.
00:13:25,00:13:33,"You, do you know the, you won't know this, but can you guess the picture? What is it? What is it?"
00:13:33,00:13:38,"We need more. We need more. That was almost a sentence, but not quite. Sorry, sorry, sorry."
00:13:38,00:13:44,"So the picture, which has the most pixels in it. So the image that has the most pixels in the world"
00:13:44,00:13:54,"has 102 terapixels. Okay. Security, security. No, no, come on now. It feels nice, doesn't it?"
00:13:54,00:13:59,"No, no, that did not feel nice. That was, that fact was just minding its own business."
00:13:59,00:14:05,"Okay, get ready to whistle. Can you guess what the picture is of? Belgium."
00:14:07,00:14:12,"Is it like Tetris, just to give you a t-shirt? Or is it like very pixelated?"
00:14:12,00:14:17,"No, it's, it's pixelated in the fact that it has a lot of pixels in it. It's not like,"
00:14:17,00:14:20,"oh, okay, okay. But basically, if you made it really small, it would be really clear. That's"
00:14:20,00:14:26,"the point. I'll say a big telescope thing like the universe. Mona Lisa. Oh gosh, no, it is the world's"
00:14:26,00:14:33,"biggest penis. Wow. Well, welcome to the whistle. This is your perfect partner. Wait, do you mean"
00:14:33,00:14:38,"it's the world's biggest picture of a penis or the world's biggest penis? Clarify, we need that."
00:14:38,00:14:43,"It's a picture of a normal sized penis, but it's the world's biggest image. And what's a normal size"
00:14:43,00:14:52,"penis? Just asking for a friend. So many issues. If they, if they made each pixel one inch. That's"
00:14:52,00:15:01,"not a normal sized penis. That also wasn't really an inch, but we'll not go into that. If you made"
00:15:01,00:15:08,"each pixel an inch, it would wrap around the earth 2.7 times this image. And if you,"
00:15:08,00:15:20,"if you are printed it out to the same specs as a billboard, it would be as tall as 16,408"
00:15:20,00:15:25,"Empire State buildings. And if you 3D printed that, you would be able to poke the International"
00:15:25,00:15:34,Space Station. And you need permission before you do that. Okay. It was invented by a former NASA
00:15:34,00:15:49,"intern who does not wish to be identified. We need to move on to our next act, guys. It is time for"
00:15:49,00:15:56,"fact number two. And that is Kariat. During the 17th century, when you died, your relatives were"
00:15:56,00:16:02,"legally forced to bury you wearing wool, whether you liked it or not. And there was for no other"
00:16:02,00:16:10,reason than to support the ailing wool industry. I love this fact. Okay. So basically there was
00:16:10,00:16:18,an act by parliament in 1666 that overnight said everybody has to be buried in wool. And it sounds
00:16:18,00:16:22,"like, oh, okay. But previously to that, nobody was buried in wool ever. Ever. That was like an"
00:16:22,00:16:28,"unusual thing to happen. You were buried in a linen shroud like Jesus in the Bible. And no coffin,"
00:16:28,00:16:32,"no coffin, right? Sometimes they did have coffins. Sometimes they had coffins. It was unusual."
00:16:32,00:16:36,But it was very unusual. You would mostly be wrapped in a shroud and just shoved in the earth.
00:16:36,00:16:42,"And because the wool industry was so important, and they were so worried about linen coming from"
00:16:42,00:16:50,"France, basically, classic fucking French linen coming over here taking our coffins. The government"
00:16:50,00:16:59,"basically said, I know. It was your GB news show coming on. Listen, the British wool. I am sweating,"
00:16:59,00:17:05,"but I am British. So many people employed in the wool industry, 12% of the population worked in"
00:17:05,00:17:10,"the wool industry. And it brought in a huge amount of money. So they said, well, we'll just make it"
00:17:10,00:17:15,"a law that you have to be buried in a wool suit in a coffin lined with wool. And if you weren't,"
00:17:15,00:17:23,"you will find five pounds, which is the equivalent of 550 pounds today. So basically,"
00:17:23,00:17:27,"initially, everyone was like, no, fuck you. Where are we going to get this from? No one has"
00:17:27,00:17:32,this. We have a history of this. And the linens they used to wrap them in would be your family
00:17:32,00:17:36,"linen. So you would have something that has been like a tablecloth, and you would keep it all night,"
00:17:36,00:17:39,and then you would sew them together. The women would sew it together and wrap everybody up.
00:17:39,00:17:45,So it's like a very nice thing. And so people weren't following the law. So then they made it
00:17:45,00:17:50,that you had to go to the keeper of the peace. Two members of your family had to sign an affidavit
00:17:50,00:17:55,"saying, we have done this, otherwise you'd be fine. So you had to go to the church and swear,"
00:17:55,00:17:59,"like based on the Bible, we buried them in wool, sorry. Yeah, there was an oath you had to read,"
00:17:59,00:18:05,"right? Yeah, a special oath, which I've got here saying, no corpse or any person, except any person"
00:18:05,00:18:11,that shall die of the plague. Fuck them. That's because they thought it lived on in the wool.
00:18:11,00:18:16,"Shall be buried in any shift sheet or shroud or anything whatsoever made or mingled with flax,"
00:18:16,00:18:22,"hemp, silk, hair, gold, or silver in any stuff or thing other than what is made of sheep's wool"
00:18:22,00:18:28,"only. That's a name how to say that. But the fine that you mentioned, the five pound fine,"
00:18:28,00:18:33,"if you grasped someone up as being buried in non-wool, then you could get half of the five"
00:18:33,00:18:40,pounds. Yeah. And this is the really clever thing. If you had buried your relative in Lennon and you
00:18:40,00:18:45,"knew that you were likely to be caught anyway, you could go and grasp up on your own relative,"
00:18:45,00:18:50,"get a half the fine, back into the family, you've only paid half the fine. Did they do that? Yeah,"
00:18:50,00:18:54,"they did. So rich people did that. So some people who like, there were certain areas where it was"
00:18:54,00:18:58,"very much didn't, they didn't approve of it. And so rich people would be like, well fuck you. Well,"
00:18:58,00:19:03,you said that like one of the rules was you couldn't bury in gold. Yeah. So I think if you're
00:19:03,00:19:09,"burying someone in gold, probably you can afford the five pounds. Yeah, yeah. Yeah. Exactly."
00:19:09,00:19:15,"So there was a study that was done between 1678 and 1707, less than one percent, and this was in"
00:19:15,00:19:20,"Henstridge. Yes. Less than one percent of burials in the churchyard were in Lennon, so following this"
00:19:20,00:19:26,"rule. But then when you went inside the church itself, it was between nine and 13 percent that"
00:19:26,00:19:32,"were then rich people in the church. Yeah, yeah, exactly. One interesting part of this is that,"
00:19:32,00:19:37,"okay, so you started to have loads more extra linen and extra cloth around because you were"
00:19:37,00:19:44,using the wool for the burials. And newspapers were made out of recycled cloth. So that's why
00:19:44,00:19:48,"you call that a rag now, because they used to use the rags, turn into newspaper and then make"
00:19:48,00:19:53,"newspapers. And so they had all of these extra bits of linen, which meant they could make more"
00:19:53,00:19:58,newspapers. And there was a huge boom of newspapers around that time. And this sort of fed into that.
00:19:59,00:20:03,"They were pleased about it. Everyone else was pissed off. And there's an amazing, have you"
00:20:03,00:20:08,"heard of Deca Mittford? And I've talked to you guys about her before. Yeah, one of the Jessica"
00:20:08,00:20:14,Mittford sisters who were like these socialite 20th century British figures who were involved in
00:20:14,00:20:18,"every single thing that happened. She went to America, she was a communist, she went to America,"
00:20:18,00:20:23,"kind of disowned her family. In the 60s, she wrote this book called An American Way of Death."
00:20:23,00:20:28,"Okay. It was like, it's very odd because she was a British socialite that had like gone to fight"
00:20:28,00:20:32,in Spain and then moved to America. Very unusual story. But the book that she wrote basically
00:20:32,00:20:37,changed the American funeral industry. Because what was happening was they were just basically
00:20:37,00:20:42,"rinsing people for money. And when someone died, they used to kind of perform plastic surgery on"
00:20:42,00:20:47,"them and then barmed them and so make them look, I mean, or she describes like basically nip and"
00:20:47,00:20:51,"tuck the tissue across the body with implants, pins and fillers to mask blemishes and swellings"
00:20:51,00:20:55,that come with age and illness before sowing the face into the most attractive and youthful
00:20:55,00:21:00,"expression possible. Sewing it. Teeth were whitened, makeup applied and the corpse was"
00:21:00,00:21:07,"dressed in its final outfit. Yes, I would like all of this. There was a special kind of bra"
00:21:07,00:21:14,designed for post-mortem form restoration. I'll pass on that. So she wrote this book exposing...
00:21:14,00:21:21,"Why is Andy in a bra? It was part of the package. She wrote this amazing book that exposed,"
00:21:21,00:21:24,basically they were they were preying on the vulnerable. So these poor people who had no
00:21:24,00:21:29,money would end up paying like thousands of dollars for what was considered like a proper funeral.
00:21:29,00:21:33,And her book was like in the bestsellers for years. David Bowie listed it as one of his favorite
00:21:33,00:21:38,"ever books, top 100 books because she changed everything. And they were putting so many chemicals"
00:21:38,00:21:42,in at that time. It was so dangerous. And that's why like funeral makers were dying of cancer from
00:21:42,00:21:48,inhaling on the formaldehyde. Grim. There's one kind of fun thing they used to do. I bought it
00:21:48,00:21:55,"down. Bring us back to the fun stuff. This is in ancient Roman funerals. You could pay an actor,"
00:21:55,00:22:00,"and a lot of people did this, you would pay an actor to dress up and wear a mask as the person"
00:22:00,00:22:07,who died. Yes. And then in the party they'd kind of mingle with everyone. Yes. Pretending that they
00:22:07,00:22:13,"were still alive and like parodying the things that they did. Oh wait, is it... I don't want to"
00:22:13,00:22:19,"be parodied, but I would love someone to be doing some of my good stuff. I'd even write some lines"
00:22:19,00:22:24,"for them to... I think that's a great idea. Andy at a funeral. I know. Some dude walking around going,"
00:22:24,00:22:30,"""Did you know the largest PDF I'm ever..."" Thank God, thank God, thank God he died."
00:22:30,00:22:38,"That's amazing. Look, wool. I'm sorry, bring me back to wool. We went after death."
00:22:38,00:22:43,Wool is an amazing material. It's like a super substance that I had no idea about. Have you
00:22:43,00:22:50,not heard of wool before now? I didn't know how good wool was basically. So it's covered in scales.
00:22:50,00:22:54,"If you look, if you zoom in, you look at it with the microscope, it's covered in scales. So liquid"
