start_hhmmss,end_hhmmss,text
00:44:33,00:44:36,"And then... If you don't, shame on you. If you don't, and then you have recycled paper."
00:44:36,00:44:39,"It's one of the easy ones. You recycle it again, right? It's one of those things that you can just"
00:44:39,00:44:45,keep recycled. It turns out that you can only recycle paper seven times. The same number of
00:44:45,00:44:53,"times you can fold it. Isn't that spooky? That is spooky. The tree knows. The tree is like, no more."
00:44:53,00:45:01,Wrap me in wool and put me in the ground. It's kind of like the sort of Doctor Who regeneration
00:45:01,00:45:05,"limit, isn't it? Can I ask you a question, though? When you recycle it, so I want to recycle this"
00:45:05,00:45:10,paper and put it in my recycling bin. How do I know if it's been recycled seven times and wasting
00:45:10,00:45:18,"more recycling? This is nice paper. It gets a bit rougher, doesn't it? It does. The rough, low quality"
00:45:18,00:45:23,pulpy paper. Cheap notebooks will be made of that. And then there are probably some industrial uses.
00:45:23,00:45:27,"If you've got a cheap notebook, what should you put in there? I'm not the only one who's stressed"
00:45:27,00:45:30,"about this, right? No, no, no. Absolutely. Because you put so much in there, then you go to the big"
00:45:30,00:45:35,"bin on the estate, right? And it's full of fucking plastic bags because no one reads the sign properly."
00:45:35,00:45:40,And is it worth me doing it? Is that whole bin? Someone contaminates the bin. I don't think we're
00:45:40,00:45:45,"saying don't recycle. I think I... No, but if you do... No, no, Karen, Karen, I've got to really"
00:45:45,00:45:50,"bite down on this. No, you should do it. And I do it, but it's frustrating. I know, I know. You have to"
00:45:50,00:45:58,"be careful what you recycle. When turbine blades, they were out sometimes, and they're really difficult"
00:45:58,00:46:03,"to recycle, because they're made of lots of different polymers and stuff. Controversial? Yeah,"
00:46:03,00:46:08,"they've got a new one, a new kind of material that they might use for turbine blades,"
00:46:08,00:46:13,"and you can recycle it by eating it. Oh, wow. You just get some microbial goo,"
00:46:13,00:46:20,"and then you spread it on top. And so what's it made of? It's made of fibreglass, but as well as"
00:46:20,00:46:25,"fibreglass, it's got some plant-derived polymers, it's got some synthetic polymers in, and once"
00:46:25,00:46:29,"it's been working for ages and you need to replace it, you can kind of dissolve it and all the"
00:46:29,00:46:36,"constituent parts separate, and you can reuse all those different bits. And the plant-based ones,"
00:46:36,00:46:43,"you can turn into gummy bears. And the guy who invented it has made a wind turbine, then dissolved"
00:46:43,00:46:47,"it, turned it into a gummy bear and eaten those gummy bears. I mean, I like gummy bears already."
00:46:47,00:46:52,"If I find out that I'm eating gummy bears, which are made from renewable energy turbines, I'm"
00:46:52,00:46:58,going to be over the fucking moon. That is so good. One thing that can be recycled that has been a bit
00:46:58,00:47:04,of a bane of the recycling industry for a while is nappies. Because sometimes they contain lots
00:47:04,00:47:07,"of different components, and it can be hard to separate them. This is a really good study from"
00:47:07,00:47:11,"this year. It's researchers from Indonesia. Actually, just whether your original fact is from"
00:47:11,00:47:17,"James, and it's researchers have found a way of taking nappies, used nappies, washing, drying,"
00:47:17,00:47:22,"sterilizing, shredding them, and then putting them into concrete and mortar. And they have"
00:47:22,00:47:29,successfully built a home that is 10% old nappies. Wow. And it's completely sterile. It's
00:47:29,00:47:35,"completely... And it can use two cubic meters of used nappies, one single-story home, without any"
00:47:35,00:47:40,weakness of structural integrity or anything like that. And it's completely safe. It uses up a load.
00:47:40,00:47:46,"I think that is about the amount a baby gets through in a year or two. No, my baby. We could"
00:47:46,00:47:52,"build half a Milton Key, isn't it? So that's just a trial so far. That's amazing. Even in the UK,"
00:47:52,00:47:59,"half of the Welsh A487 road is made of 100,000 nappies. Amazing. And they would just recycle it."
00:47:59,00:48:03,"I know, plastic pellets that are then part of the road material, and then he tarmac over the top."
00:48:03,00:48:06,"So when we were talking about the three little pigs earlier blowing down a shithouse,"
00:48:06,00:48:11,"that actually could be a reality in the future. We're going to have to wrap up, and it's that,"
00:48:11,00:48:20,"guys. We are at the end of the party. Yeah, so sorry. It's time. It's time. Yeah. Anything before we do?"
00:48:20,00:48:27,You can recycle rare earth metals using fish sperm. We're done. We're done. No one can tell
00:48:27,00:48:32,"me that's it. Is that the stuff you get those in your phone, don't you? The rare earth metal, yeah."
00:48:34,00:48:41,"This is a thing. You know, ""milt"" is the technical name for fish sperm, basically. So scientists use"
00:48:41,00:48:46,"some, again, it's at the experimental stage, it's not widely used. But they made a powder out of"
00:48:46,00:48:52,"some salmon milk, because that is like largely composed of DNA, which largely is made up of"
00:48:52,00:48:57,"phosphate, right? And that is, it's charged in a way that it attracts rare earth metals to it."
00:48:57,00:49:00,"Cool. So if you put it in a solution with some rare earth metals, because they obviously they're"
00:49:00,00:49:06,"very important to recycle, and you want to recycle as much as you can, keep it in the system going"
00:49:06,00:49:10,"around, and if you put it in a solution with some salmon sperm, then it can be extracted. How much"
00:49:10,00:49:15,"sperm do you need? Like, are we going to have to farm fish and make them ejaculate millions of times?"
00:49:15,00:49:18,"I think that is the problem of scale in this. You're absolutely right, because it's like a"
00:49:18,00:49:23,"salmon is quite small, and it is a waste product for the fish industry, but it's not. Not if you're"
00:49:23,00:49:29,"a Mrs. salmon. How are you getting the milk? Like, how do you collect milk? I'm just asking for a"
00:49:29,00:49:32,friend. I don't know. The milk man just comes round.
00:49:32,00:49:45,"Okay, that's it. That is all of our facts. Thank you so much for listening. If you'd like to get"
00:49:45,00:49:49,"in contact with any of us about things we have said over the course of this podcast, we can be"
00:49:49,00:49:54,found on our Twitter accounts. I'm on Shriverland. James. At James Harkin. Andy. At Andrew Hunter M.
00:49:54,00:50:00,"Cariad. At Cariad Lloyd on Instagram. And you can also get us on our group account on Twitter,"
00:50:00,00:50:04,which is @NoSuchThing. Go to our website as well. NoSuchThing is at fish.com. All of our previous
00:50:04,00:50:08,"episodes are up there. And you can also join Club Fish. We've got any Club Fish members. And yeah,"
00:50:08,00:50:16,"very nice. Very cool. It's a secret society for dorks. And it's awesome. So do join that. Otherwise,"
00:50:16,00:50:20,"join us again next week for another episode. We'll see you then. Thank you so much, Soho Theatre."
00:50:20,00:50:30,That was awesome. Goodbye!
00:50:30,00:50:38,[BLANK_AUDIO]
