start_hhmmss,end_hhmmss,text
00:00:00,00:00:02,(Bell)
00:00:02,00:00:04,(Bell)
00:00:04,00:00:06,(Bell)
00:00:06,00:00:08,(Bell)
00:00:08,00:00:10,(Bell)
00:00:10,00:00:12,(Bell)
00:00:12,00:00:20,Hello and welcome to another episode of no such thing as a fish a weekly podcast coming to you from the QI offices in Covenant Garden.
00:00:20,00:00:26,"My name is Dan Schreiber. I am sitting here with James Harkin, Anacizanski and Alex Bell and once again..."
00:00:26,00:00:28,(Bell)
00:00:28,00:00:30,(Bell)
00:00:30,00:00:32,(Bell)
00:00:32,00:00:34,(Bell)
00:00:34,00:00:36,I don't recognize that name.
00:00:36,00:00:46,And Andy Murray and once again we have gathered around the microphones with our four favorite facts from the last seven days and in a particular order here we go.
00:00:46,00:00:48,"Starting with you, James Harkin."
00:00:48,00:00:54,My fact this week is that Neanderthals wore capes.
00:00:54,00:00:56,Did they only wear capes?
00:00:56,00:01:00,I think they kind of did and it seems like...
00:01:00,00:01:02,Is that a good look? Is that a sexy look?
00:01:02,00:01:04,I'm just trying to picture an extra obscene if you're only wearing a cape I think.
00:01:04,00:01:06,Do you think worse than nudity?
00:01:06,00:01:08,I think it's worse than nudity.
00:01:08,00:01:10,It's worse than being naked with just socks on.
00:01:10,00:01:12,That's what it is. That looks terrible.
00:01:12,00:01:14,Having one item is always just a bit embarrassing.
00:01:14,00:01:20,"Absolutely. No, a cape's quite a good look because you can wrap it around yourself and then do the big reveal."
00:01:20,00:01:22,"So Neanderthals, they were capes?"
00:01:22,00:01:24,They did.
00:01:24,00:01:28,Compared to early humans who wore like more like parkers or hoodies.
00:01:28,00:01:34,So the thing is they found by looking at animal remains in early human settlements and the under fell settlements.
00:01:34,00:01:40,And they found that the Neanderthals didn't really have the ability to make more complex clothing like the humans could.
00:01:40,00:01:46,"All they could really do is get an animal skin and just wrap it around the neck like a cape,"
00:01:46,00:01:48,whereas the humans could kind of make more proper clothing.
00:01:48,00:01:56,And they reckon that this may be one of the reasons why the Neanderthals died out when the humans proliferated.
00:01:56,00:02:00,Kind of ironic that they don't superhero gear in order to wipe themselves out.
00:02:00,00:02:02,What a bunch of ideas.
00:02:02,00:02:08,I read a thing about superhero capes and it was a physicist who had done an analysis on Batman's cape.
00:02:08,00:02:16,"He worked out that if, as in the film, he used the cape to help slow himself down, he would still have hit the building he was landing on at 50 miles an hour, which would have immediately killed him."
00:02:16,00:02:22,"I don't think, I mean, I think we're assuming we watched that, that there's some magical force holding him up as well as just the sheer force of his cape."
00:02:22,00:02:26,"But he is just a bloke, let's not forget Batman is a bloke."
00:02:26,00:02:30,"He's not like Superman with superpowers, he's just a guy with tons of money."
00:02:30,00:02:33,"Oh, I kind of thought he had a little bit of extra magic power as well."
00:02:33,00:02:38,His soul superpower is material wealth.
00:02:38,00:02:48,"Just, I thought the really interesting thing about this new research that's been done was the idea that early humans, the real superheroes of this story, had fur trim hoodies,"
00:02:48,00:02:56,it's thought fur trim coats because what the researchers found is that certain animals were found at human sites that weren't found at Neanderthal sites.
00:02:56,00:03:06,So I think there were animals like weasels and wolverines that were found on the human sites and they have like short hairs and they're the kind of hair that you'd use to make fur trim.
00:03:06,00:03:12,"So they've got this whole mixture of fur and if it's added to sleeves and the hoods of clothes, then it insulates you better."
00:03:12,00:03:16,"How are they, how are they sewing or putting stuff together?"
00:03:16,00:03:21,"Well, do you know that the oldest sewing needle was found around this time around 40,000 years ago?"
00:03:21,00:03:32,"Really? Actually, it was found more recently. Sorry, it was found 40,000 years ago but immediately dropped again."
00:03:32,00:03:43,"But weirdly, it wasn't early humans or Neanderthals, it was Denisovians who were a third group of hominids who kind of lived around the same time."
00:03:43,00:03:46,"Were we, were we the most clever of the bunch at that period?"
00:03:46,00:03:57,They definitely have bigger brains than we did. Well they have bigger brains Neanderthals but there is a theory that because they have bigger bodies as well and they had larger eyes too so they had extremely good vision.
00:03:57,00:04:04,But there's a theory that more of their brain would have had to be given over to their visual cortex and to controlling their body as well.
00:04:04,00:04:11,So they were great at kind of gymnastics or seeing things from a long distance but the Neanderthal Olympics were brilliant.
00:04:11,00:04:16,And all the audience were five miles away as well. But on the other hand they couldn't do Rubik's cubes.
00:04:16,00:04:23,And obviously that really got humans through the eyesight when it was very boring and it had to have entertainment.
00:04:23,00:04:36,"Yeah, I think scientists have come forward in the last year slightly, not debunking but saying there's no actual evidence to show the increased focus on your brain on eyesight or body size would mean that you had a less good higher cortex but it's certainly a theory."
00:04:36,00:04:50,"That's the thing, it just changes all the time. Probably everything we're saying right now is just going to be this particularly with Neanderthals every day there's a new story that says, oh they were killed by bunnies or they loved."
00:04:50,00:04:52,"Have you not heard that theory? No, no."
00:04:52,00:04:54,Oh they were killed by rabbits. All of them. No.
00:04:54,00:05:06,"Yes, to do with the fact that they couldn't, I think I'm gaining this in the sort of area of right, their main source of food also became the main source of food that rabbits were eating and rabbits were eating all the food."
00:05:06,00:05:10,"And so they just ran out of food effectively. So rabbits kind of took, I don't know."
00:05:10,00:05:17,"Well, here's a thing, if you try to live off rabbits your whole life you wouldn't be able to because they don't contain nearly enough nutrients."
00:05:17,00:05:24,Unless they've eaten all of your other food and so they contain all the food groups now inside of their bodies. Is this an all you can eat rabbit situation?
00:05:24,00:05:28,"Yeah, if the only thing you could ever eat was rabbits you would die. No."
00:05:28,00:05:35,And you die quite quickly as well. I'm not sure exactly what it is that you're missing. I think it's a famous kind of thought experiment about rabbits in particular.
00:05:35,00:05:40,Really? I'm lots of other things presumably or the only ones trying to screw us in.
00:05:40,00:05:49,"Yeah, you could probably live just off Guinness. Yeah, okay. They always say that. They always say that. They say like two points of Guinness and three Mars bars will get you through the rest of your life."
00:05:49,00:05:52,But it doesn't sound as Irish people.
00:05:52,00:05:58,"Did you know, because people always used to say, oh, drinking a Guinness is the same as having seven roast dinners or something."
00:05:58,00:06:04,That there's the same number of calories in a pint of tenants or a pint of fosters. Is there isn't a pint of Guinness?
00:06:04,00:06:11,"I always thought there was way more in Guinness. Yeah, it feels like the small when you drink it, doesn't it? Yeah, it does. Does it?"
00:06:11,00:06:17,"Yes, I don't know. You had a full pint of beer for your birthday the other day, didn't you? Yeah, fruit beer, you know."
00:06:17,00:06:24,I really like this clothing thing because it's sort of interesting in the knock-on effects that things have.
00:06:24,00:06:35,"So if Neanderthals only had capes, as we're saying. Then they might have only been able to hunt during the very warmest bits of the day."
00:06:35,00:06:41,So that limits your hunting range time wise. It means you can't hunt in the morning or the evening. Or it might have stopped them foraging further north.
00:06:41,00:06:46,"Whereas if you've got humans in sort of parker like fur things they can hunt further north, that extends the range."
00:06:46,00:06:51,"Or in that part of Europe, ambush is quite a good means of killing prey."
00:06:51,00:06:58,"Because you use the landscape and you wait for animals to come along and then you jump out and kill them, rather than chasing them as early humans did in Africa for example."
00:06:58,00:07:03,"So if you're just lying down in a cape all day, you can't do it, you'll freeze."
00:07:03,00:07:07,Do you remember the book that came out called The Singing Neanderthals? Yes.
00:07:07,00:07:17,"Yeah, so this is a professor from Reading University called Stephen Mithin and he believes that they sung a lot and they like to dance, dance and clap."
00:07:17,00:07:23,"And they used to do in their caves together, they used to sing in groups. I have read that book quite a few years ago."
00:07:23,00:07:28,And I think is it not also that he thinks that language came originally from singing? Yes.
00:07:28,00:07:35,So people would just kind of sing and get rhythm and then that rhythm and noise would turn into meanings and then that meaning would turn into language.
00:07:35,00:07:37,"I think that's what you do. Yeah, yeah."
00:07:37,00:07:43,"So for that reason as well, the language part, he says that he thinks that they would particularly have liked rap music."
00:07:43,00:07:49,And he says I can see them rapping in my mind. He thinks a lot of stuff this guy.
00:07:49,00:07:57,And the other little males had one massive arm and one puny one. Like Nadal. Like Nadal. Exactly like Nadal.
00:07:57,00:08:05,"Athletes, cricket and tennis players in particular have upper arm bones which are much stronger in their dominant arm."
00:08:05,00:08:15,"So all of us here, dominant arm will be between 5 and 14% bigger. This is the arm bone, the upper arm bone, bigger than on the other side."
00:08:15,00:08:21,"In the underfalls, the upper arm bone is 50% bigger than on the other side."
00:08:21,00:08:25,And this is only the case in cricket and tennis players in modern humans today.
00:08:25,00:08:31,"So when you say Nadal, it's absolutely right. And they thought that this was because they were doing spear thrusting to hunt animals."
00:08:31,00:08:37,But actually they got modern humans to sort of practice thrusting spear and measured how much energy it used.
00:08:37,00:08:49,"And actually that uses the non dominant arm loads too. So they reckon that what it is is processing animal hides, i.e. scraping laboriously away at the inside of animal skins to make them suitable for wearing your capes."
00:08:49,00:08:55,And we don't know if female Neanderthals have the same thing because we haven't found female Neanderthals skeletons where both arms are present.
00:08:55,00:09:03,"Do we know that female Neanderthals had two arms? No we don't, no. It might be a reason why they died out."
00:09:03,00:09:16,"Just one thing on capes, that capes were quite big in the Aztec world. And Montezuma particularly was into them in that every year he collected a tribute from his people of 2500 and 160 of them."
00:09:16,00:09:25,The word escape comes from the word cape. Does it? It's like when someone grabs your cape but you could run away because you kind of leave them with the cape.
00:09:25,00:09:28,And you're just naked if you're in the Aztec world.
00:09:28,00:09:39,"That's actually according to the etymological dictionary of the English language to escape is to ex-cape oneself, to slip out of your cape and run away."
00:09:39,00:09:48,"Isn't that great? Was there any famous villains that were known for that? Like I mean like Jack the Reverend, we've got his cape, you know, was there any?"
00:09:48,00:09:52,Like just with the cape done by poppers at the front or something that they just whip off and lose.
00:09:52,00:09:56,Well just if that's Jack the stripper you're thinking.
00:09:56,00:10:06,But another kind of cape in the Aztec world that only Aztec rulers were allowed to wear was the hummingbird cape and so hummingbirds were sort of revered by Aztecs.
00:10:06,00:10:12,Because I think of their tenacity and the fact that they'd attack things that were bigger than them and they wouldn't rest until they'd got what they wanted.
00:10:12,00:10:16,And so Aztec kings could wear capes made entirely of hummingbird feathers.
00:10:16,00:10:18,I think I've seen one of those.
00:10:18,00:10:20,"Yeah, they're pretty spectacular."
00:10:20,00:10:23,I think there might be one in a museum in Hawaii or something.
00:10:23,00:10:24,Oh really?
00:10:24,00:10:28,Like really yellow amazing kind of feathery.
00:10:28,00:10:29,Wow.
00:10:29,00:10:35,I think the only bird that can fly backwards.
00:10:35,00:10:38,"But yeah, one cape would take 8,000 hummingbirds."
00:10:38,00:10:41,How impressive to catch though that many though it is.
00:10:41,00:10:47,You probably sneak up on them from the front.
00:10:47,00:10:58,Elvis Presley famously used to wear a cape in the later years and the very first time that they had the idea for the cape because the idea was that it was going to be used to reveal himself not in that way.
00:10:58,00:11:00,On stage to the audience.
00:11:00,00:11:02,It was a great way of hiding himself before you could see him.
00:11:02,00:11:04,Because you could still see the cape obviously.
00:11:04,00:11:06,"Yeah, I guess but you're like, who's buying the cape?"
00:11:06,00:11:07,"I mean, who's buying the cape?"
00:11:07,00:11:11,"I don't know, they're at a Presley game."
00:11:11,00:11:12,All right.
00:11:12,00:11:13,Figures is that with the cape.
00:11:13,00:11:17,So he commissioned it from this guy who was in another bit of America.
00:11:17,00:11:21,And so they made the cape and they sent it over on a plane and Elvis put it on.
00:11:21,00:11:27,And it was so heavy that as he walked forward he immediately got dragged back by the weight of it and crashed backwards onto the ground.
00:11:27,00:11:28,Wow.
00:11:28,00:11:31,Who did that in the VMAs last year or something?
00:11:31,00:11:32,Was it Madonna?
00:11:32,00:11:34,I think she just fell down forward.
00:11:34,00:11:36,Did she not get dragged off by a cape?
00:11:36,00:11:37,She did.
00:11:37,00:11:38,Someone stepped on the back of her cape.
00:11:38,00:11:39,Maybe it was just a tribute to Elvis.
00:11:39,00:11:40,No one got it.
00:11:40,00:11:45,Someone else who had a massive cape on stage was Liberacci.
00:11:45,00:11:46,"Oh, yeah."
00:11:46,00:11:47,Famously.
00:11:47,00:11:49,One time had such a massive cape.
00:11:49,00:11:53,He was brought on stage in a custom made Rolls-Rice.
00:11:53,00:11:58,"And then he took off his cape, which was then taken off stage by a small Rolls-Rice."
00:11:58,00:11:59,Wow.
00:11:59,00:12:00,That was fantastic.
00:12:00,00:12:01,That's ridiculous.
00:12:01,00:12:06,I was looking at Sherlock Holmes because he wore a cape.
00:12:06,00:12:07,"Yes, he didn't."
00:12:07,00:12:08,Described as a cape.
00:12:08,00:12:11,And he was illustrated wearing a very sort of famous cape.
00:12:11,00:12:13,I think it became famous because he'd worn it.
00:12:13,00:12:17,I don't think it was a famous cape that Sherlock had been adopted.
00:12:17,00:12:20,Who was this weird bloke inside my paper cape?
00:12:20,00:12:24,"Sorry, you're absolutely right."
00:12:24,00:12:26,He popularized that cape.
00:12:26,00:12:31,There was something really bizarre about the story.
00:12:31,00:12:35,The man who was commissioned to draw the stories ended up not drawing them.
00:12:35,00:12:39,His brother sort of got the gig somehow instead.
00:12:39,00:12:43,But then he drew the man who'd originally been commissioned to draw the cape
00:12:43,00:12:48,"was then the model for the cape, which his brother then ended up drawing for the stories."
00:12:48,00:12:49,Was that a consolation prize thing?
00:12:49,00:12:50,Kind of.
00:12:50,00:12:52,"His brother was like, oh, sorry, I didn't get the gig."
00:12:52,00:12:53,He's really weird.
00:12:53,00:12:56,He's Victorian because there was a coat with a cape built into it.
00:12:56,00:12:57,Yes.
00:12:57,00:12:58,I don't really understand it.
00:12:58,00:13:00,Is it just to protect you against rain?
00:13:00,00:13:01,Just fashion.
00:13:01,00:13:02,Yeah.
00:13:02,00:13:03,Must have been fashion.
00:13:03,00:13:08,"Yeah, because I, I, exactly, I was trying to work out was there a purpose to Darth Vader's cape."
00:13:08,00:13:10,"And a lot of people, because he's in space."
00:13:10,00:13:11,What's he doing with the cape?
00:13:11,00:13:13,There's a lot of anti-gravity going on.
00:13:13,00:13:15,That's not a useful garment to have.
00:13:15,00:13:21,A lot of people say that it was because of his authority and that a cape would suggest a military kind of authority for some reason.
00:13:21,00:13:24,"But then I, I don't really know much about Star Wars."
00:13:24,00:13:25,Wars.
00:13:25,00:13:30,But it doesn't seem like they have a lot of problem with anti-gravity at any stage.
00:13:30,00:13:32,"Which is interesting, isn't it?"
00:13:32,00:13:37,The one scene where I think you should see that is when he's flying when Vader's in his own ship.
00:13:37,00:13:41,"Because I imagine that's where anti-gravity kicks in, but he must be sitting on the cape."
00:13:41,00:13:43,"That's what I thought, because you don't see it in short."
00:13:43,00:13:45,"You're right, because they must have thought this through."
00:13:45,00:13:51,"Well, they have, because look, there's a description on Wikipedia about entire outfits."
00:13:51,00:13:58,"So the outer cape was made so that it could block fire and acid jets, helping to protect the suit's electronics."
00:13:58,00:14:01,Because remember Darth Vader was part robot.
00:14:01,00:14:04,"Yeah, but the cape was so heavy, you get this."
00:14:04,00:14:07,The cape was so heavy that it restricted movement.
00:14:07,00:14:11,"So he had difficulty lifting his arms over his head, which is why you rarely see that in the movies."
00:14:11,00:14:12,Really?
00:14:12,00:14:15,I can't really see a scene where that would have fitted in.
00:14:15,00:14:17,It's what he does the while.
00:14:17,00:14:21,It's what he does at that football match of the Mexican wave comes around this way.
00:14:21,00:14:30,"Okay, it is time for fact number two, and that is Chazinski."
00:14:30,00:14:34,"My fact this week is that when the first ballpoint pen was launched in the US,"
00:14:34,00:14:39,Riot police had to be deployed to restrain the crowds.
00:14:39,00:14:42,It was the new iPhone of its day.
00:14:42,00:14:48,"This was in 1945, and I actually read about this in a book I've just bought called Adventures in Stationary by James Ward."
00:14:48,00:14:53,And this ballpoint pen was brought to America by a guy called Milton Reynolds.
00:14:53,00:15:00,"It was 29th of October 1945, and he launched it in a department store called Gimbals in New York."
00:15:00,00:15:02,And thousands of people came.
00:15:02,00:15:05,"So I think 5,000 people swarmed Gimbals department store."
00:15:05,00:15:10,"And 50 extra policemen had to be deployed as an emergency at the last minute, because it was being swarmed so much."
00:15:10,00:15:16,"So they cost the equivalent of $160 now, which is a lot, but still they sold, you know, they'd sold millions."
00:15:16,00:15:21,"Absolutely, they weren't the really crummy cheap buyers that you were paying $160 for."
00:15:21,00:15:25,"Well, even, I mean, that was a time of some hardship across the world, right?"
00:15:25,00:15:28,"Well, what he was thinking, actually, you say it's of some hardship."
00:15:28,00:15:33,"A, they didn't work because he rushed them through, but B, I think he was thinking it's the end of the war."
00:15:33,00:15:36,I need to launch it now. People want a treat.
00:15:36,00:15:40,"Well, that wall was terrible, but at least we've got a barrier."
00:15:40,00:15:44,It's almost worth having another wall.
00:15:44,00:15:46,"It was called the Reynolds rocket, though."
00:15:46,00:15:49,So there was a little bit of militarization going on over there.
00:15:49,00:15:54,He actually took out an ad in the New York Times to promote a full page ad.
00:15:54,00:15:56,That's how big they were promoting the thing.
00:15:56,00:16:02,"And in it, he said that it was fantastic, miraculous pen, guaranteed to write for two years without refilling."
00:16:02,00:16:05,"Yeah, and you got your money back if it didn't."
00:16:05,00:16:07,"And a lot of people did, didn't they?"
00:16:07,00:16:08,"Yeah, loads of people, yeah."
00:16:08,00:16:14,"There's 104,643 had to be replaced in the first eight months."
00:16:14,00:16:16,"So I think, yeah, had massive problems."
00:16:16,00:16:19,It was really leaky or it was stopped writing altogether.
00:16:19,00:16:21,It just wasn't a very good design.
00:16:21,00:16:24,And the reason was because he was a very competitive businessman.
00:16:24,00:16:29,"So there was this, this chap called Lazlo Byro, who a few years beforehand had invented the Byro in Europe."
00:16:29,00:16:34,And he brought it to Argentina and word had reached America and this guy Milton Reynolds of the Byro.
00:16:34,00:16:39,"And he really wanted to patent the design, which was just this round tip in this capillary action,"
00:16:39,00:16:43,which meant that you could write in all directions and the ink wouldn't bleed out the page.
00:16:43,00:16:47,"Anyway, he tried to buy the patent for the design and it had already been sold."
00:16:47,00:16:52,"And so he was so pissed off, he decided to rush through his own design before Byro could get his out."
00:16:52,00:16:57,"So he knew that Byro in 1945, which was now run by a company called Evershard, I think."
00:16:57,00:17:02,He knew that they were about to rush a design out and so he put his out prematurely.
00:17:02,00:17:04,But the thing was that his didn't use capillary action.
00:17:04,00:17:05,No.
00:17:05,00:17:06,His relied on gravity.
00:17:06,00:17:09,So Darth Vader wouldn't have been able to use it for instance.
00:17:09,00:17:10,Indeed.
00:17:10,00:17:12,That's why you never saw him signing papers.
00:17:12,00:17:15,"Actually, there is a theory which Andy was just pointing."
00:17:15,00:17:16,So I vet he was about to say this.
00:17:16,00:17:17,Yeah.
00:17:17,00:17:19,But there is no writing in the whole Star Wars universe.
00:17:19,00:17:21,Fear it's a post literary universe.
00:17:21,00:17:25,"You just see people pointing at, you know, pressing buttons with little symbols on them."
00:17:25,00:17:26,Right.
00:17:26,00:17:28,So there are some scrolls at the Jedi's.
00:17:28,00:17:31,You can see it in the background occasionally that there's a scroll there.
00:17:31,00:17:33,But whether they have writing on we don't know.
00:17:33,00:17:36,But also you can see in this is getting too geeky now.
00:17:36,00:17:40,"But you can see in Raiders of the Lost Ark, there are symbols of R2D2 and C3PO."
00:17:40,00:17:45,So they've now put that in a suggested LucasArts timeline of the universe.
00:17:45,00:17:52,"So long time ago in the galaxy far, far away was remembered close enough on Earth that they knew about 3PO and R2D2."
00:17:52,00:17:55,So it's not that long ago.
00:17:55,00:18:01,"So when you said this is too geeky, I was about to say, no, it can't be too geeky for this show."
00:18:01,00:18:04,You've managed to do it.
00:18:04,00:18:09,"So the first, one of the first big orders for Byres was by the RAF."
00:18:09,00:18:11,Actually during the Second World War.
00:18:11,00:18:16,"So this was by the Lazlo Biro, inventor himself."
00:18:16,00:18:17,Which is called Biro.
00:18:17,00:18:19,I think it's originally pronounced Biro.
00:18:19,00:18:20,We've been saying it wrong all these years.
00:18:20,00:18:22,It's probably Lazlo as well as Lazlo Biro.
00:18:22,00:18:24,I think it's Biro.
00:18:24,00:18:25,Probably. He was Hungarian.
00:18:25,00:18:27,"Well, he was born in Budapest."
00:18:27,00:18:28,Right. He was Hungarian.
00:18:28,00:18:29,And then he moved to Argentina.
00:18:29,00:18:32,"So this is a really weird thing, but also about the way he invented it."
00:18:32,00:18:36,"I mean, he had to flee the Nazis and he went to Argentina."
00:18:36,00:18:42,Partly because he'd had a chance encounter on a beach with a fellow holiday maker and told him about this great invention.
00:18:42,00:18:45,"He had a fellow holiday maker said, oh, well, I'm the president of Argentina."
00:18:45,00:18:48,So do you want to come and set up in my country?
00:18:48,00:18:50,"And he said, thank you very much, I will."
00:18:50,00:18:51,It's not amazing. It's extraordinary.
00:18:51,00:18:55,"Yeah, they're on the beach and they're happy to be chatting to the Argentinian president."
00:18:55,00:18:56,Yeah.
00:18:56,00:18:57,He was the former president.
00:18:57,00:18:58,"Oh, well, yeah."
00:18:58,00:19:02,"But then really tragically, Biro never made much money from it."
00:19:02,00:19:05,Because he had sold the patent to it very early on in the process.
00:19:05,00:19:08,"Because partly, I think to get more of his family out of Europe."
00:19:08,00:19:11,I think his last shares were sold to get his family to Argentina.
00:19:11,00:19:12,Yeah.
00:19:12,00:19:15,"I really love the sound of this guy, Biro."
00:19:15,00:19:21,"Because apparently before he invented the Biro, he was a hypnotist, a race car driver and a surrealist painter."
00:19:21,00:19:22,Wow.
00:19:22,00:19:24,That's awesome.
